"S1699-65852011000100005-esp","Revisión bibliográfica de Implantología Bucofacial del año 2009: 1ª parte","Sánchez Garcés, M.A., Alvira González, J., Aznar Arasa, L.L., Esquembri Bescós, N., Ferriol Fiol, N., López Ramírez, M., Mir Marí, J., Vargas Espinosa, M.L., Gay Escoda, C.","Avances en Periodoncia e Implantología Oral; 23(1); 49-73","Avances en Periodoncia e Implantología Oral","Espanhol","2011","http://scielo.isciii.es/scielo.php?script=sci_arttext&pid=S1699-65852011000100005&lang=pt" 
"S0325-00752011000200001-arg","Participación de los médicos asistenciales en las deficiencias sanitarias y en el cuidado de la salud en nuestro país","Ceriani Cernadas, José M","Archivos argentinos de pediatría; 109(2); 98-99","Archivos argentinos de pediatría","Espanhol","2011","http://www.scielo.org.ar/scielo.php?script=sci_arttext&pid=S0325-00752011000200001&lang=pt" 
"S0325-00752011000200002-arg","Estrategias para la formación y desarrollo de equipos de investigación exitosos","Cuestas, Eduardo","Archivos argentinos de pediatría; 109(2); 100-102","Archivos argentinos de pediatría","Espanhol","2011","http://www.scielo.org.ar/scielo.php?script=sci_arttext&pid=S0325-00752011000200002&lang=pt" 
"S0325-00752011000200003-arg","Evaluación de la opinión del equipo de salud y padres sobre la identificación de los pacientes pediátricos","Dackiewicz, Nora, Viteritti, Laura, Fedrizzi, Valeria, Galvagno, Inés, Ferrería, Juan Carlos, Boada, Nancy, Calle, Graciela, Rousseau, Marcela, Díaz, Juan, Enriquez, Elizabeth, Villalonga, Nelly, Brulc, Ana, Pietanese, Silvia, Piano, Mónica, Marciano, Beatriz","Archivos argentinos de pediatría; 109(2); 105-110","Archivos argentinos de pediatría","Espanhol","2011","http://www.scielo.org.ar/scielo.php?script=sci_arttext&pid=S0325-00752011000200003&lang=pt" 
"S0325-00752011000200004-arg","Resultados de la Primera Encuesta Nacional de Salud Escolar: Argentina, 2007","Linetzky, Bruno, Morello, Paola, Virgolini, Mario, Ferrante, Daniel","Archivos argentinos de pediatría; 109(2); 111-116","Archivos argentinos de pediatría","Espanhol","2011","http://www.scielo.org.ar/scielo.php?script=sci_arttext&pid=S0325-00752011000200004&lang=pt" 
"S0325-00752011000200005-arg","Mortalidad infantil por anencefalia en la Argentina: Análisis espacial y temporal (1998-2007)","Bronberg, Rubén, Alfaro, Emma, Chaves, Estela, Andrade, Alberto, Gili, Juan, López Camelo, Jorge, Dipierri, José","Archivos argentinos de pediatría; 109(2); 117-123","Archivos argentinos de pediatría","Espanhol","2011","http://www.scielo.org.ar/scielo.php?script=sci_arttext&pid=S0325-00752011000200005&lang=pt" 
"S0325-00752011000200006-arg","Ventilación no invasiva en cuidado Intensivo Pediátrico, cuatro años de experiencia","Bonora, Juan Pablo, Frachia, Dardo, García, Mauro, Fillipini, Silvia, Haimovich, Aldo, Olguín, Gustavo","Archivos argentinos de pediatría; 109(2); 124-128","Archivos argentinos de pediatría","Espanhol","2011","http://www.scielo.org.ar/scielo.php?script=sci_arttext&pid=S0325-00752011000200006&lang=pt" 
"S0325-00752011000200007-arg","Síndrome de desgaste profesional en médicos pediatras: Análisis bivariado y multivariado","Pistelli, Yanina, Perochena, Jorge, Moscoloni, Nora, Tarrés, María Cristina","Archivos argentinos de pediatría; 109(2); 129-134","Archivos argentinos de pediatría","Espanhol","2011","http://www.scielo.org.ar/scielo.php?script=sci_arttext&pid=S0325-00752011000200007&lang=pt" 
"S0325-00752011000200008-arg","Trasplante intestinal en pediatría: Análisis de la primera serie de receptores en la Argentina","Trentadueª, Julio, Rumbo, Carolina, García Hervás, María Dolores, Saá, Gladys, Martínez, María Inés, Orce, Guillermo, Fernández, Adriana, Gondolesi, Gabriel","Archivos argentinos de pediatría; 109(2); 135-141","Archivos argentinos de pediatría","Espanhol","2011","http://www.scielo.org.ar/scielo.php?script=sci_arttext&pid=S0325-00752011000200008&lang=pt" 
"S0325-00752011000200009-arg","Estado actual del trasplante de células hepáticas en Pediatría: State of the art","Bologna, Anselmo A, Barbich, Mariana R, D&#039;Agostino, Daniel, Argibay, Pablo F","Archivos argentinos de pediatría; 109(2); 142-149","Archivos argentinos de pediatría","Espanhol","2011","http://www.scielo.org.ar/scielo.php?script=sci_arttext&pid=S0325-00752011000200009&lang=pt" 
"S0325-00752011000200010-arg","Artritis meningocócica primaria en pediatría: Presentación de nueve casos","Sordelli, Nora, Orlando, Nancy, Neyro, Silvina, Echave, Cecilia, Procopio, Adriana, Fallo, Aurelia, López, Eduardo L","Archivos argentinos de pediatría; 109(2); 150-154","Archivos argentinos de pediatría","Espanhol","2011","http://www.scielo.org.ar/scielo.php?script=sci_arttext&pid=S0325-00752011000200010&lang=pt" 
"S0325-00752011000200011-arg","Hiperostosis cortical neonatal: Un efecto colateral de la administración prolongada de prostaglandinas E1","Fernández, Mariel A, Gebara, Enrique","Archivos argentinos de pediatría; 109(2); 154-159","Archivos argentinos de pediatría","Espanhol","2011","http://www.scielo.org.ar/scielo.php?script=sci_arttext&pid=S0325-00752011000200011&lang=pt" 
"S0325-00752011000200012-arg","Linfadenopatía tuberculosa. Diagnóstico y tratamiento: Informe de un caso","Didier Cruz Anleu, Israel, Velázquez Serratos, José Roberto, Alejandre García, Alejandro","Archivos argentinos de pediatría; 109(2); 26-29","Archivos argentinos de pediatría","Espanhol","2011","http://www.scielo.org.ar/scielo.php?script=sci_arttext&pid=S0325-00752011000200012&lang=pt" 
"S0325-00752011000200013-arg","Malformación adenomatoidea quística pulmonar: Importancia del diagnóstico prenatal","Cabeza, Beatriz, Oñoro, Gonzalo, Cantarín Extremera, Verónica, Sanz Santiago, Verónica, Sequeiros, Adolfo","Archivos argentinos de pediatría; 109(2); 30-32","Archivos argentinos de pediatría","Espanhol","2011","http://www.scielo.org.ar/scielo.php?script=sci_arttext&pid=S0325-00752011000200013&lang=pt" 
"S0325-00752011000200014-arg","Taquicardia auricular focal incesante originada en la orejuela derecha: riesgo de taquicardiomiopatía. Rol de la ablación por radiofrecuencia","Femenía, Francisco, Arce, Mauricio, Arrieta, Martín, Baranchuk, Adrián","Archivos argentinos de pediatría; 109(2); 33-38","Archivos argentinos de pediatría","Espanhol","2011","http://www.scielo.org.ar/scielo.php?script=sci_arttext&pid=S0325-00752011000200014&lang=pt" 
"S0325-00752011000200015-arg","Dolor abdominal agudo como forma de presentación inicial de la enfermedad invasiva por meningococo serogrupo A","Sanz Álvarez, Débora, Blázquez Gamero, Daniel, Ruiz Contreras, Jesús","Archivos argentinos de pediatría; 109(2); 39-41","Archivos argentinos de pediatría","Espanhol","2011","http://www.scielo.org.ar/scielo.php?script=sci_arttext&pid=S0325-00752011000200015&lang=pt" 
"S0325-00752011000200016-arg","Síndrome de Sturge-Weber: Presentación de un caso con manifestaciones dermatológicas mínimas","Rodofile, Clarisa, Grees, Susana A, Valle, Lidia E, Martino, Gabriel","Archivos argentinos de pediatría; 109(2); 42-45","Archivos argentinos de pediatría","Espanhol","2011","http://www.scielo.org.ar/scielo.php?script=sci_arttext&pid=S0325-00752011000200016&lang=pt" 
"S0325-00752011000200017-arg","Colestasis neonatal transitoria","Ciocca, Mirta, Álvarez, Fernando","Archivos argentinos de pediatría; 109(2); 163-166","Archivos argentinos de pediatría","Espanhol","2011","http://www.scielo.org.ar/scielo.php?script=sci_arttext&pid=S0325-00752011000200017&lang=pt" 
"S0325-00752011000200018-arg","Resúmenes de trabajos seleccionados publicados en las revistas de las Sociedades de Pediatría del Cono Sur","","Archivos argentinos de pediatría; 109(2); 167-172","Archivos argentinos de pediatría","Espanhol","2011","http://www.scielo.org.ar/scielo.php?script=sci_arttext&pid=S0325-00752011000200018&lang=pt" 
"S0325-00752011000200019-arg","Absceso renal","Ybarra, María Eva, D&#039;Ambrosio, Lucía, Fioravanti, Alicia","Archivos argentinos de pediatría; 109(2); 173-174","Archivos argentinos de pediatría","Espanhol","2011","http://www.scielo.org.ar/scielo.php?script=sci_arttext&pid=S0325-00752011000200019&lang=pt" 
"S0325-00752011000200020-arg","Presentación del nuevo caso clínico","","Archivos argentinos de pediatría; 109(2); 174-174","Archivos argentinos de pediatría","Espanhol","2011","http://www.scielo.org.ar/scielo.php?script=sci_arttext&pid=S0325-00752011000200020&lang=pt" 
"S0325-00752011000200021-arg","Guía para el diagnóstico, seguimiento y tratamiento de la mucopolisacaridosis de tipo II (MPS-II) o Enfermedad de Hunter","","Archivos argentinos de pediatría; 109(2); 175-181","Archivos argentinos de pediatría","Espanhol","2011","http://www.scielo.org.ar/scielo.php?script=sci_arttext&pid=S0325-00752011000200021&lang=pt" 
"S0325-00752011000200022-arg","Archivos hace 75 años","","Archivos argentinos de pediatría; 109(2); 189-190","Archivos argentinos de pediatría","Espanhol","2011","http://www.scielo.org.ar/scielo.php?script=sci_arttext&pid=S0325-00752011000200022&lang=pt" 
"S0325-00752011000200023-arg","","","Archivos argentinos de pediatría; 109(2); 191-192","Archivos argentinos de pediatría","Espanhol","2011","http://www.scielo.org.ar/scielo.php?script=sci_arttext&pid=S0325-00752011000200023&lang=pt" 
"S0080-62342011000200002-scl","Avaliação de risco para úlcera por pressão em pacientes críticos","Gomes, Flávia Sampaio Latini, Bastos, Marisa Antonini Ribeiro, Matozinhos, Fernanda Penido, Temponi, Hanrieti Rotelli, Velásquez-Meléndez, Gustavo","Revista da Escola de Enfermagem da USP; 45(2); 313-318","Revista da Escola de Enfermagem da USP","Inglês, Português","2011","http://www.scielo.br/scielo.php?script=sci_arttext&pid=S0080-62342011000200002&lang=pt" 
"S0080-62342011000200004-scl","Avaliação da intensidade de dor e sinais vitais no pós-operatório de cirurgia cardíaca","Miranda, Adriana de Fátima Alencar, Silva, Lúcia de Fátima da, Caetano, Joselany Áfio, Sousa, Ana Cláudia de, Almeida, Paulo César","Revista da Escola de Enfermagem da USP; 45(2); 327-333","Revista da Escola de Enfermagem da USP","Inglês, Português","2011","http://www.scielo.br/scielo.php?script=sci_arttext&pid=S0080-62342011000200004&lang=pt" 
"S0080-62342011000200005-scl","Necessidades humanas básicas dos profissionais de enfermagem: situações de (in)satisfação no trabalho","Regis, Lorena Fagundes Ladeia Vitoria, Porto, Isaura Setenta","Revista da Escola de Enfermagem da USP; 45(2); 334-341","Revista da Escola de Enfermagem da USP","Inglês, Português","2011","http://www.scielo.br/scielo.php?script=sci_arttext&pid=S0080-62342011000200005&lang=pt" 
"S0080-62342011000200006-scl","O conhecimento dos pacientes com câncer sobre seus direitos legais","Sonobe, Helena Megumi, Buetto, Luciana Scatralhe, Zago, Márcia Maria Fontão","Revista da Escola de Enfermagem da USP; 45(2); 342-348","Revista da Escola de Enfermagem da USP","Inglês, Português","2011","http://www.scielo.br/scielo.php?script=sci_arttext&pid=S0080-62342011000200006&lang=pt" 
"S0080-62342011000200008-scl","Acessibilidade e conteúdo de informação eletrônica sobre Cursos de Especialização em Administração em Enfermagem","Meneses, Abel Silva de, Sanna, Maria Cristina","Revista da Escola de Enfermagem da USP; 45(2); 356-362","Revista da Escola de Enfermagem da USP","Inglês, Português","2011","http://www.scielo.br/scielo.php?script=sci_arttext&pid=S0080-62342011000200008&lang=pt" 
"S0080-62342011000200009-scl","Avaliação do contexto de trabalho em terapia intensiva sob o olhar da psicodinâmica do trabalho","Campos, Juliana Faria, David, Helena Scherlowski Leal","Revista da Escola de Enfermagem da USP; 45(2); 363-368","Revista da Escola de Enfermagem da USP","Inglês, Português","2011","http://www.scielo.br/scielo.php?script=sci_arttext&pid=S0080-62342011000200009&lang=pt" 
"S0080-62342011000200010-scl","Aspectos clínicos e epidemiológicos de pacientes queimados internados em um Hospital de Ensino","Montes, Samanta Flor, Barbosa, Maria Helena, Sousa Neto, Adriana Lemos de","Revista da Escola de Enfermagem da USP; 45(2); 369-373","Revista da Escola de Enfermagem da USP","Inglês, Português","2011","http://www.scielo.br/scielo.php?script=sci_arttext&pid=S0080-62342011000200010&lang=pt" 
"S0080-62342011000200011-scl","O processo de trabalho em uma Unidade de Terapia Intensiva Neonatal","Marques, Patricia de Araújo, Melo, Enirtes Caetano Prates","Revista da Escola de Enfermagem da USP; 45(2); 374-380","Revista da Escola de Enfermagem da USP","Inglês, Português","2011","http://www.scielo.br/scielo.php?script=sci_arttext&pid=S0080-62342011000200011&lang=pt" 
"S0080-62342011000200012-scl","As dificuldades da escolarização da criança com doença crônica no contexto hospitalar","Holanda, Eliane Rolim de, Collet, Neusa","Revista da Escola de Enfermagem da USP; 45(2); 381-389","Revista da Escola de Enfermagem da USP","Inglês, Português","2011","http://www.scielo.br/scielo.php?script=sci_arttext&pid=S0080-62342011000200012&lang=pt" 
"S0080-62342011000200013-scl","Abordagem existencial do cuidar em enfermagem psiquiátrica hospitalar","Furlan, Marcela Martins, Ribeiro, Cléa Regina de Oliveira","Revista da Escola de Enfermagem da USP; 45(2); 390-396","Revista da Escola de Enfermagem da USP","Inglês, Português","2011","http://www.scielo.br/scielo.php?script=sci_arttext&pid=S0080-62342011000200013&lang=pt" 
"S0080-62342011000200014-scl","Crenças religiosas, doença e morte: perspectiva da família na experiência de doença","Bousso, Regina Szylit, Poles, Kátia, Serafim, Taís de Souza, Miranda, Mariana Gonçalves de","Revista da Escola de Enfermagem da USP; 45(2); 397-403","Revista da Escola de Enfermagem da USP","Inglês, Português","2011","http://www.scielo.br/scielo.php?script=sci_arttext&pid=S0080-62342011000200014&lang=pt" 
"S0080-62342011000200015-scl","Concordância dos referenciais de crescimento propostos pelo Center of Disease Control e Organização Mundial de Saúde","Silva, Cláudia Aparecida Arcari, Pereira, Maria José Bistafa, Nakano, Ana Márcia Spanó, Gomes, Flávia Azevedo, Silva, Isilia Aparecida","Revista da Escola de Enfermagem da USP; 45(2); 404-410","Revista da Escola de Enfermagem da USP","Inglês, Português","2011","http://www.scielo.br/scielo.php?script=sci_arttext&pid=S0080-62342011000200015&lang=pt" 
"S0080-62342011000200016-scl","Hipotermia no período intra-operatório: é possível evitá-la?","Poveda, Vanessa de Brito, Galvão, Cristina Maria","Revista da Escola de Enfermagem da USP; 45(2); 411-417","Revista da Escola de Enfermagem da USP","Inglês, Português","2011","http://www.scielo.br/scielo.php?script=sci_arttext&pid=S0080-62342011000200016&lang=pt" 
"S0080-62342011000200017-scl","Saúde mental e economia solidária: a família na inclusão pelo trabalho","Filizola, Carmen Lúcia Alves, Teixeira, Iraí Maria de Campos, Milioni, Débora Brechesi, Pavarini, Sofia Cristina Iost","Revista da Escola de Enfermagem da USP; 45(2); 418-425","Revista da Escola de Enfermagem da USP","Inglês, Português","2011","http://www.scielo.br/scielo.php?script=sci_arttext&pid=S0080-62342011000200017&lang=pt" 
"S0080-62342011000200018-scl","Comunicação entre acadêmicos de enfermagem e clientes com AIDS","Lima, Ivana Cristina Vieira de, Galvão, Marli Teresinha Gimeniz, Costa, Ênia, Freitas, Julyana Gomes, Freitag, Lorita Marlena","Revista da Escola de Enfermagem da USP; 45(2); 426-432","Revista da Escola de Enfermagem da USP","Inglês, Português","2011","http://www.scielo.br/scielo.php?script=sci_arttext&pid=S0080-62342011000200018&lang=pt" 
"S0080-62342011000200019-scl","Transtorno afetivo bipolar e a ambivalência em relação à terapia medicamentosa: analisando as condições causais","Miasso, Adriana Inocenti, Cassiani, Silvia Helena De Bortoli, Pedrão, Luiz Jorge","Revista da Escola de Enfermagem da USP; 45(2); 433-441","Revista da Escola de Enfermagem da USP","Inglês, Português","2011","http://www.scielo.br/scielo.php?script=sci_arttext&pid=S0080-62342011000200019&lang=pt" 
"S0080-62342011000200020-scl","A família e o portador de transtorno mental: dinâmica e sua relação familiar","Borba, Letícia de Oliveira, Paes, Marcio Roberto, Guimarães, Andréa Noeremberg, Labronici, Liliana Maria, Maftum, Mariluci Alves","Revista da Escola de Enfermagem da USP; 45(2); 442-449","Revista da Escola de Enfermagem da USP","Inglês, Português","2011","http://www.scielo.br/scielo.php?script=sci_arttext&pid=S0080-62342011000200020&lang=pt" 
"S0080-62342011000200021-scl","Tradução e adaptação cultural para o Brasil do DISABKIDS® Atopic Dermatitis Module (ADM)","Deon, Keila Cristiane, Santos, Danielle Maria de Souza Sério dos, Reis, Roberta Alvarenga, Fegadolli, Claudia, Bullinger, Monika, Santos, Claudia Benedita dos","Revista da Escola de Enfermagem da USP; 45(2); 450-457","Revista da Escola de Enfermagem da USP","Inglês, Português","2011","http://www.scielo.br/scielo.php?script=sci_arttext&pid=S0080-62342011000200021&lang=pt" 
"S0080-62342011000200022-scl","Sentimento do portador de transtorno mental em processo de reabilitação psicossocial frente à atividade de recreação","Machado, Angelina Moda, Miasso, Adriana Inocenti, Pedrão, Luiz Jorge","Revista da Escola de Enfermagem da USP; 45(2); 458-464","Revista da Escola de Enfermagem da USP","Inglês, Português","2011","http://www.scielo.br/scielo.php?script=sci_arttext&pid=S0080-62342011000200022&lang=pt" 
"S0080-62342011000200023-scl","O brincar em sala de espera de um Ambulatório Infantil: a visão dos profissionais de saúde","Nascimento, Lucila Castanheira, Pedro, Iara Cristina da Silva, Poleti, Lívia Capelani, Borges, Ana Luiza Vilela, Pfeifer, Luzia Iara, Lima, Regina Aparecida Garcia de","Revista da Escola de Enfermagem da USP; 45(2); 465-472","Revista da Escola de Enfermagem da USP","Inglês, Português","2011","http://www.scielo.br/scielo.php?script=sci_arttext&pid=S0080-62342011000200023&lang=pt" 
"S0080-62342011000200025-scl","Revelação do diagnóstico de aids à criança na compreensão de familiares","Schaurich, Diego","Revista da Escola de Enfermagem da USP; 45(2); 480-486","Revista da Escola de Enfermagem da USP","Inglês, Português","2011","http://www.scielo.br/scielo.php?script=sci_arttext&pid=S0080-62342011000200025&lang=pt" 
"S0080-62342011000200027-scl","A produção científica de enfermagem acerca da clínica: uma revisão integrativa","Sousa, Lenice Dutra de, Lunardi Filho, Wilson Danilo, Lunardi, Valéria Lerch, Santos, Silvana Sidney Costa, Santos, Cristiano Pinto dos","Revista da Escola de Enfermagem da USP; 45(2); 494-500","Revista da Escola de Enfermagem da USP","Inglês, Português","2011","http://www.scielo.br/scielo.php?script=sci_arttext&pid=S0080-62342011000200027&lang=pt" 
"S0080-62342011000200029-scl","Prevalência e comorbidade de dor e fadiga em mulheres com câncer de mama","Lamino, Daniela de Araújo, Mota, Dálete Delalibera Correa de Faria, Pimenta, Cibele Andrucioli de Mattos","Revista da Escola de Enfermagem da USP; 45(2); 508-514","Revista da Escola de Enfermagem da USP","Inglês, Português","2011","http://www.scielo.br/scielo.php?script=sci_arttext&pid=S0080-62342011000200029&lang=pt" 
"S0080-62342011000200031-scl","Importância da assistência de enfermagem no manejo de complicação relacionada ao cateter totalmente implantável","Bruzi, Luciana Mendes, Mendes, Danielle Cabral","Revista da Escola de Enfermagem da USP; 45(2); 522-526","Revista da Escola de Enfermagem da USP","Inglês, Português","2011","http://www.scielo.br/scielo.php?script=sci_arttext&pid=S0080-62342011000200031&lang=pt" 
"S0080-62342011000200032-scl","Planejamento da alta hospitalar do paciente diabético: construção de uma proposta","Suzuki, Vanessa Ferraz, Carmona, Elenice Valentim, Lima, Maria Helena Melo","Revista da Escola de Enfermagem da USP; 45(2); 527-532","Revista da Escola de Enfermagem da USP","Inglês, Português","2011","http://www.scielo.br/scielo.php?script=sci_arttext&pid=S0080-62342011000200032&lang=pt" 
"S0080-62342011000200033-scl","A construção de um projeto na maternidade adolescente: relato de experiência","Beretta, Maria Isabel Ruiz, Freitas, Marildy Aparecida de, Dupas, Giselle, Fabbro, Márcia Regina Cangiani, Ruggiero, Eliete Maria Scarfon","Revista da Escola de Enfermagem da USP; 45(2); 533-536","Revista da Escola de Enfermagem da USP","Inglês, Português","2011","http://www.scielo.br/scielo.php?script=sci_arttext&pid=S0080-62342011000200033&lang=pt" 
"S0080-62342011000200003-scl","Qualidade de vida de cuidadores de crianças e adolescentes com sobrepeso ou obesidade","Melo, Tatiana Rocha, Jansen, Ann Kristine, Pinto, Rogério de Melo Costa, Morales, Rogério Rizo de, Morales, Nívea Macedo, Prado, Marília Martins, Silva, Carlos Henrique Martins da","Revista da Escola de Enfermagem da USP; 45(2); 319-326","Revista da Escola de Enfermagem da USP","Inglês, Português","2011","http://www.scielo.br/scielo.php?script=sci_arttext&pid=S0080-62342011000200003&lang=pt" 
"S0080-62342011000200024-scl","Vivências de familiares de crianças internadas em um Serviço de Pronto-Socorro","Santos, Ana Maria Ribeiro dos, Amorim, Nayra Michelle Anjos, Braga, Carolinne Husmann, Lima, Flávia Danielli Martins, Macedo, Elza Mayara Antunes de, Lima, Carla Fernanda de","Revista da Escola de Enfermagem da USP; 45(2); 473-479","Revista da Escola de Enfermagem da USP","Inglês, Português","2011","http://www.scielo.br/scielo.php?script=sci_arttext&pid=S0080-62342011000200024&lang=pt" 
"S0080-62342011000200030-scl","Empresa social e economia solidária: perspectivas no campo da inserção laboral de portadores de transtorno mental","Lussi, Isabela Aparecida de Oliveira, Pereira, Maria Alice Ornellas","Revista da Escola de Enfermagem da USP; 45(2); 515-521","Revista da Escola de Enfermagem da USP","Inglês, Português","2011","http://www.scielo.br/scielo.php?script=sci_arttext&pid=S0080-62342011000200030&lang=pt" 
"S0080-62342011000200026-scl","Ansiedade e depressão entre profissionais de enfermagem que atuam em blocos cirúrgicos","Schmidt, Denise Rodrigues Costa, Dantas, Rosana Aparecida Spadoti, Marziale, Maria Helena Palucci","Revista da Escola de Enfermagem da USP; 45(2); 487-493","Revista da Escola de Enfermagem da USP","Inglês, Português","2011","http://www.scielo.br/scielo.php?script=sci_arttext&pid=S0080-62342011000200026&lang=pt" 
"S0080-62342011000200028-scl","Abordagem da equipe de enfermagem ao usuário na emergência em saúde mental em um pronto atendimento","Kondo, Érika Hissae, Vilella, Juliane Cardoso, Borba, Letícia de Oliveira, Paes, Marcio Roberto, Maftum, Mariluci Alves","Revista da Escola de Enfermagem da USP; 45(2); 501-507","Revista da Escola de Enfermagem da USP","Inglês, Português","2011","http://www.scielo.br/scielo.php?script=sci_arttext&pid=S0080-62342011000200028&lang=pt" 
"S0080-62342011000200007-scl","Atributos mobilizados pela enfermeira na Saúde da Família: aproximação aos desempenhos na construção da competência gerencial","Kawata, Lauren Suemi, Mishima, Silvana Martins, Chirelli, Mara Quaglio, Pereira, Maria José Bistafa, Matumoto, Silvia, Fortuna, Cinira Magali","Revista da Escola de Enfermagem da USP; 45(2); 349-355","Revista da Escola de Enfermagem da USP","Inglês, Português","2011","http://www.scielo.br/scielo.php?script=sci_arttext&pid=S0080-62342011000200007&lang=pt" 
"S0103-863X2011000100002-scl","Paidéia: relatório de gestão - 2010","Santos, Manoel Antônio dos","Paidéia (Ribeirão Preto); 21(48); 5-8","Paidéia (Ribeirão Preto)","Português","2011","http://www.scielo.br/scielo.php?script=sci_arttext&pid=S0103-863X2011000100002&lang=pt" 
"S0103-863X2011000100013-scl","De Freud a Deleuze: os descaminhos da resistência","Canavêz, Fernanda, Herzog, Regina","Paidéia (Ribeirão Preto); 21(48); 111-118","Paidéia (Ribeirão Preto)","Português","2011","http://www.scielo.br/scielo.php?script=sci_arttext&pid=S0103-863X2011000100013&lang=pt" 
"S0103-863X2011000100016-scl","Prevenção de erros no ensino da leitura","Witter, Geraldina Porto","Paidéia (Ribeirão Preto); 21(48); 137-138","Paidéia (Ribeirão Preto)","Português","2011","http://www.scielo.br/scielo.php?script=sci_arttext&pid=S0103-863X2011000100016&lang=pt" 
"S0034-75902011000200009-scl","Gestão de empresas familiares","Zanni, Pedro, Steinberg, Herbert","Revista de Administração de Empresas; 51(2); 212-212","Revista de Administração de Empresas","Português","2011","http://www.scielo.br/scielo.php?script=sci_arttext&pid=S0034-75902011000200009&lang=pt" 
"S0034-75902011000200010-scl","A chave da inovação","Arbix, Glauco, Felizardo, Rafael Grilli","Revista de Administração de Empresas; 51(2); 213-213","Revista de Administração de Empresas","Português","2011","http://www.scielo.br/scielo.php?script=sci_arttext&pid=S0034-75902011000200010&lang=pt" 
"S0034-75902011000200005-scl","Transaction costs: an empirical analysis of their relationship with investment and foreign direct investment","Wink Junior, Marcos Vinício, Sheng, Hsia Hua, Eid Junior, William","Revista de Administração de Empresas; 51(2); 175-187","Revista de Administração de Empresas","Inglês","2011","http://www.scielo.br/scielo.php?script=sci_arttext&pid=S0034-75902011000200005&lang=pt" 
"S1984-46702011000200016-scl","Ancyrocephalidae (Monogenea) of Lake Tanganyika: I: Four new species of Cichlidogyrus from Ophthalmotilapia ventralis (Teleostei: Cichlidae), the first record of this parasite family in the basin","Vanhove, Maarten P. M., Volckaert, Filip A. M., Pariselle, Antoine","Zoologia (Curitiba); 28(2); 253-263","Zoologia (Curitiba)","Inglês","2011","http://www.scielo.br/scielo.php?script=sci_arttext&pid=S1984-46702011000200016&lang=pt" 
