"S0004-27492011000200005-scl","Superfície ocular e hepatite C","Gomes, Rachel Lopes Rodrigues, Marques, Júnia Cabral, Albers, Marcos Bottene Vila, Endo, Roberto Mitiaki, Dantas, Paulo Elias Correa, Felberg, Sérgio","Arquivos Brasileiros de Oftalmologia; 74(2); 97-101","Arquivos Brasileiros de Oftalmologia","Português","2011","http://www.scielo.br/scielo.php?script=sci_arttext&pid=S0004-27492011000200005&lang=pt" 
"S0004-27492011000200007-scl","Intraocular pressure and ocular perfusion during hemodialysis","Barbosa, Carolina Pelegrini, Stefanini, Francisco Rosa, Penha, Fernando, Góes, Miguel Ângelo, Draibe, Sérgio Antonio, Canziani, Maria Eugênia, Paranhos Junior, Augusto","Arquivos Brasileiros de Oftalmologia; 74(2); 106-109","Arquivos Brasileiros de Oftalmologia","Inglês","2011","http://www.scielo.br/scielo.php?script=sci_arttext&pid=S0004-27492011000200007&lang=pt" 
"S0004-27492011000200009-scl","Comparação entre membrana amniótica com e sem epitélio como substrato para cultura de células epiteliais do limbo ex vivo","Covre, Joyce Luciana, Loureiro, Renata Ruoco, Cristovam, Priscila Cardoso, Ricardo, José Reinaldo Da Silva, Haapalainen, Edna Freymuller, Gomes, José Álvaro Pereira","Arquivos Brasileiros de Oftalmologia; 74(2); 114-117","Arquivos Brasileiros de Oftalmologia","Português","2011","http://www.scielo.br/scielo.php?script=sci_arttext&pid=S0004-27492011000200009&lang=pt" 
"S0004-27492011000200011-scl","Eficácia do adesivo tecidual de fibrina na fixação de enxerto conjuntival autógeno em cirurgias de pterígio primário","Rubin, Michel Risnic, Dantas, Paulo Elias C., Nishiwaki-Dantas, M. Cristina, Felberg, Sergio","Arquivos Brasileiros de Oftalmologia; 74(2); 123-126","Arquivos Brasileiros de Oftalmologia","Português","2011","http://www.scielo.br/scielo.php?script=sci_arttext&pid=S0004-27492011000200011&lang=pt" 
"S0102-69922011000100002-scl","O papel do inquérito policial no processo de incriminação no Brasil: algumas reflexões a partir de uma pesquisa","Misse, Michel","Sociedade e Estado; 26(1); 15-27","Sociedade e Estado","Português","2011","http://www.scielo.br/scielo.php?script=sci_arttext&pid=S0102-69922011000100002&lang=pt" 
"S0102-69922011000100004-scl","O inquérito policial em questão: situação atual e a percepção dos delegados de polícia sobre as fragilidades do modelo Brasileiro de investigação criminal","Azevedo, Rodrigo Ghiringhelli de, Vasconcellos, Fernanda Bestetti de","Sociedade e Estado; 26(1); 59-75","Sociedade e Estado","Português","2011","http://www.scielo.br/scielo.php?script=sci_arttext&pid=S0102-69922011000100004&lang=pt" 
"S0102-69922011000100005-scl","Controle e cerimônia: o inquérito policial em um sistema de justiça criminal frouxamente ajustado","Vargas, Joana Domingues, Rodrigues, Juliana Neves Lopes","Sociedade e Estado; 26(1); 77-96","Sociedade e Estado","Português","2011","http://www.scielo.br/scielo.php?script=sci_arttext&pid=S0102-69922011000100005&lang=pt" 
"S0102-69922011000100006-scl","É possível uma Política Criminal? a discricionariedade no Sistema de Justiça Criminal do DF","Costa, Arthur Trindade M.","Sociedade e Estado; 26(1); 97-114","Sociedade e Estado","Português","2011","http://www.scielo.br/scielo.php?script=sci_arttext&pid=S0102-69922011000100006&lang=pt" 
"S0102-69922011000100007-scl","Gilberto Freyre e a valorização da província","Oliveira, Lucia Lippi","Sociedade e Estado; 26(1); 117-149","Sociedade e Estado","Português","2011","http://www.scielo.br/scielo.php?script=sci_arttext&pid=S0102-69922011000100007&lang=pt" 
"S0102-69922011000100008-scl","&quot;Direitos Humanos se conquistam na luta&quot;: igualdade racial, ativismo jurídico e defesa de causas coletivas no Rio Grande do Sul","Petrarca, Fernanda Rios, Neves, Clarissa Eckert Baeta","Sociedade e Estado; 26(1); 151-173","Sociedade e Estado","Português","2011","http://www.scielo.br/scielo.php?script=sci_arttext&pid=S0102-69922011000100008&lang=pt" 
"S0102-69922011000100009-scl","Intimidade e mercado: o cuidado de idosos em instituições de longa permanência","Batista, Analía Soria, Araújo, Anna Bárbara","Sociedade e Estado; 26(1); 175-195","Sociedade e Estado","Português","2011","http://www.scielo.br/scielo.php?script=sci_arttext&pid=S0102-69922011000100009&lang=pt" 
"S0102-69922011000100010-scl","Representação política e de interesses: bases associativas dos deputados federais de 1999-2007","Coradini, Odaci Luiz","Sociedade e Estado; 26(1); 197-220","Sociedade e Estado","Português","2011","http://www.scielo.br/scielo.php?script=sci_arttext&pid=S0102-69922011000100010&lang=pt" 
"S0102-69922011000100011-scl","A crítica da epistemologia na sociologia do conhecimento de Karl Mannheim","Gusmão, Luís de","Sociedade e Estado; 26(1); 221-239","Sociedade e Estado","Português","2011","http://www.scielo.br/scielo.php?script=sci_arttext&pid=S0102-69922011000100011&lang=pt" 
"S0102-69922011000100012-scl","Sérgio Buarque de Holanda na USP","Sanches, Rodrigo Ruiz","Sociedade e Estado; 26(1); 241-259","Sociedade e Estado","Português","2011","http://www.scielo.br/scielo.php?script=sci_arttext&pid=S0102-69922011000100012&lang=pt" 
"S0102-69922011000100003-scl","Inquérito policial, sistema de justiça criminal e políticas públicas de segurança: dilemas e limites da governança","Ratton, José Luiz, Torres, Valéria, Bastos, Camila","Sociedade e Estado; 26(1); 29-58","Sociedade e Estado","Português","2011","http://www.scielo.br/scielo.php?script=sci_arttext&pid=S0102-69922011000100003&lang=pt" 
"S1684-18242011000200002-cub","Cirugía laparoscópica en la apendicitis aguda","Galloso Cueto, Gilberto L, Lantigua Godoy, Abel, Alfonso Moya, Oriol, Sánchez Maya, Ángel Y","Revista Médica Electrónica; 33(2); 133-139","Revista Médica Electrónica","Espanhol","2011","http://scielo.sld.cu/scielo.php?script=sci_arttext&pid=S1684-18242011000200002&lang=pt" 
"S1684-18242011000200004-cub","Asociación de manifestaciones bucales con marcadores de seguimiento en personas con VIH, atendidos en el Centro de Atención Integral al Seropositivo Dr. Ismael Triana Torres","García Rodríguez, Ileana de la Caridad, Vichot Fernández, Lázaro, Batista Carvajal, Michel, Romero Díaz, Yusbelkis","Revista Médica Electrónica; 33(2); 148-155","Revista Médica Electrónica","Espanhol","2011","http://scielo.sld.cu/scielo.php?script=sci_arttext&pid=S1684-18242011000200004&lang=pt" 
"S1684-18242011000200007-cub","Infarto agudo del miocardio en centros de diagnóstico integral. Municipio San Francisco. Zulia. Venezuela. 2007","Moreno Peña, Luis Enrique, Hernández Hervís, Idalia Teresita, Moreno Peña, Raúl, García Peñate, Gladys, González Mendoza, Rudy Saél","Revista Médica Electrónica; 33(2); 169-174","Revista Médica Electrónica","Espanhol","2011","http://scielo.sld.cu/scielo.php?script=sci_arttext&pid=S1684-18242011000200007&lang=pt" 
"S1684-18242011000200010-cub","Empleo de inmunoterapia en pacientes con infección producida por Staphylococcus aureus","Naranjo Rodríguez, Sandra Adela, García Menéndez, Rodobaldo, Naranjo Rodríguez, Lisandra, Negret Hernández (1), Marisel","Revista Médica Electrónica; 33(2); 189-195","Revista Médica Electrónica","Espanhol","2011","http://scielo.sld.cu/scielo.php?script=sci_arttext&pid=S1684-18242011000200010&lang=pt" 
"S1684-18242011000200015-cub","Revisión sobre el manejo del trauma cráneo encefálico en la Unidad de Cuidados Intensivos Emergentes. Matanzas","Denis Pérez, Alberto, Álvarez Valdés, Mara Verónica, Porto Álvarez, Rudbeckia, Cabrera Caballero, Jorge Luis","Revista Médica Electrónica; 33(2); 225-234","Revista Médica Electrónica","Espanhol","2011","http://scielo.sld.cu/scielo.php?script=sci_arttext&pid=S1684-18242011000200015&lang=pt" 
"S1684-18242011000200017-cub","Feocromocitoma bilateral: presentación de un caso","Arocha Molina, Yuniel, Acosta Piedra, Yanet, Piedra Herrera, Blanca, Suárez Díaz, Teresa, Madruga Vázquez, Ketty","Revista Médica Electrónica; 33(2); 239-243","Revista Médica Electrónica","Espanhol","2011","http://scielo.sld.cu/scielo.php?script=sci_arttext&pid=S1684-18242011000200017&lang=pt" 
"S1684-18242011000200001-cub","Factores de riesgo de la enfermedad cerebrovascular en ancianos pertenecientes al Policlínico Universitario Milanés. Matanzas. 2007-2008","Hernández Suárez, Damarys, Vázquez López, Alicia, Hernández Suárez, Dalmara, Sánchez Jiménez, Odalys","Revista Médica Electrónica; 33(2); 126-132","Revista Médica Electrónica","Espanhol","2011","http://scielo.sld.cu/scielo.php?script=sci_arttext&pid=S1684-18242011000200001&lang=pt" 
"S1684-18242011000200003-cub","Incidencia del debut clínico de VIH/sida en Matanzas. 1996-2008","Ruiz Hernández, Ihosvany, Jiménez Ventosa, Yosvany","Revista Médica Electrónica; 33(2); 140-147","Revista Médica Electrónica","Espanhol","2011","http://scielo.sld.cu/scielo.php?script=sci_arttext&pid=S1684-18242011000200003&lang=pt" 
"S1684-18242011000200005-cub","Evaluación de los indicadores epidemiológicos del programa de la tuberculosis. Municipio Matanzas. 2000-2006","Garrote Rodríguez, Ismary, Gómez Murcia, Pedro R, Díaz Hernández, Odalys, Domínguez León, Silvia Isabel, Morales Cardona, Milvia","Revista Médica Electrónica; 33(2); 156-162","Revista Médica Electrónica","Espanhol","2011","http://scielo.sld.cu/scielo.php?script=sci_arttext&pid=S1684-18242011000200005&lang=pt" 
"S1684-18242011000200006-cub","Calidad del hibitane como desinfectante químico en la prevención y control de la contaminación microbiana","Serrate Silveira, Isabel, Méndez Martínez, Jesús, Latorre Enríquez, Onelia, Morales Santana, Ernesto, Alberto Palenzuela, Arelis","Revista Médica Electrónica; 33(2); 163-168","Revista Médica Electrónica","Espanhol","2011","http://scielo.sld.cu/scielo.php?script=sci_arttext&pid=S1684-18242011000200006&lang=pt" 
"S1684-18242011000200008-cub","Evaluación del programa de control de la tuberculosis. Municipio Cárdenas. 2001-2008","Díaz Hernández, Odalys, Gómez Murcia, Pedro R, Paredes Díaz, Roberto, Morales Cardona, Milvian, Torres Sánchez, Ernesto","Revista Médica Electrónica; 33(2); 175-181","Revista Médica Electrónica","Espanhol","2011","http://scielo.sld.cu/scielo.php?script=sci_arttext&pid=S1684-18242011000200008&lang=pt" 
"S1684-18242011000200009-cub","Conocimientos sobre prevención del cáncer cérvico-uterino en los adolescentes","García Rosique, Regla Mercedes, Torres Triana, Adelaida, Rendón Quintero, Marlén","Revista Médica Electrónica; 33(2); 182-188","Revista Médica Electrónica","Espanhol","2011","http://scielo.sld.cu/scielo.php?script=sci_arttext&pid=S1684-18242011000200009&lang=pt" 
"S1684-18242011000200011-cub","Prevalencia de hipertensos controlados. Municipio Cárdenas. 2009","Achiong Estupiñán, Fernando, Alfonso Godoy, Karina, Achiong Alemañy, Mercy, Achiong Alemañy, Fernando, Fernández Alfonso, Jana, Delgado Pérez, Lenia","Revista Médica Electrónica; 33(2); 196-202","Revista Médica Electrónica","Espanhol","2011","http://scielo.sld.cu/scielo.php?script=sci_arttext&pid=S1684-18242011000200011&lang=pt" 
"S1684-18242011000200012-cub","Reflexiones sobre el programa de la asignatura Agentes Biológicos, de la carrera de Medicina","Sosa Díaz, Regina Yamilet, Fernández Rodríguez, Caridad Julia, Fernández Rodríguez, Silvio, Naranjo Rodríguez, Sandra Adela, Guevara Pérez, Emma","Revista Médica Electrónica; 33(2); 203-210","Revista Médica Electrónica","Espanhol","2011","http://scielo.sld.cu/scielo.php?script=sci_arttext&pid=S1684-18242011000200012&lang=pt" 
"S1684-18242011000200013-cub","Factores relacionados con el rendimiento académico en la asignatura Morfofisiología Humana IV, del Programa Nacional de Formación de Medicina Integral Comunitaria","Martínez Pedroso, Caridad, Leiva Cubeñas, Yamilka Eulalia, Báez Pérez, Esther G, Fernández Morín, José","Revista Médica Electrónica; 33(2); 211-219","Revista Médica Electrónica","Espanhol","2011","http://scielo.sld.cu/scielo.php?script=sci_arttext&pid=S1684-18242011000200013&lang=pt" 
"S1684-18242011000200014-cub","Homeopatía y estomatitis aftosa recurrente. Revisión bibliográfica","Del Puerto Horta, Myrna, Pérez Quiñones, José Alberto, Perdomo Delgado, Johann, Castro Morillo, Eva María, Casas Ínsua, Leyvis","Revista Médica Electrónica; 33(2); 220-224","Revista Médica Electrónica","Espanhol","2011","http://scielo.sld.cu/scielo.php?script=sci_arttext&pid=S1684-18242011000200014&lang=pt" 
"S1684-18242011000200016-cub","Hernia de Spiegel vs. neoplasia de colon. A propósito de un caso","Ferreira Moreno, Víctor G, Cora Abrahams, Jesús, Suárez Camejo, René, de Posada Jiménez, Pablo, Hernández Rodríguez, Narciso","Revista Médica Electrónica; 33(2); 235-238","Revista Médica Electrónica","Espanhol","2011","http://scielo.sld.cu/scielo.php?script=sci_arttext&pid=S1684-18242011000200016&lang=pt" 
"S1684-18242011000200018-cub","Breve reseña histórica de la Botica Francesa Dr. Ernesto Triolet, hoy Museo Farmacéutico de Matanzas","Dopico Borrego, Patria","Revista Médica Electrónica; 33(2); 244-251","Revista Médica Electrónica","Espanhol","2011","http://scielo.sld.cu/scielo.php?script=sci_arttext&pid=S1684-18242011000200018&lang=pt" 
"S1684-18242011000200019-cub","La investigación educacional: una necesidad para el desarrollo","Baéz Pérez, Esther G.","Revista Médica Electrónica; 33(2); 252-253","Revista Médica Electrónica","Espanhol","2011","http://scielo.sld.cu/scielo.php?script=sci_arttext&pid=S1684-18242011000200019&lang=pt" 
"S0210-56912011000300002-esp","Impacto de las altas no programadas en la mortalidad hospitalaria tras la estancia en una unidad de cuidados intensivos","Rodríguez-Carvajal, M., Mora, D., Doblas, A., García, M., Domínguez, P., Tristancho, A., Herrera, M.","Medicina Intensiva; 35(3); 143-149","Medicina Intensiva","Espanhol","2011","http://scielo.isciii.es/scielo.php?script=sci_arttext&pid=S0210-56912011000300002&lang=pt" 
"S0210-56912011000300004-esp","Medicina aún más crítica: análisis retrospectivo de las bajas atendidas en la UCI del Hospital Militar español de Herat (Afganistán)","Navarro Suay, R., Bartolomé Cela, E., Jara Zozaya, I., Hernández Abadía de Barbará, A., Gutiérrez Ortega, C., García Labajo, J.D., Planas Roca, A., Gilsanz Rodríguez, F.","Medicina Intensiva; 35(3); 157-165","Medicina Intensiva","Espanhol","2011","http://scielo.isciii.es/scielo.php?script=sci_arttext&pid=S0210-56912011000300004&lang=pt" 
"S0102-71822011000100001-scl","","Toneli, Maria Juracy","Psicologia &amp; Sociedade; 23(1); 3-4","Psicologia &amp; Sociedade","Português","2011","http://www.scielo.br/scielo.php?script=sci_arttext&pid=S0102-71822011000100001&lang=pt" 
"S0102-71822011000100024-scl","Nas trilhas de um pensamento complexo sobre relações de gênero e a psicologia social no cotidiano: homenagem para Karin Ellen von Smigay","Prado, Marco Aurélio Máximo, Maheirie, Kátia, Medrado, Benedito, Caniato, Angela","Psicologia &amp; Sociedade; 23(1); 201-203","Psicologia &amp; Sociedade","Português","2011","http://www.scielo.br/scielo.php?script=sci_arttext&pid=S0102-71822011000100024&lang=pt" 
"S0102-71822011000100015-scl","Atitude político-ideológica e inserção social: fatores psicossociais do preconceito","Nunes, Aline Vieira de Lima, Camino, Leoncio","Psicologia &amp; Sociedade; 23(1); 135-143","Psicologia &amp; Sociedade","Português","2011","http://www.scielo.br/scielo.php?script=sci_arttext&pid=S0102-71822011000100015&lang=pt" 
"S0102-71822011000100022-scl","O desenvolvimento do educando como finalidade da educação: revisitando Kohlberg","Razera, Júlio César Castilho","Psicologia &amp; Sociedade; 23(1); 193-196","Psicologia &amp; Sociedade","Português","2011","http://www.scielo.br/scielo.php?script=sci_arttext&pid=S0102-71822011000100022&lang=pt" 
"S0102-71822011000100023-scl","Psicologia cultural e mudança social","Lacerda Júnior, Fernando","Psicologia &amp; Sociedade; 23(1); 197-200","Psicologia &amp; Sociedade","Português","2011","http://www.scielo.br/scielo.php?script=sci_arttext&pid=S0102-71822011000100023&lang=pt" 
"S0102-71822011000100021-scl","Assédio moral no trabalho: uma responsabilidade coletiva","Garcia, Ivonete Steinbach, Tolfo, Suzana da Rosa","Psicologia &amp; Sociedade; 23(1); 190-192","Psicologia &amp; Sociedade","Português","2011","http://www.scielo.br/scielo.php?script=sci_arttext&pid=S0102-71822011000100021&lang=pt" 
"S0210-56912011000300014-esp","Signo del Monte Fuji: neumoencéfalo a tensión","Pérez Redondo, M., Alcántara Carmona, S., Carrascosa Granada, Á.","Medicina Intensiva; 35(3); 199-199","Medicina Intensiva","Espanhol","2011","http://scielo.isciii.es/scielo.php?script=sci_arttext&pid=S0210-56912011000300014&lang=pt" 
"S1699-65852011000100001-esp","","","Avances en Periodoncia e Implantología Oral; 23(1); 9-9","Avances en Periodoncia e Implantología Oral","Espanhol","2011","http://scielo.isciii.es/scielo.php?script=sci_arttext&pid=S1699-65852011000100001&lang=pt" 
"S0210-56912011000300010-esp","Factores pronósticos en los pacientes con síndrome coronario agudo que ingresaron en una unidad de cuidados intensivos","Santana Cabrera, L., Sánchez Palacios, M., Lorenzo Torrent, R., Martínez Cuellar, S.","Medicina Intensiva; 35(3); 193-194","Medicina Intensiva","Espanhol","2011","http://scielo.isciii.es/scielo.php?script=sci_arttext&pid=S0210-56912011000300010&lang=pt" 
"S0210-56912011000300008-esp","Puesta al día de medicina intensiva sobre el enfermo crítico con infección grave: ¿qué hemos aprendido?","Zaragoza Crespo, R., Palomar Martínez, M.","Medicina Intensiva; 35(3); 186-188","Medicina Intensiva","Espanhol","2011","http://scielo.isciii.es/scielo.php?script=sci_arttext&pid=S0210-56912011000300008&lang=pt" 
"S1984-02922011000100017-scl","Esquizofrenia hebefrênica: psicose na infância e adolescência","Soares, Hugo Leonardo Rodrigues, Gonçalves, Hérica Cristina Batista, Werner Junior, Jairo","Fractal : Revista de Psicologia; 23(1); 239-240","Fractal : Revista de Psicologia","Português","2011","http://www.scielo.br/scielo.php?script=sci_arttext&pid=S1984-02922011000100017&lang=pt" 
"S0102-71822011000100002-scl","Natureza desumana: desmesuras do mundo ao homem","Costa, Luis Artur, Dutra, Daniel, Fonseca, Tania Mara Galli","Psicologia &amp; Sociedade; 23(1); 5-14","Psicologia &amp; Sociedade","Português","2011","http://www.scielo.br/scielo.php?script=sci_arttext&pid=S0102-71822011000100002&lang=pt" 
"S0102-71822011000100003-scl","A dimensão pública da subjetividade em tempos de Orkut","Neves, Carla, Portugal, Francisco Teixeira","Psicologia &amp; Sociedade; 23(1); 15-23","Psicologia &amp; Sociedade","Português","2011","http://www.scielo.br/scielo.php?script=sci_arttext&pid=S0102-71822011000100003&lang=pt" 
"S0102-71822011000100004-scl","Um olhar sobre o corpo: o corpo ontem e hoje","Barbosa, Maria Raquel, Matos, Paula Mena, Costa, Maria Emília","Psicologia &amp; Sociedade; 23(1); 24-34","Psicologia &amp; Sociedade","Português","2011","http://www.scielo.br/scielo.php?script=sci_arttext&pid=S0102-71822011000100004&lang=pt" 
"S0102-71822011000100005-scl","O assédio moral no trabalho na visão de operadores do direito","Battistelli, Bruna Moraes, Amazarray, Mayte Raya, Koller, Silvia Helena","Psicologia &amp; Sociedade; 23(1); 35-45","Psicologia &amp; Sociedade","Português","2011","http://www.scielo.br/scielo.php?script=sci_arttext&pid=S0102-71822011000100005&lang=pt" 
"S0102-71822011000100006-scl","Sentido do trabalho no discurso dos trabalhadores de uma ONG em Belo Horizonte","Viana, Eliete Augusta de Souza, Machado, Marília Novais da Mata","Psicologia &amp; Sociedade; 23(1); 46-55","Psicologia &amp; Sociedade","Português","2011","http://www.scielo.br/scielo.php?script=sci_arttext&pid=S0102-71822011000100006&lang=pt" 
"S0102-71822011000100008-scl","Exigências nos percursos profissionais de gerentes de banco","Máximo, Thaís Augusta Cunha de Oliveira, Araújo, Anísio José da Silva, Zambroni-de-Souza, Paulo César, Alberto, Maria de Fátima Pereira","Psicologia &amp; Sociedade; 23(1); 66-74","Psicologia &amp; Sociedade","Português","2011","http://www.scielo.br/scielo.php?script=sci_arttext&pid=S0102-71822011000100008&lang=pt" 
"S0102-71822011000100009-scl","Crítica às apropriações psicológicas do trabalho","Bendassolli, Pedro F.","Psicologia &amp; Sociedade; 23(1); 75-84","Psicologia &amp; Sociedade","Português","2011","http://www.scielo.br/scielo.php?script=sci_arttext&pid=S0102-71822011000100009&lang=pt" 
"S0102-71822011000100011-scl","A produção de meninos de projeto e acontecimentos no percurso","Tavares, Gilead Marchezi, Oliveira, Fabiana Teixeira de, Bossatto, Tatiane, Deus, Flávia Borges de, Coelho, Denise Carla Goldner, Vilas-Boas, Mônica Nogueira Santos","Psicologia &amp; Sociedade; 23(1); 94-102","Psicologia &amp; Sociedade","Português","2011","http://www.scielo.br/scielo.php?script=sci_arttext&pid=S0102-71822011000100011&lang=pt" 
"S0102-71822011000100012-scl","Caracterização dos serviços que atendem adolescentes: interfaces entre saúde mental e drogadição","Areco, Nichollas Martins, Camila Alessandra, Matias, Silva, Rosalina Carvalho da, Simon, Cristiane Paulin","Psicologia &amp; Sociedade; 23(1); 103-113","Psicologia &amp; Sociedade","Português","2011","http://www.scielo.br/scielo.php?script=sci_arttext&pid=S0102-71822011000100012&lang=pt" 
"S0102-71822011000100013-scl","Representações sociais da depressão no ensino médio: um estudo sobre duas capitais","Damião, Natália Ferreira, Coutinho, Maria da Penha de Lima, Carolino, Zulmira Carla Gonçalves, Ribeiro, Karla Carolina Silveira","Psicologia &amp; Sociedade; 23(1); 114-124","Psicologia &amp; Sociedade","Português","2011","http://www.scielo.br/scielo.php?script=sci_arttext&pid=S0102-71822011000100013&lang=pt" 
"S0102-71822011000100014-scl","Adolescentes autores de atos infracionais: psicologia moral e legislação","Monte, Franciela Félix de Carvalho, Sampaio, Leonardo Rodrigues, Rosa Filho, Josemar Soares, Barbosa, Laila Santana","Psicologia &amp; Sociedade; 23(1); 125-134","Psicologia &amp; Sociedade","Português","2011","http://www.scielo.br/scielo.php?script=sci_arttext&pid=S0102-71822011000100014&lang=pt" 
"S0102-71822011000100016-scl","Estereótipos e essencialização de brancos e negros: um estudo comparativo","Pereira, Marcos Emanoel, Álvaro, José Luis, Oliveira, Andréia C., Dantas, Gilcimar S.","Psicologia &amp; Sociedade; 23(1); 144-153","Psicologia &amp; Sociedade","Português","2011","http://www.scielo.br/scielo.php?script=sci_arttext&pid=S0102-71822011000100016&lang=pt" 
"S0102-71822011000100017-scl","Redução de danos e saúde pública: construções alternativas à política global de &quot;guerra às drogas&quot;","Passos, Eduardo Henrique, Souza, Tadeu Paula","Psicologia &amp; Sociedade; 23(1); 154-162","Psicologia &amp; Sociedade","Português","2011","http://www.scielo.br/scielo.php?script=sci_arttext&pid=S0102-71822011000100017&lang=pt" 
"S0102-71822011000100018-scl","Amor e ciúme na contemporaneidade: reflexões psicossociológicas","Baroncelli, Lauane","Psicologia &amp; Sociedade; 23(1); 163-170","Psicologia &amp; Sociedade","Português","2011","http://www.scielo.br/scielo.php?script=sci_arttext&pid=S0102-71822011000100018&lang=pt" 
"S0102-71822011000100019-scl","Rappresentazioni sociali dell&#039;invecchiamento tra psicologia sociale e letteratura","Contarello, Alberta, Marini, Ilaria, Nencini, Alessio, Ricci, Gaia","Psicologia &amp; Sociedade; 23(1); 171-180","Psicologia &amp; Sociedade","Italiano","2011","http://www.scielo.br/scielo.php?script=sci_arttext&pid=S0102-71822011000100019&lang=pt" 
"S0102-71822011000100020-scl","Espaço e subjetividade: estudo com ribeirinhos","Alves, Andréia Duarte, Justo, José Sterza","Psicologia &amp; Sociedade; 23(1); 181-189","Psicologia &amp; Sociedade","Português","2011","http://www.scielo.br/scielo.php?script=sci_arttext&pid=S0102-71822011000100020&lang=pt" 
"S0034-76122011000200005-scl","Gobernanza de las políticas de proximidad: análisis de calidad y rendimiento democrático de los Consejos Locales Bienestar (Murcia, Espana)","Pastor Seller, Enrique","Revista de Administração Pública; 45(2); 377-399","Revista de Administração Pública","Espanhol","2011","http://www.scielo.br/scielo.php?script=sci_arttext&pid=S0034-76122011000200005&lang=pt" 
"S0210-56912011000300006-esp","Síndrome de lisis tumoral en terapia intensiva: encare diagnóstico y terapéutico","Burghi, G., Berrutti, D., Manzanares, W.","Medicina Intensiva; 35(3); 170-178","Medicina Intensiva","Espanhol","2011","http://scielo.isciii.es/scielo.php?script=sci_arttext&pid=S0210-56912011000300006&lang=pt" 
"S1699-65852011000100004-esp","Revisión bibliográfica de Implantología Bucofacial del año 2008: Segunda parte","Sánchez Garcés, M.A., Pié Sánchez, J., Harutunian, K., Forni, A., González Martínez, R., Real Osuna, J., Fierro Garibay, C., Gay Escoda, C","Avances en Periodoncia e Implantología Oral; 23(1); 29-47","Avances en Periodoncia e Implantología Oral","Espanhol","2011","http://scielo.isciii.es/scielo.php?script=sci_arttext&pid=S1699-65852011000100004&lang=pt" 
"S0102-71822011000100007-scl","Envolvimento de docentes-gestores com o trabalho no contexto universitário","Kanan, Lilia Aparecida, Zanelli, José Carlos","Psicologia &amp; Sociedade; 23(1); 56-65","Psicologia &amp; Sociedade","Português","2011","http://www.scielo.br/scielo.php?script=sci_arttext&pid=S0102-71822011000100007&lang=pt" 
