"S2236-89062009000200010-scl","Anatomia foliar com implicações taxonômicas em espécies de ipês","Silva, Andréa Monte Luchiari da, Costa, Marina Fernanda Bortolin, Leite, Viviane Gonçalves, Rezende, Andréia Alves, Teixeira, Simone de Pádua","Hoehnea; 36(2); 329-338","Hoehnea","Português","2009","http://www.scielo.br/scielo.php?script=sci_arttext&pid=S2236-89062009000200010&lang=pt" 
"S0120-44832009000100008-col","STRUCTURE OF INTERREGIONAL MIGRATION FLOWS IN SPAIN: 1998-2006","Dong Guo, Sandy Dall&#039;erba","Ensayos sobre POLÍTICA ECONÓMICA; 27(spe58); 264-276","Ensayos sobre POLÍTICA ECONÓMICA","Inglês","2009","http://www.scielo.org.co/scielo.php?script=sci_arttext&pid=S0120-44832009000100008&lang=pt" 
"S0120-44832009000100003-col","PPC Y CONVERGENCIA DE PRECIOS: UN ANÁLISIS PARA LAS CIUDADES DEL PERÚ","Monge, Alvaro, Winkelried, Diego","Ensayos sobre POLÍTICA ECONÓMICA; 27(spe58); 56-104","Ensayos sobre POLÍTICA ECONÓMICA","Espanhol","2009","http://www.scielo.org.co/scielo.php?script=sci_arttext&pid=S0120-44832009000100003&lang=pt" 
"S0120-44832009000100002-col","LOS CICLOS DEL EMPLEO REGIONAL EN COLOMBIA: DEPENDENCIA INTERREGIONAL 2001-2006","Bohórquez Olarte, Lilian Carol, Godoy Bejarano, Jesús María, Téllez Falla, Diego Fernando","Ensayos sobre POLÍTICA ECONÓMICA; 27(spe58); 16-55","Ensayos sobre POLÍTICA ECONÓMICA","Espanhol","2009","http://www.scielo.org.co/scielo.php?script=sci_arttext&pid=S0120-44832009000100002&lang=pt" 
"S0120-44832009000100001-col","EDICIÓN ESPECIAL SOBRE ECONOMÍA REGIONAL Y URBANA","BONET, JAIME, MEISEL ROCA, ADOLFO","Ensayos sobre POLÍTICA ECONÓMICA; 27(spe58); 8-11","Ensayos sobre POLÍTICA ECONÓMICA","Inglês, Espanhol","2009","http://www.scielo.org.co/scielo.php?script=sci_arttext&pid=S0120-44832009000100001&lang=pt" 
"S0120-44832009000100007-col","CRECIMIENTO ECONÓMICO EN MÉXICO: LA DINÁMICA DE LA PRODUCTIVIDAD MANUFACTURERA REGIONAL, 1970-2003","de León Arias, Adrián","Ensayos sobre POLÍTICA ECONÓMICA; 27(spe58); 232-263","Ensayos sobre POLÍTICA ECONÓMICA","Espanhol","2009","http://www.scielo.org.co/scielo.php?script=sci_arttext&pid=S0120-44832009000100007&lang=pt" 
"S0120-44832009000100006-col","INTER AND INTRA-REGIONAL SEGMENTATION IN THE COLOMBIAN LABOUR MARKET, 2001-2006","Ortiz, Carlos Humberto, Uribe, José Ignacio, Badillo, Érika Raquel","Ensayos sobre POLÍTICA ECONÓMICA; 27(spe58); 194-231","Ensayos sobre POLÍTICA ECONÓMICA","Inglês","2009","http://www.scielo.org.co/scielo.php?script=sci_arttext&pid=S0120-44832009000100006&lang=pt" 
"S0120-44832009000100005-col","IMPERFECCIONES DE MERCADO EN ECONOMÍA ESPACIAL: ALGUNOS RESULTADOS EXPERIMENTALES II","Haddad, Eduardo A, Hewings, Geoffrey J.D","Ensayos sobre POLÍTICA ECONÓMICA; 27(spe58); 140-193","Ensayos sobre POLÍTICA ECONÓMICA","Inglês","2009","http://www.scielo.org.co/scielo.php?script=sci_arttext&pid=S0120-44832009000100005&lang=pt" 
"S0120-44832009000100004-col","LOS PROCESOS DE AGLOMERACIÓN EN COLOMBIA A LA LUZ DE LA NUEVA GEOGRAFÍA ECONÓMICA","Velez Villegas, Juan Esteban","Ensayos sobre POLÍTICA ECONÓMICA; 27(spe58); 106-139","Ensayos sobre POLÍTICA ECONÓMICA","Espanhol","2009","http://www.scielo.org.co/scielo.php?script=sci_arttext&pid=S0120-44832009000100004&lang=pt" 
"S1870-90442009000100001-mex","Editorial","Gelbukh, Alexander","Polibits; (39); 3-4","Polibits","Inglês","2009","http://www.scielo.org.mx/scielo.php?script=sci_arttext&pid=S1870-90442009000100001&lang=pt" 
"S1870-90442009000100010-mex","E- Learning Content Design and Implementation based on Learners&#039; Levels","Jeong, Hye-Jin, Kim, Yong-Sung","Polibits; (39); 59-63","Polibits","Inglês","2009","http://www.scielo.org.mx/scielo.php?script=sci_arttext&pid=S1870-90442009000100010&lang=pt" 
"S1870-90442009000100011-mex","Modeling Multimodal Multitasking in a Smart House","Manchón, Pilar, Solar, Carmen del, Amores, Gabriel, Pérez, Guillermo","Polibits; (39); 65-71","Polibits","Inglês","2009","http://www.scielo.org.mx/scielo.php?script=sci_arttext&pid=S1870-90442009000100011&lang=pt" 
"S1870-90442009000100002-mex","Disentangling the Wikipedia Category Graph for Corpus Extraction","Ngonga Ngomo, Axel-Cyrille, Schumacher, Frank","Polibits; (39); 5-10","Polibits","Inglês","2009","http://www.scielo.org.mx/scielo.php?script=sci_arttext&pid=S1870-90442009000100002&lang=pt" 
"S1870-90442009000100003-mex","Semantic Enterprise Search (but no Web 2.0)","Winnemöller, Ronald","Polibits; (39); 11-17","Polibits","Inglês","2009","http://www.scielo.org.mx/scielo.php?script=sci_arttext&pid=S1870-90442009000100003&lang=pt" 
"S1870-90442009000100004-mex","Semantic Web Framework for Development of Very Large Ontologies","Yablonsky, Sergey","Polibits; (39); 19-26","Polibits","Inglês","2009","http://www.scielo.org.mx/scielo.php?script=sci_arttext&pid=S1870-90442009000100004&lang=pt" 
"S1870-90442009000100005-mex","FlexIR: A Domain-Specific Information Retrieval System","Radhouani, Saïd, Mottaz Jiang, Claire-Lise, Falquet, Gilles","Polibits; (39); 27-31","Polibits","Inglês","2009","http://www.scielo.org.mx/scielo.php?script=sci_arttext&pid=S1870-90442009000100005&lang=pt" 
"S1870-90442009000100006-mex","Mining Reviews for Product Comparison and Recommendation","Sun, Jianshu, Long, Chong, Zhu, Xiaoyan, Huang, Minlie","Polibits; (39); 33-40","Polibits","Inglês","2009","http://www.scielo.org.mx/scielo.php?script=sci_arttext&pid=S1870-90442009000100006&lang=pt" 
"S1870-90442009000100007-mex","SMM: Detailed, Structured Morphological Analysis for Spanish","Mahlow, Cerstin, Piotrowski, Michael","Polibits; (39); 41-48","Polibits","Inglês","2009","http://www.scielo.org.mx/scielo.php?script=sci_arttext&pid=S1870-90442009000100007&lang=pt" 
"S1870-90442009000100008-mex","CLAU - A Service-Oriented System for Complex Language Alignment: Architectural Aspects","Mihăilă, Claudiu, Forăscul, Corina, Buraga, Sabin C.","Polibits; (39); 49-54","Polibits","Inglês","2009","http://www.scielo.org.mx/scielo.php?script=sci_arttext&pid=S1870-90442009000100008&lang=pt" 
"S1870-90442009000100009-mex","Application of Pronominal Divergence and Anaphora Resolution in English-Hindi Machine Translation","Dutta, Kamlesh, Prakash, Nupur, Kaushik, Saroj","Polibits; (39); 55-58","Polibits","Inglês","2009","http://www.scielo.org.mx/scielo.php?script=sci_arttext&pid=S1870-90442009000100009&lang=pt" 
"S1692-25222009000100008-col","Emergencia de la juventud en las ciudades contemporáneas","Garcés Montoya, Ángela","Anagramas -Rumbos y sentidos de la comunicación-; 7(14); 105-114","Anagramas -Rumbos y sentidos de la comunicación-","Espanhol","2009","http://www.scielo.org.co/scielo.php?script=sci_arttext&pid=S1692-25222009000100008&lang=pt" 
"S1692-25222009000100009-col","Estigmas territoriales y distinciones sociales: Configuraciones espaciales en la ciudad de Medellín","Quiceno Toro, Natalia, Sanín Naranjo, Paula","Anagramas -Rumbos y sentidos de la comunicación-; 7(14); 115-132","Anagramas -Rumbos y sentidos de la comunicación-","Espanhol","2009","http://www.scielo.org.co/scielo.php?script=sci_arttext&pid=S1692-25222009000100009&lang=pt" 
"S1692-25222009000100001-col","EDITORIAL","","Anagramas -Rumbos y sentidos de la comunicación-; 7(14); 7-8","Anagramas -Rumbos y sentidos de la comunicación-","Inglês, Espanhol","2009","http://www.scielo.org.co/scielo.php?script=sci_arttext&pid=S1692-25222009000100001&lang=pt" 
"S1692-25222009000100002-col","El cómic es cosa seria. El cómic como mediación para la enseñanza en la educación superior Caso Universidad Nacional, Universidad de Medellín y Universidad Pontificia Bolivariana","Arango Johnson, Jorge Alberto, Gómez Salazar, Luz Elena, Gómez Hernández, Mónica María","Anagramas -Rumbos y sentidos de la comunicación-; 7(14); 15-32","Anagramas -Rumbos y sentidos de la comunicación-","Espanhol","2009","http://www.scielo.org.co/scielo.php?script=sci_arttext&pid=S1692-25222009000100002&lang=pt" 
"S1692-25222009000100003-col","Mujeres en situación de prostitución de calle y su representación en medios gráficos: La historieta &#039;&#039;Clara de noche&#039;&#039;","Acevedo, Mariela","Anagramas -Rumbos y sentidos de la comunicación-; 7(14); 33-47","Anagramas -Rumbos y sentidos de la comunicación-","Espanhol","2009","http://www.scielo.org.co/scielo.php?script=sci_arttext&pid=S1692-25222009000100003&lang=pt" 
"S1692-25222009000100004-col","Los estudiantes de periodismo en la reinvención de los medios. Análisis, tendencias y propuestas de colaboración entre los Medios y estudiantes de periodismo para la creación de noticias locales y la generación de nuevos perfiles","Flores Vivar, Jesús Miguel, Salinas Aguilar, Cecilia","Anagramas -Rumbos y sentidos de la comunicación-; 7(14); 49-62","Anagramas -Rumbos y sentidos de la comunicación-","Espanhol","2009","http://www.scielo.org.co/scielo.php?script=sci_arttext&pid=S1692-25222009000100004&lang=pt" 
"S1692-25222009000100005-col","Una voz de los olvidados. Análisis del periodismo narrativo de José Antonio Osorio LizarazoJournalism students in new media.","Puerta Molina, Andrés Alexander","Anagramas -Rumbos y sentidos de la comunicación-; 7(14); 63-80","Anagramas -Rumbos y sentidos de la comunicación-","Espanhol","2009","http://www.scielo.org.co/scielo.php?script=sci_arttext&pid=S1692-25222009000100005&lang=pt" 
"S1692-25222009000100006-col","El diseño y uso de indicadores de comunicación en las organizaciones antioqueñas","Vahos Montoya, José Luis","Anagramas -Rumbos y sentidos de la comunicación-; 7(14); 81-92","Anagramas -Rumbos y sentidos de la comunicación-","Espanhol","2009","http://www.scielo.org.co/scielo.php?script=sci_arttext&pid=S1692-25222009000100006&lang=pt" 
"S1692-25222009000100007-col","Estrategias de comunicación para crear alianzas","Suárez Monsalve, Ana María","Anagramas -Rumbos y sentidos de la comunicación-; 7(14); 93-104","Anagramas -Rumbos y sentidos de la comunicación-","Espanhol","2009","http://www.scielo.org.co/scielo.php?script=sci_arttext&pid=S1692-25222009000100007&lang=pt" 
"S1692-25222009000100012-col","Vivir democráticamente El concepto de libertad de expresión en la obra de B. Spinoza","Guzzi, Líbera, Doyle, María Magdalena","Anagramas -Rumbos y sentidos de la comunicación-; 7(14); 155-164","Anagramas -Rumbos y sentidos de la comunicación-","Espanhol","2009","http://www.scielo.org.co/scielo.php?script=sci_arttext&pid=S1692-25222009000100012&lang=pt" 
"S1692-25222009000100011-col","Música/cine: Variaciones sobre un mismo tema (La musicalidad de la imagen o sonata de cuatro movimientos en tono mayor)","Arango Lopera, Carlos Andrés","Anagramas -Rumbos y sentidos de la comunicación-; 7(14); 143-154","Anagramas -Rumbos y sentidos de la comunicación-","Espanhol","2009","http://www.scielo.org.co/scielo.php?script=sci_arttext&pid=S1692-25222009000100011&lang=pt" 
"S1692-25222009000100010-col","Montaje o edición: Un diseño y modelo de clasificación basado en objetivos de comunicación","Morales Morante, Luis Fernando","Anagramas -Rumbos y sentidos de la comunicación-; 7(14); 133-141","Anagramas -Rumbos y sentidos de la comunicación-","Espanhol","2009","http://www.scielo.org.co/scielo.php?script=sci_arttext&pid=S1692-25222009000100010&lang=pt" 
"S2236-89062009000200001-scl","Palinologia de sedimentos da turfeira do Banhado Amarelo, São Francisco de Paula, Rio Grande do Sul, Brasil: fungos e criptógamas","Spalding, Bianca Batista da Costa, Lorscheitter, Maria Luisa","Hoehnea; 36(2); 219-232","Hoehnea","Português","2009","http://www.scielo.br/scielo.php?script=sci_arttext&pid=S2236-89062009000200001&lang=pt" 
"S2236-89062009000200002-scl","Levantamento florístico e síndromes de dispersão em remanescentes de Floresta Ombrófila Mista na região centro-sul do estado do Paraná","Liebsch, Dieter, Mikich, Sandra Bos, Possette, Rafael Fernando da Silva, Ribas, Osmar dos Santos","Hoehnea; 36(2); 233-248","Hoehnea","Português","2009","http://www.scielo.br/scielo.php?script=sci_arttext&pid=S2236-89062009000200002&lang=pt" 
"S2236-89062009000200003-scl","Marasmius do Parque Estadual das Fontes do Ipiranga, São Paulo, SP, Brasil: seções Globulares, Hygrometrici, Marasmius e Neosessiles","Puccinelli, Carla, Capelari, Marina","Hoehnea; 36(2); 249-258","Hoehnea","Português","2009","http://www.scielo.br/scielo.php?script=sci_arttext&pid=S2236-89062009000200003&lang=pt" 
"S2236-89062009000200004-scl","Catabolismo de sacarose durante a mobilização do galactomanano e sua importância na estratégia de sobrevivência de plântulas de Sesbania virgata (Cav.) Pers.","Molle, Fábio Reis Dalle, Tiné, Marco Aurélio Silva","Hoehnea; 36(2); 259-268","Hoehnea","Português","2009","http://www.scielo.br/scielo.php?script=sci_arttext&pid=S2236-89062009000200004&lang=pt" 
"S2236-89062009000200005-scl","Leaf midrib outline as a diagnostic character for taxonomy in Anthurium section Urospadix subsection Flavescentiviridia (Araceae)","Mantovani, André, Pereira, Thaís Estefani, Coelho, Marcus A. Nadruz","Hoehnea; 36(2); 269-277","Hoehnea","Inglês","2009","http://www.scielo.br/scielo.php?script=sci_arttext&pid=S2236-89062009000200005&lang=pt" 
"S2236-89062009000200006-scl","Flora polínica da Reserva do Parque Estadual das Fontes do Ipiranga (São Paulo, Brasil): família: 135-Asclepiadaceae","Luz, Cynthia Fernandes Pinto da, Albanese, Fernanda Jacinto, Corrêa, Angela Maria da Silva, Cruz-Barros, Maria Amélia Vitorino da, Guimarães, Maria Isabel Tauil de Moura","Hoehnea; 36(2); 279-291","Hoehnea","Português","2009","http://www.scielo.br/scielo.php?script=sci_arttext&pid=S2236-89062009000200006&lang=pt" 
"S2236-89062009000200007-scl","Trilhas afetam comunidades arbóreas florestais?: dois levantamentos na Floresta Atlântica do sudeste brasileiro","Eisenlohr, Pedro Vasconcellos, Melo, Maria Margarida da Rocha Fiuza de, Silva, Adriano Valentin da","Hoehnea; 36(2); 293-302","Hoehnea","Português","2009","http://www.scielo.br/scielo.php?script=sci_arttext&pid=S2236-89062009000200007&lang=pt" 
"S2236-89062009000200008-scl","O gênero Lejeunea Libert (Lejeuneaceae) no Estado da Bahia, Brasil","Bastos, Cid José Passos, Yano, Olga","Hoehnea; 36(2); 303-320","Hoehnea","Português","2009","http://www.scielo.br/scielo.php?script=sci_arttext&pid=S2236-89062009000200008&lang=pt" 
"S2236-89062009000200009-scl","Arquitetura foliar de Odontonema strictum (Nees) O. Kuntze (Acanthaceae) em duas condições de luminosidade","Larcher, Letícia, Boeger, Maria Regina Torres","Hoehnea; 36(2); 321-327","Hoehnea","Português","2009","http://www.scielo.br/scielo.php?script=sci_arttext&pid=S2236-89062009000200009&lang=pt" 
"S2236-89062009000200011-scl","Cystoderma, Cystodermella and Ripartitella in Atlantic Forest, São Paulo State, Brazil","Capelari, Marina, Asai, Tatiane","Hoehnea; 36(2); 339-348","Hoehnea","Inglês","2009","http://www.scielo.br/scielo.php?script=sci_arttext&pid=S2236-89062009000200011&lang=pt" 
"S2236-89062009000200012-scl","O gênero Micrasterias Agardh ex Ralfs (Desmidiaceae, Zygnemaphyceae) em um lago artificial urbano, Paraná, Brasil","Moresco, Carina, Biolo, Stefania, Bueno, Norma Catarina","Hoehnea; 36(2); 349-358","Hoehnea","Português","2009","http://www.scielo.br/scielo.php?script=sci_arttext&pid=S2236-89062009000200012&lang=pt" 
"S0185-06362009000100001-mex","Editorial","","Nueva antropología; 22(70); 05-09","Nueva antropología","Espanhol","2009","http://www.scielo.org.mx/scielo.php?script=sci_arttext&pid=S0185-06362009000100001&lang=pt" 
"S0185-06362009000100002-mex","Flujos y mudanzas globales del ámbar de Chiapas, México","Ytuarte-Núñez, Claudia","Nueva antropología; 22(70); 11-31","Nueva antropología","Espanhol","2009","http://www.scielo.org.mx/scielo.php?script=sci_arttext&pid=S0185-06362009000100002&lang=pt" 
"S0185-06362009000100003-mex","Café y cultura productiva en una región de Veracruz","Ejea Mendoza, María Teresa","Nueva antropología; 22(70); 33-56","Nueva antropología","Espanhol","2009","http://www.scielo.org.mx/scielo.php?script=sci_arttext&pid=S0185-06362009000100003&lang=pt" 
"S0185-06362009000100004-mex","Un granito de sal... Su circulación y consumo en la Costa Chica de Guerrero","Quiroz Malca, Haydée","Nueva antropología; 22(70); 57-86","Nueva antropología","Espanhol","2009","http://www.scielo.org.mx/scielo.php?script=sci_arttext&pid=S0185-06362009000100004&lang=pt" 
"S0185-06362009000100005-mex","Poder y ensamble de culturas en la Cadena Agroindustrial del Limón","González Villarruel, Alejandro A.","Nueva antropología; 22(70); 87-113","Nueva antropología","Espanhol","2009","http://www.scielo.org.mx/scielo.php?script=sci_arttext&pid=S0185-06362009000100005&lang=pt" 
"S0185-06362009000100006-mex","La expresión cultural de una cosa: el juguete popular","Medrano de Luna, Gabriel","Nueva antropología; 22(70); 115-142","Nueva antropología","Espanhol","2009","http://www.scielo.org.mx/scielo.php?script=sci_arttext&pid=S0185-06362009000100006&lang=pt" 
"S0185-06362009000100007-mex","El proceso ritual de las comunidades de alcohólicos anónimos del norte de México","Palacios Ramírez, José","Nueva antropología; 22(70); 143-169","Nueva antropología","Espanhol","2009","http://www.scielo.org.mx/scielo.php?script=sci_arttext&pid=S0185-06362009000100007&lang=pt" 
"S0185-06362009000100008-mex","Milagros en la frontera: Retablos de migrantes mexicanos a Estados Unidos","Méndez Martínez, Jorge Luis","Nueva antropología; 22(70); 171-174","Nueva antropología","Espanhol","2009","http://www.scielo.org.mx/scielo.php?script=sci_arttext&pid=S0185-06362009000100008&lang=pt" 
"S0718-68512009000100003-chl","La personificación de las sociedades civiles: Análisis histórico-jurídico del artículo 1669 del &quot;código civil&quot; español","Quesada Sánchez, Antonio José","Revista de derecho (Valparaíso); (32); 133-181","Revista de derecho (Valparaíso)","Espanhol","2009","http://www.scielo.cl/scielo.php?script=sci_arttext&pid=S0718-68512009000100003&lang=pt" 
"S0718-68512009000100007-chl","Análisis crítico sobre la aplicación de la doctrina de los actos propios en materia laboral","Caamaño Rojo, Eduardo","Revista de derecho (Valparaíso); (32); 261-280","Revista de derecho (Valparaíso)","Espanhol","2009","http://www.scielo.cl/scielo.php?script=sci_arttext&pid=S0718-68512009000100007&lang=pt" 
"S0718-68512009000100008-chl","Obtención fraudulenta de prestaciones estatales","Mayer Lux, Laura","Revista de derecho (Valparaíso); (32); 283-325","Revista de derecho (Valparaíso)","Espanhol","2009","http://www.scielo.cl/scielo.php?script=sci_arttext&pid=S0718-68512009000100008&lang=pt" 
"S0718-68512009000100009-chl","Multiculturalidad y discrecionalidad judicial en una sentencia penal: análisis desde Joseph Raz","Zambrano Tiznado, Juan Pablo, San Juan, Claudio Agüero","Revista de derecho (Valparaíso); (32); 327-343","Revista de derecho (Valparaíso)","Espanhol","2009","http://www.scielo.cl/scielo.php?script=sci_arttext&pid=S0718-68512009000100009&lang=pt" 
"S0718-68512009000100010-chl","Forma y sustancia en el razonamiento probatorio: El alcance del control sobre la valoración de la prueba a través del recurso de nulidad penal","Accatino, Daniela","Revista de derecho (Valparaíso); (32); 347-362","Revista de derecho (Valparaíso)","Espanhol","2009","http://www.scielo.cl/scielo.php?script=sci_arttext&pid=S0718-68512009000100010&lang=pt" 
"S0718-68512009000100011-chl","Oralidad y prueba: comparación y análisis crítico de las experiencias reformadoras del proceso civil en Alemania y España","Pérez-Ragone, Álvaro, Palomo Vélez, Diego","Revista de derecho (Valparaíso); (32); 363-406","Revista de derecho (Valparaíso)","Espanhol","2009","http://www.scielo.cl/scielo.php?script=sci_arttext&pid=S0718-68512009000100011&lang=pt" 
"S0718-68512009000100013-chl","La fuerza normativa de la constitución y el sistema de fuentes del derecho","Aldunate Lizana, Eduardo","Revista de derecho (Valparaíso); (32); 443-484","Revista de derecho (Valparaíso)","Espanhol","2009","http://www.scielo.cl/scielo.php?script=sci_arttext&pid=S0718-68512009000100013&lang=pt" 
"S0718-68512009000100015-chl","Algunas críticas a la idea de razón pública rawlsiana","Villavicencio Miranda, Luis","Revista de derecho (Valparaíso); (32); 533-557","Revista de derecho (Valparaíso)","Espanhol","2009","http://www.scielo.cl/scielo.php?script=sci_arttext&pid=S0718-68512009000100015&lang=pt" 
"S0718-68512009000100006-chl","La noción de incumplimiento esencial en el &quot;código civil&quot;","Vidal Olivares, Álvaro R","Revista de derecho (Valparaíso); (32); 221-258","Revista de derecho (Valparaíso)","Espanhol","2009","http://www.scielo.cl/scielo.php?script=sci_arttext&pid=S0718-68512009000100006&lang=pt" 
"S0718-68512009000100004-chl","El singular renacimiento de la autonomía de la voluntad y la &quot;locatio conductio operarum et operis&quot; como consecuencia de la presente depresión económica","Rodríguez Ennes, Luis","Revista de derecho (Valparaíso); (32); 183-208","Revista de derecho (Valparaíso)","Espanhol","2009","http://www.scielo.cl/scielo.php?script=sci_arttext&pid=S0718-68512009000100004&lang=pt" 
"S1870-74592009000100001-mex","La Colección Zoológica Regional (Aves) del Instituto de Historia Natural de Chiapas, México","Altamirano González Ortega, Marco Antonio, Guzmán Hernández, Jaqueline","Huitzil; 10(1); 7-14","Huitzil","Espanhol","2009","http://www.scielo.org.mx/scielo.php?script=sci_arttext&pid=S1870-74592009000100001&lang=pt" 
"S1870-74592009000100002-mex","Primer registro de la tángara ala amarilla (Thraupis abbas) en el estado de Nuevo León, México","Monroy Ojeda, Alan","Huitzil; 10(1); 1-2","Huitzil","Espanhol","2009","http://www.scielo.org.mx/scielo.php?script=sci_arttext&pid=S1870-74592009000100002&lang=pt" 
"S1870-74592009000100005-mex","Registro del mirlo pinto (Ridgwayia pinícola) para el estado de Nuevo León, México","Monroy Ojeda, Alan, Sánchez Morales, Nahum Eryán","Huitzil; 10(1); 19-21","Huitzil","Espanhol","2009","http://www.scielo.org.mx/scielo.php?script=sci_arttext&pid=S1870-74592009000100005&lang=pt" 
"S1870-74592009000100003-mex","Registros recientes de tres especies de aves en el estado de Nuevo León, México","Valdés-Peña, René A., Ortiz-Maciel, Sonia Gabriela, Núñez-Gonzalí, Adriana","Huitzil; 10(1); 3-6","Huitzil","Espanhol","2009","http://www.scielo.org.mx/scielo.php?script=sci_arttext&pid=S1870-74592009000100003&lang=pt" 
"S1870-74592009000100004-mex","Corvus imparatus, primer registro para Hidalgo, México","Valencia-Herverth, Raúl, Valencia-Herverth, Jorge, Mendoza-Quijano, Fernando","Huitzil; 10(1); 15-18","Huitzil","Espanhol","2009","http://www.scielo.org.mx/scielo.php?script=sci_arttext&pid=S1870-74592009000100004&lang=pt" 
"S1870-74592009000100007-mex","Registro del gavilán pescador (Pandion haliaetus) en el valle de Tehuacán-Cuicatlán, norte de Oaxaca","Vázquez, Leopoldo, Vázquez Reyes, José Alejandro, Arizmendi, María del Coro","Huitzil; 10(1); 24-26","Huitzil","Espanhol","2009","http://www.scielo.org.mx/scielo.php?script=sci_arttext&pid=S1870-74592009000100007&lang=pt" 
"S1870-74592009000100006-mex","Primer reporte formal de la urraca-hermosa cara negra (Calocitta colliei) en Baja California Sur, México","Amador, Édgar, Mendoza Salgado, Renato A., Ramírez Rosas, Juan J., Palacios, Eduardo","Huitzil; 10(1); 22-23","Huitzil","Espanhol","2009","http://www.scielo.org.mx/scielo.php?script=sci_arttext&pid=S1870-74592009000100006&lang=pt" 
"S1870-74592009000100009-mex","Notas sobre la distribución de algunas aves en Morelos, México","Urbina-Torres, Fernando, Romo de Vivar-Álvarez, Claudia, Navarro-Sigüenza, Adolfo G.","Huitzil; 10(1); 30-37","Huitzil","Espanhol","2009","http://www.scielo.org.mx/scielo.php?script=sci_arttext&pid=S1870-74592009000100009&lang=pt" 
"S1870-74592009000100008-mex","Registro adicional del buscabreña (Icteria virens) para el Distrito Federal, México","Ríos-Muñoz, César A., Cortés-Rodríguez, Nandadevi","Huitzil; 10(1); 27-29","Huitzil","Espanhol","2009","http://www.scielo.org.mx/scielo.php?script=sci_arttext&pid=S1870-74592009000100008&lang=pt" 
"S0301-70362009000200007-mex","Desempeño competitivo de Argentina y Uruguay en la leche en polvo","Depetris Guiguet, Edith, García Arancibia, Rodrigo, Rossini, Gustavo","Problemas del desarrollo; 40(157); 163-187","Problemas del desarrollo","Espanhol","2009","http://www.scielo.org.mx/scielo.php?script=sci_arttext&pid=S0301-70362009000200007&lang=pt" 
"S0301-70362009000200001-mex","Editorial","","Problemas del desarrollo; 40(157); 5-9","Problemas del desarrollo","Espanhol","2009","http://www.scielo.org.mx/scielo.php?script=sci_arttext&pid=S0301-70362009000200001&lang=pt" 
"S0301-70362009000200009-mex","¿Qué fue del buen samaritano? Naciones ricas, políticas pobres","López Castellano, Fernando","Problemas del desarrollo; 40(157); 207-211","Problemas del desarrollo","Espanhol","2009","http://www.scielo.org.mx/scielo.php?script=sci_arttext&pid=S0301-70362009000200009&lang=pt" 
"S0301-70362009000200008-mex","Consumo orgánico y conciencia ambiental de los consumidores","Salgado Beltrán, Lizbeth, Subirá Lobera, María Esther, Beltrán Morales, Luis Felipe","Problemas del desarrollo; 40(157); 189-199","Problemas del desarrollo","Espanhol","2009","http://www.scielo.org.mx/scielo.php?script=sci_arttext&pid=S0301-70362009000200008&lang=pt" 
"S0301-70362009000200005-mex","Relación entre la inflación y tasas de interés en México y Estados Unidos","Cavazos Arroyo, Guillermo, Rivas-Aceves, Salvador","Problemas del desarrollo; 40(157); 111-135","Problemas del desarrollo","Espanhol","2009","http://www.scielo.org.mx/scielo.php?script=sci_arttext&pid=S0301-70362009000200005&lang=pt" 
