"S0120-36492009000200002-col","ETHNICITY AND THE PEOPLE OF GOD","ACOSTA B, MILTON","Theologica Xaveriana; 59(168); 309-330","Theologica Xaveriana","Inglês","2009","http://www.scielo.org.co/scielo.php?script=sci_arttext&pid=S0120-36492009000200002&lang=pt" 
"S0120-36492009000200005-col","LA ENCÍCLICA SPE SALVI DEL PAPA BENEDICTO XVI EN LA DIALÉCTICA DE LA ESPERANZA ACTIVA","GUTIÉRREZ J.,, MARIO","Theologica Xaveriana; 59(168); 393-422","Theologica Xaveriana","Espanhol","2009","http://www.scielo.org.co/scielo.php?script=sci_arttext&pid=S0120-36492009000200005&lang=pt" 
"S0120-36492009000200004-col","LA LUCHA POR LA POSESIÓN DE LA TIERRA UNA LECTURA DE LA VIÑA DE NABOT (1R 21)","GAITÁN,, TARCISIO","Theologica Xaveriana; 59(168); 359-391","Theologica Xaveriana","Espanhol","2009","http://www.scielo.org.co/scielo.php?script=sci_arttext&pid=S0120-36492009000200004&lang=pt" 
"S0120-36492009000200007-col","LA TRANSFORMACIÓN DEL IMAGINARIO SIMBÓLICO","RAMOS,, GERARDO DANIEL","Theologica Xaveriana; 59(168); 449-469","Theologica Xaveriana","Espanhol","2009","http://www.scielo.org.co/scielo.php?script=sci_arttext&pid=S0120-36492009000200007&lang=pt" 
"S0120-36492009000200006-col","LA CREENCIA CRISTIANA COMO OPCIÓN FUNDAMENTAL POR LA NO-VIOLENCIA","MARTÍNEZ M, DARÍO ERNESTO","Theologica Xaveriana; 59(168); 423-448","Theologica Xaveriana","Espanhol","2009","http://www.scielo.org.co/scielo.php?script=sci_arttext&pid=S0120-36492009000200006&lang=pt" 
"S0718-71062009000200001-chl","Fission track thermochronology of Neogene plutons in the Principal Andean Cordillera of central Chile (33-35°S): Implications for tectonic evolution and porphyry Cu-Mo mineralization","Maksaev, Víctor, Munizaga, Francisco, Zentilli, Marcos, Charrier, Reynaldo","Andean geology; 36(2); 153-171","Andean geology","Inglês","2009","http://www.scielo.cl/scielo.php?script=sci_arttext&pid=S0718-71062009000200001&lang=pt" 
"S0718-71062009000200002-chl","Los conglomerados sintectónicos de la Formación Las Cumbres (Plio-Pleistoceno), Sierras Pampeanas de La Rioja y Catamarca, Argentina","Bossi, Gerardo E, Georgieff, Sergio M, Muruaga, Claudia M, Ibáñez, Lucía M, Sanagua, Javier G","Andean geology; 36(2); 172-196","Andean geology","Espanhol","2009","http://www.scielo.cl/scielo.php?script=sci_arttext&pid=S0718-71062009000200002&lang=pt" 
"S0718-71062009000200003-chl","El Paleoceno-Mioceno de Península Mitre: antefosa y depocentro de techo de cuña de la cuenca Austral, Tierra del Fuego, Argentina","Torres Carbonell, Pablo J, Malumián, Norberto, Olivero, Eduardo B","Andean geology; 36(2); 197-235","Andean geology","Espanhol","2009","http://www.scielo.cl/scielo.php?script=sci_arttext&pid=S0718-71062009000200003&lang=pt" 
"S0718-71062009000200004-chl","El sistema lacustre de la Formación Mollar en el depocentro triásico de Santa Clara (provincia de Mendoza, Argentina)","Spalletti, Luis A, Zavattieri, Ana María","Andean geology; 36(2); 236-263","Andean geology","Espanhol","2009","http://www.scielo.cl/scielo.php?script=sci_arttext&pid=S0718-71062009000200004&lang=pt" 
"S0718-71062009000200005-chl","LA-ICP-MS zircon U-Pb geochronology to constrain the age of post-Neocomian continental deposits of the Cerrillos Formation, Atacama Region , northern Chile: tectonic and metallogenic implications","Maksaev, Víctor, Munizaga, Francisco, Valencia, Víctor, Barra, Fernando","Andean geology; 36(2); 264-287","Andean geology","Inglês","2009","http://www.scielo.cl/scielo.php?script=sci_arttext&pid=S0718-71062009000200005&lang=pt" 
"S0718-71062009000200006-chl","Estacionalidad de la erosión y el transporte eólico de partículas en el desierto costero de Atacama, Chile (23°S)","Flores-Aqueveque, Valentina, Vargas, Gabriel, Rutllant, José, Le Roux, Jacobus P","Andean geology; 36(2); 288-310","Andean geology","Espanhol","2009","http://www.scielo.cl/scielo.php?script=sci_arttext&pid=S0718-71062009000200006&lang=pt" 
"S0718-71062009000200007-chl","Estratigrafía e inversión tectónica del &#039;rift&#039; neógeno en el Campo del Arenal, Catamarca, NO Argentina","Bossi, Gerardo E, Muruaga, Claudia M","Andean geology; 36(2); 311-340","Andean geology","Espanhol","2009","http://www.scielo.cl/scielo.php?script=sci_arttext&pid=S0718-71062009000200007&lang=pt" 
"S0718-71062009000200008-chl","First record of Elasmosaurid Plesiosaurs (Sauropterygia: Plesiosauria) in upper levels of the Dorotea Formation, Late Cretaceous (Maastrichtian), Puerto Natales, Chilean Patagonia","Otero, Rodrigo A, Suárez, Mario E, Le Roux, Jacobus P","Andean geology; 36(2); 342-350","Andean geology","Inglês","2009","http://www.scielo.cl/scielo.php?script=sci_arttext&pid=S0718-71062009000200008&lang=pt" 
"S1405-94362009000100001-mex","Editorial","Ochoa Avalos, Ma. Candelaria","La ventana. Revista de estudios de género; 3(29); 3-4","La ventana. Revista de estudios de género","Espanhol","2009","http://www.scielo.org.mx/scielo.php?script=sci_arttext&pid=S1405-94362009000100001&lang=pt" 
"S1405-94362009000100010-mex","Entre la represión y los derechos sexuales y reproductivos: socialización de género y enfoques de educación sexual de adolescentes que se embarazaron","Climent, Graciela Irma","La ventana. Revista de estudios de género; 3(29); 236-275","La ventana. Revista de estudios de género","Espanhol","2009","http://www.scielo.org.mx/scielo.php?script=sci_arttext&pid=S1405-94362009000100010&lang=pt" 
"S1405-94362009000100011-mex","Ocho cubanas y una revolución","De LaTorre Castellanos, Renée","La ventana. Revista de estudios de género; 3(29); 276-284","La ventana. Revista de estudios de género","Espanhol","2009","http://www.scielo.org.mx/scielo.php?script=sci_arttext&pid=S1405-94362009000100011&lang=pt" 
"S1405-94362009000100012-mex","¿El sexo fuerte?","Hernández Rodríguez, Alfonso","La ventana. Revista de estudios de género; 3(29); 285-291","La ventana. Revista de estudios de género","Espanhol","2009","http://www.scielo.org.mx/scielo.php?script=sci_arttext&pid=S1405-94362009000100012&lang=pt" 
"S1405-94362009000100013-mex","La Ciudadanía a debate","Ochoa Avalos, Ma. Candelaria","La ventana. Revista de estudios de género; 3(29); 292-297","La ventana. Revista de estudios de género","Espanhol","2009","http://www.scielo.org.mx/scielo.php?script=sci_arttext&pid=S1405-94362009000100013&lang=pt" 
"S1405-94362009000100014-mex","Crónica de una iniciativa anuciada... el 26 de marzo de 2009","García Reyes, Ángela","La ventana. Revista de estudios de género; 3(29); 298-303","La ventana. Revista de estudios de género","Espanhol","2009","http://www.scielo.org.mx/scielo.php?script=sci_arttext&pid=S1405-94362009000100014&lang=pt" 
"S1405-94362009000100015-mex","Avances, observaciones y tareas pendientes: coloquio sobre transversalización de la perspectiva de género en la educación","Hidalgo Rodríguez, Alejandra","La ventana. Revista de estudios de género; 3(29); 305-309","La ventana. Revista de estudios de género","Espanhol","2009","http://www.scielo.org.mx/scielo.php?script=sci_arttext&pid=S1405-94362009000100015&lang=pt" 
"S1405-94362009000100002-mex","Presentación","","La ventana. Revista de estudios de género; 3(29); 5-6","La ventana. Revista de estudios de género","Espanhol","2009","http://www.scielo.org.mx/scielo.php?script=sci_arttext&pid=S1405-94362009000100002&lang=pt" 
"S1405-94362009000100003-mex","Identidad y representaciones del cuerpo en jóvenes gays de Guadalajara","Marcial, Rogelio","La ventana. Revista de estudios de género; 3(29); 7-31","La ventana. Revista de estudios de género","Espanhol","2009","http://www.scielo.org.mx/scielo.php?script=sci_arttext&pid=S1405-94362009000100003&lang=pt" 
"S1405-94362009000100004-mex","¿Historia no es destino? Masculinidades juveniles tabasqueñas contemporáneas","Tuñón Pablos, Esperanza, Tinoco Ojanguren, Rolando","La ventana. Revista de estudios de género; 3(29); 32-66","La ventana. Revista de estudios de género","Espanhol","2009","http://www.scielo.org.mx/scielo.php?script=sci_arttext&pid=S1405-94362009000100004&lang=pt" 
"S1405-94362009000100005-mex","Hombre joven: propuestas de una categoría para la investigación social","García Villanueva, Jorge, Ito Sugiyama, María Emily R.","La ventana. Revista de estudios de género; 3(29); 67-108","La ventana. Revista de estudios de género","Espanhol","2009","http://www.scielo.org.mx/scielo.php?script=sci_arttext&pid=S1405-94362009000100005&lang=pt" 
"S1405-94362009000100006-mex","¿Nuevas generaciones, nuevas creencias? Violencia de género y jóvenes","Ramírez Rodríguez, Juan Carlos, López López, Gemma Cithlalli, Padilla González, Francisco José","La ventana. Revista de estudios de género; 3(29); 110-145","La ventana. Revista de estudios de género","Espanhol","2009","http://www.scielo.org.mx/scielo.php?script=sci_arttext&pid=S1405-94362009000100006&lang=pt" 
"S1405-94362009000100007-mex","El entorno escolar y familiar en la construcción de significaciones de género y sexualidad en jóvenes de Guadalajara","Martínez Lozano, Consuelo Patricia, Solís Domínguez, Daniel","La ventana. Revista de estudios de género; 3(29); 146-183","La ventana. Revista de estudios de género","Espanhol","2009","http://www.scielo.org.mx/scielo.php?script=sci_arttext&pid=S1405-94362009000100007&lang=pt" 
"S1405-94362009000100008-mex","Discursos sobre las sexualidades entre jóvenes universitarios/as: lo familiar como modelizador de la discursividad generacional","Blanco, Rafael","La ventana. Revista de estudios de género; 3(29); 184-205","La ventana. Revista de estudios de género","Espanhol","2009","http://www.scielo.org.mx/scielo.php?script=sci_arttext&pid=S1405-94362009000100008&lang=pt" 
"S1405-94362009000100009-mex","Conducta homosexual en estudiantes universitarios y aspectos diferenciales de género","Moral de la Rubia, José","La ventana. Revista de estudios de género; 3(29); 206-235","La ventana. Revista de estudios de género","Espanhol","2009","http://www.scielo.org.mx/scielo.php?script=sci_arttext&pid=S1405-94362009000100009&lang=pt" 
"S0120-48072009000200002-col","","Adarve, Mauricio, Caicedo, Alhena","Universitas Humanística; (68); 11-12","Universitas Humanística","Espanhol","2009","http://www.scielo.org.co/scielo.php?script=sci_arttext&pid=S0120-48072009000200002&lang=pt" 
"S0120-48072009000200003-col","Nuevos chamanismos Nueva Era","Caicedo Fernández, Alhena","Universitas Humanística; (68); 15-32","Universitas Humanística","Espanhol","2009","http://www.scielo.org.co/scielo.php?script=sci_arttext&pid=S0120-48072009000200003&lang=pt" 
"S0120-48072009000200001-col","","Montenegro Martínez, Leonardo","Universitas Humanística; (68); 9-10","Universitas Humanística","Espanhol","2009","http://www.scielo.org.co/scielo.php?script=sci_arttext&pid=S0120-48072009000200001&lang=pt" 
"S0120-48072009000200006-col","¿Guerra espiritual evangélica o brujería indígena? Prácticas mágico-religiosas de los excombatientes paramilitares en contextos de guerra en Córdoba (Colombia)","Lozano Garzón, Liz Carolina","Universitas Humanística; (68); 69-95","Universitas Humanística","Espanhol","2009","http://www.scielo.org.co/scielo.php?script=sci_arttext&pid=S0120-48072009000200006&lang=pt" 
"S0120-48072009000200007-col","Las contradicciones de la identidad de la Iglesia Israelita del Nuevo Pacto Universal","Meneses, Lucia Eufemia","Universitas Humanística; (68); 97-119","Universitas Humanística","Espanhol","2009","http://www.scielo.org.co/scielo.php?script=sci_arttext&pid=S0120-48072009000200007&lang=pt" 
"S0120-48072009000200004-col","Yoga, cuerpo e imagen: espiritualidad y bienestar, de la terapia a la publicidad","Fajardo Pulido, John Alexander","Universitas Humanística; (68); 33-47","Universitas Humanística","Espanhol","2009","http://www.scielo.org.co/scielo.php?script=sci_arttext&pid=S0120-48072009000200004&lang=pt" 
"S0120-48072009000200005-col","Iglesias evangélicas y conservación en San Pacho (Darién, Caribe colombiano)","Gálvez, Aída, Salazar, Julio, Ramírez, Lorena","Universitas Humanística; (68); 49-67","Universitas Humanística","Espanhol","2009","http://www.scielo.org.co/scielo.php?script=sci_arttext&pid=S0120-48072009000200005&lang=pt" 
"S0120-48072009000200008-col","Lenguaje y prácticas comunicativas: un acercamiento desde la etnografía del habla a la Universidad Espiritual Mundial Brahma Kumaris","Romero, Andrés","Universitas Humanística; (68); 121-137","Universitas Humanística","Espanhol","2009","http://www.scielo.org.co/scielo.php?script=sci_arttext&pid=S0120-48072009000200008&lang=pt" 
"S0120-48072009000200009-col","El rostro y lo sagrado: algunos puntos de análisis","Breton, David Le","Universitas Humanística; (68); 139-153","Universitas Humanística","Espanhol","2009","http://www.scielo.org.co/scielo.php?script=sci_arttext&pid=S0120-48072009000200009&lang=pt" 
"S0120-48072009000200015-col","Artesanía1","Oliva Mendoza, Carlos","Universitas Humanística; (68); 287-296","Universitas Humanística","Espanhol","2009","http://www.scielo.org.co/scielo.php?script=sci_arttext&pid=S0120-48072009000200015&lang=pt" 
"S0120-48072009000200014-col","La dimensión salud: ¿ignorada en la Política de Alcohol Carburante (PAC) en Colombia?","García-Lozada, Héctor","Universitas Humanística; (68); 269-286","Universitas Humanística","Espanhol","2009","http://www.scielo.org.co/scielo.php?script=sci_arttext&pid=S0120-48072009000200014&lang=pt" 
"S0120-48072009000200016-col","La escritura y los universitarios","Andrade Calderón, Martha Cecilia","Universitas Humanística; (68); 297-340","Universitas Humanística","Espanhol","2009","http://www.scielo.org.co/scielo.php?script=sci_arttext&pid=S0120-48072009000200016&lang=pt" 
"S0120-48072009000200011-col","Los Derechos Humanos como campo de luchas por la diversidad humana: Un análisis desde la sociología crítica de Boaventura de Sousa Santos","Aguiló Bonet, Antoni Jesús","Universitas Humanística; (68); 179-205","Universitas Humanística","Espanhol","2009","http://www.scielo.org.co/scielo.php?script=sci_arttext&pid=S0120-48072009000200011&lang=pt" 
"S0120-48072009000200010-col","Los derechos humanos y el antisemitismo después de Gaza","Grosfoguel, Ramón","Universitas Humanística; (68); 157-177","Universitas Humanística","Espanhol","2009","http://www.scielo.org.co/scielo.php?script=sci_arttext&pid=S0120-48072009000200010&lang=pt" 
"S0120-48072009000200013-col","El mar ¿territorio de quién? Algunos elementos para una propuesta de una antropología del litoral","Montalvo, Alfonso Julián, Silva Vallejo, Fabio","Universitas Humanística; (68); 247-265","Universitas Humanística","Espanhol","2009","http://www.scielo.org.co/scielo.php?script=sci_arttext&pid=S0120-48072009000200013&lang=pt" 
"S0120-48072009000200012-col","Cartografías del campo político afrodescendiente en América Latina","Lao-Montes, Agustín","Universitas Humanística; (68); 207-245","Universitas Humanística","Espanhol","2009","http://www.scielo.org.co/scielo.php?script=sci_arttext&pid=S0120-48072009000200012&lang=pt" 
"S0486-65252009000100010-col","ESTÉTICAS DEL CONSUMO: CONFIGURACIONES DE LA CULTURA MATERIAL","Gallego Franco, Santiago","Revista Colombiana de Antropología; 45(1); 225-229","Revista Colombiana de Antropología","Espanhol","2009","http://www.scielo.org.co/scielo.php?script=sci_arttext&pid=S0486-65252009000100010&lang=pt" 
"S0486-65252009000100011-col","RAZA, ETNICIDAD Y SEXUALIDADES. CIUDADANÍA Y MULTICULTURALISMO EN AMÉRICA LATINA","Pedraza Gómez, Zandra","Revista Colombiana de Antropología; 45(1); 230-234","Revista Colombiana de Antropología","Espanhol","2009","http://www.scielo.org.co/scielo.php?script=sci_arttext&pid=S0486-65252009000100011&lang=pt" 
"S0486-65252009000100007-col","EN CLAVE CORPORAL: CONOCIMIENTO, EXPERIENCIA Y CONDICIÓN HUMANA","PEDRAZA GÓMEZ, ZANDRA","Revista Colombiana de Antropología; 45(1); 147-168","Revista Colombiana de Antropología","Espanhol","2009","http://www.scielo.org.co/scielo.php?script=sci_arttext&pid=S0486-65252009000100007&lang=pt" 
"S0486-65252009000100006-col","TACONES, SILICONAS, HORMONAS Y OTRAS CRÍTICAS AL SISTEMA SEXO-GÉNERO. FEMINISMOS Y EXPERIENCIAS DE TRANSEXUALES Y TRAVESTIS","GARCÍA BECERRA, ANDRÉS","Revista Colombiana de Antropología; 45(1); 119-146","Revista Colombiana de Antropología","Espanhol","2009","http://www.scielo.org.co/scielo.php?script=sci_arttext&pid=S0486-65252009000100006&lang=pt" 
"S0486-65252009000100005-col","LOS CUERPOS REPLICANTES. LA ELUSIÓN DEL CUERPO LEGÍTIMO EN EL PROCESO DE FORMACIÓN POLICIAL","SIRIMARCO, MARIANA","Revista Colombiana de Antropología; 45(1); 95-118","Revista Colombiana de Antropología","Espanhol","2009","http://www.scielo.org.co/scielo.php?script=sci_arttext&pid=S0486-65252009000100005&lang=pt" 
"S0486-65252009000100004-col","CUERPOS TATUADOS, &quot;ALMAS&quot; TATUADAS: NUEVAS FORMAS DE SUBJETIVIDAD EN LA CONTEMPORANEIDAD","PÉREZ FONSECA, ANDREA LISSETT","Revista Colombiana de Antropología; 45(1); 69-94","Revista Colombiana de Antropología","Espanhol","2009","http://www.scielo.org.co/scielo.php?script=sci_arttext&pid=S0486-65252009000100004&lang=pt" 
"S0486-65252009000100003-col","UNIONES, MATERNIDAD Y SALUD SEXUAL Y REPRODUCTIVA DE LAS AFROCOLOMBIANAS DE BUENAVENTURA¹. UNA PERSPECTIVA ANTROPOLÓGICA","NAVARRO VALENCIA, MARTHA CECILIA","Revista Colombiana de Antropología; 45(1); 38-68","Revista Colombiana de Antropología","Espanhol","2009","http://www.scielo.org.co/scielo.php?script=sci_arttext&pid=S0486-65252009000100003&lang=pt" 
"S0486-65252009000100002-col","EL CUERPO INVESTIGADOR, EL CUERPO INVESTIGADO UNA APROXIMACIÓN FENOMENOLÓGICA A LA EXPERIENCIA DEL PUERPERIO","MORA, ANA SABRINA","Revista Colombiana de Antropología; 45(1); 11-38","Revista Colombiana de Antropología","Espanhol","2009","http://www.scielo.org.co/scielo.php?script=sci_arttext&pid=S0486-65252009000100002&lang=pt" 
"S0486-65252009000100001-col","EDITORIAL","CAMACHO, JUANA","Revista Colombiana de Antropología; 45(1); 7-10","Revista Colombiana de Antropología","Espanhol","2009","http://www.scielo.org.co/scielo.php?script=sci_arttext&pid=S0486-65252009000100001&lang=pt" 
"S0486-65252009000100009-col","EL CUERPO COMO UNIDAD BIOLÓGICA Y SOCIAL: UNA PREMISA PARA LA SALUD SEXUAL Y REPRODUCTIVA","REYES SÁNCHEZ, GIOVANNA LISET","Revista Colombiana de Antropología; 45(1); 203-224","Revista Colombiana de Antropología","Espanhol","2009","http://www.scielo.org.co/scielo.php?script=sci_arttext&pid=S0486-65252009000100009&lang=pt" 
"S0486-65252009000100008-col","EL DISCURSO SOBRE EL FENÓMENO DE LA MÉDIUM UNIDAD EN LAS RELIGIONES AFROCUBANAS","VON WANGENHEIM, HUBERTA","Revista Colombiana de Antropología; 45(1); 169-203","Revista Colombiana de Antropología","Espanhol","2009","http://www.scielo.org.co/scielo.php?script=sci_arttext&pid=S0486-65252009000100008&lang=pt" 
"S0120-33472009000200001-col","Innovación y desarrollo científico. La nueva estructura administrativa de la Sociedad Colombiana de Anestesiología, SCARE, ha permitido el desarrollo científico de la organización en 2009. Nuestros logros y proyectos","Reyes Duque, Gustavo","Revista Colombiana de Anestesiología; 37(2); 98-99","Revista Colombiana de Anestesiología","Inglês, Espanhol","2009","http://www.scielo.org.co/scielo.php?script=sci_arttext&pid=S0120-33472009000200001&lang=pt" 
"S0120-33472009000200002-col","La variación del volumen celular bajo diferentes concentraciones de solución salina (NaCL))","García, Mario J, Ardila, Angel M","Revista Colombiana de Anestesiología; 37(2); 106-109","Revista Colombiana de Anestesiología","Inglês, Espanhol","2009","http://www.scielo.org.co/scielo.php?script=sci_arttext&pid=S0120-33472009000200002&lang=pt" 
"S0120-33472009000200003-col","Anestesia espinal para colecistectomía laparoscópica","Jiménez, Juan Carlos, Chica, Juan, Vargas, Daniel","Revista Colombiana de Anestesiología; 37(2); 111-118","Revista Colombiana de Anestesiología","Inglês, Espanhol","2009","http://www.scielo.org.co/scielo.php?script=sci_arttext&pid=S0120-33472009000200003&lang=pt" 
"S0120-33472009000200004-col","Intubación orotraqueal sin relajante muscular: propofol o etomidato en combinación con remifentanilo","Rincón, Jaime A, Hernández, Angela, Charris, Hernán, Montes, Félix R.","Revista Colombiana de Anestesiología; 37(2); 119-129","Revista Colombiana de Anestesiología","Inglês, Espanhol","2009","http://www.scielo.org.co/scielo.php?script=sci_arttext&pid=S0120-33472009000200004&lang=pt" 
"S0120-33472009000200005-col","Manejo de la hipotensión inducida por anestesia espinal para cesárea","Montoya Botero, Beatriz Helena, Oliveros Wilches, Clara Inés, Moreno Martínez, Diego Alberto","Revista Colombiana de Anestesiología; 37(2); 131-140","Revista Colombiana de Anestesiología","Inglês, Espanhol","2009","http://www.scielo.org.co/scielo.php?script=sci_arttext&pid=S0120-33472009000200005&lang=pt" 
"S0120-33472009000200006-col","Avances en las bases moleculares de la anestesiología","Madiedo Clavijo, Cristina Nohora, Perea Solano, Dario José","Revista Colombiana de Anestesiología; 37(2); 141-151","Revista Colombiana de Anestesiología","Inglês, Espanhol","2009","http://www.scielo.org.co/scielo.php?script=sci_arttext&pid=S0120-33472009000200006&lang=pt" 
"S0120-33472009000200007-col","Insercion de balon intratraqueal por fetoscopia","Zauner Cuervo, Angela, Perez Pradilla, Carolina","Revista Colombiana de Anestesiología; 37(2); 152-154","Revista Colombiana de Anestesiología","Espanhol","2009","http://www.scielo.org.co/scielo.php?script=sci_arttext&pid=S0120-33472009000200007&lang=pt" 
"S0120-33472009000200008-col","La práctica de la anestesiología y la ley sexta de 1991","Navarro V, José Ricardo, Mora Herrera, Juan Camilo","Revista Colombiana de Anestesiología; 37(2); 155-156","Revista Colombiana de Anestesiología","Espanhol","2009","http://www.scielo.org.co/scielo.php?script=sci_arttext&pid=S0120-33472009000200008&lang=pt" 
"S1850-66662009000200001-arg","Una construcción del significado del número complejo","Martínez Sierra, Gustavo, Antonio Antonio, Rocío","Revista electrónica de investigación en educación en ciencias; 4(1); 1-9","Revista electrónica de investigación en educación en ciencias","Espanhol","2009","http://www.scielo.org.ar/scielo.php?script=sci_arttext&pid=S1850-66662009000200001&lang=pt" 
"S1850-66662009000200002-arg","Aprender Matemática en la Universidad: la perspectiva de estudiantes de primera año","Corica, Ana Rosa","Revista electrónica de investigación en educación en ciencias; 4(1); 10-27","Revista electrónica de investigación en educación en ciencias","Espanhol","2009","http://www.scielo.org.ar/scielo.php?script=sci_arttext&pid=S1850-66662009000200002&lang=pt" 
"S1850-66662009000200003-arg","Implicações de um software educacional na formação deProfessores","Veiga Carvalho, Janaina, de Alencar Carvalho, Carlos Vitor, Severianode Paiva, Ana Maria, Pereira de Sá, Ilydio","Revista electrónica de investigación en educación en ciencias; 4(1); 28-36","Revista electrónica de investigación en educación en ciencias","Português","2009","http://www.scielo.org.ar/scielo.php?script=sci_arttext&pid=S1850-66662009000200003&lang=pt" 
"S1850-66662009000200004-arg","Argumentación Matemática en los libros de la Enseñanza Secundaria: un análisis descriptivo de las características de los libros de texto y de la Argumentación","Llanos, Viviana Carolina, Otero, Maria Rita","Revista electrónica de investigación en educación en ciencias; 4(1); 37-50","Revista electrónica de investigación en educación en ciencias","Espanhol","2009","http://www.scielo.org.ar/scielo.php?script=sci_arttext&pid=S1850-66662009000200004&lang=pt" 
"S1850-66662009000200005-arg","Um Conto, uma Caixa e a Paleontologia: uma maneira lúdica de ensinar Ciências a alunos com Deficiência Auditiva","Trindade Dantas, Mário André, Torello de Mello, Fernanda","Revista electrónica de investigación en educación en ciencias; 4(1); 51-57","Revista electrónica de investigación en educación en ciencias","Português","2009","http://www.scielo.org.ar/scielo.php?script=sci_arttext&pid=S1850-66662009000200005&lang=pt" 
"S1850-66662009000200006-arg","Investigación y desarrollo de propuestas didácticas para la enseñanza de la Física en la Escuela Secundaria: Nociones Cuánticas","Otero, María Rita, Fanaro, María de los Ángeles, Arlego, Marcelo","Revista electrónica de investigación en educación en ciencias; 4(1); 58-74","Revista electrónica de investigación en educación en ciencias","Espanhol","2009","http://www.scielo.org.ar/scielo.php?script=sci_arttext&pid=S1850-66662009000200006&lang=pt" 
"S1851-75872009000100001-arg","Pan de Fécula de Mandioca con Leche. Comportamiento Físico al Adicionar un Emulsionante: Cassava Starch Bread With Milk. Physical Behavior Upon Ading an Emulsifier","Milde, Laura B., González, Karina G., Valle Urbina, Carolina, Rybak, Alexis","Revista de Ciencia y Tecnología; (11); 04-08","Revista de Ciencia y Tecnología","Espanhol","2009","http://www.scielo.org.ar/scielo.php?script=sci_arttext&pid=S1851-75872009000100001&lang=pt" 
"S1851-75872009000100002-arg","Aumento de la Velocidad de Convergencia del Sistema de Rachford-Rice: Improvement of The Rachford-Rice System Convergence Rate","Iglesias, Omar A., Petryla, Estanislao J.","Revista de Ciencia y Tecnología; (11); 09-13","Revista de Ciencia y Tecnología","Espanhol","2009","http://www.scielo.org.ar/scielo.php?script=sci_arttext&pid=S1851-75872009000100002&lang=pt" 
