"S0103-84782009000400011-scl","Sistema de previsão de ocorrência de requeima em clones de batata suscetíveis e resistentes","Bosco, Leosane Cristina, Heldwein, Arno Bernardo, Lucas, Dionéia Daiane Pitol, Trentin, Gustavo, Grimm, Edenir, Loose, Luis Henrique","Ciência Rural; 39(4); 1024-1031","Ciência Rural","Português","2009","http://www.scielo.br/scielo.php?script=sci_arttext&pid=S0103-84782009000400011&lang=pt" 
"S0103-84782009000400016-scl","Rendimento do milho em diferentes condições físicas de solo e quantidade de resíduo na ausência ou na presença de irrigação","Conte, Osmar, Levien, Renato, Trein, Carlor Ricardo, Debiasi, Henrique, Mazurana, Michael","Ciência Rural; 39(4); 1059-1066","Ciência Rural","Português","2009","http://www.scielo.br/scielo.php?script=sci_arttext&pid=S0103-84782009000400016&lang=pt" 
"S0103-84782009000400028-scl","Dispharynx nasuta (Nematoda: Acuariidae) em Guira guira e Crotophaga ani (Cuculiformes: Cuculidae) no Estado do Rio Grande do Sul, Brasil","Bartmann, Adriane, Amato, Suzana Bencke","Ciência Rural; 39(4); 1141-1147","Ciência Rural","Português","2009","http://www.scielo.br/scielo.php?script=sci_arttext&pid=S0103-84782009000400028&lang=pt" 
"S0103-84782009000400034-scl","Fluxo de tecido foliar em azevém anual manejado sob três intensidades de pastejo","Confortin, Anna Carolina Cerato, Quadros, Fernando Luiz Ferreira de, Rocha, Marta Gomes da, Kuinchtner, Bruno Castro, Glienke, Carine Lisete, Camargo, Daniele Gindri de, Machado, Juliana Medianeira","Ciência Rural; 39(4); 1182-1188","Ciência Rural","Português","2009","http://www.scielo.br/scielo.php?script=sci_arttext&pid=S0103-84782009000400034&lang=pt" 
"S0103-84782009000400020-scl","Regeneração in vitro de Parapiptadenia rigida","Kielse, Paula, Franco, Elci Terezinha Henz, Paranhos, Juçara Terezinha, Lima, Ana Paula Santos de","Ciência Rural; 39(4); 1088-1094","Ciência Rural","Português","2009","http://www.scielo.br/scielo.php?script=sci_arttext&pid=S0103-84782009000400020&lang=pt" 
"S0103-84782009000400022-scl","Azaperone e sua associação com xilazina ou dexmedetomidina em suínos","Flôres, Fabíola Niederauer, Tavares, Sabrina Geni, Moraes, Aury Nunes de, Oleskovicz, Nilson, Santos, Luiz César Pereira, Minsky, Vanessa, Keshen, Emília","Ciência Rural; 39(4); 1101-1107","Ciência Rural","Português","2009","http://www.scielo.br/scielo.php?script=sci_arttext&pid=S0103-84782009000400022&lang=pt" 
"S0102-311X2009000700006-spa","Malária e aspectos hematológicos em moradores da área de influência dos futuros reservatórios das hidrelétricas de Santo Antônio e Jirau, Rondônia, Brasil","Katsuragawa, Tony Hiroshi, Cunha, Roberto Penna de Almeida, Souza, Daniele Cristina Apoluceno de, Gil, Luiz Herman Soares, Cruz, Rafael Bastos, Silva, Alexandre de Almeida e, Tada, Mauro Shugiro, Silva, Luiz Hildebrando Pereira da","Cadernos de Saúde Pública; 25(7); 1486-1492","Cadernos de Saúde Pública","Português","2009","http://www.scielosp.org/scielo.php?script=sci_arttext&pid=S0102-311X2009000700006&lang=pt" 
"S0100-879X2009000700010-scl","Antinociceptive effects of the essential oil of Mentha x villosa leaf and its major constituent piperitenone oxide in mice","Sousa, P.J.C., Linard, C.F.B.M., Azevedo-Batista, D., Oliveira, A.C., Coelho-de-Souza, A.N., Leal-Cardoso, J.H.","Brazilian Journal of Medical and Biological Research; 42(7); 655-659","Brazilian Journal of Medical and Biological Research","Inglês","2009","http://www.scielo.br/scielo.php?script=sci_arttext&pid=S0100-879X2009000700010&lang=pt" 
"S0100-879X2009000700006-scl","Effect of melatonin and time of administration on irradiation-induced damage to rat testes","Take, G., Erdogan, D., Helvacioglu, F., Göktas, G., Ozbey, G., Uluoglu, C., Yücel, B., Guney, Y., Hicsonmez, A., Ozkan, S.","Brazilian Journal of Medical and Biological Research; 42(7); 621-628","Brazilian Journal of Medical and Biological Research","Inglês","2009","http://www.scielo.br/scielo.php?script=sci_arttext&pid=S0100-879X2009000700006&lang=pt" 
"S0100-879X2009000700013-scl","Method for automatic detection of wheezing in lung sounds","Riella, R.J., Nohama, P., Maia, J.M.","Brazilian Journal of Medical and Biological Research; 42(7); 674-684","Brazilian Journal of Medical and Biological Research","Inglês","2009","http://www.scielo.br/scielo.php?script=sci_arttext&pid=S0100-879X2009000700013&lang=pt" 
"S0100-879X2009000700012-scl","Estimation procedures affect the center of pressure frequency analysis","Vieira, T.M.M., Oliveira, L.F., Nadal, J.","Brazilian Journal of Medical and Biological Research; 42(7); 665-673","Brazilian Journal of Medical and Biological Research","Inglês","2009","http://www.scielo.br/scielo.php?script=sci_arttext&pid=S0100-879X2009000700012&lang=pt" 
"S0100-879X2009000700003-scl","Modulation of peritoneal macrophage activity by the saturation state of the fatty acid moiety of phosphatidylcholine","Grando, F.C.C., Felício, C.A., Twardowschy, A., Paula, F.M., Batista, V.G., Fernandes, L.C., Curi, R., Nishiyama, A.","Brazilian Journal of Medical and Biological Research; 42(7); 599-605","Brazilian Journal of Medical and Biological Research","Inglês","2009","http://www.scielo.br/scielo.php?script=sci_arttext&pid=S0100-879X2009000700003&lang=pt" 
"S0100-879X2009000700008-scl","A novel polar-based human face recognition computational model","Zana, Y., Mena-Chalco, J.P., Cesar Jr., R.M.","Brazilian Journal of Medical and Biological Research; 42(7); 637-646","Brazilian Journal of Medical and Biological Research","Inglês","2009","http://www.scielo.br/scielo.php?script=sci_arttext&pid=S0100-879X2009000700008&lang=pt" 
"S0100-879X2009000700007-scl","Human papillomavirus infection and its association with cervical dysplasia in Ecuadorian women attending a private cancer screening clinic","Brown, C.R., Leon, M.L., Muñoz, K., Fagioni, A., Amador, L.G., Frain, B., Tu, W., Qadadri, B., Brown, D.R.","Brazilian Journal of Medical and Biological Research; 42(7); 629-636","Brazilian Journal of Medical and Biological Research","Inglês","2009","http://www.scielo.br/scielo.php?script=sci_arttext&pid=S0100-879X2009000700007&lang=pt" 
"S0100-879X2009000700014-scl","Endogenous angiotensin II modulates nNOS expression in renovascular hypertension","Pereira, T.M.C., Balarini, C.M., Silva, I.V., Cabral, A.M., Vasquez, E.C., Meyrelles, S.S.","Brazilian Journal of Medical and Biological Research; 42(7); 685-691","Brazilian Journal of Medical and Biological Research","Inglês","2009","http://www.scielo.br/scielo.php?script=sci_arttext&pid=S0100-879X2009000700014&lang=pt" 
"S0100-879X2009000700002-scl","Comparison of blood neoangiogenesis and lymphatic vascularization in colorectal adenomas from patients with and without concomitant colorectal cancer","Moreira, L.R., Schenka, A.A., Latuf Filho, P., Lima, C.S.P., Trevisan, M.A.S., Vassallo, J.","Brazilian Journal of Medical and Biological Research; 42(7); 593-598","Brazilian Journal of Medical and Biological Research","Inglês","2009","http://www.scielo.br/scielo.php?script=sci_arttext&pid=S0100-879X2009000700002&lang=pt" 
"S0102-311X2009000700006-scl","Malária e aspectos hematológicos em moradores da área de influência dos futuros reservatórios das hidrelétricas de Santo Antônio e Jirau, Rondônia, Brasil","Katsuragawa, Tony Hiroshi, Cunha, Roberto Penna de Almeida, Souza, Daniele Cristina Apoluceno de, Gil, Luiz Herman Soares, Cruz, Rafael Bastos, Silva, Alexandre de Almeida e, Tada, Mauro Shugiro, Silva, Luiz Hildebrando Pereira da","Cadernos de Saúde Pública; 25(7); 1486-1492","Cadernos de Saúde Pública","Português","2009","http://www.scielo.br/scielo.php?script=sci_arttext&pid=S0102-311X2009000700006&lang=pt" 
"S0100-879X2009000700001-scl","Identifying reasons for failure in biomedical research and publishing","Bousfield, D.","Brazilian Journal of Medical and Biological Research; 42(7); 589-592","Brazilian Journal of Medical and Biological Research","Inglês","2009","http://www.scielo.br/scielo.php?script=sci_arttext&pid=S0100-879X2009000700001&lang=pt" 
"S0100-879X2009000700005-scl","Gentamicin-induced preconditioning of proximal tubular LLC-PK1 cells stimulates nitric oxide production but not the synthesis of heat shock protein","Pessoa, E.A., Convento, M.B., Silva, R.G., Oliveira, A.S., Borges, F.T., Schor, N.","Brazilian Journal of Medical and Biological Research; 42(7); 614-620","Brazilian Journal of Medical and Biological Research","Inglês","2009","http://www.scielo.br/scielo.php?script=sci_arttext&pid=S0100-879X2009000700005&lang=pt" 
"S0100-879X2009000700004-scl","Effect of postnatal malnutrition on hyperoxia-induced newborn lung development","Mataloun, M.M.G.B., Leone, C.R., Mascaretti, R.S., Dohlnikoff, M., Rebello, C.M.","Brazilian Journal of Medical and Biological Research; 42(7); 606-613","Brazilian Journal of Medical and Biological Research","Inglês","2009","http://www.scielo.br/scielo.php?script=sci_arttext&pid=S0100-879X2009000700004&lang=pt" 
"S0100-879X2009000700009-scl","How auditory temporal processing deficits relate to dyslexia","Murphy, C.F.B., Schochat, E.","Brazilian Journal of Medical and Biological Research; 42(7); 647-654","Brazilian Journal of Medical and Biological Research","Inglês","2009","http://www.scielo.br/scielo.php?script=sci_arttext&pid=S0100-879X2009000700009&lang=pt" 
"S0100-879X2009000700011-scl","The effect of 677C&gt;T and 1298A&gt;C MTHFR polymorphisms on sulfasalazine treatment outcome in rheumatoid arthritis","Pawlik, A., Kurzawski, M., Gawronska-Szklarz, B., Gornik, W., Dziedziejko, V., Safranow, K., Juzyszyn, Z., Drozdzik, M.","Brazilian Journal of Medical and Biological Research; 42(7); 660-664","Brazilian Journal of Medical and Biological Research","Inglês","2009","http://www.scielo.br/scielo.php?script=sci_arttext&pid=S0100-879X2009000700011&lang=pt" 
"S0102-311X2009000700010-spa","Contribuições da Análise da Conversa para os estudos sobre o cuidado em saúde: reflexões a partir das atribuições feitas por pacientes","Ostermann, Ana Cristina, Souza, Joseane de","Cadernos de Saúde Pública; 25(7); 1521-1533","Cadernos de Saúde Pública","Português","2009","http://www.scielosp.org/scielo.php?script=sci_arttext&pid=S0102-311X2009000700010&lang=pt" 
"S0102-311X2009000700018-spa","User satisfaction with pharmacy services in the Brazilian National STD/AIDS Program: validity and reliability issues","Azeredo, Thiago Botelho, Oliveira, Maria Auxiliadora, Luiza, Vera Lucia, Esher, Ângela, Campos, Mônica Rodrigues","Cadernos de Saúde Pública; 25(7); 1597-1609","Cadernos de Saúde Pública","Inglês","2009","http://www.scielosp.org/scielo.php?script=sci_arttext&pid=S0102-311X2009000700018&lang=pt" 
"S0123-14722009000200008-col","Contabilidad para la dignidad humana: Entrevista con Francisco de Roux-Rengifo, S.J.","Donato Valdés, Nathalie","Cuadernos de Contabilidad; 10(27); 431-438","Cuadernos de Contabilidad","Espanhol","2009","http://www.scielo.org.co/scielo.php?script=sci_arttext&pid=S0123-14722009000200008&lang=pt" 
"S0123-14722009000200004-col","Revelación y divulgación de la información financiera y no financiera on-line de las 500 empresas más representativas en Colombia","Gómez-Meneses, Fabio Enrique, Católico-Segura, Diego Fernando","Cuadernos de Contabilidad; 10(27); 269-318","Cuadernos de Contabilidad","Espanhol","2009","http://www.scielo.org.co/scielo.php?script=sci_arttext&pid=S0123-14722009000200004&lang=pt" 
"S0123-14722009000200005-col","Graduación de empresas: de la formación a la habilitación","Celaya-Figueroa, Roberto, Landazuri-Aguilera, Yara, Álvarez-Medina, María Trinidad, Aceves-López, Jesús Nereida","Cuadernos de Contabilidad; 10(27); 319-339","Cuadernos de Contabilidad","Espanhol","2009","http://www.scielo.org.co/scielo.php?script=sci_arttext&pid=S0123-14722009000200005&lang=pt" 
"S0123-14722009000200006-col","Mecanismos de contabilidad para prevenir y detectar el lavado de activos en Colombia","Bareño-Dueñas, Sandra Milena","Cuadernos de Contabilidad; 10(27); 341-357","Cuadernos de Contabilidad","Espanhol","2009","http://www.scielo.org.co/scielo.php?script=sci_arttext&pid=S0123-14722009000200006&lang=pt" 
"S0123-14722009000200007-col","Comparación entre la Norma Internacional de Información Financiera para Pequeñas y Medianas Entidades (NIIF para PYME) y la normatividad colombiana","Salazar-Baquero, Édgar Emilio","Cuadernos de Contabilidad; 10(27); 361-430","Cuadernos de Contabilidad","Espanhol","2009","http://www.scielo.org.co/scielo.php?script=sci_arttext&pid=S0123-14722009000200007&lang=pt" 
"S0123-14722009000200001-col","Producción intelectual e interdisciplinariedad","Grajales-Sánchez, Paula Andrea","Cuadernos de Contabilidad; 10(27); 205-208","Cuadernos de Contabilidad","Espanhol","2009","http://www.scielo.org.co/scielo.php?script=sci_arttext&pid=S0123-14722009000200001&lang=pt" 
"S0123-14722009000200002-col","La educación contable en el contexto anglosajón: una mirada a los años de construcción de comunidad*","León-Paime, Edison Fredy","Cuadernos de Contabilidad; 10(27); 219-245","Cuadernos de Contabilidad","Espanhol","2009","http://www.scielo.org.co/scielo.php?script=sci_arttext&pid=S0123-14722009000200002&lang=pt" 
"S0123-14722009000200003-col","Los sistemas de información contable en la administración estratégica organizacional","Rueda-Delgado, Gabriel, Arias-Bello, Martha Liliana","Cuadernos de Contabilidad; 10(27); 247-268","Cuadernos de Contabilidad","Espanhol","2009","http://www.scielo.org.co/scielo.php?script=sci_arttext&pid=S0123-14722009000200003&lang=pt" 
"S0122-14502009000200008-col","¿Saberes para el desarrollo de lo rural o de los sujetos rurales? (1970-2007)","Macêdo de Alencar, Cristina María","Cuadernos de Desarrollo Rural; 6(63); 163-185","Cuadernos de Desarrollo Rural","Espanhol","2009","http://www.scielo.org.co/scielo.php?script=sci_arttext&pid=S0122-14502009000200008&lang=pt" 
"S0122-14502009000200005-col","Formalización de un modelo de pago por servicios ambientales a nivel de cuenca y algunas de sus incidencias sobre la pobreza rural","Tapasco, Jeimar","Cuadernos de Desarrollo Rural; 6(63); 87-105","Cuadernos de Desarrollo Rural","Espanhol","2009","http://www.scielo.org.co/scielo.php?script=sci_arttext&pid=S0122-14502009000200005&lang=pt" 
"S0122-14502009000200004-col","Los reflejos de las agroindustrias familiares al desarrollo de los espacios rurales en el sur del Brasil","Wesz Junior, Valdemar João, Lovis Trentin, Iran Carlos, Filippi, Eduardo Ernesto","Cuadernos de Desarrollo Rural; 6(63); 59-85","Cuadernos de Desarrollo Rural","Espanhol","2009","http://www.scielo.org.co/scielo.php?script=sci_arttext&pid=S0122-14502009000200004&lang=pt" 
"S0122-14502009000200007-col","Relatos y contrarrelatos de los actores subalternos: el campesino organizado en la construcción de narrativas democráticas en Colombia","Mesías García, Liliana","Cuadernos de Desarrollo Rural; 6(63); 139-162","Cuadernos de Desarrollo Rural","Espanhol","2009","http://www.scielo.org.co/scielo.php?script=sci_arttext&pid=S0122-14502009000200007&lang=pt" 
"S0122-14502009000200006-col","Erradicación de cultivos ilícitos y desplazamiento forzado en el parque natural Sierra de la Macarena","Tobón Quintero, Gabriel John, Restrepo, Gloria Inés","Cuadernos de Desarrollo Rural; 6(63); 107-138","Cuadernos de Desarrollo Rural","Espanhol","2009","http://www.scielo.org.co/scielo.php?script=sci_arttext&pid=S0122-14502009000200006&lang=pt" 
"S0122-14502009000200001-col","Presentación","","Cuadernos de Desarrollo Rural; 6(63); 7-9","Cuadernos de Desarrollo Rural","Espanhol","2009","http://www.scielo.org.co/scielo.php?script=sci_arttext&pid=S0122-14502009000200001&lang=pt" 
"S0122-14502009000200003-col","Caña de azúcar y aguardiente en el Estado soberano de Bolívar, 1857-1886","Flórez Bolívar, Roicer Alberto","Cuadernos de Desarrollo Rural; 6(63); 35-57","Cuadernos de Desarrollo Rural","Espanhol","2009","http://www.scielo.org.co/scielo.php?script=sci_arttext&pid=S0122-14502009000200003&lang=pt" 
"S0122-14502009000200002-col","Territorios en mutación Crisis cafetera, crisis del café","Nates Cruz, Béatriz, Velásquez López, Paula","Cuadernos de Desarrollo Rural; 6(63); 11-33","Cuadernos de Desarrollo Rural","Espanhol","2009","http://www.scielo.org.co/scielo.php?script=sci_arttext&pid=S0122-14502009000200002&lang=pt" 
"S0718-33992009000100001-chl","Las prohibiciones de utilización de pruebas en el proceso penal alemán: fundamentación teórica y sistematización","Ambos, Kai","Política criminal; 4(7); 1-56","Política criminal","Espanhol","2009","http://www.scielo.cl/scielo.php?script=sci_arttext&pid=S0718-33992009000100001&lang=pt" 
"S0718-33992009000100002-chl","Modificaciones en la regulación del delito de giro fraudulento de cheque: análisis desde la teoría de la sucesión de leyes","Oliver Calderón, Guillermo","Política criminal; 4(7); 57-86","Política criminal","Espanhol","2009","http://www.scielo.cl/scielo.php?script=sci_arttext&pid=S0718-33992009000100002&lang=pt" 
"S0718-33992009000100003-chl","Una revisión crítica de los habituales conceptos sobre el íter criminis en los delitos de robo y hurto","Yáñez Arriagada, Rodrigo Alejandro","Política criminal; 4(7); 87-124","Política criminal","Espanhol","2009","http://www.scielo.cl/scielo.php?script=sci_arttext&pid=S0718-33992009000100003&lang=pt" 
"S0718-33992009000100004-chl","(Ir)retroactividad de las modificaciones a la norma complementaria de una Ley Penal en Blanco","Baldomino Díaz, Raúl A","Política criminal; 4(7); 125-150","Política criminal","Espanhol","2009","http://www.scielo.cl/scielo.php?script=sci_arttext&pid=S0718-33992009000100004&lang=pt" 
"S0718-33992009000100005-chl","Fraude fiscal y lavado de capitales","Fernández Cruz, José Ángel","Política criminal; 4(7); 151-170","Política criminal","Espanhol","2009","http://www.scielo.cl/scielo.php?script=sci_arttext&pid=S0718-33992009000100005&lang=pt" 
"S0718-33992009000100006-chl","La prevención de la delincuencia callejera mediante videocámaras: Regulación jurídica y eficacia","Díez Ripollés, José Luis, Cerezo Domínguez, Ana Isabel","Política criminal; 4(7); 171-196","Política criminal","Espanhol","2009","http://www.scielo.cl/scielo.php?script=sci_arttext&pid=S0718-33992009000100006&lang=pt" 
"S0718-33992009000100007-chl","Información en el mercado de valores y tutela del inversor","Perrone, Andrea","Política criminal; 4(7); 197-229","Política criminal","Espanhol","2009","http://www.scielo.cl/scielo.php?script=sci_arttext&pid=S0718-33992009000100007&lang=pt" 
"S0718-33992009000100008-chl","¿Por qué deberíamos conocer más y no menos?: Respuesta a A.v. Weezel","Matus A, Jean Pierre","Política criminal; 4(7); 230-234","Política criminal","Espanhol","2009","http://www.scielo.cl/scielo.php?script=sci_arttext&pid=S0718-33992009000100008&lang=pt" 
"S0718-33992009000100009-chl","Reflexiones sobre Política Criminal: Intervención del Profesor Alfredo Etcheberry en la Ceremonia de su Investidura como Doctor Honoris Causa por la Universidad de Talca","Etcheberry Osthustegi, Alfredo","Política criminal; 4(7); 235-249","Política criminal","Espanhol","2009","http://www.scielo.cl/scielo.php?script=sci_arttext&pid=S0718-33992009000100009&lang=pt" 
"S0718-33992009000100010-chl","","Muñoz Conde, Francisco","Política criminal; 4(7); 250-265","Política criminal","Espanhol","2009","http://www.scielo.cl/scielo.php?script=sci_arttext&pid=S0718-33992009000100010&lang=pt" 
"S0718-33992009000100011-chl","","Carnevali R, Raúl","Política criminal; 4(7); 266-269","Política criminal","Espanhol","2009","http://www.scielo.cl/scielo.php?script=sci_arttext&pid=S0718-33992009000100011&lang=pt" 
"S0718-33992009000100012-chl","","Londoño M, Fernando","Política criminal; 4(7); 270-274","Política criminal","Espanhol","2009","http://www.scielo.cl/scielo.php?script=sci_arttext&pid=S0718-33992009000100012&lang=pt" 
"S0718-33992009000100013-chl","Revista de Derecho Penal, n° 25 (2008)","Maldonado Fuentes, Francisco","Política criminal; 4(7); 275-277","Política criminal","Espanhol","2009","http://www.scielo.cl/scielo.php?script=sci_arttext&pid=S0718-33992009000100013&lang=pt" 
"S0718-33992009000100014-chl","Anuario de Derecho Penal y Ciencias Penales, Vol. LX (2007)","Maldonado Fuentes, Francisco","Política criminal; 4(7); 278-280","Política criminal","Espanhol","2009","http://www.scielo.cl/scielo.php?script=sci_arttext&pid=S0718-33992009000100014&lang=pt" 
"S0718-33992009000100015-chl","Revista Penal, N° 23, Enero 2009","Alarcón Corsi, Humberto","Política criminal; 4(7); 281-284","Política criminal","Espanhol","2009","http://www.scielo.cl/scielo.php?script=sci_arttext&pid=S0718-33992009000100015&lang=pt" 
"S1794-44492009000200008-col","Prospectivas para el año 2012 de la televisión de interés público de producción local en Medellín - Colombia","Velásquez Hurtado, Omar Mauricio, Castaño Echeverri, Alejandra","Revista Lasallista de Investigación; 6(2); 54-63","Revista Lasallista de Investigación","Espanhol","2009","http://www.scielo.org.co/scielo.php?script=sci_arttext&pid=S1794-44492009000200008&lang=pt" 
"S1794-44492009000200009-col","Cría de ulomoides dermestoides, coleoptera: tenebrionidae, en tres tipos de sustrato","Garcés Molina, Adelaida María, Arango Gutiérrez, Gloria Patricia, Gómez Fernández, Tomás","Revista Lasallista de Investigación; 6(2); 64-68","Revista Lasallista de Investigación","Espanhol","2009","http://www.scielo.org.co/scielo.php?script=sci_arttext&pid=S1794-44492009000200009&lang=pt" 
"S1794-44492009000200001-col","Reconocimiento a los Investigadores de la Corporación Universitaria Lasallista","Castrillón Agudelo, María Consuelo","Revista Lasallista de Investigación; 6(2); 5-6","Revista Lasallista de Investigación","Espanhol","2009","http://www.scielo.org.co/scielo.php?script=sci_arttext&pid=S1794-44492009000200001&lang=pt" 
"S1794-44492009000200002-col","Efectos de la primera alimentación en larvas de Rhamdia sobre la ganancia de peso y longitud","Ruales, Carlos David, Zapata Berruecos, Beatriz, Vásquez Torres, Walter","Revista Lasallista de Investigación; 6(2); 7-13","Revista Lasallista de Investigación","Espanhol","2009","http://www.scielo.org.co/scielo.php?script=sci_arttext&pid=S1794-44492009000200002&lang=pt" 
"S1794-44492009000200004-col","Evaluación de la técnica de bolsa móvil de nylon para determinar la digestibilidad de proteína cruda en cerdos","Palacios García, Juliana, Echeverry Zuluaga, José Julián, Parra Suescún, Jaime","Revista Lasallista de Investigación; 6(2); 24-30","Revista Lasallista de Investigación","Espanhol","2009","http://www.scielo.org.co/scielo.php?script=sci_arttext&pid=S1794-44492009000200004&lang=pt" 
"S1794-44492009000200005-col","Remoción del colorante azoico amaranto de soluciones acuosas mediante electrocoagulación","Arango Ruíz, Álvaro, Garcés Giraldo, Luis Fernando","Revista Lasallista de Investigación; 6(2); 31-38","Revista Lasallista de Investigación","Espanhol","2009","http://www.scielo.org.co/scielo.php?script=sci_arttext&pid=S1794-44492009000200005&lang=pt" 
"S1794-44492009000200006-col","Identificación de polimorfismos del gen de la Kappa caseína bovina: Nariño-Colombia","Solarte Portilla, Carlos Eugenio, Rosero Galindo, Carol Yovanna, Cárdenas Henao, Heiber, Burgos Paz, William Orlando, Eraso Cabrera, Johanna Melissa, Zambrano Burbano, Gema Lucía","Revista Lasallista de Investigación; 6(2); 39-45","Revista Lasallista de Investigación","Espanhol","2009","http://www.scielo.org.co/scielo.php?script=sci_arttext&pid=S1794-44492009000200006&lang=pt" 
"S1794-44492009000200007-col","Mineralización del colorante Tartrazina mediante un proceso de oxidación avanzada","Arroyave Rojas, Joan Amir, Garcés Giraldo, Luis Fernando, Arango Ruíz, Álvaro","Revista Lasallista de Investigación; 6(2); 46-53","Revista Lasallista de Investigación","Espanhol","2009","http://www.scielo.org.co/scielo.php?script=sci_arttext&pid=S1794-44492009000200007&lang=pt" 
"S1794-44492009000200003-col","Parámetros genéticos para el control del peso al nacimiento en bovinos de carne: cruzados en el trópico bajo colombiano","Bolívar Vergara, Diana María, Ramírez Toro, Edison Julián, Vergara Garay, Oscar David, Restrepo, Luis Fernando, Arboleda Zapata, Elkin Mauricio, Cerón-Muñoz, Mario Fernando","Revista Lasallista de Investigación; 6(2); 14-23","Revista Lasallista de Investigación","Espanhol","2009","http://www.scielo.org.co/scielo.php?script=sci_arttext&pid=S1794-44492009000200003&lang=pt" 
"S1794-44492009000200010-col","Fellini, o el sueño de ser Picasso","Arroyave Álvarez, Orlando","Revista Lasallista de Investigación; 6(2); 69-76","Revista Lasallista de Investigación","Espanhol","2009","http://www.scielo.org.co/scielo.php?script=sci_arttext&pid=S1794-44492009000200010&lang=pt" 
"S0120-36492009000200008-col","LA SUBSIDIARIEDAD EN EL EVANGELIO DE JUAN","SARASA G., LUIS GUILLERMO","Theologica Xaveriana; 59(168); 471-489","Theologica Xaveriana","Espanhol","2009","http://www.scielo.org.co/scielo.php?script=sci_arttext&pid=S0120-36492009000200008&lang=pt" 
"S0120-36492009000200001-col","EDITORIAL","Noratto Gutiérrez, José Alfredo","Theologica Xaveriana; 59(168); 305-307","Theologica Xaveriana","Espanhol","2009","http://www.scielo.org.co/scielo.php?script=sci_arttext&pid=S0120-36492009000200001&lang=pt" 
"S0120-36492009000200003-col","LA IGNORANCIA EN EL EVANGELIO DE MARCOS UN ACERCAMIENTO DESDE LA LITERATURA DE QUMRÁN A LA TEORÍA DE LAS PARÁBOLAS","CARBULLANCA N, CÉSAR","Theologica Xaveriana; 59(168); 331-358","Theologica Xaveriana","Espanhol","2009","http://www.scielo.org.co/scielo.php?script=sci_arttext&pid=S0120-36492009000200003&lang=pt" 
