"S1665-11462008000600013-mex","El papel actual del tratamiento quirúrgico. ¿Puede la cirugía curar enfermedades metabólicas?","López, Federico, Herrera, Miguel F.","Boletín médico del Hospital Infantil de México; 65(6); 568-578","Boletín médico del Hospital Infantil de México","Espanhol","2008","http://www.scielo.org.mx/scielo.php?script=sci_arttext&pid=S1665-11462008000600013&lang=pt" 
"S1665-11462008000600014-mex","Los trastornos de la conducta alimentaria","Méndez, Juan Pablo, Vázquez-Velazquez, Verónica, García-García, Eduardo","Boletín médico del Hospital Infantil de México; 65(6); 579-592","Boletín médico del Hospital Infantil de México","Espanhol","2008","http://www.scielo.org.mx/scielo.php?script=sci_arttext&pid=S1665-11462008000600014&lang=pt" 
"S1665-11462008000600015-mex","Esquemas de alimentación saludable en niños durante sus diferentes etapas de la vida: Parte I. Primeros dos años de vida","Vásquez-Garibay, Edgar M., Romero-Velarde, Enrique","Boletín médico del Hospital Infantil de México; 65(6); 593-604","Boletín médico del Hospital Infantil de México","Espanhol","2008","http://www.scielo.org.mx/scielo.php?script=sci_arttext&pid=S1665-11462008000600015&lang=pt" 
"S1665-11462008000600016-mex","Esquemas de alimentación saludable en niños durante sus diferentes etapas de la vida: Parte II. Preescolares, escolares y adolescentes","Vásquez-Garibay, Edgar M., Romero-Velarde, Enrique","Boletín médico del Hospital Infantil de México; 65(6); 605-615","Boletín médico del Hospital Infantil de México","Espanhol","2008","http://www.scielo.org.mx/scielo.php?script=sci_arttext&pid=S1665-11462008000600016&lang=pt" 
"S1665-11462008000600017-mex","Acciones, programas, proyectos y políticas para disminuir el sedentarismo y promover el ejercicio en los niños","Cornejo-Barrera, Judith, Llanas-Rodríguez, José Daniel, Alcázar-Castañeda, Carlos","Boletín médico del Hospital Infantil de México; 65(6); 616-625","Boletín médico del Hospital Infantil de México","Espanhol","2008","http://www.scielo.org.mx/scielo.php?script=sci_arttext&pid=S1665-11462008000600017&lang=pt" 
"S1665-11462008000600018-mex","La escuela primaria como ámbito de oportunidad para prevenir el sobrepeso y la obesidad en los niños","Flores-Huerta, Samuel, Klünder-Klünder, Miguel, Medina-Bravo, Patricia","Boletín médico del Hospital Infantil de México; 65(6); 626-638","Boletín médico del Hospital Infantil de México","Espanhol","2008","http://www.scielo.org.mx/scielo.php?script=sci_arttext&pid=S1665-11462008000600018&lang=pt" 
"S1665-11462008000600019-mex","¿Es la obesidad un problema médico individual y social? Políticas públicas que se requieren para su prevención","Barrientos-Pérez, Margarita, Flores-Huerta, Samuel","Boletín médico del Hospital Infantil de México; 65(6); 639-651","Boletín médico del Hospital Infantil de México","Espanhol","2008","http://www.scielo.org.mx/scielo.php?script=sci_arttext&pid=S1665-11462008000600019&lang=pt" 
"S1665-11462008000600002-mex","La convocatoria del Hospital Infantil de México Federico Gómez para discutir el problema de sobrepeso y obesidad y plantear alternativas de solución","Santos-Preciado, José Ignacio","Boletín médico del Hospital Infantil de México; 65(6); 419-420","Boletín médico del Hospital Infantil de México","Espanhol","2008","http://www.scielo.org.mx/scielo.php?script=sci_arttext&pid=S1665-11462008000600002&lang=pt" 
"S1665-11462008000600003-mex","Epidemiología y genética del sobrepeso y la obesidad: Perspectiva de México en el contexto mundial","López-Alarcón, Mardia G., Rodríguez-Cruz, Maricela","Boletín médico del Hospital Infantil de México; 65(6); 421-430","Boletín médico del Hospital Infantil de México","Espanhol","2008","http://www.scielo.org.mx/scielo.php?script=sci_arttext&pid=S1665-11462008000600003&lang=pt" 
"S1665-11462008000600004-mex","La alimentación en la evolución del hombre: su relación con el riesgo de enfermedades crónico degenerativas","Arroyo, Pedro","Boletín médico del Hospital Infantil de México; 65(6); 431-440","Boletín médico del Hospital Infantil de México","Espanhol","2008","http://www.scielo.org.mx/scielo.php?script=sci_arttext&pid=S1665-11462008000600004&lang=pt" 
"S1665-11462008000600005-mex","Genética de la obesidad","Tejero, María Elizabeth","Boletín médico del Hospital Infantil de México; 65(6); 441-450","Boletín médico del Hospital Infantil de México","Espanhol","2008","http://www.scielo.org.mx/scielo.php?script=sci_arttext&pid=S1665-11462008000600005&lang=pt" 
"S1665-11462008000600006-mex","Impacto de la programación fetal y la nutrición durante el primer año de vida en el desarrollo de obesidad y sus complicaciones","Garibay-Nieto, Nayely, Miranda-Lora, América Liliana","Boletín médico del Hospital Infantil de México; 65(6); 451-467","Boletín médico del Hospital Infantil de México","Espanhol","2008","http://www.scielo.org.mx/scielo.php?script=sci_arttext&pid=S1665-11462008000600006&lang=pt" 
"S1665-11462008000600007-mex","Reguladores neuroendocrinos y gastrointestinales del apetito y la saciedad","Calzada-León, Raúl, Altamirano-Bustamante, Nelly, Ruiz-Reyes, María de la Luz","Boletín médico del Hospital Infantil de México; 65(6); 468-487","Boletín médico del Hospital Infantil de México","Espanhol","2008","http://www.scielo.org.mx/scielo.php?script=sci_arttext&pid=S1665-11462008000600007&lang=pt" 
"S1665-11462008000600008-mex","Controversias en el diagnóstico del síndrome metabólico en poblaciones pediátricas","Arjona-Villicaña, Ruy David, Gómez-Díaz, Rita Angélica, Aguilar-Salinas, Carlos Alberto","Boletín médico del Hospital Infantil de México; 65(6); 488-501","Boletín médico del Hospital Infantil de México","Espanhol","2008","http://www.scielo.org.mx/scielo.php?script=sci_arttext&pid=S1665-11462008000600008&lang=pt" 
"S1665-11462008000600009-mex","Indicadores antropométricos para evaluar sobrepeso y obesidad en pediatría","Kaufer-Horwitz, Martha, Toussaint, Georgina","Boletín médico del Hospital Infantil de México; 65(6); 502-518","Boletín médico del Hospital Infantil de México","Espanhol","2008","http://www.scielo.org.mx/scielo.php?script=sci_arttext&pid=S1665-11462008000600009&lang=pt" 
"S0465-546X2008000400009-esp","Protección ocular: importancia y uso","Serrano Ramos, Cristina, Jiménez Bajo, Lourdes, Jerez Fidalgo, María, O´Connor Pérez, Silvia, Bardón Fernández-Pacheco, Ignacio, Caso Pita, Covadonga","Medicina y Seguridad del Trabajo; 54(213); 81-86","Medicina y Seguridad del Trabajo","Espanhol","2008","http://scielo.isciii.es/scielo.php?script=sci_arttext&pid=S0465-546X2008000400009&lang=pt" 
"S0465-546X2008000400005-esp","Exposición a contaminantes ambientales y patología respiratoria","González Domínguez, Mª Eugenia, Rueda Ygueravide, Mª Dolores, Gutiérrez Fernández, Diego, Gómez Gutiérrez, Juan Manuel, León Jiménez, Antonio, Pérez Álvarez, José","Medicina y Seguridad del Trabajo; 54(213); 41-46","Medicina y Seguridad del Trabajo","Espanhol","2008","http://scielo.isciii.es/scielo.php?script=sci_arttext&pid=S0465-546X2008000400005&lang=pt" 
"S0254-07702008000400008-ven","Desempeño de recubrimientos base cinc en un ambiente tropical de elevada agresividad","Salas, Orlando","Revista Técnica de la Facultad de Ingeniería Universidad del Zulia; 31(Especial); 50-60","Revista Técnica de la Facultad de Ingeniería Universidad del Zulia","Espanhol","2008","http://www.scielo.org.ve/scielo.php?script=sci_arttext&pid=S0254-07702008000400008&lang=pt" 
"S1853-31752008000100001-arg","Boedo y Florida en las páginas de Los Pensadores","Ferreira de Cassone, Florencia","Cuyo; 25(); 11-74","Cuyo","Espanhol","2008","http://www.scielo.org.ar/scielo.php?script=sci_arttext&pid=S1853-31752008000100001&lang=pt" 
"S1853-31752008000100002-arg","Reforma social y reforma jurídica: Proyectos para la Argentina moderna de un intelectual hispanoamericano, el Dr. Serafín Álvarez","Hayes, Graciela","Cuyo; 25(); 75-100","Cuyo","Espanhol","2008","http://www.scielo.org.ar/scielo.php?script=sci_arttext&pid=S1853-31752008000100002&lang=pt" 
"S1853-31752008000100003-arg","La cuestión del método para un &quot;pensamiento latinoamericano&quot; en Arturo Roig","Vignale, Silvana","Cuyo; 25(); 101-118","Cuyo","Espanhol","2008","http://www.scielo.org.ar/scielo.php?script=sci_arttext&pid=S1853-31752008000100003&lang=pt" 
"S1853-31752008000100004-arg","Abolición, independencia y confederación: Los escritos de Ramón Emeterio Betances, &quot;El Antillano&quot;","Arpini, Adriana María","Cuyo; 25(); 119-144","Cuyo","Espanhol","2008","http://www.scielo.org.ar/scielo.php?script=sci_arttext&pid=S1853-31752008000100004&lang=pt" 
"S1853-31752008000100005-arg","La biología contra la democracia: Eugenesia, herencia y prejuicio en Argentina. 1880-1940","Solari, Herminia","Cuyo; 25(); 147-149","Cuyo","Espanhol","2008","http://www.scielo.org.ar/scielo.php?script=sci_arttext&pid=S1853-31752008000100005&lang=pt" 
"S1853-31752008000100006-arg","Una presencia ausente: Ensayos y fragmentos inéditos","Jalif de Bertranou, Clara Alicia","Cuyo; 25(); 151-152","Cuyo","Espanhol","2008","http://www.scielo.org.ar/scielo.php?script=sci_arttext&pid=S1853-31752008000100006&lang=pt" 
"S1851-16862008000100030-arg","Adaptación y validación del inventario de respuestas de afrontamiento de moos (CRI-A) para adultos","Mikulic, Isabel María, Crespi, Melina Claudia","Anuario de investigaciones; 15(); -","Anuario de investigaciones","Espanhol","2008","http://www.scielo.org.ar/scielo.php?script=sci_arttext&pid=S1851-16862008000100030&lang=pt" 
"S1851-16862008000100031-arg","Inicio temprano del consumo de alcohol: ¿cómo medirlo?","Pedrón, Valeria T.","Anuario de investigaciones; 15(); -","Anuario de investigaciones","Espanhol","2008","http://www.scielo.org.ar/scielo.php?script=sci_arttext&pid=S1851-16862008000100031&lang=pt" 
"S1851-16862008000100032-arg","Devenir de un cambio: del patronato de menores a la protección integral de los derechos de niños, niñas y adolescentes","De la Iglesia, Matilde, Velázquez, María Eugenia, Piekarz, Walter","Anuario de investigaciones; 15(); -","Anuario de investigaciones","Espanhol","2008","http://www.scielo.org.ar/scielo.php?script=sci_arttext&pid=S1851-16862008000100032&lang=pt" 
"S1851-16862008000100033-arg","Generación de inferencias emocionales durante la lectura de textos narrativos","Barreyro, Juan Pablo, Molinari Marotto, Carlos, Yomha Cevasco, Jazmín, Duarte, Dionisio Aníbal","Anuario de investigaciones; 15(); -","Anuario de investigaciones","Espanhol","2008","http://www.scielo.org.ar/scielo.php?script=sci_arttext&pid=S1851-16862008000100033&lang=pt" 
"S1851-16862008000100034-arg","Relación entre el feedback emocional, feedback cognitivo-verbal y percepción emocional en la variante frontal de demencia frontotemporal resultados preliminares","Calodolce, Florencia, Politis, Daniel, Moyano, Paula","Anuario de investigaciones; 15(); -","Anuario de investigaciones","Espanhol","2008","http://www.scielo.org.ar/scielo.php?script=sci_arttext&pid=S1851-16862008000100034&lang=pt" 
"S1851-16862008000100035-arg","Perfiles aptitudinales, estilos de pensamiento y rendimiento académico","González, Gustavo, Castro Solano, Alejandro, González, Federico","Anuario de investigaciones; 15(); -","Anuario de investigaciones","Espanhol","2008","http://www.scielo.org.ar/scielo.php?script=sci_arttext&pid=S1851-16862008000100035&lang=pt" 
"S1851-16862008000100036-arg","Asociación entre desempeño en razonamiento condicional y rendimiento académico","Nicolai, Lidia I., Attorresi, Horacio F.","Anuario de investigaciones; 15(); -","Anuario de investigaciones","Espanhol","2008","http://www.scielo.org.ar/scielo.php?script=sci_arttext&pid=S1851-16862008000100036&lang=pt" 
"S1851-16862008000100037-arg","El estatuto del obstáculo","Delgado, Osvaldo Leonardo","Anuario de investigaciones; 15(); -","Anuario de investigaciones","Espanhol","2008","http://www.scielo.org.ar/scielo.php?script=sci_arttext&pid=S1851-16862008000100037&lang=pt" 
"S1851-16862008000100038-arg","Freud y la pregunta por la eficacia: El uso del caso en el historial del hombre de los lobos","Iuale, Lujan, Rubistein, Adriana","Anuario de investigaciones; 15(); -","Anuario de investigaciones","Espanhol","2008","http://www.scielo.org.ar/scielo.php?script=sci_arttext&pid=S1851-16862008000100038&lang=pt" 
"S1851-16862008000100039-arg","Versiones psicoanalíticas de la histeria","Mazzuca, Roberto, Canónico, Eduardo, Esseiva, María de los Ángeles, Mazzuca, Santiago","Anuario de investigaciones; 15(); -","Anuario de investigaciones","Espanhol","2008","http://www.scielo.org.ar/scielo.php?script=sci_arttext&pid=S1851-16862008000100039&lang=pt" 
"S1851-16862008000100040-arg","La implicación del sujeto del inconsciente en el síntoma","Mordoh, Edmundo, Gurevicz, Mónica, Lombardi, Gabriel","Anuario de investigaciones; 15(); -","Anuario de investigaciones","Espanhol","2008","http://www.scielo.org.ar/scielo.php?script=sci_arttext&pid=S1851-16862008000100040&lang=pt" 
"S1851-16862008000100041-arg","El concepto de locura en la obra de Jacques Lacan","Muñoz, Pablo D.","Anuario de investigaciones; 15(); -","Anuario de investigaciones","Espanhol","2008","http://www.scielo.org.ar/scielo.php?script=sci_arttext&pid=S1851-16862008000100041&lang=pt" 
"S1851-16862008000100042-arg","Regulación afectiva diádica y autorregulación en los infantes en el primer año de vida","R. de Schejtman, Clara, Vardy, Inés","Anuario de investigaciones; 15(); -","Anuario de investigaciones","Espanhol","2008","http://www.scielo.org.ar/scielo.php?script=sci_arttext&pid=S1851-16862008000100042&lang=pt" 
"S1851-16862008000100043-arg","El lugar del padre primordial en Moisés y la religión monoteísta: Algunas conclusiones","Raffaini, Laura Edith","Anuario de investigaciones; 15(); -","Anuario de investigaciones","Espanhol","2008","http://www.scielo.org.ar/scielo.php?script=sci_arttext&pid=S1851-16862008000100043&lang=pt" 
"S1851-16862008000100044-arg","El uso freudiano del caso en torno a la pregunta por la eficacia del análisis: El historial de dora","Rubistein, Adriana, Iuale, Luján","Anuario de investigaciones; 15(); -","Anuario de investigaciones","Espanhol","2008","http://www.scielo.org.ar/scielo.php?script=sci_arttext&pid=S1851-16862008000100044&lang=pt" 
"S1851-16862008000100045-arg","La histeria en el último período de la enseñanza de J. Lacan","Schejtman, Fabián, Godoy, Claudio","Anuario de investigaciones; 15(); -","Anuario de investigaciones","Espanhol","2008","http://www.scielo.org.ar/scielo.php?script=sci_arttext&pid=S1851-16862008000100045&lang=pt" 
"S0254-07702008000400009-ven","Forma general de la transformada finita de Hankel","Pirela Cristalino, Ovidio, Villalobos Mena, Alfredo","Revista Técnica de la Facultad de Ingeniería Universidad del Zulia; 31(Especial); 61-69","Revista Técnica de la Facultad de Ingeniería Universidad del Zulia","Espanhol","2008","http://www.scielo.org.ve/scielo.php?script=sci_arttext&pid=S0254-07702008000400009&lang=pt" 
"S0254-07702008000400002-ven","Evaluación de los subproductos de la cloración en el proceso de Potabilización de la Planta “Lucio Baldó Soulés”","Mallia, Auxilia, Ríos, Luis, Carrillo, Jocelyn, Llobregat, María, Fernández, Celeste","Revista Técnica de la Facultad de Ingeniería Universidad del Zulia; 31(Especial); 01-11","Revista Técnica de la Facultad de Ingeniería Universidad del Zulia","Espanhol","2008","http://www.scielo.org.ve/scielo.php?script=sci_arttext&pid=S0254-07702008000400002&lang=pt" 
"S0254-07702008000400003-ven","Estudio de la interacción del carbón mineral con agua del Lago de Maracaibo","Parra, Yleana, Esteves, Iván, Escobar, Marcos, Portillo, Edgar, Rojas, José A","Revista Técnica de la Facultad de Ingeniería Universidad del Zulia; 31(Especial); 12-21","Revista Técnica de la Facultad de Ingeniería Universidad del Zulia","Espanhol","2008","http://www.scielo.org.ve/scielo.php?script=sci_arttext&pid=S0254-07702008000400003&lang=pt" 
"S0254-07702008000400001-ven","","SÃ¡nchez, Miguel Â","Revista Técnica de la Facultad de Ingeniería Universidad del Zulia; 31(Especial); 01-01","Revista Técnica de la Facultad de Ingeniería Universidad del Zulia","Espanhol","2008","http://www.scielo.org.ve/scielo.php?script=sci_arttext&pid=S0254-07702008000400001&lang=pt" 
"S0254-07702008000400006-ven","Simulación computacional del crecimiento de la población de Lemna sp en el Lago de Maracaibo","Badell, Gustavo, Flores, Janett, Rincón, José, Rubio, María","Revista Técnica de la Facultad de Ingeniería Universidad del Zulia; 31(Especial); 41-49","Revista Técnica de la Facultad de Ingeniería Universidad del Zulia","Espanhol","2008","http://www.scielo.org.ve/scielo.php?script=sci_arttext&pid=S0254-07702008000400006&lang=pt" 
"S0254-07702008000400007-ven","Un enfoque práctico para la optimización de procesos de inyección de ASP usando modelos de superficie de respuesta cuadrática y diseño de experimentos","Zerpa, Luis E, Queipo, Néstor V, Pintos, Salvador, Tillero, Edwin, Alter, David","Revista Técnica de la Facultad de Ingeniería Universidad del Zulia; 31(Especial); 50-60","Revista Técnica de la Facultad de Ingeniería Universidad del Zulia","Espanhol","2008","http://www.scielo.org.ve/scielo.php?script=sci_arttext&pid=S0254-07702008000400007&lang=pt" 
"S0254-07702008000400004-ven","Determinación de los parámetros cinéticos que rigen la ecuación de la DBO en efluentes industriales","Isea, Daisy, Vargas, Luis, Durán, José, Pineda, Karla, Delgado, José","Revista Técnica de la Facultad de Ingeniería Universidad del Zulia; 31(Especial); 22-31","Revista Técnica de la Facultad de Ingeniería Universidad del Zulia","Espanhol","2008","http://www.scielo.org.ve/scielo.php?script=sci_arttext&pid=S0254-07702008000400004&lang=pt" 
"S0254-07702008000400005-ven","Evaluation of exudated gum produced by Acacia siamea as coagulant in the clarification of the waters for human consumption","Fernández1, Andreína, Herrera, Francisco, Mas y Rubí3, Marielba, Mejías, Donaldo, Diaz, Altamira","Revista Técnica de la Facultad de Ingeniería Universidad del Zulia; 31(Especial); 32-40","Revista Técnica de la Facultad de Ingeniería Universidad del Zulia","Inglês","2008","http://www.scielo.org.ve/scielo.php?script=sci_arttext&pid=S0254-07702008000400005&lang=pt" 
"S0254-07702008000400011-ven","Costos por corrosión en el mantenimiento preventivo y correctivo de equipos e instalaciones en la industria","Aponte, Bertila, Fernández de Romero, Matilde, oconis de Rincón, Oladis, Arias, Silagdy, Contreras, Melani, Ramos, Jomar, Collantes, Raúl","Revista Técnica de la Facultad de Ingeniería Universidad del Zulia; 31(Especial); 87-96","Revista Técnica de la Facultad de Ingeniería Universidad del Zulia","Espanhol","2008","http://www.scielo.org.ve/scielo.php?script=sci_arttext&pid=S0254-07702008000400011&lang=pt" 
"S0254-07702008000400010-ven","Evaluación de las desviaciones de los proyectos de perforación exploratoria de PDVSA Exploración Occidente","Oliva, Karim C, Sada, Yoján","Revista Técnica de la Facultad de Ingeniería Universidad del Zulia; 31(Especial); 79-86","Revista Técnica de la Facultad de Ingeniería Universidad del Zulia","Espanhol","2008","http://www.scielo.org.ve/scielo.php?script=sci_arttext&pid=S0254-07702008000400010&lang=pt" 
"S0254-07702008000400013-ven","Producción continua de proteína unicelular de Kluyveromyces marxianus var. marxianus a partir de lactosuero diluido","Buitrago, Glorymar, Soto, Laura, Páez, Gisela, Araujo, Karelen, Mármol, Zulay, Rincón, Marisela","Revista Técnica de la Facultad de Ingeniería Universidad del Zulia; 31(Especial); 107-113","Revista Técnica de la Facultad de Ingeniería Universidad del Zulia","Espanhol","2008","http://www.scielo.org.ve/scielo.php?script=sci_arttext&pid=S0254-07702008000400013&lang=pt" 
"S0254-07702008000400015-ven","Diseño experimental aplicado a la extracción de aceite de la almendra del corozo (Acrocomia aculeata)","Arveláez, América, Mieres Pitre, Alberto, Hernández, Carlos Enrique","Revista Técnica de la Facultad de Ingeniería Universidad del Zulia; 31(Especial); 122-129","Revista Técnica de la Facultad de Ingeniería Universidad del Zulia","Espanhol","2008","http://www.scielo.org.ve/scielo.php?script=sci_arttext&pid=S0254-07702008000400015&lang=pt" 
"S0254-07702008000400014-ven","Utilización de un desecho agroindustrial proveniente de una empresa refinadora de aceite comestible para la producción de jabones","Altomare, Vanessa, Fernández, Celeste, Ros, Mario","Revista Técnica de la Facultad de Ingeniería Universidad del Zulia; 31(Especial); 114-121","Revista Técnica de la Facultad de Ingeniería Universidad del Zulia","Espanhol","2008","http://www.scielo.org.ve/scielo.php?script=sci_arttext&pid=S0254-07702008000400014&lang=pt" 
"S1851-16862008000100046-arg","Variables del diagnóstico psicoanalítico de neurosis en la histeria y la obsesion","Thompson, Santiago, Frydman, Arturo, Lombardi, Gabriel","Anuario de investigaciones; 15(); -","Anuario de investigaciones","Espanhol","2008","http://www.scielo.org.ar/scielo.php?script=sci_arttext&pid=S1851-16862008000100046&lang=pt" 
"S1851-16862008000100047-arg","La reposición de una experiencia fundante: Orientación vocacional en la UBA en los años &#039;50-&#039;60. Un espacio para la carrera de psicología","Diamant, Ana","Anuario de investigaciones; 15(); -","Anuario de investigaciones","Espanhol","2008","http://www.scielo.org.ar/scielo.php?script=sci_arttext&pid=S1851-16862008000100047&lang=pt" 
"S1851-16862008000100048-arg","Los anales de biotipología, eugenesia y medicina social y un cambio en la nosografía psiquiátrica relacionado con el origen de la psicología en la Argentina: The Anales De Biotipología, Eugenesia Y Medicina Social And A Change In The Classification Of Psychiatric Diseases Related With The Origin Of The Psychology In Argentine","Navarlaz, Vanesa Eva","Anuario de investigaciones; 15(); -","Anuario de investigaciones","Espanhol","2008","http://www.scielo.org.ar/scielo.php?script=sci_arttext&pid=S1851-16862008000100048&lang=pt" 
"S1851-16862008000100049-arg","Redes discursivas, políticas e institucionales en las publicaciones periódicas en Argentina (1902-1962): Su influencia en la conformación del discurso psicológico","Rossi, Lucía A.","Anuario de investigaciones; 15(); -","Anuario de investigaciones","Espanhol","2008","http://www.scielo.org.ar/scielo.php?script=sci_arttext&pid=S1851-16862008000100049&lang=pt" 
"S1851-16862008000100050-arg","La psicologización de la sexualidad en Argentina (1900-1970)","Talak, Ana María, Chayo, Yazmín, Macchioli, Florencia A., Del Cueto, Julio Daniel, García, Luciano Nicolás, Sánchez, María Victoria","Anuario de investigaciones; 15(); -","Anuario de investigaciones","Espanhol","2008","http://www.scielo.org.ar/scielo.php?script=sci_arttext&pid=S1851-16862008000100050&lang=pt" 
"S1851-16862008000100051-arg","Psicoanálisis y pedagogía: Un análisis de las actas de la sociedad psicoanalítica de Viena (1906-1923)","Vallejo, Mauro","Anuario de investigaciones; 15(); -","Anuario de investigaciones","Espanhol","2008","http://www.scielo.org.ar/scielo.php?script=sci_arttext&pid=S1851-16862008000100051&lang=pt" 
"S1851-16862008000100052-arg","La construcción de normas en episodios de conflicto intersubjetivos: Indagando acciones comunicativas para la validación normativa en la praxis cotidiana de niños/as de cuatro años en clases de educación física","Gómez, Valeria Mariel","Anuario de investigaciones; 15(); -","Anuario de investigaciones","Espanhol","2008","http://www.scielo.org.ar/scielo.php?script=sci_arttext&pid=S1851-16862008000100052&lang=pt" 
"S1851-16862008000100053-arg","El derecho a la privacidad en los niños: Un enfoque constructivista e institucional","Horn, Axel, Castorina, José Antonio","Anuario de investigaciones; 15(); -","Anuario de investigaciones","Espanhol","2008","http://www.scielo.org.ar/scielo.php?script=sci_arttext&pid=S1851-16862008000100053&lang=pt" 
"S1851-16862008000100054-arg","Construcción de una escala de observación del vínculo madre-bebé internado en UCIN: Resultados preliminares de la aplicación del protocolo de observación","Santos, María Soledad","Anuario de investigaciones; 15(); -","Anuario de investigaciones","Espanhol","2008","http://www.scielo.org.ar/scielo.php?script=sci_arttext&pid=S1851-16862008000100054&lang=pt" 
"S1851-16862008000100055-arg","Las condiciones para un aprendizaje universitario más autónomo desde la mirada del alumno","Del Río, Marta, Venticinque, Nilda","Anuario de investigaciones; 15(); -","Anuario de investigaciones","Espanhol","2008","http://www.scielo.org.ar/scielo.php?script=sci_arttext&pid=S1851-16862008000100055&lang=pt" 
"S1851-16862008000100056-arg","Los derechos humanos: Una excepción que haga lugar al no-todo","Domínguez, María Elena","Anuario de investigaciones; 15(); -","Anuario de investigaciones","Espanhol","2008","http://www.scielo.org.ar/scielo.php?script=sci_arttext&pid=S1851-16862008000100056&lang=pt" 
"S1851-16862008000100057-arg","La estructura académica del sistema educativo analizada a partir de los contenidos de la enseñanza: La educación básica durante las primeras décadas del siglo XX","Ruiz, Guillermo, Marzoa, Karina, Mauceri, María Laura, Molinari, Andrea, Schmidt, Marcelo","Anuario de investigaciones; 15(); -","Anuario de investigaciones","Espanhol","2008","http://www.scielo.org.ar/scielo.php?script=sci_arttext&pid=S1851-16862008000100057&lang=pt" 
