"S1851-16862008000100058-arg","La estructura académica del sistema educativo analizada a partir de los contenidos de la enseñanza: La educación secundaria durante las primeras décadas del siglo XX","Ruiz, Guillermo, Molinari, Andrea, Muiños, Claudia, Ruiz, María, Schoo, Susana","Anuario de investigaciones; 15(); -","Anuario de investigaciones","Espanhol","2008","http://www.scielo.org.ar/scielo.php?script=sci_arttext&pid=S1851-16862008000100058&lang=pt" 
"S1851-16862008000100059-arg","La investigación científica como parte de las políticas de formación docente en la Argentina: La situación en dos jurisdicciones","Ruiz, Guillermo, Cardinaux, Nancy, Molinari, Andrea, Rodriguez, Martha, Brizuela, Mariano, Muiños, Claudia, Quiroga, Cristina, Ruiz, María, Schmidt, Marcelo, Schoo, Susana","Anuario de investigaciones; 15(); -","Anuario de investigaciones","Espanhol","2008","http://www.scielo.org.ar/scielo.php?script=sci_arttext&pid=S1851-16862008000100059&lang=pt" 
"S1851-16862008000100060-arg","El Babytalk como proceso de significación","Videla, Santiago, Español, Silvia","Anuario de investigaciones; 15(); -","Anuario de investigaciones","Espanhol","2008","http://www.scielo.org.ar/scielo.php?script=sci_arttext&pid=S1851-16862008000100060&lang=pt" 
"S1851-16862008000100001-arg","Un esquema clasificatorio para las intervenciones en terapia interpersonal","Etchebarne, Ignacio, Fernández, Marcela, Roussos, Andrés J.","Anuario de investigaciones; 15(); -","Anuario de investigaciones","Espanhol","2008","http://www.scielo.org.ar/scielo.php?script=sci_arttext&pid=S1851-16862008000100001&lang=pt" 
"S1851-16862008000100002-arg","Adaptación del modelo de ciclos Terapéuticos (TCM) a una población Adolescente de alto riesgo psicosocial","Quiroga, Susana, Cryan, Glenda","Anuario de investigaciones; 15(); -","Anuario de investigaciones","Espanhol","2008","http://www.scielo.org.ar/scielo.php?script=sci_arttext&pid=S1851-16862008000100002&lang=pt" 
"S1851-16862008000100003-arg","Perfil cognitivo de pacientes con trastorno obsesivo compulsivo: resultados preliminares","Rodríguez Biglieri, Ricardo","Anuario de investigaciones; 15(); -","Anuario de investigaciones","Espanhol","2008","http://www.scielo.org.ar/scielo.php?script=sci_arttext&pid=S1851-16862008000100003&lang=pt" 
"S1851-16862008000100004-arg","Nivel de funcionamiento y calidad de vida en pacientes con trastorno de ansiedad generalizada","Vetere, Giselle","Anuario de investigaciones; 15(); -","Anuario de investigaciones","Espanhol","2008","http://www.scielo.org.ar/scielo.php?script=sci_arttext&pid=S1851-16862008000100004&lang=pt" 
"S1851-16862008000100005-arg","Concepciones y creencias sobre el trabajo: Estudio descriptivo de algunas fuentes de variación en una muestra laboralmente activa","Zubieta, Elena, Filippi, Graciela, Beramendi, Maite, Ceballos, Samantha, Córdoba, Esteban, Napoli, Laura","Anuario de investigaciones; 15(); -","Anuario de investigaciones","Espanhol","2008","http://www.scielo.org.ar/scielo.php?script=sci_arttext&pid=S1851-16862008000100005&lang=pt" 
"S1851-16862008000100006-arg","El sentido del estudio y el trabajo para los jóvenes que finalizan la escuela de nivel medio: Un análisis desde la perspectiva de la psicología de la orientación","Aisenson, Diana, Aisenson, Gabriela, Legaspi, Leandro, Valenzuela, Viviana, Polastri, Graciela, Duro, Lorena","Anuario de investigaciones; 15(); -","Anuario de investigaciones","Espanhol","2008","http://www.scielo.org.ar/scielo.php?script=sci_arttext&pid=S1851-16862008000100006&lang=pt" 
"S1851-16862008000100007-arg","Análisis de la aplicación de un sistema de actividad ad hoc para la promoción de habilidades metacognitivas de alfabetización académica","Colombo, María Elena, Curone, Gladys Nancy, Pabago, Gustavo, Sulle, Adriana","Anuario de investigaciones; 15(); -","Anuario de investigaciones","Espanhol","2008","http://www.scielo.org.ar/scielo.php?script=sci_arttext&pid=S1851-16862008000100007&lang=pt" 
"S1851-16862008000100008-arg","Revisitando la pedagogía con la perspectiva sociocultural: Artefactos para la práctica reflexiva en el oficio de enseñar psicología. Profesores de psicología en formación y formados en comunidades de aprendizaje de prácticas de enseñanza del profesorado de psicología","Erausquin, Cristina, Basualdo, María Esther, García Labandal, Livia, González, Daniela, Ortega, Gabriela, Meschman, Clara","Anuario de investigaciones; 15(); -","Anuario de investigaciones","Espanhol","2008","http://www.scielo.org.ar/scielo.php?script=sci_arttext&pid=S1851-16862008000100008&lang=pt" 
"S1851-16862008000100009-arg","Teoría de la actividad y modelos mentales: Instrumentos para la reflexión sobre la práctica profesional: &quot;aprendizaje expansivo&quot;, intercambio cognitivo y transformación de intervenciones de psicólogos y otros agentes en escenarios educativos","Larripa, Martín, Erausquin, Cristina","Anuario de investigaciones; 15(); -","Anuario de investigaciones","Espanhol","2008","http://www.scielo.org.ar/scielo.php?script=sci_arttext&pid=S1851-16862008000100009&lang=pt" 
"S1851-16862008000100010-arg","Relaciones entre saberes políticos, participación política y educación política: Aportes de la investigación psicológica","Lenzi, Alicia M., D&#039;Avirro, Ma. Julieta, Pataro, Ma. Alejandra","Anuario de investigaciones; 15(); -","Anuario de investigaciones","Espanhol","2008","http://www.scielo.org.ar/scielo.php?script=sci_arttext&pid=S1851-16862008000100010&lang=pt" 
"S1851-16862008000100011-arg","La tensión entre tener éxito y comprender en la búsqueda de información en Internet","Perelman, Flora Beatríz, Bivort, María Rosa, Estévez, Vanina, Limansky, Dalia, Mancinelli, Fabiana, Ornique, Mariana, Paganini, Susana","Anuario de investigaciones; 15(); -","Anuario de investigaciones","Espanhol","2008","http://www.scielo.org.ar/scielo.php?script=sci_arttext&pid=S1851-16862008000100011&lang=pt" 
"S1851-16862008000100012-arg","Procesos de transformación en la producción simbólica y su relación con la complejización psíquica en el tratamiento psicopedagógico grupal","Rego, María Victoria","Anuario de investigaciones; 15(); -","Anuario de investigaciones","Espanhol","2008","http://www.scielo.org.ar/scielo.php?script=sci_arttext&pid=S1851-16862008000100012&lang=pt" 
"S1851-16862008000100013-arg","Aprendizaje y formas de participación: La consulta de control de niño sano como sistema de actividad","Scavino, Carolina","Anuario de investigaciones; 15(); -","Anuario de investigaciones","Espanhol","2008","http://www.scielo.org.ar/scielo.php?script=sci_arttext&pid=S1851-16862008000100013&lang=pt" 
"S1851-16862008000100014-arg","La percepción de la violencia entre pares en contextos escolares: un estudio cualitativo","Veccia, Teresa Ana, Calzada, Javier Gonzalo, Grisolia, Erika Valeria","Anuario de investigaciones; 15(); -","Anuario de investigaciones","Espanhol","2008","http://www.scielo.org.ar/scielo.php?script=sci_arttext&pid=S1851-16862008000100014&lang=pt" 
"S1851-16862008000100015-arg","Empresas recuperadas: las voces de las mujeres - perspectivas de género","Bancalari, Hebe, Calcagno, Ana María, Pérez Ferretti, Liliana","Anuario de investigaciones; 15(); -","Anuario de investigaciones","Espanhol","2008","http://www.scielo.org.ar/scielo.php?script=sci_arttext&pid=S1851-16862008000100015&lang=pt" 
"S1851-16862008000100016-arg","Estudio sobre la corriente migratoria contemporánea en españa: desarrollo económico e integración socio-afectiva","Benbenaste, Narciso, Etchezahar, Edgardo, Benbenaste, Verónica","Anuario de investigaciones; 15(); -","Anuario de investigaciones","Espanhol","2008","http://www.scielo.org.ar/scielo.php?script=sci_arttext&pid=S1851-16862008000100016&lang=pt" 
"S1851-16862008000100017-arg","Psicología de la anomia","Benbenaste, Narciso, Etchezahar, Edgardo, Del Río, Marta","Anuario de investigaciones; 15(); -","Anuario de investigaciones","Espanhol","2008","http://www.scielo.org.ar/scielo.php?script=sci_arttext&pid=S1851-16862008000100017&lang=pt" 
"S1851-16862008000100018-arg","Política y subjetividad: la tensión autogestióndelegación en empresas y fábricas recuperadas","Fernández, Ana María, López, Mercedes, Borakievich, Sandra, Ojám, Enrique","Anuario de investigaciones; 15(); -","Anuario de investigaciones","Espanhol","2008","http://www.scielo.org.ar/scielo.php?script=sci_arttext&pid=S1851-16862008000100018&lang=pt" 
"S1851-16862008000100019-arg","El derecho a la salud de las mujeres y su garantía constitucional en Argentina","Fontenla, Mariana, Tajer, Débora","Anuario de investigaciones; 15(); -","Anuario de investigaciones","Espanhol","2008","http://www.scielo.org.ar/scielo.php?script=sci_arttext&pid=S1851-16862008000100019&lang=pt" 
"S1851-16862008000100020-arg","Adolescencia y procesos participativos en el campo de la salud de la ciudad autónoma de Buenos Aires: Descripción de las características específicas de la participación en los niveles personal, familiar, lnstitucional y comunitario","Grippo, Leticia","Anuario de investigaciones; 15(); -","Anuario de investigaciones","Espanhol","2008","http://www.scielo.org.ar/scielo.php?script=sci_arttext&pid=S1851-16862008000100020&lang=pt" 
"S1851-16862008000100021-arg","Niñez en condiciones de desamparo y acceso a la salud en ciudad de Buenos Aires","Luciani Conde, Leandro, Barcala, Alejandra, Fanelli, Ana María, Laino, Cecilia, Luzuriaga, Claudia, Moreyra, Valeria, Pambukdjian, María Fernanda, Corradini, Ana, Barbieri, Adrián, Rodríguez, Gustavo, Camera, Omar","Anuario de investigaciones; 15(); -","Anuario de investigaciones","Espanhol","2008","http://www.scielo.org.ar/scielo.php?script=sci_arttext&pid=S1851-16862008000100021&lang=pt" 
"S1851-16862008000100022-arg","La práctica del &quot;apoyo mutuo&quot; en situaciones límites entre trabajadores y trabajadoras de empresas recuperadas","Robertazzi, Margarita, Pertierra, Lidia Isabel, Ferrari, Liliana","Anuario de investigaciones; 15(); -","Anuario de investigaciones","Espanhol","2008","http://www.scielo.org.ar/scielo.php?script=sci_arttext&pid=S1851-16862008000100022&lang=pt" 
"S1851-16862008000100023-arg","La persistencia de los estereotipos de género en la representación social de crisis en jóvenes argentinos entre 20 y 30 años","Seidmann, Susana, Bail Pupko, Vera, Azzollini, Susana, Vidal, Victoria, Thomé, Sandra, Di Iorio, Jorgelina","Anuario de investigaciones; 15(); -","Anuario de investigaciones","Espanhol","2008","http://www.scielo.org.ar/scielo.php?script=sci_arttext&pid=S1851-16862008000100023&lang=pt" 
"S1851-16862008000100024-arg","Políticas sociales, dispositivos autogestivos y enunciados subjetivantes","Zaldúa, Graciela, Sopransi, María Belén, Estrada Maldonado, Sandra, Veloso, Verónica","Anuario de investigaciones; 15(); -","Anuario de investigaciones","Espanhol","2008","http://www.scielo.org.ar/scielo.php?script=sci_arttext&pid=S1851-16862008000100024&lang=pt" 
"S1851-16862008000100025-arg","Derechos, ciudadanía y participación en salud: su relación con la accesibilidad simbólica a los servicios","Solitario, Romina, Garbus, Pamela, Stolkiner, Alicia","Anuario de investigaciones; 15(); -","Anuario de investigaciones","Espanhol","2008","http://www.scielo.org.ar/scielo.php?script=sci_arttext&pid=S1851-16862008000100025&lang=pt" 
"S1851-16862008000100026-arg","Ruta crítica de la salud de las mujeres: integralidad y equidad de género en las prácticas de salud de las mujeres en la ciudad de Buenos Aires - 2da parte","Tajer, Débora, Gaba, Mariana, Lo Russo, Alejandra, Reid, Graciela, Attardo, Clara, Zamar, Adriana, Fontenla, Mariana, Cuadra, María Eugenia, Cunningham, María Viviana, Oliveto, Agustín, Lupi, Mercedes, Jeifetz, Vanesa, Straschnoy, Marina","Anuario de investigaciones; 15(); -","Anuario de investigaciones","Espanhol","2008","http://www.scielo.org.ar/scielo.php?script=sci_arttext&pid=S1851-16862008000100026&lang=pt" 
"S1851-16862008000100027-arg","Evidencias acerca de la validez de constructo de la escala voluntad de trabajo","Abal, Facundo Juan Pablo, Lozzia, Gabriela Susana, Aguerri, María Ester, Galibert, María Silvia, Attorresi, Horacio Félix","Anuario de investigaciones; 15(); -","Anuario de investigaciones","Espanhol","2008","http://www.scielo.org.ar/scielo.php?script=sci_arttext&pid=S1851-16862008000100027&lang=pt" 
"S1851-16862008000100028-arg","Diseño de un instrumento psicométrico para evaluar concepciones sobre la sabiduría","Casullo, María Martina, Fernández Liporace, Mercedes","Anuario de investigaciones; 15(); -","Anuario de investigaciones","Espanhol","2008","http://www.scielo.org.ar/scielo.php?script=sci_arttext&pid=S1851-16862008000100028&lang=pt" 
"S1851-16862008000100029-arg","Evaluación de la inestabilidad laboral como estresor psicosocial en el trabajo","Leibovich de Figueroa, Nora, Injoque-Ricle, Irene, Schufer, Marta","Anuario de investigaciones; 15(); -","Anuario de investigaciones","Espanhol","2008","http://www.scielo.org.ar/scielo.php?script=sci_arttext&pid=S1851-16862008000100029&lang=pt" 
"S0254-07702008000400012-ven","Origen, madurez térmica y nivel de alteración de menes en el piedemonte de la Sierra de Perijá, Venezuela","Portillo, Edgar, Torres, Johanna, González, Anaís, Esteves, Iván, Rojas, Juan, Escobar, Marcos","Revista Técnica de la Facultad de Ingeniería Universidad del Zulia; 31(Especial); 97-106","Revista Técnica de la Facultad de Ingeniería Universidad del Zulia","Espanhol","2008","http://www.scielo.org.ve/scielo.php?script=sci_arttext&pid=S0254-07702008000400012&lang=pt" 
"S0254-07702008000400016-ven","Efecto de la irradiación con microondas sobre las propiedades sensoriales de algunos productos cárnicos y marinos","Fernández, Celeste, García, Magaly, Tineo, Ysmar, Altomare, Vanessa","Revista Técnica de la Facultad de Ingeniería Universidad del Zulia; 31(Especial); 130-150","Revista Técnica de la Facultad de Ingeniería Universidad del Zulia","Espanhol","2008","http://www.scielo.org.ve/scielo.php?script=sci_arttext&pid=S0254-07702008000400016&lang=pt" 
"S1850-468X2008000100001-arg","Contribución al estudio de las secuencias secas en la zona agropecuaria de Argentina","Penalba, Olga, Llano, María Paula","Meteorologica; 33(1-2); 51-64","Meteorologica","Espanhol","2008","http://www.scielo.org.ar/scielo.php?script=sci_arttext&pid=S1850-468X2008000100001&lang=pt" 
"S1850-468X2008000100002-arg","Estudio de secuencias secas en la Cuenca del Plata: Implicancias con las sequias","Naumann, Gustavo, Vargas, Walter M, Minetti, Juan L","Meteorologica; 33(1-2); 65-81","Meteorologica","Espanhol","2008","http://www.scielo.org.ar/scielo.php?script=sci_arttext&pid=S1850-468X2008000100002&lang=pt" 
"S1850-468X2008000100003-arg","El sistema de pronóstico experimental del Centro de Investigaciones del Mar y la Atmósfera","Saulo, Celeste, Cardazzo, Soledad, Ruiz, Juan, Campetella, Claudia, Rolla, Alfredo","Meteorologica; 33(1-2); 83-97","Meteorologica","Espanhol","2008","http://www.scielo.org.ar/scielo.php?script=sci_arttext&pid=S1850-468X2008000100003&lang=pt" 
"S0120-48232008000200009-col","Espaços okupas em Barcelona e a comunicação na cidade","SILVA, PAULO CELSO","Signo y Pensamiento; 27(53); 140-161","Signo y Pensamiento","Português","2008","http://www.scielo.org.co/scielo.php?script=sci_arttext&pid=S0120-48232008000200009&lang=pt" 
"S0120-48232008000200008-col","Definir lo indefinible: El papel de las tecnologías de construcción corporal en las problemáticas sobre el cuerpo como territorio en disputa","AGUDELO TORRES, MARÍA DEL MAR","Signo y Pensamiento; 27(53); 128-139","Signo y Pensamiento","Espanhol","2008","http://www.scielo.org.co/scielo.php?script=sci_arttext&pid=S0120-48232008000200008&lang=pt" 
"S0120-48232008000200007-col","Por una re-partición de lo sensible: disensos y aperturas de nuevos espacios: Una lectura de la estética y la política en J. Rancière","RONCALLO DOW, SERGIO","Signo y Pensamiento; 27(53); 104-127","Signo y Pensamiento","Espanhol","2008","http://www.scielo.org.co/scielo.php?script=sci_arttext&pid=S0120-48232008000200007&lang=pt" 
"S0120-48232008000200006-col","El lugar como política y las políticas de lugar","GARZÓN, MARÍA ANGELÍCA","Signo y Pensamiento; 27(53); 92-103","Signo y Pensamiento","Espanhol","2008","http://www.scielo.org.co/scielo.php?script=sci_arttext&pid=S0120-48232008000200006&lang=pt" 
"S0120-48232008000200005-col","La egoesfera","GARCÍA, FEDERICO","Signo y Pensamiento; 27(53); 68-91","Signo y Pensamiento","Espanhol","2008","http://www.scielo.org.co/scielo.php?script=sci_arttext&pid=S0120-48232008000200005&lang=pt" 
"S0120-48232008000200004-col","Identidades locales, lenguajes y medios de comunicación: entre búsquedas, lógicas y tensiones","ROVEDA HOYOS, ANTONIO","Signo y Pensamiento; 27(53); 59-67","Signo y Pensamiento","Espanhol","2008","http://www.scielo.org.co/scielo.php?script=sci_arttext&pid=S0120-48232008000200004&lang=pt" 
"S0120-48232008000200003-col","La postura de la representación y del discurso: O un trastrocamiento de la metáfora usual de la nación","MURCIA GÓMEZ, VERÓNICA, MORENO MARTÍNEZ, ÓSCAR","Signo y Pensamiento; 27(53); 38-58","Signo y Pensamiento","Espanhol","2008","http://www.scielo.org.co/scielo.php?script=sci_arttext&pid=S0120-48232008000200003&lang=pt" 
"S0120-48232008000200002-col","Heterologías y nación: proyectos letrados y alteridad radical en la Colombia decimonónica","VILLEGAS VÉLEZ, ÁLVARO","Signo y Pensamiento; 27(53); 24-37","Signo y Pensamiento","Espanhol","2008","http://www.scielo.org.co/scielo.php?script=sci_arttext&pid=S0120-48232008000200002&lang=pt" 
"S0120-48232008000200001-col","Prólogo: territorios, nación e identidades en las ciencias sociales","","Signo y Pensamiento; 27(53); 16-21","Signo y Pensamiento","Espanhol","2008","http://www.scielo.org.co/scielo.php?script=sci_arttext&pid=S0120-48232008000200001&lang=pt" 
"S0120-48232008000200021-col","Hay que traer el espacio a la vida","ROMÁN VELÁZQUEZ, PATRIA, GARCÍA VARGAS, ALEJANDRA","Signo y Pensamiento; 27(53); 328-343","Signo y Pensamiento","Espanhol","2008","http://www.scielo.org.co/scielo.php?script=sci_arttext&pid=S0120-48232008000200021&lang=pt" 
"S0120-48232008000200020-col","Positioning masculinities and femininities in preschool EFLl1 education","CASTAÑEDA-PEÑA, HAROLD","Signo y Pensamiento; 27(53); 314-326","Signo y Pensamiento","Inglês","2008","http://www.scielo.org.co/scielo.php?script=sci_arttext&pid=S0120-48232008000200020&lang=pt" 
"S0120-48232008000200023-col","¿Qué le pide hoy la sociedad colombiana a un profesor de lenguas extranjeras?","AGRAY VARGAS, NANCY","Signo y Pensamiento; 27(53); 352-357","Signo y Pensamiento","Espanhol","2008","http://www.scielo.org.co/scielo.php?script=sci_arttext&pid=S0120-48232008000200023&lang=pt" 
"S0120-48232008000200022-col","El poder de la palabra: o la &#039;mirada inversa&#039; de Michel de Certeau sobre el mayo francés","SIERRA GUTIÉRREZ, LUIS IGNACIO, AGRAY VARGAS, NANCY, GARCÍA TOBÓN, CARLOS","Signo y Pensamiento; 27(53); 346-351","Signo y Pensamiento","Espanhol","2008","http://www.scielo.org.co/scielo.php?script=sci_arttext&pid=S0120-48232008000200022&lang=pt" 
"S0120-48232008000200025-col","Nuevas prácticas lecto-escriturales en el ciberespacio","González Romero, Nadya","Signo y Pensamiento; 27(53); 370-372","Signo y Pensamiento","Espanhol","2008","http://www.scielo.org.co/scielo.php?script=sci_arttext&pid=S0120-48232008000200025&lang=pt" 
"S0120-48232008000200024-col","2008: Año Internacional de los Idiomas","GARCÍA TOBÓN*, CARLOS","Signo y Pensamiento; 27(53); 358-368","Signo y Pensamiento","Espanhol","2008","http://www.scielo.org.co/scielo.php?script=sci_arttext&pid=S0120-48232008000200024&lang=pt" 
"S0120-48232008000200026-col","Brújula para la reconstrucción de un campo estratégico","Cadavid Bringe, Amparo","Signo y Pensamiento; 27(53); 370-372","Signo y Pensamiento","Espanhol","2008","http://www.scielo.org.co/scielo.php?script=sci_arttext&pid=S0120-48232008000200026&lang=pt" 
"S0120-48232008000200018-col","El monitoreo de medios a la campaña electoral 2007 por parte de la Misión de Observación Electoral: un caso para comprender los cambios en la relación entre medios y democracia en Colombia","LONDOÑO, ADRIANA MARCELA, GUTIÉRREZ, EDUARDO","Signo y Pensamiento; 27(53); 282-294","Signo y Pensamiento","Espanhol","2008","http://www.scielo.org.co/scielo.php?script=sci_arttext&pid=S0120-48232008000200018&lang=pt" 
"S0120-48232008000200019-col","Teoría del texto y tipología discursiva","ULLOA SANMIGUEL, ALEJANDRO, CARVAJAL BARRIOS, GIOVANNA","Signo y Pensamiento; 27(53); 295-313","Signo y Pensamiento","Espanhol","2008","http://www.scielo.org.co/scielo.php?script=sci_arttext&pid=S0120-48232008000200019&lang=pt" 
"S0120-48232008000200014-col","El discurso nacionalista en los medios audiovisuales, periodísticos y publicitarios (2005-2006)","ARIAS, JUAN CARLOS","Signo y Pensamiento; 27(53); 213-229","Signo y Pensamiento","Espanhol","2008","http://www.scielo.org.co/scielo.php?script=sci_arttext&pid=S0120-48232008000200014&lang=pt" 
"S0120-48232008000200015-col","Radio y nacionalismo iconográfico en México: la negociación discursiva de una identidad maya","CASTELLS I TALENS*, ANTONI","Signo y Pensamiento; 27(53); 230-245","Signo y Pensamiento","Espanhol","2008","http://www.scielo.org.co/scielo.php?script=sci_arttext&pid=S0120-48232008000200015&lang=pt" 
"S0120-48232008000200016-col","Impresiones sobre los hablantes mediáticos a partir de la profesionalidad en su elocución y el contenido de su discurso","SOTO SANFIEL, MARÍA TERESA","Signo y Pensamiento; 27(53); 246-266","Signo y Pensamiento","Espanhol","2008","http://www.scielo.org.co/scielo.php?script=sci_arttext&pid=S0120-48232008000200016&lang=pt" 
"S0120-48232008000200017-col","Los protagonistas de la realidad informativa local en España: Las fuentes de información en los noticiarios de las televisiones locales de Castilla y León","IGLESIAS, ANA ZULIMA","Signo y Pensamiento; 27(53); 267-281","Signo y Pensamiento","Espanhol","2008","http://www.scielo.org.co/scielo.php?script=sci_arttext&pid=S0120-48232008000200017&lang=pt" 
"S0120-48232008000200010-col","La historia como proceso narrativo de construcción de sentido: Diálogo entre Hayden White y la construcción de sentido","CHARLOIS ALLENDE, ADRIEN JOSÉ","Signo y Pensamiento; 27(53); 162-173","Signo y Pensamiento","Espanhol","2008","http://www.scielo.org.co/scielo.php?script=sci_arttext&pid=S0120-48232008000200010&lang=pt" 
"S0120-48232008000200011-col","La nación en el discurso de la derecha Un análisis ideológico del debate parlamentario chileno","MUÑOZ-NAVARRO, ANTONIETA","Signo y Pensamiento; 27(53); 174-191","Signo y Pensamiento","Espanhol","2008","http://www.scielo.org.co/scielo.php?script=sci_arttext&pid=S0120-48232008000200011&lang=pt" 
"S0120-48232008000200012-col","Análisis de retóricas políticas y periodísticas a raíz de las elecciones presidenciales colombianas de 2006","ÁNGEL BOTERO*, ADRIANA MARÍA","Signo y Pensamiento; 27(53); 194-201","Signo y Pensamiento","Espanhol","2008","http://www.scielo.org.co/scielo.php?script=sci_arttext&pid=S0120-48232008000200012&lang=pt" 
"S0120-48232008000200013-col","El mundo peronista a través del noticiero cinematográfico Sucesos Argentinos (1946-1952 )","CARRO*, JOSÉ PABLO","Signo y Pensamiento; 27(53); 202-211","Signo y Pensamiento","Espanhol","2008","http://www.scielo.org.co/scielo.php?script=sci_arttext&pid=S0120-48232008000200013&lang=pt" 
"S1645-99112008000200005-prt","Factores satisfacientes e insatisfacientes dos utilizadores de websites: Um estudo de caso","Pinho, Isabel, Rego, Arménio, Kastenholz, Elisabeth","Tékhne - Revista de Estudos Politécnicos; (10); 51-71","Tékhne - Revista de Estudos Politécnicos","Português","2008","http://www.scielo.mec.pt/scielo.php?script=sci_arttext&pid=S1645-99112008000200005&lang=pt" 
"S1645-99112008000200012-prt","Health economics or Health Care economics?","Cardoso, Cláudia","Tékhne - Revista de Estudos Politécnicos; (10); 189-198","Tékhne - Revista de Estudos Politécnicos","Inglês","2008","http://www.scielo.mec.pt/scielo.php?script=sci_arttext&pid=S1645-99112008000200012&lang=pt" 
"S1645-99112008000200004-prt","As Parcerias Público-Privadas em Portugal. Lições e Recomendações","Marques, Rui Cunha, Silva, Duarte","Tékhne - Revista de Estudos Politécnicos; (10); 33-50","Tékhne - Revista de Estudos Politécnicos","Português","2008","http://www.scielo.mec.pt/scielo.php?script=sci_arttext&pid=S1645-99112008000200004&lang=pt" 
"S1645-99112008000200006-prt","Investimentos em meio ambiente, responsabilidade social e desempenho econômico-financeiro de empresas no Brasil","Tupy, Oscar","Tékhne - Revista de Estudos Politécnicos; (10); 73-86","Tékhne - Revista de Estudos Politécnicos","Português","2008","http://www.scielo.mec.pt/scielo.php?script=sci_arttext&pid=S1645-99112008000200006&lang=pt" 
"S1645-99112008000200007-prt","Integration on Hyperspaces","Abreu, Teresa, Corbacho, Eusébio, Tarieladze, Vaja","Tékhne - Revista de Estudos Politécnicos; (10); 87-102","Tékhne - Revista de Estudos Politécnicos","Inglês","2008","http://www.scielo.mec.pt/scielo.php?script=sci_arttext&pid=S1645-99112008000200007&lang=pt" 
"S1645-99112008000200001-prt","Editorial","Nunes, Pedro","Tékhne - Revista de Estudos Politécnicos; (10); 5-5","Tékhne - Revista de Estudos Politécnicos","Português","2008","http://www.scielo.mec.pt/scielo.php?script=sci_arttext&pid=S1645-99112008000200001&lang=pt" 
