"S1645-99112008000200002-prt","The European Court Of Auditor’s Perspective On The Management And Control Of EU Funds","Caldeira, Vítor","Tékhne - Revista de Estudos Politécnicos; (10); 7-27","Tékhne - Revista de Estudos Politécnicos","Inglês","2008","http://www.scielo.mec.pt/scielo.php?script=sci_arttext&pid=S1645-99112008000200002&lang=pt" 
"S1645-99112008000200003-prt","A importância do tribunal de contas na sustentabilidade financeira do estado","Martins, Guilherme d’Oliveira","Tékhne - Revista de Estudos Politécnicos; (10); 29-31","Tékhne - Revista de Estudos Politécnicos","Português","2008","http://www.scielo.mec.pt/scielo.php?script=sci_arttext&pid=S1645-99112008000200003&lang=pt" 
"S1645-99112008000200008-prt","Aplicação de geotecnologias: detecção remota e geoprocessamento - para a gestão ambiental dos recursos hídricos superficiais em Cambará do Sul, RS, Brasil","Hoff, Rosemary, Vaccaro, Sandro, Krob, Alexandre José Diehl","Tékhne - Revista de Estudos Politécnicos; (10); 103-127","Tékhne - Revista de Estudos Politécnicos","Português","2008","http://www.scielo.mec.pt/scielo.php?script=sci_arttext&pid=S1645-99112008000200008&lang=pt" 
"S1645-99112008000200009-prt","The Normative Technique In A Constitutional State: (The Principle Of Legal Certainty)","Rodríguez-Arana, Jaime","Tékhne - Revista de Estudos Politécnicos; (10); 129-147","Tékhne - Revista de Estudos Politécnicos","Inglês","2008","http://www.scielo.mec.pt/scielo.php?script=sci_arttext&pid=S1645-99112008000200009&lang=pt" 
"S1645-99112008000200013-prt","Aplicação da Teoria dos Rough Sets na Previsão do Fracasso Empresarial","Pereira, José Manuel, Gómez, Fernando Díaz, López, Manuel Rodríguez","Tékhne - Revista de Estudos Politécnicos; (10); 199-220","Tékhne - Revista de Estudos Politécnicos","Português","2008","http://www.scielo.mec.pt/scielo.php?script=sci_arttext&pid=S1645-99112008000200013&lang=pt" 
"S1645-99112008000200011-prt","Confiança nas Equipas de I&amp;D: Operacionalização de um Constructo","Freire, Carla","Tékhne - Revista de Estudos Politécnicos; (10); 165-188","Tékhne - Revista de Estudos Politécnicos","Português","2008","http://www.scielo.mec.pt/scielo.php?script=sci_arttext&pid=S1645-99112008000200011&lang=pt" 
"S1645-99112008000200010-prt","A Responsabilidade Social das Empresas e o Desempenho Organizacional","Marques, Mário, Teixeira, Cláudia","Tékhne - Revista de Estudos Politécnicos; (10); 149-164","Tékhne - Revista de Estudos Politécnicos","Português","2008","http://www.scielo.mec.pt/scielo.php?script=sci_arttext&pid=S1645-99112008000200010&lang=pt" 
"S1645-99112008000200016-prt","Políticas de Género no âmbito Comunitário","Rodrigues, Noronha","Tékhne - Revista de Estudos Politécnicos; (10); 263-295","Tékhne - Revista de Estudos Politécnicos","Português","2008","http://www.scielo.mec.pt/scielo.php?script=sci_arttext&pid=S1645-99112008000200016&lang=pt" 
"S1645-99112008000200015-prt","From Cash To Accruals In Portuguese Local Government Accounting: What Has Truly Changed","Jorge, Susana Margarida, Carvalho, João Baptista da Costa, Fernandes, Maria José","Tékhne - Revista de Estudos Politécnicos; (10); 239-261","Tékhne - Revista de Estudos Politécnicos","Inglês","2008","http://www.scielo.mec.pt/scielo.php?script=sci_arttext&pid=S1645-99112008000200015&lang=pt" 
"S1645-99112008000200014-prt","O género e os estereótipos na gestão","Loureiro, Paula, Cardoso, Carlos Cabral","Tékhne - Revista de Estudos Politécnicos; (10); 221-238","Tékhne - Revista de Estudos Politécnicos","Português","2008","http://www.scielo.mec.pt/scielo.php?script=sci_arttext&pid=S1645-99112008000200014&lang=pt" 
"S1850-66662008000200001-arg","Qué opinan nuestros alumnos acerca de una estrategia didáctica empleada en sus clases de Matemática","González de Galindo, Susana Estela, Mercau de Sancho, Susana Beatriz, Marcilla, Marta Inés","Revista electrónica de investigación en educación en ciencias; 3(2); 1-11","Revista electrónica de investigación en educación en ciencias","Espanhol","2008","http://www.scielo.org.ar/scielo.php?script=sci_arttext&pid=S1850-66662008000200001&lang=pt" 
"S1850-66662008000200002-arg","Resignificando la linealidad en una experiencia de educación a distancia en línea","García Zatti, Mónica, Montiel Espinosa, Gisela","Revista electrónica de investigación en educación en ciencias; 3(2); 12-26","Revista electrónica de investigación en educación en ciencias","Espanhol","2008","http://www.scielo.org.ar/scielo.php?script=sci_arttext&pid=S1850-66662008000200002&lang=pt" 
"S1850-66662008000200003-arg","Las representaciones sobre el aprendizaje de los alumnos de profesorado: Diseño y validación de un instrumento para analizar concepciones implícitas sobre el aprendizaje en profesores de matemática en formación","García, María B, Vilanova, Silvia L.","Revista electrónica de investigación en educación en ciencias; 3(2); 27-34","Revista electrónica de investigación en educación en ciencias","Espanhol","2008","http://www.scielo.org.ar/scielo.php?script=sci_arttext&pid=S1850-66662008000200003&lang=pt" 
"S1850-66662008000200004-arg","Panorama geral das dificuldades e viabilidades para a inclusão do aluno com deficiência visual em aulas de eletromagnetismo","Pires de Camargo, Eder, Nardi, Roberto","Revista electrónica de investigación en educación en ciencias; 3(2); 35-48","Revista electrónica de investigación en educación en ciencias","Português","2008","http://www.scielo.org.ar/scielo.php?script=sci_arttext&pid=S1850-66662008000200004&lang=pt" 
"S1678-69712008000800006-scl","A internacionalização da indústria calçadista francana","Machado Neto, Alfredo José, Almeida, Fernando Carvalho de","RAM. Revista de Administração Mackenzie; 9(8); 88-111","RAM. Revista de Administração Mackenzie","Português","2008","http://www.scielo.br/scielo.php?script=sci_arttext&pid=S1678-69712008000800006&lang=pt" 
"S1678-69712008000800007-scl","O empreendedor humanizado como uma alternativa ao empresário bem-sucedido: um novo conceito em empreendedorismo, inspirado no filme Beleza Americana","Paiva Júnior, Fernando Gomes de, Almeida, Simone de Lira, Guerra, José Roberto Ferreira","RAM. Revista de Administração Mackenzie; 9(8); 112-134","RAM. Revista de Administração Mackenzie","Português","2008","http://www.scielo.br/scielo.php?script=sci_arttext&pid=S1678-69712008000800007&lang=pt" 
"S1678-69712008000800005-scl","Mecanismos de vigilância e dispositivos de controle: o caso de uma indústria familiar de confecções de Minas Gerais","Gomes, Almiralva Ferraz, Santana, Weslei Gusmão Piau, Araújo, Uajará Pessoa","RAM. Revista de Administração Mackenzie; 9(8); 64-87","RAM. Revista de Administração Mackenzie","Português","2008","http://www.scielo.br/scielo.php?script=sci_arttext&pid=S1678-69712008000800005&lang=pt" 
"S1851-82652008000300002-spa","El derecho a la salud en los tribunales: algunos efectos del activismo judicial sobre el sistema de salud en Argentina","Abramovich, Víctor, Pautassi, Laura","Salud Colectiva; 4(3); 261-282","Salud Colectiva","Espanhol","2008","http://www.scielosp.org/scielo.php?script=sci_arttext&pid=S1851-82652008000300002&lang=pt" 
"S1851-82652008000300003-spa","Procesos macroeconómicos y homicidios: un estudio ecológico en los partidos del Gran Buenos Aires (Argentina) entre los años 1989 y 2006","Spinelli, Hugo, Macías, Guillermo, Darraidou, Victoria","Salud Colectiva; 4(3); 283-299","Salud Colectiva","Espanhol","2008","http://www.scielosp.org/scielo.php?script=sci_arttext&pid=S1851-82652008000300003&lang=pt" 
"S1851-82652008000300004-spa","Políticas de drogas: prevención, participación y reducción del daño","Romaní, Oriol","Salud Colectiva; 4(3); 301-318","Salud Colectiva","Espanhol","2008","http://www.scielosp.org/scielo.php?script=sci_arttext&pid=S1851-82652008000300004&lang=pt" 
"S1851-82652008000300005-spa","Caminos divergentes para la protección social en salud en México","López-Arellano, Oliva, Blanco Gil, José","Salud Colectiva; 4(3); 319-333","Salud Colectiva","Espanhol","2008","http://www.scielosp.org/scielo.php?script=sci_arttext&pid=S1851-82652008000300005&lang=pt" 
"S1851-82652008000300006-spa","Promoción de la Salud, &quot;empowerment&quot; y educación: una reflexión crítica como contribución a la reforma sanitaria","Carvalho, Sérgio Resende","Salud Colectiva; 4(3); 335-347","Salud Colectiva","Espanhol","2008","http://www.scielosp.org/scielo.php?script=sci_arttext&pid=S1851-82652008000300006&lang=pt" 
"S1851-82652008000300007-spa","Estudio epidemiológico comparativo de la mortalidad por armas de fuego en Brasil y Argentina, 1990-2005","Zunino, Marina Gabriela, Souza, Edinilsa Ramos de, Lauritzen, Bruno","Salud Colectiva; 4(3); 349-361","Salud Colectiva","Espanhol","2008","http://www.scielosp.org/scielo.php?script=sci_arttext&pid=S1851-82652008000300007&lang=pt" 
"S1851-23722008000200001-arg","Micofilas, endófitos fúngicos y alcaloides en poblaciones de Melica stuckertii (Poaceae) del Centro de Argentina","Benavente, Cecilia A., Kurina-Sanz, Marcela, Lugo, Mónica A.","Boletín de la Sociedad Argentina de Botánica; 43(3-4); 189-195","Boletín de la Sociedad Argentina de Botánica","Espanhol","2008","http://www.scielo.org.ar/scielo.php?script=sci_arttext&pid=S1851-23722008000200001&lang=pt" 
"S1851-23722008000200002-arg","Hongos micorrícico arbusculares presentes en bosques de Alnus acuminata (Betulaceae) de la Yunga Argentina","Becerra, Alejandra, Cabello, Marta","Boletín de la Sociedad Argentina de Botánica; 43(3-4); 197-203","Boletín de la Sociedad Argentina de Botánica","Espanhol","2008","http://www.scielo.org.ar/scielo.php?script=sci_arttext&pid=S1851-23722008000200002&lang=pt" 
"S1851-23722008000200003-arg","New records in the lichen family Verrucariaceae (Ascomycota) from Argentina","Prieto, M., Aragón, G., Martínez, I.","Boletín de la Sociedad Argentina de Botánica; 43(3-4); 205-210","Boletín de la Sociedad Argentina de Botánica","Inglês","2008","http://www.scielo.org.ar/scielo.php?script=sci_arttext&pid=S1851-23722008000200003&lang=pt" 
"S1851-23722008000200004-arg","Host range findings on Beauveria bassiana and Metarhizium anisopliae (Ascomycota: Hypocreales) in Argentina","Toledo, A. V., De Remes Lenicov, A. M. M., López Lastra, C. C.","Boletín de la Sociedad Argentina de Botánica; 43(3-4); 211-220","Boletín de la Sociedad Argentina de Botánica","Inglês","2008","http://www.scielo.org.ar/scielo.php?script=sci_arttext&pid=S1851-23722008000200004&lang=pt" 
"S1851-23722008000200005-arg","Usnea amblyoclada «Barba de piedra» (Ascomycetes liquenizados) en Argentina","Rodriguez, Juan Manuel, Estrabou, Cecilia","Boletín de la Sociedad Argentina de Botánica; 43(3-4); 221-225","Boletín de la Sociedad Argentina de Botánica","Espanhol","2008","http://www.scielo.org.ar/scielo.php?script=sci_arttext&pid=S1851-23722008000200005&lang=pt" 
"S1851-23722008000200006-arg","Especies tóxicas de Agaricales halladas en la Argentina: nueva cita de Amanita pantherina y reevaluación de la comestibilidad de Tricholoma equestre","Lechner, Bernardo E., Albertó, Edgardo","Boletín de la Sociedad Argentina de Botánica; 43(3-4); 227-235","Boletín de la Sociedad Argentina de Botánica","Espanhol","2008","http://www.scielo.org.ar/scielo.php?script=sci_arttext&pid=S1851-23722008000200006&lang=pt" 
"S1851-23722008000200007-arg","Rauiella niveo-calycina (Thuidiaceae, Musci) is a new synonym of R. praelonga","Suárez, Guillermo M., Schiavone, María M.","Boletín de la Sociedad Argentina de Botánica; 43(3-4); 237-237","Boletín de la Sociedad Argentina de Botánica","Inglês","2008","http://www.scielo.org.ar/scielo.php?script=sci_arttext&pid=S1851-23722008000200007&lang=pt" 
"S1851-23722008000200008-arg","Anatomía comparada del leño de Eucalyptus camaldulensis (Myrtaceae) de dos orígenes, ensayados en Santiago del Estero","Moglia, Juana Graciela, Bravo, Sandra, Gerez, Roxana","Boletín de la Sociedad Argentina de Botánica; 43(3-4); 239-246","Boletín de la Sociedad Argentina de Botánica","Espanhol","2008","http://www.scielo.org.ar/scielo.php?script=sci_arttext&pid=S1851-23722008000200008&lang=pt" 
"S1851-23722008000200009-arg","Protuberancias intercelulares pécticas en especies neotropicales de Marattia (Marattiaceae- Pteridophyta)","Lavalle, María del Carmen, Mengascini, Adriana, Rodríguez, Mónica","Boletín de la Sociedad Argentina de Botánica; 43(3-4); 247-253","Boletín de la Sociedad Argentina de Botánica","Espanhol","2008","http://www.scielo.org.ar/scielo.php?script=sci_arttext&pid=S1851-23722008000200009&lang=pt" 
"S1851-23722008000200010-arg","Anatomía foliar y caulinar de Stemodia hassleriana (Scrophulariaceae), una especie endémica del Paraguay","Sosa, María de las Mercedes","Boletín de la Sociedad Argentina de Botánica; 43(3-4); 255-259","Boletín de la Sociedad Argentina de Botánica","Espanhol","2008","http://www.scielo.org.ar/scielo.php?script=sci_arttext&pid=S1851-23722008000200010&lang=pt" 
"S1851-23722008000200011-arg","Germinación de Grindelia ventanensis (Asteraceae), una especie endémica del sistema de Ventania (Buenos Aires)","Negrin, Vanesa Lorena, Zalba, Sergio Martín","Boletín de la Sociedad Argentina de Botánica; 43(3-4); 261-267","Boletín de la Sociedad Argentina de Botánica","Espanhol","2008","http://www.scielo.org.ar/scielo.php?script=sci_arttext&pid=S1851-23722008000200011&lang=pt" 
"S1851-23722008000200012-arg","Aspectos ecológicos y nuevas citas de Apinagia yguazuensis (Podostemaceae)","Fontana, José Luis","Boletín de la Sociedad Argentina de Botánica; 43(3-4); 269-272","Boletín de la Sociedad Argentina de Botánica","Espanhol","2008","http://www.scielo.org.ar/scielo.php?script=sci_arttext&pid=S1851-23722008000200012&lang=pt" 
"S1851-23722008000200013-arg","Las plantas vasculares de la Reserva de Uso Múltiple Guaraní, Misiones (Argentina)","Tressens, Sara G., Keller, Héctor A., Revilla, Víctor","Boletín de la Sociedad Argentina de Botánica; 43(3-4); 273-293","Boletín de la Sociedad Argentina de Botánica","Espanhol","2008","http://www.scielo.org.ar/scielo.php?script=sci_arttext&pid=S1851-23722008000200013&lang=pt" 
"S1851-23722008000200014-arg","Nuevas entidades en Stipa (Gramineae)","Roig, Fidel Antonio","Boletín de la Sociedad Argentina de Botánica; 43(3-4); 295-300","Boletín de la Sociedad Argentina de Botánica","Espanhol","2008","http://www.scielo.org.ar/scielo.php?script=sci_arttext&pid=S1851-23722008000200014&lang=pt" 
"S1851-23722008000200015-arg","Delimitación de Senecio filaginoides y rehabilitación de S. caricifolius, S. leuciscus y S. quenselii (Asteraceae, Senecioneae)","Tortosa, Roberto D., Bartoli, Adriana","Boletín de la Sociedad Argentina de Botánica; 43(3-4); 301-310","Boletín de la Sociedad Argentina de Botánica","Espanhol","2008","http://www.scielo.org.ar/scielo.php?script=sci_arttext&pid=S1851-23722008000200015&lang=pt" 
"S1851-23722008000200016-arg","Herbertia darwinii (Iridaceae: Tigridieae: Cipurinae), a new species from South America","Roitman, G., Castillo, A.","Boletín de la Sociedad Argentina de Botánica; 43(3-4); 311-314","Boletín de la Sociedad Argentina de Botánica","Inglês","2008","http://www.scielo.org.ar/scielo.php?script=sci_arttext&pid=S1851-23722008000200016&lang=pt" 
"S1983-32882008000200001-scl","The psychobiology of malnutrition in Brazil","Almeida, Sebastião Sousa, Morato, Silvio","Psychology &amp; Neuroscience; 1(2); 97-98","Psychology &amp; Neuroscience","Inglês","2008","http://www.scielo.br/scielo.php?script=sci_arttext&pid=S1983-32882008000200001&lang=pt" 
"S1983-32882008000200002-scl","The pioneer contribution of Luiz Marcellino de Oliveira to experimental analysis of behavior and psychobiological investigation in Brazil","Ferrari, Elenice A. de Moraes","Psychology &amp; Neuroscience; 1(2); 99-102","Psychology &amp; Neuroscience","Inglês","2008","http://www.scielo.br/scielo.php?script=sci_arttext&pid=S1983-32882008000200002&lang=pt" 
"S1983-32882008000200011-scl","Executive functions in the young elderly and oldest old: a preliminary comparison emphasizing decision making","Bakos, Daniela Schneider, Couto, Maria Clara Pinheiro de Paula, Melo, Wilson Vieira, Parente, Maria Alice de M. P., Koller, Silvia H., Bizarro, Lisiane","Psychology &amp; Neuroscience; 1(2); 183-189","Psychology &amp; Neuroscience","Inglês","2008","http://www.scielo.br/scielo.php?script=sci_arttext&pid=S1983-32882008000200011&lang=pt" 
"S1984-29612008000400001-scl","Controle da infestação por Ornithonyssus sylviarum (Canestrini e Fanzago, 1877) (Acari: Macronyssidae) em poedeiras comerciais utilizando extrato de Azadirachta indica","Soares, Nilce M., Tucci, Edna C., Guastalli, Elizabeth A. L., Yajima, Helena","Revista Brasileira de Parasitologia Veterinária; 17(4); 175-178","Revista Brasileira de Parasitologia Veterinária","Português","2008","http://www.scielo.br/scielo.php?script=sci_arttext&pid=S1984-29612008000400001&lang=pt" 
"S1984-29612008000400005-scl","Atividade residual in vitro do pelo de cobertura de cães tratados com dinotefuran sobre larvas e adultos de Ctenocephalides felis felis (Bouché, 1835) (Siphonaptera: pulicidae)","Correia, Thaís R., Cruz, Vanessa P. da, Ribeiro, Francisco de A., Melo, Raquel M. P. S., Fernandes, Julio I., Verocai, Guilherme G, Scott, Fabio B.","Revista Brasileira de Parasitologia Veterinária; 17(4); 195-199","Revista Brasileira de Parasitologia Veterinária","Português","2008","http://www.scielo.br/scielo.php?script=sci_arttext&pid=S1984-29612008000400005&lang=pt" 
"S1984-29612008000400006-scl","Histopatologia de fígado, rim e baço de piaractus mesopotamicus, prochilodus lineatus e pseudoplatystoma fasciatum parasitados por myxosporídios, capturados no Rio Aquidauana, Mato Grosso do Sul, Brasil","Campos, Cristiane M. de, Moraes, Julieta R. E. de, Moraes, Flávio R. de","Revista Brasileira de Parasitologia Veterinária; 17(4); 200-205","Revista Brasileira de Parasitologia Veterinária","Português","2008","http://www.scielo.br/scielo.php?script=sci_arttext&pid=S1984-29612008000400006&lang=pt" 
"S1984-29612008000400008-scl","Carrapatos do gênero amblyomma (acari: ixodidae) e suas relações com os hospedeiros em área endêmica para febre maculosa no Estado de São Paulo","Perez, Carlos Alberto, Almeida, Álvaro Fernando de, Almeida, Alexandre, Carvalho, Victor Hugo Barbosa de, Balestrin, Daniele do Carmo, Guimarães, Murilo Saraiva, Costa, Julio C., Ramos, Leonardo Adriano, Arruda-Santos, Ana Dulce, Máximo-Espíndola, Clarice Pinto, Barros-Battesti, Darci Moraes","Revista Brasileira de Parasitologia Veterinária; 17(4); 210-217","Revista Brasileira de Parasitologia Veterinária","Português","2008","http://www.scielo.br/scielo.php?script=sci_arttext&pid=S1984-29612008000400008&lang=pt" 
"S1984-29612008000400014-scl","Proposta para teste carrapaticida por imersão de larvas de Rhipicephalus (Boophilus) microplus: avaliação em cipermetrina e amitraz","Souza, Antonio P. de, Veiga, Luana Paula H. N., Bellato, Valdomiro, Sartor, Amélia Aparecida, Cardoso, Cristina P., Nunes, Ana Paula de O.","Revista Brasileira de Parasitologia Veterinária; 17(4); 242-245","Revista Brasileira de Parasitologia Veterinária","Português","2008","http://www.scielo.br/scielo.php?script=sci_arttext&pid=S1984-29612008000400014&lang=pt" 
"S1984-29612008000400012-scl","Aflatoxin effect on the oocysts morphometry and contribution on the morphology of Eimeria bateri Bhatia, Pandey and Pande, 1965 from the japanese quail Coturnix japonica in Brazil","Berto, Bruno P., Cardozo, Sergian V., Teixeira Filho, Walter L., Ferreira, Ana Maria R., Lopes, Carlos Wilson G.","Revista Brasileira de Parasitologia Veterinária; 17(4); 235-238","Revista Brasileira de Parasitologia Veterinária","Inglês","2008","http://www.scielo.br/scielo.php?script=sci_arttext&pid=S1984-29612008000400012&lang=pt" 
"S1984-29612008000400013-scl","Ocorrência de Platynosomum illiciens em felinos selvagens mantidos em cativeiro no estado da Bahia, Brasil","Castro, Letícia S. de, Albuquerque, George R.","Revista Brasileira de Parasitologia Veterinária; 17(4); 239-241","Revista Brasileira de Parasitologia Veterinária","Português","2008","http://www.scielo.br/scielo.php?script=sci_arttext&pid=S1984-29612008000400013&lang=pt" 
"S1984-29612008000400007-scl","Parasitas zoonóticos em fezes de cães em praças públicas do município de Itabuna, Bahia, Brasil","Campos Filho, Pedro C., Barros, Laise M., Campos, Jamille O., Braga, Vânia B., Cazorla, Irene M., Albuquerque, George R., Carvalho, Sílvia M.S.","Revista Brasileira de Parasitologia Veterinária; 17(4); 206-209","Revista Brasileira de Parasitologia Veterinária","Português","2008","http://www.scielo.br/scielo.php?script=sci_arttext&pid=S1984-29612008000400007&lang=pt" 
"S1984-29612008000400002-scl","Genotype characterization of the Haematobia Irritans (diptera: muscidae) from Brazil, Dominican Republic and Colombia based on randomly amplified polymorphic dna (rapd) analysis","Brito, Luciana Gatto, Regitano, Luciana C. de A., Huacca, Maribel Elizabeth F., Carrilho, Emanuel, Paes, Maria José, Moya- Borja, Gonzalo E.","Revista Brasileira de Parasitologia Veterinária; 17(4); 179-184","Revista Brasileira de Parasitologia Veterinária","Inglês","2008","http://www.scielo.br/scielo.php?script=sci_arttext&pid=S1984-29612008000400002&lang=pt" 
"S1984-29612008000400003-scl","Caracterização da população de ectoparasitos em cães de núcleos de expansão urbana de Juiz de Fora, Minas Gerais, Brasil","Rodrigues, Denise F., Daemon, Erik, Rodrigues, André Flávio S.F.","Revista Brasileira de Parasitologia Veterinária; 17(4); 185-188","Revista Brasileira de Parasitologia Veterinária","Português","2008","http://www.scielo.br/scielo.php?script=sci_arttext&pid=S1984-29612008000400003&lang=pt" 
"S1984-29612008000400004-scl","Freqüência de anticorpos anti-Neospora caninum em vacas e fetos provenientes de municípios do sul de Minas Gerais","Guedes, Marlon H. Paiva, Guimarães, Antônio M., Rocha, Christiane M.B.M., Hirsch, Christian","Revista Brasileira de Parasitologia Veterinária; 17(4); 189-194","Revista Brasileira de Parasitologia Veterinária","Português","2008","http://www.scielo.br/scielo.php?script=sci_arttext&pid=S1984-29612008000400004&lang=pt" 
"S1984-29612008000400009-scl","Ticks infesting amphibians and reptiles in Pernambuco, Northeastern Brazil","Dantas-Torres, Filipe, Oliveira-Filho, Edmilson F., Soares, Fábio Ângelo M., Souza, Bruno O.F., Valença, Raul Baltazar P., Sá, Fabrício B.","Revista Brasileira de Parasitologia Veterinária; 17(4); 218-221","Revista Brasileira de Parasitologia Veterinária","Inglês","2008","http://www.scielo.br/scielo.php?script=sci_arttext&pid=S1984-29612008000400009&lang=pt" 
"S1984-29612008000400010-scl","Frequency of antibodies against Neospora caninum in stray and domiciled dogs from urban, periurban and rural areas from Paraná State, Southern Brazil","Fridlund-Plugge, Nicolle, Montiani-Ferreira, Fabiano, Richartz, Rosária R. T. B., Dal Pizzol, Juliano, Machado Jr, Pedro C., Patrício, Lia F. L., Rosinelli, Adriana S., Locatelli-Dittrich, Rosangela","Revista Brasileira de Parasitologia Veterinária; 17(4); 222-226","Revista Brasileira de Parasitologia Veterinária","Inglês","2008","http://www.scielo.br/scielo.php?script=sci_arttext&pid=S1984-29612008000400010&lang=pt" 
"S1984-29612008000400011-scl","Recuperação de larvas infectantes de Trichostrongylus colubriformis em três espécies de gramíneas contaminadas no verão","Rocha, Raquel A. da, Rocha, Gilberto P. da, Bricarello, Patrizia A., Amarante, Alessandro F. T.","Revista Brasileira de Parasitologia Veterinária; 17(4); 227-234","Revista Brasileira de Parasitologia Veterinária","Português","2008","http://www.scielo.br/scielo.php?script=sci_arttext&pid=S1984-29612008000400011&lang=pt" 
"S1851-82652008000300009-spa","Homenaje a Mario Hamilton: Buenos Aires 1932 - Río de Janeiro 2008","Testa, Mario","Salud Colectiva; 4(3); 373-374","Salud Colectiva","Espanhol","2008","http://www.scielosp.org/scielo.php?script=sci_arttext&pid=S1851-82652008000300009&lang=pt" 
"S1851-82652008000300001-spa","La producción de conocimiento en América Latina","Quintanilla-Montoya, Ana Luz","Salud Colectiva; 4(3); 253-260","Salud Colectiva","Espanhol","2008","http://www.scielosp.org/scielo.php?script=sci_arttext&pid=S1851-82652008000300001&lang=pt" 
"S1851-82652008000300008-spa","El mal de Chagas en los ojos de la nación: ciencia y salud en Brasil a comienzos del siglo XX","Kropf, Simone Petraglia","Salud Colectiva; 4(3); 363-372","Salud Colectiva","Espanhol","2008","http://www.scielosp.org/scielo.php?script=sci_arttext&pid=S1851-82652008000300008&lang=pt" 
"S1678-69712008000700001-scl","Apresentação","BATAGLIA, WALTER","RAM. Revista de Administração Mackenzie; 9(7); 9-10","RAM. Revista de Administração Mackenzie","Português","2008","http://www.scielo.br/scielo.php?script=sci_arttext&pid=S1678-69712008000700001&lang=pt" 
"S1678-69712008000700005-scl","Da qualificação à competência: deslocamento conceitual e individualização do trabalhador","Amaro, Rubens de Araújo","RAM. Revista de Administração Mackenzie; 9(7); 89-111","RAM. Revista de Administração Mackenzie","Português","2008","http://www.scielo.br/scielo.php?script=sci_arttext&pid=S1678-69712008000700005&lang=pt" 
"S1678-69712008000700003-scl","Atitudes ante produtos bancários: a visão dos funcionários","Nepomuceno, Marcelo Vinhal","RAM. Revista de Administração Mackenzie; 9(7); 41-69","RAM. Revista de Administração Mackenzie","Português","2008","http://www.scielo.br/scielo.php?script=sci_arttext&pid=S1678-69712008000700003&lang=pt" 
