"S1414-32832008000100030-sss","National Humanization Policy as a bet for collective production of changes in management and care methods","Pasche, Dário Frederico, Badiz, Philip Sidney Pacheco","Interface - Comunicação, Saúde, Educação; 4(se); -","Interface - Comunicação, Saúde, Educação","Inglês","2008","http://socialsciences.scielo.org/scielo.php?script=sci_arttext&pid=S1414-32832008000100030&lang=pt" 
"S1414-32832008000100033-sss","Internal management contracts within the context of the Humanization Policy: experimenting with methodology within the reference frame of co-management","Santos Filho, Serafim Barbosa, Figueiredo, Vera de Oliveira Nunes, Vallim, Maria Aparecida Gazotti","Interface - Comunicação, Saúde, Educação; 4(se); -","Interface - Comunicação, Saúde, Educação","Inglês","2008","http://socialsciences.scielo.org/scielo.php?script=sci_arttext&pid=S1414-32832008000100033&lang=pt" 
"S1414-32832008000100032-sss","The National Humanization Policy as a policy produced within the healthcare labor process","Santos Filho, Serafim Barbosa, Barros, Maria Elizabeth Barros de, Gomes, Rafael da Silveira, Badiz, Philip Sidney Pacheco","Interface - Comunicação, Saúde, Educação; 4(se); -","Interface - Comunicação, Saúde, Educação","Inglês","2008","http://socialsciences.scielo.org/scielo.php?script=sci_arttext&pid=S1414-32832008000100032&lang=pt" 
"S0717-71942008000100005-sss","An empire in the tropics: historiographic analysis","Sagredo Baeza, Rafael, Labarca Cortés, Cristina","Historia (Santiago); 4(se); -","Historia (Santiago)","Inglês","2008","http://socialsciences.scielo.org/scielo.php?script=sci_arttext&pid=S0717-71942008000100005&lang=pt" 
"S0327-77122008000100005-sss","An approach to Paraguayan organized groups in Buenos Aires","Halpern, Gerardo, Marchi, Agostina","Sociedad (Buenos Aires); 4(se); -","Sociedad (Buenos Aires)","Inglês","2008","http://socialsciences.scielo.org/scielo.php?script=sci_arttext&pid=S0327-77122008000100005&lang=pt" 
"S0104-83332008000100005-sss","L&#039;Italia dei Divieti: in between the dream of being european and the &quot;babado&quot; of prostituition","Teixeira, Flávia do Bonsucesso, Blanchette, Thaddeus Gregory","Cadernos Pagu; 1(se); -","Cadernos Pagu","Inglês","2008","http://socialsciences.scielo.org/scielo.php?script=sci_arttext&pid=S0104-83332008000100005&lang=pt" 
"S0101-90742008000200002-scl","Ética, capitalismo e arqueologia pública no Brasil","Funari, Pedro Paulo A., Robrahn-González, Erika M.","História (São Paulo); 27(2); 13-30","História (São Paulo)","Português","2008","http://www.scielo.br/scielo.php?script=sci_arttext&pid=S0101-90742008000200002&lang=pt" 
"S0101-90742008000200003-scl","Restauro arquitetônico: a formação do arquiteto no Brasil para preservação do patrimônio edificado","Farah, Ana Paula","História (São Paulo); 27(2); 31-47","História (São Paulo)","Português","2008","http://www.scielo.br/scielo.php?script=sci_arttext&pid=S0101-90742008000200003&lang=pt" 
"S0101-90742008000200004-scl","Entre o uso social e o abuso comercial: as percepções do patrimônio cultural subaquático no Brasil","Rambelli, Gilson","História (São Paulo); 27(2); 49-74","História (São Paulo)","Português","2008","http://www.scielo.br/scielo.php?script=sci_arttext&pid=S0101-90742008000200004&lang=pt" 
"S0101-90742008000200006-scl","O estatuto da cidade e os instrumentos de política urbana para proteção do patrimônio histórico: outorga onerosa e transferência do direito de construir","Santin, Janaína Rigo, Marangon, Elizete Gonçalves","História (São Paulo); 27(2); 89-109","História (São Paulo)","Português","2008","http://www.scielo.br/scielo.php?script=sci_arttext&pid=S0101-90742008000200006&lang=pt" 
"S0101-90742008000200010-scl","Para além do Rio Grande: os impactos da economia paulista sobre O Triângulo Mineiro","Oliveira, Paulo Roberto de","História (São Paulo); 27(2); 203-222","História (São Paulo)","Português","2008","http://www.scielo.br/scielo.php?script=sci_arttext&pid=S0101-90742008000200010&lang=pt" 
"S0101-90742008000200011-scl","O papado avinhonense e os poderes civis: as décadas de 30 e de 40 do século XIV a partir de três obras de Guilherme de Ockham","Magalhães, Ana Paula Tavares","História (São Paulo); 27(2); 223-251","História (São Paulo)","Português","2008","http://www.scielo.br/scielo.php?script=sci_arttext&pid=S0101-90742008000200011&lang=pt" 
"S0101-90742008000200012-scl","Fotografia, história e vistas urbanas","Possamai, Zita Rosane","História (São Paulo); 27(2); 253-277","História (São Paulo)","Português","2008","http://www.scielo.br/scielo.php?script=sci_arttext&pid=S0101-90742008000200012&lang=pt" 
"S0101-90742008000100003-scl","A França Antártica e a criação de padrões narrativos sobre o Brasil e os brasileiros","França, Jean Marcel Carvalho","História (São Paulo); 27(1); 15-27","História (São Paulo)","Português","2008","http://www.scielo.br/scielo.php?script=sci_arttext&pid=S0101-90742008000100003&lang=pt" 
"S0101-90742008000100005-scl","Villegagnon: herói ou vilão?","Mariz, Vasco","História (São Paulo); 27(1); 51-75","História (São Paulo)","Português","2008","http://www.scielo.br/scielo.php?script=sci_arttext&pid=S0101-90742008000100005&lang=pt" 
"S0101-90742008000100007-scl","La mémoire de la France Antarctique","Lestringan, Frank","História (São Paulo); 27(1); 101-133","História (São Paulo)","Francês","2008","http://www.scielo.br/scielo.php?script=sci_arttext&pid=S0101-90742008000100007&lang=pt" 
"S0101-90742008000100010-scl","A feitoria portuguesa do Rio de Janeiro","Fernendes, Fernando Lourenço","História (São Paulo); 27(1); 155-194","História (São Paulo)","Português","2008","http://www.scielo.br/scielo.php?script=sci_arttext&pid=S0101-90742008000100010&lang=pt" 
"S0101-90742008000100011-scl","Escritos, imagens e artefatos: ou a viagem de Thevet à França Antártica","Raminelli, Ronald José","História (São Paulo); 27(1); 195-212","História (São Paulo)","Português","2008","http://www.scielo.br/scielo.php?script=sci_arttext&pid=S0101-90742008000100011&lang=pt" 
"S0101-90742008000100012-scl","Villegagnon &amp; Cook: tupinambá e havaiano","Osward, Christina","História (São Paulo); 27(1); 213-245","História (São Paulo)","Português","2008","http://www.scielo.br/scielo.php?script=sci_arttext&pid=S0101-90742008000100012&lang=pt" 
"S0101-90742008000100013-scl","Villegagnon ou a utopia tropical","Elmalan, Serge","História (São Paulo); 27(1); 247-281","História (São Paulo)","Português","2008","http://www.scielo.br/scielo.php?script=sci_arttext&pid=S0101-90742008000100013&lang=pt" 
"S0101-90742008000100014-scl","La crise exemplaire d&#039;un modèle européen en Amérique latine: les racines anciennes du retrait du modèle politique et culturel français","Rolland, Denis","História (São Paulo); 27(1); 283-344","História (São Paulo)","Francês","2008","http://www.scielo.br/scielo.php?script=sci_arttext&pid=S0101-90742008000100014&lang=pt" 
"S0101-90742008000100015-scl","A civilização maia: contextualização historiográfica e arqueológica","Navarro, Alexandre Guida","História (São Paulo); 27(1); 347-377","História (São Paulo)","Português","2008","http://www.scielo.br/scielo.php?script=sci_arttext&pid=S0101-90742008000100015&lang=pt" 
"S0101-90742008000200008-scl","A gestão do patrimônio imaterial brasileiro na contemporaneidade","Pelegrini, Sandra C. A.","História (São Paulo); 27(2); 145-173","História (São Paulo)","Português","2008","http://www.scielo.br/scielo.php?script=sci_arttext&pid=S0101-90742008000200008&lang=pt" 
"S0101-90742008000200009-scl","Migraciones e Inmigraciones en las religiones: la diversidad religiosa en el Medioevo","Rodríguez, Gerardo","História (São Paulo); 27(2); 177-201","História (São Paulo)","Espanhol","2008","http://www.scielo.br/scielo.php?script=sci_arttext&pid=S0101-90742008000200009&lang=pt" 
"S0101-90742008000200007-scl","O Centro de Documentação Musical da UFPel no horizonte da multidisciplinaridade: articulações entre musicologia histórica, gestão patrimonial e memória institucional","Cerqueira, Fábio Vergara, Michelon, Francisca Ferreira, Nogueira, Isabel Porto, Goldberg, Luiz Guilherme Duro, Ferreira, Maria Letícia Mazzuchi","História (São Paulo); 27(2); 111-143","História (São Paulo)","Português","2008","http://www.scielo.br/scielo.php?script=sci_arttext&pid=S0101-90742008000200007&lang=pt" 
"S0864-34662008000200007-spa","Gastos asumidos por la familia durante el ingreso en el hogar","García Fariñas, Anaí, Rodríguez Salvá, Armando, Marine Alonso, Maria de Los Ángeles, Vos, Pol de, Van der Stuyfs, Patrick","Revista Cubana de Salud Pública; 34(2); -","Revista Cubana de Salud Pública","Espanhol","2008","http://www.scielosp.org/scielo.php?script=sci_arttext&pid=S0864-34662008000200007&lang=pt" 
"S0864-34662008000200008-spa","Impacto de las condiciones laborales en la salud de trabajadores de un centro quirúrgico","Tomasina, Fernando, Bozzo, Elizabeth, Chaves, Elizabeth, Pucci, Francisco","Revista Cubana de Salud Pública; 34(2); -","Revista Cubana de Salud Pública","Espanhol","2008","http://www.scielosp.org/scielo.php?script=sci_arttext&pid=S0864-34662008000200008&lang=pt" 
"S0864-34662008000400005-spa","Caracterización psicosocial de pacientes con diabetes tipo 2 en atención primaria","Colunga-Rodríguez, Cecilia, García de Alba, Javier E., Ángel-González, Mario, Salazar-Estrada, José G.","Revista Cubana de Salud Pública; 34(4); 1-7","Revista Cubana de Salud Pública","Espanhol","2008","http://www.scielosp.org/scielo.php?script=sci_arttext&pid=S0864-34662008000400005&lang=pt" 
"S0864-34662008000400020-spa","José Jordán Rodríguez (1920-2008)","","Revista Cubana de Salud Pública; 34(4); 1-2","Revista Cubana de Salud Pública","Espanhol","2008","http://www.scielosp.org/scielo.php?script=sci_arttext&pid=S0864-34662008000400020&lang=pt" 
"S0864-34662008000400019-spa","Edmundo Granda Ugalde (1946-2008)","","Revista Cubana de Salud Pública; 34(4); 1-1","Revista Cubana de Salud Pública","Espanhol","2008","http://www.scielosp.org/scielo.php?script=sci_arttext&pid=S0864-34662008000400019&lang=pt" 
"S0864-34662008000400001-spa","","Ochoa, Francisco Rojas","Revista Cubana de Salud Pública; 34(4); 1-1","Revista Cubana de Salud Pública","Espanhol","2008","http://www.scielosp.org/scielo.php?script=sci_arttext&pid=S0864-34662008000400001&lang=pt" 
"S0864-34662008000400021-spa","Llamamiento de la Seccion de Medicina Social (Ateneo &quot;Juan César García&quot;), de la Sociedad Cubana de Salud Pública-ALAMES Cuba","","Revista Cubana de Salud Pública; 34(4); 1-1","Revista Cubana de Salud Pública","Espanhol","2008","http://www.scielosp.org/scielo.php?script=sci_arttext&pid=S0864-34662008000400021&lang=pt" 
"S0864-34662008000200011-spa","Necesidad de cambios organizativos en el Sistema Nacional de Salud para la atención del ictus","Fernández Concepción, Otman, Buergo Zuaznabar, Miguel Ángel","Revista Cubana de Salud Pública; 34(2); -","Revista Cubana de Salud Pública","Espanhol","2008","http://www.scielosp.org/scielo.php?script=sci_arttext&pid=S0864-34662008000200011&lang=pt" 
"S0864-34662008000400018-spa","Las ciencias sociales en medicina","García, Juan César","Revista Cubana de Salud Pública; 34(4); 1-13","Revista Cubana de Salud Pública","Espanhol","2008","http://www.scielosp.org/scielo.php?script=sci_arttext&pid=S0864-34662008000400018&lang=pt" 
"S0864-34662008000400017-spa","Metodología para definir funciones profesionales","Torres Esperón, Maricela","Revista Cubana de Salud Pública; 34(4); 1-12","Revista Cubana de Salud Pública","Espanhol","2008","http://www.scielosp.org/scielo.php?script=sci_arttext&pid=S0864-34662008000400017&lang=pt" 
"S0864-34662008000400016-spa","Implicación de los valores éticos y morales en el enfrentamiento de las adicciones en jóvenes","Gutierrez Raina, Daniel, Hernández Meléndez, Edelsys","Revista Cubana de Salud Pública; 34(4); 1-13","Revista Cubana de Salud Pública","Espanhol","2008","http://www.scielosp.org/scielo.php?script=sci_arttext&pid=S0864-34662008000400016&lang=pt" 
"S0864-34662008000400015-spa","Universalización de la formación académica e investigativa para la obtención del doctorado en el sector salud","Castañeda Abascal, Ileana Elena, Rodríguez Cabrera, Aida, Hernández Meléndez, Edelsys, Rojo Pérez, Nereida","Revista Cubana de Salud Pública; 34(4); 1-11","Revista Cubana de Salud Pública","Espanhol","2008","http://www.scielosp.org/scielo.php?script=sci_arttext&pid=S0864-34662008000400015&lang=pt" 
"S0864-34662008000400014-spa","La relación entre los niveles de atención constituye un determinante clave de la salud","Van der Stuyft, Patrick, De Vos, Pol","Revista Cubana de Salud Pública; 34(4); 1-9","Revista Cubana de Salud Pública","Espanhol","2008","http://www.scielosp.org/scielo.php?script=sci_arttext&pid=S0864-34662008000400014&lang=pt" 
"S0864-34662008000400013-spa","La evaluación de la satisfacción en salud: un reto a la calidad","Massip Pérez, Coralia, Ortiz Reyes, Rosa María, Llantá Abreu, María del Carmen, Peña Fortes, Madai, Infante Ochoa, Idalmis","Revista Cubana de Salud Pública; 34(4); 1-10","Revista Cubana de Salud Pública","Espanhol","2008","http://www.scielosp.org/scielo.php?script=sci_arttext&pid=S0864-34662008000400013&lang=pt" 
"S0864-34662008000400012-spa","Repercusión visual del uso de las computadoras sobre la salud","Pérez Tejeda, Alain A., Acuña Pardo, Arlenis, Rúa Martínez, Raúl","Revista Cubana de Salud Pública; 34(4); 1-9","Revista Cubana de Salud Pública","Espanhol","2008","http://www.scielosp.org/scielo.php?script=sci_arttext&pid=S0864-34662008000400012&lang=pt" 
"S0864-34662008000400011-spa","El artículo de revisión","Cué Brugueras, Manuel, Díaz Alonso, Guillermo, Díaz Martínez, Ana Gloria, Valdés Abreu, Manuela de la C.","Revista Cubana de Salud Pública; 34(4); 1-11","Revista Cubana de Salud Pública","Espanhol","2008","http://www.scielosp.org/scielo.php?script=sci_arttext&pid=S0864-34662008000400011&lang=pt" 
"S0864-34662008000400010-spa","Potencial erosivo de las bebidas industriales sobre el esmalte dental","López Soto, Olga Patricia, Cerezo Correa, María del Pilar","Revista Cubana de Salud Pública; 34(4); 1-9","Revista Cubana de Salud Pública","Espanhol","2008","http://www.scielosp.org/scielo.php?script=sci_arttext&pid=S0864-34662008000400010&lang=pt" 
"S0864-34662008000400009-spa","Incidencia de Listeria spp. en hortalizas frescas","Martino, Tamara K., Lemus, Diadelys, Leyva, Virginia, Tejedor, René, de los Reyes, Maritza, Soto, Perla","Revista Cubana de Salud Pública; 34(4); 1-11","Revista Cubana de Salud Pública","Espanhol","2008","http://www.scielosp.org/scielo.php?script=sci_arttext&pid=S0864-34662008000400009&lang=pt" 
"S0864-34662008000400008-spa","Primer estudio de Enterobacter sakazakii en alimentos en Cuba","Leyva, Virginia, Ruiz, Heidi, Machín, Mayrín, Tejedor, René, Martino, Tamara K., Ferrer, Yaumara","Revista Cubana de Salud Pública; 34(4); 1-9","Revista Cubana de Salud Pública","Espanhol","2008","http://www.scielosp.org/scielo.php?script=sci_arttext&pid=S0864-34662008000400008&lang=pt" 
"S0864-34662008000400007-spa","Niveles de eficiencia de los policlínicos tipo I en Matanzas: Evolución durante el año 2006","Sánchez Delgado, Zoe, Chaviano Morena, Magalys, García Fariñas, Anaí","Revista Cubana de Salud Pública; 34(4); 1-15","Revista Cubana de Salud Pública","Espanhol","2008","http://www.scielosp.org/scielo.php?script=sci_arttext&pid=S0864-34662008000400007&lang=pt" 
"S0864-34662008000400006-spa","Costo institucional del infarto agudo del miocardio en en el Instituto de Cardiología y Cirugía Cardiovascular","Fernández García, Ariana, Gálvez González, Ana María, Castillo Guzmán, Antonio","Revista Cubana de Salud Pública; 34(4); 1-7","Revista Cubana de Salud Pública","Espanhol","2008","http://www.scielosp.org/scielo.php?script=sci_arttext&pid=S0864-34662008000400006&lang=pt" 
"S0864-34662008000400004-spa","Criterios del personal de apoyo en el trabajo contra el Aedes aegypti en Ciudad de La Habana. 2006","Jean-Claude, Magdalena Mirabal, Noriega Bravo, Vivian","Revista Cubana de Salud Pública; 34(4); 1-10","Revista Cubana de Salud Pública","Espanhol","2008","http://www.scielosp.org/scielo.php?script=sci_arttext&pid=S0864-34662008000400004&lang=pt" 
"S0864-34662008000400003-spa","Las tecnicas de estadistica espacial en la investigación salubrista: caso síndrome de Down","Alegret Rodríguez, Milagros, Herrera, Manuela, Grau Abalo, Ricardo","Revista Cubana de Salud Pública; 34(4); 1-11","Revista Cubana de Salud Pública","Espanhol","2008","http://www.scielosp.org/scielo.php?script=sci_arttext&pid=S0864-34662008000400003&lang=pt" 
"S0864-34662008000400002-spa","El tabaquismo en los profesionales de la salud en el municipio Habana Vieja","Suárez Lugo, Nery, Caraballoso Hernández, Magali, Hechavarria Negrín, Sandra","Revista Cubana de Salud Pública; 34(4); 1-11","Revista Cubana de Salud Pública","Espanhol","2008","http://www.scielosp.org/scielo.php?script=sci_arttext&pid=S0864-34662008000400002&lang=pt" 
"S0864-34662008000200015-spa","Ambiente y enfermedad: ¿Asociación o causación?","Hill, Austin Bradford","Revista Cubana de Salud Pública; 34(2); -","Revista Cubana de Salud Pública","Espanhol","2008","http://www.scielosp.org/scielo.php?script=sci_arttext&pid=S0864-34662008000200015&lang=pt" 
"S0864-34662008000200006-spa","Conocimientos y comportamientos sobre el VIH/SIDA en adolescentes de enseñanza media superior","González Valcárcel, Bertha, Núñez Aragón, Elsa, Couturejuzon González, Lourdes, Amable Ambrós, Zoraida","Revista Cubana de Salud Pública; 34(2); -","Revista Cubana de Salud Pública","Espanhol","2008","http://www.scielosp.org/scielo.php?script=sci_arttext&pid=S0864-34662008000200006&lang=pt" 
"S0864-34662008000200004-spa","La clasificación multivariante de áreas geográficas como una alternativa útil a la investigación salubrista","Alegret Rodríguez, Milagros, Grau Abalo, Ricardo, Rodríguez Rodríguez, Mercedes","Revista Cubana de Salud Pública; 34(2); -","Revista Cubana de Salud Pública","Espanhol","2008","http://www.scielosp.org/scielo.php?script=sci_arttext&pid=S0864-34662008000200004&lang=pt" 
"S0864-34662008000200002-spa","Prevalencia de discapacidad física en adultos mayores de provincias seleccionadas, Cuba 2000-2004","Bayarre Vea, Héctor D., Pérez Piñero, Julia S., Menéndez Jiménez, Jesús, Tamargo Barbeito, Teddy O., Morejón Carralero, Agustín, Garrido Díaz, Dayamí, Piñera Marrero, Arlín González de","Revista Cubana de Salud Pública; 34(2); -","Revista Cubana de Salud Pública","Espanhol","2008","http://www.scielosp.org/scielo.php?script=sci_arttext&pid=S0864-34662008000200002&lang=pt" 
"S0864-34662008000200010-spa","Estado de salud y su relación con los determinantes: procedimientos de análisis","López Pardo, Cándido M.","Revista Cubana de Salud Pública; 34(2); -","Revista Cubana de Salud Pública","Espanhol","2008","http://www.scielosp.org/scielo.php?script=sci_arttext&pid=S0864-34662008000200010&lang=pt" 
"S0102-64452008000300004-scl","A revolução russa e o sistema internacional","Ricupero, Rubens","Lua Nova: Revista de Cultura e Política; (75); 59-76","Lua Nova: Revista de Cultura e Política","Português","2008","http://www.scielo.br/scielo.php?script=sci_arttext&pid=S0102-64452008000300004&lang=pt" 
"S0102-64452008000300001-scl","Apresentação","","Lua Nova: Revista de Cultura e Política; (75); -","Lua Nova: Revista de Cultura e Política","Português","2008","http://www.scielo.br/scielo.php?script=sci_arttext&pid=S0102-64452008000300001&lang=pt" 
"S0718-686X2008000200007-chl","SOUTH-WEST ATLANTIC RIGHT WHALES EUBALAENA AUSTRALIS (DESMOULINS, 1822) DISTRIBUTION NEARBY THE MAGELLAN STRAIT","Belgrano, Jimena, Iñíguez, Miguel, Gibbons, Jorge, García, Cristian, Olavarría, Carlos","Anales del Instituto de la Patagonia; 36(2); 69-74","Anales del Instituto de la Patagonia","Inglês","2008","http://www.scielo.cl/scielo.php?script=sci_arttext&pid=S0718-686X2008000200007&lang=pt" 
"S0718-686X2008000200006-chl","ANALES DEL INSTITUTO DE LA PATAGONIA: LAS CIENCIAS NATURALES","Pérez, Vicente","Anales del Instituto de la Patagonia; 36(2); 53-68","Anales del Instituto de la Patagonia","Espanhol","2008","http://www.scielo.cl/scielo.php?script=sci_arttext&pid=S0718-686X2008000200006&lang=pt" 
"S0718-686X2008000200005-chl","AVES ACUÁTICAS EN EL HUMEDAL URBANO DE TRES PUENTES, PUNTA ARENAS (53° S), CHILE AUSTRAL","Kusch, Alejandro, Cárcamo, Jaime, Gómez, Humberto","Anales del Instituto de la Patagonia; 36(2); 45-51","Anales del Instituto de la Patagonia","Espanhol","2008","http://www.scielo.cl/scielo.php?script=sci_arttext&pid=S0718-686X2008000200005&lang=pt" 
"S0718-686X2008000200004-chl","TAMAÑO, ESTRUCTURA Y DISTRIBUCIÓN ESTACIONAL DE POBLACIONES DE AVES ACUÁTICAS EN EL FIORDO ÚLTIMA ESPERANZA Y CANAL SEÑORET, REGIÓN DE MAGALLANES","Garay, Gladys, Guineo, Oscar, Mutschke, Erika, Ríos, Carlos","Anales del Instituto de la Patagonia; 36(2); 33-43","Anales del Instituto de la Patagonia","Espanhol","2008","http://www.scielo.cl/scielo.php?script=sci_arttext&pid=S0718-686X2008000200004&lang=pt" 
"S0718-686X2008000200003-chl","MAGELLANIC PENGUIN (SPHENISCIDAE) MONITORING RESULTS FOR MAGDALENA ISLAND (CHILE) 2000 - 2008","Bingham, Mike, Herrmann, Thora M.","Anales del Instituto de la Patagonia; 36(2); 19-32","Anales del Instituto de la Patagonia","Inglês","2008","http://www.scielo.cl/scielo.php?script=sci_arttext&pid=S0718-686X2008000200003&lang=pt" 
"S0718-686X2008000200002-chl","COASTAL MIGRATORY CONNECTIONS OF HUMPBACK WHALES, MEGAPTERA NOVAEANGLIAE BOROWSKI, 1781, IN SOUTHERN CHILE","Capella, Juan, Galletti Vernazzani, Bárbara, Gibbons, Jorge, Cabrera, Elsa","Anales del Instituto de la Patagonia; 36(2); 13-18","Anales del Instituto de la Patagonia","Inglês","2008","http://www.scielo.cl/scielo.php?script=sci_arttext&pid=S0718-686X2008000200002&lang=pt" 
"S0718-686X2008000200001-chl","VARIABILIDAD TÉRMICA EN LA REGIÓN NORORIENTAL DE LA PENÍNSULA DE BRUNSWICK, MAGALLANES, CHILE, EMPLEANDO DATOS LANDSAT","Olave-Solar, Carlos, Santana, Ariel, Butorovic, Nicolás, Acuña, Paola","Anales del Instituto de la Patagonia; 36(2); 5-12","Anales del Instituto de la Patagonia","Espanhol","2008","http://www.scielo.cl/scielo.php?script=sci_arttext&pid=S0718-686X2008000200001&lang=pt" 
"S0718-686X2008000200009-chl","PRIMER REGISTRO DEL CHUCAO SCELORCHILUS RUBECULA (KITTLITZ, 1830) (RHINOCRYPTIDAE) EN MAGALLANES","Cárcamo, Jaime, Henríquez, Juan M, Kusch, Alejandro","Anales del Instituto de la Patagonia; 36(2); 79-81","Anales del Instituto de la Patagonia","Espanhol","2008","http://www.scielo.cl/scielo.php?script=sci_arttext&pid=S0718-686X2008000200009&lang=pt" 
"S0718-686X2008000200008-chl","ON THE GEOGRAPHIC DISTRIBUTION OF PARABROTEAS SARSI (MRÁZEK, 1901) (COPEPODA, CALANOIDA)","De los Ríos, Patricio, Rivera, Reinaldo","Anales del Instituto de la Patagonia; 36(2); 75-78","Anales del Instituto de la Patagonia","Inglês","2008","http://www.scielo.cl/scielo.php?script=sci_arttext&pid=S0718-686X2008000200008&lang=pt" 
"S0102-64452008000300003-scl","A Revolução Russa em perspectiva histórica e comparada","Florenzano, Modesto","Lua Nova: Revista de Cultura e Política; (75); 41-57","Lua Nova: Revista de Cultura e Política","Português","2008","http://www.scielo.br/scielo.php?script=sci_arttext&pid=S0102-64452008000300003&lang=pt" 
"S0102-64452008000300007-scl","O comunismo na história do século XX","Groppo, Bruno","Lua Nova: Revista de Cultura e Política; (75); 115-141","Lua Nova: Revista de Cultura e Política","Português","2008","http://www.scielo.br/scielo.php?script=sci_arttext&pid=S0102-64452008000300007&lang=pt" 
"S0102-64452008000300009-scl","Revolução 2008-?","Dunn, John","Lua Nova: Revista de Cultura e Política; (75); 199-214","Lua Nova: Revista de Cultura e Política","Português","2008","http://www.scielo.br/scielo.php?script=sci_arttext&pid=S0102-64452008000300009&lang=pt" 
"S0102-64452008000300002-scl","Violências de baixo, violências de cima na revolução russa","Werth, Nicolas","Lua Nova: Revista de Cultura e Política; (75); 11-40","Lua Nova: Revista de Cultura e Política","Português","2008","http://www.scielo.br/scielo.php?script=sci_arttext&pid=S0102-64452008000300002&lang=pt" 
"S0102-64452008000300008-scl","Em torno da pré-história intelectual do totalitarismo igualitarista","Fausto, Ruy","Lua Nova: Revista de Cultura e Política; (75); 143-198","Lua Nova: Revista de Cultura e Política","Português","2008","http://www.scielo.br/scielo.php?script=sci_arttext&pid=S0102-64452008000300008&lang=pt" 
"S0102-64452008000300006-scl","Império, estado e ideologia na URSS stalinista","Pons, Silvio","Lua Nova: Revista de Cultura e Política; (75); 99-113","Lua Nova: Revista de Cultura e Política","Português","2008","http://www.scielo.br/scielo.php?script=sci_arttext&pid=S0102-64452008000300006&lang=pt" 
"S0185-26982008000200001-mex","","Chehaibar Náder, Lourdes M","Perfiles educativos; 30(120); 3-6","Perfiles educativos","Espanhol","2008","http://www.scielo.org.mx/scielo.php?script=sci_arttext&pid=S0185-26982008000200001&lang=pt" 
"S0185-26982008000200010-mex","Examen final: la educación en México (2000-2006)","Monroy Jiménez, Wendy Jazmín","Perfiles educativos; 30(120); 151-155","Perfiles educativos","Espanhol","2008","http://www.scielo.org.mx/scielo.php?script=sci_arttext&pid=S0185-26982008000200010&lang=pt" 
