"S0212-71992007001100017-esp","Laparotomía urgente en un caso de paniculitis mesentérica","Arjona Sánchez, A., Torres Tordera, E., Martínez Cecilia, D., Alonso Gómez, J., Rufián Peña, S.","Anales de Medicina Interna; 24(11); 566-567","Anales de Medicina Interna","Espanhol","2007","http://scielo.isciii.es/scielo.php?script=sci_arttext&pid=S0212-71992007001100017&lang=pt" 
"S0212-71992007001100013-esp","Angioedema asociado a captopril","Nicolás Sánchez, F. J., Moreno Arias, G., Gort Oromí, A., Sarrat Nuevo, R. M., Nicolás Sánchez, M. E., Cabau Rubies, J.","Anales de Medicina Interna; 24(11); 562-563","Anales de Medicina Interna","Espanhol","2007","http://scielo.isciii.es/scielo.php?script=sci_arttext&pid=S0212-71992007001100013&lang=pt" 
"S0212-71992007001100012-esp","Tumor pardo malar e hipercalcemia severa asintomática como formas atípicas de presentación de un hiperparatiroidismo primario","Fontseré Baldellou, N., Andrés Santamaría, M., Bella Cueto, F., Ramírez de Arellano Serna, M.","Anales de Medicina Interna; 24(11); 561-562","Anales de Medicina Interna","Espanhol","2007","http://scielo.isciii.es/scielo.php?script=sci_arttext&pid=S0212-71992007001100012&lang=pt" 
"S0212-71992007001100006-esp","Endocarditis infecciosa por enterococo: descripción de 12 casos","Martínez Odriozola, P., Muñoz Sánchez, J., Arriola Martínez, P., Lizarralde Palacios, E., Santamaría Jáuregui, J. M., Zuazo Meabe, J., Cisterna Cáncer, R., La Villa, F. M. de","Anales de Medicina Interna; 24(11); 539-542","Anales de Medicina Interna","Espanhol","2007","http://scielo.isciii.es/scielo.php?script=sci_arttext&pid=S0212-71992007001100006&lang=pt" 
"S0212-71992007001100004-esp","Fiebre de origen desconocido: Forma de presentación de los linfomas malignos","Roca Campañá, V., Rodríguez Silva, H.","Anales de Medicina Interna; 24(11); 531-534","Anales de Medicina Interna","Espanhol","2007","http://scielo.isciii.es/scielo.php?script=sci_arttext&pid=S0212-71992007001100004&lang=pt" 
"S0212-71992007001100001-esp","Implicación de la investigación de resultados en salud en la mejora continua de la calidad asistencial del Sistema Nacional de Salud","Soto Álvarez, J.","Anales de Medicina Interna; 24(11); 517-519","Anales de Medicina Interna","Espanhol","2007","http://scielo.isciii.es/scielo.php?script=sci_arttext&pid=S0212-71992007001100001&lang=pt" 
"S0212-71992007001100008-esp","Fístula aorto pulmonar: endocarditis izquierda en paciente VIH y ADVP: Revisión de la literatura","Obón Azuara, B., Zalba Etayo, B., Gutiérrez Cía, I., Villanueva Anadón, B.","Anales de Medicina Interna; 24(11); 547-550","Anales de Medicina Interna","Espanhol","2007","http://scielo.isciii.es/scielo.php?script=sci_arttext&pid=S0212-71992007001100008&lang=pt" 
"S0212-71992007001100016-esp","Sobrecarga de hierro en síndromes mielodisplásicos y terapia quelante de hierro","Castillo Rueda, A. del, Ravell Aumaitre, J. C., Khosravi Shahi, P., Álvarez-Sala Walter, L. A.","Anales de Medicina Interna; 24(11); 565-566","Anales de Medicina Interna","Espanhol","2007","http://scielo.isciii.es/scielo.php?script=sci_arttext&pid=S0212-71992007001100016&lang=pt" 
"S0212-71992007001100015-esp","Broncolitiasis como causa de atelectasia lobar","Moro, M. J., Sarro, M., Albéniz, L. F., Pérez, G., Herrero, E.","Anales de Medicina Interna; 24(11); 564-565","Anales de Medicina Interna","Espanhol","2007","http://scielo.isciii.es/scielo.php?script=sci_arttext&pid=S0212-71992007001100015&lang=pt" 
"S0212-71992007001100011-esp","Fiebre Q","Roca, B.","Anales de Medicina Interna; 24(11); 558-560","Anales de Medicina Interna","Espanhol","2007","http://scielo.isciii.es/scielo.php?script=sci_arttext&pid=S0212-71992007001100011&lang=pt" 
"S1519-69842007000400008-scl","Effects of rainfall on water quality in six sequentially disposed fishponds with continuous water flow","Sipaúba-Tavares, LH., Guariglia, CST., Braga, FMS.","Brazilian Journal of Biology; 67(4); 643-649","Brazilian Journal of Biology","Inglês","2007","http://www.scielo.br/scielo.php?script=sci_arttext&pid=S1519-69842007000400008&lang=pt" 
"S1519-69842007000400002-scl","Spatial and temporal variations of Cocconeis placentula var. euglypta (Ehrenb.) 1854 Grunow, 1884 in drift and periphyton","Gari, EN., Corigliano, MC.","Brazilian Journal of Biology; 67(4); 587-595","Brazilian Journal of Biology","Inglês","2007","http://www.scielo.br/scielo.php?script=sci_arttext&pid=S1519-69842007000400002&lang=pt" 
"S1519-69842007000400003-scl","From a water resource to a point pollution source: the daily journey of a coastal urban stream","Rörig, LR., Tundisi, JG., Schettini, CAF., Pereira-Filho, J., Menezes, JT., Almeida, TCM., Urban, SR., Radetski, CM., Sperb, RC., Stramosk, CA., Macedo, RS., Castro-Silva, MA., Perez, JAA.","Brazilian Journal of Biology; 67(4); 597-609","Brazilian Journal of Biology","Inglês","2007","http://www.scielo.br/scielo.php?script=sci_arttext&pid=S1519-69842007000400003&lang=pt" 
"S1519-69842007000400004-scl","Relationship between invertebrate fauna and bromeliad size","Araújo, VA., Melo, SK., Araújo, APA., Gomes, MLM., Carneiro, MAA.","Brazilian Journal of Biology; 67(4); 611-617","Brazilian Journal of Biology","Inglês","2007","http://www.scielo.br/scielo.php?script=sci_arttext&pid=S1519-69842007000400004&lang=pt" 
"S1519-69842007000400005-scl","Habitat associations of small mammals in southern Brazil and use of regurgitated pellets of birds of prey for inventorying a local fauna","Scheibler, DR., Christoff, AU.","Brazilian Journal of Biology; 67(4); 619-625","Brazilian Journal of Biology","Inglês","2007","http://www.scielo.br/scielo.php?script=sci_arttext&pid=S1519-69842007000400005&lang=pt" 
"S1519-69842007000400007-scl","Ant communities (Hymenoptera: Formicidae) in an urban ecosystem near the Atlantic Rainforest","Kamura, CM., Morini, MSC., Figueiredo, CJ., Bueno, OC., Campos-Farinha, AEC.","Brazilian Journal of Biology; 67(4); 635-641","Brazilian Journal of Biology","Inglês","2007","http://www.scielo.br/scielo.php?script=sci_arttext&pid=S1519-69842007000400007&lang=pt" 
"S1519-69842007000400009-scl","Spatial and temporal distribution of fishing resources exploited by the Manaus fishing fleet, Amazonas, Brazil","Batista, VS., Petrere Jr, M.","Brazilian Journal of Biology; 67(4); 651-656","Brazilian Journal of Biology","Inglês","2007","http://www.scielo.br/scielo.php?script=sci_arttext&pid=S1519-69842007000400009&lang=pt" 
"S1519-69842007000400012-scl","Dial organic carbon fluctuations in a mangrove tidal creek in Sepetiba bay, Southeast Brazil","Rezende, CE., Lacerda, LD., Ovalle, ARC., Silva, LFF.","Brazilian Journal of Biology; 67(4); 673-680","Brazilian Journal of Biology","Inglês","2007","http://www.scielo.br/scielo.php?script=sci_arttext&pid=S1519-69842007000400012&lang=pt" 
"S1519-69842007000400014-scl","Size structure and fertility in an Eriocnema fulva Naudin (Melastomataceae) population in Southeastern Brazil","Andrade, PM., Santos, FAM., Martins, FR.","Brazilian Journal of Biology; 67(4); 685-693","Brazilian Journal of Biology","Inglês","2007","http://www.scielo.br/scielo.php?script=sci_arttext&pid=S1519-69842007000400014&lang=pt" 
"S1519-69842007000400016-scl","Agonistic and reproductive behaviors in males of red hybrid tilapia, Oreochromis niloticus (Linnaeus, 1758) x O. mossambicus (Peters, 1852) (Osteichthyes: Cichlidae)","Medeiros, APT, Chellappa, S, Yamamoto, ME","Brazilian Journal of Biology; 67(4); 701-706","Brazilian Journal of Biology","Inglês","2007","http://www.scielo.br/scielo.php?script=sci_arttext&pid=S1519-69842007000400016&lang=pt" 
"S1519-69842007000400017-scl","","De Conto, V, Cerqueira, R","Brazilian Journal of Biology; 67(4); 707-713","Brazilian Journal of Biology","Inglês","2007","http://www.scielo.br/scielo.php?script=sci_arttext&pid=S1519-69842007000400017&lang=pt" 
"S1519-69842007000400020-scl","Gonadossomatic relation and reproductive strategy of Brycon opalinus (Cuvier, 1819) in the Serra do Mar State Park - Núcleo Santa Virgínia, Atlantic Forest, Brazil","Gomiero, LM, Braga, FMS","Brazilian Journal of Biology; 67(4); 727-733","Brazilian Journal of Biology","Inglês","2007","http://www.scielo.br/scielo.php?script=sci_arttext&pid=S1519-69842007000400020&lang=pt" 
"S1519-69842007000400022-scl","Feeding of Oligosarcus hepsetus (Cuvier, 1829) (Characiformes) in the Serra do Mar State Park - Santa Virgínia Unit, São Paulo, Brazil","Botelho, MLLA, Gomiero, LM, Braga, FMS","Brazilian Journal of Biology; 67(4); 741-748","Brazilian Journal of Biology","Inglês","2007","http://www.scielo.br/scielo.php?script=sci_arttext&pid=S1519-69842007000400022&lang=pt" 
"S1519-69842007000400025-scl","Prevalence and intensity of pentastomid infection in two species of snakes from northeastern Brazil","Almeida, WO, Vasconcellos, A, Lopes, SG, Freire, EMX","Brazilian Journal of Biology; 67(4); 759-763","Brazilian Journal of Biology","Inglês","2007","http://www.scielo.br/scielo.php?script=sci_arttext&pid=S1519-69842007000400025&lang=pt" 
"S1519-69842007000400027-scl","Effect of L-5-Hydroxytryptophan on drinking behavior in Coturnix japonica (Temminck and Schlegel, 1849) (Galliformes: Aves): involvement of renin-angiotensin system","Cedraz-Mercez, PL, Almeida, AC, Thomaz, CM, Costa-e-Sousa, RH, Olivares, EL, Côrtes, WS, Medeiros, MA, Reis, LC","Brazilian Journal of Biology; 67(4); 771-776","Brazilian Journal of Biology","Inglês","2007","http://www.scielo.br/scielo.php?script=sci_arttext&pid=S1519-69842007000400027&lang=pt" 
"S1519-69842007000400006-scl","Bird attributes, plant characteristics, and seed dispersal of Pera glabrata (Schott, 1858), (Euphorbiaceae) in a disturbed cerrado area","Francisco, MR., Lunardi, VO., Galetti, M.","Brazilian Journal of Biology; 67(4); 627-634","Brazilian Journal of Biology","Inglês","2007","http://www.scielo.br/scielo.php?script=sci_arttext&pid=S1519-69842007000400006&lang=pt" 
"S1519-69842007000400011-scl","An ecological economics approach to estimate the value of a fragmented wetland in Brazil (Mato Grosso do Sul state)","Carvalho, AR.","Brazilian Journal of Biology; 67(4); 663-671","Brazilian Journal of Biology","Inglês","2007","http://www.scielo.br/scielo.php?script=sci_arttext&pid=S1519-69842007000400011&lang=pt" 
"S0212-71992007001100002-esp","Estudio de las interconsultas solicitadas por el Servicio de Cirugía General al Servicio de Medicina Interna","Soler-Bel, J., Sala, C., Relaño, N., Moya, M. J., Vergéz, L., Flor, A.","Anales de Medicina Interna; 24(11); 520-524","Anales de Medicina Interna","Espanhol","2007","http://scielo.isciii.es/scielo.php?script=sci_arttext&pid=S0212-71992007001100002&lang=pt" 
"S0212-71992007001100007-esp","Dificultad en el tratamiento del hipertiroidismo por amiodarona: Presentación de un caso","Pedro, T., Martínez-Hervás, S., Lorente, R., Catalá, M., Ortega, J., Real, J. T., Carmena, R.","Anales de Medicina Interna; 24(11); 543-546","Anales de Medicina Interna","Espanhol","2007","http://scielo.isciii.es/scielo.php?script=sci_arttext&pid=S0212-71992007001100007&lang=pt" 
"S0212-71992007001100003-esp","Comorbilidad, pluripatología, consumo de recursos y pronóstico de pacientes ingresados en una unidad de Medicina Interna","Medrano González, F., Melero Bascones, M., Barba Romero, M. A., Gómez Garrido, J., Llabrés Díaz, J., Moreno Salcedo, J.","Anales de Medicina Interna; 24(11); 525-530","Anales de Medicina Interna","Espanhol","2007","http://scielo.isciii.es/scielo.php?script=sci_arttext&pid=S0212-71992007001100003&lang=pt" 
"S0212-71992007001100009-esp","Síndrome del ácido transretinoico y necrosis cortical renal","Sastre López, A., Gago Gonzalez, E., Baños Gallardo, M., Gómez-Huertas, E., Ortega Suárez, F.","Anales de Medicina Interna; 24(11); 551-553","Anales de Medicina Interna","Espanhol","2007","http://scielo.isciii.es/scielo.php?script=sci_arttext&pid=S0212-71992007001100009&lang=pt" 
"S0021-75572007000700009-scl","Nem toda criança diabética é tipo 1","Della Manna, Thais","Jornal de Pediatria; 83(5); S178-S183","Jornal de Pediatria","Inglês, Português","2007","http://www.scielo.br/scielo.php?script=sci_arttext&pid=S0021-75572007000700009&lang=pt" 
"S1516-89132007000700002-scl","Germination in seed species ingested by opossums: implications for seed dispersal and forest conservation","Cáceres, Nilton Carlos, Monteiro-Filho, Emygdio Leite de Araújo","Brazilian Archives of Biology and Technology; 50(6); 921-928","Brazilian Archives of Biology and Technology","Inglês","2007","http://www.scielo.br/scielo.php?script=sci_arttext&pid=S1516-89132007000700002&lang=pt" 
"S1516-89132007000700003-scl","Occurrence of Pyemotes sp. on Tuta absoluta (Meyrick)","Oliveira, Carlos Romero Ferreira de, Matos, Cláudia Helena Cysneiros, Hatano, Eduardo","Brazilian Archives of Biology and Technology; 50(6); 929-932","Brazilian Archives of Biology and Technology","Inglês","2007","http://www.scielo.br/scielo.php?script=sci_arttext&pid=S1516-89132007000700003&lang=pt" 
"S1516-89132007000700004-scl","Evaluation of gelling agents on anther culture: response of two soybean cultivars","Cardoso, Milena Barcelos, Bodanese-Zanettini, Maria Helena, Mundstock, Elsa Cristina de, Kaltchuk-Santos, Eliane","Brazilian Archives of Biology and Technology; 50(6); 933-939","Brazilian Archives of Biology and Technology","Inglês","2007","http://www.scielo.br/scielo.php?script=sci_arttext&pid=S1516-89132007000700004&lang=pt" 
"S1516-89132007000700008-scl","Alveolus-capillary permeability on both normal and HIV seroreactive individuals","Carriel, José Carlos, Maliska, Carmelindo, Piloto, José Henrique, Norberg, Antônio Neres, D’Almeida, Joaquim, Ferreira, Gilsy S., Penas, Maria Expósito","Brazilian Archives of Biology and Technology; 50(6); 971-978","Brazilian Archives of Biology and Technology","Inglês","2007","http://www.scielo.br/scielo.php?script=sci_arttext&pid=S1516-89132007000700008&lang=pt" 
"S1516-89132007000700007-scl","Influence of starch and casein administered postruminally on small intestinal sodium-glucose cotransport activity and expression","Guimaraes, Kátia Cylene, Hazelton, Sarah Rodrigues, Matthews, James Clyde, Swanson, Kendall Carl, Harmon, David Lee, Branco, Antonio Ferriani","Brazilian Archives of Biology and Technology; 50(6); 963-970","Brazilian Archives of Biology and Technology","Inglês","2007","http://www.scielo.br/scielo.php?script=sci_arttext&pid=S1516-89132007000700007&lang=pt" 
"S1516-89132007000700010-scl","Comparison of different methodologies for DNA extraction from Aegla longirostri","Bitencourt, João Vitor Trindade, Roratto, Paula Angélica, Bartholomei-Santos, Marlise Ladvocat, Santos, Sandro","Brazilian Archives of Biology and Technology; 50(6); 989-994","Brazilian Archives of Biology and Technology","Inglês","2007","http://www.scielo.br/scielo.php?script=sci_arttext&pid=S1516-89132007000700010&lang=pt" 
"S1516-89132007000700001-scl","Enhanced production of manganese peroxidase by Phanerochaete chrysosporium","Urek, Raziye Ozturk, Pazarlioglu, Nurdan Kasikara","Brazilian Archives of Biology and Technology; 50(6); 913-920","Brazilian Archives of Biology and Technology","Inglês","2007","http://www.scielo.br/scielo.php?script=sci_arttext&pid=S1516-89132007000700001&lang=pt" 
"S1516-89132007000700005-scl","Copper concentration of vineyard soils as a function of pH variation and addition of poultry litter","Nachtigall, Gilmar Ribeiro, Nogueirol, Roberta Corrêa, Alleoni, Luís Reynaldo Ferracciú, Cambri, Michel Alexandro","Brazilian Archives of Biology and Technology; 50(6); 941-948","Brazilian Archives of Biology and Technology","Inglês","2007","http://www.scielo.br/scielo.php?script=sci_arttext&pid=S1516-89132007000700005&lang=pt" 
"S1516-89132007000700006-scl","Percutaneous absorption enhancers: mechanisms and potential","Carpentieri-Rodrigues, Letícia Norma, Zanluchi, Juliana Modolo, Grebogi, Ivanna Hinke","Brazilian Archives of Biology and Technology; 50(6); 949-961","Brazilian Archives of Biology and Technology","Inglês","2007","http://www.scielo.br/scielo.php?script=sci_arttext&pid=S1516-89132007000700006&lang=pt" 
"S1516-89132007000700009-scl","Anatomy of the underground system in Vernonia grandiflora Less. and V. brevifolia Less. (Asteraceae)","Hayashi, Adriana Hissae, Appezzato-da-Glória, Beatriz","Brazilian Archives of Biology and Technology; 50(6); 979-988","Brazilian Archives of Biology and Technology","Inglês","2007","http://www.scielo.br/scielo.php?script=sci_arttext&pid=S1516-89132007000700009&lang=pt" 
"S1516-89132007000700011-scl","Reproductive biology of Bryconamericus stramineus Eigenmann, 1908 (Ostariophysi: Characidae) from the Rio Ibicuí, RS, Brazil","Lampert, Vinicius Renner, Azevedo, Marco Aurélio, Fialho, Clarice Bernhardt","Brazilian Archives of Biology and Technology; 50(6); 995-1004","Brazilian Archives of Biology and Technology","Inglês","2007","http://www.scielo.br/scielo.php?script=sci_arttext&pid=S1516-89132007000700011&lang=pt" 
"S1516-89132007000700012-scl","Bee community of a beach dune ecosystem on Maranhão Island, Brazil","Albuquerque, Patricia Maia Correia de, Camargo, João Maria Franco de, Mendonça, José Ângelo Cordeiro","Brazilian Archives of Biology and Technology; 50(6); 1005-1018","Brazilian Archives of Biology and Technology","Inglês","2007","http://www.scielo.br/scielo.php?script=sci_arttext&pid=S1516-89132007000700012&lang=pt" 
"S1516-89132007000700013-scl","Morphology of gonads, maturity and spawning season of Loricariichthys spixii (Siluriformes, Loricariidae) in a Subtropical Reservoir","Duarte, Silvana, Araújo, Francisco Gerson, Sales, Armando, Bazzoli, Nilo","Brazilian Archives of Biology and Technology; 50(6); 1019-1032","Brazilian Archives of Biology and Technology","Inglês","2007","http://www.scielo.br/scielo.php?script=sci_arttext&pid=S1516-89132007000700013&lang=pt" 
"S1516-89132007000700014-scl","Fish species diversity in headwaters streams of Paraguay and Paraná Basins","Súarez, Yzel Rondon, Valério, Sabrina Bigatão, Tondado, Karina Keyla, Florentino, Alexandro Cezar, Felipe, Thiago Rota Alves, Ximenes, Lidiani Queli Lubas, Lourenço, Luzia da Silva","Brazilian Archives of Biology and Technology; 50(6); 1033-1042","Brazilian Archives of Biology and Technology","Inglês","2007","http://www.scielo.br/scielo.php?script=sci_arttext&pid=S1516-89132007000700014&lang=pt" 
"S1516-89132007000700015-scl","Floral visitors and reproductive strategies in five melittophilous species of Bignoniaceae in Southeastern Brazil","Yanagizawa, Yuriko A. N. Pinto, Maimoni-Rodella, Rita de Cassia Sindrônia","Brazilian Archives of Biology and Technology; 50(6); 1043-1050","Brazilian Archives of Biology and Technology","Inglês","2007","http://www.scielo.br/scielo.php?script=sci_arttext&pid=S1516-89132007000700015&lang=pt" 
"S1516-89132007000700016-scl","Assesment of soil erosion by 137Cs technique in native forests in Londrina City, Parana, Brazil","Andrello, Avacir Casanova, Appoloni, Carlos Roberto, Nascimento Filho, Virgílio Franco do","Brazilian Archives of Biology and Technology; 50(6); 1051-1060","Brazilian Archives of Biology and Technology","Inglês","2007","http://www.scielo.br/scielo.php?script=sci_arttext&pid=S1516-89132007000700016&lang=pt" 
"S1516-89132007000700017-scl","Effect of temperature on two-phase anaerobic reactors treating slaughterhouse wastewater","Beux, Simone, Nunes, Ezequiel, Barana, Ana Cláudia","Brazilian Archives of Biology and Technology; 50(6); 1061-1072","Brazilian Archives of Biology and Technology","Inglês","2007","http://www.scielo.br/scielo.php?script=sci_arttext&pid=S1516-89132007000700017&lang=pt" 
"S1516-89132007000700018-scl","Effect of the improved fermentation on physicochemical properties and sensorial acceptability of sour cassava starch","Marcon, Maria Janete Angeloni, Vieira, Gisele Cristina Netto, Simas, Karina Nunes de, Santos, Karina, Vieira, Manoela Alano, Amboni, Renata Dias de Mello Castanho, Amante, Edna Regina","Brazilian Archives of Biology and Technology; 50(6); 1073-1081","Brazilian Archives of Biology and Technology","Inglês","2007","http://www.scielo.br/scielo.php?script=sci_arttext&pid=S1516-89132007000700018&lang=pt" 
"S1516-89132007000700019-scl","Effect of biomass reduction on the fermentation of cider","Nogueira, Alessandro, Mongruel, Caroline, Simões, Deise Rosana Silva, Waszczynskyj, Nina, Wosiacki, Gilvan","Brazilian Archives of Biology and Technology; 50(6); 1083-1092","Brazilian Archives of Biology and Technology","Inglês","2007","http://www.scielo.br/scielo.php?script=sci_arttext&pid=S1516-89132007000700019&lang=pt" 
"S0100-72032007001100004-scl","Avaliação da classificação histológica da endometriose observada em implantes de mulheres portadoras de endometriose pélvica superficial e profunda","Kamergorodsky, Gil, Ribeiro, Paulo Augusto Ayroza, Galvão, Maria Antonieta Longo, Abrão, Maurício Simões, Lemos, Nucélio Barros, Donadio, Nilson, Aoki, Tsutomu","Revista Brasileira de Ginecologia e Obstetrícia; 29(11); 568-574","Revista Brasileira de Ginecologia e Obstetrícia","Português","2007","http://www.scielo.br/scielo.php?script=sci_arttext&pid=S0100-72032007001100004&lang=pt" 
"S0100-72032007001100005-scl","Adenocarcinoma viloglandular de cérvice uterina","Gonçalves, Manoel Afonso Guimarães, Anschau, Fernando, Marc, Chrystiane, Meurer, Luise","Revista Brasileira de Ginecologia e Obstetrícia; 29(11); 575-579","Revista Brasileira de Ginecologia e Obstetrícia","Português","2007","http://www.scielo.br/scielo.php?script=sci_arttext&pid=S0100-72032007001100005&lang=pt" 
"S0100-72032007001100007-scl","Septo uterino, duplicação cervical e septo vaginal: relato de rara malformação mülleriana com gestação a termo","Badalotti, Mariangela, Arent, Adriana, Monteggia, Vicente, Machado, Julia, Petracco, Rafaella, Petracco, Alvaro","Revista Brasileira de Ginecologia e Obstetrícia; 29(11); 588-592","Revista Brasileira de Ginecologia e Obstetrícia","Português","2007","http://www.scielo.br/scielo.php?script=sci_arttext&pid=S0100-72032007001100007&lang=pt" 
"S0100-72032007001100008-scl","Efeitos da terapia hormonal na menopausa sobre o sistema imune","Medeiros, Sebastião Freitas de, Maitelli, Alexandre, Nince, Ana Paula Barros","Revista Brasileira de Ginecologia e Obstetrícia; 29(11); 593-601","Revista Brasileira de Ginecologia e Obstetrícia","Português","2007","http://www.scielo.br/scielo.php?script=sci_arttext&pid=S0100-72032007001100008&lang=pt" 
"S1130-01082007001100006-esp","Flora intestinal, probióticos, prebióticos, simbióticos y alimentos novedosos","Peña, A. S.","Revista Española de Enfermedades Digestivas; 99(11); 653-658","Revista Española de Enfermedades Digestivas","Espanhol","2007","http://scielo.isciii.es/scielo.php?script=sci_arttext&pid=S1130-01082007001100006&lang=pt" 
"S1130-01082007001100005-esp","Daño hepático y enfermedad celíaca","Cantarero Vallejo, M. D., Gómez Camarero, J., Menchén, L., Pajares Díaz, J. A., Lo Iacono, O.","Revista Española de Enfermedades Digestivas; 99(11); 648-652","Revista Española de Enfermedades Digestivas","Espanhol","2007","http://scielo.isciii.es/scielo.php?script=sci_arttext&pid=S1130-01082007001100005&lang=pt" 
"S0021-75572007000700001-scl","Novas abordagens endócrino-metabólicas em pediatria","Damiani, Durval, Garcia, Pedro Celiny Ramos","Jornal de Pediatria; 83(5); S117-S118","Jornal de Pediatria","Inglês, Português","2007","http://www.scielo.br/scielo.php?script=sci_arttext&pid=S0021-75572007000700001&lang=pt" 
"S0021-75572007000700008-scl","Manejo farmacológico da baixa estatura: o papel dos inibidores da aromatase","Damiani, Durval, Damiani, Daniel","Jornal de Pediatria; 83(5); S172-S177","Jornal de Pediatria","Inglês, Português","2007","http://www.scielo.br/scielo.php?script=sci_arttext&pid=S0021-75572007000700008&lang=pt" 
"S0021-75572007000700007-scl","Corticoterapia: minimizando efeitos colaterais","Longui, Carlos Alberto","Jornal de Pediatria; 83(5); S163-S171","Jornal de Pediatria","Inglês, Português","2007","http://www.scielo.br/scielo.php?script=sci_arttext&pid=S0021-75572007000700007&lang=pt" 
"S0021-75572007000700012-scl","Síndrome metabólica: identificando fatores de risco","Lottenberg, Simão Augusto, Glezer, Andrea, Turatti, Luiz Alberto","Jornal de Pediatria; 83(5); S204-S208","Jornal de Pediatria","Inglês, Português","2007","http://www.scielo.br/scielo.php?script=sci_arttext&pid=S0021-75572007000700012&lang=pt" 
"S0104-62762007000200008-scl","","","Opinião Pública; 13(2); 409-427","Opinião Pública","Português","2007","http://www.scielo.br/scielo.php?script=sci_arttext&pid=S0104-62762007000200008&lang=pt" 
"S0104-62762007000200005-scl","Os partidos brasileiros na perspectiva dos eleitores: mudanças e continuidades na identificação partidária e na avaliação das principais legendas após 2002","Veiga, Luciana Fernandes","Opinião Pública; 13(2); 340-365","Opinião Pública","Português","2007","http://www.scielo.br/scielo.php?script=sci_arttext&pid=S0104-62762007000200005&lang=pt" 
"S0104-62762007000200007-scl","Eleitorado e partidos políticos no Brasil","Paiva, Denise, Braga, Maria do Socorro S., Pimentel Jr., Jairo Tadeu Pires","Opinião Pública; 13(2); 388-408","Opinião Pública","Português","2007","http://www.scielo.br/scielo.php?script=sci_arttext&pid=S0104-62762007000200007&lang=pt" 
"S0021-75572007000700002-scl","Perspectivas atuais do tratamento da cetoacidose diabética em pediatria","Piva, Jefferson P., Czepielewski, Mauro, Garcia, Pedro Celiny R., Machado, Denise","Jornal de Pediatria; 83(5); S119-S127","Jornal de Pediatria","Inglês, Português","2007","http://www.scielo.br/scielo.php?script=sci_arttext&pid=S0021-75572007000700002&lang=pt" 
