"S0021-75572007000700003-scl","Controle glicêmico e terapia insulínica em sepse e doença crítica","Branco, Ricardo Garcia, Tasker, Robert Charles, Garcia, Pedro Celiny Ramos, Piva, Jefferson Pedro, Xavier, Lisandra Dias","Jornal de Pediatria; 83(5); S128-S136","Jornal de Pediatria","Inglês, Português","2007","http://www.scielo.br/scielo.php?script=sci_arttext&pid=S0021-75572007000700003&lang=pt" 
"S0021-75572007000700004-scl","Efeitos hemodinâmicos e metabólicos da infusão de vasopressina em crianças com choque","Baldasso, Elisa, Garcia, Pedro Celiny Ramos, Piva, Jefferson P., Einloft, Paulo Roberto","Jornal de Pediatria; 83(5); S137-S145","Jornal de Pediatria","Inglês, Português","2007","http://www.scielo.br/scielo.php?script=sci_arttext&pid=S0021-75572007000700004&lang=pt" 
"S0021-75572007000700005-scl","Novas opções na terapia insulínica","Schmid, Helena","Jornal de Pediatria; 83(5); S146-S154","Jornal de Pediatria","Inglês, Português","2007","http://www.scielo.br/scielo.php?script=sci_arttext&pid=S0021-75572007000700005&lang=pt" 
"S0021-75572007000700006-scl","Função adrenal na sepse e choque séptico","Pizarro, Cristiane Freitas, Troster, Eduardo Juan","Jornal de Pediatria; 83(5); S155-S162","Jornal de Pediatria","Inglês, Português","2007","http://www.scielo.br/scielo.php?script=sci_arttext&pid=S0021-75572007000700006&lang=pt" 
"S0021-75572007000700010-scl","O pediatra frente a uma criança com ambigüidade genital","Guerra-Júnior, Gil, Maciel-Guerra, Andréa T.","Jornal de Pediatria; 83(5); S184-S191","Jornal de Pediatria","Inglês, Português","2007","http://www.scielo.br/scielo.php?script=sci_arttext&pid=S0021-75572007000700010&lang=pt" 
"S0021-75572007000700011-scl","O tecido adiposo como órgão endócrino: da teoria à prática","Fonseca-Alaniz, Miriam Helena, Takada, Julie, Alonso-Vale, Maria Isabel Cardoso, Lima, Fabio Bessa","Jornal de Pediatria; 83(5); S192-S203","Jornal de Pediatria","Inglês, Português","2007","http://www.scielo.br/scielo.php?script=sci_arttext&pid=S0021-75572007000700011&lang=pt" 
"S0021-75572007000700013-scl","Hipotireoidismo na criança: diagnóstico e tratamento","Setian, Nuvarte","Jornal de Pediatria; 83(5); S209-S216","Jornal de Pediatria","Inglês, Português","2007","http://www.scielo.br/scielo.php?script=sci_arttext&pid=S0021-75572007000700013&lang=pt" 
"S0104-62762007000200001-scl","Eleições e capital social: uma análise das eleições presidenciais no Brasil (2002-2006)","Baquero, Marcello","Opinião Pública; 13(2); 231-259","Opinião Pública","Português","2007","http://www.scielo.br/scielo.php?script=sci_arttext&pid=S0104-62762007000200001&lang=pt" 
"S0104-62762007000200002-scl","Escândalos e voto: as eleições presidenciais brasileiras de 2006","Rennó, Lucio R.","Opinião Pública; 13(2); 260-282","Opinião Pública","Português","2007","http://www.scielo.br/scielo.php?script=sci_arttext&pid=S0104-62762007000200002&lang=pt" 
"S0104-62762007000200003-scl","Classe ideologia e política: uma interpretação dos resultados das eleições de 2002 e 2006","Holzhacker, Denilde Oliveira, Balbachevsky, Elizabeth","Opinião Pública; 13(2); 283-306","Opinião Pública","Português","2007","http://www.scielo.br/scielo.php?script=sci_arttext&pid=S0104-62762007000200003&lang=pt" 
"S0104-62762007000200006-scl","Contexto político-eleitoral, minorias religiosas e voto em pleitos presidenciais (2002-2006)","Bohn, Simone R.","Opinião Pública; 13(2); 366-387","Opinião Pública","Português","2007","http://www.scielo.br/scielo.php?script=sci_arttext&pid=S0104-62762007000200006&lang=pt" 
"S0104-62762007000200004-scl","Identificação ideológica, partidos e voto na eleição presidencial de 2006","Carreirão, Yan de Souza","Opinião Pública; 13(2); 307-339","Opinião Pública","Português","2007","http://www.scielo.br/scielo.php?script=sci_arttext&pid=S0104-62762007000200004&lang=pt" 
"S0717-68212007000200002-chl","The Determinants of Sovereign Bond Spreads: Theory and Facts from Latin America","GRANDES, MARTÍN","Cuadernos de economía; 44(130); 151-181","Cuadernos de economía","Inglês","2007","http://www.scielo.cl/scielo.php?script=sci_arttext&pid=S0717-68212007000200002&lang=pt" 
"S0717-68212007000200003-chl","Is Latin America Overcoming its Fear of Floating?","IBARRA, CARLOS A","Cuadernos de economía; 44(130); 183-209","Cuadernos de economía","Inglês","2007","http://www.scielo.cl/scielo.php?script=sci_arttext&pid=S0717-68212007000200003&lang=pt" 
"S0717-68212007000200004-chl","¿Cuánto Dura el Desempleo de la Población más Pobre en Chile?","MONTERO, RODRIGO","Cuadernos de economía; 44(130); 211-231","Cuadernos de economía","Espanhol","2007","http://www.scielo.cl/scielo.php?script=sci_arttext&pid=S0717-68212007000200004&lang=pt" 
"S0717-68212007000200005-chl","Costos de Transacción y Formas de Gobernación de los Servicios de Consulta en Colombia","TORRES, SERGIO, GARCÍA, RAFAEL GUILLERMO, QUINTERO, JOHN JAIRO","Cuadernos de economía; 44(130); 233-262","Cuadernos de economía","Espanhol","2007","http://www.scielo.cl/scielo.php?script=sci_arttext&pid=S0717-68212007000200005&lang=pt" 
"S0718-22952007000200001-chl","BORGES HEREDERO: UNA LECTURA DEL TEXTO AUTOBIOGRÁFICO DESDE LA PROBLEMÁTICA GENEALÓGICA","Amaro, Lorena","Revista chilena de literatura; (71); 5-18","Revista chilena de literatura","Espanhol","2007","http://www.scielo.cl/scielo.php?script=sci_arttext&pid=S0718-22952007000200001&lang=pt" 
"S0718-22952007000200002-chl","UN MITO EN MOVIMIENTO: PABLO DE OLAVIDE Y SU EVANGELIO EN TRIUNFO (1797)","Carrasco M, Rolando","Revista chilena de literatura; (71); 19-42","Revista chilena de literatura","Espanhol","2007","http://www.scielo.cl/scielo.php?script=sci_arttext&pid=S0718-22952007000200002&lang=pt" 
"S0718-22952007000200003-chl","ELISABETH DE SCHÓNAU: AUTORIDAD VISIONARIA Y LA PRESENCIA DE LOS SANTOS","Góngora, María Eugenia","Revista chilena de literatura; (71); 43-62","Revista chilena de literatura","Espanhol","2007","http://www.scielo.cl/scielo.php?script=sci_arttext&pid=S0718-22952007000200003&lang=pt" 
"S0718-22952007000200004-chl","HACIA LA TERNURA COMO EL LUGAR DEL POEMA ÚNICO: UNA LECTURA DE MANUEL BANDEIRA A LA LUZ DE HEIDEGGER","Mac-Millan K, Mary","Revista chilena de literatura; (71); 63-81","Revista chilena de literatura","Espanhol","2007","http://www.scielo.cl/scielo.php?script=sci_arttext&pid=S0718-22952007000200004&lang=pt" 
"S0718-22952007000200005-chl","DESDE LOS SALONES ALA SALA DE CONFERENCIAS: MUJERES ESCRITORAS EN EL PROCESO DE CONSTITUCIÓN DEL CAMPO LITERARIO EN CHILE","Doll Castillo, Darcie","Revista chilena de literatura; (71); 83-100","Revista chilena de literatura","Espanhol","2007","http://www.scielo.cl/scielo.php?script=sci_arttext&pid=S0718-22952007000200005&lang=pt" 
"S0718-22952007000200006-chl","HISTORIAS DE EXTRANJEROS Y EXILIADOS: AUTOFIGURACIONES EN LA POÉTICA DE MARJORIE AGOSÍN","León, Denise","Revista chilena de literatura; (71); 101-112","Revista chilena de literatura","Espanhol","2007","http://www.scielo.cl/scielo.php?script=sci_arttext&pid=S0718-22952007000200006&lang=pt" 
"S0718-22952007000200007-chl","EL PASADO COMO ARCHIVO VACÍO EN LA CIUDAD ANTERIOR DE GONZALO CONTRERAS","Lulo Cabezas, Mario","Revista chilena de literatura; (71); 113-126","Revista chilena de literatura","Espanhol","2007","http://www.scielo.cl/scielo.php?script=sci_arttext&pid=S0718-22952007000200007&lang=pt" 
"S0718-22952007000200008-chl","DOCE CALAS EN &quot;LA INTRUSA&quot;","Rojo, Grínor","Revista chilena de literatura; (71); 127-133","Revista chilena de literatura","Espanhol","2007","http://www.scielo.cl/scielo.php?script=sci_arttext&pid=S0718-22952007000200008&lang=pt" 
"S0718-22952007000200009-chl","NACIONALISMO Y CULTURA","Cordua, Carla","Revista chilena de literatura; (71); 135-140","Revista chilena de literatura","Espanhol","2007","http://www.scielo.cl/scielo.php?script=sci_arttext&pid=S0718-22952007000200009&lang=pt" 
"S0718-22952007000200010-chl","NADIE MÁS HA VENIDO A LEERLAS","Morales T, Leónidas","Revista chilena de literatura; (71); 141-144","Revista chilena de literatura","Espanhol","2007","http://www.scielo.cl/scielo.php?script=sci_arttext&pid=S0718-22952007000200010&lang=pt" 
"S0718-22952007000200011-chl","UNA NECESARIA REEDICIÓN PARA LA MEMORIA DE CHILE","Grau Duhart, Olga","Revista chilena de literatura; (71); 145-147","Revista chilena de literatura","Espanhol","2007","http://www.scielo.cl/scielo.php?script=sci_arttext&pid=S0718-22952007000200011&lang=pt" 
"S0718-22952007000200012-chl","ESCRITURA, DESTINACIÓN Y DESTINO","Santa Cruz, Guadalupe","Revista chilena de literatura; (71); 149-153","Revista chilena de literatura","Espanhol","2007","http://www.scielo.cl/scielo.php?script=sci_arttext&pid=S0718-22952007000200012&lang=pt" 
"S0718-22952007000200013-chl","EN TORNO A TRÍPTICO DE COBQUECURA DE ANDRÉS GALLARDO","Valdés, Adriana","Revista chilena de literatura; (71); 155-157","Revista chilena de literatura","Espanhol","2007","http://www.scielo.cl/scielo.php?script=sci_arttext&pid=S0718-22952007000200013&lang=pt" 
"S0718-22952007000200014-chl","Münnich, Susana Gabriela Mistral. Soberbiamente Transgresora","BERNASCHINA SCHÜRMANN, VICENTE","Revista chilena de literatura; (71); 159-161","Revista chilena de literatura","Espanhol","2007","http://www.scielo.cl/scielo.php?script=sci_arttext&pid=S0718-22952007000200014&lang=pt" 
"S0718-22952007000200015-chl","Víctor Lobos El ojo y otros puntos de vista","MORALES, ANDRÉS","Revista chilena de literatura; (71); 161-163","Revista chilena de literatura","Espanhol","2007","http://www.scielo.cl/scielo.php?script=sci_arttext&pid=S0718-22952007000200015&lang=pt" 
"S0718-22952007000200016-chl","Luis Correa-Díaz Cervantes y América / Cervantes en las Americas. Mapa de Campo y Ensayo de Bibliografía Razonada","ROMERO FARIÑA, M. VERÓNICA","Revista chilena de literatura; (71); 163-166","Revista chilena de literatura","Espanhol","2007","http://www.scielo.cl/scielo.php?script=sci_arttext&pid=S0718-22952007000200016&lang=pt" 
"S0004-27302007000800003-scl","Síndrome de Cushing subclínica em populações de risco","Caetano, Maria Silvia S., Vilar, Lucio, Kater, Claudio E.","Arquivos Brasileiros de Endocrinologia &amp; Metabologia; 51(8); 1185-1190","Arquivos Brasileiros de Endocrinologia &amp; Metabologia","Português","2007","http://www.scielo.br/scielo.php?script=sci_arttext&pid=S0004-27302007000800003&lang=pt" 
"S0004-27302007000800004-scl","Screening and diagnosis of Cushing&#039;s syndrome","Castro, Margaret de, Moreira, Ayrton C.","Arquivos Brasileiros de Endocrinologia &amp; Metabologia; 51(8); 1191-1198","Arquivos Brasileiros de Endocrinologia &amp; Metabologia","Inglês","2007","http://www.scielo.br/scielo.php?script=sci_arttext&pid=S0004-27302007000800004&lang=pt" 
"S0004-27302007000800007-scl","Ectopic ACTH syndrome","Isidori, Andrea M., Lenzi, Andrea","Arquivos Brasileiros de Endocrinologia &amp; Metabologia; 51(8); 1217-1225","Arquivos Brasileiros de Endocrinologia &amp; Metabologia","Inglês","2007","http://www.scielo.br/scielo.php?script=sci_arttext&pid=S0004-27302007000800007&lang=pt" 
"S0004-27302007000800010-scl","Unusual causes of Cushing&#039;s syndrome","Vassiliadi, Dimitra, Tsagarakis, Stylianos","Arquivos Brasileiros de Endocrinologia &amp; Metabologia; 51(8); 1245-1252","Arquivos Brasileiros de Endocrinologia &amp; Metabologia","Inglês","2007","http://www.scielo.br/scielo.php?script=sci_arttext&pid=S0004-27302007000800010&lang=pt" 
"S0004-27302007000800011-scl","Cyclic Cushing&#039;s syndrome: an overview","Albiger, Nora Maria Elvira, Scaroni, Carla M., Mantero, Franco","Arquivos Brasileiros de Endocrinologia &amp; Metabologia; 51(8); 1253-1260","Arquivos Brasileiros de Endocrinologia &amp; Metabologia","Inglês","2007","http://www.scielo.br/scielo.php?script=sci_arttext&pid=S0004-27302007000800011&lang=pt" 
"S0004-27302007000800012-scl","Pediatric Cushing&#039;s syndrome: clinical features, diagnosis, and treatment","Chan, Li F., Storr, Helen L., Grossman, Ashley B., Savage, Martin O.","Arquivos Brasileiros de Endocrinologia &amp; Metabologia; 51(8); 1261-1271","Arquivos Brasileiros de Endocrinologia &amp; Metabologia","Inglês","2007","http://www.scielo.br/scielo.php?script=sci_arttext&pid=S0004-27302007000800012&lang=pt" 
"S0004-27302007000800022-scl","Prospective evaluation of transsphenoidal pituitary surgery in 108 patients with Cushing&#039;s disease","Rollin, Guilherme, Ferreira, Nelson Pires, Czepielewski, Mauro A.","Arquivos Brasileiros de Endocrinologia &amp; Metabologia; 51(8); 1355-1361","Arquivos Brasileiros de Endocrinologia &amp; Metabologia","Inglês","2007","http://www.scielo.br/scielo.php?script=sci_arttext&pid=S0004-27302007000800022&lang=pt" 
"S0004-27302007000800024-scl","Radiotherapy and radiosurgery for Cushing&#039;s disease","Minniti, Giuseppe, Brada, Michael","Arquivos Brasileiros de Endocrinologia &amp; Metabologia; 51(8); 1373-1380","Arquivos Brasileiros de Endocrinologia &amp; Metabologia","Inglês","2007","http://www.scielo.br/scielo.php?script=sci_arttext&pid=S0004-27302007000800024&lang=pt" 
"S0004-27302007000800027-scl","Adipose tissue expression of 11beta-Hydroxysteroid dehydrogenase type 1 in cushing&#039;s syndrome and in obesity","Espíndola-Antunes, Daniela, Kater, Claudio E.","Arquivos Brasileiros de Endocrinologia &amp; Metabologia; 51(8); 1397-1403","Arquivos Brasileiros de Endocrinologia &amp; Metabologia","Inglês","2007","http://www.scielo.br/scielo.php?script=sci_arttext&pid=S0004-27302007000800027&lang=pt" 
"S0004-27302007000800005-scl","Differential diagnosis of Cushing&#039;s syndrome","Newell-Price, John, Grossman, Ashley B.","Arquivos Brasileiros de Endocrinologia &amp; Metabologia; 51(8); 1199-1206","Arquivos Brasileiros de Endocrinologia &amp; Metabologia","Inglês","2007","http://www.scielo.br/scielo.php?script=sci_arttext&pid=S0004-27302007000800005&lang=pt" 
"S0101-33002007000300011-scl","Sintoma e intuição","Duve, Thierry de","Novos Estudos - CEBRAP; (79); 211-226","Novos Estudos - CEBRAP","Português","2007","http://www.scielo.br/scielo.php?script=sci_arttext&pid=S0101-33002007000300011&lang=pt" 
"S1698-69462007000700013-esp","Sinus elevation by in situ utilization of bone scrapers: technique and results","Martos Díaz, Pedro, Naval Gías, Luis, Sastre Pérez, Jesús, González García, Raúl, Bances del Castillo, Fernando, Mancha de la Plata, María, Galindo Moreno, Pablo, Muñoz Guerra, Mario","Medicina Oral, Patología Oral y Cirugía Bucal (Internet); 12(7); 537-541","Medicina Oral, Patología Oral y Cirugía Bucal (Internet)","Inglês","2007","http://scielo.isciii.es/scielo.php?script=sci_arttext&pid=S1698-69462007000700013&lang=pt" 
"S1698-69462007000700010-esp","Effectiveness of low flow vascular lesions sclerosis with monoetanolamine: Report of six cases","Bonan, Paulo Rogério Ferreti, Miranda, Leonardo de Paula, Mendes, Danilo Cangussu, Paula, Alfredo Maurício Batista de, Pego, Sabina Pena Borges, Martelli-Júnior, Hercílio","Medicina Oral, Patología Oral y Cirugía Bucal (Internet); 12(7); 524-527","Medicina Oral, Patología Oral y Cirugía Bucal (Internet)","Inglês","2007","http://scielo.isciii.es/scielo.php?script=sci_arttext&pid=S1698-69462007000700010&lang=pt" 
"S1698-69462007000700011-esp","Distraction osteogenesis in Goldenhar Syndrome: Case report and 8-year follow-up","Lima, Marina de Deus Moura de, Marques, Yonara Maria Freire Soares, Alves Júnior, Sérgio de Melo, Ortega, Karem Lopez, Soares, Marcelo Melo, Magalhães, Marina Helena Cury Gallottini de","Medicina Oral, Patología Oral y Cirugía Bucal (Internet); 12(7); 528-531","Medicina Oral, Patología Oral y Cirugía Bucal (Internet)","Inglês","2007","http://scielo.isciii.es/scielo.php?script=sci_arttext&pid=S1698-69462007000700011&lang=pt" 
"S1698-69462007000700005-esp","Results of a dental care protocol for mentally handicapped patients set in a primary health care area in Spain","Escribano Hernández, Alfonso, Hernández Corral, Tomás, Ruiz Martín, Eduardo, Porteros Sánchez, Jose Andrés","Medicina Oral, Patología Oral y Cirugía Bucal (Internet); 12(7); 492-495","Medicina Oral, Patología Oral y Cirugía Bucal (Internet)","Inglês","2007","http://scielo.isciii.es/scielo.php?script=sci_arttext&pid=S1698-69462007000700005&lang=pt" 
"S1698-69462007000700012-esp","Maxillary sinus lift with intraoral autologous bone and B - Tricalcium Phosphate: Histological and histomorphometric clinical study","Aguirre Zorzano, Luis Antonio, Rodríguez Tojo, María José, Aguirre Urizar, José Manuel","Medicina Oral, Patología Oral y Cirugía Bucal (Internet); 12(7); 532-536","Medicina Oral, Patología Oral y Cirugía Bucal (Internet)","Inglês","2007","http://scielo.isciii.es/scielo.php?script=sci_arttext&pid=S1698-69462007000700012&lang=pt" 
"S1698-69462007000700003-esp","Lymphoid lesions of salivary glands: Malignant and Benign","Ellis, Gary L.","Medicina Oral, Patología Oral y Cirugía Bucal (Internet); 12(7); 479-485","Medicina Oral, Patología Oral y Cirugía Bucal (Internet)","Inglês","2007","http://scielo.isciii.es/scielo.php?script=sci_arttext&pid=S1698-69462007000700003&lang=pt" 
"S1698-69462007000700004-esp","Oral non-squamous malignant tumors: diagnosis and treatment","van der Waal, Rutger, van der Waal, Isaäc","Medicina Oral, Patología Oral y Cirugía Bucal (Internet); 12(7); 486-491","Medicina Oral, Patología Oral y Cirugía Bucal (Internet)","Inglês","2007","http://scielo.isciii.es/scielo.php?script=sci_arttext&pid=S1698-69462007000700004&lang=pt" 
"S1698-69462007000700007-esp","Oral biopsy in dental practice","Mota-Ramírez, Amparo, Silvestre, Francisco Javier, Simó, Juan Manuel","Medicina Oral, Patología Oral y Cirugía Bucal (Internet); 12(7); 504-510","Medicina Oral, Patología Oral y Cirugía Bucal (Internet)","Inglês","2007","http://scielo.isciii.es/scielo.php?script=sci_arttext&pid=S1698-69462007000700007&lang=pt" 
"S1698-69462007000700002-esp","A histological and clinical study on oral cancer: Descriptive analyses of 365 cases","Dias, Gonçalo Seguro, Almeida, Arlindo Pereira de","Medicina Oral, Patología Oral y Cirugía Bucal (Internet); 12(7); 474-478","Medicina Oral, Patología Oral y Cirugía Bucal (Internet)","Inglês","2007","http://scielo.isciii.es/scielo.php?script=sci_arttext&pid=S1698-69462007000700002&lang=pt" 
"S1698-69462007000700009-esp","Factors related to survival from oral cancer in an Andalusian population sample (Spain)","Vallecillo Capilla, Manuel, Romero Olid, Maria Nuria, Olmedo Gaya, Maria Victoria, Reyes Botella, Candela, Bustos Ruiz, Vicente","Medicina Oral, Patología Oral y Cirugía Bucal (Internet); 12(7); 518-523","Medicina Oral, Patología Oral y Cirugía Bucal (Internet)","Inglês","2007","http://scielo.isciii.es/scielo.php?script=sci_arttext&pid=S1698-69462007000700009&lang=pt" 
"S1698-69462007000700001-esp","Time elapsed between the first symptoms, diagnosis and treatment of oral cancer patients in Belo Horizonte, Brazil","Abdo, Evandro Neves, Garrocho, Arnaldo de Almeida, Barbosa, Alvimar Afonso, Oliveira, Enaldo Lopes de, França-Filho, Lyzio, Negri, Sérgio Luiz Coelho, Pordeus, Isabela Almeida","Medicina Oral, Patología Oral y Cirugía Bucal (Internet); 12(7); 469-473","Medicina Oral, Patología Oral y Cirugía Bucal (Internet)","Inglês","2007","http://scielo.isciii.es/scielo.php?script=sci_arttext&pid=S1698-69462007000700001&lang=pt" 
"S1698-69462007000700008-esp","Salivary gland application of botulinum toxin for the treatment of sialorrhea","Fuster Torres, María Ángeles, Berini Aytés, Leonardo, Gay Escoda, Cosme","Medicina Oral, Patología Oral y Cirugía Bucal (Internet); 12(7); 511-517","Medicina Oral, Patología Oral y Cirugía Bucal (Internet)","Inglês","2007","http://scielo.isciii.es/scielo.php?script=sci_arttext&pid=S1698-69462007000700008&lang=pt" 
"S1698-69462007000700006-esp","Criteria for selecting children with special needs for dental treatment under general anaesthesia","Nova García, M. Joaquín de, Gallardo López, Nuria E., Martín Sanjuán, Carmen, Mourelle Martínez, M. Rosa, Alonso García, Yolanda, Carracedo Cabaleiro, Esther","Medicina Oral, Patología Oral y Cirugía Bucal (Internet); 12(7); 496-503","Medicina Oral, Patología Oral y Cirugía Bucal (Internet)","Inglês","2007","http://scielo.isciii.es/scielo.php?script=sci_arttext&pid=S1698-69462007000700006&lang=pt" 
"S1698-69462007000700014-esp","The influence of soft acidic drinks in exposing dentinal tubules after non-surgical periodontal treatment: A SEM investigation on the protective effects of oxalate-containing phytocomplex","Sauro, Salvatore, Mannocci, Francesco, Watson, Timothy F., Piemontese, Matteo, Sherriff, Martyn, Mongiorgi, Romano","Medicina Oral, Patología Oral y Cirugía Bucal (Internet); 12(7); 542-548","Medicina Oral, Patología Oral y Cirugía Bucal (Internet)","Inglês","2007","http://scielo.isciii.es/scielo.php?script=sci_arttext&pid=S1698-69462007000700014&lang=pt" 
"S0101-33002007000300005-scl","Anti-semitismo na Europa hoje","Sorj, Bila","Novos Estudos - CEBRAP; (79); 97-115","Novos Estudos - CEBRAP","Português","2007","http://www.scielo.br/scielo.php?script=sci_arttext&pid=S0101-33002007000300005&lang=pt" 
"S0101-33002007000300006-scl","Os sefarditas em Israel: o sionismo do ponto de vista das vítimas judaicas","Shohat, Ella","Novos Estudos - CEBRAP; (79); 117-136","Novos Estudos - CEBRAP","Português","2007","http://www.scielo.br/scielo.php?script=sci_arttext&pid=S0101-33002007000300006&lang=pt" 
"S0101-33002007000300007-scl","A lógica da corrupção: um olhar psicanalítico","Minerbo, Marion","Novos Estudos - CEBRAP; (79); 139-149","Novos Estudos - CEBRAP","Português","2007","http://www.scielo.br/scielo.php?script=sci_arttext&pid=S0101-33002007000300007&lang=pt" 
"S0101-33002007000300014-scl","Ambigüidades na construção de um &quot;gênio brasileiro&quot;","Cattani, Icleia Borsa","Novos Estudos - CEBRAP; (79); 251-257","Novos Estudos - CEBRAP","Português","2007","http://www.scielo.br/scielo.php?script=sci_arttext&pid=S0101-33002007000300014&lang=pt" 
"S0101-33002007000300016-scl","Dez cartas jesuíticas","Pereira, Iuri","Novos Estudos - CEBRAP; (79); 267-272","Novos Estudos - CEBRAP","Português","2007","http://www.scielo.br/scielo.php?script=sci_arttext&pid=S0101-33002007000300016&lang=pt" 
"S0101-33002007000300012-scl","Nova voz na música brasileira","Fróes, Romulo","Novos Estudos - CEBRAP; (79); 229-236","Novos Estudos - CEBRAP","Português","2007","http://www.scielo.br/scielo.php?script=sci_arttext&pid=S0101-33002007000300012&lang=pt" 
"S0101-33002007000300015-scl","Sinal de perigo","Rodrigues, Thiago","Novos Estudos - CEBRAP; (79); 259-264","Novos Estudos - CEBRAP","Português","2007","http://www.scielo.br/scielo.php?script=sci_arttext&pid=S0101-33002007000300015&lang=pt" 
"S0101-33002007000300017-scl","A letra Z","Arêas, Vilma","Novos Estudos - CEBRAP; (79); 275-277","Novos Estudos - CEBRAP","Português","2007","http://www.scielo.br/scielo.php?script=sci_arttext&pid=S0101-33002007000300017&lang=pt" 
"S0101-33002007000300018-scl","Errata","","Novos Estudos - CEBRAP; (79); -","Novos Estudos - CEBRAP","Português","2007","http://www.scielo.br/scielo.php?script=sci_arttext&pid=S0101-33002007000300018&lang=pt" 
"S0101-33002007000300001-scl","Transferência de renda no Brasil","Medeiros, Marcelo, Britto, Tatiana, Soares, Fábio","Novos Estudos - CEBRAP; (79); 5-21","Novos Estudos - CEBRAP","Português","2007","http://www.scielo.br/scielo.php?script=sci_arttext&pid=S0101-33002007000300001&lang=pt" 
"S0101-33002007000300003-scl","Matriz energética brasileira: uma prospectiva","Tolmasquim, Mauricio T., Guerreiro, Amilcar, Gorini, Ricardo","Novos Estudos - CEBRAP; (79); 47-69","Novos Estudos - CEBRAP","Português","2007","http://www.scielo.br/scielo.php?script=sci_arttext&pid=S0101-33002007000300003&lang=pt" 
"S0101-33002007000300004-scl","Para além do pensamento abissal: das linhas globais a uma ecologia de saberes","Santos, Boaventura de Sousa","Novos Estudos - CEBRAP; (79); 71-94","Novos Estudos - CEBRAP","Português","2007","http://www.scielo.br/scielo.php?script=sci_arttext&pid=S0101-33002007000300004&lang=pt" 
"S0101-33002007000300008-scl","Identidade e estratégia na formação do movimento ambientalista brasileiro","Alonso, Angela, Costa, Valeriano, Maciel, Débora","Novos Estudos - CEBRAP; (79); 151-167","Novos Estudos - CEBRAP","Português","2007","http://www.scielo.br/scielo.php?script=sci_arttext&pid=S0101-33002007000300008&lang=pt" 
"S0101-33002007000300010-scl","O Memorial de Aires e a Abolição","Fragelli, Pedro Coelho","Novos Estudos - CEBRAP; (79); 195-208","Novos Estudos - CEBRAP","Português","2007","http://www.scielo.br/scielo.php?script=sci_arttext&pid=S0101-33002007000300010&lang=pt" 
"S0101-33002007000300013-scl","Em busca da palavra do mestre","Leonídio, Otavio","Novos Estudos - CEBRAP; (79); 239-249","Novos Estudos - CEBRAP","Português","2007","http://www.scielo.br/scielo.php?script=sci_arttext&pid=S0101-33002007000300013&lang=pt" 
"S0121-49932007000200007-col","Optimización del proceso logístico en una empresa de colombiana de alimentos congelados y refrigerados","Mejía, Gonzalo, Castro, Elkin","Revista de Ingeniería; (26); 47-54","Revista de Ingeniería","Espanhol","2007","http://www.scielo.org.co/scielo.php?script=sci_arttext&pid=S0121-49932007000200007&lang=pt" 
"S0121-49932007000200006-col","Modelación de enclavamientos en subestaciones eléctricas de transmisión de energía utilizando Redes de Petri de alto nivel","Sanz, Fredy Alberto","Revista de Ingeniería; (26); 39-46","Revista de Ingeniería","Espanhol","2007","http://www.scielo.org.co/scielo.php?script=sci_arttext&pid=S0121-49932007000200006&lang=pt" 
