"S0121-49932007000200005-col","Plataforma para el acceso a servicios desde dispositivos móviles utilizando parámetros de autenticación basados en SIM Card","Martínez, Francisco, Hernández, Rodrigo, Caicedo, Jaime, Caicedo, Oscar, Hurtado, Javier","Revista de Ingeniería; (26); 29-38","Revista de Ingeniería","Espanhol","2007","http://www.scielo.org.co/scielo.php?script=sci_arttext&pid=S0121-49932007000200005&lang=pt" 
"S0121-49932007000200003-col","Planeamiento en el largo plazo de un sistema de transmisión de energía eléctrica incluyendo valoración explícita de la confiabilidad","Garcés, Lina, Zapata, Carlos J.","Revista de Ingeniería; (26); 14-21","Revista de Ingeniería","Espanhol","2007","http://www.scielo.org.co/scielo.php?script=sci_arttext&pid=S0121-49932007000200003&lang=pt" 
"S0121-49932007000200002-col","Contribución para QoS en Redes Metropolitanas Ethernet","Álvarez, Omar, Mayoral, Margarita, Moliner, Carmen","Revista de Ingeniería; (26); 07-13","Revista de Ingeniería","Espanhol","2007","http://www.scielo.org.co/scielo.php?script=sci_arttext&pid=S0121-49932007000200002&lang=pt" 
"S0121-49932007000200001-col","","","Revista de Ingeniería; (26); 03-04","Revista de Ingeniería","Espanhol","2007","http://www.scielo.org.co/scielo.php?script=sci_arttext&pid=S0121-49932007000200001&lang=pt" 
"S0121-49932007000200009-col","Reflexiones sobre el papel de la Ingeniería Civil en la evolución del medio ambiente en Colombia","Mariño, Juan José","Revista de Ingeniería; (26); 65-73","Revista de Ingeniería","Espanhol","2007","http://www.scielo.org.co/scielo.php?script=sci_arttext&pid=S0121-49932007000200009&lang=pt" 
"S0121-49932007000200008-col","Ingenieria y medio ambiente","Rodríguez Becerra, Manuel","Revista de Ingeniería; (26); 56-63","Revista de Ingeniería","Espanhol","2007","http://www.scielo.org.co/scielo.php?script=sci_arttext&pid=S0121-49932007000200008&lang=pt" 
"S0121-49932007000200004-col","El desarrollo de aplicaciones colaborativas de alta calidad: una realidad sobre la Red Académica de Alto Desempeño (Renata)","Hernández, José Tiberio, Díaz, Eddy, Figueroa, Pablo, De la Rosa, Fernando","Revista de Ingeniería; (26); 22-28","Revista de Ingeniería","Espanhol","2007","http://www.scielo.org.co/scielo.php?script=sci_arttext&pid=S0121-49932007000200004&lang=pt" 
"S0864-03942007000400001-cub","Generación, difusión y adopción de tecnologías para la producción, beneficio y conservación de semillas de plantas forrajeras con un enfoque empresarial","Pérez, A, Suárez, J, Matías, C, González, Yolanda, Navarro, Marlen, Vieito, E.L","Pastos y Forrajes; 30(4); -","Pastos y Forrajes","Espanhol","2007","http://scielo.sld.cu/scielo.php?script=sci_arttext&pid=S0864-03942007000400001&lang=pt" 
"S0864-03942007000400003-cub","Efecto del método de secado en la longevidad y la calidad de las semillas de Bauhinia purpurea.: I. Almacenamiento en Condiciones Ambientales","Navarro, Marlen, Lezcano, J.C","Pastos y Forrajes; 30(4); -","Pastos y Forrajes","Espanhol","2007","http://scielo.sld.cu/scielo.php?script=sci_arttext&pid=S0864-03942007000400003&lang=pt" 
"S0864-03942007000400004-cub","Nota Técnica: Comportamiento productivo de la morera sometida a dos alternativas de fertilización orgánica","Pentón, Gertrudis","Pastos y Forrajes; 30(4); -","Pastos y Forrajes","Espanhol","2007","http://scielo.sld.cu/scielo.php?script=sci_arttext&pid=S0864-03942007000400004&lang=pt" 
"S0864-03942007000400005-cub","Caracterización de la comunidad vegetal en una asociación de gramíneas mejoradas y Leucaena leucocephala cv.: Cunningham","Sánchez, Tania, Lamela, L, López, O","Pastos y Forrajes; 30(4); -","Pastos y Forrajes","Espanhol","2007","http://scielo.sld.cu/scielo.php?script=sci_arttext&pid=S0864-03942007000400005&lang=pt" 
"S0864-03942007000400006-cub","Estudio de la descomposición de la hojarasca en un pastizal de Panicum maximum Jacq cv. Likoni","Sánchez, Saray, Crespo, G, Hernández, Marta","Pastos y Forrajes; 30(4); -","Pastos y Forrajes","Espanhol","2007","http://scielo.sld.cu/scielo.php?script=sci_arttext&pid=S0864-03942007000400006&lang=pt" 
"S0864-03942007000400007-cub","Carbono secuestrado en ecosistemas agropecuarios cubanos y su valoración económica.: Estudio de caso","Miranda, Taymer, Machado, R, Machado, Hilda, Duquesne, P","Pastos y Forrajes; 30(4); -","Pastos y Forrajes","Espanhol","2007","http://scielo.sld.cu/scielo.php?script=sci_arttext&pid=S0864-03942007000400007&lang=pt" 
"S0864-03942007000400002-cub","Nota técnica: Influencia de la densidad de plantación en el establecimiento de la morera","Noda, Yolai, Martín, G, Mesa, A.R","Pastos y Forrajes; 30(4); -","Pastos y Forrajes","Espanhol","2007","http://scielo.sld.cu/scielo.php?script=sci_arttext&pid=S0864-03942007000400002&lang=pt" 
"S0104-44782007000200012-scl","Reconhecimento em debate: os modelos de Honneth e Fraser em sua relação com o legado Habermasiano","Mendonça, Ricardo Fabrino","Revista de Sociologia e Política; (29); 169-185","Revista de Sociologia e Política","Português","2007","http://www.scielo.br/scielo.php?script=sci_arttext&pid=S0104-44782007000200012&lang=pt" 
"S1645-00862007000200001-prt","Vinculação parental durante a gravidez: Versão portuguesa da forma materna e paterna da antenatal emotional attachment scale","Gomez, Rita, Leal, Isabel","Psicologia, Saúde &amp; Doenças; 8(2); 153-165","Psicologia, Saúde &amp; Doenças","Português","2007","http://www.scielo.mec.pt/scielo.php?script=sci_arttext&pid=S1645-00862007000200001&lang=pt" 
"S1645-00862007000200002-prt","Experiências adversas, comportamentos de risco, queixas de saúde e preocupações modernas de saúde em universitários: Uma comparação entre diferentes licenciaturas","Maia, Angela Costa, Seabra, Armanda","Psicologia, Saúde &amp; Doenças; 8(2); 167-180","Psicologia, Saúde &amp; Doenças","Português","2007","http://www.scielo.mec.pt/scielo.php?script=sci_arttext&pid=S1645-00862007000200002&lang=pt" 
"S1645-00862007000200003-prt","O conceito de cuidador analisado numa perspectiva autopoiética: do caos à autopoiése","Oliveira, Magda A., Queirós, Cristina, Guerra, Marina Prista","Psicologia, Saúde &amp; Doenças; 8(2); 181-196","Psicologia, Saúde &amp; Doenças","Português","2007","http://www.scielo.mec.pt/scielo.php?script=sci_arttext&pid=S1645-00862007000200003&lang=pt" 
"S1645-00862007000200004-prt","Atitudes face ao tabagismo: Hábitos tabágicos e o papel dos profissionais de saúde","Barreira, Esmeralda, Gomes, Francisco Sampaio, Cunha, Luís Miguel","Psicologia, Saúde &amp; Doenças; 8(2); 197-207","Psicologia, Saúde &amp; Doenças","Português","2007","http://www.scielo.mec.pt/scielo.php?script=sci_arttext&pid=S1645-00862007000200004&lang=pt" 
"S1645-00862007000200005-prt","Contracepção: conhecimentos e atitudes em jovens universitários","Reis, Marta, Matos, Margarida Gaspar de","Psicologia, Saúde &amp; Doenças; 8(2); 209-220","Psicologia, Saúde &amp; Doenças","Português","2007","http://www.scielo.mec.pt/scielo.php?script=sci_arttext&pid=S1645-00862007000200005&lang=pt" 
"S1645-00862007000200006-prt","Humor, atenção concentrada e qualidade de vida no climatério: Um estudo no Brasil Central","Moraes, Valdeilma Maria, Vandenberghe, Luc, Silveira, Nusa de Almeida","Psicologia, Saúde &amp; Doenças; 8(2); 221-237","Psicologia, Saúde &amp; Doenças","Português","2007","http://www.scielo.mec.pt/scielo.php?script=sci_arttext&pid=S1645-00862007000200006&lang=pt" 
"S1645-00862007000200007-prt","A malformação do bebé: Vivências psicológicas do casal","Antunes, Mónica Sofia do Couto, Patrocínio, Carla","Psicologia, Saúde &amp; Doenças; 8(2); 239-251","Psicologia, Saúde &amp; Doenças","Português","2007","http://www.scielo.mec.pt/scielo.php?script=sci_arttext&pid=S1645-00862007000200007&lang=pt" 
"S1645-00862007000200008-prt","Maternidade “prematura”: Uma investigação psicossociológica na unidade de terapia intensiva neonatal","Barros, Sibelle Maria Martins de, Trindade, Zeidi Araujo","Psicologia, Saúde &amp; Doenças; 8(2); 253-269","Psicologia, Saúde &amp; Doenças","Português","2007","http://www.scielo.mec.pt/scielo.php?script=sci_arttext&pid=S1645-00862007000200008&lang=pt" 
"S1645-00862007000200009-prt","Metric properties of a portuguese version of theabridged, 5-item version of the internacional indexof erectile function (IIEF-5)","Ribeiro, J.L. Pais, Santos, Abel","Psicologia, Saúde &amp; Doenças; 8(2); 271-274","Psicologia, Saúde &amp; Doenças","Inglês","2007","http://www.scielo.mec.pt/scielo.php?script=sci_arttext&pid=S1645-00862007000200009&lang=pt" 
"S0717-68212007000200001-chl","An Auction Mechanism for the Commons: Some Extensions","MONTERO, JUAN-PABLO","Cuadernos de economía; 44(130); 141-150","Cuadernos de economía","Inglês","2007","http://www.scielo.cl/scielo.php?script=sci_arttext&pid=S0717-68212007000200001&lang=pt" 
"S0012-73532007000300004-col","MODELACIÓN ESTADÍSTICA DE LOS APORTES DE LAS VÍAS COMO FUENTES DE EMISION A LAS PARTÍCULAS TOTALES EN SUSPENSION SEGÚN MODELO MCF, ZONA CENTRO DE MEDELLIN-ANTIOQUIA-COLOMBIA, 2004","GÓMEZ, MIRYAM, SALDARRIAGA, JULIO, CORREA, MAURICIO, POSADA, ENRIQUE, CASTRILLÓN M, FRANCISCO JAVIER","DYNA; 74(153); 35-40","DYNA","Espanhol","2007","http://www.scielo.org.co/scielo.php?script=sci_arttext&pid=S0012-73532007000300004&lang=pt" 
"S0100-204X2007001100004-scl","Scanning electron microscopy of the interaction between Cryptococcus magnus and Colletotrichum gloeosporioides on papaya fruit","Capdeville, Guy de, Souza Júnior, Manoel Teixeira, Santos, Jansen Rodrigo Pereira, Miranda, Simoni Paula, Caetano, Alexandre Rodrigues, Falcão, Rosana, Gomes, Ana Cristina Menezes Mendes","Pesquisa Agropecuária Brasileira; 42(11); 1537-1544","Pesquisa Agropecuária Brasileira","Inglês","2007","http://www.scielo.br/scielo.php?script=sci_arttext&pid=S0100-204X2007001100004&lang=pt" 
"S0100-204X2007001100020-scl","Transformação genética de laranja &#039;Valência&#039; com o gene cecropin MB39","Paoli, Luis Gustavo de, Camargo, Raquel Luciana Boscariol, Harakava, Ricardo, Mendes, Beatriz Madalena Januzzi, Mourão Filho, Francisco de Assis Alves","Pesquisa Agropecuária Brasileira; 42(11); 1663-1666","Pesquisa Agropecuária Brasileira","Português","2007","http://www.scielo.br/scielo.php?script=sci_arttext&pid=S0100-204X2007001100020&lang=pt" 
"S0100-204X2007001100019-scl","Minipenetrômetro dinâmico para determinação da resistência à penetração em amostras de solo indeformadas","Sá, Marcos Aurélio Carolino de, Santos Junior, João de Deus Gomes dos, Resck, Dimas Vital Siqueira, Ferreira, Eloisa Aparecida Belleza, Franz, Claudio Alberto Bento","Pesquisa Agropecuária Brasileira; 42(11); 1659-1662","Pesquisa Agropecuária Brasileira","Português","2007","http://www.scielo.br/scielo.php?script=sci_arttext&pid=S0100-204X2007001100019&lang=pt" 
"S0378-18442007001100009-ven","Diversidad arbórea en cacaotales del Soconusco, Chiapas, México","Salgado-Mora, Marisela G, Ibarra-Núñez, Guillermo, Macías-Sámano, Jorge E, López-Báez, Orlando","Interciencia; 32(11); 763-768","Interciencia","Espanhol","2007","http://www.scielo.org.ve/scielo.php?script=sci_arttext&pid=S0378-18442007001100009&lang=pt" 
"S0378-18442007001100008-ven","Comparative cytogenetic and allozyme analysis of Mugil rubrioculus and M. curema (TELEOSTEI: MUGILIDAE) from Venezuela","Nirchio, Mauro, Oliveira, Claudio, Ferreira, Irani A, Pérez, Julio E, Gaviria, Juan I, Harrison, Ian, Rossi, Anna Rita, Sola, Luciana","Interciencia; 32(11); 757-762","Interciencia","Inglês","2007","http://www.scielo.org.ve/scielo.php?script=sci_arttext&pid=S0378-18442007001100008&lang=pt" 
"S0378-18442007001100005-ven","La depresión submarina de Guaracayal, estado Sucre, Venezuela: Una barrera para la propagación de la ruptura cosísmica a lo largo de la falla de el pilar","Audemard, Franck, Beck, Christian, Moernaut, Jasper, De Rycker, Koen, De Batist, Marc, Sánchez, Javier, González, Moralis, Sánchez, Cristhian, Versteeg, Willem, Malavé, Gustavo, Schmitz, Michael, Van Welden, Aurélien, Carrillo, Eduardo, Lemus, Andrés","Interciencia; 32(11); 735-741","Interciencia","Espanhol","2007","http://www.scielo.org.ve/scielo.php?script=sci_arttext&pid=S0378-18442007001100005&lang=pt" 
"S0378-18442007001100004-ven","Factores de riesgo en las Cactaceae amenazadas de una región semiárida en el sur del desierto Chihuahuense, México","Hernández-Oria, José Guadalupe, Chávez-Martínez, Ruth Julieta, Sánchez-Martínez, Emiliano","Interciencia; 32(11); 728-734","Interciencia","Espanhol","2007","http://www.scielo.org.ve/scielo.php?script=sci_arttext&pid=S0378-18442007001100004&lang=pt" 
"S0378-18442007001100007-ven","Subproductos de la desinfección del agua potable: Formación, aspectos sanitarios y reglamentación","Rodríguez, Manuel J, Rodríguez, Germán, Serodes, Jean, Sadiq, Rehan","Interciencia; 32(11); 749-756","Interciencia","Espanhol","2007","http://www.scielo.org.ve/scielo.php?script=sci_arttext&pid=S0378-18442007001100007&lang=pt" 
"S0378-18442007001100006-ven","El sistema Kirón: Hacia una integración de los valores económicos y ecológicos del Oikos","Curiel Carías, Ernesto C","Interciencia; 32(11); 742-748","Interciencia","Espanhol","2007","http://www.scielo.org.ve/scielo.php?script=sci_arttext&pid=S0378-18442007001100006&lang=pt" 
"S0378-18442007001100001-ven","La cultura de la publicación científica (IV)","Laufer, Miguel","Interciencia; 32(11); 725-725","Interciencia","Espanhol","2007","http://www.scielo.org.ve/scielo.php?script=sci_arttext&pid=S0378-18442007001100001&lang=pt" 
"S0378-18442007001100003-ven","A cultura da publicação científica (IV)","Laufer, Miguel","Interciencia; 32(11); 727-727","Interciencia","Português","2007","http://www.scielo.org.ve/scielo.php?script=sci_arttext&pid=S0378-18442007001100003&lang=pt" 
"S0378-18442007001100002-ven","The culture of scientific publication (IV)","Laufer, Miguel","Interciencia; 32(11); 726-726","Interciencia","Inglês","2007","http://www.scielo.org.ve/scielo.php?script=sci_arttext&pid=S0378-18442007001100002&lang=pt" 
"S0378-18442007001100014-ven","Relaciones hídricas, fotosíntesis, y anatomía foliar de dos especies del género Calotropis","Colombo, Rita, Marín, Oranys, Irazábal, Shaybeth, Tezara, Wilmer","Interciencia; 32(11); 791-796","Interciencia","Espanhol","2007","http://www.scielo.org.ve/scielo.php?script=sci_arttext&pid=S0378-18442007001100014&lang=pt" 
"S0378-18442007001100012-ven","Actividad fibrolítica de enzimas producidas por Trametes sp. EUM1, Pleurotus ostreatus IE8 y Aspergillus niger AD96.4 en fermentación sólida","Márquez-Araque, Alis Teresa, Mendoza Martínez, Germán David, González Muñoz, Sergio Segundo, Buntinx Dios, Silvia Elena, Loera Corral, Octavio","Interciencia; 32(11); 780-785","Interciencia","Espanhol","2007","http://www.scielo.org.ve/scielo.php?script=sci_arttext&pid=S0378-18442007001100012&lang=pt" 
"S0378-18442007001100013-ven","Entre la vida académica y la vida familiar: Retos y estrategias de investigadores del sur de México","Morales, Helda","Interciencia; 32(11); 786-790","Interciencia","Espanhol","2007","http://www.scielo.org.ve/scielo.php?script=sci_arttext&pid=S0378-18442007001100013&lang=pt" 
"S0378-18442007001100010-ven","Efecto perjudicial de Moringa oleifera (Lam.) combinada con otros desechos agrícolas como sustratos para la lombriz roja (Eisenia spp.)","Cova, Luis José, García, Danny Eugenio, Castro, Alexander Rafael, Medina, María Gabriela","Interciencia; 32(11); 769-774","Interciencia","Espanhol","2007","http://www.scielo.org.ve/scielo.php?script=sci_arttext&pid=S0378-18442007001100010&lang=pt" 
"S0378-18442007001100011-ven","Marcador RAPD asociado a la resistencia a Fusarium oxysporum en Musa","Zambrano, Asia Y, Martínez, Gustavo, Gutiérrez, Zulay, Manzanilla, Edwin, Vicente-Villardón, José Luís, Demey, Jhonny R","Interciencia; 32(11); 775-779","Interciencia","Espanhol","2007","http://www.scielo.org.ve/scielo.php?script=sci_arttext&pid=S0378-18442007001100011&lang=pt" 
"S0100-204X2007001100002-scl","Alocação de fotoassimilados em folhas e frutos de cafeeiro cultivado em duas altitudes","Laviola, Bruno Galvêas, Martinez, Herminia Emilia Prieto, Salomão, Luiz Carlos Chamhum, Cruz, Cosme Damião, Mendonça, Sebastião Marcos, Neto, Ana Paula","Pesquisa Agropecuária Brasileira; 42(11); 1521-1530","Pesquisa Agropecuária Brasileira","Português","2007","http://www.scielo.br/scielo.php?script=sci_arttext&pid=S0100-204X2007001100002&lang=pt" 
"S0100-204X2007001100006-scl","Nutrição e produtividade do amendoim em sucessão ao cultivo de plantas de cobertura no sistema plantio direto","Crusciol, Carlos Alexandre Costa, Soratto, Rogério Peres","Pesquisa Agropecuária Brasileira; 42(11); 1553-1560","Pesquisa Agropecuária Brasileira","Português","2007","http://www.scielo.br/scielo.php?script=sci_arttext&pid=S0100-204X2007001100006&lang=pt" 
"S0100-204X2007001100007-scl","Cultivo hidropônico de lisianto para flor de corte em sistema de fluxo laminar de nutrientes","Backes, Fernanda Alice Antonello Londero, Barbosa, José Geraldo, Cecon, Paulo Roberto, Grossi, José Antonio Saraiva, Backes, Rogério Luiz, Finger, Fernando Luiz","Pesquisa Agropecuária Brasileira; 42(11); 1561-1566","Pesquisa Agropecuária Brasileira","Português","2007","http://www.scielo.br/scielo.php?script=sci_arttext&pid=S0100-204X2007001100007&lang=pt" 
"S0100-204X2007001100008-scl","Análise de fatores e estratificação ambiental na avaliação da adaptabilidade e estabilidade em soja","Mendonça, Osmair, Carpentieri-Pípolo, Valéria, Garbuglio, Deoclécio Domingos, Fonseca Junior, Nelson da Silva","Pesquisa Agropecuária Brasileira; 42(11); 1567-1575","Pesquisa Agropecuária Brasileira","Português","2007","http://www.scielo.br/scielo.php?script=sci_arttext&pid=S0100-204X2007001100008&lang=pt" 
"S0100-204X2007001100011-scl","Interação entre fungos micorrízicos arbusculares e bactérias diazotróficas em trigo","Sala, Valéria Marino Rodrigues, Freitas, Sueli dos Santos, Silveira, Adriana Parada Dias da","Pesquisa Agropecuária Brasileira; 42(11); 1593-1600","Pesquisa Agropecuária Brasileira","Português","2007","http://www.scielo.br/scielo.php?script=sci_arttext&pid=S0100-204X2007001100011&lang=pt" 
"S0100-204X2007001100012-scl","Glutamina e turnover do carbono no tecido adiposo de leitões","Caldara, Fabiana Ribeiro, Ducatti, Carlos, Berto, Dirlei Antonio, Denadai, Juliana Célia, Andrade, Gustavo Augusto, Gioso, Marilú Martins","Pesquisa Agropecuária Brasileira; 42(11); 1601-1607","Pesquisa Agropecuária Brasileira","Português","2007","http://www.scielo.br/scielo.php?script=sci_arttext&pid=S0100-204X2007001100012&lang=pt" 
"S0100-204X2007001100013-scl","Desempenho e atividade de amilase em tilápias-do-nilo submetidas a diferentes temperaturas","Moura, Guilherme de Souza, Oliveira, Maria Goreti Almeida, Lanna, Eduardo Teixeira Arruda, Maciel Júnior, Alaor, Maciel, Cláudia Maria Reis Raposo","Pesquisa Agropecuária Brasileira; 42(11); 1609-1615","Pesquisa Agropecuária Brasileira","Português","2007","http://www.scielo.br/scielo.php?script=sci_arttext&pid=S0100-204X2007001100013&lang=pt" 
"S0100-204X2007001100015-scl","Retenção e dessorção competitivas de ânions inorgânicos em gibbsita natural de solo","Pozza, Adélia Aziz Alexandre, Curi, Nilton, Costa, Enio Tarso de Souza, Guilherme, Luiz Roberto Guimarães, Marques, João José Granate de Sá e Melo, Motta, Paulo Emílio Ferreira da","Pesquisa Agropecuária Brasileira; 42(11); 1627-1633","Pesquisa Agropecuária Brasileira","Português","2007","http://www.scielo.br/scielo.php?script=sci_arttext&pid=S0100-204X2007001100015&lang=pt" 
"S0100-204X2007001100017-scl","Eficiência de pastejo de capim-marandu submetido a diferentes ofertas de forragem","Braga, Gustavo José, Pedreira, Carlos Guilherme Silveira, Herling, Valdo Rodrigues, Luz, Pedro Henrique de Cerqueira","Pesquisa Agropecuária Brasileira; 42(11); 1641-1649","Pesquisa Agropecuária Brasileira","Português","2007","http://www.scielo.br/scielo.php?script=sci_arttext&pid=S0100-204X2007001100017&lang=pt" 
"S0100-204X2007001100018-scl","Variáveis ruminais avaliadas por meio de funções matemáticas contínuas","Detmann, Edenio, Cecon, Paulo Roberto, Paulino, Mário Fonseca, Valadares Filho, Sebastião de Campos, Henriques, Lara Toledo, Detmann, Kelly da Silva Coutinho","Pesquisa Agropecuária Brasileira; 42(11); 1651-1657","Pesquisa Agropecuária Brasileira","Português","2007","http://www.scielo.br/scielo.php?script=sci_arttext&pid=S0100-204X2007001100018&lang=pt" 
"S0100-204X2007001100016-scl","Caracterização nutricional de grãos integrais e descascados de cultivares de cevada","Mayer, Elveni Teresinha, Fuke, Gitane, Nörnberg, José Laerte, Minella, Euclydes","Pesquisa Agropecuária Brasileira; 42(11); 1635-1640","Pesquisa Agropecuária Brasileira","Português","2007","http://www.scielo.br/scielo.php?script=sci_arttext&pid=S0100-204X2007001100016&lang=pt" 
"S0100-204X2007001100003-scl","Lesões foliares e de ramos de laranjeira-doce causadas pela leprose-dos-citros","Marques, João Paulo Rodrigues, Freitas-Astúa, Juliana de, Kitajima, Elliot Watanabe, Appezzato-da-Glória, Beatriz","Pesquisa Agropecuária Brasileira; 42(11); 1531-1536","Pesquisa Agropecuária Brasileira","Português","2007","http://www.scielo.br/scielo.php?script=sci_arttext&pid=S0100-204X2007001100003&lang=pt" 
"S0066-782X2007001700015-scl","Padrão Ecocardiográfico do fluxo da artéria torácica interna esquerda após revascularização do miocárdio com enxerto composto","Forte, Antonio Jorge de Vasconcelos, Lobo Filho, José Glauco, Leitão, Maria Cláudia A","Arquivos Brasileiros de Cardiologia; 89(5); e163-e164","Arquivos Brasileiros de Cardiologia","Inglês, Português","2007","http://www.scielo.br/scielo.php?script=sci_arttext&pid=S0066-782X2007001700015&lang=pt" 
"S0066-782X2007001700010-scl","Caso 6/2007: criança de dez anos com estenose pulmonar valvar discreta","Atik, Edmar","Arquivos Brasileiros de Cardiologia; 89(5); 341-342","Arquivos Brasileiros de Cardiologia","Inglês, Português","2007","http://www.scielo.br/scielo.php?script=sci_arttext&pid=S0066-782X2007001700010&lang=pt" 
"S0066-782X2007001700002-scl","Ablação da fibrilação atrial no Brasil: resultados do registro da Sociedade Brasileira de Arritmias Cardíacas","Fenelon, Guilherme, Scanavacca, Maurício, Atié, Jacob, Zimerman, Leandro, Magalhães, Luiz Pereira de, Lorga Filho, Adalberto, Maia, Henrique, Martinelli Filho, Martino","Arquivos Brasileiros de Cardiologia; 89(5); 285-289","Arquivos Brasileiros de Cardiologia","Inglês, Português","2007","http://www.scielo.br/scielo.php?script=sci_arttext&pid=S0066-782X2007001700002&lang=pt" 
"S0066-782X2007001700013-scl","Artéria coronária direita de origem anômala: diagnóstico e tratamento","Leme Neto, Antonio Carvalho, Carvalho, Roberto Gomes de, Rauen Junior, Remulo José, Melnick, Gilberto, Carvalho, Gustavo, Marchiori, Janaine","Arquivos Brasileiros de Cardiologia; 89(5); e132-e135","Arquivos Brasileiros de Cardiologia","Inglês, Português","2007","http://www.scielo.br/scielo.php?script=sci_arttext&pid=S0066-782X2007001700013&lang=pt" 
"S0066-782X2007001700011-scl","Aplicação da assistência circulatória mecânica em casos de falência cardíaca aguda irrecuperável","Colafranceschi, Alexandre Siciliano, Monteiro, Andrey José de Oliveira, Barbosa, Rodrigo Minati, Côrtes, Denise Castro de Souza, Correa, Celso Musa, Canale, Leonardo Secchin, Fernandes, Marcelo Ramalho, Botelho, Eduardo, Campos, Luiz Antonio de Almeida","Arquivos Brasileiros de Cardiologia; 89(5); 343-345","Arquivos Brasileiros de Cardiologia","Inglês, Português","2007","http://www.scielo.br/scielo.php?script=sci_arttext&pid=S0066-782X2007001700011&lang=pt" 
"S0066-782X2007001700009-scl","Exposição ao tabagismo e atitudes: comparação entre inquéritos realizados na população adulta do município de São Paulo em 1987 e 2002","Marcopito, Luiz Francisco, Coutinho, Ana Paula, Valencich, Dalva Maria de Oliveira, Moraes, Marco Antonio de, Brumini, Rodolfo, Ribeiro, Sandra Aparecida","Arquivos Brasileiros de Cardiologia; 89(5); 333-340","Arquivos Brasileiros de Cardiologia","Inglês, Português","2007","http://www.scielo.br/scielo.php?script=sci_arttext&pid=S0066-782X2007001700009&lang=pt" 
"S0100-204X2007001100001-scl","Uso da radiação solar pelo milho sob diferentes preparos do solo, espaçamento e disponibilidade hídrica","Kunz, Jefferson Horn, Bergonci, João Ito, Bergamaschi, Homero, Dalmago, Genei Antonio, Heckler, Bruna Maria Machado, Comiran, Flavia","Pesquisa Agropecuária Brasileira; 42(11); 1511-1520","Pesquisa Agropecuária Brasileira","Português","2007","http://www.scielo.br/scielo.php?script=sci_arttext&pid=S0100-204X2007001100001&lang=pt" 
"S0100-204X2007001100009-scl","Genetic diversity of Brazilian triticales evaluated with genomic wheat microsatellites","Costa, Cibele Tesser da, Albuquerque, Ana Christina Sagebin, Nascimento Junior, Alfredo do, Marcelino, Francismar Correa, Pereira, Jorge Fernando","Pesquisa Agropecuária Brasileira; 42(11); 1577-1586","Pesquisa Agropecuária Brasileira","Inglês","2007","http://www.scielo.br/scielo.php?script=sci_arttext&pid=S0100-204X2007001100009&lang=pt" 
"S0100-204X2007001100010-scl","Sulfonamidas em leite por cromatografia líquida de alta eficiência com derivação pré-coluna e detecção por fluorescência","Alaburda, Janete, Ruvieri, Valter, Shundo, Luzia, Almeida, Adriana Palma de, Tiglea, Paulo, Sabino, Myrna","Pesquisa Agropecuária Brasileira; 42(11); 1587-1592","Pesquisa Agropecuária Brasileira","Português","2007","http://www.scielo.br/scielo.php?script=sci_arttext&pid=S0100-204X2007001100010&lang=pt" 
