"S0100-204X2007001100014-scl","Infiltração de atrazina em latossolo submetido aos sistemas de plantio direto e convencional","Correia, Fabio Veríssimo, Mercante, Fabio Martins, Fabrício, Amoacy Carvalho, Campos, Tácio Mauro Pereira de, Vargas Júnior, Eurípedes Amaral, Langenbach, Tomaz","Pesquisa Agropecuária Brasileira; 42(11); 1617-1625","Pesquisa Agropecuária Brasileira","Português","2007","http://www.scielo.br/scielo.php?script=sci_arttext&pid=S0100-204X2007001100014&lang=pt" 
"S0376-723X2007000300003-ven","Aplicación de la ecuación integral de contorno axisimétrica para elasticidad y termoelasticidad","González, Yomar A, Cisilino, Adrian P, Cerrolaza, Miguel E","Boletín Técnico; 45(3); 52-73","Boletín Técnico","Espanhol","2007","http://www.scielo.org.ve/scielo.php?script=sci_arttext&pid=S0376-723X2007000300003&lang=pt" 
"S0376-723X2007000300002-ven","Investigación de respuestas sísmicas críticas incorporando la torsión accidental","Hernández, Julio J, López, Oscar A","Boletín Técnico; 45(3); 22-51","Boletín Técnico","Espanhol","2007","http://www.scielo.org.ve/scielo.php?script=sci_arttext&pid=S0376-723X2007000300002&lang=pt" 
"S0376-723X2007000300001-ven","Método de holzer - van den dugen en el análisis de pórticos","Cruz, Jorge","Boletín Técnico; 45(3); 1-21","Boletín Técnico","Espanhol","2007","http://www.scielo.org.ve/scielo.php?script=sci_arttext&pid=S0376-723X2007000300001&lang=pt" 
"S0066-782X2007001700001-scl","Peso dos ventrículos cardíacos determinado em necropsia de indivíduos saudáveis mortos por causas externas","Rodrigues, Sérgio Lamêgo, Pimentel, Enildo Broetto, Mill, José Geraldo","Arquivos Brasileiros de Cardiologia; 89(5); 279-284","Arquivos Brasileiros de Cardiologia","Inglês, Português","2007","http://www.scielo.br/scielo.php?script=sci_arttext&pid=S0066-782X2007001700001&lang=pt" 
"S0066-782X2007001700003-scl","Doença arterial coronariana em diabéticas do tipo 2 assintomáticas: estudo comparativo entre o teste ergométrico, o teste cardiopulmonar e a cintilografia de perfusão miocárdica com dipiridamol na identificação de isquemia","Smanio, Paola Emanuela Poggio, Carvalho, Antonio Carlos, Tebexreni, Antonio Sergio, Thom, Anneliese, Rodrigues, Filadelfo, Meneghelo, Romeu, Mastrocolla, Luiz, Alves, Alexandre, Piegas, Leopoldo Soares, Paola, Angelo Amato de","Arquivos Brasileiros de Cardiologia; 89(5); 290-297","Arquivos Brasileiros de Cardiologia","Inglês, Português","2007","http://www.scielo.br/scielo.php?script=sci_arttext&pid=S0066-782X2007001700003&lang=pt" 
"S0066-782X2007001700004-scl","Aplicação da ventilação não-invasiva em insuficiência respiratória aguda após cirurgia cardiovascular","Coimbra, Vera Regina de Morais, Lara, Rodrigo de Almeida, Flores, Ériko Gonçalves, Nozawa, Emília, Auler Júnior, José Octávio Costa, Feltrim, Maria Ignez Zanetti","Arquivos Brasileiros de Cardiologia; 89(5); 298-305","Arquivos Brasileiros de Cardiologia","Inglês, Português","2007","http://www.scielo.br/scielo.php?script=sci_arttext&pid=S0066-782X2007001700004&lang=pt" 
"S0066-782X2007001700005-scl","Prevalência de fatores de risco coronarianos e alterações da perfusão miocárdica à cintilografia em pacientes diabéticos assintomáticos ambulatoriais","Monteiro Júnior, Francisco das Chagas, Cunha, Fhabyula da Silva, Salgado Filho, Natalino, Barbosa, José Bonifácio, Furtado, João Ribeiro, Ferreira, Pedro Antônio Muniz, Nina, Vinícius, Lages, Joyce, Santana, Nilton","Arquivos Brasileiros de Cardiologia; 89(5); 306-311","Arquivos Brasileiros de Cardiologia","Inglês, Português","2007","http://www.scielo.br/scielo.php?script=sci_arttext&pid=S0066-782X2007001700005&lang=pt" 
"S0066-782X2007001700006-scl","Isquemia silenciosa na doença coronariana estável em vigência de tratamento medicamentoso","Ferreira, João Fernando Monteiro, César, Luiz Antonio Machado, Gruppi, César J., Giorgi, Dante M. A., Hueb, Whady A., Mansur, Antonio P., Ramires, José A. F.","Arquivos Brasileiros de Cardiologia; 89(5); 312-318","Arquivos Brasileiros de Cardiologia","Inglês, Português","2007","http://www.scielo.br/scielo.php?script=sci_arttext&pid=S0066-782X2007001700006&lang=pt" 
"S0066-782X2007001700007-scl","Prevalência de Fatores de risco cardiovascular em adultos de Luzerna, Santa Catarina, 2006","Nunes Filho, João Rogério, Debastiani, Daniela, Nunes, Alessandra Daros, Peres, Karen Glazer","Arquivos Brasileiros de Cardiologia; 89(5); 319-324","Arquivos Brasileiros de Cardiologia","Inglês, Português","2007","http://www.scielo.br/scielo.php?script=sci_arttext&pid=S0066-782X2007001700007&lang=pt" 
"S0066-782X2007001700008-scl","Eficácia da atorvastatina sem administração diária","Ghattas, Antonio Edmond, Pimenta, João","Arquivos Brasileiros de Cardiologia; 89(5); 325-332","Arquivos Brasileiros de Cardiologia","Inglês, Português","2007","http://www.scielo.br/scielo.php?script=sci_arttext&pid=S0066-782X2007001700008&lang=pt" 
"S0066-782X2007001700012-scl","Monitorização ambulatorial da pressão arterial e diabete melito tipo 2","Leitão, Cristiane Bauermann, Canani, Luís Henrique, Silveiro, Sandra Pinho, Gross, Jorge Luiz","Arquivos Brasileiros de Cardiologia; 89(5); 347-354","Arquivos Brasileiros de Cardiologia","Inglês, Português","2007","http://www.scielo.br/scielo.php?script=sci_arttext&pid=S0066-782X2007001700012&lang=pt" 
"S0066-782X2007001700014-scl","E(TI)cossistema da cardiologia diretriz, mecenas do estado da arte","Grinberg, Max","Arquivos Brasileiros de Cardiologia; 89(5); e136-e162","Arquivos Brasileiros de Cardiologia","Inglês, Português","2007","http://www.scielo.br/scielo.php?script=sci_arttext&pid=S0066-782X2007001700014&lang=pt" 
"S0100-204X2007001100005-scl","Banco de sementes no solo em sistemas de cultivo lavoura-pastagem","Ikeda, Fernanda Satie, Mitja, Danielle, Vilela, Lourival, Carmona, Ricardo","Pesquisa Agropecuária Brasileira; 42(11); 1545-1551","Pesquisa Agropecuária Brasileira","Português","2007","http://www.scielo.br/scielo.php?script=sci_arttext&pid=S0100-204X2007001100005&lang=pt" 
"S0100-879X2007001100017-scl","Does acute hyperglycemia alter rat aortic depressor nerve function?","Huber, D.A., Carmo, J.M. do, Castania, J.A., Fazan Jr, R., Salgado, H.C.","Brazilian Journal of Medical and Biological Research; 40(11); 1567-1576","Brazilian Journal of Medical and Biological Research","Inglês","2007","http://www.scielo.br/scielo.php?script=sci_arttext&pid=S0100-879X2007001100017&lang=pt" 
"S0100-879X2007001100008-scl","Effect of sildenafil (Viagra®) on the genital reflexes of paradoxical sleep-deprived male rats","Andersen, M.L., Bignotto, M., Tufik, S.","Brazilian Journal of Medical and Biological Research; 40(11); 1473-1480","Brazilian Journal of Medical and Biological Research","Inglês","2007","http://www.scielo.br/scielo.php?script=sci_arttext&pid=S0100-879X2007001100008&lang=pt" 
"S0100-879X2007001100012-scl","The time course of ethanol tolerance: associative learning","Bueno, J.L.O., Fachini, A.","Brazilian Journal of Medical and Biological Research; 40(11); 1517-1528","Brazilian Journal of Medical and Biological Research","Inglês","2007","http://www.scielo.br/scielo.php?script=sci_arttext&pid=S0100-879X2007001100012&lang=pt" 
"S0100-879X2007001100005-scl","Over-expression of cyclooxygenase-2 in endoscopic biopsies of ectopic gastric mucosa","Martins, F.P., Artigiani Neto, R., Oshima, C.T., Costa, P.P. da, Forones, N.M., Ferrari, A.P.","Brazilian Journal of Medical and Biological Research; 40(11); 1447-1454","Brazilian Journal of Medical and Biological Research","Inglês","2007","http://www.scielo.br/scielo.php?script=sci_arttext&pid=S0100-879X2007001100005&lang=pt" 
"S0100-879X2007001100006-scl","Immunohistochemical characterization of the chick marginal retina","Lima, I.P., Saito, K., Hamassaki, D.E., Yan, C.Y.I.","Brazilian Journal of Medical and Biological Research; 40(11); 1455-1464","Brazilian Journal of Medical and Biological Research","Inglês","2007","http://www.scielo.br/scielo.php?script=sci_arttext&pid=S0100-879X2007001100006&lang=pt" 
"S0100-879X2007001100011-scl","Sleep habits and complaints of adults in the city of São Paulo, Brazil, in 1987 and 1995","Pires, M.L.N., Benedito-Silva, A.A., Mello, M.T., Del Giglio, S., Pompeia, C., Tufik, S.","Brazilian Journal of Medical and Biological Research; 40(11); 1505-1515","Brazilian Journal of Medical and Biological Research","Inglês","2007","http://www.scielo.br/scielo.php?script=sci_arttext&pid=S0100-879X2007001100011&lang=pt" 
"S0100-879X2007001100014-scl","Cytotoxic effect of essential oil of thyme (Thymus broussonettii) on the IGR-OV1 tumor cells resistant to chemotherapy","Ait M&#039;Barek, L., Ait Mouse, H., Jaâfari, A., Aboufatima, R., Benharref, A., Kamal, M, Bénard, J., El Abbadi, N., Bensalah, M., Gamouh, A., Chait, A., Dalal, A., Zyad, A.","Brazilian Journal of Medical and Biological Research; 40(11); 1537-1544","Brazilian Journal of Medical and Biological Research","Inglês","2007","http://www.scielo.br/scielo.php?script=sci_arttext&pid=S0100-879X2007001100014&lang=pt" 
"S0100-879X2007001100002-scl","Apolipoprotein E polymorphism distribution in an elderly Brazilian population: the Bambuí Health and Aging Study","Fuzikawa, A.K., Peixoto, S.V., Taufer, M., Moriguchi, E.H., Lima-Costa, M.F.","Brazilian Journal of Medical and Biological Research; 40(11); 1429-1434","Brazilian Journal of Medical and Biological Research","Inglês","2007","http://www.scielo.br/scielo.php?script=sci_arttext&pid=S0100-879X2007001100002&lang=pt" 
"S0100-879X2007001100004-scl","Correlation between lactose absorption and the C/T-13910 and G/A-22018 mutations of the lactase-phlorizin hydrolase (LCT) gene in adult-type hypolactasia","Bulhões, A.C., Goldani, H.A.S., Oliveira, F.S., Matte, U.S., Mazzuca, R.B., Silveira, T.R.","Brazilian Journal of Medical and Biological Research; 40(11); 1441-1446","Brazilian Journal of Medical and Biological Research","Inglês","2007","http://www.scielo.br/scielo.php?script=sci_arttext&pid=S0100-879X2007001100004&lang=pt" 
"S0100-879X2007001100016-scl","Rats with high left ventricular end-diastolic pressure can be identified by Doppler echocardiography one week after myocardial infarction","Saraiva, R.M., Kanashiro-Takeuchi, R.M., Antonio, E.L., Campos, O., Tucci, P.J.F., Moisés, V.A.","Brazilian Journal of Medical and Biological Research; 40(11); 1557-1565","Brazilian Journal of Medical and Biological Research","Inglês","2007","http://www.scielo.br/scielo.php?script=sci_arttext&pid=S0100-879X2007001100016&lang=pt" 
"S0042-96862007001100019-spa","Malaria, mosquitoes and the legacy of Ronald Ross","Sinden, Robert E","Bulletin of the World Health Organization; 85(11); 894-896","Bulletin of the World Health Organization","Inglês","2007","http://www.scielosp.org/scielo.php?script=sci_arttext&pid=S0042-96862007001100019&lang=pt" 
"S0042-96862007001100007-spa","Climate change and human health","","Bulletin of the World Health Organization; 85(11); 830-832","Bulletin of the World Health Organization","Inglês","2007","http://www.scielosp.org/scielo.php?script=sci_arttext&pid=S0042-96862007001100007&lang=pt" 
"S0042-96862007001100002-spa","Inter-agency agreement on mental health and psychosocial support in emergency settings","van Ommeren, Mark, Wessells, Mike","Bulletin of the World Health Organization; 85(11); 822-822","Bulletin of the World Health Organization","Inglês","2007","http://www.scielosp.org/scielo.php?script=sci_arttext&pid=S0042-96862007001100002&lang=pt" 
"S0042-96862007001100011-spa","A national survey of the impact of rapid scale-up of antiretroviral therapy on health-care workers in Malawi: effects on human resources and survival","Makombe, Simon D, Jahn, Andreas, Tweya, Hannock, Chuka, Stuart, Yu, Joseph Kwong-Leung, Hochgesang, Mindy, Aberle-Grasse, John, Pasulani, Olesi, Schouten, Erik J, Kamoto, Kelita, Harries, Anthony D","Bulletin of the World Health Organization; 85(11); 851-857","Bulletin of the World Health Organization","Inglês","2007","http://www.scielosp.org/scielo.php?script=sci_arttext&pid=S0042-96862007001100011&lang=pt" 
"S0042-96862007001100016-spa","Rose revisited: a &quot;middle road&quot; prevention strategy to reduce noncommunicable chronic disease risk","Brown, Wendy J, Hockey, Richard, Dobson, Annette","Bulletin of the World Health Organization; 85(11); 886-887","Bulletin of the World Health Organization","Inglês","2007","http://www.scielosp.org/scielo.php?script=sci_arttext&pid=S0042-96862007001100016&lang=pt" 
"S0042-96862007001100017-spa","Pathways to homelessness among older people in Rio de Janeiro, Brazil","Lovisi, Giovanni Marcos, Ferri, Cleusa Pinheiro, Amado, Karla Christina Ornelas, Prince, Martin","Bulletin of the World Health Organization; 85(11); 888-889","Bulletin of the World Health Organization","Inglês","2007","http://www.scielosp.org/scielo.php?script=sci_arttext&pid=S0042-96862007001100017&lang=pt" 
"S0042-96862007001100008-spa","Recent news from WHO","","Bulletin of the World Health Organization; 85(11); 832-832","Bulletin of the World Health Organization","Inglês","2007","http://www.scielosp.org/scielo.php?script=sci_arttext&pid=S0042-96862007001100008&lang=pt" 
"S0042-96862007001100006-spa","India’s last bastion of polio at &quot;tipping point&quot;","Orr, David","Bulletin of the World Health Organization; 85(11); 828-829","Bulletin of the World Health Organization","Inglês","2007","http://www.scielosp.org/scielo.php?script=sci_arttext&pid=S0042-96862007001100006&lang=pt" 
"S0042-96862007001100024-spa","Response to public-private partnerships and the Private Finance Initiative","McKee, Martin, Edwards, Nigel, Atun, Rifat","Bulletin of the World Health Organization; 85(11); -","Bulletin of the World Health Organization","Inglês","2007","http://www.scielosp.org/scielo.php?script=sci_arttext&pid=S0042-96862007001100024&lang=pt" 
"S0042-96862007001100025-spa","Contraception counselling and compliance","Luthra, Rita","Bulletin of the World Health Organization; 85(11); -","Bulletin of the World Health Organization","Inglês","2007","http://www.scielosp.org/scielo.php?script=sci_arttext&pid=S0042-96862007001100025&lang=pt" 
"S0042-96862007001100023-spa","Public-private partnerships and the Private Finance Initiative","Pollock, Allyson","Bulletin of the World Health Organization; 85(11); -","Bulletin of the World Health Organization","Inglês","2007","http://www.scielosp.org/scielo.php?script=sci_arttext&pid=S0042-96862007001100023&lang=pt" 
"S0042-96862007001100022-spa","The bottom billion: why are the poorest countries failing and what can be done about it","Durairaj, Varatharajan","Bulletin of the World Health Organization; 85(11); 898-899","Bulletin of the World Health Organization","Inglês","2007","http://www.scielosp.org/scielo.php?script=sci_arttext&pid=S0042-96862007001100022&lang=pt" 
"S0042-96862007001100021-spa","The HIV pandemic: local and global implications","Jaffar, Shabbar","Bulletin of the World Health Organization; 85(11); 897-898","Bulletin of the World Health Organization","Inglês","2007","http://www.scielosp.org/scielo.php?script=sci_arttext&pid=S0042-96862007001100021&lang=pt" 
"S0042-96862007001100020-spa","Globalization and health","Bach, Stephen","Bulletin of the World Health Organization; 85(11); 897-897","Bulletin of the World Health Organization","Inglês","2007","http://www.scielosp.org/scielo.php?script=sci_arttext&pid=S0042-96862007001100020&lang=pt" 
"S0042-96862007001100004-spa","Reducing the impact of climate change","Brown, Hannah","Bulletin of the World Health Organization; 85(11); 824-825","Bulletin of the World Health Organization","Inglês","2007","http://www.scielosp.org/scielo.php?script=sci_arttext&pid=S0042-96862007001100004&lang=pt" 
"S0042-96862007001100005-spa","Will increased awareness of the health impacts of climate change help in achieving international collective action?","","Bulletin of the World Health Organization; 85(11); 826-828","Bulletin of the World Health Organization","Inglês","2007","http://www.scielosp.org/scielo.php?script=sci_arttext&pid=S0042-96862007001100005&lang=pt" 
"S0042-96862007001100001-spa","In this month&#039;s Bulletin","","Bulletin of the World Health Organization; 85(11); 821-821","Bulletin of the World Health Organization","Inglês","2007","http://www.scielosp.org/scielo.php?script=sci_arttext&pid=S0042-96862007001100001&lang=pt" 
"S0042-96862007001100003-spa","Bombarding people with questions: a reconsideration of survey ethics","Aiga, Hirotsugu","Bulletin of the World Health Organization; 85(11); 823-823","Bulletin of the World Health Organization","Inglês","2007","http://www.scielosp.org/scielo.php?script=sci_arttext&pid=S0042-96862007001100003&lang=pt" 
"S0042-96862007001100009-spa","Economic evaluation of hepatitis B vaccination in low-income countries: using cost-effectiveness affordability curves","Kim, Sun-Young, Salomon, Joshua A, Goldie, Sue J","Bulletin of the World Health Organization; 85(11); 833-842","Bulletin of the World Health Organization","Inglês","2007","http://www.scielosp.org/scielo.php?script=sci_arttext&pid=S0042-96862007001100009&lang=pt" 
"S0042-96862007001100010-spa","Routine offer of antenatal HIV testing (&quot;opt-out&quot; approach) to prevent mother-to-child transmission of HIV in urban Zimbabwe","Chandisarewa, Winfreda, Stranix-Chibanda, Lynda, Chirapa, Elizabeth, Miller, Anna, Simoyi, Micah, Mahomva, Agnes, Maldonado, Yvonne, Shetty, Avinash K","Bulletin of the World Health Organization; 85(11); 843-850","Bulletin of the World Health Organization","Inglês","2007","http://www.scielosp.org/scielo.php?script=sci_arttext&pid=S0042-96862007001100010&lang=pt" 
"S0042-96862007001100012-spa","Mental health reform in the Russian Federation: an integrated approach to achieve social inclusion and recovery","Jenkins, Rachel, Lancashire, Stuart, McDaid, David, Samyshkin, Yevgeniy, Green, Samantha, Watkins, Jonathan, Potasheva, Angelina, Nikiforov, Alexey, Bobylova, Zinaida, Gafurov, Valery, Goldberg, David, Huxley, Peter, Lucas, Jo, Purchase, Nick, Atun, Rifat","Bulletin of the World Health Organization; 85(11); 858-866","Bulletin of the World Health Organization","Inglês","2007","http://www.scielosp.org/scielo.php?script=sci_arttext&pid=S0042-96862007001100012&lang=pt" 
"S0042-96862007001100013-spa","The Strengthening the Reporting of Observational Studies in Epidemiology (STROBE) statement: guidelines for reporting observational studies","von Elm, Erik, Altman, Douglas G, Egger, Matthias, Pocock, Stuart J, Gøtzsche, Peter C, Vandenbroucke, Jan P","Bulletin of the World Health Organization; 85(11); 867-872","Bulletin of the World Health Organization","Inglês","2007","http://www.scielosp.org/scielo.php?script=sci_arttext&pid=S0042-96862007001100013&lang=pt" 
"S0042-96862007001100018-spa","Shaping the world to illustrate inequalities in health","Dorling, Danny, Barford, Anna","Bulletin of the World Health Organization; 85(11); 890-893","Bulletin of the World Health Organization","Inglês","2007","http://www.scielosp.org/scielo.php?script=sci_arttext&pid=S0042-96862007001100018&lang=pt" 
"S0042-96862007001100015-spa","Offering integrated care for HIV/AIDS, diabetes and hypertension within chronic disease clinics in Cambodia","Janssens, B, Van Damme, W, Raleigh, B, Gupta, J, Khem, S, Soy Ty, K, Vun, MC, Ford, N, Zachariah, R","Bulletin of the World Health Organization; 85(11); 880-885","Bulletin of the World Health Organization","Inglês","2007","http://www.scielosp.org/scielo.php?script=sci_arttext&pid=S0042-96862007001100015&lang=pt" 
"S1413-81232007000700001-scl","Saúde é desenvolvimento: esse é o desafio da 13ª Conferência Nacional de Saúde","Minayo, Maria Cecília de Souza","Ciência &amp; Saúde Coletiva; 12(); 1762-1762","Ciência &amp; Saúde Coletiva","Inglês, Português","2007","http://www.scielo.br/scielo.php?script=sci_arttext&pid=S1413-81232007000700001&lang=pt" 
"S1413-81232007000700001-spa","Saúde é desenvolvimento: esse é o desafio da 13ª Conferência Nacional de Saúde","Minayo, Maria Cecília de Souza","Ciência &amp; Saúde Coletiva; 12(); 1762-1762","Ciência &amp; Saúde Coletiva","Inglês, Português","2007","http://www.scielosp.org/scielo.php?script=sci_arttext&pid=S1413-81232007000700001&lang=pt" 
"S1413-81232007000700009-spa","O SUS entre a tradição dos Sistemas Nacionais e o modo liberal-privado para organizar o cuidado à saúde","Campos, Gastão Wagner de Sousa","Ciência &amp; Saúde Coletiva; 12(); 1865-1874","Ciência &amp; Saúde Coletiva","Português","2007","http://www.scielosp.org/scielo.php?script=sci_arttext&pid=S1413-81232007000700009&lang=pt" 
"S1413-81232007000700002-scl","Saúde e desenvolvimento","Viana, Ana Luiza D&#039;Ávila, Elias, Paulo Eduardo M.","Ciência &amp; Saúde Coletiva; 12(); 1765-1777","Ciência &amp; Saúde Coletiva","Português","2007","http://www.scielo.br/scielo.php?script=sci_arttext&pid=S1413-81232007000700002&lang=pt" 
"S1413-81232007000700003-scl","Padrões de adoecimento e de morte da população brasileira: os renovados desafios para o Sistema Único de Saúde","Barreto, Mauricio Lima, Carmo, Eduardo Hage","Ciência &amp; Saúde Coletiva; 12(); 1179-1790","Ciência &amp; Saúde Coletiva","Português","2007","http://www.scielo.br/scielo.php?script=sci_arttext&pid=S1413-81232007000700003&lang=pt" 
"S1413-81232007000700004-scl","A saúde na agenda pública: convergências e lacunas nas pautas de debate e programas de trabalho das instituições governamentais e movimentos sociais","Bahia, Ligia, Costa, Nilson Rosario, Stralen, Cornelis van","Ciência &amp; Saúde Coletiva; 12(); 1791-1818","Ciência &amp; Saúde Coletiva","Português","2007","http://www.scielo.br/scielo.php?script=sci_arttext&pid=S1413-81232007000700004&lang=pt" 
"S1413-81232007000700005-scl","Configuração institucional e gestão do Sistema Único de Saúde: problemas e desafios","Paim, Jairnilson Silva, Teixeira, Carmen Fontes","Ciência &amp; Saúde Coletiva; 12(); 1819-1829","Ciência &amp; Saúde Coletiva","Português","2007","http://www.scielo.br/scielo.php?script=sci_arttext&pid=S1413-81232007000700005&lang=pt" 
"S1413-81232007000700006-scl","Modelos de gestão e o SUS","Ibañez, Nelson, Vecina Neto, Gonzalo","Ciência &amp; Saúde Coletiva; 12(); 1831-1840","Ciência &amp; Saúde Coletiva","Português","2007","http://www.scielo.br/scielo.php?script=sci_arttext&pid=S1413-81232007000700006&lang=pt" 
"S1413-81232007000700008-scl","Os vários mundos do financiamento da Saúde no Brasil: uma tentativa de integração","Dain, Sulamis","Ciência &amp; Saúde Coletiva; 12(); 1851-1864","Ciência &amp; Saúde Coletiva","Português","2007","http://www.scielo.br/scielo.php?script=sci_arttext&pid=S1413-81232007000700008&lang=pt" 
"S1413-81232007000700009-scl","O SUS entre a tradição dos Sistemas Nacionais e o modo liberal-privado para organizar o cuidado à saúde","Campos, Gastão Wagner de Sousa","Ciência &amp; Saúde Coletiva; 12(); 1865-1874","Ciência &amp; Saúde Coletiva","Português","2007","http://www.scielo.br/scielo.php?script=sci_arttext&pid=S1413-81232007000700009&lang=pt" 
"S0100-879X2007001100018-scl","","Rodrigues, A.C., Rebecchi, I.M.M., Bertolami, M.C., Faludi, A.A., Hirata, M.H., Hirata, R.D.C.","Brazilian Journal of Medical and Biological Research; 40(11); 1578-1578","Brazilian Journal of Medical and Biological Research","Inglês","2007","http://www.scielo.br/scielo.php?script=sci_arttext&pid=S0100-879X2007001100018&lang=pt" 
"S0100-879X2007001100015-scl","Primary mechanism of apoptosis induction in a leukemia cell line by fraction FA-2-b-ß prepared from the mushroom Agaricus blazei Murill","Gao, L., Sun, Y., Chen, C., Xi, Y., Wang, J., Wang, Z.","Brazilian Journal of Medical and Biological Research; 40(11); 1545-1555","Brazilian Journal of Medical and Biological Research","Inglês","2007","http://www.scielo.br/scielo.php?script=sci_arttext&pid=S0100-879X2007001100015&lang=pt" 
"S0100-879X2007001100013-scl","Hirsch&#039;s index: a case study conducted at the Faculdade de Filosofia, Ciências e Letras de Ribeirão Preto, Universidade de São Paulo","Torro-Alves, N., Herculano, R.D., Terçariol, C.A.S., Kinouchi Filho, O., Graeff, C.F.O.","Brazilian Journal of Medical and Biological Research; 40(11); 1529-1536","Brazilian Journal of Medical and Biological Research","Inglês","2007","http://www.scielo.br/scielo.php?script=sci_arttext&pid=S0100-879X2007001100013&lang=pt" 
"S0100-879X2007001100007-scl","TP53 codon 72 polymorphism as a risk factor for cardiovascular disease in a Brazilian population","Smith, M.A.C., Silva, M.D.A., Cendoroglo, M.S., Ramos, L.R., Araujo, L.M.Q., Labio, R.W., Burbano, R.R., Chen, E.S., Payão, S.L.M.","Brazilian Journal of Medical and Biological Research; 40(11); 1465-1472","Brazilian Journal of Medical and Biological Research","Inglês","2007","http://www.scielo.br/scielo.php?script=sci_arttext&pid=S0100-879X2007001100007&lang=pt" 
"S0100-879X2007001100010-scl","Th1 polarized response induced by intramuscular DNA-HSP65 immunization is preserved in experimental atherosclerosis","Fonseca, D.M., Bonato, V.L.D., Silva, C.L., Sartori, A.","Brazilian Journal of Medical and Biological Research; 40(11); 1495-1504","Brazilian Journal of Medical and Biological Research","Inglês","2007","http://www.scielo.br/scielo.php?script=sci_arttext&pid=S0100-879X2007001100010&lang=pt" 
"S0100-879X2007001100001-scl","Glutamate receptors as seen by light: spectroscopic studies of structure-function relationships","Mankiewicz, K.A., Jayaraman, V.","Brazilian Journal of Medical and Biological Research; 40(11); 1419-1427","Brazilian Journal of Medical and Biological Research","Inglês","2007","http://www.scielo.br/scielo.php?script=sci_arttext&pid=S0100-879X2007001100001&lang=pt" 
