"S0034-72992007000500005-scl","A prevalência de perdas auditivas em crianças e adolescentes com câncer","Silva, Aline Medeiros da, Latorre, Maria do Rosário Dias de Oliveira, Cristofani, Lilian Maria, Odone Filho, Vicente","Revista Brasileira de Otorrinolaringologia; 73(5); 608-614","Revista Brasileira de Otorrinolaringologia","Inglês, Português","2007","http://www.scielo.br/scielo.php?script=sci_arttext&pid=S0034-72992007000500005&lang=pt" 
"S0034-72992007000500006-scl","Avaliação da obstrução da via aérea superior através da videonasofaringoscopia: comparação da manobra de Müller com o sono induzido","Gregório, Marcelo Gervilla, Jacomelli, Márcia, Figueiredo, Adelaide C., Cahali, Michel Burihan, Pedreira Junior, Wilson Leite, Lorenzi Filho, Geraldo","Revista Brasileira de Otorrinolaringologia; 73(5); 618-622","Revista Brasileira de Otorrinolaringologia","Inglês, Português","2007","http://www.scielo.br/scielo.php?script=sci_arttext&pid=S0034-72992007000500006&lang=pt" 
"S0034-72992007000500007-scl","Estudo comparativo entre diversas técnicas de confecção de modelo experimental de sinusite inflamatória em coelhos","Costa, Henrique Olival, Luchi, Giulliano Enrico Ruschi e, Augusto, Arthur Guilerme, Castro, Marilia, Souza, Flavia Coelho de","Revista Brasileira de Otorrinolaringologia; 73(5); 627-631","Revista Brasileira de Otorrinolaringologia","Inglês, Português","2007","http://www.scielo.br/scielo.php?script=sci_arttext&pid=S0034-72992007000500007&lang=pt" 
"S0034-72992007000500008-scl","Achados timpanométricos em neonatos com emissões otoacústicas presentes: medidas e interpretações","Silva, Kilza de Arruda Lyra e, Novaes, Beatriz de Albuquerque C. C., Lewis, Dóris Ruthi, Carvallo, Renata Mota Mamede","Revista Brasileira de Otorrinolaringologia; 73(5); 633-639","Revista Brasileira de Otorrinolaringologia","Inglês, Português","2007","http://www.scielo.br/scielo.php?script=sci_arttext&pid=S0034-72992007000500008&lang=pt" 
"S0034-72992007000500009-scl","Esvaziamento radical versus seletivo (supraomohióideo) no tratamento do carcinoma epidermóide do andar inferior da boca","Rapoport, Abrão, Ortellado, Daniel Kanabben, Amar, Ali, Lehn, Carlos Neutzling, Dedivitis, Rogério Aparecido, Perez, Ricardo Salinas, Rodrigues, Helen Mara","Revista Brasileira de Otorrinolaringologia; 73(5); 641-646","Revista Brasileira de Otorrinolaringologia","Inglês, Português","2007","http://www.scielo.br/scielo.php?script=sci_arttext&pid=S0034-72992007000500009&lang=pt" 
"S0034-72992007000500010-scl","Cirurgia do estapédio na residência: experiência do Hospital de Clínicas/UFPR","Caldart, Adriano Ulisses, Terruel, Igor, Enge Júnior, Dair Jocely, Kurogi, Adriana Sayuri, Buschle, Maurício, Mocellin, Marcos","Revista Brasileira de Otorrinolaringologia; 73(5); 647-653","Revista Brasileira de Otorrinolaringologia","Inglês, Português","2007","http://www.scielo.br/scielo.php?script=sci_arttext&pid=S0034-72992007000500010&lang=pt" 
"S0034-72992007000500011-scl","prevalência da perda auditiva em uma população de idosos da cidade do Rio de Janeiro: um estudo seccional","Mattos, Leila Couto, Veras, Renato Peixoto","Revista Brasileira de Otorrinolaringologia; 73(5); 654-659","Revista Brasileira de Otorrinolaringologia","Inglês, Português","2007","http://www.scielo.br/scielo.php?script=sci_arttext&pid=S0034-72992007000500011&lang=pt" 
"S0034-72992007000500012-scl","Processo de adaptação de próteses auditivas em usuários atendidos em uma instituição pública federal: parte II: resultados dos questionários de auto-avaliação","Freitas, Carine Dias de, Costa, Maristela Julio","Revista Brasileira de Otorrinolaringologia; 73(5); 660-670","Revista Brasileira de Otorrinolaringologia","Inglês, Português","2007","http://www.scielo.br/scielo.php?script=sci_arttext&pid=S0034-72992007000500012&lang=pt" 
"S0034-72992007000500013-scl","Perda auditiva sensório-neural na otite média crônica supurativa em pacientes com e sem colesteatoma","Azevedo, Alexandre Fernandes de, Pinto, Daniele Cristine Gomes, Souza, Nicodemos José Alves de, Greco, Dirceu Bartolomeu, Gonçalves, Denise Utsch","Revista Brasileira de Otorrinolaringologia; 73(5); 671-674","Revista Brasileira de Otorrinolaringologia","Inglês, Português","2007","http://www.scielo.br/scielo.php?script=sci_arttext&pid=S0034-72992007000500013&lang=pt" 
"S0034-72992007000500014-scl","Implicações do efeito Lombard sobre a intensidade, freqüência fundamental e estabilidade da voz de indivíduos com doença de Parkinson","Quedas, Araken, Duprat, André de Campos, Gasparini, Gisele","Revista Brasileira de Otorrinolaringologia; 73(5); 675-683","Revista Brasileira de Otorrinolaringologia","Inglês, Português","2007","http://www.scielo.br/scielo.php?script=sci_arttext&pid=S0034-72992007000500014&lang=pt" 
"S0034-72992007000500016-scl","Polipectomia endoscópica com meatotomia média como tratamento de pólipo antrocoanal","Franche, Guilherme Luis da Silva, Granzotto, Eduardo Homrich, Borba, Andresa Thier de, Hermes, Fernando, Saleh, Cátia de Souza, Souza, Person Antunes de","Revista Brasileira de Otorrinolaringologia; 73(5); 689-692","Revista Brasileira de Otorrinolaringologia","Inglês, Português","2007","http://www.scielo.br/scielo.php?script=sci_arttext&pid=S0034-72992007000500016&lang=pt" 
"S0034-72992007000500017-scl","Breve história da otorrinolaringologia: otologia, laringologia e rinologia","Nogueira Júnior, João Flávio, Hermann, Diego Rodrigo, Américo, Ronaldo dos Reis, Barauna Filho, Iulo Sérgio, Stamm, Aldo Eden Cassol, Pignatari, Shirley Shizuo Nagata","Revista Brasileira de Otorrinolaringologia; 73(5); 693-703","Revista Brasileira de Otorrinolaringologia","Inglês, Português","2007","http://www.scielo.br/scielo.php?script=sci_arttext&pid=S0034-72992007000500017&lang=pt" 
"S0034-72992007000500018-scl","Métodos de estudo do transporte mucociliar","Trindade, Sergio Henrique Kiemle, Mello Júnior, João Ferreira de, Mion, Olavo de Godoy, Lorenzi-Filho, Geraldo, Macchione, Mariângela, Guimarães, Eliane Tigre, Saldiva, Paulo Hilário Nascimento","Revista Brasileira de Otorrinolaringologia; 73(5); 704-712","Revista Brasileira de Otorrinolaringologia","Inglês, Português","2007","http://www.scielo.br/scielo.php?script=sci_arttext&pid=S0034-72992007000500018&lang=pt" 
"S0482-50042007000500008-scl","Baixa dose de methotrexate comparado a placebo em osteoartrite de joelho","Holanda, Haroldo Tenório de, Pollak, Daniel Feldman, Pucinelli, Mário Luis Cardoso","Revista Brasileira de Reumatologia; 47(5); 334-340","Revista Brasileira de Reumatologia","Português","2007","http://www.scielo.br/scielo.php?script=sci_arttext&pid=S0482-50042007000500008&lang=pt" 
"S1020-49892007000900003-spa","The increase of diabetes mortality burden among Brazilian adults","Barreto, Sandhi Maria, Passos, Valeria Maria Azeredo, Almeida, Suzanne Kelly Ferreira, Assis, Tiago Duarte","Revista Panamericana de Salud Pública; 22(4); 239-245","Revista Panamericana de Salud Pública","Inglês","2007","http://www.scielosp.org/scielo.php?script=sci_arttext&pid=S1020-49892007000900003&lang=pt" 
"S1020-49892007000900004-spa","Fatores socioculturais e nível de atividade física no início da adolescência","Gonçalves, Helen, Hallal, Pedro C., Amorim, Tales C., Araújo, Cora L. P., Menezes, Ana M. B.","Revista Panamericana de Salud Pública; 22(4); 246-253","Revista Panamericana de Salud Pública","Português","2007","http://www.scielosp.org/scielo.php?script=sci_arttext&pid=S1020-49892007000900004&lang=pt" 
"S1020-49892007000900006-spa","Estado nutricional en la marginación y la pobreza de adultos triquis del estado de Oaxaca, México","Ramos Rodríguez, Rosa María, Sandoval Mendoza, Karla","Revista Panamericana de Salud Pública; 22(4); 260-267","Revista Panamericana de Salud Pública","Espanhol","2007","http://www.scielosp.org/scielo.php?script=sci_arttext&pid=S1020-49892007000900006&lang=pt" 
"S1020-49892007000900007-spa","Evaluating the costs of pneumococcal disease in selected Latin American countries","Constenla, Dagna","Revista Panamericana de Salud Pública; 22(4); 268-278","Revista Panamericana de Salud Pública","Inglês","2007","http://www.scielosp.org/scielo.php?script=sci_arttext&pid=S1020-49892007000900007&lang=pt" 
"S0482-50042007000500009-scl","Cytokine inhibitors and pain control","Verri Jr., Waldiceu A., Cunha, Thiago M., Poole, Stephen, Ferreira, Sérgio H., Cunha, Fernando Q.","Revista Brasileira de Reumatologia; 47(5); 341-353","Revista Brasileira de Reumatologia","Inglês","2007","http://www.scielo.br/scielo.php?script=sci_arttext&pid=S0482-50042007000500009&lang=pt" 
"S1413-70542007000500009-scl","Fontes de resistência à murcha-de-curtobacterium em cultivares locais de feijoeiro, coletadas em Santa Catarina","Theodoro, Gustavo de Faria, Herbes, Daniel Henrique, Maringoni, Antonio Carlos","Ciência e Agrotecnologia; 31(5); 1333-1339","Ciência e Agrotecnologia","Português","2007","http://www.scielo.br/scielo.php?script=sci_arttext&pid=S1413-70542007000500009&lang=pt" 
"S1413-70542007000500008-scl","Doses de nitrogênio e potássio na produção de grama esmeralda","Godoy, Leandro José Grava de, Villas Bôas, Roberto Lyra, Backes, Clarice, Lima, Claudinei Paulo de","Ciência e Agrotecnologia; 31(5); 1326-1332","Ciência e Agrotecnologia","Português","2007","http://www.scielo.br/scielo.php?script=sci_arttext&pid=S1413-70542007000500008&lang=pt" 
"S1413-70542007000500007-scl","Diagnose foliar da gravioleira (Annona muricata L.): efeito da posição de ramos e folhas","Lima, Rosiane de Lourdes Silva de, Ferreira, Gilvan Barbosa, Weber, Olmar Baller, Cazetta, Jairo Osvaldo","Ciência e Agrotecnologia; 31(5); 1320-1325","Ciência e Agrotecnologia","Português","2007","http://www.scielo.br/scielo.php?script=sci_arttext&pid=S1413-70542007000500007&lang=pt" 
"S1413-70542007000500002-scl","Avaliação da produção de Pleurotus sajor-caju (Fr.) singer utilizando resíduo do beneficiamento têxtil do algodão como substrato","Castro, Ana Luisa Aguiar de, Paiva, Paulo César de Aguiar, Banys, Vera Lúcia, Dias, Eustáquio Souza, Santos, Juliana dos","Ciência e Agrotecnologia; 31(5); 1286-1290","Ciência e Agrotecnologia","Português","2007","http://www.scielo.br/scielo.php?script=sci_arttext&pid=S1413-70542007000500002&lang=pt" 
"S1413-70542007000500003-scl","Avaliação do potencial hídrico foliar, umidade do solo e temperatura do ar no período pré- florescimento dos citros","Cruz, Maria do Céu Monteiro da, Rocha, Railene Hérica Carlos, Siqueira, Dalmo Lopes de, Salomão, Luiz Carlos Chamhum","Ciência e Agrotecnologia; 31(5); 1291-1296","Ciência e Agrotecnologia","Português","2007","http://www.scielo.br/scielo.php?script=sci_arttext&pid=S1413-70542007000500003&lang=pt" 
"S1413-70542007000500004-scl","Comparação de distribuições de probabilidade e estimativa da precipitação provável para região de Barbacena, MG","Ribeiro, Bruno Teixeira, Avanzi, Junior Cesar, Mello, Carlos Rogério de, Lima, José Maria de, Silva, Marx Leandro Naves","Ciência e Agrotecnologia; 31(5); 1297-1302","Ciência e Agrotecnologia","Português","2007","http://www.scielo.br/scielo.php?script=sci_arttext&pid=S1413-70542007000500004&lang=pt" 
"S1413-70542007000500006-scl","Desenvolvimento de um sistema de rastreabilidade aplicado à cadeia de produção do vinho","Porto, Luís Fernando de Abreu, Lopes, Marcos Aurélio, Zambalde, André Luiz","Ciência e Agrotecnologia; 31(5); 1310-1319","Ciência e Agrotecnologia","Português","2007","http://www.scielo.br/scielo.php?script=sci_arttext&pid=S1413-70542007000500006&lang=pt" 
"S1413-70542007000500010-scl","Germinação e vigor de plantas de maracujazeiro &#039;amarelo&#039; em diferentes estádios de maturação do fruto, arilo e substrato","Lopes, José Carlos, Bono, Gustavo Marchezi, Alexandre, Rodrigo Sobreira, Maia, Victor Martins","Ciência e Agrotecnologia; 31(5); 1340-1346","Ciência e Agrotecnologia","Português","2007","http://www.scielo.br/scielo.php?script=sci_arttext&pid=S1413-70542007000500010&lang=pt" 
"S1413-70542007000500012-scl","Identificação de QTLs em feijoeiro por meio de marcadores SSR influenciados pela seleção natural","Rodrigues, Taislene Butarello, Santos, João Bosco dos, Ramalho, Magno Antonio Patto, Amorim, Edson Perito, Silva, Nara Oliveira","Ciência e Agrotecnologia; 31(5); 1351-1357","Ciência e Agrotecnologia","Português","2007","http://www.scielo.br/scielo.php?script=sci_arttext&pid=S1413-70542007000500012&lang=pt" 
"S1413-70542007000500018-scl","Seletividade de Lecanicillium lecanii (Zimm.) Zare &amp; W. Gams (classe-forma: Hyphomycetes) ao parasitóide Trichogramma atopovirilia Oatman &amp; Platner, 1983 (Hymenoptera: Trichogrammatidae)","Dalvi, Leandro Pin, Polanczyk, Ricardo Antônio, Pratissoli, Dirceu, Melo, Ricardo Lopes de, Holtz, Anderson Mathias","Ciência e Agrotecnologia; 31(5); 1392-1395","Ciência e Agrotecnologia","Português","2007","http://www.scielo.br/scielo.php?script=sci_arttext&pid=S1413-70542007000500018&lang=pt" 
"S1413-70542007000500015-scl","Metodologia de inoculação de fungos causadores da podridão peduncular em mamão","Nery-Silva, Flávia Andrea, Machado, José da Cruz, Resende, Mário Lúcio Vilela de, Lima, Luiz Carlos de Oliveira","Ciência e Agrotecnologia; 31(5); 1374-1379","Ciência e Agrotecnologia","Português","2007","http://www.scielo.br/scielo.php?script=sci_arttext&pid=S1413-70542007000500015&lang=pt" 
"S1413-70542007000500017-scl","Produção de carvão a partir de resíduo de erva-mate para a remoção de contaminantes orgânicos de meio aquoso","Gonçalves, Maraísa, Guerreiro, Mário César, Bianchi, Maria Lúcia, Oliveira, Luiz Carlos Alves, Pereira, Elaine Inácio, Dallago, Rogério Marcos","Ciência e Agrotecnologia; 31(5); 1386-1391","Ciência e Agrotecnologia","Português","2007","http://www.scielo.br/scielo.php?script=sci_arttext&pid=S1413-70542007000500017&lang=pt" 
"S1413-70542007000500029-scl","Análise espaço-temporal da evapotranspiração de referência para Minas Gerais","Lemos Filho, Luis César de Aquino, Carvalho, Luiz Gonsaga de, Evangelista, Adão Wagner Pêgo, Carvalho, Luis Marcelo Tavares de, Dantas, Antônio Augusto Aguilar","Ciência e Agrotecnologia; 31(5); 1462-1469","Ciência e Agrotecnologia","Português","2007","http://www.scielo.br/scielo.php?script=sci_arttext&pid=S1413-70542007000500029&lang=pt" 
"S1413-70542007000500025-scl","Caracterização química e bioquímica de goiabas armazenadas sob refrigeração e atmosfera modificada","Vila, Mariana Texeira Rodrigues, Lima, Luiz Carlos de Oliveira, Vilas Boas, Eduardo Valério de Barros, Doll Hojo, Ellen Toews, Rodrigues, Luiz José, Paula, Nélio Ranieli Ferreira de","Ciência e Agrotecnologia; 31(5); 1435-1442","Ciência e Agrotecnologia","Português","2007","http://www.scielo.br/scielo.php?script=sci_arttext&pid=S1413-70542007000500025&lang=pt" 
"S1413-70542007000500026-scl","Granules morphology and rheological behavior of green banana (Musa cavendishii) and corn (Zea mays) starch gels","Izidoro, Dayane Rosalyn, Demczuk Junior, Bogdan, Haminiuk, Charles Windson Isidoro, Sierakowski, Maria Rita, Freitas, Renato João Sossela de, Scheer, Agnes de Paula","Ciência e Agrotecnologia; 31(5); 1443-1448","Ciência e Agrotecnologia","Inglês","2007","http://www.scielo.br/scielo.php?script=sci_arttext&pid=S1413-70542007000500026&lang=pt" 
"S1413-70542007000500028-scl","Alguns aspectos da política creditícia e o desenvolvimento da pecuária de corte no Brasil","Carrer, Celso da Costa, Cardoso, João Luiz, Aferri, Gabriela, Ribeiro, Marcelo Machado de Luca Oliveira, Oliveira, Nadia Jorge Diniz de","Ciência e Agrotecnologia; 31(5); 1455-1461","Ciência e Agrotecnologia","Português","2007","http://www.scielo.br/scielo.php?script=sci_arttext&pid=S1413-70542007000500028&lang=pt" 
"S1413-70542007000500031-scl","Variabilidade espacial de atributos físicos do solo em uma microbacia hidrográfica","Vieira, Vinicius Augusto da Silveira, Mello, Carlos Rogério de, Lima, José Maria de","Ciência e Agrotecnologia; 31(5); 1477-1485","Ciência e Agrotecnologia","Português","2007","http://www.scielo.br/scielo.php?script=sci_arttext&pid=S1413-70542007000500031&lang=pt" 
"S1413-70542007000500037-scl","Efeito de diferentes aditivos sobre a qualidade fermentativa da silagem de resíduo de maracujá amarelo","Neiva Júnior, Arnaldo Prata, Silva Filho, José Cleto da, Von Tiesenhausen, Igor Maximiliano Eustáquio V., Freitas, Rilke Tadeu Fonseca de, Couto Filho, Cristóvão Colombo de Carvalho, Nogueira, Denismar","Ciência e Agrotecnologia; 31(5); 1519-1524","Ciência e Agrotecnologia","Português","2007","http://www.scielo.br/scielo.php?script=sci_arttext&pid=S1413-70542007000500037&lang=pt" 
"S1413-70542007000500039-scl","Produção de forragem do capim-tanzânia sob intervalos de corte e doses de potássio","Souza, Milena Rízzia Ferreira de, Pinto, José Cardoso, Oliveira, Itamar Pereira de, Muniz, Joel Augusto, Rocha, Gudesteu Porto, Evangelista, Antônio Ricardo","Ciência e Agrotecnologia; 31(5); 1532-1536","Ciência e Agrotecnologia","Português","2007","http://www.scielo.br/scielo.php?script=sci_arttext&pid=S1413-70542007000500039&lang=pt" 
"S1413-70542007000500042-scl","Principais dificuldades encontradas pelas certificadoras para rastrear bovinos","Lopes, Marcos Aurélio, Santos, Glauber dos","Ciência e Agrotecnologia; 31(5); 1552-1557","Ciência e Agrotecnologia","Português","2007","http://www.scielo.br/scielo.php?script=sci_arttext&pid=S1413-70542007000500042&lang=pt" 
"S1413-70542007000500044-scl","Seleção de linhagens de melancia resistentes ao Watermelon mosaic virus e ao Papaya ringspot virus","Beserra Júnior, José Evando Aguiar, Figueira, Antonia dos Reis, Maluf, Wilson Roberto","Ciência e Agrotecnologia; 31(5); 1563-1568","Ciência e Agrotecnologia","Português","2007","http://www.scielo.br/scielo.php?script=sci_arttext&pid=S1413-70542007000500044&lang=pt" 
"S0101-73302007000300002-scl","APRESENTAÇÃO","","Educação &amp; Sociedade; 28(100); 655-658","Educação &amp; Sociedade","Português","2007","http://www.scielo.br/scielo.php?script=sci_arttext&pid=S0101-73302007000300002&lang=pt" 
"S0101-73302007000300001-scl","Editorial","Vieira, Evaldo","Educação &amp; Sociedade; 28(100); 651-654","Educação &amp; Sociedade","Português","2007","http://www.scielo.br/scielo.php?script=sci_arttext&pid=S0101-73302007000300001&lang=pt" 
"S1413-70542007000500001-scl","Ação do BAP na regeneração in vitro de Blc Owen Holmes Ponkan x Brassavola digbiana nº 2","Giatti, Luciana, Lima, Giuseppina Pace Pereira","Ciência e Agrotecnologia; 31(5); 1279-1285","Ciência e Agrotecnologia","Português","2007","http://www.scielo.br/scielo.php?script=sci_arttext&pid=S1413-70542007000500001&lang=pt" 
"S1413-70542007000500005-scl","Cultivo de milho no sistema de aléias com leguminosas perenes","Queiroz, Luciano Rodrigues, Coelho, Fábio Cunha, Barroso, Deborah Guerra","Ciência e Agrotecnologia; 31(5); 1303-1309","Ciência e Agrotecnologia","Português","2007","http://www.scielo.br/scielo.php?script=sci_arttext&pid=S1413-70542007000500005&lang=pt" 
"S1413-70542007000500014-scl","Isolamento e identificação de bactérias presentes nos solos de cobertura utilizados no cultivo do cogumelo Agaricus blazei Murril","Silva, Valdirene Aparecida da, Dias, Eustáquio Souza, Vale, Roberta Hilsdorf Piccoli do, Silva, Romildo da, Moreira, Grazielle Furtado","Ciência e Agrotecnologia; 31(5); 1364-1373","Ciência e Agrotecnologia","Português","2007","http://www.scielo.br/scielo.php?script=sci_arttext&pid=S1413-70542007000500014&lang=pt" 
"S1413-70542007000500022-scl","Análises físico-químicas de pré-misturas de pães de queijo e produção de pães de queijo com adição de okara","Aplevicz, Krischina Singer, Demiate, Ivo Mottin","Ciência e Agrotecnologia; 31(5); 1416-1422","Ciência e Agrotecnologia","Português","2007","http://www.scielo.br/scielo.php?script=sci_arttext&pid=S1413-70542007000500022&lang=pt" 
"S1413-70542007000500023-scl","Armazenamento refrigerado de banana &#039;Prata Anã&#039; proveniente de cachos com 16, 18 e 20 semanas","Martins, Ramilo Nogueira, Dias, Mário Sérgio Carvalho, Vilas Boas, Eduardo Valério de Barros, Santos, Leandra Oliveira","Ciência e Agrotecnologia; 31(5); 1423-1429","Ciência e Agrotecnologia","Português","2007","http://www.scielo.br/scielo.php?script=sci_arttext&pid=S1413-70542007000500023&lang=pt" 
"S1413-70542007000500027-scl","Qualidade pós-colheita de frutos de diferentes clones de mangabeira (Hancornia speciosa Gomes)","Souza, Florisvaldo Gama de, Figueiredo, Raimundo Wilane de, Alves, Ricardo Elesbão, Maia, Geraldo Arraes, Araújo, Ivaldo Antônio de","Ciência e Agrotecnologia; 31(5); 1449-1454","Ciência e Agrotecnologia","Português","2007","http://www.scielo.br/scielo.php?script=sci_arttext&pid=S1413-70542007000500027&lang=pt" 
"S1413-70542007000500036-scl","Efeito da substituição do farelo de soja pela amiréia 150S no consumo, produção e composição do leite","Vilela, Flávio Garcia, Teixeira, Júlio César, Pérez, Juan Ramon O., Paiva, Paulo César de Aguiar, Muniz, Joel Augusto, Reis, Sidnei Tavares","Ciência e Agrotecnologia; 31(5); 1512-1518","Ciência e Agrotecnologia","Português","2007","http://www.scielo.br/scielo.php?script=sci_arttext&pid=S1413-70542007000500036&lang=pt" 
"S1413-70542007000500041-scl","Fontes e níveis de óleos na alimentação de carpa comum (Cyprinus carpio L.) na fase de crescimento","Graeff, Álvaro, Tomazelli, Amador","Ciência e Agrotecnologia; 31(5); 1545-1551","Ciência e Agrotecnologia","Português","2007","http://www.scielo.br/scielo.php?script=sci_arttext&pid=S1413-70542007000500041&lang=pt" 
"S0101-73302007000300003-scl","Da universalização do ensino fundamental ao desafio da qualidade: uma análise histórica","Oliveira, Romualdo Portela de","Educação &amp; Sociedade; 28(100); 661-690","Educação &amp; Sociedade","Português","2007","http://www.scielo.br/scielo.php?script=sci_arttext&pid=S0101-73302007000300003&lang=pt" 
"S0101-73302007000300004-scl","A educação como um direito fundamental de natureza social","Duarte, Clarice Seixas","Educação &amp; Sociedade; 28(100); 691-713","Educação &amp; Sociedade","Português","2007","http://www.scielo.br/scielo.php?script=sci_arttext&pid=S0101-73302007000300004&lang=pt" 
"S0101-73302007000300005-scl","Utopias revolucionárias e educação pública: rumos para uma nova &quot;cidade ética&quot;","Piozzi, Patrizia","Educação &amp; Sociedade; 28(100); 715-735","Educação &amp; Sociedade","Português","2007","http://www.scielo.br/scielo.php?script=sci_arttext&pid=S0101-73302007000300005&lang=pt" 
"S0101-73302007000300006-scl","Educação moral hoje: cenários, perspectivas e perplexidades","Goergen, Pedro","Educação &amp; Sociedade; 28(100); 737-762","Educação &amp; Sociedade","Português","2007","http://www.scielo.br/scielo.php?script=sci_arttext&pid=S0101-73302007000300006&lang=pt" 
"S0101-73302007000300007-scl","Violência, educação e sociedade: um olhar sobre o Brasil contemporâneo","Pino, Angel","Educação &amp; Sociedade; 28(100); 763-785","Educação &amp; Sociedade","Português","2007","http://www.scielo.br/scielo.php?script=sci_arttext&pid=S0101-73302007000300007&lang=pt" 
"S0101-73302007000300008-scl","Quando a violência infanto-juvenil indaga a pedagogia","González Arroyo, Miguel","Educação &amp; Sociedade; 28(100); 787-807","Educação &amp; Sociedade","Português","2007","http://www.scielo.br/scielo.php?script=sci_arttext&pid=S0101-73302007000300008&lang=pt" 
"S0101-73302007000300009-scl","O desenvolvimento meandroso da educação brasileira entre o estado e o mercado","Cunha, Luiz Antônio","Educação &amp; Sociedade; 28(100); 809-829","Educação &amp; Sociedade","Português","2007","http://www.scielo.br/scielo.php?script=sci_arttext&pid=S0101-73302007000300009&lang=pt" 
"S0101-73302007000300010-scl","Estado e políticas de financiamento em educação","Cury, Carlos Roberto Jamil","Educação &amp; Sociedade; 28(100); 831-855","Educação &amp; Sociedade","Português","2007","http://www.scielo.br/scielo.php?script=sci_arttext&pid=S0101-73302007000300010&lang=pt" 
"S0101-73302007000300011-scl","Financiamento e gasto público na educação básica no Brasil: 1995-2005","Castro, Jorge Abrahão de","Educação &amp; Sociedade; 28(100); 857-876","Educação &amp; Sociedade","Português","2007","http://www.scielo.br/scielo.php?script=sci_arttext&pid=S0101-73302007000300011&lang=pt" 
"S0101-73302007000300012-scl","A política recente de fundos para o financiamento da educação e seus efeitos no pacto federativo","Pinto, José Marcelino de Rezende","Educação &amp; Sociedade; 28(100); 877-897","Educação &amp; Sociedade","Português","2007","http://www.scielo.br/scielo.php?script=sci_arttext&pid=S0101-73302007000300012&lang=pt" 
"S0101-73302007000300013-scl","Formulação e implementação das políticas públicas em educação e as parcerias público-privadas: impasse democrático ou mistificação política?","Arelaro, Lisete R.G.","Educação &amp; Sociedade; 28(100); 899-919","Educação &amp; Sociedade","Português","2007","http://www.scielo.br/scielo.php?script=sci_arttext&pid=S0101-73302007000300013&lang=pt" 
"S0101-73302007000300014-scl","Políticas e gestão da educação básica no Brasil: limites e perspectivas","Dourado, Luiz Fernandes","Educação &amp; Sociedade; 28(100); 921-946","Educação &amp; Sociedade","Português","2007","http://www.scielo.br/scielo.php?script=sci_arttext&pid=S0101-73302007000300014&lang=pt" 
