"S0101-73302007000300015-scl","Inclusão e governamentalidade","Veiga-Neto, Alfredo, Lopes, Maura Corcini","Educação &amp; Sociedade; 28(100); 947-963","Educação &amp; Sociedade","Português","2007","http://www.scielo.br/scielo.php?script=sci_arttext&pid=S0101-73302007000300015&lang=pt" 
"S0101-73302007000300016-scl","Eliminação adiada: o ocaso das classes populares no interior da escola e a ocultação da (má) qualidade do ensino","Freitas, Luiz Carlos de","Educação &amp; Sociedade; 28(100); 965-987","Educação &amp; Sociedade","Português","2007","http://www.scielo.br/scielo.php?script=sci_arttext&pid=S0101-73302007000300016&lang=pt" 
"S0101-73302007000300017-scl","Qualidade do ensino fundamental: políticas, suas possibilidades, seus limites","Franco, Creso, Alves, Fátima, Bonamino, Alicia","Educação &amp; Sociedade; 28(100); 989-1014","Educação &amp; Sociedade","Português","2007","http://www.scielo.br/scielo.php?script=sci_arttext&pid=S0101-73302007000300017&lang=pt" 
"S0101-73302007000300018-scl","Tempo de escola e qualidade na educação pública","Cavaliere, Ana Maria","Educação &amp; Sociedade; 28(100); 1015-1035","Educação &amp; Sociedade","Português","2007","http://www.scielo.br/scielo.php?script=sci_arttext&pid=S0101-73302007000300018&lang=pt" 
"S0101-73302007000300019-scl","Contemporaneidade, educação e tecnologia","Moreira, Antonio Flavio Barbosa, Kramer, Sonia","Educação &amp; Sociedade; 28(100); 1037-1057","Educação &amp; Sociedade","Português","2007","http://www.scielo.br/scielo.php?script=sci_arttext&pid=S0101-73302007000300019&lang=pt" 
"S0101-73302007000300021-scl","Reflexões acerca da busca de uma nova qualidade da educação: relações entre juventude, educação e trabalho","Nakano, Marilena, Almeida, Elmir de","Educação &amp; Sociedade; 28(100); 1085-1104","Educação &amp; Sociedade","Português","2007","http://www.scielo.br/scielo.php?script=sci_arttext&pid=S0101-73302007000300021&lang=pt" 
"S0101-73302007000300022-scl","A escola &quot;faz&quot; as juventudes? Reflexões em torno da socialização juvenil","Dayrell, Juarez","Educação &amp; Sociedade; 28(100); 1105-1128","Educação &amp; Sociedade","Português","2007","http://www.scielo.br/scielo.php?script=sci_arttext&pid=S0101-73302007000300022&lang=pt" 
"S0101-73302007000300023-scl","A relação da educação profissional e tecnológica com a universalização da educação básica","Frigotto, Gaudêncio","Educação &amp; Sociedade; 28(100); 1129-1152","Educação &amp; Sociedade","Português","2007","http://www.scielo.br/scielo.php?script=sci_arttext&pid=S0101-73302007000300023&lang=pt" 
"S0101-73302007000300024-scl","Da dualidade assumida à dualidade negada: o discurso da flexibilização justifica a inclusão excludente","Kuenzer, Acacia Zeneida","Educação &amp; Sociedade; 28(100); 1153-1178","Educação &amp; Sociedade","Português","2007","http://www.scielo.br/scielo.php?script=sci_arttext&pid=S0101-73302007000300024&lang=pt" 
"S0101-73302007000300025-scl","O trabalho docente nas páginas de Educação &amp; Sociedade em seus (quase) 100 números","Lüdke, Menga, Boing, Luiz Alberto","Educação &amp; Sociedade; 28(100); 1179-1201","Educação &amp; Sociedade","Português","2007","http://www.scielo.br/scielo.php?script=sci_arttext&pid=S0101-73302007000300025&lang=pt" 
"S0101-73302007000300027-scl","O Plano de Desenvolvimento da Educação: análise do projeto do MEC","Saviani, Dermeval","Educação &amp; Sociedade; 28(100); 1231-1255","Educação &amp; Sociedade","Português","2007","http://www.scielo.br/scielo.php?script=sci_arttext&pid=S0101-73302007000300027&lang=pt" 
"S1806-37132007000500020-scl","Pólipo traqueal","Baldi, Bruno Guedes, Fernandes, Caio Júlio César dos Santos, Salge, João Marcos, Takagaki, Teresa Yae","Jornal Brasileiro de Pneumologia; 33(5); 616-620","Jornal Brasileiro de Pneumologia","Inglês, Português","2007","http://www.scielo.br/scielo.php?script=sci_arttext&pid=S1806-37132007000500020&lang=pt" 
"S1806-37132007000500008-scl","Tendência de mortalidade do câncer de pulmão, traquéia e brônquios no Brasil, 1980-2003","Malta, Deborah Carvalho, Moura, Lenildo de, Souza, Maria de Fátima Marinho de, Curado, Maria Paula, Alencar, Airlane Pereira, Alencar, Gizelton Pereira","Jornal Brasileiro de Pneumologia; 33(5); 536-543","Jornal Brasileiro de Pneumologia","Inglês, Português","2007","http://www.scielo.br/scielo.php?script=sci_arttext&pid=S1806-37132007000500008&lang=pt" 
"S1806-37132007000500017-scl","Discinesia ciliar primária: considerações sobre seis casos da síndrome de Kartagener","Ortega, Hugo Alejandro Vega, Vega, Nelson de Araujo, Santos, Bruno Quirino dos, Maia, Guilherme Tavares da Silva","Jornal Brasileiro de Pneumologia; 33(5); 602-608","Jornal Brasileiro de Pneumologia","Inglês, Português","2007","http://www.scielo.br/scielo.php?script=sci_arttext&pid=S1806-37132007000500017&lang=pt" 
"S1806-37132007000500015-scl","Hipertensão arterial pulmonar associada à anemia falciforme","Machado, Roberto Ferreira Pinto","Jornal Brasileiro de Pneumologia; 33(5); 583-591","Jornal Brasileiro de Pneumologia","Inglês, Português","2007","http://www.scielo.br/scielo.php?script=sci_arttext&pid=S1806-37132007000500015&lang=pt" 
"S1806-37132007000500016-scl","Características psicológicas associadas ao comportamento de fumar tabaco","Rondina, Regina de Cássia, Gorayeb, Ricardo, Botelho, Clóvis","Jornal Brasileiro de Pneumologia; 33(5); 592-601","Jornal Brasileiro de Pneumologia","Inglês, Português","2007","http://www.scielo.br/scielo.php?script=sci_arttext&pid=S1806-37132007000500016&lang=pt" 
"S0021-75572007000600003-scl","Uma visão evidente da prática baseada em evidências na medicina perinatal: ausência de evidência não é evidência de ausência","Sola, Augusto, Dieppa, Fernando Dominguez, Rogido, Marta R.","Jornal de Pediatria; 83(5); 395-414","Jornal de Pediatria","Inglês, Português","2007","http://www.scielo.br/scielo.php?script=sci_arttext&pid=S0021-75572007000600003&lang=pt" 
"S0021-75572007000600005-scl","Vigilância de oito vírus respiratórios em amostras clínicas de pacientes pediátricos no sudeste do Brasil","Thomazelli, Luciano M., Vieira, Sandra, Leal, Andrea L., Sousa, Thereza S., Oliveira, Daniele B. L., Golono, Miguel A., Gillio, Alfredo E., Stwien, Klaus E., Erdman, Dean D., Durigon, Edison L.","Jornal de Pediatria; 83(5); 422-428","Jornal de Pediatria","Inglês, Português","2007","http://www.scielo.br/scielo.php?script=sci_arttext&pid=S0021-75572007000600005&lang=pt" 
"S0021-75572007000600007-scl","Em busca da eficiência: visibilidade internacional da produção científica dos programas brasileiros de pós-graduação em saúde infantil e do adolescente entre 1998 e 2003","Goldani, Marcelo Z., Gurgel, Ricardo Q., Blank, Danilo, Gerolin, Jerônimo, Mari, Jair J.","Jornal de Pediatria; 83(5); 436-440","Jornal de Pediatria","Inglês, Português","2007","http://www.scielo.br/scielo.php?script=sci_arttext&pid=S0021-75572007000600007&lang=pt" 
"S0021-75572007000600008-scl","Avaliação das medidas do comprimento peniano de crianças e adolescentes","Gabrich, Pedro N., Vasconcelos, Juliana S. P., Damião, Ronaldo, Silva, Eloísio A. da","Jornal de Pediatria; 83(5); 441-446","Jornal de Pediatria","Inglês, Português","2007","http://www.scielo.br/scielo.php?script=sci_arttext&pid=S0021-75572007000600008&lang=pt" 
"S0021-75572007000600009-scl","O aleitamento materno no tratamento de crianças com fenilcetonúria","Kanufre, Viviane C., Starling, Ana L. P., Leão, Ennio, Aguiar, Marcos J. B., Santos, Jacqueline S., Soares, Rosângelis D. L., Silveira, Adriana M.","Jornal de Pediatria; 83(5); 447-452","Jornal de Pediatria","Inglês, Português","2007","http://www.scielo.br/scielo.php?script=sci_arttext&pid=S0021-75572007000600009&lang=pt" 
"S0021-75572007000600010-scl","Automedicação em crianças e adolescentes","Pereira, Francis S. V. T., Bucaretchi, Fábio, Stephan, Celso, Cordeiro, Ricardo","Jornal de Pediatria; 83(5); 453-458","Jornal de Pediatria","Inglês, Português","2007","http://www.scielo.br/scielo.php?script=sci_arttext&pid=S0021-75572007000600010&lang=pt" 
"S0021-75572007000600011-scl","Desempenho de pais de crianças em dieta de exclusão do leite de vaca na identificação de alimentos industrializados com e sem leite vaca","Weber, Thabata Koester, Speridião, Patrícia da Graça Leite, Sdepanian, Vera Lucia, Fagundes Neto, Ulysses, Morais, Mauro Batista de","Jornal de Pediatria; 83(5); 459-464","Jornal de Pediatria","Inglês, Português","2007","http://www.scielo.br/scielo.php?script=sci_arttext&pid=S0021-75572007000600011&lang=pt" 
"S0021-75572007000600012-scl","Diagnóstico precoce das faringoamigdalites estreptocócicas: avaliação pelo teste de aglutinação de partículas de látex","Fontes, Maria Jussara F., Bottrel, Flávia B., Fonseca, Maria Teresa M., Lasmar, Laura B., Diamante, Rosângela, Camargos, Paulo Augusto M.","Jornal de Pediatria; 83(5); 465-470","Jornal de Pediatria","Inglês, Português","2007","http://www.scielo.br/scielo.php?script=sci_arttext&pid=S0021-75572007000600012&lang=pt" 
"S0021-75572007000600013-scl","Adesão ao uso de corticóide inalatório na asma: taxas relatadas pelos responsáveis e mensuradas pela farmácia","Lasmar, Laura M. L. B. F., Camargos, Paulo A. M., Costa, Leila F., Fonseca, Maria Teresa M., Fontes, Maria Jussara F., Ibiapina, Cassio C., Alvim, Cristina G., Moura, José A. R., Goulart, Eugenio M. A., Sakurai, Emilia","Jornal de Pediatria; 83(5); 471-476","Jornal de Pediatria","Inglês, Português","2007","http://www.scielo.br/scielo.php?script=sci_arttext&pid=S0021-75572007000600013&lang=pt" 
"S0021-75572007000600014-scl","Proteína C reativa como indicador de inflamação de baixa intensidade em crianças e adolescentes com e sem obesidade","Brasil, Adriana R., Norton, Rocksane C., Rossetti, Márcia B., Leão, Ennio, Mendes, Ricardo P.","Jornal de Pediatria; 83(5); 477-480","Jornal de Pediatria","Inglês, Português","2007","http://www.scielo.br/scielo.php?script=sci_arttext&pid=S0021-75572007000600014&lang=pt" 
"S0021-75572007000600015-scl","Determinação das concentrações plasmáticas de salbutamol pós-nebulização em serviço de emergência pediátrica","Rotta, Eloni T., Amantéa, Sérgio L., Froehlich, Pedro E., Becker, Adriana","Jornal de Pediatria; 83(5); 481-484","Jornal de Pediatria","Inglês, Português","2007","http://www.scielo.br/scielo.php?script=sci_arttext&pid=S0021-75572007000600015&lang=pt" 
"S0021-75572007000600006-scl","Aptidão cardiorrespiratória e associações com fatores de risco cardiovascular em adolescentes","Rodrigues, Anabel N., Perez, Anselmo José, Carletti, Luciana, Bissoli, Nazaré S., Abreu, Gláucia R.","Jornal de Pediatria; 83(5); 429-435","Jornal de Pediatria","Inglês, Português","2007","http://www.scielo.br/scielo.php?script=sci_arttext&pid=S0021-75572007000600006&lang=pt" 
"S1806-37132007000500005-scl","Perfil celular do escarro induzido e sangue periférico na doença pulmonar obstrutiva crônica","Rufino, Rogerio, Costa, Cláudia Henrique da, Souza, Heitor Siffert Pereira de, Madi, Kalil, Silva, José Roberto Lapa e","Jornal Brasileiro de Pneumologia; 33(5); 510-518","Jornal Brasileiro de Pneumologia","Inglês, Português","2007","http://www.scielo.br/scielo.php?script=sci_arttext&pid=S1806-37132007000500005&lang=pt" 
"S1806-37132007000500021-scl","Perguntamos: qual é o diagnóstico?","Jasinowodolinski, Dany, Meirelles, Gustavo de Souza Portes, Silva, Flavio Duarte, Müller, Nestor L","Jornal Brasileiro de Pneumologia; 33(5); 621-621","Jornal Brasileiro de Pneumologia","Inglês, Português","2007","http://www.scielo.br/scielo.php?script=sci_arttext&pid=S1806-37132007000500021&lang=pt" 
"S1806-37132007000500022-scl","Diagnóstico do caso da edição anterior","Jasinowodolinski, Dany, Meirelles, Gustavo de Souza Portes, Müller, Nestor L","Jornal Brasileiro de Pneumologia; 33(5); 622-623","Jornal Brasileiro de Pneumologia","Inglês, Português","2007","http://www.scielo.br/scielo.php?script=sci_arttext&pid=S1806-37132007000500022&lang=pt" 
"S1806-37132007000500004-scl","Avaliação quantitativa das fibras elásticas na doença pulmonar obstrutiva crônica","Rufino, Rogerio, Madi, Kalil, Souza, Heitor Siffert Pereira de, Costa, Cláudia Henrique da, Saito, Eduardo Haruo, Silva, José Roberto Lapa e","Jornal Brasileiro de Pneumologia; 33(5); 502-509","Jornal Brasileiro de Pneumologia","Inglês, Português","2007","http://www.scielo.br/scielo.php?script=sci_arttext&pid=S1806-37132007000500004&lang=pt" 
"S1806-37132007000500009-scl","Tendência temporal e distribuição espacial da mortalidade por câncer de pulmão no Brasil entre 1979 e 2004: magnitude, padrões regionais e diferenças entre sexos","Boing, Antonio Fernando, Rossi, Tiana Fávero","Jornal Brasileiro de Pneumologia; 33(5); 544-551","Jornal Brasileiro de Pneumologia","Inglês, Português","2007","http://www.scielo.br/scielo.php?script=sci_arttext&pid=S1806-37132007000500009&lang=pt" 
"S1806-37132007000500010-scl","Microlitíase alveolar pulmonar: achados na tomografia computadorizada de alta resolução do tórax em 10 pacientes","Marchiori, Edson, Gonçalves, Carolina Marinho, Escuissato, Dante Luiz, Teixeira, Kim-Ir-Sen Santos, Rodrigues, Rosana, Barreto, Miriam Menna, Esteves, Mauro","Jornal Brasileiro de Pneumologia; 33(5); 552-557","Jornal Brasileiro de Pneumologia","Inglês, Português","2007","http://www.scielo.br/scielo.php?script=sci_arttext&pid=S1806-37132007000500010&lang=pt" 
"S1806-37132007000500011-scl","Variáveis relacionadas à iniciação do tabagismo entre estudantes do ensino médio de escola pública e particular na cidade de Belém - PA","Pinto, Denise da Silva, Ribeiro, Sandra Aparecida","Jornal Brasileiro de Pneumologia; 33(5); 558-564","Jornal Brasileiro de Pneumologia","Inglês, Português","2007","http://www.scielo.br/scielo.php?script=sci_arttext&pid=S1806-37132007000500011&lang=pt" 
"S1806-37132007000500012-scl","Características clínico-demográficas de pacientes hospitalizados com tuberculose no Brasil, no período de 1994 a 2004","Severo, Norma Pinheiro Franco, Leite, Clarice Queico Fujimura, Capela, Marisa Veiga, Simões, Maria Jacira da Silva","Jornal Brasileiro de Pneumologia; 33(5); 565-571","Jornal Brasileiro de Pneumologia","Inglês, Português","2007","http://www.scielo.br/scielo.php?script=sci_arttext&pid=S1806-37132007000500012&lang=pt" 
"S0100-69912007000500014-scl","GLOSSÁRIO","Oliveira, Glória Maria de, Marsico, Giovanni Antonio, Renteria, Juan Miguel, Figueiredo, José Henrique Cunha, Guimarães, Carlos Alberto","Revista do Colégio Brasileiro de Cirurgiões; 34(5); 347-350","Revista do Colégio Brasileiro de Cirurgiões","Português","2007","http://www.scielo.br/scielo.php?script=sci_arttext&pid=S0100-69912007000500014&lang=pt" 
"S0100-39842007000500006-scl","Freqüência dos sinais de pielonefrite aguda em pacientes submetidos a tomografia computadorizada","Campos, Flávio do Amaral, Rosas, George de Queiroz, Goldenberg, Décio, Szarf, Gilberto, D&#039;Ippolito, Giuseppe","Radiologia Brasileira; 40(5); 309-314","Radiologia Brasileira","Inglês, Português","2007","http://www.scielo.br/scielo.php?script=sci_arttext&pid=S0100-39842007000500006&lang=pt" 
"S0100-69912007000500004-scl","Reconstrução com prótese imediata pós maxilectomia","Miracca, Renato Alberto Aldo, Andrade Sobrinho, Josias de, Gonçalves, Antônio José","Revista do Colégio Brasileiro de Cirurgiões; 34(5); 297-302","Revista do Colégio Brasileiro de Cirurgiões","Português","2007","http://www.scielo.br/scielo.php?script=sci_arttext&pid=S0100-69912007000500004&lang=pt" 
"S0100-39842007000500002-scl","Qual o seu diagnóstico?","Nacif, Marcelo Souto, Santos, Alair Augusto Sarmet Moreira Damas dos, Barros Filho, Clovis Monteiro de, Sales, Luciano Carneiro, Souza, Valdênia Pereira de, Carvalho, Antonio Carlos Pires","Radiologia Brasileira; 40(5); IX-XII","Radiologia Brasileira","Inglês, Português","2007","http://www.scielo.br/scielo.php?script=sci_arttext&pid=S0100-39842007000500002&lang=pt" 
"S0100-39842007000500001-scl","Embolização dos miomas uterinos sintomáticos: indicação baseada em evidências científicas","Carnevale, Francisco César","Radiologia Brasileira; 40(5); V-VI","Radiologia Brasileira","Inglês, Português","2007","http://www.scielo.br/scielo.php?script=sci_arttext&pid=S0100-39842007000500001&lang=pt" 
"S0100-39842007000500015-scl","Paracoccidioidomicose pulmonar: relato de dois casos enfatizando o sinal do halo invertido","Freitas Filho, Matias de, Gonçalves, Fabrício Guimarães, Basílio, Marcello Antônio Rezende, Mançano, Alexandre Dias, Cherulli, Bruno, Barreiros, Márcia Rocha Carneiro","Radiologia Brasileira; 40(5); 355-357","Radiologia Brasileira","Inglês, Português","2007","http://www.scielo.br/scielo.php?script=sci_arttext&pid=S0100-39842007000500015&lang=pt" 
"S0100-69912007000500017-scl","Tuberculose esofágica primária: relato de caso","Pioner, Sérgio Ricardo, Rech, Daniel, Menegotto, Lucas, Machado, Felipe Pioner, Indicatti, Ciana Santos","Revista do Colégio Brasileiro de Cirurgiões; 34(5); 357-358","Revista do Colégio Brasileiro de Cirurgiões","Português","2007","http://www.scielo.br/scielo.php?script=sci_arttext&pid=S0100-69912007000500017&lang=pt" 
"S0100-69912007000500001-scl","Videocirurgia em oncologia: mitos e verdades","Guarischi, Alfredo","Revista do Colégio Brasileiro de Cirurgiões; 34(5); 283-284","Revista do Colégio Brasileiro de Cirurgiões","Português","2007","http://www.scielo.br/scielo.php?script=sci_arttext&pid=S0100-69912007000500001&lang=pt" 
"S0100-69912007000500003-scl","O valor da tomografia computadorizada na mudança do paradigma cirúrgico do carcinoma epidermóide de boca e orofaringe","Brito Junior, Joel Pinheiro de, Souza, Ricardo Pires de, Rapoport, Abrão, Lehn, Carlos Neutzling, Perez, Ricardo Salinas, Rodrigues, Helen Mara","Revista do Colégio Brasileiro de Cirurgiões; 34(5); 290-296","Revista do Colégio Brasileiro de Cirurgiões","Português","2007","http://www.scielo.br/scielo.php?script=sci_arttext&pid=S0100-69912007000500003&lang=pt" 
"S0100-69912007000500016-scl","Sump syndrome: relato de caso","Lopes Junior, Ascêncio Garcia, Fuganti, Paulo Emílio, Spinosa, Sergio R.","Revista do Colégio Brasileiro de Cirurgiões; 34(5); 354-356","Revista do Colégio Brasileiro de Cirurgiões","Português","2007","http://www.scielo.br/scielo.php?script=sci_arttext&pid=S0100-69912007000500016&lang=pt" 
"S0100-69912007000500008-scl","Análise dos fatores implicados na conversão da colecistectomia laparoscópica","Lima, Enio Corrêa, Queiroz, Fábio Lopes, Ladeira, Felipe Neto, Ferreira, Bruno Meilman, Bueno, José Guilherme Penido, Magalhães, Eudes Arantes","Revista do Colégio Brasileiro de Cirurgiões; 34(5); 321-325","Revista do Colégio Brasileiro de Cirurgiões","Português","2007","http://www.scielo.br/scielo.php?script=sci_arttext&pid=S0100-69912007000500008&lang=pt" 
"S0100-69912007000500012-scl","Ressecção hepática com uso de radiofreqüência bipolar","Waechter, Fábio Luiz, Sampaio, José Artur, Berger, Paulo Renê Soares, Souza, Eliézer Knob de","Revista do Colégio Brasileiro de Cirurgiões; 34(5); 340-342","Revista do Colégio Brasileiro de Cirurgiões","Português","2007","http://www.scielo.br/scielo.php?script=sci_arttext&pid=S0100-69912007000500012&lang=pt" 
"S0100-69912007000500015-scl","Variação anatômica da artéria torácica interna lateral: relato de caso","Rocha, Rogério Porto da, Oliveira, Helenice Souza de, Lopes, Aline Urias, Rios, Sérgio Luz","Revista do Colégio Brasileiro de Cirurgiões; 34(5); 351-353","Revista do Colégio Brasileiro de Cirurgiões","Português","2007","http://www.scielo.br/scielo.php?script=sci_arttext&pid=S0100-69912007000500015&lang=pt" 
"S0100-69912007000500013-scl","Mecanismos cirúrgicos de controle do diabetes mellitus tipo 2 após cirurgia bariátrica","Martins, Marcus Vinicius Dantas de Campos, Souza, Antônio Augusto Peixoto de","Revista do Colégio Brasileiro de Cirurgiões; 34(5); 343-346","Revista do Colégio Brasileiro de Cirurgiões","Português","2007","http://www.scielo.br/scielo.php?script=sci_arttext&pid=S0100-69912007000500013&lang=pt" 
"S0100-69912007000500018-scl","Carta do Editor","Trindade, Eduardo Neubarth","Revista do Colégio Brasileiro de Cirurgiões; 34(5); 359-359","Revista do Colégio Brasileiro de Cirurgiões","Português","2007","http://www.scielo.br/scielo.php?script=sci_arttext&pid=S0100-69912007000500018&lang=pt" 
"S0042-96862007001000013-spa","Contraceptive injections by community health workers in Uganda: a nonrandomized community trial","Stanback, John, Mbonye, Anthony K, Bekiita, Martha","Bulletin of the World Health Organization; 85(10); 768-773","Bulletin of the World Health Organization","Inglês","2007","http://www.scielosp.org/scielo.php?script=sci_arttext&pid=S0042-96862007001000013&lang=pt" 
"S0042-96862007001000012-spa","Magnesium sulfate is not used for pre-eclampsia and eclampsia in Mexico and Thailand as much as it should be","Lumbiganon, Pisake, Gülmezoglu, A Metin, Piaggio, Gilda, Langer, Ana, Grimshaw, Jeremy","Bulletin of the World Health Organization; 85(10); 763-767","Bulletin of the World Health Organization","Inglês","2007","http://www.scielosp.org/scielo.php?script=sci_arttext&pid=S0042-96862007001000012&lang=pt" 
"S0042-96862007001000017-spa","The Chilean infant mortality decline: improvement for whom? Socioeconomic and geographic inequalities in infant mortality, 1990-2005","Hertel-Fernandez, Alexander Warren, Giusti, Alejandro Esteban, Sotelo, Juan Manuel","Bulletin of the World Health Organization; 85(10); 798-804","Bulletin of the World Health Organization","Inglês","2007","http://www.scielosp.org/scielo.php?script=sci_arttext&pid=S0042-96862007001000017&lang=pt" 
"S0042-96862007001000021-spa","Corrigendum","","Bulletin of the World Health Organization; 85(10); 822-822","Bulletin of the World Health Organization","Inglês","2007","http://www.scielosp.org/scielo.php?script=sci_arttext&pid=S0042-96862007001000021&lang=pt" 
"S0042-96862007001000008-spa","The Global Fund expands its role","","Bulletin of the World Health Organization; 85(10); 742-743","Bulletin of the World Health Organization","Inglês","2007","http://www.scielosp.org/scielo.php?script=sci_arttext&pid=S0042-96862007001000008&lang=pt" 
"S0042-96862007001000007-spa","Saving mother&#039;s lives in rural Indonesia","Analen, Cininta","Bulletin of the World Health Organization; 85(10); 740-741","Bulletin of the World Health Organization","Inglês","2007","http://www.scielosp.org/scielo.php?script=sci_arttext&pid=S0042-96862007001000007&lang=pt" 
"S0042-96862007001000006-spa","South African study highlights importance of research involving children","Keeton, Claire","Bulletin of the World Health Organization; 85(10); 738-740","Bulletin of the World Health Organization","Inglês","2007","http://www.scielosp.org/scielo.php?script=sci_arttext&pid=S0042-96862007001000006&lang=pt" 
"S0042-96862007001000009-spa","Recent news from WHO","","Bulletin of the World Health Organization; 85(10); 744-744","Bulletin of the World Health Organization","Inglês","2007","http://www.scielosp.org/scielo.php?script=sci_arttext&pid=S0042-96862007001000009&lang=pt" 
"S0042-96862007001000003-spa","The Safe Motherhood Initiative and beyond","Islam, Monir","Bulletin of the World Health Organization; 85(10); 735-735","Bulletin of the World Health Organization","Inglês","2007","http://www.scielosp.org/scielo.php?script=sci_arttext&pid=S0042-96862007001000003&lang=pt" 
"S0042-96862007001000004-spa","Opening data to the world: why health numbers matter","Wood, Sara","Bulletin of the World Health Organization; 85(10); 736-736","Bulletin of the World Health Organization","Inglês","2007","http://www.scielosp.org/scielo.php?script=sci_arttext&pid=S0042-96862007001000004&lang=pt" 
"S0042-96862007001000002-spa","Poverty and development","Fosu, Augustin Kwasi","Bulletin of the World Health Organization; 85(10); 734-734","Bulletin of the World Health Organization","Inglês","2007","http://www.scielosp.org/scielo.php?script=sci_arttext&pid=S0042-96862007001000002&lang=pt" 
"S0042-96862007001000005-spa","Defeating dengue: a difficult task ahead","Orozco, José","Bulletin of the World Health Organization; 85(10); 737-738","Bulletin of the World Health Organization","Inglês","2007","http://www.scielosp.org/scielo.php?script=sci_arttext&pid=S0042-96862007001000005&lang=pt" 
"S0042-96862007001000020-spa","Addressing smoking cessation in tuberculosis control","Schneider, Nick K, Novotny, Thomas E","Bulletin of the World Health Organization; 85(10); 820-821","Bulletin of the World Health Organization","Inglês","2007","http://www.scielosp.org/scielo.php?script=sci_arttext&pid=S0042-96862007001000020&lang=pt" 
"S0100-39842007000500004-scl","Valor preditivo da distensão de alças intestinais em radiografias no prognóstico de enterocolite necrosante","Martins, Daniel Lahan, Gonçalves, Anderson, Dabus, Guilherme de Castro, Bustorff-Silva, Joaquim Murray, Olímpio, Hugo Oliveira, Alvares, Beatriz Regina, Sbragia, Lourenço","Radiologia Brasileira; 40(5); 297-301","Radiologia Brasileira","Inglês, Português","2007","http://www.scielo.br/scielo.php?script=sci_arttext&pid=S0100-39842007000500004&lang=pt" 
