"S0798-04772004000200009-ven","Y el África parió al hombre…","APONTE, CARLOS","Revista del Instituto Nacional de Higiene Rafael Rangel; 35(2); 45-45","Revista del Instituto Nacional de Higiene Rafael Rangel","Espanhol","2004","http://www.scielo.org.ve/scielo.php?script=sci_arttext&pid=S0798-04772004000200009&lang=pt" 
"S0798-04772004000200008-ven","Terrorismo y las armas de cuarta generación","APONTE, CARLOS","Revista del Instituto Nacional de Higiene Rafael Rangel; 35(2); 43-44","Revista del Instituto Nacional de Higiene Rafael Rangel","Espanhol","2004","http://www.scielo.org.ve/scielo.php?script=sci_arttext&pid=S0798-04772004000200008&lang=pt" 
"S1316-00872004000200009-ven","Sentido metafórico y conceptual de la obra &quot;Urdimbre estética, social e ideológica del indigenismo en América Latina&quot;","Rodríguez Bello, Luisa","Investigación y Postgrado; 19(2); 203-212","Investigación y Postgrado","Espanhol","2004","http://www.scielo.org.ve/scielo.php?script=sci_arttext&pid=S1316-00872004000200009&lang=pt" 
"S0367-47622004000300010-ven","Oncología","","Gaceta Médica de Caracas; 112(3); 227-231","Gaceta Médica de Caracas","Espanhol","2004","http://www.scielo.org.ve/scielo.php?script=sci_arttext&pid=S0367-47622004000300010&lang=pt" 
"S0367-47622004000300011-ven","Medicina Familiar","","Gaceta Médica de Caracas; 112(3); 232-232","Gaceta Médica de Caracas","Espanhol","2004","http://www.scielo.org.ve/scielo.php?script=sci_arttext&pid=S0367-47622004000300011&lang=pt" 
"S0367-47622004000300012-ven","Diabetes Mellitus","","Gaceta Médica de Caracas; 112(3); 232-233","Gaceta Médica de Caracas","Espanhol","2004","http://www.scielo.org.ve/scielo.php?script=sci_arttext&pid=S0367-47622004000300012&lang=pt" 
"S0367-47622004000300013-ven","Cardiopatía y Ateroesclerosis","","Gaceta Médica de Caracas; 112(3); 236-241","Gaceta Médica de Caracas","Espanhol","2004","http://www.scielo.org.ve/scielo.php?script=sci_arttext&pid=S0367-47622004000300013&lang=pt" 
"S0367-47622004000300016-ven","Fe de Errata","","Gaceta Médica de Caracas; 112(3); 252-252","Gaceta Médica de Caracas","Espanhol","2004","http://www.scielo.org.ve/scielo.php?script=sci_arttext&pid=S0367-47622004000300016&lang=pt" 
"S0367-47622004000300017-ven","Congreso Centenario &quot;Dr. José Ignacio Baldó&quot;: Curso Precongreso Avances Pediátricos","","Gaceta Médica de Caracas; 112(3); 253-258","Gaceta Médica de Caracas","Espanhol","2004","http://www.scielo.org.ve/scielo.php?script=sci_arttext&pid=S0367-47622004000300017&lang=pt" 
"S0367-47622004000300018-ven","Congreso Centenario &quot;Dr. José Ignacio Baldó&quot; Cursos precongreso","","Gaceta Médica de Caracas; 112(3); 259-265","Gaceta Médica de Caracas","Espanhol","2004","http://www.scielo.org.ve/scielo.php?script=sci_arttext&pid=S0367-47622004000300018&lang=pt" 
"S0367-47622004000300007-ven","Avances en Imagenología","","Gaceta Médica de Caracas; 112(3); 212-217","Gaceta Médica de Caracas","Espanhol","2004","http://www.scielo.org.ve/scielo.php?script=sci_arttext&pid=S0367-47622004000300007&lang=pt" 
"S0367-47622004000300006-ven","Urgencias Psiquiátricas","","Gaceta Médica de Caracas; 112(3); 204-211","Gaceta Médica de Caracas","Espanhol","2004","http://www.scielo.org.ve/scielo.php?script=sci_arttext&pid=S0367-47622004000300006&lang=pt" 
"S0367-47622004000300005-ven","Actualización de Emergencias en Trauma","","Gaceta Médica de Caracas; 112(3); 196-203","Gaceta Médica de Caracas","Espanhol","2004","http://www.scielo.org.ve/scielo.php?script=sci_arttext&pid=S0367-47622004000300005&lang=pt" 
"S0367-47622004000300004-ven","Pautas para la atención de emergencias en medicina","","Gaceta Médica de Caracas; 112(3); 189-195","Gaceta Médica de Caracas","Espanhol","2004","http://www.scielo.org.ve/scielo.php?script=sci_arttext&pid=S0367-47622004000300004&lang=pt" 
"S0367-47622004000300003-ven","Sesión de Clausura","Lima Gómez, Otto","Gaceta Médica de Caracas; 112(3); 188-188","Gaceta Médica de Caracas","Espanhol","2004","http://www.scielo.org.ve/scielo.php?script=sci_arttext&pid=S0367-47622004000300003&lang=pt" 
"S0367-47622004000300002-ven","Congreso Centenario &quot;Dr. José Ignacio Baldó&quot;: Sesión Inaugural","López, José Enrique","Gaceta Médica de Caracas; 112(3); 185-188","Gaceta Médica de Caracas","Espanhol","2004","http://www.scielo.org.ve/scielo.php?script=sci_arttext&pid=S0367-47622004000300002&lang=pt" 
"S0367-47622004000300001-ven","Conclusiones y Recomendaciones de las Ponencias desarrolladas durante el Congreso Centenario 2004 &quot;Dr. José Ignacio Baldó&quot; de la Academia Nacional de Medicina. Consideraciones finales","Ravelo Celis, José A.","Gaceta Médica de Caracas; 112(3); 181-184","Gaceta Médica de Caracas","Espanhol","2004","http://www.scielo.org.ve/scielo.php?script=sci_arttext&pid=S0367-47622004000300001&lang=pt" 
"S0367-47622004000300009-ven","La conducta","","Gaceta Médica de Caracas; 112(3); 224-226","Gaceta Médica de Caracas","Espanhol","2004","http://www.scielo.org.ve/scielo.php?script=sci_arttext&pid=S0367-47622004000300009&lang=pt" 
"S0367-47622004000300008-ven","Avances Pediátricos","","Gaceta Médica de Caracas; 112(3); 218-223","Gaceta Médica de Caracas","Espanhol","2004","http://www.scielo.org.ve/scielo.php?script=sci_arttext&pid=S0367-47622004000300008&lang=pt" 
"S0367-47622004000300014-ven","Seguridad Alimentaria y Calidad de Vida en Venezuela","","Gaceta Médica de Caracas; 112(3); 242-247","Gaceta Médica de Caracas","Espanhol","2004","http://www.scielo.org.ve/scielo.php?script=sci_arttext&pid=S0367-47622004000300014&lang=pt" 
"S0367-47622004000300015-ven","Enfermedades nuevas emergentes y re-emergentes en el continente americano y en Venezuela","","Gaceta Médica de Caracas; 112(3); 248-252","Gaceta Médica de Caracas","Espanhol","2004","http://www.scielo.org.ve/scielo.php?script=sci_arttext&pid=S0367-47622004000300015&lang=pt" 
"S0367-47622004000300019-ven","Vida de la Academia y Notas Bibliográficas","Avilán Rovira, J.M","Gaceta Médica de Caracas; 112(3); 266-271","Gaceta Médica de Caracas","Espanhol","2004","http://www.scielo.org.ve/scielo.php?script=sci_arttext&pid=S0367-47622004000300019&lang=pt" 
"S0042-96862004000700007-spa","Secondary prevention of stroke: results from the Southern Africa Stroke Prevention Initiative (SASPI) study","","Bulletin of the World Health Organization; 82(7); 503-508","Bulletin of the World Health Organization","Inglês","2004","http://www.scielosp.org/scielo.php?script=sci_arttext&pid=S0042-96862004000700007&lang=pt" 
"S0042-96862004000700008-spa","Improving antimicrobial use among health workers in first-level facilities: results from the Multi-Country Evaluation of the Integrated Management of Childhood Illness strategy","Gouws, Eleanor, Bryce, Jennifer, Habicht, Jean-Pierre, Amaral, João, Pariyo, George, Schellenberg, Joanna Armstrong, Fontaine, Olivier","Bulletin of the World Health Organization; 82(7); 509-515","Bulletin of the World Health Organization","Inglês","2004","http://www.scielosp.org/scielo.php?script=sci_arttext&pid=S0042-96862004000700008&lang=pt" 
"S0042-96862004000700010-spa","Cost-effectiveness of zinc as adjunct therapy for acute childhood diarrhoea in developing countries","Robberstad, Bjarne, Strand, Tor, Black, Robert E., Sommerfelt, Halvor","Bulletin of the World Health Organization; 82(7); 523-531","Bulletin of the World Health Organization","Inglês","2004","http://www.scielosp.org/scielo.php?script=sci_arttext&pid=S0042-96862004000700010&lang=pt" 
"S0042-96862004000700013-spa","Changing virulence of the SARS virus: the epidemiological evidence","Wang, Ming-Dong, Jolly, Ann Margaret","Bulletin of the World Health Organization; 82(7); 547-548","Bulletin of the World Health Organization","Inglês","2004","http://www.scielosp.org/scielo.php?script=sci_arttext&pid=S0042-96862004000700013&lang=pt" 
"S0042-96862004000700006-spa","Psychometric properties of the WHO Quality of Life questionnaire (WHOQOL-100) in patients with chronic diseases and their caregivers in China","Li, Lingjiang, Young, Derson, Xiao, Shuiyuan, Zhou, Xiao, Zhou, Liang","Bulletin of the World Health Organization; 82(7); 493-502","Bulletin of the World Health Organization","Inglês","2004","http://www.scielosp.org/scielo.php?script=sci_arttext&pid=S0042-96862004000700006&lang=pt" 
"S0042-96862004000700011-spa","China&#039;s public health-care system: facing the challenges","Liu, Yuanli","Bulletin of the World Health Organization; 82(7); 532-538","Bulletin of the World Health Organization","Inglês","2004","http://www.scielosp.org/scielo.php?script=sci_arttext&pid=S0042-96862004000700011&lang=pt" 
"S0042-96862004000700012-spa","Health in south-eastern Europe: a troubled past, an uncertain future","Rechel, Bernd, Schwalbe, Nina, McKee, Martin","Bulletin of the World Health Organization; 82(7); 539-546","Bulletin of the World Health Organization","Inglês","2004","http://www.scielosp.org/scielo.php?script=sci_arttext&pid=S0042-96862004000700012&lang=pt" 
"S0378-48352004000700008-esp","Formación de especialistas en Oncología Radioterápica en España","Pedraza Muriel, V.","Oncología (Barcelona); 27(7); 34-39","Oncología (Barcelona)","Espanhol","2004","http://scielo.isciii.es/scielo.php?script=sci_arttext&pid=S0378-48352004000700008&lang=pt" 
"S0378-48352004000700006-esp","Apoyo psicológico en oncología radioterápica","Cruzado, J. A.","Oncología (Barcelona); 27(7); 28-31","Oncología (Barcelona)","Espanhol","2004","http://scielo.isciii.es/scielo.php?script=sci_arttext&pid=S0378-48352004000700006&lang=pt" 
"S0378-48352004000700003-esp","Protección gastrointestinal y antieméticos en radioterapia: I. Protección gastrointestinal","Vázquez, G.","Oncología (Barcelona); 27(7); 14-17","Oncología (Barcelona)","Espanhol","2004","http://scielo.isciii.es/scielo.php?script=sci_arttext&pid=S0378-48352004000700003&lang=pt" 
"S0378-48352004000700007-esp","Programa docente de medicina basada en la evidencia: Experiencia en el Hospital Ramón y Cajal","Zamora, J.","Oncología (Barcelona); 27(7); 32-33","Oncología (Barcelona)","Espanhol","2004","http://scielo.isciii.es/scielo.php?script=sci_arttext&pid=S0378-48352004000700007&lang=pt" 
"S0378-48352004000700012-esp","Complementariedades clínicas entre tratamientos con protones y tratamientos con iones de carbón","Mazeron, J.-J., Rivera, R., Marsiglia, H., Widakowich, C.","Oncología (Barcelona); 27(7); 59-61","Oncología (Barcelona)","Espanhol","2004","http://scielo.isciii.es/scielo.php?script=sci_arttext&pid=S0378-48352004000700012&lang=pt" 
"S0378-48352004000700004-esp","Protección gastrointestinal y antieméticos en radioterapia: II. Antieméticos","Vázquez, G.","Oncología (Barcelona); 27(7); 18-21","Oncología (Barcelona)","Espanhol","2004","http://scielo.isciii.es/scielo.php?script=sci_arttext&pid=S0378-48352004000700004&lang=pt" 
"S0378-48352004000700001-esp","Experiencia con radioterapia externa y sobreimpresión con braquiterapia HDR y LDR en el tratamiento del cáncer de próstata","Fernández, P., Paula, B. de, Ayala, A., Guisasola, A., Mincholé, J.L., Pericás, I.","Oncología (Barcelona); 27(7); 9-12","Oncología (Barcelona)","Espanhol","2004","http://scielo.isciii.es/scielo.php?script=sci_arttext&pid=S0378-48352004000700001&lang=pt" 
"S0378-48352004000700011-esp","Cáncer de próstata","Zapatero, A.","Oncología (Barcelona); 27(7); 55-58","Oncología (Barcelona)","Espanhol","2004","http://scielo.isciii.es/scielo.php?script=sci_arttext&pid=S0378-48352004000700011&lang=pt" 
"S0378-48352004000700002-esp","Prostate brachytherapy: brief history and the evolution of the different techniques","Polo, A., Marsiglia, H.","Oncología (Barcelona); 27(7); 13-13","Oncología (Barcelona)","Inglês","2004","http://scielo.isciii.es/scielo.php?script=sci_arttext&pid=S0378-48352004000700002&lang=pt" 
"S0378-48352004000700009-esp","Radioterapia y citoprotección: Estado actual","Esco, R., Valencia, J., Polo, S.","Oncología (Barcelona); 27(7); 40-46","Oncología (Barcelona)","Espanhol","2004","http://scielo.isciii.es/scielo.php?script=sci_arttext&pid=S0378-48352004000700009&lang=pt" 
"S0378-48352004000700005-esp","Toxicidad sobre piel y mucosas: tratamientos de soporte","Montero Luis, A., Hervás, A., Morera, R., Ramos, A.","Oncología (Barcelona); 27(7); 22-27","Oncología (Barcelona)","Espanhol","2004","http://scielo.isciii.es/scielo.php?script=sci_arttext&pid=S0378-48352004000700005&lang=pt" 
"S0716-02082004000100001-chl","Temperaturas de formación en cataclasitas triásicas de la Cordillera Domeyko, Antofagasta, Chile","Niemeyer, Hans, Berríos, Héctor, Ruiz Cruz, María Dolores","Revista geológica de Chile; 31(1); 3-18","Revista geológica de Chile","Espanhol","2004","http://www.scielo.cl/scielo.php?script=sci_arttext&pid=S0716-02082004000100001&lang=pt" 
"S0716-02082004000100002-chl","Sedimentación sintectónica asociada a las estructuras neógenas en la Precordillera de la zona de Moquella, Tarapacá (19°15&#039;S, norte de Chile)","Pinto, Luisa, Hérail, Gérard, Charrier, Reynaldo","Revista geológica de Chile; 31(1); 19-44","Revista geológica de Chile","Espanhol","2004","http://www.scielo.cl/scielo.php?script=sci_arttext&pid=S0716-02082004000100002&lang=pt" 
"S0716-02082004000100003-chl","Un nuevo Trachytheriinae (Mammalia,†Notoungulata) del Deseadense (Oligoceno tardío) de Patagonia, Argentina: implicancias en la filogenia, biogeografía y bioestratigrafía de los Mesotheriidae","Reguero, Marcelo A., Castro, Paula V.","Revista geológica de Chile; 31(1); 45-64","Revista geológica de Chile","Espanhol","2004","http://www.scielo.cl/scielo.php?script=sci_arttext&pid=S0716-02082004000100003&lang=pt" 
"S0716-02082004000100004-chl","Mamíferos extintos del Cuaternario de la Provincia del Chaco (Argentina) y su relación con aquéllos del este de la región pampeana y de Chile","Zurita, Alfredo E., Carlini, Alfredo A., Scillato-Yané, Gustavo J., Tonni, Eduardo P.","Revista geológica de Chile; 31(1); 65-87","Revista geológica de Chile","Espanhol","2004","http://www.scielo.cl/scielo.php?script=sci_arttext&pid=S0716-02082004000100004&lang=pt" 
"S0716-02082004000100005-chl","Sclerorhynchid teeth (Neoselachii, Sclerorhynchidae) from the Late Cretaceous of the Quiriquina Formation, central Chile","Suárez, Mario E., Cappetta, Henri","Revista geológica de Chile; 31(1); 89-103","Revista geológica de Chile","Inglês","2004","http://www.scielo.cl/scielo.php?script=sci_arttext&pid=S0716-02082004000100005&lang=pt" 
"S0716-02082004000100006-chl","Peces Chimaeriformes (Chondrichthyes, Holocephali) del Neógeno de la Formación Bahía Inglesa (Región de Atacama, Chile)","Suárez, Mario E., Lamilla, Julio, Marquardt, Carlos","Revista geológica de Chile; 31(1); 105-117","Revista geológica de Chile","Espanhol","2004","http://www.scielo.cl/scielo.php?script=sci_arttext&pid=S0716-02082004000100006&lang=pt" 
"S0716-02082004000100007-chl","El género Cymatoceras (Nautilida) en el Cretácico Inferior de la Cuenca de Atacama, norte de Chile","Cichowolski, Marcela, Mourgues, Francisco A., Pérez d&#039;A, Ernesto","Revista geológica de Chile; 31(1); 119-131","Revista geológica de Chile","Espanhol","2004","http://www.scielo.cl/scielo.php?script=sci_arttext&pid=S0716-02082004000100007&lang=pt" 
"S0716-02082004000100008-chl","Paleodistribución del alerce y ciprés de las Guaitecas durante períodos interestadiales de la Glaciación Llanquihue: provincias de Llanquihue y Chiloé, Región de Los Lagos, Chile","Villagrán, Carolina, León, Ana, Roig, Fidel A.","Revista geológica de Chile; 31(1); 133-151","Revista geológica de Chile","Espanhol","2004","http://www.scielo.cl/scielo.php?script=sci_arttext&pid=S0716-02082004000100008&lang=pt" 
"S0716-02082004000100009-chl","Peter Welkner Mattenshohn† (1936 - 2004)","Kausel V., Edgar","Revista geológica de Chile; 31(1); 152-153","Revista geológica de Chile","Espanhol","2004","http://www.scielo.cl/scielo.php?script=sci_arttext&pid=S0716-02082004000100009&lang=pt" 
"S0798-07522004000200008-ven","Tras la Ruta del Hambre Following the Route of Hunger","Bengoa, José María","Anales Venezolanos de Nutrición; 17(2); 82-92","Anales Venezolanos de Nutrición","Espanhol","2004","http://www.scielo.org.ve/scielo.php?script=sci_arttext&pid=S0798-07522004000200008&lang=pt" 
"S0798-07522004000200005-ven","Creencias y prácticas alimentarias e higiénicas en madres, según el estado nutricional de su hijo.","Hurtado, Marta, Hagel, Isabel, Araujo, Marian, Rodríguez, Orquídea L., Palenque, Miguel","Anales Venezolanos de Nutrición; 17(2); 42-56","Anales Venezolanos de Nutrición","Espanhol","2004","http://www.scielo.org.ve/scielo.php?script=sci_arttext&pid=S0798-07522004000200005&lang=pt" 
"S0798-07522004000200004-ven","Consumo y adecuación de energía y nutrientes en niños urbanos de bajos recursos económicos de Valencia, Venezuela","del Real, Sara Irene, Fajardo, Zuleida, Solano, Liseti, Concepción Páez, María, Sánchez, Armando","Anales Venezolanos de Nutrición; 17(2); 28-41","Anales Venezolanos de Nutrición","Espanhol","2004","http://www.scielo.org.ve/scielo.php?script=sci_arttext&pid=S0798-07522004000200004&lang=pt" 
"S0798-07522004000200007-ven","La información en salud en revistas dominicales: ¿una vía para la publicidad indirecta?","Montes de Oca, Acianela","Anales Venezolanos de Nutrición; 17(2); 73-81","Anales Venezolanos de Nutrición","Espanhol","2004","http://www.scielo.org.ve/scielo.php?script=sci_arttext&pid=S0798-07522004000200007&lang=pt" 
"S0798-07522004000200006-ven","Nutritional Status and Development of Modified Formula-Supplemented Preschoolers under the Daycare Multihomes Program","Puig, Myriam, Aular, Ada, Lechín, Andrea, Lozada, María Antonieta, Cumare, Yarma","Anales Venezolanos de Nutrición; 17(2); 57-72","Anales Venezolanos de Nutrición","Inglês","2004","http://www.scielo.org.ve/scielo.php?script=sci_arttext&pid=S0798-07522004000200006&lang=pt" 
"S0798-07522004000200003-ven","Modificación de la conducta y alimentación balanceada en niños con déficit de atención y desorden de hiperactividad","Barrios, Ariana, Calderón, Marian, Ritter, Elsa, Velazco Gutiérrez, Yuly","Anales Venezolanos de Nutrición; 17(2); 13-27","Anales Venezolanos de Nutrición","Espanhol","2004","http://www.scielo.org.ve/scielo.php?script=sci_arttext&pid=S0798-07522004000200003&lang=pt" 
"S0798-07522004000200002-ven","Insulina serica en niños y adolescentes obesos y eutróficos","Viso González, Miguel Eduardo, Solano R, Liseti, Sánchez, Armando, Portillo, Zulay, Llovera, Daisy","Anales Venezolanos de Nutrición; 17(2); 3-12","Anales Venezolanos de Nutrición","Espanhol","2004","http://www.scielo.org.ve/scielo.php?script=sci_arttext&pid=S0798-07522004000200002&lang=pt" 
"S1516-89132004000300007-scl","Redistribution of phosphorus in soil through cover crop roots","Franchini, Júlio C., Pavan, Marcos A., Miyazawa, Mário","Brazilian Archives of Biology and Technology; 47(3); 381-386","Brazilian Archives of Biology and Technology","Inglês","2004","http://www.scielo.br/scielo.php?script=sci_arttext&pid=S1516-89132004000300007&lang=pt" 
"S1516-89132004000300006-scl","Direct RAPD evaluation of bacteria without conventional DNA extraction","Araújo, Welington Luiz, Angellis, Derlene Attili de, Azevedo, João Lúcio","Brazilian Archives of Biology and Technology; 47(3); 375-380","Brazilian Archives of Biology and Technology","Inglês","2004","http://www.scielo.br/scielo.php?script=sci_arttext&pid=S1516-89132004000300006&lang=pt" 
"S1516-89132004000300013-scl","Temporal dynamics of stomatal conductance of plants under water deficit: can homeostasis be improved by more complex dynamics?","Souza, Gustavo Maia, Oliveira, Ricardo Ferraz de, Cardoso, Victor José Mendes","Brazilian Archives of Biology and Technology; 47(3); 423-431","Brazilian Archives of Biology and Technology","Inglês","2004","http://www.scielo.br/scielo.php?script=sci_arttext&pid=S1516-89132004000300013&lang=pt" 
"S1516-89132004000300001-scl","Differential expression of Zymomonas mobilis sucrase genes (sacB and sacC) in Escherichia coli and sucrase mutants of Zymomonas mobilis","Gurunathan, Sangiliyandi, Gunasekaran, Paramasamy","Brazilian Archives of Biology and Technology; 47(3); 329-338","Brazilian Archives of Biology and Technology","Inglês","2004","http://www.scielo.br/scielo.php?script=sci_arttext&pid=S1516-89132004000300001&lang=pt" 
"S1516-89132004000300005-scl","Fructans and water suppression on intact and fragmented rhizophores of Vernonia herbacea","Dias-Tagliacozzo, Gláucia M., Itaya, Nair M., Carvalho, M. Angela Machado de, Figueiredo-Ribeiro, Rita de Cássia L., Dietrich, Sonia M. C.","Brazilian Archives of Biology and Technology; 47(3); 363-373","Brazilian Archives of Biology and Technology","Inglês","2004","http://www.scielo.br/scielo.php?script=sci_arttext&pid=S1516-89132004000300005&lang=pt" 
"S1516-89132004000300012-scl","Effect of host availability and egg load in Trichogramma platneri Nagarkatti (Hymenoptera: Trichogrammatidae) and its consequences on progeny quality","Hohmann, Celso L., Luck, Robert F.","Brazilian Archives of Biology and Technology; 47(3); 413-422","Brazilian Archives of Biology and Technology","Inglês","2004","http://www.scielo.br/scielo.php?script=sci_arttext&pid=S1516-89132004000300012&lang=pt" 
"S1516-89132004000300016-scl","Urban secondary sewage: an alternative medium for the culture of Tetraselmis chuii (Prasinophyceae) and Dunaliella viridis (Chlorophyceae)","Costa, Rauquírio André Albuquerque Marinho da, Koening, Maria Luise, Macedo, Sílvio José de","Brazilian Archives of Biology and Technology; 47(3); 451-459","Brazilian Archives of Biology and Technology","Inglês","2004","http://www.scielo.br/scielo.php?script=sci_arttext&pid=S1516-89132004000300016&lang=pt" 
"S1516-89132004000300017-scl","Movement of southern elephant seals (Mirounga leonina L.) from Elephant Is. South Shetlands, Antarctica","Muelbert, Mônica M. C., Robaldo, Ricardo B., Martínes, Pablo E., Colares, Elton P., Bianchini, Adalto, Setzer, Alberto","Brazilian Archives of Biology and Technology; 47(3); 461-467","Brazilian Archives of Biology and Technology","Inglês","2004","http://www.scielo.br/scielo.php?script=sci_arttext&pid=S1516-89132004000300017&lang=pt" 
"S1516-89132004000300018-scl","Evaluation of Apis mellifera Carniolan and Africanized honey bees in royal jelly production","Mouro, Gisele Fernanda, Toledo, Vagner de Alencar Arnaut de","Brazilian Archives of Biology and Technology; 47(3); 469-476","Brazilian Archives of Biology and Technology","Inglês","2004","http://www.scielo.br/scielo.php?script=sci_arttext&pid=S1516-89132004000300018&lang=pt" 
"S1516-89132004000300003-scl","Esterase polymorphism marking cultivars of Manihot esculenta, Crantz","Resende, Adriana Gazoli, Vidigal Filho, Pedro Soares, Machado, Maria de Fátima P. S.","Brazilian Archives of Biology and Technology; 47(3); 347-353","Brazilian Archives of Biology and Technology","Inglês","2004","http://www.scielo.br/scielo.php?script=sci_arttext&pid=S1516-89132004000300003&lang=pt" 
"S1516-89132004000300002-scl","Induction of leafy galls in Acacia mearnsii De Wild seedlings infected by Rhodococcus fascians","Quoirin, Marguerite, Bona, Cleusa, Souza, Elizandra F. de, Schwartsburd, Pedro B.","Brazilian Archives of Biology and Technology; 47(3); 339-346","Brazilian Archives of Biology and Technology","Inglês","2004","http://www.scielo.br/scielo.php?script=sci_arttext&pid=S1516-89132004000300002&lang=pt" 
"S1516-89132004000300015-scl","Studies on the morphometry of Macrobrachium nobilii (Decapoda, Palaemonidae)","Mariappan, Pitchaimuthu, Balasundaram, Chellam","Brazilian Archives of Biology and Technology; 47(3); 441-449","Brazilian Archives of Biology and Technology","Inglês","2004","http://www.scielo.br/scielo.php?script=sci_arttext&pid=S1516-89132004000300015&lang=pt" 
"S0365-66912004000700005-esp","Dacriocistorrinostomía transcanalicular con láser diodo","Alañón Fernández, FJ, Alañón Fernández, MA, Martínez Fernández, A, Cárdenas Lara, M","Archivos de la Sociedad Española de Oftalmología; 79(7); 325-330","Archivos de la Sociedad Española de Oftalmología","Espanhol","2004","http://scielo.isciii.es/scielo.php?script=sci_arttext&pid=S0365-66912004000700005&lang=pt" 
"S0365-66912004000700014-esp","Endoftalmitis post-quirúrgicas","Alió, Jorge L.","Archivos de la Sociedad Española de Oftalmología; 79(7); 365-366","Archivos de la Sociedad Española de Oftalmología","Espanhol","2004","http://scielo.isciii.es/scielo.php?script=sci_arttext&pid=S0365-66912004000700014&lang=pt" 
"S0365-66912004000700009-esp","Disección de la adventicia arterio-venosa en la oclusión de rama venosa retiniana con edema macular no isquémico","Asensio Sánchez, VM, Rodríguez Bravo, I, Botella Oltra, G","Archivos de la Sociedad Española de Oftalmología; 79(7); 347-352","Archivos de la Sociedad Española de Oftalmología","Espanhol","2004","http://scielo.isciii.es/scielo.php?script=sci_arttext&pid=S0365-66912004000700009&lang=pt" 
"S0365-66912004000700010-esp","Amaurosis tras implante de stent lacrimonasal","Bracamonte Bermejo, A, Lanciego Pérez, C","Archivos de la Sociedad Española de Oftalmología; 79(7); 353-356","Archivos de la Sociedad Española de Oftalmología","Espanhol","2004","http://scielo.isciii.es/scielo.php?script=sci_arttext&pid=S0365-66912004000700010&lang=pt" 
"S0365-66912004000700003-esp","Xalacom® y empeoramiento del vitíligo: ¿Relación causal?","Arnalich-Montiel, F, Lara-Medina, J, Muñoz-Negrete, FJ, Rebolleda, G","Archivos de la Sociedad Española de Oftalmología; 79(7); 315-316","Archivos de la Sociedad Española de Oftalmología","Espanhol","2004","http://scielo.isciii.es/scielo.php?script=sci_arttext&pid=S0365-66912004000700003&lang=pt" 
