"S0004-27492004000300012-scl","Retinopatia diabética em pacientes de um programa de atendimento multidisciplinar do Hospital das Clínicas de Ribeirão Preto - USP","Souza, Eduardo Vieira de, Souza, Nivaldo V. de, Rodrigues, Maria de Lourdes Veronese","Arquivos Brasileiros de Oftalmologia; 67(3); 433-436","Arquivos Brasileiros de Oftalmologia","Português","2004","http://www.scielo.br/scielo.php?script=sci_arttext&pid=S0004-27492004000300012&lang=pt" 
"S0004-27492004000300014-scl","Facoemulsificação, vitrectomia via pars plana e implante de lente intra-ocular em olhos com retinopatia diabética proliferativa","Mattos, Armando Belfort, Bonomo, Pedro Paulo de Oliveira, Freitas, Lincoln Lemes, Farah, Michel Eid, Flynn Jr, Harry, Pereira, Maurício Bastos","Arquivos Brasileiros de Oftalmologia; 67(3); 441-449","Arquivos Brasileiros de Oftalmologia","Português","2004","http://www.scielo.br/scielo.php?script=sci_arttext&pid=S0004-27492004000300014&lang=pt" 
"S0004-27492004000300020-scl","Trabeculectomia com mitomicina C em pacientes com glaucoma congênito refratário","Cronemberger, Sebastião, Santos, Daniel Vítor de Vasconcelos, Ramos, Luís Felipe Fornaciari, Oliveira, Ana Cláudia Monteiro, Maestrini, Heloísa Andrade, Calixto, Nassim","Arquivos Brasileiros de Oftalmologia; 67(3); 475-479","Arquivos Brasileiros de Oftalmologia","Português","2004","http://www.scielo.br/scielo.php?script=sci_arttext&pid=S0004-27492004000300020&lang=pt" 
"S0102-76382004000200012-scl","Emprego de sistemas robóticos na cirurgia cardiovascular","Sant&#039;Anna, Roberto T., Prates, Paulo R. L., Sant&#039;Anna, João Ricardo M., Prates, Paulo R., Kalil, Renato A. K., Santos, Diogo E., Nesralla, Ivo A.","Brazilian Journal of Cardiovascular Surgery; 19(2); 171-178","Brazilian Journal of Cardiovascular Surgery","Inglês, Português","2004","http://www.scielo.br/scielo.php?script=sci_arttext&pid=S0102-76382004000200012&lang=pt" 
"S0034-74932004000200001-cub","Protocolo de diagnóstico y tratamiento del cáncer tiroideo","González Fernández, Ramón, Infante Amorós, Adalberto, López Soto, María Victoria, De Dios Vidal, José M","Revista Cubana de Cirugía; 43(2); -","Revista Cubana de Cirugía","Espanhol","2004","http://scielo.sld.cu/scielo.php?script=sci_arttext&pid=S0034-74932004000200001&lang=pt" 
"S0034-74932004000200002-cub","Hamartoma de la mama","Pérez Vázquez, Mercedes, Santiago Pérez, Juana T, Rivera Valdespino, Amparo de la C, Beltrán Sánchez, Petra E","Revista Cubana de Cirugía; 43(2); -","Revista Cubana de Cirugía","Espanhol","2004","http://scielo.sld.cu/scielo.php?script=sci_arttext&pid=S0034-74932004000200002&lang=pt" 
"S0034-74932004000200003-cub","Mioplastia en el tratamiento de fístulas broncopleurales","Fuentes Valdés, Edelberto, Corona Mancebo, Sixto B, Ferrá Betancourt, Albio R, Martín González, Miguel A","Revista Cubana de Cirugía; 43(2); -","Revista Cubana de Cirugía","Espanhol","2004","http://scielo.sld.cu/scielo.php?script=sci_arttext&pid=S0034-74932004000200003&lang=pt" 
"S0034-74932004000200004-cub","Resultados del tratamiento quirúrgico de la patología nodular tiroidea en el Hospital “Hermanos Ameijeiras” (1995-2004)","González Fernández, Ramón, de Dios Vidal, José M, Salinas Graham, Jorge René, Infante Amorós, Adalberto, López Soto, María Victoria","Revista Cubana de Cirugía; 43(2); -","Revista Cubana de Cirugía","Espanhol","2004","http://scielo.sld.cu/scielo.php?script=sci_arttext&pid=S0034-74932004000200004&lang=pt" 
"S0034-74932004000200005-cub","Litiasis única en vesícula doble tratada con ondas de choque extracorpórea","Pérez González, Domingo, Scorza Sánchez, Carlos, de León Rubio, Nancy, Hernández Mulet, Hermidio","Revista Cubana de Cirugía; 43(2); -","Revista Cubana de Cirugía","Espanhol","2004","http://scielo.sld.cu/scielo.php?script=sci_arttext&pid=S0034-74932004000200005&lang=pt" 
"S0034-74932004000200006-cub","Criterios de selección para fragmentación de cálculos vesiculares por ondas de choque extracorpóreas","Pérez González, Domingo, Scorza Sánchez, Carlos, De León Rubio, Nancy, Hernández Mulet, Hermidio, Pérez Palenzuela, Javier","Revista Cubana de Cirugía; 43(2); -","Revista Cubana de Cirugía","Espanhol","2004","http://scielo.sld.cu/scielo.php?script=sci_arttext&pid=S0034-74932004000200006&lang=pt" 
"S0034-74932004000200007-cub","Intestino Corto","Socarrás Suárez, María Matilde, Bolet Astoviza, Miriam, Larrea Fabra, Martha","Revista Cubana de Cirugía; 43(2); -","Revista Cubana de Cirugía","Espanhol","2004","http://scielo.sld.cu/scielo.php?script=sci_arttext&pid=S0034-74932004000200007&lang=pt" 
"S0034-74932004000200009-cub","Un nuevo enfoque quirúrgico realizado en la herniorrafía inguinal","López Rodríguez, Pedro, López Rodríguez, Felipe, Puentes Rizo, Elisa, González, Olga León, Ochoa, Félix, Cruz García, Nicolás, Strachan, Jaime","Revista Cubana de Cirugía; 43(2); -","Revista Cubana de Cirugía","Espanhol","2004","http://scielo.sld.cu/scielo.php?script=sci_arttext&pid=S0034-74932004000200009&lang=pt" 
"S0034-74932004000200010-cub","Xenotransplante: Estado actual, limitantes y expectativas","Bazán Milián, Manuel, González Jiménez, Noel, Delgado Bereijo, Lourdes","Revista Cubana de Cirugía; 43(2); -","Revista Cubana de Cirugía","Espanhol","2004","http://scielo.sld.cu/scielo.php?script=sci_arttext&pid=S0034-74932004000200010&lang=pt" 
"S0034-74932004000200011-cub","Anestesia en la operación de Jatene, experiencia en el Cardiocentro del Hospital “William Soler”","de la Parte Pérez, Lincoln","Revista Cubana de Cirugía; 43(2); -","Revista Cubana de Cirugía","Espanhol","2004","http://scielo.sld.cu/scielo.php?script=sci_arttext&pid=S0034-74932004000200011&lang=pt" 
"S0034-74932004000200012-cub","Fístula esofagopleurocutánea de tercio medio: A propósito de un caso","Mederos Curbelo, Orestes N, Barrera Ortega, Juan C, Romero Díaz, Carlos A, Cantero Ronquillo, Alexis, Valdés Jiménez, Jesús","Revista Cubana de Cirugía; 43(2); -","Revista Cubana de Cirugía","Espanhol","2004","http://scielo.sld.cu/scielo.php?script=sci_arttext&pid=S0034-74932004000200012&lang=pt" 
"S0034-74932004000200013-cub","Acúfeno unilateral: Presentación de un caso","Alfonso Muñoz, Eulalia, Aguilar Fernández, Luis, Pérez González, Raquel","Revista Cubana de Cirugía; 43(2); -","Revista Cubana de Cirugía","Espanhol","2004","http://scielo.sld.cu/scielo.php?script=sci_arttext&pid=S0034-74932004000200013&lang=pt" 
"S0034-74932004000200008-cub","Reparación de hernias inguinoescrotales gigantes bilaterales con realización preoperatoria de neumoperitoneo","Vicario Benito del Valle, Eugenio, Fernández y Morales, Eduardo, Mazarro Valle, Alberto, Ugena Sánchez, Caridad, Fadel Mokhtar, Mohamed, Pinto Varela, J osé María","Revista Cubana de Cirugía; 43(2); -","Revista Cubana de Cirugía","Espanhol","2004","http://scielo.sld.cu/scielo.php?script=sci_arttext&pid=S0034-74932004000200008&lang=pt" 
"S1025-55832004000200001-per","","","Anales de la Facultad de Medicina; 65(2); 87-88","Anales de la Facultad de Medicina","Espanhol","2004","http://www.scielo.org.pe/scielo.php?script=sci_arttext&pid=S1025-55832004000200001&lang=pt" 
"S1025-55832004000200002-per","Estudio de los niveles plasmáticos de homocisteína, ácido fólico y vitamina B-12 en una población limeña de jóvenes adultos","Soberón, Mercedes, Charaja, Ada, Agüero, Ysela, Oriondo, Rosa, Sandoval, Miguel, Núñez, Marco","Anales de la Facultad de Medicina; 65(2); 89-96","Anales de la Facultad de Medicina","Espanhol","2004","http://www.scielo.org.pe/scielo.php?script=sci_arttext&pid=S1025-55832004000200002&lang=pt" 
"S1025-55832004000200003-per","Hábitos y trastornos del sueño en rotadores de turnos de trabajo en una fábrica de bebidas","Durand, Gerardo, Rey de Castro, Jorge","Anales de la Facultad de Medicina; 65(2); 97-102","Anales de la Facultad de Medicina","Espanhol","2004","http://www.scielo.org.pe/scielo.php?script=sci_arttext&pid=S1025-55832004000200003&lang=pt" 
"S1025-55832004000200004-per","Conocimiento y cumplimiento de medidas de bioseguridad en personal de enfermería. Hospital Nacional Almanzor Aguinaga. Chiclayo 2002","Soto, Víctor, Olano, Enrique","Anales de la Facultad de Medicina; 65(2); 103-110","Anales de la Facultad de Medicina","Espanhol","2004","http://www.scielo.org.pe/scielo.php?script=sci_arttext&pid=S1025-55832004000200004&lang=pt" 
"S1025-55832004000200005-per","Impacto del crecimiento industrial en la salud de los habitantes de una ciudad minera del Perú","Ramírez, Augusto, León, Teresita","Anales de la Facultad de Medicina; 65(2); 111-118","Anales de la Facultad de Medicina","Espanhol","2004","http://www.scielo.org.pe/scielo.php?script=sci_arttext&pid=S1025-55832004000200005&lang=pt" 
"S1025-55832004000200006-per","Interacción medicamentosa en Geriatría","Oscanoa, Teodoro","Anales de la Facultad de Medicina; 65(2); 119-126","Anales de la Facultad de Medicina","Espanhol","2004","http://www.scielo.org.pe/scielo.php?script=sci_arttext&pid=S1025-55832004000200006&lang=pt" 
"S1025-55832004000200007-per","Protocolo diagnóstico en fiebre de origen desconocido para países en vías de desarrollo","Romo, Jesús, Muñoz, Julián","Anales de la Facultad de Medicina; 65(2); 127-132","Anales de la Facultad de Medicina","Espanhol","2004","http://www.scielo.org.pe/scielo.php?script=sci_arttext&pid=S1025-55832004000200007&lang=pt" 
"S1025-55832004000200008-per","Hidrops fetalis no immune: a propósito de un caso","Cárdenas, Joel, Huertas, Erasmo, Oré, Ismenia, Carbajal, Semiramis","Anales de la Facultad de Medicina; 65(2); 133-137","Anales de la Facultad de Medicina","Espanhol","2004","http://www.scielo.org.pe/scielo.php?script=sci_arttext&pid=S1025-55832004000200008&lang=pt" 
"S1025-55832004000200009-per","Cistitis hemorrágica relacionada al trasplante de médula ósea: primer reporte de casos en el país","Nunura, Juan, Navarro, Juan","Anales de la Facultad de Medicina; 65(2); 138-146","Anales de la Facultad de Medicina","Espanhol","2004","http://www.scielo.org.pe/scielo.php?script=sci_arttext&pid=S1025-55832004000200009&lang=pt" 
"S1025-55832004000200010-per","Carlos Gutiérrez-Noriega y su contribución a la Escuela Médica Peruana","Ayala, Salomón, Arellano, Pedro","Anales de la Facultad de Medicina; 65(2); 147-153","Anales de la Facultad de Medicina","Espanhol","2004","http://www.scielo.org.pe/scielo.php?script=sci_arttext&pid=S1025-55832004000200010&lang=pt" 
"S1025-55832004000200011-per","Aporte de la Anatomía para la cirugía de la hernioplastia por laparoscopía en hernias inguino-femorales: anatomía &quot;Interior-Exterior&quot;","Cabrera, Germán","Anales de la Facultad de Medicina; 65(2); 154-155","Anales de la Facultad de Medicina","Espanhol","2004","http://www.scielo.org.pe/scielo.php?script=sci_arttext&pid=S1025-55832004000200011&lang=pt" 
"S0123-59232004000200002-col","MODELOS PARA EL ANÁLISIS Y DIAGNÓSTICO DE EQUIPOS DE TRABAJO","FRANCO GUTIÉRREZ, CARLOS ALBERTO","Estudios Gerenciales; 20(91); 35-48","Estudios Gerenciales","Espanhol","2004","http://www.scielo.org.co/scielo.php?script=sci_arttext&pid=S0123-59232004000200002&lang=pt" 
"S0123-59232004000200003-col","LA CONVENCIÓN DE LAS NACIONES UNIDAS SOBRE LOS CONTRATOS DE COMPRAVENTA INTERNACIONAL DE MERCADERÍAS","GALÁN BARRERA, DIEGO RICARDO","Estudios Gerenciales; 20(91); 49-64","Estudios Gerenciales","Espanhol","2004","http://www.scielo.org.co/scielo.php?script=sci_arttext&pid=S0123-59232004000200003&lang=pt" 
"S0123-59232004000200001-col","DIFFERENT LEGISLATIONS REGARDING OPAs","FUENZALIDA, DARCY, NASH, MAURICIO","Estudios Gerenciales; 20(91); 13-34","Estudios Gerenciales","Inglês","2004","http://www.scielo.org.co/scielo.php?script=sci_arttext&pid=S0123-59232004000200001&lang=pt" 
"S0123-59232004000200004-col","UPDATING BELIEFS: ARE ECONOMIC AGENTS INSPIRED BY RATIONAL ACTION OR ACCORDING TO ONES HOPES AND FEARS?","GONZÁLEZ, NATALIA, FUKANO, SACHIKO, BENÍTEZ, EDGAR ORLANDO","Estudios Gerenciales; 20(91); 65-87","Estudios Gerenciales","Inglês","2004","http://www.scielo.org.co/scielo.php?script=sci_arttext&pid=S0123-59232004000200004&lang=pt" 
"S0102-76382004000200001-scl","Palavras do Prof. Dr. Domingo M. Braile","Braile, Domingo","Brazilian Journal of Cardiovascular Surgery; 19(2); -","Brazilian Journal of Cardiovascular Surgery","Inglês, Português","2004","http://www.scielo.br/scielo.php?script=sci_arttext&pid=S0102-76382004000200001&lang=pt" 
"S0102-76382004000200017-scl","Cartas ao Editor","","Brazilian Journal of Cardiovascular Surgery; 19(2); 190-191","Brazilian Journal of Cardiovascular Surgery","Inglês, Português","2004","http://www.scielo.br/scielo.php?script=sci_arttext&pid=S0102-76382004000200017&lang=pt" 
"S0102-76382004000200016-scl","Caso 4/2004","Croti, Ulisses Alexandre, Braile, Domingo Marcolino, Maisano, Ana Carolina Leiroz Ferreira Botelho, Selig, Fábio Augusto","Brazilian Journal of Cardiovascular Surgery; 19(2); 188-189","Brazilian Journal of Cardiovascular Surgery","Inglês, Português","2004","http://www.scielo.br/scielo.php?script=sci_arttext&pid=S0102-76382004000200016&lang=pt" 
"S0102-76382004000200015-scl","Caso 3/2004","Croti, Ulisses Alexandre, Braile, Domingo Marcolino, Fernandes, Márcio Pimentel, Godoy, Moacir Fernandes de","Brazilian Journal of Cardiovascular Surgery; 19(2); 186-187","Brazilian Journal of Cardiovascular Surgery","Inglês, Português","2004","http://www.scielo.br/scielo.php?script=sci_arttext&pid=S0102-76382004000200015&lang=pt" 
"S0102-76382004000200003-scl","Estudo clínico e epidemiológico de pacientes submetidos a implante de marcapasso cardíaco artificial permanente: comparação dos portadores da doença de Chagas com os de doenças degenerativas do sistema de condução","Costa, Roberto, Rassi, Anis, Leão, Maria Inês de Paula","Brazilian Journal of Cardiovascular Surgery; 19(2); 107-114","Brazilian Journal of Cardiovascular Surgery","Inglês, Português","2004","http://www.scielo.br/scielo.php?script=sci_arttext&pid=S0102-76382004000200003&lang=pt" 
"S0102-76382004000200004-scl","Resultados da operação reconstrutora da valva mitral em pacientes com idade inferior a 15 anos","Cordeiro, Celso O., Gregori Jr., Francisco, Gregori, Thelma Elisa F., Murakami, Alexandre N., Abrão, Adriana","Brazilian Journal of Cardiovascular Surgery; 19(2); 115-119","Brazilian Journal of Cardiovascular Surgery","Inglês, Português","2004","http://www.scielo.br/scielo.php?script=sci_arttext&pid=S0102-76382004000200004&lang=pt" 
"S0102-76382004000200005-scl","Nova abordagem técnica e eletrofisiológica para tratamento da fibrilação atrial","Gomes, Otoni Moreira, Gomes, Eros Silva","Brazilian Journal of Cardiovascular Surgery; 19(2); 120-125","Brazilian Journal of Cardiovascular Surgery","Inglês, Português","2004","http://www.scielo.br/scielo.php?script=sci_arttext&pid=S0102-76382004000200005&lang=pt" 
"S0102-76382004000200006-scl","Alterações estruturais e moleculares (cDNA) precoces em veias safenas humanas cultivadas sob regime pressórico arterial","Dallan, Luís Alberto O., Miyakawa, Ayumi A., Lisboa, Luiz Augusto, Abreu Filho, Carlos Alberto, Campos, Luciene, Borin, Thaiz, Krieger, José Eduardo, Oliveira, Sérgio Almeida de","Brazilian Journal of Cardiovascular Surgery; 19(2); 126-135","Brazilian Journal of Cardiovascular Surgery","Inglês, Português","2004","http://www.scielo.br/scielo.php?script=sci_arttext&pid=S0102-76382004000200006&lang=pt" 
"S0102-76382004000200007-scl","Estudo da função ventricular na técnica de plicatura da parede livre do ventrículo esquerdo em cães","Andrade, James Newton Bizetto Meira de, Camacho, Aparecido Antonio, Santos, Paulo Sérgio Patto, Fantinatti, Alexandra Pinheiro, Nunes, Newton, Stopiglia, Ângelo João, Leal, João Carlos, Braile, Domingo Marcolino","Brazilian Journal of Cardiovascular Surgery; 19(2); 136-143","Brazilian Journal of Cardiovascular Surgery","Inglês, Português","2004","http://www.scielo.br/scielo.php?script=sci_arttext&pid=S0102-76382004000200007&lang=pt" 
"S0102-76382004000200008-scl","Endotelização in vivo das biopróteses cardíacas: preservação convencional versus não-aldeídica","Nina, Vinicius José da Silva, Pomerantzeff, Pablo Maria Alberto, Casagrande, Ivan Sérgio Joviano, Chung, David, Brandão, Carlos Manuel de Almeida, Nascimento, Sérgio Antonio Barbosa do, Benvenuti, Luiz Alberto, Oliveira, Sérgio Almeida de","Brazilian Journal of Cardiovascular Surgery; 19(2); 144-151","Brazilian Journal of Cardiovascular Surgery","Inglês, Português","2004","http://www.scielo.br/scielo.php?script=sci_arttext&pid=S0102-76382004000200008&lang=pt" 
"S0102-76382004000200010-scl","Análise comparativa dos efeitos do diazepam, midazolam, propofol e etomidato na contratilidade miocárdica e no fluxo coronariano: estudo em corações isolados de ratos","Medeiros, Carlos Geraldo Sobral de, Pontes, José Carlos Dorsa Vieira, Gomes, Otoni Moreira, Silva, Luiz Paulo Rangel Gomes da","Brazilian Journal of Cardiovascular Surgery; 19(2); 157-164","Brazilian Journal of Cardiovascular Surgery","Inglês, Português","2004","http://www.scielo.br/scielo.php?script=sci_arttext&pid=S0102-76382004000200010&lang=pt" 
"S0102-76382004000200011-scl","Preditores de mediastinite em cirurgia cardíaca","Guaragna, João Carlos, Facchi, Luciane Maria, Baião, Carolina Guerra, Cruz, Ivana Beatrice Mânica da, Bodanese, Luiz Carlos, Albuquerque, Luciano, Petracco, João Batista, Goldani, Marco Antônio","Brazilian Journal of Cardiovascular Surgery; 19(2); 165-170","Brazilian Journal of Cardiovascular Surgery","Inglês, Português","2004","http://www.scielo.br/scielo.php?script=sci_arttext&pid=S0102-76382004000200011&lang=pt" 
"S0102-76382004000200009-scl","Obtenção minimamente invasiva de veia safena para cirurgia de revascularização do miocárdio","Martins, Antônio S., Andrade, Rubens R., Silva, Marcos A. Moraes, Oliveira, Reinaldo A., Campos, Nelson L. K., Mola, Ricardo de, Souza, Ademar R., Vidotto, Júlio, Padovani, Carlos","Brazilian Journal of Cardiovascular Surgery; 19(2); 152-156","Brazilian Journal of Cardiovascular Surgery","Inglês, Português","2004","http://www.scielo.br/scielo.php?script=sci_arttext&pid=S0102-76382004000200009&lang=pt" 
"S0102-76382004000200002-scl","Situação das cirurgias cardíacas congênitas no Brasil","Pinto Júnior, Valdester Cavalcante, Daher, Christianne Valença, Sallum, Fábio Said, Jatene, Marcelo Biscegli, Croti, Ulisses Alexandre","Brazilian Journal of Cardiovascular Surgery; 19(2); -","Brazilian Journal of Cardiovascular Surgery","Inglês, Português","2004","http://www.scielo.br/scielo.php?script=sci_arttext&pid=S0102-76382004000200002&lang=pt" 
"S0102-76382004000200014-scl","Tratamento cirúrgico do túnel ventrículo esquerdo-aorta","Caliani, José Alberto, Gouvêa, Flávio Reis, Simões, Luiz Carlos, Dorigo, Ana Helena, Porto, Erika, Neves, Flávio Reis, Barbosa, Odilon Nogueira","Brazilian Journal of Cardiovascular Surgery; 19(2); 183-185","Brazilian Journal of Cardiovascular Surgery","Inglês, Português","2004","http://www.scielo.br/scielo.php?script=sci_arttext&pid=S0102-76382004000200014&lang=pt" 
"S0102-76382004000200013-scl","Dissecção endoscópica da artéria torácica interna com auxílio robótico","Prates, Paulo R .L., Sant&#039;Anna, Roberto T., Nesralla, Ivo A.","Brazilian Journal of Cardiovascular Surgery; 19(2); 179-182","Brazilian Journal of Cardiovascular Surgery","Inglês, Português","2004","http://www.scielo.br/scielo.php?script=sci_arttext&pid=S0102-76382004000200013&lang=pt" 
"S0102-88392004000200001-scl","Nota do editor","","São Paulo em Perspectiva; 18(2); -","São Paulo em Perspectiva","Português","2004","http://www.scielo.br/scielo.php?script=sci_arttext&pid=S0102-88392004000200001&lang=pt" 
"S0102-88392004000200012-scl","Direito público subjetivo e políticas educacionais","Duarte, Clarice Seixas","São Paulo em Perspectiva; 18(2); 113-118","São Paulo em Perspectiva","Português","2004","http://www.scielo.br/scielo.php?script=sci_arttext&pid=S0102-88392004000200012&lang=pt" 
"S0102-88392004000200006-scl","A organização da política social do governo Fernando Henrique","Tiezzi, Sergio","São Paulo em Perspectiva; 18(2); 49-56","São Paulo em Perspectiva","Português","2004","http://www.scielo.br/scielo.php?script=sci_arttext&pid=S0102-88392004000200006&lang=pt" 
"S0102-88392004000200005-scl","Sustentabilidade, o desafio das políticas sociais no século 21","Cardoso, Ruth","São Paulo em Perspectiva; 18(2); 42-48","São Paulo em Perspectiva","Português","2004","http://www.scielo.br/scielo.php?script=sci_arttext&pid=S0102-88392004000200005&lang=pt" 
"S0102-88392004000200002-scl","Proteção social na periferia do capitalismo: considerações sobre o Brasil","Pochmann, Marcio","São Paulo em Perspectiva; 18(2); 3-16","São Paulo em Perspectiva","Português","2004","http://www.scielo.br/scielo.php?script=sci_arttext&pid=S0102-88392004000200002&lang=pt" 
"S0102-88392004000200003-scl","Federalismo e políticas sociais no Brasil: problemas de coordenação e autonomia","Arretche, Marta","São Paulo em Perspectiva; 18(2); 17-26","São Paulo em Perspectiva","Português","2004","http://www.scielo.br/scielo.php?script=sci_arttext&pid=S0102-88392004000200003&lang=pt" 
"S0102-88392004000200004-scl","Governos locais e gestão de políticas sociais universais","Souza, Celina","São Paulo em Perspectiva; 18(2); 27-41","São Paulo em Perspectiva","Português","2004","http://www.scielo.br/scielo.php?script=sci_arttext&pid=S0102-88392004000200004&lang=pt" 
"S0102-88392004000200007-scl","A reconversão do social: dilemas da redistribuição no tratamento focalizado","Ivo, Anete Brito Leal","São Paulo em Perspectiva; 18(2); 57-67","São Paulo em Perspectiva","Português","2004","http://www.scielo.br/scielo.php?script=sci_arttext&pid=S0102-88392004000200007&lang=pt" 
"S0102-88392004000200008-scl","Política social no Brasil: prioridades erradas, incentivos perversos","Camargo, José Márcio","São Paulo em Perspectiva; 18(2); 68-77","São Paulo em Perspectiva","Português","2004","http://www.scielo.br/scielo.php?script=sci_arttext&pid=S0102-88392004000200008&lang=pt" 
"S0102-88392004000200009-scl","A improvisação na concepção de programas sociais: muitas convicções, poucas constatações - o caso do primeiro emprego","Madeira, Felícia Reicher","São Paulo em Perspectiva; 18(2); 78-94","São Paulo em Perspectiva","Português","2004","http://www.scielo.br/scielo.php?script=sci_arttext&pid=S0102-88392004000200009&lang=pt" 
"S0102-88392004000200010-scl","Políticas públicas e desenvolvimento social rural","Gehlen, Ivaldo","São Paulo em Perspectiva; 18(2); 95-103","São Paulo em Perspectiva","Português","2004","http://www.scielo.br/scielo.php?script=sci_arttext&pid=S0102-88392004000200010&lang=pt" 
"S0102-88392004000200011-scl","O programa fome zero no contexto das políticas sociais brasileiras","Yasbek, Maria Carmelita","São Paulo em Perspectiva; 18(2); 104-112","São Paulo em Perspectiva","Português","2004","http://www.scielo.br/scielo.php?script=sci_arttext&pid=S0102-88392004000200011&lang=pt" 
"S0103-65642004000100010-scl","Lembranças, Luiz Carlos Nogueira","Pedrosa, Maria Aparecida de Luna","Psicologia USP; 15(1-2); 51-53","Psicologia USP","Português","2004","http://www.scielo.br/scielo.php?script=sci_arttext&pid=S0103-65642004000100010&lang=pt" 
"S0103-65642004000100009-scl","Meu caro professor","Loffredo, Ana Maria","Psicologia USP; 15(1-2); 49-50","Psicologia USP","Português","2004","http://www.scielo.br/scielo.php?script=sci_arttext&pid=S0103-65642004000100009&lang=pt" 
"S0103-65642004000100008-scl","Luiz Carlos Nogueira: o testemunho de um compromisso ético com a psicanálise","Dunker, Christian Ingo Lenz","Psicologia USP; 15(1-2); 45-48","Psicologia USP","Português","2004","http://www.scielo.br/scielo.php?script=sci_arttext&pid=S0103-65642004000100008&lang=pt" 
"S0103-65642004000100005-scl","Luiz Carlos Nogueira: psicanálise no IP-USP e no Brasil","","Psicologia USP; 15(1-2); 31-34","Psicologia USP","Português","2004","http://www.scielo.br/scielo.php?script=sci_arttext&pid=S0103-65642004000100005&lang=pt" 
"S0103-65642004000100027-scl","Lacan e Hegel","Torres, Ronaldo","Psicologia USP; 15(1-2); 309-320","Psicologia USP","Português","2004","http://www.scielo.br/scielo.php?script=sci_arttext&pid=S0103-65642004000100027&lang=pt" 
"S0103-65642004000100026-scl","A Chinela Turca: desejo e gozo na fantasia","Meirelles, Carlos Eduardo Frazão","Psicologia USP; 15(1-2); 295-308","Psicologia USP","Português","2004","http://www.scielo.br/scielo.php?script=sci_arttext&pid=S0103-65642004000100026&lang=pt" 
"S0103-65642004000100025-scl","O real na psicose","Herrmann, Maurício Castejón","Psicologia USP; 15(1-2); 279-293","Psicologia USP","Português","2004","http://www.scielo.br/scielo.php?script=sci_arttext&pid=S0103-65642004000100025&lang=pt" 
"S0103-65642004000100024-scl","A gramática do corpo e a escrita do nome","Masagão, Andrea Menezes","Psicologia USP; 15(1-2); 263-277","Psicologia USP","Português","2004","http://www.scielo.br/scielo.php?script=sci_arttext&pid=S0103-65642004000100024&lang=pt" 
"S0103-65642004000100019-scl","A &#039;verdade&#039; da ciência a partir de uma leitura psicanalítica","Sanada, Elizabeth dos Reis","Psicologia USP; 15(1-2); 183-194","Psicologia USP","Português","2004","http://www.scielo.br/scielo.php?script=sci_arttext&pid=S0103-65642004000100019&lang=pt" 
"S0103-65642004000100014-scl","Antes e depois de meu encontro com Lacan: Paris - Julho de 1977","","Psicologia USP; 15(1-2); 109-113","Psicologia USP","Português","2004","http://www.scielo.br/scielo.php?script=sci_arttext&pid=S0103-65642004000100014&lang=pt" 
