"S0102-09352004000300002-scl","Utilização de hidrocortisona em eqüinos submetidos a isquemia e reperfusão no jejuno e suas conseqüências sobre o cório laminar","Rio Tinto, J.J.M., Alves, G.E.S., Faleiros, R.R., Santos, R.L., Marques Júnior, A.P., Melo, E.G.","Arquivo Brasileiro de Medicina Veterinária e Zootecnia; 56(3); 292-299","Arquivo Brasileiro de Medicina Veterinária e Zootecnia","Português","2004","http://www.scielo.br/scielo.php?script=sci_arttext&pid=S0102-09352004000300002&lang=pt" 
"S0102-09352004000300012-scl","Influência da diferença cátion-aniônica da dieta sobre o balanço de cálcio, fósforo e magnésio em ovinos","Gomide, C.A., Zanetti, M.A., Penteado, M.V.C., Carrer, C.R.O., Del Claro, G.R., Netto, A.S.","Arquivo Brasileiro de Medicina Veterinária e Zootecnia; 56(3); 363-369","Arquivo Brasileiro de Medicina Veterinária e Zootecnia","Português","2004","http://www.scielo.br/scielo.php?script=sci_arttext&pid=S0102-09352004000300012&lang=pt" 
"S0004-27302004000300006-scl","Ausência de efeito hipolipemiante da Solanum melongena L. (berinjela) em pacientes hiperlipidêmicos","Silva, Gisleine E.C. da, Takahashi, Miriam H., Eik Filho, Wilson, Albino, Cláudio C., Tasim, Gilsom E., Serri, Letícia de A.F., Assef, Abdol H., Cortez, Diógenes A.G., Bazotte, Roberto B.","Arquivos Brasileiros de Endocrinologia &amp; Metabologia; 48(3); 368-373","Arquivos Brasileiros de Endocrinologia &amp; Metabologia","Português","2004","http://www.scielo.br/scielo.php?script=sci_arttext&pid=S0004-27302004000300006&lang=pt" 
"S0004-27302004000300008-scl","Repercussões da persistência de grandes remanescentes tireoideanos após tireoidectomia bilateral para carcinoma diferenciado de tireóide","Rosário, Pedro Weslley S., Cardoso, Ludmilla David, Barroso, Álvaro, Padrão, Eduardo L., Rezende, Leonardo, Purisch, Saulo","Arquivos Brasileiros de Endocrinologia &amp; Metabologia; 48(3); 379-383","Arquivos Brasileiros de Endocrinologia &amp; Metabologia","Português","2004","http://www.scielo.br/scielo.php?script=sci_arttext&pid=S0004-27302004000300008&lang=pt" 
"S0004-27302004000300009-scl","Valor da varredura com radioiodo em pacientes com carcinoma diferenciado de tireóide de moderado / alto risco com tireoglobulina (sem tiroxina) indetectável após o tratamento inicial","Rosário, Pedro Weslley S., Cardoso, Ludmilla David, Fagundes, Tales Alvarenga, Reis, Janice Sepúlveda, Maia, Frederico F. Ribeiro, Purisch, Saulo","Arquivos Brasileiros de Endocrinologia &amp; Metabologia; 48(3); 384-388","Arquivos Brasileiros de Endocrinologia &amp; Metabologia","Português","2004","http://www.scielo.br/scielo.php?script=sci_arttext&pid=S0004-27302004000300009&lang=pt" 
"S0004-27302004000300012-scl","Pé diabético: análise bacteriológica de 141 casos","Carvalho, Cibele B.M., M. Neto, Renato, Aragão, Luciana P., Oliveira, Margarida M., Nogueira, Marcelo B., Forti, Adriana C.","Arquivos Brasileiros de Endocrinologia &amp; Metabologia; 48(3); 398-405","Arquivos Brasileiros de Endocrinologia &amp; Metabologia","Português","2004","http://www.scielo.br/scielo.php?script=sci_arttext&pid=S0004-27302004000300012&lang=pt" 
"S0004-27302004000300014-scl","Linfoma não-Hodgkin em tireóide: relato de caso","Azambuja, Evandro de, Azevedo, Sérgio Jobim de, Moreira, Roger, Castro, Rodrigo C. Leite de","Arquivos Brasileiros de Endocrinologia &amp; Metabologia; 48(3); 414-418","Arquivos Brasileiros de Endocrinologia &amp; Metabologia","Português","2004","http://www.scielo.br/scielo.php?script=sci_arttext&pid=S0004-27302004000300014&lang=pt" 
"S0034-71402004000200003-scl","Desigualdade salarial entre raças no mercado de trabalho urbano brasileiro: aspectos regionais","Campante, Filipe R., Crespo, Anna R. V., Leite, Phillippe G. P. G.","Revista Brasileira de Economia; 58(2); 185-210","Revista Brasileira de Economia","Português","2004","http://www.scielo.br/scielo.php?script=sci_arttext&pid=S0034-71402004000200003&lang=pt" 
"S0034-71402004000200004-scl","The provision of education and its impacts on college premium in Brazil","Ferreira, Sergio Guimarães","Revista Brasileira de Economia; 58(2); 211-233","Revista Brasileira de Economia","Inglês","2004","http://www.scielo.br/scielo.php?script=sci_arttext&pid=S0034-71402004000200004&lang=pt" 
"S0034-71402004000200006-scl","Um estudo sobre retorno em escolaridade no Brasil","Sachsida, Adolfo, Loureiro, Paulo Roberto Amorim, Mendonça, Mário Jorge Cardoso de","Revista Brasileira de Economia; 58(2); 249-265","Revista Brasileira de Economia","Português","2004","http://www.scielo.br/scielo.php?script=sci_arttext&pid=S0034-71402004000200006&lang=pt" 
"S0034-71402004000200007-scl","Avaliação do diferencial de salários na agropecuária brasileira: período de 1966 a 2002","Staduto, Jefferson Andronio Ramundo, Bacchi, Mirian Rumenos Piedade, Bacha, Carlos José Caetano","Revista Brasileira de Economia; 58(2); 267-295","Revista Brasileira de Economia","Português","2004","http://www.scielo.br/scielo.php?script=sci_arttext&pid=S0034-71402004000200007&lang=pt" 
"S0034-71402004000200002-scl","Filiação industrial e diferencial de salários no Brasil","Arbache, Jorge Saba, De Negri, João Alberto","Revista Brasileira de Economia; 58(2); 159-184","Revista Brasileira de Economia","Português","2004","http://www.scielo.br/scielo.php?script=sci_arttext&pid=S0034-71402004000200002&lang=pt" 
"S0004-27302004000300019-scl","Tireóide ou tiróide","Dias, José Côdo Albino","Arquivos Brasileiros de Endocrinologia &amp; Metabologia; 48(3); 431-431","Arquivos Brasileiros de Endocrinologia &amp; Metabologia","Português","2004","http://www.scielo.br/scielo.php?script=sci_arttext&pid=S0004-27302004000300019&lang=pt" 
"S0004-27302004000300018-scl","Níveis de testosterona sérica elevados em mulheres: necessidade de confirmação com diferentes metodologias","Vieira, José Gilberto H., Ferrer, Cláudia Maria, Ghiringhello, Maria Teresa, Nakamura, Odete, Hauache, Omar Magid","Arquivos Brasileiros de Endocrinologia &amp; Metabologia; 48(3); 429-429","Arquivos Brasileiros de Endocrinologia &amp; Metabologia","Português","2004","http://www.scielo.br/scielo.php?script=sci_arttext&pid=S0004-27302004000300018&lang=pt" 
"S0004-27302004000300017-scl","Classificação do carcinoma diferenciado de tireóide baseada no prognóstico. Qual e quando usar?","Rosário, Pedro Weslley S. do","Arquivos Brasileiros de Endocrinologia &amp; Metabologia; 48(3); 427-428","Arquivos Brasileiros de Endocrinologia &amp; Metabologia","Português","2004","http://www.scielo.br/scielo.php?script=sci_arttext&pid=S0004-27302004000300017&lang=pt" 
"S0004-27302004000300003-scl","UCP-3: regulação da expressão gênica no músculo esquelético e possível relação com o controle do peso corporal","Depieri, Tatiane Z., Pinto, Roberta R., Catarin, Juliana K., Carli, Magda C.L. de, Garcia Júnior, Jair R.","Arquivos Brasileiros de Endocrinologia &amp; Metabologia; 48(3); 337-344","Arquivos Brasileiros de Endocrinologia &amp; Metabologia","Português","2004","http://www.scielo.br/scielo.php?script=sci_arttext&pid=S0004-27302004000300003&lang=pt" 
"S0004-27302004000300015-scl","HELLP síndrome associada à síndrome de Cushing: relato de dois casos","Castro, Rodrigo F., Maia, Frederico F.R., Ferreira, Antônio R., Purisch, Saulo, Calsolari, Maria R., Menezes, Patrícia A.F.C., Victória, Ivana Maria N.","Arquivos Brasileiros de Endocrinologia &amp; Metabologia; 48(3); 419-422","Arquivos Brasileiros de Endocrinologia &amp; Metabologia","Português","2004","http://www.scielo.br/scielo.php?script=sci_arttext&pid=S0004-27302004000300015&lang=pt" 
"S0004-27302004000300020-scl","Tiróide, tireóide","Rezende, Joffre M. de","Arquivos Brasileiros de Endocrinologia &amp; Metabologia; 48(3); 432-434","Arquivos Brasileiros de Endocrinologia &amp; Metabologia","Português","2004","http://www.scielo.br/scielo.php?script=sci_arttext&pid=S0004-27302004000300020&lang=pt" 
"S0004-27302004000300004-scl","Avaliação do estado nutricional de adultos e idosos e situação nutricional da população brasileira","Acuña, Kátia, Cruz, Thomaz","Arquivos Brasileiros de Endocrinologia &amp; Metabologia; 48(3); 345-361","Arquivos Brasileiros de Endocrinologia &amp; Metabologia","Português","2004","http://www.scielo.br/scielo.php?script=sci_arttext&pid=S0004-27302004000300004&lang=pt" 
"S0104-44782004000100014-scl","A revolução de 1964 e o movimento militar no paraná: a visão da caserna","Dutra, José Carlos","Revista de Sociologia e Política; (22); 195-208","Revista de Sociologia e Política","Português","2004","http://www.scielo.br/scielo.php?script=sci_arttext&pid=S0104-44782004000100014&lang=pt" 
"S0104-44782004000100013-scl","A eleição presidencial de 2002: uma análise preliminar do processo e dos resultados eleitorais","Carreirão, Yan","Revista de Sociologia e Política; (22); 179-194","Revista de Sociologia e Política","Português","2004","http://www.scielo.br/scielo.php?script=sci_arttext&pid=S0104-44782004000100013&lang=pt" 
"S0104-44782004000100004-scl","Campanhas eleitorais em sociedades midiáticas: articulando e revisando conceitos","Ribeiro, Pedro José Floriano","Revista de Sociologia e Política; (22); 25-43","Revista de Sociologia e Política","Português","2004","http://www.scielo.br/scielo.php?script=sci_arttext&pid=S0104-44782004000100004&lang=pt" 
"S0104-44782004000100005-scl","Palanque eletrônico em eleições locais: aspectos do acesso dos municípios ao HGPE na televisão","Jardim, Márcia","Revista de Sociologia e Política; (22); 45-58","Revista de Sociologia e Política","Português","2004","http://www.scielo.br/scielo.php?script=sci_arttext&pid=S0104-44782004000100005&lang=pt" 
"S0104-44782004000100006-scl","As rádios comunitárias nas campanhas eleitorais: exercício da cidadania ou instrumentalização (1998-2000)","Nunes, Márcia Vidal","Revista de Sociologia e Política; (22); 59-76","Revista de Sociologia e Política","Português","2004","http://www.scielo.br/scielo.php?script=sci_arttext&pid=S0104-44782004000100006&lang=pt" 
"S0104-44782004000100010-scl","Representação das associações profissionais no Brasil: o debate dos anos 1930","Barreto, Alvaro Augusto de Borba","Revista de Sociologia e Política; (22); 119-133","Revista de Sociologia e Política","Português","2004","http://www.scielo.br/scielo.php?script=sci_arttext&pid=S0104-44782004000100010&lang=pt" 
"S0104-44782004000100011-scl","¿Populismos reciclados o neoliberalismo a secas? El mito del &quot;neopopulismo&quot; latinoamericano","Vilas, Carlos M.","Revista de Sociologia e Política; (22); 135-151","Revista de Sociologia e Política","Espanhol","2004","http://www.scielo.br/scielo.php?script=sci_arttext&pid=S0104-44782004000100011&lang=pt" 
"S0104-44782004000100012-scl","A política cotidiana dos vereadores e as relações entre executivo e legislativo em âmbito municipal: o caso do município de Araruama","Lopez, Felix G.","Revista de Sociologia e Política; (22); 153-177","Revista de Sociologia e Política","Português","2004","http://www.scielo.br/scielo.php?script=sci_arttext&pid=S0104-44782004000100012&lang=pt" 
"S0100-84042004000200004-scl","Female gametophyte development in Adesmia latifolia (Spreng.) Vog. (Leguminosae - Papilionoideae)","Moço, Maria C.C., Mariath, Jorge E.A.","Brazilian Journal of Botany; 27(2); 241-248","Brazilian Journal of Botany","Inglês","2004","http://www.scielo.br/scielo.php?script=sci_arttext&pid=S0100-84042004000200004&lang=pt" 
"S0100-84042004000200012-scl","Croton faroensis, uma nova Euphorbiaceae da Amazônia brasileira","Secco, Ricardo de S.","Brazilian Journal of Botany; 27(2); 333-335","Brazilian Journal of Botany","Português","2004","http://www.scielo.br/scielo.php?script=sci_arttext&pid=S0100-84042004000200012&lang=pt" 
"S0100-84042004000200001-scl","Atividade da celulase de fungos isolados do solo da Estação Ecológica de Juréia-Itatins, São Paulo, Brasil","Ruegger, Marcelo J.S., Tauk-Tornisielo, Sâmia M.","Brazilian Journal of Botany; 27(2); 205-211","Brazilian Journal of Botany","Português","2004","http://www.scielo.br/scielo.php?script=sci_arttext&pid=S0100-84042004000200001&lang=pt" 
"S0100-84042004000200003-scl","Morfoanatomia do sistema caulinar de Canna edulis Kerr-Gawler (Cannaceae)","Alonso, Alexandre A., Moraes-Dallaqua, Marina A.","Brazilian Journal of Botany; 27(2); 229-239","Brazilian Journal of Botany","Português","2004","http://www.scielo.br/scielo.php?script=sci_arttext&pid=S0100-84042004000200003&lang=pt" 
"S0100-84042004000200006-scl","Purificação e caracterização parcial de uma lectina da alga marinha vermelha Vidalia obtusiloba C. Agardh","Melo, Fábio R., Benevides, Norma M.B., Pereira, Maria G., Holanda, Márjory L., Mendes, Francisca N.P., Oliveira, Stélio R.M., Freitas, Ana L.P., Silva, Luana M.C.M.","Brazilian Journal of Botany; 27(2); 263-269","Brazilian Journal of Botany","Português","2004","http://www.scielo.br/scielo.php?script=sci_arttext&pid=S0100-84042004000200006&lang=pt" 
"S0100-84042004000200007-scl","Anatomia do lenho de Croton urucurana Baill. (Euphorbiaceae) de solos com diferentes níveis de umidade","Luchi, Agnes E.","Brazilian Journal of Botany; 27(2); 271-280","Brazilian Journal of Botany","Português","2004","http://www.scielo.br/scielo.php?script=sci_arttext&pid=S0100-84042004000200007&lang=pt" 
"S0100-84042004000200008-scl","O gênero Pythium Pringsheim de áreas de cerrado no Estado de São Paulo, Brasil","Baptista, Filipe R., Pires-Zottarelli, Carmen L.A., Rocha, Maristela, Milanez, Adauto I.","Brazilian Journal of Botany; 27(2); 281-290","Brazilian Journal of Botany","Português","2004","http://www.scielo.br/scielo.php?script=sci_arttext&pid=S0100-84042004000200008&lang=pt" 
"S0100-84042004000200010-scl","Ecologia morfofuncional de plântulas de espécies arbóreas da Estação Ecológica do Panga, Uberlândia, Minas Gerais","Ressel, Kaila, Guilherme, Frederico A.G., Schiavini, Ivan, Oliveira, Paulo E.","Brazilian Journal of Botany; 27(2); 311-323","Brazilian Journal of Botany","Português","2004","http://www.scielo.br/scielo.php?script=sci_arttext&pid=S0100-84042004000200010&lang=pt" 
"S0100-84042004000200011-scl","Effect of nitrate and ammonium on the growth and protein concentration of Microcystis viridis Lemmermann (Cyanobacteria)","Rückert, Gabriela Von, Giani, Alessandra","Brazilian Journal of Botany; 27(2); 325-331","Brazilian Journal of Botany","Inglês","2004","http://www.scielo.br/scielo.php?script=sci_arttext&pid=S0100-84042004000200011&lang=pt" 
"S0100-84042004000200014-scl","Fitossociologia de uma floresta de restinga no Parque Estadual Paulo César Vinha, Setiba, município de Guarapari (ES)","Assis, André M. de, Pereira, Oberdan J., Thomaz, Luciana D.","Brazilian Journal of Botany; 27(2); 349-361","Brazilian Journal of Botany","Português","2004","http://www.scielo.br/scielo.php?script=sci_arttext&pid=S0100-84042004000200014&lang=pt" 
"S0100-84042004000200015-scl","Taxonomy and distribution of the green algal genus Halimeda (Bryopsidales, Chlorophyta) in Brazil","Bandeira-Pedrosa, Maria Elizabeth, Pereira, Sonia M.B., Oliveira, Eurico C.","Brazilian Journal of Botany; 27(2); 363-377","Brazilian Journal of Botany","Inglês","2004","http://www.scielo.br/scielo.php?script=sci_arttext&pid=S0100-84042004000200015&lang=pt" 
"S0100-84042004000200017-scl","Poliembrionia e aspectos da embriogênese em Tabebuia ochracea (Chamisso) Standley (Bignoniaceae)","Costa, Maria Eugênia, Sampaio, Diana S., Paoli, Adelita A.S., Leite, Simone C.A.L.","Brazilian Journal of Botany; 27(2); 395-406","Brazilian Journal of Botany","Português","2004","http://www.scielo.br/scielo.php?script=sci_arttext&pid=S0100-84042004000200017&lang=pt" 
"S0100-84042004000200002-scl","Planktic Cyanobacteria from São Paulo State, Brazil: Chroococcales","Sant&#039;Anna, Célia L., Azevedo, Maria Teresa de P., Senna, Pedro Américo C., Komárek, Jirí, Komárková, Jaroslava","Brazilian Journal of Botany; 27(2); 213-227","Brazilian Journal of Botany","Inglês","2004","http://www.scielo.br/scielo.php?script=sci_arttext&pid=S0100-84042004000200002&lang=pt" 
"S0100-84042004000200009-scl","Variações estruturais do compartimento arbóreo de uma floresta semidecídua alto-montana na chapada das Perdizes, Carrancas, MG","Oliveira Filho, Ary T., Carvalho, Douglas A., Fontes, Marco Aurélio L., Van Den Berg, Eduardo, Curi, Nilton, Carvalho, Warley A.C.","Brazilian Journal of Botany; 27(2); 291-309","Brazilian Journal of Botany","Português","2004","http://www.scielo.br/scielo.php?script=sci_arttext&pid=S0100-84042004000200009&lang=pt" 
"S0100-84042004000200016-scl","Liberação e atividade de moléculas indutoras de fitoalexinas em rubiáceas tropicais: influência da metilesterificação de pectinas","Silva, Claudia A. da, Braga, Marcia R.","Brazilian Journal of Botany; 27(2); 379-393","Brazilian Journal of Botany","Português","2004","http://www.scielo.br/scielo.php?script=sci_arttext&pid=S0100-84042004000200016&lang=pt" 
"S0100-84042004000200013-scl","Efeitos da poluição aérea e edáfica no sistema radicular de Tibouchina pulchra Cogn. (Melastomataceae) em área de Mata Atlântica: associações micorrízicas e morfologia","Mazzoni-Viveiros, Solange C., Trufem, Sandra F.B.","Brazilian Journal of Botany; 27(2); 337-348","Brazilian Journal of Botany","Português","2004","http://www.scielo.br/scielo.php?script=sci_arttext&pid=S0100-84042004000200013&lang=pt" 
"S0100-84042004000200005-scl","Estrutura do cerradão e da transição entre cerradão e floresta paludícola num fragmento da International Paper do Brasil Ltda., em Brotas, SP","Gomes, Bruno Z., Martins, Fernando R., Tamashiro, Jorge Y.","Brazilian Journal of Botany; 27(2); 249-262","Brazilian Journal of Botany","Português","2004","http://www.scielo.br/scielo.php?script=sci_arttext&pid=S0100-84042004000200005&lang=pt" 
"S0104-44782004000100001-scl","Editorial","Codato, Adriano Nervo","Revista de Sociologia e Política; (22); 5-6","Revista de Sociologia e Política","Português","2004","http://www.scielo.br/scielo.php?script=sci_arttext&pid=S0104-44782004000100001&lang=pt" 
"S0104-44782004000100019-scl","O avesso da liberdade","Limongi, Maria Isabel","Revista de Sociologia e Política; (22); 227-229","Revista de Sociologia e Política","Português","2004","http://www.scielo.br/scielo.php?script=sci_arttext&pid=S0104-44782004000100019&lang=pt" 
"S0104-44782004000100018-scl","Cultura infantil: a construção corporativa da infância","Mourão, Bernadete","Revista de Sociologia e Política; (22); 223-226","Revista de Sociologia e Política","Português","2004","http://www.scielo.br/scielo.php?script=sci_arttext&pid=S0104-44782004000100018&lang=pt" 
"S0104-44782004000100008-scl","Jornalismo, democracia e golpe: a crise de 1955 nas páginas do Correio da Manhã e de O Estado de S. Paulo","Biroli, Flávia","Revista de Sociologia e Política; (22); 87-99","Revista de Sociologia e Política","Português","2004","http://www.scielo.br/scielo.php?script=sci_arttext&pid=S0104-44782004000100008&lang=pt" 
"S0104-44782004000100007-scl","Uma pauta pública para uma nova televisão brasileira","Mota, Regina","Revista de Sociologia e Política; (22); 77-86","Revista de Sociologia e Política","Português","2004","http://www.scielo.br/scielo.php?script=sci_arttext&pid=S0104-44782004000100007&lang=pt" 
"S0104-44782004000100003-scl","Mídia e democracia: falsas confluências","Fonseca, Francisco C. P.","Revista de Sociologia e Política; (22); 13-24","Revista de Sociologia e Política","Português","2004","http://www.scielo.br/scielo.php?script=sci_arttext&pid=S0104-44782004000100003&lang=pt" 
"S0104-44782004000100002-scl","Apresentação","Miguel, Luis Felipe","Revista de Sociologia e Política; (22); 7-12","Revista de Sociologia e Política","Português","2004","http://www.scielo.br/scielo.php?script=sci_arttext&pid=S0104-44782004000100002&lang=pt" 
"S0104-44782004000100016-scl","Espionagem e democracia: agilidade e transparência como dilemas na institucionalização de serviços de inteligência","Marques, Adriana","Revista de Sociologia e Política; (22); 213-215","Revista de Sociologia e Política","Português","2004","http://www.scielo.br/scielo.php?script=sci_arttext&pid=S0104-44782004000100016&lang=pt" 
"S0104-44782004000100017-scl","Propostas para uma gestão pública municipal efetiva","Rosa, Denis","Revista de Sociologia e Política; (22); 217-221","Revista de Sociologia e Política","Português","2004","http://www.scielo.br/scielo.php?script=sci_arttext&pid=S0104-44782004000100017&lang=pt" 
"S0104-44782004000100015-scl","Democracia: teoria e prática","Rodrigues, Alberto Tosi","Revista de Sociologia e Política; (22); 209-211","Revista de Sociologia e Política","Português","2004","http://www.scielo.br/scielo.php?script=sci_arttext&pid=S0104-44782004000100015&lang=pt" 
"S0104-44782004000100009-scl","O Supremo Tribunal Federal no processo de transição democrática: uma análise de conteúdo dos jornais Folha de S. Paulo e O Estado de S. Paulo","Oliveira, Fabiana Luci de","Revista de Sociologia e Política; (22); 101-118","Revista de Sociologia e Política","Português","2004","http://www.scielo.br/scielo.php?script=sci_arttext&pid=S0104-44782004000100009&lang=pt" 
"S1135-57272004000300001-spa","Evaluación económica en salud: de la investigación a la toma de decisiones","Rovira, Juan","Revista Española de Salud Pública; 78(3); 293-295","Revista Española de Salud Pública","Espanhol","2004","http://www.scielosp.org/scielo.php?script=sci_arttext&pid=S1135-57272004000300001&lang=pt" 
"S1135-57272004000300008-spa","Zoonosis emergentes ligadas a animales de compañía en la Comunidad de Madrid: diseño de un método para establecer prioridades en salud pública","Almudena, García Nieto, Medina Blanco, Guillermo, Reinares Ortiz de Villajos, Javier","Revista Española de Salud Pública; 78(3); 389-398","Revista Española de Salud Pública","Espanhol","2004","http://www.scielosp.org/scielo.php?script=sci_arttext&pid=S1135-57272004000300008&lang=pt" 
"S1135-57272004000300007-spa","Utilización de ansiolíticos e hipnóticos en España (1995-2002)","García del Pozo, Javier, Abajo Iglesias, Francisco J. de, Carvajal García-Pando, Alfonso, Montero Corominas, Dolores, Madurga Sanz, Mariano, García del Pozo, Victorina","Revista Española de Salud Pública; 78(3); 379-387","Revista Española de Salud Pública","Espanhol","2004","http://www.scielosp.org/scielo.php?script=sci_arttext&pid=S1135-57272004000300007&lang=pt" 
"S1135-57272004000300006-spa","Accesibilidad a los servicios de salud en la práctica de citología reciente de cuello uterino en una zona urbana de Colombia","Lucumí Cuesta, Diego Iván, Gómez Gutiérrez, Luis Fernando","Revista Española de Salud Pública; 78(3); 367-377","Revista Española de Salud Pública","Espanhol","2004","http://www.scielosp.org/scielo.php?script=sci_arttext&pid=S1135-57272004000300006&lang=pt" 
"S1135-57272004000300005-spa","Ganancia funcional y estancia hospitalaria en la unidad geriátrica de media estancia del Hospital Central de Cruz Roja de Madrid","Baztán, Juan J., Domenech, Juan R., González, Margarita, Forcano, Silvia, Morales, Carmen, Ruipérez, Isidoro","Revista Española de Salud Pública; 78(3); 355-366","Revista Española de Salud Pública","Espanhol","2004","http://www.scielosp.org/scielo.php?script=sci_arttext&pid=S1135-57272004000300005&lang=pt" 
"S1135-57272004000300004-spa","Análisis coste-efectividad del programa de detección sistemática del cáncer cervical en la región del Algarve, Portugal","Novoa Vázquez, Rosa María","Revista Española de Salud Pública; 78(3); 341-353","Revista Española de Salud Pública","Espanhol","2004","http://www.scielosp.org/scielo.php?script=sci_arttext&pid=S1135-57272004000300004&lang=pt" 
"S1135-57272004000300003-spa","Nuevas iniciativas para mejorar la seguridad de la utilización de los medicamentos en los hospitales","Otero López, María José","Revista Española de Salud Pública; 78(3); 323-339","Revista Española de Salud Pública","Espanhol","2004","http://www.scielosp.org/scielo.php?script=sci_arttext&pid=S1135-57272004000300003&lang=pt" 
"S1135-57272004000300009-spa","Satisfacción laboral de los odontólogos y estomatólogos del Servicio Gallego de Salud","Varela-Centelles, Pablo Ignacio, Ferreiro Abelairas, Agustín, Fontao Valcárcel, Luis Fernando, Martínez González, Andrés Manuel","Revista Española de Salud Pública; 78(3); 309-402","Revista Española de Salud Pública","Espanhol","2004","http://www.scielosp.org/scielo.php?script=sci_arttext&pid=S1135-57272004000300009&lang=pt" 
"S1135-57272004000300010-spa","Certifica: Autoformación médica para la certificación de defunción","Cirera, Lluís, Vázquez, Enrique, Cerdeira, Sara, Sangrador, Luis Alberto, Pérez, Gloria, Audicana, Covadonga","Revista Española de Salud Pública; 78(3); 403-405","Revista Española de Salud Pública","Espanhol","2004","http://www.scielosp.org/scielo.php?script=sci_arttext&pid=S1135-57272004000300010&lang=pt" 
"S1135-57272004000300011-spa","Tablas de composición de alimentos del Cesnid","","Revista Española de Salud Pública; 78(3); 407-407","Revista Española de Salud Pública","Espanhol","2004","http://www.scielosp.org/scielo.php?script=sci_arttext&pid=S1135-57272004000300011&lang=pt" 
"S1135-57272004000300012-spa","Making choices in health: who guide to cost-effectiveness analysis","","Revista Española de Salud Pública; 78(3); 409-410","Revista Española de Salud Pública","Espanhol","2004","http://www.scielosp.org/scielo.php?script=sci_arttext&pid=S1135-57272004000300012&lang=pt" 
