"S0103-65642004000100012-scl","A pesquisa qualitativa em Psicologia Clínica","Batista Pinto, Elizabeth","Psicologia USP; 15(1-2); 71-80","Psicologia USP","Português","2004","http://www.scielo.br/scielo.php?script=sci_arttext&pid=S0103-65642004000100012&lang=pt" 
"S0103-65642004000100003-scl","Luiz Carlos","Ades, César","Psicologia USP; 15(1-2); 21-23","Psicologia USP","Português","2004","http://www.scielo.br/scielo.php?script=sci_arttext&pid=S0103-65642004000100003&lang=pt" 
"S0103-65642004000100007-scl","Algumas palavras em homenagem ao pai","Motta, Ivonise Fernandes da","Psicologia USP; 15(1-2); 39-44","Psicologia USP","Português","2004","http://www.scielo.br/scielo.php?script=sci_arttext&pid=S0103-65642004000100007&lang=pt" 
"S0103-65642004000100002-scl","A herança de Luíz Carlos Nogueira","Quinet, Antonio","Psicologia USP; 15(1-2); 17-20","Psicologia USP","Português","2004","http://www.scielo.br/scielo.php?script=sci_arttext&pid=S0103-65642004000100002&lang=pt" 
"S0103-65642004000100001-scl","","","Psicologia USP; 15(1-2); -","Psicologia USP","Português","2004","http://www.scielo.br/scielo.php?script=sci_arttext&pid=S0103-65642004000100001&lang=pt" 
"S0103-65642004000100004-scl","Homenagem ao Prof. Luiz Carlos Nogueira","Andrade, Maria Lúcia de Araújo","Psicologia USP; 15(1-2); 25-30","Psicologia USP","Português","2004","http://www.scielo.br/scielo.php?script=sci_arttext&pid=S0103-65642004000100004&lang=pt" 
"S0103-65642004000100015-scl","Apresentação","Gianesi, Ana Paula, Hernandez, Juliana, Checchia, Marcelo A.","Psicologia USP; 15(1-2); 125-128","Psicologia USP","Português","2004","http://www.scielo.br/scielo.php?script=sci_arttext&pid=S0103-65642004000100015&lang=pt" 
"S0103-65642004000100021-scl","A posição do sujeito na fala e seus efeitos: uma reflexão sobre os quatro discursos","Ziliotto, Denise Macedo","Psicologia USP; 15(1-2); 215-223","Psicologia USP","Português","2004","http://www.scielo.br/scielo.php?script=sci_arttext&pid=S0103-65642004000100021&lang=pt" 
"S0103-65642004000100006-scl","Professor Luiz Carlos, meu professor","Priszkulnik, Léia","Psicologia USP; 15(1-2); 35-37","Psicologia USP","Português","2004","http://www.scielo.br/scielo.php?script=sci_arttext&pid=S0103-65642004000100006&lang=pt" 
"S0103-65642004000100018-scl","Psicanálise e pesquisa","Gianesi, Ana Paula Lacorte","Psicologia USP; 15(1-2); 169-182","Psicologia USP","Português","2004","http://www.scielo.br/scielo.php?script=sci_arttext&pid=S0103-65642004000100018&lang=pt" 
"S0103-65642004000100013-scl","A pesquisa em psicanálise","Nogueira, Luiz Carlos","Psicologia USP; 15(1-2); 83-106","Psicologia USP","Português","2004","http://www.scielo.br/scielo.php?script=sci_arttext&pid=S0103-65642004000100013&lang=pt" 
"S0103-65642004000100016-scl","O duplo estatuto do silêncio","Hernandez, Juliana","Psicologia USP; 15(1-2); 129-147","Psicologia USP","Português","2004","http://www.scielo.br/scielo.php?script=sci_arttext&pid=S0103-65642004000100016&lang=pt" 
"S0103-65642004000100020-scl","A escrita e o sujeito: uma leitura à luz de Lacan","Bento, Conceição Aparecida","Psicologia USP; 15(1-2); 195-214","Psicologia USP","Português","2004","http://www.scielo.br/scielo.php?script=sci_arttext&pid=S0103-65642004000100020&lang=pt" 
"S0103-65642004000100022-scl","Considerações sobre corpo e linguagem na clínica e na teoria lacaniana","Cukiert, Michele","Psicologia USP; 15(1-2); 225-241","Psicologia USP","Português","2004","http://www.scielo.br/scielo.php?script=sci_arttext&pid=S0103-65642004000100022&lang=pt" 
"S0103-65642004000100023-scl","Da foraclusão do Nome-do-Pai à foraclusão generalizada: considerações sobre a teoria das psicoses em Lacan","Lacet, Cristine","Psicologia USP; 15(1-2); 243-262","Psicologia USP","Português","2004","http://www.scielo.br/scielo.php?script=sci_arttext&pid=S0103-65642004000100023&lang=pt" 
"S0103-65642004000100028-scl","Considerações iniciais sobre lógica e teoria lacaniana","Checchia, Marcelo Amorim","Psicologia USP; 15(1-2); 321-338","Psicologia USP","Português","2004","http://www.scielo.br/scielo.php?script=sci_arttext&pid=S0103-65642004000100028&lang=pt" 
"S0103-65642004000100011-scl","Transferência de trabalho e a universidade","Alberti, Sonia","Psicologia USP; 15(1-2); 55-70","Psicologia USP","Português","2004","http://www.scielo.br/scielo.php?script=sci_arttext&pid=S0103-65642004000100011&lang=pt" 
"S0103-65642004000100029-scl","As duas vertentes: significante e objeto a","Nogueira, Luiz Carlos, Bicalho, Helena, Abe, Jair","Psicologia USP; 15(1-2); 339-343","Psicologia USP","Português","2004","http://www.scielo.br/scielo.php?script=sci_arttext&pid=S0103-65642004000100029&lang=pt" 
"S0103-65642004000100017-scl","Que destino dar à mensagem recebida? apontamentos sobre a questão da transmissão na psicanálise","Prates, Ana Laura","Psicologia USP; 15(1-2); 149-167","Psicologia USP","Português","2004","http://www.scielo.br/scielo.php?script=sci_arttext&pid=S0103-65642004000100017&lang=pt" 
"S1415-790X2004000200001-scl","Editorial","Carvalheiro, José da Rocha","Revista Brasileira de Epidemiologia; 7(2); 107-110","Revista Brasileira de Epidemiologia","Inglês, Português","2004","http://www.scielo.br/scielo.php?script=sci_arttext&pid=S1415-790X2004000200001&lang=pt" 
"S1415-790X2004000200009-scl","Prevalência de sobrepeso e sua associação com a área de residência em crianças menores de 6 anos de idade matriculadas em creches públicas de Florianópolis, Santa Catarina, Brasil","Corso, Arlete Catarina Tittoni, Viteritte, Paulo Luiz, Peres, Marco Aurélio","Revista Brasileira de Epidemiologia; 7(2); 201-209","Revista Brasileira de Epidemiologia","Português","2004","http://www.scielo.br/scielo.php?script=sci_arttext&pid=S1415-790X2004000200009&lang=pt" 
"S1415-790X2004000200003-scl","Padrões espaço-temporais da mortalidade por câncer de pulmão no Sul do Brasil","Castro, Mônica Silva Monteiro de, Vieira, Viviane Alves, Assunção, Renato Martins","Revista Brasileira de Epidemiologia; 7(2); 131-143","Revista Brasileira de Epidemiologia","Português","2004","http://www.scielo.br/scielo.php?script=sci_arttext&pid=S1415-790X2004000200003&lang=pt" 
"S1415-790X2004000200002-scl","Sessão Especial: VI Congresso Brasileiro de Epidemiologia","","Revista Brasileira de Epidemiologia; 7(2); 111-130","Revista Brasileira de Epidemiologia","Inglês, Português","2004","http://www.scielo.br/scielo.php?script=sci_arttext&pid=S1415-790X2004000200002&lang=pt" 
"S1415-790X2004000200004-scl","Precisão e validade de levantamentos epidemiológicos em saúde bucal: cárie dentária na Cidade de São Paulo, 2002","Frias, Antonio Carlos, Antunes, José Leopoldo Ferreira, Narvai, Paulo Capel","Revista Brasileira de Epidemiologia; 7(2); 144-154","Revista Brasileira de Epidemiologia","Português","2004","http://www.scielo.br/scielo.php?script=sci_arttext&pid=S1415-790X2004000200004&lang=pt" 
"S1415-790X2004000200005-scl","Aplicação de métodos de estimativa da prevalência de hanseníase no Estado de Mato Grosso","Ignotti, Eliane, Rodrigues, Alex Miranda, Andrade, Vera Lúcia Gomes de, Valente, Joaquim Gonçalves","Revista Brasileira de Epidemiologia; 7(2); 155-166","Revista Brasileira de Epidemiologia","Português","2004","http://www.scielo.br/scielo.php?script=sci_arttext&pid=S1415-790X2004000200005&lang=pt" 
"S1415-790X2004000200006-scl","Mutações no gene TP53 em tumores malignos de mama: associação com fatores de risco e características clínico-patológicas, inclusive risco de óbito, em pacientes residentes no Rio de Janeiro","Moura-Gallo, Claudia Vitória de, Simão, Tatiana de Almeida, Ribeiro, Fabiana Siqueira, Andrada-Serpa, Maria José, Cardoso, Luís Eduardo Bastos, Mendonça, Gulnar Azevedo e Silva","Revista Brasileira de Epidemiologia; 7(2); 167-175","Revista Brasileira de Epidemiologia","Português","2004","http://www.scielo.br/scielo.php?script=sci_arttext&pid=S1415-790X2004000200006&lang=pt" 
"S1415-790X2004000200007-scl","Níveis séricos de creatinina: hipercreatininemia em segmento da população adulta de Salvador, Brasil","Lessa, Ines","Revista Brasileira de Epidemiologia; 7(2); 176-186","Revista Brasileira de Epidemiologia","Português","2004","http://www.scielo.br/scielo.php?script=sci_arttext&pid=S1415-790X2004000200007&lang=pt" 
"S1415-790X2004000200008-scl","Fatores associados com a retenção e o ganho de peso pós-parto: uma revisão sistemática","Lacerda, Elisa Maria de Aquino, Leal, Maria do Carmo","Revista Brasileira de Epidemiologia; 7(2); 187-200","Revista Brasileira de Epidemiologia","Português","2004","http://www.scielo.br/scielo.php?script=sci_arttext&pid=S1415-790X2004000200008&lang=pt" 
"S1415-790X2004000200010-scl","Weekly iron supplementation reduces anemia prevalence by 1/3 in preschool children","Brunken, Gisela Soares, Muniz, Pascoal Torres, Silva, Solanyara Maria da","Revista Brasileira de Epidemiologia; 7(2); 210-219","Revista Brasileira de Epidemiologia","Inglês","2004","http://www.scielo.br/scielo.php?script=sci_arttext&pid=S1415-790X2004000200010&lang=pt" 
"S1415-790X2004000200012-scl","Gastos governamentais do SUS com internações hospitalares por causas externas: análise no Estado de São Paulo, 2000","Jorge, Maria Helena Prado de Mello, Koizumi, Maria Sumie","Revista Brasileira de Epidemiologia; 7(2); 228-238","Revista Brasileira de Epidemiologia","Português","2004","http://www.scielo.br/scielo.php?script=sci_arttext&pid=S1415-790X2004000200012&lang=pt" 
"S1415-790X2004000200011-scl","Internações por doenças respiratórias em idosos e a intervenção vacinal contra influenza no Estado de São Paulo","Francisco, Priscila Maria Stolses Bergamo, Donalisio, Maria Rita, Lattorre, Maria do Rosário Dias de Oliveira","Revista Brasileira de Epidemiologia; 7(2); 220-227","Revista Brasileira de Epidemiologia","Português","2004","http://www.scielo.br/scielo.php?script=sci_arttext&pid=S1415-790X2004000200011&lang=pt" 
"S0102-05362004000200034-scl","Perfil dos consumidores de plantas medicinais e condimentares do município de Pato Branco (PR)","Marchese, José Abramo, Broetto, Fernando, Ming, Lin C., Goto, Rumy, Stefanini, Mirian B., Galina, Adinam, Tedesco, Ângela C., Conte, Cassiano, Miniuk, Cindia M., Schurt, Daniel A., Sangaletti, Emerson, Silva, Giovani O. da, Gomes, Greice, Bertagnolli, José A., Francheschi, Lucia, Cossa, Maicon L., Moraes, Maires R.D., Lima, Patrícia M., Lira, Rodrigo, Costa, Silvana","Horticultura Brasileira; 22(2); 332-335","Horticultura Brasileira","Português","2004","http://www.scielo.br/scielo.php?script=sci_arttext&pid=S0102-05362004000200034&lang=pt" 
"S0102-09352004000300001-scl","Effects of lidocaine on lipopolysaccharide-induced synovitis in horses","Campebell, R.C., Peiró, J.R., Valadão, C.A.A., Santana, A.E., Cunha, F.Q.","Arquivo Brasileiro de Medicina Veterinária e Zootecnia; 56(3); 281-291","Arquivo Brasileiro de Medicina Veterinária e Zootecnia","Inglês","2004","http://www.scielo.br/scielo.php?script=sci_arttext&pid=S0102-09352004000300001&lang=pt" 
"S0102-09352004000300006-scl","Serum and urinary measurements of prostatic acid phosphatase (PAP) and prostatic specific antigen (PSA) in dogs","Amorim, R.L., Moura, V.M.B.D., Di Santis, G.W., Bandarra, E.P., Padovani, C.","Arquivo Brasileiro de Medicina Veterinária e Zootecnia; 56(3); 320-324","Arquivo Brasileiro de Medicina Veterinária e Zootecnia","Inglês","2004","http://www.scielo.br/scielo.php?script=sci_arttext&pid=S0102-09352004000300006&lang=pt" 
"S0102-09352004000300007-scl","Effects of experimental infections with larvae of Eustrongylides ignotus Jäegerskiold, 1909 and Contracaecum multipapillatum (Drasche, 1882) Baylis, 1920 in rabbits","Barros, L.A., Tortelly, R., Pinto, R.M., Gomes, D.C.","Arquivo Brasileiro de Medicina Veterinária e Zootecnia; 56(3); 325-332","Arquivo Brasileiro de Medicina Veterinária e Zootecnia","Inglês","2004","http://www.scielo.br/scielo.php?script=sci_arttext&pid=S0102-09352004000300007&lang=pt" 
"S0102-09352004000300022-scl","Toxoplasma gondii and Neospora caninum serological status of different canine populations from Uberlândia, Minas Gerais","Mineo, T.W.P., Silva, D.A.O., Näslund, K., Björkman, C., Uggla, A., Mineo, J.R.","Arquivo Brasileiro de Medicina Veterinária e Zootecnia; 56(3); 414-417","Arquivo Brasileiro de Medicina Veterinária e Zootecnia","Inglês","2004","http://www.scielo.br/scielo.php?script=sci_arttext&pid=S0102-09352004000300022&lang=pt" 
"S0102-09352004000300009-scl","Comparative study of the sedative and antinociceptive effects of levomepromazine, azaperone and midazolam in laboratory animals","Mataqueiro, M.I., D’Angelis, F.H.F., De-Caroli-Neto, A., Rossi, C.A., Queiroz-Neto, A.","Arquivo Brasileiro de Medicina Veterinária e Zootecnia; 56(3); 340-345","Arquivo Brasileiro de Medicina Veterinária e Zootecnia","Inglês","2004","http://www.scielo.br/scielo.php?script=sci_arttext&pid=S0102-09352004000300009&lang=pt" 
"S0102-09352004000300019-scl","Sensibilidade antimicrobiana de cepas de Staphylococcus spp. isoladas de carcaças de frango comercializadas em Recife","Freitas, M.F.L., Mota, R.A., Leão, A.E.D.S., Figueiredo, M.L., Fonte, M.M., Vieira, R.F.C.","Arquivo Brasileiro de Medicina Veterinária e Zootecnia; 56(3); 405-407","Arquivo Brasileiro de Medicina Veterinária e Zootecnia","Português","2004","http://www.scielo.br/scielo.php?script=sci_arttext&pid=S0102-09352004000300019&lang=pt" 
"S0102-09352004000300018-scl","Diarréia em leitões lactentes por Clostridium perfringens tipo A em granjas tecnificadas nos estados de Minas Gerais e São Paulo","Costa, G.M., Assis, R.A., Lobato, F.C.F., Abreu, V.L.V., Santos, J.L., Uzal, F.A.","Arquivo Brasileiro de Medicina Veterinária e Zootecnia; 56(3); 401-404","Arquivo Brasileiro de Medicina Veterinária e Zootecnia","Português","2004","http://www.scielo.br/scielo.php?script=sci_arttext&pid=S0102-09352004000300018&lang=pt" 
"S0102-09352004000300013-scl","Efeito da idade de exposição de novilhas à reprodução sobre estimativas de herdabilidade da idade ao primeiro parto em bovinos Nelore","Dias, L.T., EL Faro, L., Albuquerque, L.G.","Arquivo Brasileiro de Medicina Veterinária e Zootecnia; 56(3); 370-373","Arquivo Brasileiro de Medicina Veterinária e Zootecnia","Português","2004","http://www.scielo.br/scielo.php?script=sci_arttext&pid=S0102-09352004000300013&lang=pt" 
"S0102-09352004000300016-scl","Efeito de aditivos biológicos comerciais na silagem de capim-elefante (Pennisetum purpureum Schum)","Patrizi, W.L., Madruga Júnior, C.R.F., Minetto, T.P., Nogueira, E., Morais, M.G.","Arquivo Brasileiro de Medicina Veterinária e Zootecnia; 56(3); 392-397","Arquivo Brasileiro de Medicina Veterinária e Zootecnia","Português","2004","http://www.scielo.br/scielo.php?script=sci_arttext&pid=S0102-09352004000300016&lang=pt" 
"S0102-09352004000300020-scl","Determination of the minimal representative number of microscopic fields to quantify apoptosis in canine lymph nodes","Moro, L., Vasconcelos, A.C., Santos, F.G.A., Alves, C.M., Nunes, J.E.S., Sampaio, I.B.M.","Arquivo Brasileiro de Medicina Veterinária e Zootecnia; 56(3); 408-410","Arquivo Brasileiro de Medicina Veterinária e Zootecnia","Inglês","2004","http://www.scielo.br/scielo.php?script=sci_arttext&pid=S0102-09352004000300020&lang=pt" 
"S0102-09352004000300021-scl","Hepatozoonose canina: achados clínico-epidemiológicos em três casos","Aguiar, D.M., Ribeiro, M.G., Silva, W.B., Dias Jr, J.G., Megid, J., Paes, A.C.","Arquivo Brasileiro de Medicina Veterinária e Zootecnia; 56(3); 411-413","Arquivo Brasileiro de Medicina Veterinária e Zootecnia","Português","2004","http://www.scielo.br/scielo.php?script=sci_arttext&pid=S0102-09352004000300021&lang=pt" 
"S0102-09352004000300023-scl","Lead poisoning in cattle in southern Brazil","Traverso, S.D., Loretti, A.P., Donini, M.A., Driemeier, D.","Arquivo Brasileiro de Medicina Veterinária e Zootecnia; 56(3); 418-421","Arquivo Brasileiro de Medicina Veterinária e Zootecnia","Inglês","2004","http://www.scielo.br/scielo.php?script=sci_arttext&pid=S0102-09352004000300023&lang=pt" 
"S0102-09352004000300024-scl","Nasonia vitripennis (Walker) (Hymenoptera: Pteromalidae) parasitóide de dípteros muscóides coletado em Itumbiara, Goiás","Marchiori, C.H.","Arquivo Brasileiro de Medicina Veterinária e Zootecnia; 56(3); 422-424","Arquivo Brasileiro de Medicina Veterinária e Zootecnia","Português","2004","http://www.scielo.br/scielo.php?script=sci_arttext&pid=S0102-09352004000300024&lang=pt" 
"S0102-09352004000300003-scl","Presença de Salmonella sp. no trato intestinal e em tonsilas/linfonodos submandibulares de suínos ao abate","Castagna, S.M.F., Schwarz, P., Canal, C.W., Cardoso, M.","Arquivo Brasileiro de Medicina Veterinária e Zootecnia; 56(3); 300-306","Arquivo Brasileiro de Medicina Veterinária e Zootecnia","Português","2004","http://www.scielo.br/scielo.php?script=sci_arttext&pid=S0102-09352004000300003&lang=pt" 
"S0102-09352004000300004-scl","Lavagem traqueobrônquica por sondagem nasotraqueal em bezerros","Gonçalves, R.C., Mattos, M.C.F.I., Kuchembuck, M.R.G., Lopes, R.S., Borges, A.S.","Arquivo Brasileiro de Medicina Veterinária e Zootecnia; 56(3); 307-311","Arquivo Brasileiro de Medicina Veterinária e Zootecnia","Português","2004","http://www.scielo.br/scielo.php?script=sci_arttext&pid=S0102-09352004000300004&lang=pt" 
"S0102-09352004000300005-scl","Fixação de enxerto cutâneo em malha de espessura total com sutura ou cola de fibrina","Amaral, M.S.P., Rahal, S.C., Dal-Pai, V., Barraviera, S.R.C.S., Lima, A.F.M., Crocci, A.J.","Arquivo Brasileiro de Medicina Veterinária e Zootecnia; 56(3); 312-319","Arquivo Brasileiro de Medicina Veterinária e Zootecnia","Português","2004","http://www.scielo.br/scielo.php?script=sci_arttext&pid=S0102-09352004000300005&lang=pt" 
"S0102-09352004000300008-scl","Efeito do dimetildioctadecilamônio na resposta imune humoral e celular de cobaios inoculados com o herpesvírus bovino-1 inativado","Silva, L.C., Takiuchi, E., Médici, K.C., Alfieri, A.F., Alfieri, A.A.","Arquivo Brasileiro de Medicina Veterinária e Zootecnia; 56(3); 333-339","Arquivo Brasileiro de Medicina Veterinária e Zootecnia","Português","2004","http://www.scielo.br/scielo.php?script=sci_arttext&pid=S0102-09352004000300008&lang=pt" 
"S0102-09352004000300010-scl","Dinâmica folicular e momento da ovulação em vacas não lactantes das raças Gir e Nelore durante duas estações do ano","Borges, A.M., Torres, C.A.A., Rocha Júnior, V.R., Ruas, J.R.M., Gioso, M.M., Fonseca, J.F., Carvalho, G.R., Maffili, V.V.","Arquivo Brasileiro de Medicina Veterinária e Zootecnia; 56(3); 346-354","Arquivo Brasileiro de Medicina Veterinária e Zootecnia","Português","2004","http://www.scielo.br/scielo.php?script=sci_arttext&pid=S0102-09352004000300010&lang=pt" 
"S0102-09352004000300011-scl","Efeito da suplementação e do intervalo de pastejo sobre a qualidade da forragem e consumo voluntário de vacas Holandês × Zebu em lactação em pastagem de capim-elefante","Lopes, F.C.F., Aroeira, L.J.M., Rodriguez, N.M., Deresz, F., Sampaio, I.B.M., Paciullo, D.S.C., Vittori, A.","Arquivo Brasileiro de Medicina Veterinária e Zootecnia; 56(3); 355-362","Arquivo Brasileiro de Medicina Veterinária e Zootecnia","Português","2004","http://www.scielo.br/scielo.php?script=sci_arttext&pid=S0102-09352004000300011&lang=pt" 
"S0102-09352004000300014-scl","Critérios de seleção para características de crescimento em bovinos da raça Nelore","Simonelli, S.M., Silva, M.A., Silva, L.O.C., Pereira, J.C.C., Souza, J.E.R., Ventura, R.V., Valente, B.D.","Arquivo Brasileiro de Medicina Veterinária e Zootecnia; 56(3); 374-384","Arquivo Brasileiro de Medicina Veterinária e Zootecnia","Português","2004","http://www.scielo.br/scielo.php?script=sci_arttext&pid=S0102-09352004000300014&lang=pt" 
"S0102-09352004000300015-scl","Análise de custos de diferentes grupos genéticos de bovinos de corte terminados em confinamento","Ferreira, I.C., Silva, M.A., Reis, R.P., Euclides Filho, K., Figueiredo, G.R.","Arquivo Brasileiro de Medicina Veterinária e Zootecnia; 56(3); 385-391","Arquivo Brasileiro de Medicina Veterinária e Zootecnia","Português","2004","http://www.scielo.br/scielo.php?script=sci_arttext&pid=S0102-09352004000300015&lang=pt" 
"S0102-09352004000300017-scl","Reverse transcription-polymerase chain reaction assay for rabies virus detection","Dantas Junior, J.V., Kimura, L.M.S., Ferreira, M.S.R., Fialho, A.M., Almeida, M.M.S., Grégio, C.R.V., Romijn, P.C., Leite, J.P.G.","Arquivo Brasileiro de Medicina Veterinária e Zootecnia; 56(3); 398-400","Arquivo Brasileiro de Medicina Veterinária e Zootecnia","Inglês","2004","http://www.scielo.br/scielo.php?script=sci_arttext&pid=S0102-09352004000300017&lang=pt" 
"S0004-27302004000300002-scl","Fator de impacto. Boletim do editor?","Bianco, Antonio C.","Arquivos Brasileiros de Endocrinologia &amp; Metabologia; 48(3); 335-336","Arquivos Brasileiros de Endocrinologia &amp; Metabologia","Português","2004","http://www.scielo.br/scielo.php?script=sci_arttext&pid=S0004-27302004000300002&lang=pt" 
"S0004-27302004000300001-scl","Da berinjela às estatinas: uma viagem entre ficção e realidade","Quintão, Eder C.R.","Arquivos Brasileiros de Endocrinologia &amp; Metabologia; 48(3); 331-334","Arquivos Brasileiros de Endocrinologia &amp; Metabologia","Português","2004","http://www.scielo.br/scielo.php?script=sci_arttext&pid=S0004-27302004000300001&lang=pt" 
"S0004-27302004000300005-scl","Cintilografia de perfusão miocárdica em pacientes diabeticos tipo 2 com dor torácica atípica","Andrade, Luis J.O., Cruz, Thomaz R.P., Daltro, Carla, Soares, Filemon J., França, Caroline S., Sampaio, Ana P.Q., Vigário, Adriano O., Lobão, Luiz J.","Arquivos Brasileiros de Endocrinologia &amp; Metabologia; 48(3); 362-373","Arquivos Brasileiros de Endocrinologia &amp; Metabologia","Português","2004","http://www.scielo.br/scielo.php?script=sci_arttext&pid=S0004-27302004000300005&lang=pt" 
"S0004-27302004000300007-scl","Estudo das manifestações bucais em crianças com diabetes e suas variáveis de correlação","Costa, Carolina C., Resende, Gimol B., Souza, Joeci M., Tavares, Silvia S., Almeida, Izabel C.S.S., C. Filho, Luiz Cesar","Arquivos Brasileiros de Endocrinologia &amp; Metabologia; 48(3); 374-378","Arquivos Brasileiros de Endocrinologia &amp; Metabologia","Português","2004","http://www.scielo.br/scielo.php?script=sci_arttext&pid=S0004-27302004000300007&lang=pt" 
"S0004-27302004000300010-scl","Glicemia capilar em ponta do dedo versus lóbulo de orelha: estudo comparativo dos valores resultantes e preferências dos pacientes","Ferraz, Dênis P., Maia, Frederico F.R., Araújo, Levimar R.","Arquivos Brasileiros de Endocrinologia &amp; Metabologia; 48(3); 389-393","Arquivos Brasileiros de Endocrinologia &amp; Metabologia","Português","2004","http://www.scielo.br/scielo.php?script=sci_arttext&pid=S0004-27302004000300010&lang=pt" 
"S0004-27302004000300011-scl","Avaliação do grau de satisfação da contagem de carboidratos em diabetes mellitus tipo 1","Hissa, Ana Sofia Rocha, Albuquerque, Lílian L., Hissa, Miguel Nasser","Arquivos Brasileiros de Endocrinologia &amp; Metabologia; 48(3); 394-397","Arquivos Brasileiros de Endocrinologia &amp; Metabologia","Português","2004","http://www.scielo.br/scielo.php?script=sci_arttext&pid=S0004-27302004000300011&lang=pt" 
"S0004-27302004000300016-scl","Hipotireoidismo primário simulando volumoso macroadenoma hipofisário","Betônico, Carolina C. R., Rodrigues, Ricardo, Mendonça, Suzan C. L., Jorge, Paulo Tannus","Arquivos Brasileiros de Endocrinologia &amp; Metabologia; 48(3); 423-426","Arquivos Brasileiros de Endocrinologia &amp; Metabologia","Português","2004","http://www.scielo.br/scielo.php?script=sci_arttext&pid=S0004-27302004000300016&lang=pt" 
"S0004-27302004000300013-scl","Hormônio do crescimento ou somatotrófico: novas perspectivas na deficiência isolada de GH a partir da descrição da mutação no gene do receptor do GHRH nos indivíduos da cidade de Itabaianinha, Brasil","Souza, Anita Hermínia O., Salvatori, Roberto, Martinelli Jr, Carlos E., Carvalho, Walter M.O., Menezes, Carlos A., Barretto, Elenilde S. de A., Barreto Filho, José A.S., Alcântara, Marta R.S. de, Oliveira, Carla R.P., Alcântara, Paula R.S. de, Ramalho, Roberto J.R., Oliveira, Hélio A., Lima, Ivana B. de, Carneiro, Jamille N., Santos, Marcos M., Gill, Matthew S., Clayton, Peter E., Oliveira, Manuel H. A","Arquivos Brasileiros de Endocrinologia &amp; Metabologia; 48(3); 406-413","Arquivos Brasileiros de Endocrinologia &amp; Metabologia","Português","2004","http://www.scielo.br/scielo.php?script=sci_arttext&pid=S0004-27302004000300013&lang=pt" 
"S0034-71402004000200001-scl","Introdução a &#039;&#039;diferencial de salários no Brasil&#039;&#039;","Carvalho, José Raimundo","Revista Brasileira de Economia; 58(2); 151-157","Revista Brasileira de Economia","Português","2004","http://www.scielo.br/scielo.php?script=sci_arttext&pid=S0034-71402004000200001&lang=pt" 
"S0034-71402004000200005-scl","O diferencial de salários formal-informal no Brasil: segmentação ou viés de seleção?","Menezes Filho, Naércio Aquino, Mendes, Marcos, Almeida, Eduardo Simões de","Revista Brasileira de Economia; 58(2); 235-248","Revista Brasileira de Economia","Português","2004","http://www.scielo.br/scielo.php?script=sci_arttext&pid=S0034-71402004000200005&lang=pt" 
