"S1135-57272004000300002-spa","Requisitos de uniformidad para la redacción y edición de manuscritos presentados a revistas biomédicas: Actualización de noviembre de 2003","","Revista Española de Salud Pública; 78(3); 297-321","Revista Española de Salud Pública","Espanhol","2004","http://www.scielosp.org/scielo.php?script=sci_arttext&pid=S1135-57272004000300002&lang=pt" 
"S1806-37132004000300019-scl","CARTA AO EDITOR","","Jornal Brasileiro de Pneumologia; 30(3); 302-302","Jornal Brasileiro de Pneumologia","Inglês, Português","2004","http://www.scielo.br/scielo.php?script=sci_arttext&pid=S1806-37132004000300019&lang=pt" 
"S1806-37132004000300017-scl","Perguntamos: qual o diagnóstico?","","Jornal Brasileiro de Pneumologia; 30(3); 299-299","Jornal Brasileiro de Pneumologia","Inglês, Português","2004","http://www.scielo.br/scielo.php?script=sci_arttext&pid=S1806-37132004000300017&lang=pt" 
"S1806-37132004000300002-scl","Smoking in health professionals","Raw, Martin","Jornal Brasileiro de Pneumologia; 30(3); 194-194","Jornal Brasileiro de Pneumologia","Inglês","2004","http://www.scielo.br/scielo.php?script=sci_arttext&pid=S1806-37132004000300002&lang=pt" 
"S1806-37132004000300001-scl","Biomass burning and its effects on health","Pope III, C. Arden","Jornal Brasileiro de Pneumologia; 30(3); 193-193","Jornal Brasileiro de Pneumologia","Inglês","2004","http://www.scielo.br/scielo.php?script=sci_arttext&pid=S1806-37132004000300001&lang=pt" 
"S1806-37132004000300005-scl","Influência de características gerais na qualidade de vida de pacientes com doença pulmonar obstrutiva crônica","Dourado, Victor Zuniga, Antunes, Letícia Cláudia de Oliveira, Carvalho, Lídia Raquel de, Godoy, Irma","Jornal Brasileiro de Pneumologia; 30(3); 207-214","Jornal Brasileiro de Pneumologia","Inglês, Português","2004","http://www.scielo.br/scielo.php?script=sci_arttext&pid=S1806-37132004000300005&lang=pt" 
"S1806-37132004000300006-scl","Toracocentese esvaziadora com irrigação e uso de antimicrobiano intrapleural no tratamento do empiema","Duailibe, Liana Peres, Donatti, Maria Ilizabeti, Müller, Paulo de Tarso, Dobashi, Pedro Nango","Jornal Brasileiro de Pneumologia; 30(3); 215-222","Jornal Brasileiro de Pneumologia","Inglês, Português","2004","http://www.scielo.br/scielo.php?script=sci_arttext&pid=S1806-37132004000300006&lang=pt" 
"S1806-37132004000300007-scl","Tabagismo em estudantes de Medicina: tendências temporais e fatores associados","Menezes, Ana Maria Baptista, Hallal, Pedro Curi, Silva, Fernando, Souza, Marcos, Paiva, Luciene, D&#039;Ávila, Aline, Weber, Bianca, Vaz, Viviane, Marques, Fernando, Horta, Bernardo L.","Jornal Brasileiro de Pneumologia; 30(3); 223-228","Jornal Brasileiro de Pneumologia","Inglês, Português","2004","http://www.scielo.br/scielo.php?script=sci_arttext&pid=S1806-37132004000300007&lang=pt" 
"S1806-37132004000300009-scl","Traqueostomia percutânea no doente crítico: a experiência de uma unidade de terapia intensiva clínica","Park, Marcelo, Brauer, Leonardo, Sanga, Ricardo Reis, Amaral, André Carlos Kajdacsy-Balla, Ladeira, José Paulo, Azevedo, Luciano Cesar Pontes de, Taniguchi, Leandro Utino, Cruz-Neto, Luiz Monteiro da","Jornal Brasileiro de Pneumologia; 30(3); 237-242","Jornal Brasileiro de Pneumologia","Inglês, Português","2004","http://www.scielo.br/scielo.php?script=sci_arttext&pid=S1806-37132004000300009&lang=pt" 
"S1806-37132004000300010-scl","Características clínicas e epidemiológicas do adulto contagiante da criança com tuberculose","Lima, João AB, Icaza, Edgar Enrique Sarria, Menegotto, Beatriz G., Fischer, Gilberto Bueno, Barreto, Sérgio Saldanha Menna","Jornal Brasileiro de Pneumologia; 30(3); 243-252","Jornal Brasileiro de Pneumologia","Inglês, Português","2004","http://www.scielo.br/scielo.php?script=sci_arttext&pid=S1806-37132004000300010&lang=pt" 
"S1806-37132004000300011-scl","A residência médica em Pneumologia no Brasil","Souza, Evandro Guimarães de","Jornal Brasileiro de Pneumologia; 30(3); 253-259","Jornal Brasileiro de Pneumologia","Inglês, Português","2004","http://www.scielo.br/scielo.php?script=sci_arttext&pid=S1806-37132004000300011&lang=pt" 
"S1806-37132004000300013-scl","Forma grave da síndrome pulmonar e cardiovascular por hantavírus tratada com pressurização positiva através de máscara facial","Pincelli, Mariangela Pimentel, Carvalho, Carlos Roberto Ribeiro de, Figueiredo, Luis Tadeu Moraes, Oliveira Junior, Antônio Delfino de, Soares, Ana Lúcia Bernardo, Barbas, Carmen Sílvia Valente","Jornal Brasileiro de Pneumologia; 30(3); 264-269","Jornal Brasileiro de Pneumologia","Inglês, Português","2004","http://www.scielo.br/scielo.php?script=sci_arttext&pid=S1806-37132004000300013&lang=pt" 
"S1806-37132004000300015-scl","Avaliação econômica da doença pulmonar obstrutiva crônica e de suas agudizações: aplicação na América Latina","Miravitlles, Marc","Jornal Brasileiro de Pneumologia; 30(3); 274-285","Jornal Brasileiro de Pneumologia","Inglês, Português","2004","http://www.scielo.br/scielo.php?script=sci_arttext&pid=S1806-37132004000300015&lang=pt" 
"S1806-37132004000300016-scl","Análise crítica dos escores de avaliação de gravidade da fibrose cística: estado da arte","Santos, Camila Isabel da Silva, Ribeiro, Jose Dirceu, Ribeiro, Antonio Fernando, Hessel, Gabriel","Jornal Brasileiro de Pneumologia; 30(3); 286-298","Jornal Brasileiro de Pneumologia","Inglês, Português","2004","http://www.scielo.br/scielo.php?script=sci_arttext&pid=S1806-37132004000300016&lang=pt" 
"S0100-83582004000200001-scl","Genetic diversity among proso millet (Panicum miliaceum) biotypes assessed by AFLP technique","Karam, D., Westra, P., Nissen, S.J., Ward, S.M., Figueiredo, J.E.F.","Planta Daninha; 22(2); 167-174","Planta Daninha","Inglês","2004","http://www.scielo.br/scielo.php?script=sci_arttext&pid=S0100-83582004000200001&lang=pt" 
"S0100-83582004000200002-scl","Perdas de rendimento de grãos na cultura de arroz irrigado em função da população de plantas e da época relativa de emergência de arroz-vermelho ou de seu genótipo simulador de infestação de arroz-vermelho","Agostinetto, D., Fleck, N.G., Rizzardi, M.A., Balbinot Jr., A.A.","Planta Daninha; 22(2); 175-183","Planta Daninha","Português","2004","http://www.scielo.br/scielo.php?script=sci_arttext&pid=S0100-83582004000200002&lang=pt" 
"S0100-83582004000200003-scl","Influência de cultivares de arroz e épocas da adubação nitrogenada nas relações de interferência da cultura com cultivar simulador de infestação de arroz-vermelho","Agostinetto, D., Fleck, N.G., Rizzardi, M.A., Vidal, R.A., Costa, E.L.N.","Planta Daninha; 22(2); 185-193","Planta Daninha","Português","2004","http://www.scielo.br/scielo.php?script=sci_arttext&pid=S0100-83582004000200003&lang=pt" 
"S0100-83582004000200007-scl","Potencial da utilização de coberturas vegetais de sorgo e milheto na supressão de plantas daninhas em condição de campo: I - plantas em desenvolvimento vegetativo","Vidal, R.A., Trezzi, M.M.","Planta Daninha; 22(2); 217-223","Planta Daninha","Português","2004","http://www.scielo.br/scielo.php?script=sci_arttext&pid=S0100-83582004000200007&lang=pt" 
"S0100-83582004000200009-scl","Viabilidade de sementes de erva-de-touro, sob diferentes condições de armazenamento","Guimarães, S.C., Souza, I.F., Pinho, E.V.R.V.","Planta Daninha; 22(2); 231-238","Planta Daninha","Português","2004","http://www.scielo.br/scielo.php?script=sci_arttext&pid=S0100-83582004000200009&lang=pt" 
"S0100-83582004000200010-scl","Período anterior a interferência de plantas daninhas em soja: estudo de caso com baixo estande e testemunhas duplas","Meschede, D.K., Oliveira Jr., R.S., Constantin, J., Scapim, C.A.","Planta Daninha; 22(2); 239-246","Planta Daninha","Português","2004","http://www.scielo.br/scielo.php?script=sci_arttext&pid=S0100-83582004000200010&lang=pt" 
"S0100-83582004000200013-scl","Influência do teor de água na superfície do solo sobre a eficácia e seletividade do flazasulfuron, na cultura de cana-de-açúcar","Martini, G., Durigan, J.C.","Planta Daninha; 22(2); 259-267","Planta Daninha","Português","2004","http://www.scielo.br/scielo.php?script=sci_arttext&pid=S0100-83582004000200013&lang=pt" 
"S0100-83582004000200005-scl","Caracterização da superfície foliar e das ceras epicuticulares em Commelina benghalensis, Ipomoea grandifolia e Amaranthus hybridus","Monquero, P.A., Christoffoleti, P.J., Matas, J.A., Heredia, A.","Planta Daninha; 22(2); 203-210","Planta Daninha","Português","2004","http://www.scielo.br/scielo.php?script=sci_arttext&pid=S0100-83582004000200005&lang=pt" 
"S0100-83582004000200017-scl","Efeitos de diferentes formulações comerciais de glyphosate sobre estirpes de Bradyrhizobium","Santos, J.B., Jacques, R.J.S., Procópio, S.O., Kasuya, M.C.M., Silva, A.A., Santos, E.A.","Planta Daninha; 22(2); 293-299","Planta Daninha","Português","2004","http://www.scielo.br/scielo.php?script=sci_arttext&pid=S0100-83582004000200017&lang=pt" 
"S0100-83582004000200012-scl","Períodos de interferência de plantas daninhas na cultura do girassol","Brighenti, A.M., Castro, C., Oliveira Jr., R.S., Scapim, C.A., Voll, E., Gazziero, D.L.P.","Planta Daninha; 22(2); 251-257","Planta Daninha","Português","2004","http://www.scielo.br/scielo.php?script=sci_arttext&pid=S0100-83582004000200012&lang=pt" 
"S1806-37132004000300008-scl","Pneumonias adquiridas na comunidade em pacientes idosos: aderência ao Consenso Brasileiro sobre Pneumonias","Almeida, José Roberto de, Ferreira Filho, Olavo Franco","Jornal Brasileiro de Pneumologia; 30(3); 229-236","Jornal Brasileiro de Pneumologia","Inglês, Português","2004","http://www.scielo.br/scielo.php?script=sci_arttext&pid=S1806-37132004000300008&lang=pt" 
"S1020-49892004000600003-spa","Recomendação da Sociedade Brasileira de Pediatria para antibioticoterapia em crianças e adolescentes com pneumonia comunitária","Nascimento-Carvalho, Cristiana M., Souza-Marques, Heloísa H.","Revista Panamericana de Salud Pública; 15(6); 380-387","Revista Panamericana de Salud Pública","Português","2004","http://www.scielosp.org/scielo.php?script=sci_arttext&pid=S1020-49892004000600003&lang=pt" 
"S1517-83822004000100006-scl","SDS-Page and numerical analysis of Candida albicans from human oral cavity and other anatomical sites","Rodrigues, Cristina Crespo, Höfling, José Francisco, Boriollo, Marcelo Fabiano Gomes, Rodrigues, Janaina Aparecida de Oliveira, Azevedo, Ricardo Antunes de, Gonçalves, Reginaldo Bruno, Gomes, Luiz Humberto, Tavares, Flávio César Almeida","Brazilian Journal of Microbiology; 35(1-2); 40-47","Brazilian Journal of Microbiology","Inglês","2004","http://www.scielo.br/scielo.php?script=sci_arttext&pid=S1517-83822004000100006&lang=pt" 
"S1517-83822004000100011-scl","HLA in Brazilian Ashkenazic Jews with chronic dermatophytosis caused by Trichophyton rubrum","Sadahiro, Aya, Moraes, José Roberto Feresin, Moraes, Maria Elisa Hue, Romero, Matilde, Gouvea, Nancy Alves de Lima, Gouvea, Celso José, Ogusku, Mauricio Morishi, Campbell, Iphis, Zaitz, Clarisse","Brazilian Journal of Microbiology; 35(1-2); 69-73","Brazilian Journal of Microbiology","Inglês","2004","http://www.scielo.br/scielo.php?script=sci_arttext&pid=S1517-83822004000100011&lang=pt" 
"S1517-83822004000100012-scl","Molecular characterization of enteroinvasive Escherichia coli ipa genes by PCR-RFLP analysis","Gibotti, Adriana, Tanaka, Tânia L., Oliveira, Valéria R., Taddei, Carla R., Martinez, Marina B.","Brazilian Journal of Microbiology; 35(1-2); 74-80","Brazilian Journal of Microbiology","Inglês","2004","http://www.scielo.br/scielo.php?script=sci_arttext&pid=S1517-83822004000100012&lang=pt" 
"S1517-83822004000100014-scl","Purification and characterization of a new Xylanase from Humicola grisea var. Thermoidea","Lucena-Neto, Severino de Albuquerque, Ferreira-Filho, Edivaldo Ximenes","Brazilian Journal of Microbiology; 35(1-2); 86-90","Brazilian Journal of Microbiology","Inglês","2004","http://www.scielo.br/scielo.php?script=sci_arttext&pid=S1517-83822004000100014&lang=pt" 
"S1517-83822004000100015-scl","Production and properties of an extracellular protease from thermophilic Bacillus sp","Nascimento, Wellingta Cristina Almeida do, Martins, Meire Lelis Leal","Brazilian Journal of Microbiology; 35(1-2); 91-96","Brazilian Journal of Microbiology","Inglês","2004","http://www.scielo.br/scielo.php?script=sci_arttext&pid=S1517-83822004000100015&lang=pt" 
"S1517-83822004000100017-scl","Analysis of the composition of Brazilian propolis extracts by chromatography and evaluation of their in vitro activity against gram-positive bacteria","Sawaya, Alexandra C. H. F., Souza, Kirllian S., Marcucci, Maria C., Cunha, Ildenize B.S., Shimizu, Mario T.","Brazilian Journal of Microbiology; 35(1-2); 104-109","Brazilian Journal of Microbiology","Inglês","2004","http://www.scielo.br/scielo.php?script=sci_arttext&pid=S1517-83822004000100017&lang=pt" 
"S1517-83822004000100018-scl","Activity of glycosidases from freshwater heterotrophic microorganisms on the degradation of extracellular polysaccharide produced by Anabaena spiroides (Cyanobacteria)","Colombo, Vanessa, Vieira, Armando A.H., Moraes, Gilberto","Brazilian Journal of Microbiology; 35(1-2); 110-116","Brazilian Journal of Microbiology","Inglês","2004","http://www.scielo.br/scielo.php?script=sci_arttext&pid=S1517-83822004000100018&lang=pt" 
"S1517-83822004000100021-scl","Bacteria of fecal origin in mangrove oysters (Crassostrea rhizophorae) in the Cocó River estuary, Ceará State, Brazil","Silva, Ana I.M., Vieira, Regine H.S.F., Menezes, Francisca G.R., Fonteles-Filho, Antonio A., Torres, Regina C.O., Sant&#039;Anna, Ernani S.","Brazilian Journal of Microbiology; 35(1-2); 126-130","Brazilian Journal of Microbiology","Inglês","2004","http://www.scielo.br/scielo.php?script=sci_arttext&pid=S1517-83822004000100021&lang=pt" 
"S1517-83822004000100022-scl","Comparative study of antibacterial and antifugal activity of callus culture and adult plants extracts from Alternanthera maritima (Amaranthaceae)","Salvador, Marcos J., Pereira, Paulo S., França, Suzelei C., Candido, Regina C., Ito, Izabel Y., Dias, Diones A.","Brazilian Journal of Microbiology; 35(1-2); 131-136","Brazilian Journal of Microbiology","Inglês","2004","http://www.scielo.br/scielo.php?script=sci_arttext&pid=S1517-83822004000100022&lang=pt" 
"S1517-83822004000100023-scl","Isolation of bacteriocin-producing lactic acid bacteria from meat and meat products and its spectrum of inhibitory activity","Bromberg, Renata, Moreno, Izildinha, Zaganini, Cíntia Lopes, Delboni, Roberta Regina, Oliveira, Josiane de","Brazilian Journal of Microbiology; 35(1-2); 137-144","Brazilian Journal of Microbiology","Inglês","2004","http://www.scielo.br/scielo.php?script=sci_arttext&pid=S1517-83822004000100023&lang=pt" 
"S1517-83822004000100024-scl","Fate of Helicobacter pylori artificially inoculated in lettuce and carrot samples","Gomes, Bruna C., Martinis, Elaine C.P. de","Brazilian Journal of Microbiology; 35(1-2); 145-150","Brazilian Journal of Microbiology","Inglês","2004","http://www.scielo.br/scielo.php?script=sci_arttext&pid=S1517-83822004000100024&lang=pt" 
"S1517-83822004000100025-scl","Stability of free and immobilized Lactobacillus acidophilus and Bifidobacterium lactis in acidified milk and of immobilized B. lactis in yoghurt","Grosso, Carlos Raimundo Ferreira, Fávaro-Trindade, Carmen Sílvia","Brazilian Journal of Microbiology; 35(1-2); 151-156","Brazilian Journal of Microbiology","Inglês","2004","http://www.scielo.br/scielo.php?script=sci_arttext&pid=S1517-83822004000100025&lang=pt" 
"S1517-83822004000100027-scl","Brucella spp. isolation from dogs from commercial breeding kennels in São Paulo state, Brazil","Keid, Lara B., Soares, Rodrigo M., Morais, Zenaide M., Richtzenhain, Leonardo J., Vasconcellos, Sílvio A.","Brazilian Journal of Microbiology; 35(1-2); 161-166","Brazilian Journal of Microbiology","Inglês","2004","http://www.scielo.br/scielo.php?script=sci_arttext&pid=S1517-83822004000100027&lang=pt" 
"S1020-49892004000600012-spa","Salud, equidad y los objetivos de desarrollo del milenio","Torres, Cristina, Mújica, Oscar J.","Revista Panamericana de Salud Pública; 15(6); 430-439","Revista Panamericana de Salud Pública","Espanhol","2004","http://www.scielosp.org/scielo.php?script=sci_arttext&pid=S1020-49892004000600012&lang=pt" 
"S1517-83822004000100010-scl","Staphylococcus spp. in the oral cavity and periodontal pockets of chronic periodontitis patients","Loberto, Jussara Cia S., Martins, Clélia Ap. de Paiva, Santos, Silvana S. Ferreira dos, Cortelli, José Roberto, Jorge, Antonio Olavo Cardoso","Brazilian Journal of Microbiology; 35(1-2); 64-68","Brazilian Journal of Microbiology","Inglês","2004","http://www.scielo.br/scielo.php?script=sci_arttext&pid=S1517-83822004000100010&lang=pt" 
"S1517-83822004000100003-scl","","Moreira, Maria Aparecida Scatamburlo, Souza, Edmar Chartone de, Moraes, Célia Alencar de","Brazilian Journal of Microbiology; 35(1-2); 19-28","Brazilian Journal of Microbiology","Inglês","2004","http://www.scielo.br/scielo.php?script=sci_arttext&pid=S1517-83822004000100003&lang=pt" 
"S1517-83822004000100016-scl","Electrical stimulation of saccharomyces cerevisiae cultures","Araújo, Ofelia Q.F., Coelho, Maria Alice Z., Margarit, Isabel C.P., Vaz-Junior, Carlos A., Rocha-Leão, Maria Helena M.","Brazilian Journal of Microbiology; 35(1-2); 97-103","Brazilian Journal of Microbiology","Inglês","2004","http://www.scielo.br/scielo.php?script=sci_arttext&pid=S1517-83822004000100016&lang=pt" 
"S1517-83822004000100013-scl","Selection of microorganisms for biosurfactant production using agroindustrial wastes","Nitschke, Marcia, Ferraz, Cristina, Pastore, Gláucia M.","Brazilian Journal of Microbiology; 35(1-2); 81-85","Brazilian Journal of Microbiology","Inglês","2004","http://www.scielo.br/scielo.php?script=sci_arttext&pid=S1517-83822004000100013&lang=pt" 
"S1517-83822004000100028-scl","Construction of adenoviral vectors expressing F and G glycoproteins of human respiratory syncytial virus (HRSV)","Kosaka, Ithana Monteiro, Carromeu, Cassiano, Durigon, Edison Luiz, Ventura, Armando Morais","Brazilian Journal of Microbiology; 35(1-2); 167-172","Brazilian Journal of Microbiology","Inglês","2004","http://www.scielo.br/scielo.php?script=sci_arttext&pid=S1517-83822004000100028&lang=pt" 
"S1517-83822004000100007-scl","Comparative evaluation of pyrogens tests in pharmaceutical products","Silveira, Rosimar L., Andrade, Simone S., Schmidt, Cleber A., Casali, Renata G., Dalmora, Sérgio L.","Brazilian Journal of Microbiology; 35(1-2); 48-53","Brazilian Journal of Microbiology","Inglês","2004","http://www.scielo.br/scielo.php?script=sci_arttext&pid=S1517-83822004000100007&lang=pt" 
"S1517-83822004000100004-scl","Detection of Mycobacterium in clinical samples by multiprimer polymerase chain reaction","Barouni, Abdulmonam Saied, Saridakis, Halha Ostrensky, Vidotto, Marilda Carlos","Brazilian Journal of Microbiology; 35(1-2); 29-32","Brazilian Journal of Microbiology","Inglês","2004","http://www.scielo.br/scielo.php?script=sci_arttext&pid=S1517-83822004000100004&lang=pt" 
"S1517-83822004000100002-scl","Bacterial phytase: potential application, in vivo function and regulation of its synthesis","Konietzny, Ursula, Greiner, Ralf","Brazilian Journal of Microbiology; 35(1-2); 12-18","Brazilian Journal of Microbiology","Inglês","2004","http://www.scielo.br/scielo.php?script=sci_arttext&pid=S1517-83822004000100002&lang=pt" 
"S1517-83822004000100001-scl","University education and training of microbiologists in Brazil: 1990-2000","Freire, João Ruy Jardim, Sá, Enilson Luiz Saccol de","Brazilian Journal of Microbiology; 35(1-2); 1-10","Brazilian Journal of Microbiology","Inglês","2004","http://www.scielo.br/scielo.php?script=sci_arttext&pid=S1517-83822004000100001&lang=pt" 
"S1517-83822004000100009-scl","Natural antibodies in paracoccidioidomycosis","Unterkircher, Carmelinda S., Leão, Mariella V.P., Blotta, Maria Heloisa S.L., Camargo, Zoilo Pires de","Brazilian Journal of Microbiology; 35(1-2); 59-63","Brazilian Journal of Microbiology","Inglês","2004","http://www.scielo.br/scielo.php?script=sci_arttext&pid=S1517-83822004000100009&lang=pt" 
"S1517-83822004000100005-scl","The effectiveness of alcohol gel and other hand-cleansing agents against important nosocomial pathogens","Hernandes, Silvio Evandro Daniel, Mello, Aline Cláudia de, Sant&#039;Ana, Janete Jordão, Soares, Vanessa Sarto, Cassiolato, Valdir, Garcia, Lourdes Botelho, Cardoso, Celso Luíz","Brazilian Journal of Microbiology; 35(1-2); 33-39","Brazilian Journal of Microbiology","Inglês","2004","http://www.scielo.br/scielo.php?script=sci_arttext&pid=S1517-83822004000100005&lang=pt" 
"S1517-83822004000100008-scl","Hemagglutinating properties of Salmonella enterica serovar Enteritidis isolated from different sources","Mikcha, Jane M.G., Ferreira, Antonio J. Piantino, Ferreira, Claudete S. Astolfi, Yano, Tomomasa","Brazilian Journal of Microbiology; 35(1-2); 54-58","Brazilian Journal of Microbiology","Inglês","2004","http://www.scielo.br/scielo.php?script=sci_arttext&pid=S1517-83822004000100008&lang=pt" 
"S1517-83822004000100020-scl","Assessing in vitro solubilization potential of different zinc solubilizing bacterial (zsb) isolates","Saravanan, Venkatakrishnan Sivaraj, Subramoniam, Sudalayandy Rama, Raj, Savariappan Anthoni","Brazilian Journal of Microbiology; 35(1-2); 121-125","Brazilian Journal of Microbiology","Inglês","2004","http://www.scielo.br/scielo.php?script=sci_arttext&pid=S1517-83822004000100020&lang=pt" 
"S1517-83822004000100019-scl","The use of acetonitrile as the sole nitrogen and carbon source by Geotrichum sp. JR1","Rezende, Rachel Passos, Dias, João Carlos Teixeira, Monteiro, Andrea Souza, Carraza, Fernando, Linardi, Valter Roberto","Brazilian Journal of Microbiology; 35(1-2); 117-120","Brazilian Journal of Microbiology","Inglês","2004","http://www.scielo.br/scielo.php?script=sci_arttext&pid=S1517-83822004000100019&lang=pt" 
"S1517-83822004000100026-scl","Comparison of two methods for purification of plantaricin ST31, a bacteriocin produced by Lactobacillus plantarum ST31","Todorov, Svetoslav D., Vaz-Velho, Manuela, Gibbs, Paul","Brazilian Journal of Microbiology; 35(1-2); 157-160","Brazilian Journal of Microbiology","Inglês","2004","http://www.scielo.br/scielo.php?script=sci_arttext&pid=S1517-83822004000100026&lang=pt" 
"S1135-57272004000300002-esp","Requisitos de uniformidad para la redacción y edición de manuscritos presentados a revistas biomédicas: Actualización de noviembre de 2003","","Revista Española de Salud Pública; 78(3); 297-321","Revista Española de Salud Pública","Espanhol","2004","http://scielo.isciii.es/scielo.php?script=sci_arttext&pid=S1135-57272004000300002&lang=pt" 
"S1135-57272004000300001-esp","Evaluación económica en salud: de la investigación a la toma de decisiones","Rovira, Juan","Revista Española de Salud Pública; 78(3); 293-295","Revista Española de Salud Pública","Espanhol","2004","http://scielo.isciii.es/scielo.php?script=sci_arttext&pid=S1135-57272004000300001&lang=pt" 
"S1135-57272004000300009-esp","Satisfacción laboral de los odontólogos y estomatólogos del Servicio Gallego de Salud","Varela-Centelles, Pablo Ignacio, Ferreiro Abelairas, Agustín, Fontao Valcárcel, Luis Fernando, Martínez González, Andrés Manuel","Revista Española de Salud Pública; 78(3); 309-402","Revista Española de Salud Pública","Espanhol","2004","http://scielo.isciii.es/scielo.php?script=sci_arttext&pid=S1135-57272004000300009&lang=pt" 
"S1135-57272004000300005-esp","Ganancia funcional y estancia hospitalaria en la unidad geriátrica de media estancia del Hospital Central de Cruz Roja de Madrid","Baztán, Juan J., Domenech, Juan R., González, Margarita, Forcano, Silvia, Morales, Carmen, Ruipérez, Isidoro","Revista Española de Salud Pública; 78(3); 355-366","Revista Española de Salud Pública","Espanhol","2004","http://scielo.isciii.es/scielo.php?script=sci_arttext&pid=S1135-57272004000300005&lang=pt" 
"S1135-57272004000300006-esp","Accesibilidad a los servicios de salud en la práctica de citología reciente de cuello uterino en una zona urbana de Colombia","Lucumí Cuesta, Diego Iván, Gómez Gutiérrez, Luis Fernando","Revista Española de Salud Pública; 78(3); 367-377","Revista Española de Salud Pública","Espanhol","2004","http://scielo.isciii.es/scielo.php?script=sci_arttext&pid=S1135-57272004000300006&lang=pt" 
"S1135-57272004000300008-esp","Zoonosis emergentes ligadas a animales de compañía en la Comunidad de Madrid: diseño de un método para establecer prioridades en salud pública","Almudena, García Nieto, Medina Blanco, Guillermo, Reinares Ortiz de Villajos, Javier","Revista Española de Salud Pública; 78(3); 389-398","Revista Española de Salud Pública","Espanhol","2004","http://scielo.isciii.es/scielo.php?script=sci_arttext&pid=S1135-57272004000300008&lang=pt" 
"S1135-57272004000300004-esp","Análisis coste-efectividad del programa de detección sistemática del cáncer cervical en la región del Algarve, Portugal","Novoa Vázquez, Rosa María","Revista Española de Salud Pública; 78(3); 341-353","Revista Española de Salud Pública","Espanhol","2004","http://scielo.isciii.es/scielo.php?script=sci_arttext&pid=S1135-57272004000300004&lang=pt" 
"S1135-57272004000300007-esp","Utilización de ansiolíticos e hipnóticos en España (1995-2002)","García del Pozo, Javier, Abajo Iglesias, Francisco J. de, Carvajal García-Pando, Alfonso, Montero Corominas, Dolores, Madurga Sanz, Mariano, García del Pozo, Victorina","Revista Española de Salud Pública; 78(3); 379-387","Revista Española de Salud Pública","Espanhol","2004","http://scielo.isciii.es/scielo.php?script=sci_arttext&pid=S1135-57272004000300007&lang=pt" 
