"S1413-24782002000100007-scl","Os negros, a educação e as políticas de ação afirmativa","Valente, Ana Lúcia","Revista Brasileira de Educação; (19); 76-86","Revista Brasileira de Educação","Português","2002","http://www.scielo.br/scielo.php?script=sci_arttext&pid=S1413-24782002000100007&lang=pt" 
"S1413-24782002000100008-scl","Repensando algumas questões sobre o trabalho infanto-juvenil","Alves-Mazzotti, Alda Judith","Revista Brasileira de Educação; (19); 87-98","Revista Brasileira de Educação","Português","2002","http://www.scielo.br/scielo.php?script=sci_arttext&pid=S1413-24782002000100008&lang=pt" 
"S1413-24782002000100009-scl","Política educacional e poder local: análise das repercussões do Programa de Erradicação do Trabalho Infantil na educação de municípios pernambucanos","Ferreira, Rosilda Arruda","Revista Brasileira de Educação; (19); 99-112","Revista Brasileira de Educação","Português","2002","http://www.scielo.br/scielo.php?script=sci_arttext&pid=S1413-24782002000100009&lang=pt" 
"S1413-24782002000100010-scl","Um lugar de produção e a produção de um lugar: a história e a historiografia divulgadas no GT História da Educação da ANPEd (1985-2000)","Catani, Denice Barbara, Faria Filho, Luciano Mendes de","Revista Brasileira de Educação; (19); 113-128","Revista Brasileira de Educação","Português","2002","http://www.scielo.br/scielo.php?script=sci_arttext&pid=S1413-24782002000100010&lang=pt" 
"S1519-70772002000100002-scl","A auditoria legal na União Europeia: enquadramento, debate actual e perspectivas futuras","Almeida, José Joaquim Marques de","Revista Contabilidade &amp; Finanças; 13(28); 29-38","Revista Contabilidade &amp; Finanças","Português","2002","http://www.scielo.br/scielo.php?script=sci_arttext&pid=S1519-70772002000100002&lang=pt" 
"S1519-70772002000100001-scl","Da contabilidade à controladoria: a evolução necessária","Martin, Nilton Cano","Revista Contabilidade &amp; Finanças; 13(28); 7-28","Revista Contabilidade &amp; Finanças","Português","2002","http://www.scielo.br/scielo.php?script=sci_arttext&pid=S1519-70772002000100001&lang=pt" 
"S1519-70772002000100003-scl","Os dividendos como estratégia de investimentos em ações","Bueno, Artur Franco","Revista Contabilidade &amp; Finanças; 13(28); 39-55","Revista Contabilidade &amp; Finanças","Português","2002","http://www.scielo.br/scielo.php?script=sci_arttext&pid=S1519-70772002000100003&lang=pt" 
"S1519-70772002000100004-scl","O conceito de ativos na contabilidade: um fundamento a ser explorado","Goulart, André Moura Cintra","Revista Contabilidade &amp; Finanças; 13(28); 56-65","Revista Contabilidade &amp; Finanças","Português","2002","http://www.scielo.br/scielo.php?script=sci_arttext&pid=S1519-70772002000100004&lang=pt" 
"S1519-70772002000100005-scl","A reestruturação do sistema de pagamentos Brasileiro e seus impactos nas instituições financeiras","Brito, Alan","Revista Contabilidade &amp; Finanças; 13(28); 66-85","Revista Contabilidade &amp; Finanças","Português","2002","http://www.scielo.br/scielo.php?script=sci_arttext&pid=S1519-70772002000100005&lang=pt" 
"S1519-70772002000100006-scl","Uma contribuição à discussão sobre a avaliação de desempenho das instituições federais de ensino superior: uma abordagem da gestão econômica","Santos, Luís Paulo Guimarães dos","Revista Contabilidade &amp; Finanças; 13(28); 86-99","Revista Contabilidade &amp; Finanças","Português","2002","http://www.scielo.br/scielo.php?script=sci_arttext&pid=S1519-70772002000100006&lang=pt" 
"S0188-46112002000100001-mex","Presentación","","Investigaciones geográficas; (47); 1-1","Investigaciones geográficas","Espanhol","2002","http://www.scielo.org.mx/scielo.php?script=sci_arttext&pid=S0188-46112002000100001&lang=pt" 
"S0188-46112002000100010-mex","","Lugo Hubp, José","Investigaciones geográficas; (47); 150-151","Investigaciones geográficas","Espanhol","2002","http://www.scielo.org.mx/scielo.php?script=sci_arttext&pid=S0188-46112002000100010&lang=pt" 
"S0188-46112002000100011-mex","Geomorfología climática","Lugo Hubp, José","Investigaciones geográficas; (47); 152-152","Investigaciones geográficas","Espanhol","2002","http://www.scielo.org.mx/scielo.php?script=sci_arttext&pid=S0188-46112002000100011&lang=pt" 
"S0188-46112002000100012-mex","","Lugo Hubp, José","Investigaciones geográficas; (47); 153-154","Investigaciones geográficas","Espanhol","2002","http://www.scielo.org.mx/scielo.php?script=sci_arttext&pid=S0188-46112002000100012&lang=pt" 
"S0188-46112002000100013-mex","La furia de nuestra Madre Tierra (Forious Earth)","Lugo Hubp, José","Investigaciones geográficas; (47); 155-155","Investigaciones geográficas","Espanhol","2002","http://www.scielo.org.mx/scielo.php?script=sci_arttext&pid=S0188-46112002000100013&lang=pt" 
"S0188-46112002000100014-mex","A la memoria del geógrafo Milton Almeida dos Santos (1926-2001)","Ramírez Suárez, Ricardo","Investigaciones geográficas; (47); 156-156","Investigaciones geográficas","Espanhol","2002","http://www.scielo.org.mx/scielo.php?script=sci_arttext&pid=S0188-46112002000100014&lang=pt" 
"S0188-46112002000100015-mex","Asociación Internacional de Geomorfólogos (AIG). Newsletter No. 19 (1/2002)","","Investigaciones geográficas; (47); 157-163","Investigaciones geográficas","Espanhol","2002","http://www.scielo.org.mx/scielo.php?script=sci_arttext&pid=S0188-46112002000100015&lang=pt" 
"S0188-46112002000100002-mex","Islas de Puerto Rico y de Culebra: regularidades geomorfológicas de su relieve costero y submarino","Hernández Santana, José Ramón, Seguinot Barbosa, José, Reyes González, Ramiro","Investigaciones geográficas; (47); 7-19","Investigaciones geográficas","Espanhol","2002","http://www.scielo.org.mx/scielo.php?script=sci_arttext&pid=S0188-46112002000100002&lang=pt" 
"S0188-46112002000100003-mex","El desarrollo de los paleosuelos como índice de la estabilidad del paisaje: Un ejemplo del centro de México","Jasso, Carolina, Sedov, Sergey, Solleiro, Elizabeth, Gama, Jorge","Investigaciones geográficas; (47); 20-35","Investigaciones geográficas","Espanhol","2002","http://www.scielo.org.mx/scielo.php?script=sci_arttext&pid=S0188-46112002000100003&lang=pt" 
"S0188-46112002000100004-mex","Modelamiento hidrológico espacialmente distribuido: una revisión de sus componentes, niveles de integración e implicaciones en la estimación de procesos hidrológicos en cuencas no instrumentadas","Mendoza, Manuel, Bocco, Gerardo, Bravo, Miguel, Siebe, Christina, Ortiz, Mario Arturo","Investigaciones geográficas; (47); 36-58","Investigaciones geográficas","Espanhol","2002","http://www.scielo.org.mx/scielo.php?script=sci_arttext&pid=S0188-46112002000100004&lang=pt" 
"S0188-46112002000100005-mex","Impacto de la deforestación en el microclima de la subcuenca río Corona, Tamaulipas, México","Salinas Castillo, Wilver Enrique, Treviño Garza, Eduardo Javier","Investigaciones geográficas; (47); 59-76","Investigaciones geográficas","Espanhol","2002","http://www.scielo.org.mx/scielo.php?script=sci_arttext&pid=S0188-46112002000100005&lang=pt" 
"S0188-46112002000100006-mex","Caracterización de las superficies agrícolas y sus volúmenes de irrigación en la cuenca del río San Juan, México","Návar, José, Rodríguez Téllez, Efraín","Investigaciones geográficas; (47); 77-91","Investigaciones geográficas","Espanhol","2002","http://www.scielo.org.mx/scielo.php?script=sci_arttext&pid=S0188-46112002000100006&lang=pt" 
"S0188-46112002000100007-mex","Uso de sensores remotos y SIG para delimitar los cambios en el uso del suelo agrícola de 1970 a 1997 en el estado de Guanajuato","García Nieto, Hilario, García Daguer, Rolando R., Moreno Sánchez, Rafael, González Ramos, Alfredo","Investigaciones geográficas; (47); 92-112","Investigaciones geográficas","Espanhol","2002","http://www.scielo.org.mx/scielo.php?script=sci_arttext&pid=S0188-46112002000100007&lang=pt" 
"S0188-46112002000100008-mex","Reestructuración productiva y desplazamiento pendular de la fuerza de trabajo en la Cuenca Carbonífera de Coahuila, México","Contreras Delgado, Camilo","Investigaciones geográficas; (47); 113-130","Investigaciones geográficas","Espanhol","2002","http://www.scielo.org.mx/scielo.php?script=sci_arttext&pid=S0188-46112002000100008&lang=pt" 
"S0188-46112002000100009-mex","Análisis de los flujos turísticos en el corredor Los Cabos, Baja California Sur","López López, Álvaro","Investigaciones geográficas; (47); 131-149","Investigaciones geográficas","Espanhol","2002","http://www.scielo.org.mx/scielo.php?script=sci_arttext&pid=S0188-46112002000100009&lang=pt" 
"S1984-92302002000100010-scl","Casamento, estupro ou dormindo com o inimigo? Interpretando imagens e representações dos sobreviventes de fusões e aquisições","Caldas, Miguel P., Tonelli, Maria José","Organizações &amp; Sociedade; 9(23); 171-186","Organizações &amp; Sociedade","Português","2002","http://www.scielo.br/scielo.php?script=sci_arttext&pid=S1984-92302002000100010&lang=pt" 
"S1984-92302002000100011-scl","A inovação e o sistema de franqusia na construção civil de Salvador: o caso do plano 100","Muñoz, Rosana, Quintella, Rogério H.","Organizações &amp; Sociedade; 9(23); 1-20","Organizações &amp; Sociedade","Português","2002","http://www.scielo.br/scielo.php?script=sci_arttext&pid=S1984-92302002000100011&lang=pt" 
"S1984-92302002000100007-scl","Quais conceitos permeiam o discurso do presidente da telemar S/A sobre a mudança da empresa com a privatização? Uma análise através de mapas cognitivos","Faria, Luciana de Oliveira","Organizações &amp; Sociedade; 9(23); 1-15","Organizações &amp; Sociedade","Português","2002","http://www.scielo.br/scielo.php?script=sci_arttext&pid=S1984-92302002000100007&lang=pt" 
"S1984-92302002000100005-scl","A pequena e micro empresa e o meio ambiente: a percepção dos empresários com relação aos impactos ambientais","Farias, Josivânia Silva, Teixeira, Rivanda Meira","Organizações &amp; Sociedade; 9(23); 1-20","Organizações &amp; Sociedade","Português","2002","http://www.scielo.br/scielo.php?script=sci_arttext&pid=S1984-92302002000100005&lang=pt" 
"S1984-92302002000100004-scl","Os dilemas do processo de mudança em uma organização pública: Uma análise das representações sociais sobre a prática de P &amp; D multi e interdisciplinar","Brito, Mozar José de, Cappelle, Mônica Carvalho Alves, Brito, Valéria da G. Pereira, Cramer, Luciana","Organizações &amp; Sociedade; 9(23); 1-25","Organizações &amp; Sociedade","Português","2002","http://www.scielo.br/scielo.php?script=sci_arttext&pid=S1984-92302002000100004&lang=pt" 
"S1984-92302002000100006-scl","Filantropia empresarial e trabalho voluntário: interação e conflito na gestão de voluntariado","Pinheiro, Leandro R.","Organizações &amp; Sociedade; 9(23); -","Organizações &amp; Sociedade","Português","2002","http://www.scielo.br/scielo.php?script=sci_arttext&pid=S1984-92302002000100006&lang=pt" 
"S1984-92302002000100003-scl","O debate sobre a descentralização de políticas públicas: um balanço bibliográfico","Guinmarães, Maria do Carmo Lessa","Organizações &amp; Sociedade; 9(23); 1-17","Organizações &amp; Sociedade","Português","2002","http://www.scielo.br/scielo.php?script=sci_arttext&pid=S1984-92302002000100003&lang=pt" 
"S1984-92302002000100009-scl","Análise comparativa acerca da utilização de desenhos na pesquisa sobre a criação do sentido da mudança organizacional","Silva, José Roberto Gomes da, Vergara, Sylvia Constant","Organizações &amp; Sociedade; 9(23); -","Organizações &amp; Sociedade","Português","2002","http://www.scielo.br/scielo.php?script=sci_arttext&pid=S1984-92302002000100009&lang=pt" 
"S1984-92302002000100008-scl","Utilizando mapas cognitivos para compreender interorganizações: o mapeamento nos postos de emissão de identidade","Vargens, Emiliana da Costa","Organizações &amp; Sociedade; 9(23); -","Organizações &amp; Sociedade","Português","2002","http://www.scielo.br/scielo.php?script=sci_arttext&pid=S1984-92302002000100008&lang=pt" 
"S1984-92302002000100001-scl","A transformação das identidades uma empresa de telecomunicações antes e depois de sua privatização: um estudo de metáforas","Carrieri, Alexandre de Pádua","Organizações &amp; Sociedade; 9(23); 1-29","Organizações &amp; Sociedade","Português","2002","http://www.scielo.br/scielo.php?script=sci_arttext&pid=S1984-92302002000100001&lang=pt" 
"S1984-92302002000100002-scl","Reestruturação econômica, relações do trabalho e qualificação na indústria petroquímica no Rio Grande do Sul","Carrion, Rosinha Machado","Organizações &amp; Sociedade; 9(23); 1-31","Organizações &amp; Sociedade","Português","2002","http://www.scielo.br/scielo.php?script=sci_arttext&pid=S1984-92302002000100002&lang=pt" 
"S0034-74932002000100001-cub","Fractura del ahorcado: Antecedentes históricos","Roig Fabré, Esteban, González Valcárcel, Ivón","Revista Cubana de Cirugía; 41(1); 5-10","Revista Cubana de Cirugía","Espanhol","2002","http://scielo.sld.cu/scielo.php?script=sci_arttext&pid=S0034-74932002000100001&lang=pt" 
"S0034-74932002000100002-cub","Incisiones mínimas para mastoplastias reductoras","Sánchez Castillo, Víctor Manuel, Collado Hernández, Carlos Manuel","Revista Cubana de Cirugía; 41(1); 11-15","Revista Cubana de Cirugía","Espanhol","2002","http://scielo.sld.cu/scielo.php?script=sci_arttext&pid=S0034-74932002000100002&lang=pt" 
"S0034-74932002000100003-cub","Vagotomía altamente selectiva en la úlcera duodenal estenosante","Rodríguez Rodríguez, Ibrahím, Solís Chávez, Santiago Luis, Rodríguez López-Callejas, Carlos Arturo, Martínez Portuondo, Ana Ivonne","Revista Cubana de Cirugía; 41(1); 16-22","Revista Cubana de Cirugía","Espanhol","2002","http://scielo.sld.cu/scielo.php?script=sci_arttext&pid=S0034-74932002000100003&lang=pt" 
"S0034-74932002000100004-cub","Abdomen agudo quirúrgico en el anciano","Valdés Jiménez, Jesús M, Mederos Curbelo, Orestes N, Barrera Ortega, Juan Carlos, Cantero Ronquillo, Alexis, Pedroso Díaz, Yanet, Bekele Jémbere, Bruk","Revista Cubana de Cirugía; 41(1); 23-27","Revista Cubana de Cirugía","Espanhol","2002","http://scielo.sld.cu/scielo.php?script=sci_arttext&pid=S0034-74932002000100004&lang=pt" 
"S0034-74932002000100005-cub","Morbilidad y mortalidad de la apendicitis aguda en los pacientes geriátricos, 1990-1999","Morales González, Raúl A, Ordinales Núñez, Juan, Salcedo Frómeta, Leandra O, Lahaba Liqui, Natividad, Fernández Torres, Salomón","Revista Cubana de Cirugía; 41(1); 28-32","Revista Cubana de Cirugía","Espanhol","2002","http://scielo.sld.cu/scielo.php?script=sci_arttext&pid=S0034-74932002000100005&lang=pt" 
"S0034-74932002000100006-cub","Morbilidad en Consulta externa de urología","Martínez Labrada, Rafael S, Arias Ortiz, Armando, Garlobo García, Griselda","Revista Cubana de Cirugía; 41(1); 33-37","Revista Cubana de Cirugía","Espanhol","2002","http://scielo.sld.cu/scielo.php?script=sci_arttext&pid=S0034-74932002000100006&lang=pt" 
"S0034-74932002000100007-cub","Implante con el sistema de reparación herniaria inguinal de prolene (Prolene hernia system)","Goderich Lalán, José, Molina Fernández, Eduardo","Revista Cubana de Cirugía; 41(1); 38-42","Revista Cubana de Cirugía","Espanhol","2002","http://scielo.sld.cu/scielo.php?script=sci_arttext&pid=S0034-74932002000100007&lang=pt" 
"S0034-74932002000100008-cub","Soluciones cristaloides y coloides, como sustitutas de la sangre en el cebado del circuito extracorpóreo durante la cirugía cardiovascular","Llanes Echevarría, José R","Revista Cubana de Cirugía; 41(1); 42-46","Revista Cubana de Cirugía","Espanhol","2002","http://scielo.sld.cu/scielo.php?script=sci_arttext&pid=S0034-74932002000100008&lang=pt" 
"S0034-74932002000100009-cub","Quiste branquial de localización anterior: Presentación de 1 caso","Cantero Ronquillo, Alexis, Mederos Curbelo, Orestes Noel, Valdés Jiménez, Jesús, Romero Díaz, Carlos, Barreras Ortega, Juan Carlos","Revista Cubana de Cirugía; 41(1); 47-49","Revista Cubana de Cirugía","Espanhol","2002","http://scielo.sld.cu/scielo.php?script=sci_arttext&pid=S0034-74932002000100009&lang=pt" 
"S0034-74932002000100010-cub","Dislocaciones occipito-atloideas: Revisión de la literatura y presentación de 7 casos","Roig Fabré, Esteban, González Valcárcel, Ivón, Rincón Flores, Noemí, Corea Barrios, Juan Carlos","Revista Cubana de Cirugía; 41(1); 50-55","Revista Cubana de Cirugía","Espanhol","2002","http://scielo.sld.cu/scielo.php?script=sci_arttext&pid=S0034-74932002000100010&lang=pt" 
"S0034-74932002000100011-cub","Imagen radiológica de pseudocolon derecho: Reporte de 1 caso","Mederos Curbelo, Orestes Noel, Romero Díaz, Carlos, Cantero Ronquillo, Alexis, Martín Gil, Luis Manuel, Barreras Ortega, Juan Carlos","Revista Cubana de Cirugía; 41(1); 56-58","Revista Cubana de Cirugía","Espanhol","2002","http://scielo.sld.cu/scielo.php?script=sci_arttext&pid=S0034-74932002000100011&lang=pt" 
"S0034-74932002000100012-cub","Divertículo de Meckel perforado por cuerpo extraño: Presentación de 1 caso","Rosabal Estacio, José E, Morales González, Raúl A, Fernández Gautier, Miguel, González Constantén, Juan","Revista Cubana de Cirugía; 41(1); 59-61","Revista Cubana de Cirugía","Espanhol","2002","http://scielo.sld.cu/scielo.php?script=sci_arttext&pid=S0034-74932002000100012&lang=pt" 
"S0034-74932002000100013-cub","Coma profundo consecutivo a bloqueo del plexo braquial: A propósito de 1 caso","Labrada Tapia, Domingo Ángel, Labrada Tapia, Víctor Cesar, Llópiz Salasar, Rolando Emilio, Morales González, Raúl A","Revista Cubana de Cirugía; 41(1); 62-64","Revista Cubana de Cirugía","Espanhol","2002","http://scielo.sld.cu/scielo.php?script=sci_arttext&pid=S0034-74932002000100013&lang=pt" 
"S0864-21252002000200001-cub","La prescripción médica es un acto científico, ético y legal","Pérez Peña, Julián","Revista Cubana de Medicina General Integral; 18(2); 114-116","Revista Cubana de Medicina General Integral","Espanhol","2002","http://scielo.sld.cu/scielo.php?script=sci_arttext&pid=S0864-21252002000200001&lang=pt" 
"S0864-21252002000200002-cub","Infertilidad como evento paranormativo: Su repercusión familiar","Fernández Ríos, Malbys, Herrera Santí, Patricia Ma., González Benítez, Idarmis","Revista Cubana de Medicina General Integral; 18(2); 117-120","Revista Cubana de Medicina General Integral","Espanhol","2002","http://scielo.sld.cu/scielo.php?script=sci_arttext&pid=S0864-21252002000200002&lang=pt" 
"S0864-21252002000200003-cub","Factores de riesgo asociados a la hipertensión arterial en mujeres climatéricas","Lugones Botell, Miguel, Dávalos Sarría, Tatiana, Pérez Piñeiro, Julia","Revista Cubana de Medicina General Integral; 18(2); 121-125","Revista Cubana de Medicina General Integral","Espanhol","2002","http://scielo.sld.cu/scielo.php?script=sci_arttext&pid=S0864-21252002000200003&lang=pt" 
"S0864-21252002000200004-cub","Conocimientos teóricos de los Médicos de Familia sobre reanimación cardiopulmonar","Arango Díaz, Ariel, Solero Berrio, Ma. Teresa, Castillo Hermida, Dalila, Álvarez Cabrera, Jorge P.","Revista Cubana de Medicina General Integral; 18(2); 126-131","Revista Cubana de Medicina General Integral","Espanhol","2002","http://scielo.sld.cu/scielo.php?script=sci_arttext&pid=S0864-21252002000200004&lang=pt" 
"S0864-21252002000200005-cub","Ferropenia en niños de 6 a 24 meses de edad con hemoglobina normal","Ruiz González, Marlen, Rosich García, Lourdes, Picó Bergantiños, María V.","Revista Cubana de Medicina General Integral; 18(2); 132-135","Revista Cubana de Medicina General Integral","Espanhol","2002","http://scielo.sld.cu/scielo.php?script=sci_arttext&pid=S0864-21252002000200005&lang=pt" 
"S0864-21252002000200006-cub","¿Están nuestros médicos en condiciones de realizar con calidad el acto de la prescripción?","Sansó Soberats, Félix José","Revista Cubana de Medicina General Integral; 18(2); 136-138","Revista Cubana de Medicina General Integral","Espanhol","2002","http://scielo.sld.cu/scielo.php?script=sci_arttext&pid=S0864-21252002000200006&lang=pt" 
"S0864-21252002000200007-cub","Epidemiología de la conducta suicida","Guibert Reyes, Wilfredo","Revista Cubana de Medicina General Integral; 18(2); 139-142","Revista Cubana de Medicina General Integral","Espanhol","2002","http://scielo.sld.cu/scielo.php?script=sci_arttext&pid=S0864-21252002000200007&lang=pt" 
"S0864-21252002000200008-cub","Enfrentamiento especializado al paciente suicida","Guibert Reyes, Wilfredo","Revista Cubana de Medicina General Integral; 18(2); 143-148","Revista Cubana de Medicina General Integral","Espanhol","2002","http://scielo.sld.cu/scielo.php?script=sci_arttext&pid=S0864-21252002000200008&lang=pt" 
"S0864-21252002000200009-cub","Prevención de la conducta suicida en la APS","Guibert Reyes, Wilfredo","Revista Cubana de Medicina General Integral; 18(2); 149-154","Revista Cubana de Medicina General Integral","Espanhol","2002","http://scielo.sld.cu/scielo.php?script=sci_arttext&pid=S0864-21252002000200009&lang=pt" 
"S0864-21252002000200010-cub","Guía para la práctica clínica en infecciones del tracto urinario","Cires Pujol, Miriam, Freijoso Santiesteban, Elsie, Vergara Fabián, Eduardo, Machado, Otto, Alfonso, Ismany, Salas Obregón, Lisset, Borrero Guillot, Adrián, Hernández Silveiro, Dámaso R., Reyes, Leonardo, Sansó Soberats, Félix José, Breto García, Andrés","Revista Cubana de Medicina General Integral; 18(2); 155-160","Revista Cubana de Medicina General Integral","Espanhol","2002","http://scielo.sld.cu/scielo.php?script=sci_arttext&pid=S0864-21252002000200010&lang=pt" 
"S0864-21252002000200011-cub","Del método científico al clínico: Consideraciones teóricas","Hernández Hernández, Roberto","Revista Cubana de Medicina General Integral; 18(2); 161-164","Revista Cubana de Medicina General Integral","Espanhol","2002","http://scielo.sld.cu/scielo.php?script=sci_arttext&pid=S0864-21252002000200011&lang=pt" 
"S0864-21252002000200013-cub","Metodología para evaluar el impacto de los acontecimientos vitales de la familia en la salud familiar","Herrera Santí, Patricia Ma., González Benítez, Idarmis, Soler Cárdenas, Silvio","Revista Cubana de Medicina General Integral; 18(2); 169-172","Revista Cubana de Medicina General Integral","Espanhol","2002","http://scielo.sld.cu/scielo.php?script=sci_arttext&pid=S0864-21252002000200013&lang=pt" 
"S0864-21252002000200016-cub","Bibliomed","","Revista Cubana de Medicina General Integral; 18(2); 176-177","Revista Cubana de Medicina General Integral","Espanhol","2002","http://scielo.sld.cu/scielo.php?script=sci_arttext&pid=S0864-21252002000200016&lang=pt" 
"S0864-21252002000200012-cub","La resistencia a los antimicrobianos, un problema mundial","Cires Pujol, Miriam","Revista Cubana de Medicina General Integral; 18(2); 165-168","Revista Cubana de Medicina General Integral","Espanhol","2002","http://scielo.sld.cu/scielo.php?script=sci_arttext&pid=S0864-21252002000200012&lang=pt" 
