"S0100-83582002000100004-scl","Estádio de desenvolvimento e estresse hídrico e as potencialidades alelopáticas do capim-marandu","Souza Filho, A.P.S., Alves, S.M., Dutra, S.","Planta Daninha; 20(1); 25-31","Planta Daninha","Português","2002","http://www.scielo.br/scielo.php?script=sci_arttext&pid=S0100-83582002000100004&lang=pt" 
"S0100-83582002000100008-scl","Período crítico para controle de Brachiaria plantaginea em função de épocas de semeadura da soja após dessecação da cobertura vegetal","Fleck, N.G., Rizzard, M.A., Vidal, R.A., Merotto Jr., A., Agostinetto, D., Balbinot Jr., A.A.","Planta Daninha; 20(1); 53-62","Planta Daninha","Português","2002","http://www.scielo.br/scielo.php?script=sci_arttext&pid=S0100-83582002000100008&lang=pt" 
"S0100-83582002000100013-scl","Interação de glyphosate com carfentrazone-ethyl","Werlang, R.C., Silva, A.A.","Planta Daninha; 20(1); 93-102","Planta Daninha","Português","2002","http://www.scielo.br/scielo.php?script=sci_arttext&pid=S0100-83582002000100013&lang=pt" 
"S0100-83582002000100014-scl","Carfentrazone-ethyl, isolado e associado a duas formulações de glyphosate no controle de duas espécies de trapoeraba","Ronchi, C.P., Silva, A.A., Ferreira, L.R., Miranda, G.V., Terra, A.A.","Planta Daninha; 20(1); 103-113","Planta Daninha","Português","2002","http://www.scielo.br/scielo.php?script=sci_arttext&pid=S0100-83582002000100014&lang=pt" 
"S0100-83582002000100015-scl","Momento da chuva após a aplicação e a eficácia dos herbicidas sulfosate e glyphosate aplicados em diferentes formulações","Pedrinho Júnior, A.F.F., Martini, G., Felici, G.V., Piva, F.M., Durigan, J.C.","Planta Daninha; 20(1); 115-123","Planta Daninha","Português","2002","http://www.scielo.br/scielo.php?script=sci_arttext&pid=S0100-83582002000100015&lang=pt" 
"S0100-83582002000100016-scl","Calagem e o potencial de lixiviação de imazaquin em colunas de solo","Inoue, M.H., Marchiori Jr., O., Oliveira Jr., R.S., Constantin, J., Tormena, C.A.","Planta Daninha; 20(1); 125-132","Planta Daninha","Português","2002","http://www.scielo.br/scielo.php?script=sci_arttext&pid=S0100-83582002000100016&lang=pt" 
"S0100-83582002000100017-scl","Persistência do acetochlor em solo sob semeadura direta e convencional","Ferri, M.V.W., Vidal, R.A.","Planta Daninha; 20(1); 133-139","Planta Daninha","Português","2002","http://www.scielo.br/scielo.php?script=sci_arttext&pid=S0100-83582002000100017&lang=pt" 
"S0100-83582002000100018-scl","Efeitos do volume de calda de aplicação e adição de surfatantes organossiliconados na eficiência do MSMA no controle de tiririca","Procópio, S.O., Gontijo Neto, M.M., Siqueira, J.G., Silva, A.A., Ferreira, L.R., Ferreira, F.A., Santos, J.B.","Planta Daninha; 20(1); 141-146","Planta Daninha","Português","2002","http://www.scielo.br/scielo.php?script=sci_arttext&pid=S0100-83582002000100018&lang=pt" 
"S0100-83582002000100001-scl","Caracteres anatômicos de duas espécies de trapoeraba e a eficiência do glyphosate","Santos, I.C., Meira, R.M.S.A., Ferreira, F.A., Santos, L.D.T., Miranda, G.V.","Planta Daninha; 20(1); 1-8","Planta Daninha","Português","2002","http://www.scielo.br/scielo.php?script=sci_arttext&pid=S0100-83582002000100001&lang=pt" 
"S0100-83582002000100011-scl","Atividade da acetolactato sintase de plantas de milho e de amendoim-bravo (Euphorbia heterophylla) resistentes e suscetíveis ao imazaquin","Oliveira, M.F., Prates, H.T., Brighenti, A.M., Gazziero, D.L.P., Vidal, R.A., Vargas, L., Oliveira Jr., R.S., Purcino, A.A.C.","Planta Daninha; 20(1); 77-82","Planta Daninha","Português","2002","http://www.scielo.br/scielo.php?script=sci_arttext&pid=S0100-83582002000100011&lang=pt" 
"S0100-83582002000100007-scl","Aplicação tardia de glyphosate e estande e desenvolvimento inicial do arroz em sistema de cultivo mínimo","Crusciol, C.A.C., Lima, E.V., Andreotti, M., Schiocchet, M.A.","Planta Daninha; 20(1); 45-51","Planta Daninha","Português","2002","http://www.scielo.br/scielo.php?script=sci_arttext&pid=S0100-83582002000100007&lang=pt" 
"S0327-07932002000200001-arg","Application of a Monte Carlo method for the evaluation of reactivity ratios in the copolymerization of furfuryl methacrylate with N-vinyl-2-pyrrolidone","Zaldívar, D., Fuentes, G., Monett, D., Peniche, C., Arcis, R. W., Soto, A., San Roman, J.","Latin American applied research; 32(2); 117-122","Latin American applied research","Inglês","2002","http://www.scielo.org.ar/scielo.php?script=sci_arttext&pid=S0327-07932002000200001&lang=pt" 
"S0327-07932002000200002-arg","Platinum monolithic catalyst for SO2 abatement in dust-free flue-gas from combustion units","Alvarez, E., Blanco, J., Otero De Becerra, J., Olivares Del Valle, J., Salvador, L.","Latin American applied research; 32(2); 123-129","Latin American applied research","Inglês","2002","http://www.scielo.org.ar/scielo.php?script=sci_arttext&pid=S0327-07932002000200002&lang=pt" 
"S0327-07932002000200003-arg","Hydroformylation of oct-1-ene by supported aqueous phase catalysis: Influence of catalytic complex and preparation method of the supports","Jáuregui-Haza, U. J., Wilhelm, A. M., Delmas, H.","Latin American applied research; 32(2); 131-136","Latin American applied research","Inglês","2002","http://www.scielo.org.ar/scielo.php?script=sci_arttext&pid=S0327-07932002000200003&lang=pt" 
"S0327-07932002000200004-arg","Low carbon steel sheets obtained by reactive annealing","Oldani, C. R., Alija, A.","Latin American applied research; 32(2); 137-140","Latin American applied research","Inglês","2002","http://www.scielo.org.ar/scielo.php?script=sci_arttext&pid=S0327-07932002000200004&lang=pt" 
"S0327-07932002000200005-arg","Gas-phase β-pinene isomerization over acid-activated bentonite","Foletto, E.L., Valentini, A., Probst, L.F.D., Porto, L.M.","Latin American applied research; 32(2); 141-144","Latin American applied research","Inglês","2002","http://www.scielo.org.ar/scielo.php?script=sci_arttext&pid=S0327-07932002000200005&lang=pt" 
"S0327-07932002000200006-arg","Kinetics of iron oxide direct reduction by coal","Abril, E.R.","Latin American applied research; 32(2); 145-149","Latin American applied research","Inglês","2002","http://www.scielo.org.ar/scielo.php?script=sci_arttext&pid=S0327-07932002000200006&lang=pt" 
"S0327-07932002000200007-arg","Estimating pure diffusion contributions in alkaline pulping processes","Costanza, Vicente, Costanza, Pedro","Latin American applied research; 32(2); 151-159","Latin American applied research","Inglês","2002","http://www.scielo.org.ar/scielo.php?script=sci_arttext&pid=S0327-07932002000200007&lang=pt" 
"S0327-07932002000200008-arg","An alternative procedure to retrofit an industrial plant: A case study","Liporace, F.S., Pessoa, F.L.P., Queiroz, E.M.","Latin American applied research; 32(2); 161-170","Latin American applied research","Inglês","2002","http://www.scielo.org.ar/scielo.php?script=sci_arttext&pid=S0327-07932002000200008&lang=pt" 
"S0327-07932002000200009-arg","A parallel - Consecutive reaction scheme in three-dimensional pore structure catalyst pellet","Gonzo, Elio E.","Latin American applied research; 32(2); 171-175","Latin American applied research","Inglês","2002","http://www.scielo.org.ar/scielo.php?script=sci_arttext&pid=S0327-07932002000200009&lang=pt" 
"S0327-07932002000200010-arg","Synthesis of chemically induced separation sequences using fuzzy heuristic based system","Cisternas, L. A., Guerrero, Ch. J., Melo, J. A.","Latin American applied research; 32(2); 177-182","Latin American applied research","Inglês","2002","http://www.scielo.org.ar/scielo.php?script=sci_arttext&pid=S0327-07932002000200010&lang=pt" 
"S0327-07932002000200011-arg","Monitoring the thermal stability of the porous structure of hybrid SiO2-TiO2 materials by means of mass transport coefficient calculations","Silva, H. S., Larsen, G. F., Venturini, R. B., González, J. E.","Latin American applied research; 32(2); 183-188","Latin American applied research","Inglês","2002","http://www.scielo.org.ar/scielo.php?script=sci_arttext&pid=S0327-07932002000200011&lang=pt" 
"S0327-07932002000200012-arg","Effect of impeller clearance on power consumption of unsteadily forward-reverse rotating multiple impellers in an unbaffled agitation vessel","Yoshida, Masanori, Ito, Akira, Yamagiwa, Kazuaki, Ohkawa, Akira, Abe, Masahiko, Tezura, Shuichi, Shimazaki, Masuo","Latin American applied research; 32(2); 189-194","Latin American applied research","Inglês","2002","http://www.scielo.org.ar/scielo.php?script=sci_arttext&pid=S0327-07932002000200012&lang=pt" 
"S0327-07932002000200013-arg","Mass and energy balances as state-space models for aerobic batch fermentations","Dondo, R., Marqués, D.","Latin American applied research; 32(2); 195-204","Latin American applied research","Inglês","2002","http://www.scielo.org.ar/scielo.php?script=sci_arttext&pid=S0327-07932002000200013&lang=pt" 
"S0327-07932002000200014-arg","Regeneration and utilization of spent bleaching clay","Foletto, E.L., Alves, C.C.A., Sganzerla, L.R., Porto, L.M.","Latin American applied research; 32(2); 205-208","Latin American applied research","Inglês","2002","http://www.scielo.org.ar/scielo.php?script=sci_arttext&pid=S0327-07932002000200014&lang=pt" 
"S0327-07932002000200015-arg","Histamine formation by Morganella morganii isolated from Trachurus murphyii (Chilean mackerel)","Torres, Silvia, Roeckel, Marlene, Martí, M. Cristina","Latin American applied research; 32(2); 205-208","Latin American applied research","Inglês","2002","http://www.scielo.org.ar/scielo.php?script=sci_arttext&pid=S0327-07932002000200015&lang=pt" 
"S0103-166X2002000100002-scl","Conflitos vivenciados por atletas quanto à manutenção da prática esportiva de alto rendimento","Epiphanio, Erika Höfling","Estudos de Psicologia (Campinas); 19(1); 15-22","Estudos de Psicologia (Campinas)","Português","2002","http://www.scielo.br/scielo.php?script=sci_arttext&pid=S0103-166X2002000100002&lang=pt" 
"S0103-166X2002000100001-scl","Orientação profissional sob o enfoque da análise do comportamento: avaliação de uma experiência","Moura, Cynthia Borges de, Silveira, Jocelaine Martins da","Estudos de Psicologia (Campinas); 19(1); 5-14","Estudos de Psicologia (Campinas)","Português","2002","http://www.scielo.br/scielo.php?script=sci_arttext&pid=S0103-166X2002000100001&lang=pt" 
"S0103-166X2002000100003-scl","Imagem e self em Plotino e Jung: confluências","Raffaelli, Rafael","Estudos de Psicologia (Campinas); 19(1); 23-36","Estudos de Psicologia (Campinas)","Português","2002","http://www.scielo.br/scielo.php?script=sci_arttext&pid=S0103-166X2002000100003&lang=pt" 
"S0103-166X2002000100005-scl","Condições que promovem o aprimoramento profissional e comportamentos relacionados à mudança clínica: atribuições de terapeutas comportamentais experientes e não experientes","Alvarez, Luciana Ferreira, Silveira, Jocelaine Martins da","Estudos de Psicologia (Campinas); 19(1); 49-59","Estudos de Psicologia (Campinas)","Português","2002","http://www.scielo.br/scielo.php?script=sci_arttext&pid=S0103-166X2002000100005&lang=pt" 
"S0103-166X2002000100006-scl","A Experiência do Êxtase: Categorizando os Processos Envolvidos na Ampliação da Consciência","Moraes, Celia Carvalho de","Estudos de Psicologia (Campinas); 19(1); 60-77","Estudos de Psicologia (Campinas)","Português","2002","http://www.scielo.br/scielo.php?script=sci_arttext&pid=S0103-166X2002000100006&lang=pt" 
"S0103-166X2002000100008-scl","Diferenças individuais: temperamento e personalidade; importância da teoria","Ito, Patrícia do Carmo Pereira, Guzzo, Raquel Souza Lobo","Estudos de Psicologia (Campinas); 19(1); 91-100","Estudos de Psicologia (Campinas)","Português","2002","http://www.scielo.br/scielo.php?script=sci_arttext&pid=S0103-166X2002000100008&lang=pt" 
"S0103-166X2002000100007-scl","Percepção de professores sobre alunos superdotados","Maia-Pinto, Renata Rodrigues, Fleith, Denise de Souza","Estudos de Psicologia (Campinas); 19(1); 78-90","Estudos de Psicologia (Campinas)","Português","2002","http://www.scielo.br/scielo.php?script=sci_arttext&pid=S0103-166X2002000100007&lang=pt" 
"S1415-65552002000100007-scl","Ora (direis) ouvir estrelas!: Estudo das citações de autores de estratégia na produção acadêmica brasileira","Bignetti, Luiz Paulo, Paiva, Ely Laureano","Revista de Administração Contemporânea; 6(1); 105-125","Revista de Administração Contemporânea","Português","2002","http://www.scielo.br/scielo.php?script=sci_arttext&pid=S1415-65552002000100007&lang=pt" 
"S1415-65552002000100003-scl","Eficiência fraca, efeito dia-da-semana e efeito feriado no mercado acionário brasileiro: uma análise empírica sistemática e robusta","Bone, Rosemarie Bröker, Ribeiro, Eduardo Pontual","Revista de Administração Contemporânea; 6(1); 19-37","Revista de Administração Contemporânea","Português","2002","http://www.scielo.br/scielo.php?script=sci_arttext&pid=S1415-65552002000100003&lang=pt" 
"S1415-65552002000100004-scl","Desenvolvimento de produtos na indústria automobilística brasileira: perspectivas e obstáculos para a capacitação local","Consoni, Flávia Luciane, Carvalho, Ruy de Quadros","Revista de Administração Contemporânea; 6(1); 39-61","Revista de Administração Contemporânea","Português","2002","http://www.scielo.br/scielo.php?script=sci_arttext&pid=S1415-65552002000100004&lang=pt" 
"S1415-65552002000100005-scl","A análise de agrupamentos como instrumento de apoio à melhoria da qualidade dos serviços aos clientes","Moori, Roberto Giro, Marcondes, Reynaldo Cavalheiro, Ávila, Ricardo Teixeira","Revista de Administração Contemporânea; 6(1); 63-84","Revista de Administração Contemporânea","Português","2002","http://www.scielo.br/scielo.php?script=sci_arttext&pid=S1415-65552002000100005&lang=pt" 
"S1415-65552002000100006-scl","Alianças estratégicas: conceito e teoria","Klotzle, Marcelo Cabus","Revista de Administração Contemporânea; 6(1); 85-104","Revista de Administração Contemporânea","Português","2002","http://www.scielo.br/scielo.php?script=sci_arttext&pid=S1415-65552002000100006&lang=pt" 
"S1415-65552002000100008-scl","Estrutura ocupacional, autoridade gerencial e determinação de salários em organizações fordistas: o caso da indústria de transformações no Brasil","Neves, Jorge Alexandre, Fernandes, Danielle Cireno","Revista de Administração Contemporânea; 6(1); 127-140","Revista de Administração Contemporânea","Português","2002","http://www.scielo.br/scielo.php?script=sci_arttext&pid=S1415-65552002000100008&lang=pt" 
"S1415-65552002000100009-scl","A privatização de empresas siderúrgicas brasileiras: reflexos na gestão de recursos humanos","Oliva, Eduardo de Camargo","Revista de Administração Contemporânea; 6(1); 141-161","Revista de Administração Contemporânea","Português","2002","http://www.scielo.br/scielo.php?script=sci_arttext&pid=S1415-65552002000100009&lang=pt" 
"S1415-65552002000100010-scl","A terceirização e seus impactos: um estudo em grandes organizações de Minas Gerais","Valença, Myrian Constantino de Almeida, Barbosa, Allan Claudius Queiroz","Revista de Administração Contemporânea; 6(1); 163-185","Revista de Administração Contemporânea","Português","2002","http://www.scielo.br/scielo.php?script=sci_arttext&pid=S1415-65552002000100010&lang=pt" 
"S1415-65552002000100011-scl","Cultura organizacional em ambiente burocrático","Saraiva, Luiz Alex Silva","Revista de Administração Contemporânea; 6(1); 187-207","Revista de Administração Contemporânea","Português","2002","http://www.scielo.br/scielo.php?script=sci_arttext&pid=S1415-65552002000100011&lang=pt" 
"S0103-166X2002000100004-scl","A influência de fatores de personalidade e de organização do trabalho no burnout em profissionais de saúde","Souza, Wilma Costa, Silva, Angela Maria Monteiro da","Estudos de Psicologia (Campinas); 19(1); 37-48","Estudos de Psicologia (Campinas)","Português","2002","http://www.scielo.br/scielo.php?script=sci_arttext&pid=S0103-166X2002000100004&lang=pt" 
"S1025-028X2002000100001-cub","Serogrupos, serosubtipos, inmunotipos y susceptibilidad antimicrobiana de cepas de Neisseria meningitidis aisladas de portadores","Zamora, Leydis, Martínez, Isabel, Gutiérrez, Mercedes, Núñez, Niuris, Ginebra, Mónica, Climent, Yanet, Sotolongo, Franklin, Camaraza, María Amalia","Vaccimonitor; 11(1); 1-4","Vaccimonitor","Espanhol","2002","http://scielo.sld.cu/scielo.php?script=sci_arttext&pid=S1025-028X2002000100001&lang=pt" 
"S1025-028X2002000100002-cub","ELISA cualitativo de IgA anti-Lipopolisacárido de Vibrio cholerae en saliva de humanos","del Campo, Judith Mónica, Ochoa, Rolando, Lastre, Miriam, Bracho, Gustavo, Taboada, Carlos, Díaz, Miriam, Pérez, Oliver","Vaccimonitor; 11(1); 5-10","Vaccimonitor","Espanhol","2002","http://scielo.sld.cu/scielo.php?script=sci_arttext&pid=S1025-028X2002000100002&lang=pt" 
"S1025-028X2002000100003-cub","Preparado de inmunoglobulina contra LPS de Pseudomonas aeruginosa serotipo O11","Moya, Aniel, Joó, Lázaro, Rodríguez, Alexandro, Hernández, Janhna, Hernández, Johnatan, Almenares, Juan F, Berrios, Denisse, Rodríguez, Zoraida, Cádiz, Armando, Esnard, Sara C.","Vaccimonitor; 11(1); 12-17","Vaccimonitor","Espanhol","2002","http://scielo.sld.cu/scielo.php?script=sci_arttext&pid=S1025-028X2002000100003&lang=pt" 
"S1409-41422002000100001-cri","","Speranza S, Mario","Revista Costarricense de Cardiología; 4(1); 3-3","Revista Costarricense de Cardiología","Espanhol","2002","http://www.scielo.sa.cr/scielo.php?script=sci_arttext&pid=S1409-41422002000100001&lang=pt" 
"S1409-41422002000100002-cri","Y tú... ¿recetaste estatinas hoy?...","Pichel, Daniel R., Motta, Jorge A., Rodríguez, Antonio J.","Revista Costarricense de Cardiología; 4(1); 4-6","Revista Costarricense de Cardiología","Espanhol","2002","http://www.scielo.sa.cr/scielo.php?script=sci_arttext&pid=S1409-41422002000100002&lang=pt" 
"S1409-41422002000100003-cri","Tumores intracardíacos: aspectos generales y experiencia quirúrgica en el Hospital México","Induni, Eduardo, Pucc, Juan, Soto, Longino","Revista Costarricense de Cardiología; 4(1); 7-11","Revista Costarricense de Cardiología","Espanhol","2002","http://www.scielo.sa.cr/scielo.php?script=sci_arttext&pid=S1409-41422002000100003&lang=pt" 
"S1409-41422002000100004-cri","Actualización en farmacoterapia: la farmacología de las estatinas. Primera parte","Arguedas Quesada, José Agustín","Revista Costarricense de Cardiología; 4(1); 13-21","Revista Costarricense de Cardiología","Espanhol","2002","http://www.scielo.sa.cr/scielo.php?script=sci_arttext&pid=S1409-41422002000100004&lang=pt" 
"S1409-41422002000100005-cri","Tratamiento de dislipidemias con ácido nicotínico","Martínez-Ortiz, JA, Páez, L, von Saalfeld, K","Revista Costarricense de Cardiología; 4(1); 23-27","Revista Costarricense de Cardiología","Espanhol","2002","http://www.scielo.sa.cr/scielo.php?script=sci_arttext&pid=S1409-41422002000100005&lang=pt" 
"S1409-41422002000100006-cri","Triglicéridos, &quot;el enemigo olvidado&quot;","Rodríguez, Antonio J.","Revista Costarricense de Cardiología; 4(1); 28-31","Revista Costarricense de Cardiología","Espanhol","2002","http://www.scielo.sa.cr/scielo.php?script=sci_arttext&pid=S1409-41422002000100006&lang=pt" 
"S1409-41422002000100007-cri","Bloqueo de Ganglio Estrellado en el tratamiento de angina de pecho refractaria: un posible tratamiento coadyuvante","Salas Herrera, Isaías, Huertas Gabert, Luis Carlos","Revista Costarricense de Cardiología; 4(1); 33-35","Revista Costarricense de Cardiología","Espanhol","2002","http://www.scielo.sa.cr/scielo.php?script=sci_arttext&pid=S1409-41422002000100007&lang=pt" 
"S1409-41422002000100008-cri","Diabetes Mellitus, una enfermedad cardiovascular","Vinocour Fornieri, Mary Velvet, Tortós Guzmán, Jaime E.","Revista Costarricense de Cardiología; 4(1); 36-44","Revista Costarricense de Cardiología","Espanhol","2002","http://www.scielo.sa.cr/scielo.php?script=sci_arttext&pid=S1409-41422002000100008&lang=pt" 
"S1409-41422002000100009-cri","Síndrome de Brugada: reporte del primer caso diagnosticado en Costa Rica","Lanzas Rodríguez, Roger, Araya Gómez, Vivien, Cruz Cruz, Flory, Gutiérrez Sotelo, Oswaldo, Arias Valverde, Elionay","Revista Costarricense de Cardiología; 4(1); 46-50","Revista Costarricense de Cardiología","Espanhol","2002","http://www.scielo.sa.cr/scielo.php?script=sci_arttext&pid=S1409-41422002000100009&lang=pt" 
"S1409-41422002000100010-cri","Tratamiento del Síndrome de QT Largo adquirido con estimulación cardíaca: un caso clínico","Gutiérrez Sotelo, Oswaldo","Revista Costarricense de Cardiología; 4(1); 51-56","Revista Costarricense de Cardiología","Espanhol","2002","http://www.scielo.sa.cr/scielo.php?script=sci_arttext&pid=S1409-41422002000100010&lang=pt" 
"S1409-41422002000100011-cri","","Araya Gómez, Vivien","Revista Costarricense de Cardiología; 4(1); 58-58","Revista Costarricense de Cardiología","Espanhol","2002","http://www.scielo.sa.cr/scielo.php?script=sci_arttext&pid=S1409-41422002000100011&lang=pt" 
"S1409-41422002000100012-cri","Educación Continua y Recertificación Médica","","Revista Costarricense de Cardiología; 4(1); 61-63","Revista Costarricense de Cardiología","Espanhol","2002","http://www.scielo.sa.cr/scielo.php?script=sci_arttext&pid=S1409-41422002000100012&lang=pt" 
"S1413-24782002000100001-scl","","","Revista Brasileira de Educação; (19); 3-4","Revista Brasileira de Educação","Português","2002","http://www.scielo.br/scielo.php?script=sci_arttext&pid=S1413-24782002000100001&lang=pt" 
"S1413-24782002000100003-scl","Notas sobre a experiência e o saber de experiência","Bondía, Jorge Larrosa","Revista Brasileira de Educação; (19); 20-28","Revista Brasileira de Educação","Português","2002","http://www.scielo.br/scielo.php?script=sci_arttext&pid=S1413-24782002000100003&lang=pt" 
"S1413-24782002000100004-scl","Bases antropológicas da cidadania brasileira: sobre escola pública e cidadania na Primeira República","Valle, Lílian do","Revista Brasileira de Educação; (19); 29-42","Revista Brasileira de Educação","Português","2002","http://www.scielo.br/scielo.php?script=sci_arttext&pid=S1413-24782002000100004&lang=pt" 
"S1413-24782002000100016-scl","Comenius &amp; Educação","Goulart, Maria Alice","Revista Brasileira de Educação; (19); 166-167","Revista Brasileira de Educação","Português","2002","http://www.scielo.br/scielo.php?script=sci_arttext&pid=S1413-24782002000100016&lang=pt" 
"S1413-24782002000100013-scl","Em volta da mesa: uma conversa sobre grupos de trabalho, na FAE/UFMG, em abril de 1986","Maciel, Ira Maria, Miranda, Glaura Vasquez de, Arroyo, Miguel Gonzáles, Paixão, Léa Pinheiro, Soares, Magda Becker, Lopes, Eliane Marta Teixeira","Revista Brasileira de Educação; (19); 148-154","Revista Brasileira de Educação","Português","2002","http://www.scielo.br/scielo.php?script=sci_arttext&pid=S1413-24782002000100013&lang=pt" 
"S1413-24782002000100012-scl","Direitos humanos e cidadania: a educação como campo de conflito","Abicail, Carlos Augusto","Revista Brasileira de Educação; (19); 138-147","Revista Brasileira de Educação","Português","2002","http://www.scielo.br/scielo.php?script=sci_arttext&pid=S1413-24782002000100012&lang=pt" 
"S1413-24782002000100011-scl","A avaliação no processo ensino/aprendizagem: os desafios postos pelas múltiplas faces do cotidiano","Esteban, Maria Teresa","Revista Brasileira de Educação; (19); 129-137","Revista Brasileira de Educação","Português","2002","http://www.scielo.br/scielo.php?script=sci_arttext&pid=S1413-24782002000100011&lang=pt" 
"S1413-24782002000100018-scl","Gramsci, o estado e a escola","Pires, Raíssa Pimenta","Revista Brasileira de Educação; (19); 163-164","Revista Brasileira de Educação","Português","2002","http://www.scielo.br/scielo.php?script=sci_arttext&pid=S1413-24782002000100018&lang=pt" 
"S1413-24782002000100017-scl","A investigação da natureza no Brasil Colônia","Selles, Sandra Escovedo","Revista Brasileira de Educação; (19); 160-163","Revista Brasileira de Educação","Português","2002","http://www.scielo.br/scielo.php?script=sci_arttext&pid=S1413-24782002000100017&lang=pt" 
"S1413-24782002000100015-scl","Cultura infantil: a construção corporativa da infância","Torres, Maria Cecilia","Revista Brasileira de Educação; (19); 165-166","Revista Brasileira de Educação","Português","2002","http://www.scielo.br/scielo.php?script=sci_arttext&pid=S1413-24782002000100015&lang=pt" 
"S1413-24782002000100014-scl","Grupos de trabalho: avaliação e proposta","","Revista Brasileira de Educação; (19); 155-157","Revista Brasileira de Educação","Português","2002","http://www.scielo.br/scielo.php?script=sci_arttext&pid=S1413-24782002000100014&lang=pt" 
"S1413-24782002000100002-scl","Rei morto, rei posto? as lutas pela sucessão de Pierre Bourdieu no campo acadêmico francês","Brito, Angela Xavier de","Revista Brasileira de Educação; (19); 5-19","Revista Brasileira de Educação","Português","2002","http://www.scielo.br/scielo.php?script=sci_arttext&pid=S1413-24782002000100002&lang=pt" 
"S1413-24782002000100005-scl","A sustentabilidade da reforma educacional em questão: a posição dos organismos internacionais","Krawczyk, Nora","Revista Brasileira de Educação; (19); 43-62","Revista Brasileira de Educação","Português","2002","http://www.scielo.br/scielo.php?script=sci_arttext&pid=S1413-24782002000100005&lang=pt" 
"S1413-24782002000100006-scl","Pobreza, emoção e saúde: uma discussão sobre pentecostalismo e saúde no Brasil","Valla, Victor Vincent","Revista Brasileira de Educação; (19); 63-75","Revista Brasileira de Educação","Português","2002","http://www.scielo.br/scielo.php?script=sci_arttext&pid=S1413-24782002000100006&lang=pt" 
