"S1413-85572001000200002-scl","A criatividade verbal e sua importância nos ambientes educacionais","Joly, Maria Cristina Rodrigues Azevedo","Psicologia Escolar e Educacional; 5(2); 11-20","Psicologia Escolar e Educacional","Português","2001","http://www.scielo.br/scielo.php?script=sci_arttext&pid=S1413-85572001000200002&lang=pt" 
"S1413-85572001000200003-scl","“Família possível” na relação escola-comunidade","Nunes, Dulce Gomes, Vilarinho, Lúcia Regina Goulart","Psicologia Escolar e Educacional; 5(2); 21-29","Psicologia Escolar e Educacional","Português","2001","http://www.scielo.br/scielo.php?script=sci_arttext&pid=S1413-85572001000200003&lang=pt" 
"S1413-85572001000200005-scl","Dificuldade de aprendizagem em escrita, memória e contradições","Souza, Adriana Regina Marques de, Sisto, Fermino Fernandes","Psicologia Escolar e Educacional; 5(2); 39-47","Psicologia Escolar e Educacional","Português","2001","http://www.scielo.br/scielo.php?script=sci_arttext&pid=S1413-85572001000200005&lang=pt" 
"S1413-85572001000200007-scl","Por trás do imaginário infantil: explorando a brinquedoteca","Vectore, Célia, Kishimoto, Tizuko M.","Psicologia Escolar e Educacional; 5(2); 59-65","Psicologia Escolar e Educacional","Português","2001","http://www.scielo.br/scielo.php?script=sci_arttext&pid=S1413-85572001000200007&lang=pt" 
"S1415-65552001000300011-scl","Índice de sharpe e outros indicadores de performance aplicados a fundos de ações brasileiros","Varga, Gyorgy","Revista de Administração Contemporânea; 5(3); 215-245","Revista de Administração Contemporânea","Português","2001","http://www.scielo.br/scielo.php?script=sci_arttext&pid=S1415-65552001000300011&lang=pt" 
"S1415-65552001000300009-scl","Convergent and discriminant validity of the perceived risk scale in business-to-business context using the multitrait-multimethod approach","Mello, Sérgio C. Benício de, Collins, Martin","Revista de Administração Contemporânea; 5(3); 167-186","Revista de Administração Contemporânea","Inglês","2001","http://www.scielo.br/scielo.php?script=sci_arttext&pid=S1415-65552001000300009&lang=pt" 
"S1415-65552001000300002-scl","Rentabilidade e eficiência no setor bancário brasileiro","Ceretta, Paulo Sergio, Niederauer, Carlos Alberto Pittaluga","Revista de Administração Contemporânea; 5(3); 7-26","Revista de Administração Contemporânea","Português","2001","http://www.scielo.br/scielo.php?script=sci_arttext&pid=S1415-65552001000300002&lang=pt" 
"S1415-65552001000300010-scl","Portfolio insurance using traded options","Machado-Santos, Carlos","Revista de Administração Contemporânea; 5(3); 187-214","Revista de Administração Contemporânea","Inglês","2001","http://www.scielo.br/scielo.php?script=sci_arttext&pid=S1415-65552001000300010&lang=pt" 
"S1415-65552001000300008-scl","Universidades corporativas: discussão e proposta de uma definição","Alperstedt, Cristiane","Revista de Administração Contemporânea; 5(3); 149-165","Revista de Administração Contemporânea","Português","2001","http://www.scielo.br/scielo.php?script=sci_arttext&pid=S1415-65552001000300008&lang=pt" 
"S1415-65552001000300003-scl","Posicionamento estratégico e desempenho de mercado da indústria farmacêutica à luz da tipologia de Porter","Pinho, Antonio Felipe de Almeida, Silva, Jorge Ferreira da","Revista de Administração Contemporânea; 5(3); 27-52","Revista de Administração Contemporânea","Português","2001","http://www.scielo.br/scielo.php?script=sci_arttext&pid=S1415-65552001000300003&lang=pt" 
"S1415-65552001000300004-scl","Eficácia de sistemas de informação e percepção de mudança organizacional: um estudo de caso","Andrade, Davi Gomes de, Falk, James Anthony","Revista de Administração Contemporânea; 5(3); 53-84","Revista de Administração Contemporânea","Português","2001","http://www.scielo.br/scielo.php?script=sci_arttext&pid=S1415-65552001000300004&lang=pt" 
"S1415-65552001000300006-scl","A dinâmica entre liderança e identificação: sobre a influência consentida nas organizações contemporâneas","Davel, Eduardo, Machado, Hilka Vier","Revista de Administração Contemporânea; 5(3); 107-126","Revista de Administração Contemporânea","Português","2001","http://www.scielo.br/scielo.php?script=sci_arttext&pid=S1415-65552001000300006&lang=pt" 
"S1415-65552001000300001-scl","Editorial","Gonçalves Neto, Cesar","Revista de Administração Contemporânea; 5(3); -","Revista de Administração Contemporânea","Português","2001","http://www.scielo.br/scielo.php?script=sci_arttext&pid=S1415-65552001000300001&lang=pt" 
"S1415-65552001000300005-scl","Comprometimento atitudinal e comportamental: relações com suporte e imagem nas organizações","Borges-Andrade, Jairo Eduardo, Pilati, Ronaldo","Revista de Administração Contemporânea; 5(3); 85-106","Revista de Administração Contemporânea","Português","2001","http://www.scielo.br/scielo.php?script=sci_arttext&pid=S1415-65552001000300005&lang=pt" 
"S1415-65552001000300007-scl","Prioridades axiológicas, atividade física e estresse ocupacional","Tamayo, Alvaro","Revista de Administração Contemporânea; 5(3); 127-147","Revista de Administração Contemporânea","Português","2001","http://www.scielo.br/scielo.php?script=sci_arttext&pid=S1415-65552001000300007&lang=pt" 
"S1657-59972001000100012-col","Enfermería en el mundo cristiano","Quintero Laverde, María Clara","Aquichán; 1(1); 42-45","Aquichán","Espanhol","2001","http://www.scielo.org.co/scielo.php?script=sci_arttext&pid=S1657-59972001000100012&lang=pt" 
"S1657-59972001000100013-col","Educación en Salud","Rozo de Arévalo, Clara","Aquichán; 1(1); 46-47","Aquichán","Espanhol","2001","http://www.scielo.org.co/scielo.php?script=sci_arttext&pid=S1657-59972001000100013&lang=pt" 
"S1657-59972001000100010-col","La enseñanza de la ética en enfermería","Restrepo Arzayús, Lucía","Aquichán; 1(1); 35-36","Aquichán","Espanhol","2001","http://www.scielo.org.co/scielo.php?script=sci_arttext&pid=S1657-59972001000100010&lang=pt" 
"S1657-59972001000100011-col","Herramientas para la investigación en enfermería","Díaz de Flórez, Leticia","Aquichán; 1(1); 37-41","Aquichán","Espanhol","2001","http://www.scielo.org.co/scielo.php?script=sci_arttext&pid=S1657-59972001000100011&lang=pt" 
"S1657-59972001000100009-col","La autoevaluación dentro del proceso de acreditación del programa de Enfermería de la Universidad de La Sabana","Gutiérrez Agudelo, Ma. del Carmen","Aquichán; 1(1); 30-34","Aquichán","Espanhol","2001","http://www.scielo.org.co/scielo.php?script=sci_arttext&pid=S1657-59972001000100009&lang=pt" 
"S1657-59972001000100008-col","La educación como proceso holístico, la comunicación participativa y la motivación, principales elementos del cambio","Pardo Novoa, Leonor","Aquichán; 1(1); 23-29","Aquichán","Espanhol","2001","http://www.scielo.org.co/scielo.php?script=sci_arttext&pid=S1657-59972001000100008&lang=pt" 
"S1657-59972001000100001-col","Editorial","","Aquichán; 1(1); 4-4","Aquichán","Espanhol","2001","http://www.scielo.org.co/scielo.php?script=sci_arttext&pid=S1657-59972001000100001&lang=pt" 
"S1657-59972001000100003-col","Un sueño hecho realidad","Borda Camacho, Eduardo","Aquichán; 1(1); 7-8","Aquichán","Espanhol","2001","http://www.scielo.org.co/scielo.php?script=sci_arttext&pid=S1657-59972001000100003&lang=pt" 
"S1657-59972001000100002-col","Aquichan, cuidado","Mendoza Ramírez, Álvaro","Aquichán; 1(1); 5-6","Aquichán","Espanhol","2001","http://www.scielo.org.co/scielo.php?script=sci_arttext&pid=S1657-59972001000100002&lang=pt" 
"S1657-59972001000100005-col","Prácticas indígenas relacionadas con la enfermedad","Quintero Laverde, María Clara","Aquichán; 1(1); 11-13","Aquichán","Espanhol","2001","http://www.scielo.org.co/scielo.php?script=sci_arttext&pid=S1657-59972001000100005&lang=pt" 
"S1657-59972001000100004-col","Palabras de saludo al Consejo Directivo de Acofaen","Romero, María Nubia","Aquichán; 1(1); 9-10","Aquichán","Espanhol","2001","http://www.scielo.org.co/scielo.php?script=sci_arttext&pid=S1657-59972001000100004&lang=pt" 
"S1657-59972001000100007-col","Algunas consideraciones acerca de los valores humanos y el profesional de enfermería","Hernández Posada, Ángela Susana","Aquichán; 1(1); 18-22","Aquichán","Espanhol","2001","http://www.scielo.org.co/scielo.php?script=sci_arttext&pid=S1657-59972001000100007&lang=pt" 
"S1657-59972001000100006-col","Aplicación del Modelo de Adaptación en un Servicio de Rehabilitación Ambulatoria","Moreno F., María Elisa","Aquichán; 1(1); 14-17","Aquichán","Espanhol","2001","http://www.scielo.org.co/scielo.php?script=sci_arttext&pid=S1657-59972001000100006&lang=pt" 
"S0188-46112001000300001-mex","Presentación","","Investigaciones geográficas; (46); 5-6","Investigaciones geográficas","Espanhol","2001","http://www.scielo.org.mx/scielo.php?script=sci_arttext&pid=S0188-46112001000300001&lang=pt" 
"S0188-46112001000300010-mex","Las diferencias regional-económicas del estado de Guerrero, México","Vázquez Solís, Valente, Propin Frejomil, Enrique","Investigaciones geográficas; (46); 131-147","Investigaciones geográficas","Espanhol","2001","http://www.scielo.org.mx/scielo.php?script=sci_arttext&pid=S0188-46112001000300010&lang=pt" 
"S0188-46112001000300011-mex","Características básicas de la estructura territorial de la economía mexicana","Propin Frejomil, Enrique, Sánchez-Crispín, Álvaro","Investigaciones geográficas; (46); 148-163","Investigaciones geográficas","Espanhol","2001","http://www.scielo.org.mx/scielo.php?script=sci_arttext&pid=S0188-46112001000300011&lang=pt" 
"S0188-46112001000300012-mex","El envejecimiento humano: sus derivaciones pedagógicas","Carrascal, Eurosia","Investigaciones geográficas; (46); 164-165","Investigaciones geográficas","Espanhol","2001","http://www.scielo.org.mx/scielo.php?script=sci_arttext&pid=S0188-46112001000300012&lang=pt" 
"S0188-46112001000300013-mex","Globalización en México y desafíos del empleo femenino","Escamilla Herrera, Irma","Investigaciones geográficas; (46); 167-169","Investigaciones geográficas","Espanhol","2001","http://www.scielo.org.mx/scielo.php?script=sci_arttext&pid=S0188-46112001000300013&lang=pt" 
"S0188-46112001000300014-mex","Homenaje a Milton Santos","Gutiérrez de MacGregor, María Teresa","Investigaciones geográficas; (46); 170-171","Investigaciones geográficas","Espanhol","2001","http://www.scielo.org.mx/scielo.php?script=sci_arttext&pid=S0188-46112001000300014&lang=pt" 
"S0188-46112001000300015-mex","Boletín Informativo de la Unión Geográfica Internacional (UGI)","","Investigaciones geográficas; (46); 172-180","Investigaciones geográficas","Espanhol","2001","http://www.scielo.org.mx/scielo.php?script=sci_arttext&pid=S0188-46112001000300015&lang=pt" 
"S0188-46112001000300016-mex","Asociación Internacional de Geomorfólogos (AIG)","","Investigaciones geográficas; (46); 181-188","Investigaciones geográficas","Espanhol","2001","http://www.scielo.org.mx/scielo.php?script=sci_arttext&pid=S0188-46112001000300016&lang=pt" 
"S0188-46112001000300002-mex","Detección de cambios en la morfología litoral de Punta Zacatal y parte occidental de Isla del Carmen, Campeche, mediante el análisis multitemporal de imágenes de satélite","Palacio Aponte, A. Gerardo","Investigaciones geográficas; (46); 7-14","Investigaciones geográficas","Espanhol","2001","http://www.scielo.org.mx/scielo.php?script=sci_arttext&pid=S0188-46112001000300002&lang=pt" 
"S0188-46112001000300003-mex","Clima histórico de Cuba: contribución al transecto PEP-I del PAGES","Celeiro Chaple, Maira","Investigaciones geográficas; (46); 15-29","Investigaciones geográficas","Espanhol","2001","http://www.scielo.org.mx/scielo.php?script=sci_arttext&pid=S0188-46112001000300003&lang=pt" 
"S0188-46112001000300004-mex","Cambios intraestacionales en la circulación regional sobre México","Cortez, Miguel, Matsumoto, Jun","Investigaciones geográficas; (46); 30-44","Investigaciones geográficas","Espanhol","2001","http://www.scielo.org.mx/scielo.php?script=sci_arttext&pid=S0188-46112001000300004&lang=pt" 
"S0188-46112001000300005-mex","Transformación de la vegetación por cambio de uso del suelo en la Reserva de la Biosfera Calakmul, Campeche","García Gil, Gerardo, March Mifsut, Ignacio, Castillo Santiago, Miguel Ángel","Investigaciones geográficas; (46); 45-57","Investigaciones geográficas","Espanhol","2001","http://www.scielo.org.mx/scielo.php?script=sci_arttext&pid=S0188-46112001000300005&lang=pt" 
"S0188-46112001000300006-mex","El enfoque de paisaje en el manejo forestal de la comunidad indígena de Nuevo San Juan Parangaricutiro, Michoacán, México","Fregoso, Alejandra, Velázquez, Alejandro, Bocco, Gerardo, Cortéz, Gonzalo","Investigaciones geográficas; (46); 58-77","Investigaciones geográficas","Espanhol","2001","http://www.scielo.org.mx/scielo.php?script=sci_arttext&pid=S0188-46112001000300006&lang=pt" 
"S0188-46112001000300007-mex","Caracterización óptica de la laguna costera de Coyuca de Benítez","Aguirre Gómez, Raúl","Investigaciones geográficas; (46); 78-97","Investigaciones geográficas","Espanhol","2001","http://www.scielo.org.mx/scielo.php?script=sci_arttext&pid=S0188-46112001000300007&lang=pt" 
"S0188-46112001000300008-mex","Evolución y expresión territorial de la industria petroquímica en México","Martínez Laguna, Norma","Investigaciones geográficas; (46); 98-116","Investigaciones geográficas","Espanhol","2001","http://www.scielo.org.mx/scielo.php?script=sci_arttext&pid=S0188-46112001000300008&lang=pt" 
"S0188-46112001000300009-mex","Accesibilidad de las localidades del Estado de México a la red carretera pavimentada: un enfoque metodológico","Chias Becerril, Luis, Iturbe Posadas, Antonio, Reyna Sáenz, Francisco","Investigaciones geográficas; (46); 117-130","Investigaciones geográficas","Espanhol","2001","http://www.scielo.org.mx/scielo.php?script=sci_arttext&pid=S0188-46112001000300009&lang=pt" 
"S0121-07932001000400001-col","RESÚMENES ORALES","","Iatreia; 14(4); 235-267","Iatreia","Espanhol","2001","http://www.scielo.org.co/scielo.php?script=sci_arttext&pid=S0121-07932001000400001&lang=pt" 
"S0121-07932001000400002-col","RESÚMENES DE CARTELES","","Iatreia; 14(4); 268-326","Iatreia","Espanhol","2001","http://www.scielo.org.co/scielo.php?script=sci_arttext&pid=S0121-07932001000400002&lang=pt" 
"S0100-06832001000400003-scl","Transformações mineralógicas ao longo de perfis de alteração pedogenética na região de Lavras (MG)","Lacerda, M. P. C., Andrade, H., Quéméneur, J. J. G.","Revista Brasileira de Ciência do Solo; 25(4); 799-809","Revista Brasileira de Ciência do Solo","Português","2001","http://www.scielo.br/scielo.php?script=sci_arttext&pid=S0100-06832001000400003&lang=pt" 
"S0100-06832001000400001-scl","Efeito de três manejos do lençol freático na adaptação fisiomorfológica do feijoeiro (Phaseolus vulgaris, L.) ao encharcamento","Calheiros, R. O., Cruciani, D. E., Arruda, F. B., Queiroz Voltan, R. B.","Revista Brasileira de Ciência do Solo; 25(4); 779-789","Revista Brasileira de Ciência do Solo","Português","2001","http://www.scielo.br/scielo.php?script=sci_arttext&pid=S0100-06832001000400001&lang=pt" 
"S0100-06832001000400007-scl","Tolerância de fungos ectomicorrízicos a metais pesados em meio de cultura adicionado de solo contaminado","Grazziotti, P. H., Siqueira, J. O., Moreira, F. M., Carvalho, D.","Revista Brasileira de Ciência do Solo; 25(4); 839-848","Revista Brasileira de Ciência do Solo","Português","2001","http://www.scielo.br/scielo.php?script=sci_arttext&pid=S0100-06832001000400007&lang=pt" 
"S0100-06832001000400009-scl","Carbono da biomassa microbiana em solos de cerrado sob vegetação nativa e sob cultivo: avaliação dos métodos fumigação-incubação e fumigação-extração","Oliveira, J. R. A., Mendes, I. C., Vivaldi, L.","Revista Brasileira de Ciência do Solo; 25(4); 863-871","Revista Brasileira de Ciência do Solo","Português","2001","http://www.scielo.br/scielo.php?script=sci_arttext&pid=S0100-06832001000400009&lang=pt" 
"S0100-06832001000400019-scl","Estudo de toposseqüência da Baixada Litorânea Fluminense: efeitos do material de origem e posição topográfica","Silva, M. B., Anjos, L. H. C., Pereira, M. G., Nascimento, R. A. M.","Revista Brasileira de Ciência do Solo; 25(4); 965-976","Revista Brasileira de Ciência do Solo","Português","2001","http://www.scielo.br/scielo.php?script=sci_arttext&pid=S0100-06832001000400019&lang=pt" 
"S0100-06832001000400026-scl","Comprimentos críticos de rampa para diferentes manejos de resíduos culturais em sistema de semeadura direta em um Argissolo Vermelho da depressão central (RS)","Morais, L. F. B., Cogo, N. P.","Revista Brasileira de Ciência do Solo; 25(4); 1041-1051","Revista Brasileira de Ciência do Solo","Português","2001","http://www.scielo.br/scielo.php?script=sci_arttext&pid=S0100-06832001000400026&lang=pt" 
"S0100-06832001000400028-scl","Gramíneas e leguminosas na recuperação de áreas degradadas: efeito nas características químicas de solo","Santos, A. C., Silva, I. F., Lima, J. R. S., Andrade, A. P., Cavalcante, V. R.","Revista Brasileira de Ciência do Solo; 25(4); 1063-1071","Revista Brasileira de Ciência do Solo","Português","2001","http://www.scielo.br/scielo.php?script=sci_arttext&pid=S0100-06832001000400028&lang=pt" 
"S0100-06832001000400025-scl","Crescimento radicular e nutrição da soja cultivada no sistema plantio direto em resposta ao calcário e gesso na superfície","Caires, E. F., Fonseca, A. F., Feldhaus, I. C., Blum, J.","Revista Brasileira de Ciência do Solo; 25(4); 1029-1040","Revista Brasileira de Ciência do Solo","Português","2001","http://www.scielo.br/scielo.php?script=sci_arttext&pid=S0100-06832001000400025&lang=pt" 
"S0100-06832001000400027-scl","Adsorção e lixiviação de tebuthiuron em três tipos de solo","Souza, M. Dornelas De, Boeira, R. C., Gomes, M. A. F., Ferracini, V. L., Maia, A. H. N.","Revista Brasileira de Ciência do Solo; 25(4); 1053-1061","Revista Brasileira de Ciência do Solo","Português","2001","http://www.scielo.br/scielo.php?script=sci_arttext&pid=S0100-06832001000400027&lang=pt" 
"S0100-06832001000400021-scl","Variabilidade espacial da taxa de infiltração de água e da espessura do horizonte A, em um Argissolo Vermelho-Amarelo, sob diferentes usos","Bertolani, F. C., Vieira, S. R.","Revista Brasileira de Ciência do Solo; 25(4); 987-995","Revista Brasileira de Ciência do Solo","Português","2001","http://www.scielo.br/scielo.php?script=sci_arttext&pid=S0100-06832001000400021&lang=pt" 
"S0100-06832001000400020-scl","Caracterização e classificação de solos tiomórficos da várzea do rio Coruripe, no estado de Alagoas","Souza Júnior, V. S., Ribeiro, M. R., Oliveira, L. B.","Revista Brasileira de Ciência do Solo; 25(4); 977-986","Revista Brasileira de Ciência do Solo","Português","2001","http://www.scielo.br/scielo.php?script=sci_arttext&pid=S0100-06832001000400020&lang=pt" 
"S0100-06832001000400023-scl","Avaliação de produtos para a nutrição da videira via foliar","Fráguas, J. C., Czermainski, A. B. C.","Revista Brasileira de Ciência do Solo; 25(4); 1007-1015","Revista Brasileira de Ciência do Solo","Português","2001","http://www.scielo.br/scielo.php?script=sci_arttext&pid=S0100-06832001000400023&lang=pt" 
"S0100-06832001000400022-scl","Técnicas de geoprocessamento e de amostragem para o mapeamento de atributos anisotrópicos do solo","Valeriano, M. M., Prado, H.","Revista Brasileira de Ciência do Solo; 25(4); 997-1005","Revista Brasileira de Ciência do Solo","Português","2001","http://www.scielo.br/scielo.php?script=sci_arttext&pid=S0100-06832001000400022&lang=pt" 
"S0100-06832001000400010-scl","Influência do pH do meio de cultivo e da turfa no comportamento de estirpes de Bradyrhizobium","Miguel, D. L., Moreira, F. M. S.","Revista Brasileira de Ciência do Solo; 25(4); 873-883","Revista Brasileira de Ciência do Solo","Português","2001","http://www.scielo.br/scielo.php?script=sci_arttext&pid=S0100-06832001000400010&lang=pt" 
"S0100-06832001000400011-scl","Alteração de atributos químicos no perfil do solo pela calagem superficial em campo nativo","Petrere, C., Anghinoni, I.","Revista Brasileira de Ciência do Solo; 25(4); 885-895","Revista Brasileira de Ciência do Solo","Português","2001","http://www.scielo.br/scielo.php?script=sci_arttext&pid=S0100-06832001000400011&lang=pt" 
"S0100-06832001000400012-scl","Influência da calagem no rendimento de matéria seca de plantas de cobertura e adubação verde, em casa de vegetação","Ernani, P. R., Bayer, C., Fontoura, S. M. V.","Revista Brasileira de Ciência do Solo; 25(4); 897-904","Revista Brasileira de Ciência do Solo","Português","2001","http://www.scielo.br/scielo.php?script=sci_arttext&pid=S0100-06832001000400012&lang=pt" 
"S0100-06832001000400013-scl","Influência de adições sucessivas de zinco, na forma de esterco suíno ou de óxido, no rendimento de matéria seca de milho","Ernani, P. R., Bittencourt, F., Valmorbida, J., Cristani, J.","Revista Brasileira de Ciência do Solo; 25(4); 905-911","Revista Brasileira de Ciência do Solo","Português","2001","http://www.scielo.br/scielo.php?script=sci_arttext&pid=S0100-06832001000400013&lang=pt" 
"S0100-06832001000400014-scl","Efeito do nitrogênio e potássio na nutrição do pimentão cultivado em ambiente protegido","Silva, M. A. G., Boaretto, A. E., Muraoka, T., Fernandes, H. G., Granja, F. A., Scivittaro, W. B.","Revista Brasileira de Ciência do Solo; 25(4); 913-922","Revista Brasileira de Ciência do Solo","Português","2001","http://www.scielo.br/scielo.php?script=sci_arttext&pid=S0100-06832001000400014&lang=pt" 
"S0100-06832001000400015-scl","Efeito do alumínio sobre o crescimento de duas espécies florestais","Beutler, A. N., Fernandes, L. A., Faquin, V.","Revista Brasileira de Ciência do Solo; 25(4); 923-928","Revista Brasileira de Ciência do Solo","Português","2001","http://www.scielo.br/scielo.php?script=sci_arttext&pid=S0100-06832001000400015&lang=pt" 
"S0100-06832001000400016-scl","Exigência a boro em cultivares de soja","Furlani, A. M. C., Tanaka, R. T., Tarallo, M., Verdial, M. F., Mascarenhas, H. A. A.","Revista Brasileira de Ciência do Solo; 25(4); 929-937","Revista Brasileira de Ciência do Solo","Português","2001","http://www.scielo.br/scielo.php?script=sci_arttext&pid=S0100-06832001000400016&lang=pt" 
"S0100-06832001000400017-scl","Características químicas de solo e rendimento de massa seca de milho em função do método de aplicação de fosfatos, em dois níveis de acidez","Ernani, P. R., Steckling, C., Bayer, C.","Revista Brasileira de Ciência do Solo; 25(4); 939-946","Revista Brasileira de Ciência do Solo","Português","2001","http://www.scielo.br/scielo.php?script=sci_arttext&pid=S0100-06832001000400017&lang=pt" 
