"S0034-77442001000300038-cri","White-lipped peccary (Tayassu pecari, Artiodactyla: Tayassuidae) diet and fruit availability in a Costa Rican rain forest","Altrichter, Mariana, Carrillo, Eduardo, Sáenz, Joel, K. Fuller, Todd","Revista de Biología Tropical; 49(3-4); 1183-1192","Revista de Biología Tropical","Inglês","2001","http://www.scielo.sa.cr/scielo.php?script=sci_arttext&pid=S0034-77442001000300038&lang=pt" 
"S0034-77442001000300036-cri","Seguimiento anual de la parasitosis gastrointestinal del tepezcuintle, Agouti paca (Rodentia: Agoutidae) en cautiverio en el trópico mexicano","Ramírez-Herrera, Oscar, Rodríguez-Vivas, Roger I., Montes-Pérez, Rubén, Torres-Acosta, J. Felipe","Revista de Biología Tropical; 49(3-4); 1171-1176","Revista de Biología Tropical","Espanhol","2001","http://www.scielo.sa.cr/scielo.php?script=sci_arttext&pid=S0034-77442001000300036&lang=pt" 
"S0034-77442001000300037-cri","Swimming ability in three Costa Rican dry forest rodents","Cook, William M., Timm, Robert M., Hyman, Dena E.","Revista de Biología Tropical; 49(3-4); 1177-1181","Revista de Biología Tropical","Inglês","2001","http://www.scielo.sa.cr/scielo.php?script=sci_arttext&pid=S0034-77442001000300037&lang=pt" 
"S0034-77442001000300040-cri","White-faced monkey (Cebus capucinus) ecology and management in neotropical agricultural landscapes during the dry season","Williams, Heather E., Vaughan, Christopher","Revista de Biología Tropical; 49(3-4); 1199-1206","Revista de Biología Tropical","Inglês","2001","http://www.scielo.sa.cr/scielo.php?script=sci_arttext&pid=S0034-77442001000300040&lang=pt" 
"S0034-77442001000300056-cri","New records of amphipods (Crustacea: Amphipoda) from shallow waters of the Caribbean coast of Venezuela","J. Díaz, Yusbelly, Martín, Alberto","Revista de Biología Tropical; 49(3-4); 1271-1276","Revista de Biología Tropical","Inglês","2001","http://www.scielo.sa.cr/scielo.php?script=sci_arttext&pid=S0034-77442001000300056&lang=pt" 
"S0034-77442001000300042-cri","Evaluación in vitro de sustancias antibacterianas producidas por bacterias aisladas de diferentes organismos marinos","Castillo, Isabel, Lodeiros, César, Núñez, Maximiano, Isabel, Campos","Revista de Biología Tropical; 49(3-4); 1213-1221","Revista de Biología Tropical","Espanhol","2001","http://www.scielo.sa.cr/scielo.php?script=sci_arttext&pid=S0034-77442001000300042&lang=pt" 
"S0034-77442001000300043-cri","Bandeo de cromosomas humanos con extracto crudo de frutas u hojas de papaya","Solís, María Virginia","Revista de Biología Tropical; 49(3-4); 1223-1225","Revista de Biología Tropical","Espanhol","2001","http://www.scielo.sa.cr/scielo.php?script=sci_arttext&pid=S0034-77442001000300043&lang=pt" 
"S0034-77442001000300044-cri","Diagnóstico prenatal citogenético mediante amniocentesis durante los trimestres II y III de gestación en Costa Rica","Castro Volio, Isabel, Sander Mangel, Kay, Vargas Prado, Manuel, Sánchez Cháves, Luis, Escalante López, Gerardo","Revista de Biología Tropical; 49(3-4); 1227-1236","Revista de Biología Tropical","Espanhol","2001","http://www.scielo.sa.cr/scielo.php?script=sci_arttext&pid=S0034-77442001000300044&lang=pt" 
"S0034-77442001000300046-cri","Nicaraguan population data on LDLR, GYPA, D7S8, HBGG, GC and HLA-DQA1 loci","Morera, Bernal, Sánchez-Rivera, Gerardo, Jiménez-Arce, Gerardo, Calafell, Francesc, Morales-Cordero, Ana Isabel","Revista de Biología Tropical; 49(3-4); 1253-1260","Revista de Biología Tropical","Inglês","2001","http://www.scielo.sa.cr/scielo.php?script=sci_arttext&pid=S0034-77442001000300046&lang=pt" 
"S0034-77442001000300047-cri","","Pupulin, Franco","Revista de Biología Tropical; 49(3-4); 1261-1262","Revista de Biología Tropical","Espanhol","2001","http://www.scielo.sa.cr/scielo.php?script=sci_arttext&pid=S0034-77442001000300047&lang=pt" 
"S0034-77442001000300049-cri","Vuelo de mariposas nocturnas frente a la costa de Chile (Lepidoptera: Sphingidae)","Angulo, Andrés O., Antezana, Tarsicio","Revista de Biología Tropical; 49(3-4); 1265-1266","Revista de Biología Tropical","Espanhol","2001","http://www.scielo.sa.cr/scielo.php?script=sci_arttext&pid=S0034-77442001000300049&lang=pt" 
"S0034-77442001000300050-cri","A spinal column malformation in the creolefish Paranthias colonus (Osteichthyes: Serranidae)","Rodríguez-Romero, Jesús, Cárdenas, Leonardo, Pérez Urbiola, Juan Carlos, Hinohuye Rivera, Roxana, Silva Hernández, Mario Alberto","Revista de Biología Tropical; 49(3-4); 1267-1267","Revista de Biología Tropical","Inglês","2001","http://www.scielo.sa.cr/scielo.php?script=sci_arttext&pid=S0034-77442001000300050&lang=pt" 
"S0034-77442001000300051-cri","Range extension of the mitosporic fungus Virgatospora echinofibrosa (Hyphomycetes) to Brazil","Piccolo Grandi, Rosely Ana, Pascholati Gusmão, Luis Fernando","Revista de Biología Tropical; 49(3-4); 1269-1269","Revista de Biología Tropical","Inglês","2001","http://www.scielo.sa.cr/scielo.php?script=sci_arttext&pid=S0034-77442001000300051&lang=pt" 
"S0034-77442001000300052-cri","Amphilochus casahoya (Amphipoda: Amphilochidae) en las costas de Venezuela","J. Díaz, Yusbelly, Martín, Alberto","Revista de Biología Tropical; 49(3-4); 1269-1269","Revista de Biología Tropical","Espanhol","2001","http://www.scielo.sa.cr/scielo.php?script=sci_arttext&pid=S0034-77442001000300052&lang=pt" 
"S0034-77442001000300053-cri","Seba tropica (Amphipoda: Sebidae) en las costas de Venezuela","Martín, Alberto","Revista de Biología Tropical; 49(3-4); 1270-1270","Revista de Biología Tropical","Espanhol","2001","http://www.scielo.sa.cr/scielo.php?script=sci_arttext&pid=S0034-77442001000300053&lang=pt" 
"S0034-77442001000300054-cri","Tiburonella viscana (Amphipoda: Platyisnopidae) en las costas de Venezuela","Atienza, Dacha, Martín, Alberto","Revista de Biología Tropical; 49(3-4); 1270-1270","Revista de Biología Tropical","Espanhol","2001","http://www.scielo.sa.cr/scielo.php?script=sci_arttext&pid=S0034-77442001000300054&lang=pt" 
"S0034-77442001000300055-cri","Westwoodila longimana (Amphipoda: Oedicerotidae) en las costas de Venezuela","Martín, Alberto","Revista de Biología Tropical; 49(3-4); 1270-1270","Revista de Biología Tropical","Espanhol","2001","http://www.scielo.sa.cr/scielo.php?script=sci_arttext&pid=S0034-77442001000300055&lang=pt" 
"S0034-77442001000300057-cri","Range extension of Caligus chelifer (Copepoda: Siphonostomatoida) to coastal lagoons","Ocaña-Luna, Alberto, Álvarez-Silva, Carlos","Revista de Biología Tropical; 49(3-4); 1277-1277","Revista de Biología Tropical","Inglês","2001","http://www.scielo.sa.cr/scielo.php?script=sci_arttext&pid=S0034-77442001000300057&lang=pt" 
"S0034-77442001000300058-cri","Ampliación de ámbito de Alpheus felgenhaueri (Caridea: Alpheidae) a Colima, México","Hermoso-Salazar, A.M., Quintana-Meza, I.","Revista de Biología Tropical; 49(3-4); 1277-1277","Revista de Biología Tropical","Espanhol","2001","http://www.scielo.sa.cr/scielo.php?script=sci_arttext&pid=S0034-77442001000300058&lang=pt" 
"S0034-77442001000300059-cri","Ampliación de ámbito de Leptalpheus forceps (Caridea: Alpheidae) al Golfo de México","Hermoso-Salazar, A.M.","Revista de Biología Tropical; 49(3-4); 1278-1278","Revista de Biología Tropical","Espanhol","2001","http://www.scielo.sa.cr/scielo.php?script=sci_arttext&pid=S0034-77442001000300059&lang=pt" 
"S0034-77442001000300060-cri","Ampliación de ámbito de Synalpheus bannerorum (Caridea: Alpheidae) en el Golfo de California, México","Hermoso-Salazar, A.M., Suárez González, I.","Revista de Biología Tropical; 49(3-4); 1278-1278","Revista de Biología Tropical","Inglês","2001","http://www.scielo.sa.cr/scielo.php?script=sci_arttext&pid=S0034-77442001000300060&lang=pt" 
"S0034-77442001000300061-cri","Ampliación de distribución de Synalpheus lockingtoni (Caridea: Alpheidae) al atolón de Clipperton","Hermoso-Salazar, A.M., Solís-Weiss, V.","Revista de Biología Tropical; 49(3-4); 1278-1278","Revista de Biología Tropical","Espanhol","2001","http://www.scielo.sa.cr/scielo.php?script=sci_arttext&pid=S0034-77442001000300061&lang=pt" 
"S0034-77442001000300062-cri","Ampliación de ámbito de Synalpheus occidentalis (Caridea: Alpheidae) al sur del Golfo de California, México","Hermoso-Salazar, A.M.","Revista de Biología Tropical; 49(3-4); 1279-1279","Revista de Biología Tropical","Espanhol","2001","http://www.scielo.sa.cr/scielo.php?script=sci_arttext&pid=S0034-77442001000300062&lang=pt" 
"S0034-77442001000300063-cri","Range extension of caridean shrimps (Crustacea: Decapoda) from Caleta de Campos, Mexican Pacific","Hermoso-Salazar, A.M., Hernández-Alcántara, P.","Revista de Biología Tropical; 49(3-4); 1279-1280","Revista de Biología Tropical","Inglês","2001","http://www.scielo.sa.cr/scielo.php?script=sci_arttext&pid=S0034-77442001000300063&lang=pt" 
"S0034-77442001000300064-cri","","Hermoso-Salazar, A.M., Solís-Weiss, V.","Revista de Biología Tropical; 49(3-4); 1980-1980","Revista de Biología Tropical","Espanhol","2001","http://www.scielo.sa.cr/scielo.php?script=sci_arttext&pid=S0034-77442001000300064&lang=pt" 
"S0034-77442001000300065-cri","Primer registro para Venezuela de la ascidia solitaria Herdmania momus (Urochordata: Ascidiacea)","Montes, A., Prieto-Arcas, A.","Revista de Biología Tropical; 49(3-4); 1980-1980","Revista de Biología Tropical","Espanhol","2001","http://www.scielo.sa.cr/scielo.php?script=sci_arttext&pid=S0034-77442001000300065&lang=pt" 
"S0034-77442001000300066-cri","Primer registro para el Caribe de la ascidia solitaria Styela barnharti (Urochordata: Stolidobranchia)","Montes, A., Prieto-Arcas, A.","Revista de Biología Tropical; 49(3-4); 1281-1281","Revista de Biología Tropical","Espanhol","2001","http://www.scielo.sa.cr/scielo.php?script=sci_arttext&pid=S0034-77442001000300066&lang=pt" 
"S0034-77442001000300067-cri","La ascidia colonial Botryllus planus (Urochordata: Styelidae) en Venezuela","Montes, A., Prieto, A.","Revista de Biología Tropical; 49(3-4); 1281-1281","Revista de Biología Tropical","Espanhol","2001","http://www.scielo.sa.cr/scielo.php?script=sci_arttext&pid=S0034-77442001000300067&lang=pt" 
"S0034-77442001000300068-cri","First record of Ulmeritoides misionensis (Ephemeroptera: Leptophlebiidae) in Brazil","Ribeiro Da-Silva, Elidiomar, Nascimento Lopes, Maria José","Revista de Biología Tropical; 49(3-4); 1281-1282","Revista de Biología Tropical","Inglês","2001","http://www.scielo.sa.cr/scielo.php?script=sci_arttext&pid=S0034-77442001000300068&lang=pt" 
"S0034-77442001000300069-cri","New range of the Brazilian endemic Platythyrea exigua (Hymenoptera: Formicidae: Platythyreini)","Charles Delabie, Jacques Hubert","Revista de Biología Tropical; 49(3-4); 1282-1282","Revista de Biología Tropical","Inglês","2001","http://www.scielo.sa.cr/scielo.php?script=sci_arttext&pid=S0034-77442001000300069&lang=pt" 
"S0034-77442001000300070-cri","New records for leafhoppers (Homoptera: Cicadellidae) from Brazil","Nova Coelho, Luci Boa, Ribeiro DaSilva, Elidiomar","Revista de Biología Tropical; 49(3-4); 1282-1283","Revista de Biología Tropical","Inglês","2001","http://www.scielo.sa.cr/scielo.php?script=sci_arttext&pid=S0034-77442001000300070&lang=pt" 
"S0034-77442001000300071-cri","Hallazgos de Triatoma infestans en México","Rocha, D.S., Galvão, C., Jurberg, J., Carcavallo, R.","Revista de Biología Tropical; 49(3-4); 1284-1284","Revista de Biología Tropical","Espanhol","2001","http://www.scielo.sa.cr/scielo.php?script=sci_arttext&pid=S0034-77442001000300071&lang=pt" 
"S0034-77442001000300072-cri","Hectopsylla psittaci (Siphonaptera: Tungidae) en Chile","Alarcón, Mauricio E., Muñoz, Lisandro E.","Revista de Biología Tropical; 49(3-4); 1284-1284","Revista de Biología Tropical","Espanhol","2001","http://www.scielo.sa.cr/scielo.php?script=sci_arttext&pid=S0034-77442001000300072&lang=pt" 
"S0034-77442001000300073-cri","Primer registro del género Innesa (Solifugae: Ammotrechidae) para Costa Rica","de Armas, Luis F., Víquez, Carlos","Revista de Biología Tropical; 49(3-4); 1284-1285","Revista de Biología Tropical","Espanhol","2001","http://www.scielo.sa.cr/scielo.php?script=sci_arttext&pid=S0034-77442001000300073&lang=pt" 
"S0034-77442001000300074-cri","Ampliación de ámbito de la garrapata Rhipicephalus sanguineus (Acari: Ixodidae) en Chile","Muñoz, Lisandro Eduardo, Casanueva, María Eugenia","Revista de Biología Tropical; 49(3-4); 1285-1285","Revista de Biología Tropical","Espanhol","2001","http://www.scielo.sa.cr/scielo.php?script=sci_arttext&pid=S0034-77442001000300074&lang=pt" 
"S0034-77442001000300075-cri","First report of seven fish species from Colombian Caribbean waters","Ben-Tuvia, Adam, Alvarez-León, Ricardo, Rey-Carrasco, Iván","Revista de Biología Tropical; 49(3-4); 1285-1286","Revista de Biología Tropical","Inglês","2001","http://www.scielo.sa.cr/scielo.php?script=sci_arttext&pid=S0034-77442001000300075&lang=pt" 
"S0034-77442001000300076-cri","Nuevo registro de Acartia (Planktacartia) negligens (Copepoda, Calanoida) en el Pacífico Tropical Oriental","Suárez-Morales, Eduardo, Morales-Ramírez, Alvaro","Revista de Biología Tropical; 49(3-4); 1286-1286","Revista de Biología Tropical","Espanhol","2001","http://www.scielo.sa.cr/scielo.php?script=sci_arttext&pid=S0034-77442001000300076&lang=pt" 
"S0034-77442001000300077-cri","Lacey, E.A., J.L. Patton and G.N. Cameron. (eds.). 2000. Life underground. The biology of subterranean rodents: Chicago 462 p. ISBN 0-226-46728-7 (rústica). (Precio US$24)","Gómez P., Luis D.","Revista de Biología Tropical; 49(3-4); 1287-1287","Revista de Biología Tropical","Espanhol","2001","http://www.scielo.sa.cr/scielo.php?script=sci_arttext&pid=S0034-77442001000300077&lang=pt" 
"S0034-77442001000300078-cri","Marineros, L. 2000. Guía de las serpientes de Honduras: Secretaría de Recursos Naturales y Ambiente, Dirección General de Biodiversidad. 252 p. (Precio US$25)","Solórzano, Alejandro","Revista de Biología Tropical; 49(3-4); 1287-1289","Revista de Biología Tropical","Espanhol","2001","http://www.scielo.sa.cr/scielo.php?script=sci_arttext&pid=S0034-77442001000300078&lang=pt" 
"S0034-77442001000300079-cri","","Cortés, Jorge","Revista de Biología Tropical; 49(3-4); 1289-1290","Revista de Biología Tropical","Espanhol","2001","http://www.scielo.sa.cr/scielo.php?script=sci_arttext&pid=S0034-77442001000300079&lang=pt" 
"S0034-77442001000300080-cri","Anónimo. 1994-2000. Biodiversidad de Cuba Oriental: 4 Vols. Academia, Santiago, Cuba","Monge-Nájera, Julián","Revista de Biología Tropical; 49(3-4); 1290-1290","Revista de Biología Tropical","Espanhol","2001","http://www.scielo.sa.cr/scielo.php?script=sci_arttext&pid=S0034-77442001000300080&lang=pt" 
"S0034-77442001000300081-cri","Mora B., J.M. 2000. Mamíferos silvestres de Costa Rica: Universidad Estatal a Distancia, San José, Costa Rica. 222 p","Monge-Nájera, Julián","Revista de Biología Tropical; 49(3-4); 1291-1292","Revista de Biología Tropical","Espanhol","2001","http://www.scielo.sa.cr/scielo.php?script=sci_arttext&pid=S0034-77442001000300081&lang=pt" 
"S0034-77442001000300082-cri","Martín-Piera, F., J.J. Morrone &amp; A. Melic. 2000. Hacia un proyecto CYTED para el inventario y estimación de la diversidad entomológica en Iberoamérica: PrIBES 2000: Sociedad Entomológica Aragonesa, Zaragoza, España. 326 p","Monge-Nájera, Julián","Revista de Biología Tropical; 49(3-4); 1292-1293","Revista de Biología Tropical","Espanhol","2001","http://www.scielo.sa.cr/scielo.php?script=sci_arttext&pid=S0034-77442001000300082&lang=pt" 
"S0034-77442001000300083-cri","Víquez, C. 1999. Escorpiones de Costa Rica / Costa Rica scorpions: INBio, Santo Domingo de Heredia, Heredia, Costa Rica. 86 p","Monge-Nájera, Julián","Revista de Biología Tropical; 49(3-4); 1293-1294","Revista de Biología Tropical","Espanhol","2001","http://www.scielo.sa.cr/scielo.php?script=sci_arttext&pid=S0034-77442001000300083&lang=pt" 
"S0034-77442001000300084-cri","García G., M. 2000. Legislación en Iberoamérica sobre fitofármacos y productos naturales: Universidad de Costa Rica, San José, Costa Rica. 394 p","Monge-Nájera, Julián","Revista de Biología Tropical; 49(3-4); 1294-1295","Revista de Biología Tropical","Espanhol","2001","http://www.scielo.sa.cr/scielo.php?script=sci_arttext&pid=S0034-77442001000300084&lang=pt" 
"S0034-77442001000300085-cri","Mata G., L. 2000. Las ciencias naturales en Margarita, Venezuela: Nacional, Caracas, Venezuela. 394 p","Monge-Nájera, Julián","Revista de Biología Tropical; 49(3-4); 1295-1296","Revista de Biología Tropical","Espanhol","2001","http://www.scielo.sa.cr/scielo.php?script=sci_arttext&pid=S0034-77442001000300085&lang=pt" 
"S0034-77442001000300086-cri","Nueva Revista de Aracnología","Monge-Nájera, Julián","Revista de Biología Tropical; 49(3-4); 1296-1296","Revista de Biología Tropical","Espanhol","2001","http://www.scielo.sa.cr/scielo.php?script=sci_arttext&pid=S0034-77442001000300086&lang=pt" 
"S0034-77442001000300087-cri","León J. &amp; L.J. Poveda. 2000. Nombres comunes de las plantas en Costa Rica: Editado por Pablo Sánchez Vindas. Guayacán, San José Costa Rica. 915 p. ISBN 9968-14-0635","Monge-Nájera, Julián","Revista de Biología Tropical; 49(3-4); 1297-1298","Revista de Biología Tropical","Espanhol","2001","http://www.scielo.sa.cr/scielo.php?script=sci_arttext&pid=S0034-77442001000300087&lang=pt" 
"S0034-77442001000300088-cri","Wook, G., J.C. Sáenz &amp; E. Carrillo. 1999 [2000]. Mamíferos del Parque Nacional Corcovado: Instituto Nacional de Biodiversidad, Santo Domingo, Heredia, Costa Rica. 117 p","Monge-Nájera, Julián","Revista de Biología Tropical; 49(3-4); 1299-1299","Revista de Biología Tropical","Espanhol","2001","http://www.scielo.sa.cr/scielo.php?script=sci_arttext&pid=S0034-77442001000300088&lang=pt" 
"S0034-77442001000300089-cri","Sáenz J.C., E. Carrillo &amp; G. Wook. 1999 [2000]. Mamíferos del Área de Conservación Arenal, Costa Rica","Monge-Nájera, Julián","Revista de Biología Tropical; 49(3-4); 1299-1300","Revista de Biología Tropical","Espanhol","2001","http://www.scielo.sa.cr/scielo.php?script=sci_arttext&pid=S0034-77442001000300089&lang=pt" 
"S0034-77442001000300090-cri","Moreno, C. 2001. Métodos para medir la biodiversidad: Vol. 1. Programa Iberoamericano de Ciencia y Tecnología para el Desarrollo, Oficina Regional de Ciencia y Tecnología para América Latina y el Caribe de UNESCO y Sociedad Entomológica Aragonesa. Serie Manuales y Tesis SEA. 84 p","Monge-Nájera, Julián","Revista de Biología Tropical; 49(3-4); 1300-1302","Revista de Biología Tropical","Espanhol","2001","http://www.scielo.sa.cr/scielo.php?script=sci_arttext&pid=S0034-77442001000300090&lang=pt" 
"S0034-77442001000300001-cri","Taxonomía y distribución de los corales hermatípicos (Scleractinia) del Archipiélago de Revillagigedo, México","James T., Ketchum, Héctor Reyes, Bonilla","Revista de Biología Tropical; 49(3-4); 803-848","Revista de Biología Tropical","Espanhol","2001","http://www.scielo.sa.cr/scielo.php?script=sci_arttext&pid=S0034-77442001000300001&lang=pt" 
"S0034-77442001000300018-cri","Woody plant diversity and structure of shade-grown-coffee plantations in Northern Chiapas, Mexico","Soto-Pinto, Lorena, Romero-Alvarado, Yolanda, Caballero-Nieto, Javier, Segura Warnholtz, Gerardo","Revista de Biología Tropical; 49(3-4); 977-987","Revista de Biología Tropical","Inglês","2001","http://www.scielo.sa.cr/scielo.php?script=sci_arttext&pid=S0034-77442001000300018&lang=pt" 
"S0034-77442001000300019-cri","Comportamiento fenológico del árbol Elaeagia uxpanapensis (Rubiaceae), en un bosque pluvial premontano de Costa Rica","Brenes Cambronero, Liz, D’Stefano, José Francisco","Revista de Biología Tropical; 49(3-4); 989-998","Revista de Biología Tropical","Espanhol","2001","http://www.scielo.sa.cr/scielo.php?script=sci_arttext&pid=S0034-77442001000300019&lang=pt" 
"S0034-77442001000300006-cri","Crecimiento y madurez sexual de una población de Saccostrea palmula (Mollusca: Bivalvia), Costa Rica","Cabrera Peña, Jorge H., Protti Quesada, Maurizio, Urriola Hernández, Mario, Sáenz Vargas, Osvaldo","Revista de Biología Tropical; 49(3-4); 877-882","Revista de Biología Tropical","Espanhol","2001","http://www.scielo.sa.cr/scielo.php?script=sci_arttext&pid=S0034-77442001000300006&lang=pt" 
"S0034-77442001000300012-cri","Longitud, peso y sexo del dorado Coryphaena hippurus (Perciformes: Coryphaenidae), del litoral de Sinaloa, Nayarit y Baja California Sur, México","Madrid, J.V., Beltrán-Pimienta, R.","Revista de Biología Tropical; 49(3-4); 931-938","Revista de Biología Tropical","Espanhol","2001","http://www.scielo.sa.cr/scielo.php?script=sci_arttext&pid=S0034-77442001000300012&lang=pt" 
"S0034-77442001000300015-cri","In Vitro micropropagation of Lawsonia inermis (Lythraceae)","Rout, G.R., Das, G., Samantaray, S., Das, P.","Revista de Biología Tropical; 49(3-4); 957-963","Revista de Biología Tropical","Inglês","2001","http://www.scielo.sa.cr/scielo.php?script=sci_arttext&pid=S0034-77442001000300015&lang=pt" 
"S0034-77442001000300022-cri","Insectos asociados con flores de malezas del Jardín Botánico de Santiago de Cuba, con énfasis en Hymenoptera","Fernández T., José L., Garcés G., G., Portuondo F., E., Valdés T., P., Expósito E., I.","Revista de Biología Tropical; 49(3-4); 1013-1026","Revista de Biología Tropical","Espanhol","2001","http://www.scielo.sa.cr/scielo.php?script=sci_arttext&pid=S0034-77442001000300022&lang=pt" 
"S0034-77442001000300004-cri","Occurrence and Distribution of Fresh-Water Molluscs in the Riacho Fundo Creek Basin, Brasilia, Brazil","Maria Júlia, Martins-Silva, Barros, Marilia","Revista de Biología Tropical; 49(3-4); 865-870","Revista de Biología Tropical","Inglês","2001","http://www.scielo.sa.cr/scielo.php?script=sci_arttext&pid=S0034-77442001000300004&lang=pt" 
"S0034-77442001000300002-cri","Environmental variables and intertidal beach annelids of São Sebastião Channel (State of São Paulo, Brazil)","Rizzo, Alexandra E, Z. Amaral, A. Cecília","Revista de Biología Tropical; 49(3-4); 849-857","Revista de Biología Tropical","Inglês","2001","http://www.scielo.sa.cr/scielo.php?script=sci_arttext&pid=S0034-77442001000300002&lang=pt" 
"S0034-77442001000300003-cri","Gastropods and bivalves of commercial interest from the continental shelf of Jalisco and Colima, México","Ríos-Jara, E., Pérez-Peña, M., Beas-Luna, R., López-Uriarte, E., Juárez-Carrillo, E.","Revista de Biología Tropical; 49(3-4); 859-863","Revista de Biología Tropical","Inglês","2001","http://www.scielo.sa.cr/scielo.php?script=sci_arttext&pid=S0034-77442001000300003&lang=pt" 
"S0034-77442001000300005-cri","Morfometría de Sanguinolaria cruenta (Bivalvia: Psammobidae) en playa Tucacas, Falcón, Venezuela","Martín, Alberto, Díaz Díaz, Yusbelly J., Paredes, Claudio","Revista de Biología Tropical; 49(3-4); 871-875","Revista de Biología Tropical","Espanhol","2001","http://www.scielo.sa.cr/scielo.php?script=sci_arttext&pid=S0034-77442001000300005&lang=pt" 
"S0034-77442001000300007-cri","Abundancia y tallas de Menippe mercenaria (Crustacea: Brachyura), en refugios artificiales en Quintana Roo, México","Cervantes-Martínez, Adrián, Ramírez-González, Angélica","Revista de Biología Tropical; 49(3-4); 883-888","Revista de Biología Tropical","Espanhol","2001","http://www.scielo.sa.cr/scielo.php?script=sci_arttext&pid=S0034-77442001000300007&lang=pt" 
"S0034-77442001000300008-cri","Tallas y fecundidad de Juxtafabia muliniarum (Brachyura: Pinnotheridae) asociado con Saccostrea palmula (Bivalvia: Ostreidae), Costa Rica","Cabrera Peña, Jorge, Protti Quesada, Maurizio, Urriola Hernández, Mario, Sáenz Vargas, Osvaldo, Alfaro Hidalgo, Rebeca","Revista de Biología Tropical; 49(3-4); 889-894","Revista de Biología Tropical","Espanhol","2001","http://www.scielo.sa.cr/scielo.php?script=sci_arttext&pid=S0034-77442001000300008&lang=pt" 
"S0034-77442001000300009-cri","Effect of different densities of live and dead Chlorella vulgaris on the population growth of rotifers Brachionus calyciflorus and Brachionus patulus (Rotifera)","Lucía-Pavón, E., Sarma, S.S.S., Nandini, S.","Revista de Biología Tropical; 49(3-4); 895-902","Revista de Biología Tropical","Inglês","2001","http://www.scielo.sa.cr/scielo.php?script=sci_arttext&pid=S0034-77442001000300009&lang=pt" 
"S0034-77442001000300010-cri","Morfología bucofaríngea y hábitos alimentarios de Micropogonias furnieri (Pisces: Sciaenidae) en la costa norte del Estado Sucre, Venezuela","Ruiz, Lilia J., Prieto A., Antulio, Lemus, Mairin","Revista de Biología Tropical; 49(3-4); 903-913","Revista de Biología Tropical","Espanhol","2001","http://www.scielo.sa.cr/scielo.php?script=sci_arttext&pid=S0034-77442001000300010&lang=pt" 
"S0034-77442001000300011-cri","Ictiofauna de la pesquería ribereña en Bahía de Navidad, Jalisco, México, asociada al evento El Niño 1997-1998","Rojo-Vázquez, J.A., Aguilar-Palomino, B., Galván-Piña, V.H., Godínez-Domínguez, E., Hernández-Vázquez, S., Ruiz-Ramírez, S., Lucano-Ramírez, G","Revista de Biología Tropical; 49(3-4); 915-929","Revista de Biología Tropical","Espanhol","2001","http://www.scielo.sa.cr/scielo.php?script=sci_arttext&pid=S0034-77442001000300011&lang=pt" 
"S0034-77442001000300013-cri","Reproductive activity and condition index of Holacanthus passer (Teleostei: Pomacanthidae) in the Gulf of California, Mexico","Arellano-Martínez, Marcial, Ceballos- Vázquez, Bertha Patricia","Revista de Biología Tropical; 49(3-4); 939-943","Revista de Biología Tropical","Inglês","2001","http://www.scielo.sa.cr/scielo.php?script=sci_arttext&pid=S0034-77442001000300013&lang=pt" 
