"S0034-75902001000400004-scl","Taking the &quot;cross&quot; out of cross-cultural transfer of management practice","Stephen, David","Revista de Administração de Empresas; 41(4); 26-31","Revista de Administração de Empresas","Inglês","2001","http://www.scielo.br/scielo.php?script=sci_arttext&pid=S0034-75902001000400004&lang=pt" 
"S0034-75902001000400005-scl","Estratégia nas empresas de internet: lições da informalidade","Barros, Marco A.","Revista de Administração de Empresas; 41(4); 32-43","Revista de Administração de Empresas","Português","2001","http://www.scielo.br/scielo.php?script=sci_arttext&pid=S0034-75902001000400005&lang=pt" 
"S0034-75902001000400009-scl","Governança e cidadania empresarial","Alves, Lauro Eduardo Soutello","Revista de Administração de Empresas; 41(4); 78-86","Revista de Administração de Empresas","Português","2001","http://www.scielo.br/scielo.php?script=sci_arttext&pid=S0034-75902001000400009&lang=pt" 
"S0034-75902001000400008-scl","Etnomarketing: antropologia, cultura e consumo","Jaime Júnior, Pedro","Revista de Administração de Empresas; 41(4); 68-77","Revista de Administração de Empresas","Português","2001","http://www.scielo.br/scielo.php?script=sci_arttext&pid=S0034-75902001000400008&lang=pt" 
"S0034-75902001000400011-scl","Da gestão do conhecimento à gestão da ignorância: uma visão co-evolucionária","Vasconcelos, Flávio C.","Revista de Administração de Empresas; 41(4); 98-102","Revista de Administração de Empresas","Português","2001","http://www.scielo.br/scielo.php?script=sci_arttext&pid=S0034-75902001000400011&lang=pt" 
"S0034-75902001000400010-scl","O impacto da tecnologia de informação na estratégia dos bancos","Maçada, Antonio Carlos Gastaud, Becker, João Luiz","Revista de Administração de Empresas; 41(4); 87-97","Revista de Administração de Empresas","Português","2001","http://www.scielo.br/scielo.php?script=sci_arttext&pid=S0034-75902001000400010&lang=pt" 
"S0034-75902001000400012-scl","","Paula, Ana Paula Paes de","Revista de Administração de Empresas; 41(4); 103-104","Revista de Administração de Empresas","Português","2001","http://www.scielo.br/scielo.php?script=sci_arttext&pid=S0034-75902001000400012&lang=pt" 
"S0034-75902001000400013-scl","Costos sociales de las reformas neoliberales en América Latina","Carvalho, Carlos Eduardo","Revista de Administração de Empresas; 41(4); 106-107","Revista de Administração de Empresas","Português","2001","http://www.scielo.br/scielo.php?script=sci_arttext&pid=S0034-75902001000400013&lang=pt" 
"S0034-75902001000400014-scl","Teoria crítica","Motta, Fernando C. Prestes, Alcadipani, Rafael","Revista de Administração de Empresas; 41(4); 108-108","Revista de Administração de Empresas","Português","2001","http://www.scielo.br/scielo.php?script=sci_arttext&pid=S0034-75902001000400014&lang=pt" 
"S0034-75902001000400015-scl","Recursos humanos","Tonelli, Maria José","Revista de Administração de Empresas; 41(4); 109-109","Revista de Administração de Empresas","Português","2001","http://www.scielo.br/scielo.php?script=sci_arttext&pid=S0034-75902001000400015&lang=pt" 
"S0102-69922001000100001-scl","EDITORIAL","Moreira, Roberto S. C.","Sociedade e Estado; 16(1-2); 07-07","Sociedade e Estado","Português","2001","http://www.scielo.br/scielo.php?script=sci_arttext&pid=S0102-69922001000100001&lang=pt" 
"S0102-69922001000100005-scl","Economia solidária versus economia capitalista","Singer, Paul","Sociedade e Estado; 16(1-2); 100-112","Sociedade e Estado","Português","2001","http://www.scielo.br/scielo.php?script=sci_arttext&pid=S0102-69922001000100005&lang=pt" 
"S0102-69922001000100006-scl","Discurso tentativo sobre o anonimato","Ribeiro, Ana Clara Torres, Lourenço, Alice","Sociedade e Estado; 16(1-2); 113-132","Sociedade e Estado","Português","2001","http://www.scielo.br/scielo.php?script=sci_arttext&pid=S0102-69922001000100006&lang=pt" 
"S0102-69922001000100018-scl","Do crítico, das críticas","Aguiar, Ronaldo Conde","Sociedade e Estado; 16(1-2); 370-382","Sociedade e Estado","Português","2001","http://www.scielo.br/scielo.php?script=sci_arttext&pid=S0102-69922001000100018&lang=pt" 
"S0102-69922001000100016-scl","Violência e democracia: o paradoxo Brasileiro","Bandeira, Lourdes","Sociedade e Estado; 16(1-2); 357-366","Sociedade e Estado","Português","2001","http://www.scielo.br/scielo.php?script=sci_arttext&pid=S0102-69922001000100016&lang=pt" 
"S0102-69922001000100014-scl","Impunidade avesso da reciprocidade","Porto, Maria Stela Grossi","Sociedade e Estado; 16(1-2); 336-349","Sociedade e Estado","Português","2001","http://www.scielo.br/scielo.php?script=sci_arttext&pid=S0102-69922001000100014&lang=pt" 
"S0102-69922001000100015-scl","O social além da política","Nascimento, Elimar Pinheiro do","Sociedade e Estado; 16(1-2); 352-356","Sociedade e Estado","Português","2001","http://www.scielo.br/scielo.php?script=sci_arttext&pid=S0102-69922001000100015&lang=pt" 
"S0102-69922001000100017-scl","Nota do Editor","Moreira, Roberto S. C.","Sociedade e Estado; 16(1-2); -","Sociedade e Estado","Português","2001","http://www.scielo.br/scielo.php?script=sci_arttext&pid=S0102-69922001000100017&lang=pt" 
"S0102-69922001000100002-scl","APRESENTAÇÃO","Nunes, Brasilmar Ferreira, Martins, Paulo Henrique","Sociedade e Estado; 16(1-2); 09-23","Sociedade e Estado","Português","2001","http://www.scielo.br/scielo.php?script=sci_arttext&pid=S0102-69922001000100002&lang=pt" 
"S0102-69922001000100004-scl","Economia solidária, a perspectiva européia","Laville, Jean-Louis","Sociedade e Estado; 16(1-2); 57-99","Sociedade e Estado","Português","2001","http://www.scielo.br/scielo.php?script=sci_arttext&pid=S0102-69922001000100004&lang=pt" 
"S0102-69922001000100007-scl","Cooperativas: uma possível transformação identitária para os trabalhadores do setor informal?","Nunes, Christiane Girard Ferreira","Sociedade e Estado; 16(1-2); 134-158","Sociedade e Estado","Português","2001","http://www.scielo.br/scielo.php?script=sci_arttext&pid=S0102-69922001000100007&lang=pt" 
"S0102-69922001000100008-scl","Em busca de novas solidariedades: os empreendimentos da economia social em questão","Carvalho, Ricardo Augusto Alves de, Pires, Sanyo Drummond","Sociedade e Estado; 16(1-2); 159-185","Sociedade e Estado","Português","2001","http://www.scielo.br/scielo.php?script=sci_arttext&pid=S0102-69922001000100008&lang=pt" 
"S0102-69922001000100009-scl","Sobre a estruturação de redes sociais em associações voluntárias: estudo empírico de organizações não-governamentais da cidade do Recife","Fontes, Breno Augusto Souto Maior, Eichner, Klaus","Sociedade e Estado; 16(1-2); 187-221","Sociedade e Estado","Português","2001","http://www.scielo.br/scielo.php?script=sci_arttext&pid=S0102-69922001000100009&lang=pt" 
"S0102-69922001000100010-scl","Troca e reciprocidade no campo da cultura política","Laniado, Ruthy Nadia","Sociedade e Estado; 16(1-2); 222-244","Sociedade e Estado","Português","2001","http://www.scielo.br/scielo.php?script=sci_arttext&pid=S0102-69922001000100010&lang=pt" 
"S0102-69922001000100011-scl","A problemática da economia solidária: uma perspectiva internacional","França Filho, Genauto Carvalho de","Sociedade e Estado; 16(1-2); 245-275","Sociedade e Estado","Português","2001","http://www.scielo.br/scielo.php?script=sci_arttext&pid=S0102-69922001000100011&lang=pt" 
"S0102-69922001000100012-scl","Le réseau d&#039;échanges des savoirs de belleville e ménilmontant: uma discussão sobre associativismo e reciprocidade no mundo contemporâneo","Gomes, Laura Graziela","Sociedade e Estado; 16(1-2); 276-305","Sociedade e Estado","Português","2001","http://www.scielo.br/scielo.php?script=sci_arttext&pid=S0102-69922001000100012&lang=pt" 
"S0102-69922001000100013-scl","Notas sobre a forma e a razão dos conflitos no mercado de consumo","Bevilaqua, Ciméa","Sociedade e Estado; 16(1-2); 306-334","Sociedade e Estado","Português","2001","http://www.scielo.br/scielo.php?script=sci_arttext&pid=S0102-69922001000100013&lang=pt" 
"S0102-69922001000100003-scl","O princípio de razão, o utilitarismo e o antiutilitarismo","Caillé, Alain","Sociedade e Estado; 16(1-2); 26-56","Sociedade e Estado","Português","2001","http://www.scielo.br/scielo.php?script=sci_arttext&pid=S0102-69922001000100003&lang=pt" 
"S0034-75902001000400007-scl","Um tour pelas medidas de satisfação do consumidor","Marchetti, Renato, Prado, Paulo H. M.","Revista de Administração de Empresas; 41(4); 56-67","Revista de Administração de Empresas","Português","2001","http://www.scielo.br/scielo.php?script=sci_arttext&pid=S0034-75902001000400007&lang=pt" 
"S0100-512X2001000200001-scl","O conceito de categoria ontológica: um novo enfoque","Puntel, Lorenz B.","Kriterion: Revista de Filosofia; 42(104); 7-32","Kriterion: Revista de Filosofia","Português","2001","http://www.scielo.br/scielo.php?script=sci_arttext&pid=S0100-512X2001000200001&lang=pt" 
"S0100-512X2001000200002-scl","Leibniz&#039;s theory of bodies: monadic aggregates, phenomena, or both?","Schneider, Christina","Kriterion: Revista de Filosofia; 42(104); 33-48","Kriterion: Revista de Filosofia","Inglês","2001","http://www.scielo.br/scielo.php?script=sci_arttext&pid=S0100-512X2001000200002&lang=pt" 
"S0100-512X2001000200003-scl","Indiferença, simetria e perfeição segundo Leibniz","Danowski, Déborah","Kriterion: Revista de Filosofia; 42(104); 49-71","Kriterion: Revista de Filosofia","Português","2001","http://www.scielo.br/scielo.php?script=sci_arttext&pid=S0100-512X2001000200003&lang=pt" 
"S0100-512X2001000200004-scl","Contingência e análise infinita em Leibniz","Pinheiro, Ulysses","Kriterion: Revista de Filosofia; 42(104); 72-96","Kriterion: Revista de Filosofia","Português","2001","http://www.scielo.br/scielo.php?script=sci_arttext&pid=S0100-512X2001000200004&lang=pt" 
"S0100-512X2001000200005-scl","Observações críticas acerca da noção Leibniziana de decretos divinos possíveis","Marques, Edgar","Kriterion: Revista de Filosofia; 42(104); 97-112","Kriterion: Revista de Filosofia","Português","2001","http://www.scielo.br/scielo.php?script=sci_arttext&pid=S0100-512X2001000200005&lang=pt" 
"S0100-512X2001000200006-scl","O ens realissimum e a existência: notas sobre o conceito de impessoalidade em Ser e Tempo, de Martin Heidegger","Reis, Róbson Ramos dos","Kriterion: Revista de Filosofia; 42(104); 113-129","Kriterion: Revista de Filosofia","Português","2001","http://www.scielo.br/scielo.php?script=sci_arttext&pid=S0100-512X2001000200006&lang=pt" 
"S0100-512X2001000200007-scl","","Ruffino, Marco","Kriterion: Revista de Filosofia; 42(104); 130-146","Kriterion: Revista de Filosofia","Inglês","2001","http://www.scielo.br/scielo.php?script=sci_arttext&pid=S0100-512X2001000200007&lang=pt" 
"S0211-57352001000400004-esp","Perspectiva jurídica de la relación entre farmacoterapia antidepresiva y suicidio","Barrio Flores, Luis Fernando","Revista de la Asociación Española de Neuropsiquiatría; (80); 37-54","Revista de la Asociación Española de Neuropsiquiatría","Espanhol","2001","http://scielo.isciii.es/scielo.php?script=sci_arttext&pid=S0211-57352001000400004&lang=pt" 
"S0211-57352001000400009-esp","Modelo asistencial integrador en salud mental infantojuvenil","Salvador Sánchez, Isabel","Revista de la Asociación Española de Neuropsiquiatría; (80); 111-118","Revista de la Asociación Española de Neuropsiquiatría","Espanhol","2001","http://scielo.isciii.es/scielo.php?script=sci_arttext&pid=S0211-57352001000400009&lang=pt" 
"S0211-57352001000400008-esp","La interconsulta en salud mental infantil de niños recién nacidos con alto riesgo","Menéndez Osorio, Federico","Revista de la Asociación Española de Neuropsiquiatría; (80); 101-110","Revista de la Asociación Española de Neuropsiquiatría","Espanhol","2001","http://scielo.isciii.es/scielo.php?script=sci_arttext&pid=S0211-57352001000400008&lang=pt" 
"S0211-57352001000400007-esp","La psicogénesis del delirio en la obra y en la época de E. Kretschmer","Díez Patricio, Antonio","Revista de la Asociación Española de Neuropsiquiatría; (80); 73-97","Revista de la Asociación Española de Neuropsiquiatría","Espanhol","2001","http://scielo.isciii.es/scielo.php?script=sci_arttext&pid=S0211-57352001000400007&lang=pt" 
"S0211-57352001000400006-esp","Reflexiones acerca de la psicoterapia: la formación y el movimiento de la integración","Olabarría González, Begoña","Revista de la Asociación Española de Neuropsiquiatría; (80); 61-69","Revista de la Asociación Española de Neuropsiquiatría","Espanhol","2001","http://scielo.isciii.es/scielo.php?script=sci_arttext&pid=S0211-57352001000400006&lang=pt" 
"S0211-57352001000400001-esp","Modelos y paradigmas en salud mental","Capellá, Alfred","Revista de la Asociación Española de Neuropsiquiatría; (80); 3-5","Revista de la Asociación Española de Neuropsiquiatría","Espanhol","2001","http://scielo.isciii.es/scielo.php?script=sci_arttext&pid=S0211-57352001000400001&lang=pt" 
"S0211-57352001000400005-esp","De las psicopatologías críticas a la crítica de la psicopatología","Fernández Liria, Alberto","Revista de la Asociación Española de Neuropsiquiatría; (80); 57-60","Revista de la Asociación Española de Neuropsiquiatría","Espanhol","2001","http://scielo.isciii.es/scielo.php?script=sci_arttext&pid=S0211-57352001000400005&lang=pt" 
"S0211-57352001000400002-esp","Los dolores abdominales psicógenos de la infancia: una revisión","Otero Rodríguez, Juan, Rodado Martínez, Juan, Sanz Rivas, Elena","Revista de la Asociación Española de Neuropsiquiatría; (80); 9-22","Revista de la Asociación Española de Neuropsiquiatría","Espanhol","2001","http://scielo.isciii.es/scielo.php?script=sci_arttext&pid=S0211-57352001000400002&lang=pt" 
"S0211-57352001000400003-esp","El consentimiento informado en psicoterapia","Castilla García, Aurelio, Castilla San José, M.ª Loreto","Revista de la Asociación Española de Neuropsiquiatría; (80); 23-35","Revista de la Asociación Española de Neuropsiquiatría","Espanhol","2001","http://scielo.isciii.es/scielo.php?script=sci_arttext&pid=S0211-57352001000400003&lang=pt" 
"S0211-57352001000400010-esp","","","Revista de la Asociación Española de Neuropsiquiatría; (80); 121-126","Revista de la Asociación Española de Neuropsiquiatría","Espanhol","2001","http://scielo.isciii.es/scielo.php?script=sci_arttext&pid=S0211-57352001000400010&lang=pt" 
"S1667-782X2001000200001-arg","Editorial","Rabinovich, Jorge","Ecología austral; 11(2); 59-59","Ecología austral","Espanhol","2001","http://www.scielo.org.ar/scielo.php?script=sci_arttext&pid=S1667-782X2001000200001&lang=pt" 
"S1667-782X2001000200002-arg","Respuesta a largo plazo del puma (Puma concolor) a una declinación poblacional de la vizcacha (Lagostomus maximus) en el desierto del Monte, Argentina","Pessino, Marcelo EM, Sarasola, José H, Wander, Claudio, Besoky, Nestor","Ecología austral; 11(2); 61-67","Ecología austral","Espanhol","2001","http://www.scielo.org.ar/scielo.php?script=sci_arttext&pid=S1667-782X2001000200002&lang=pt" 
"S1667-782X2001000200003-arg","Alimentación de la carpa (Cyprinus carpio Linnaeus 1758) en la laguna de Lobos, Provincia de Buenos Aires, Argentina","Colautti, Darío C, Remes Lenicov, Mauricio","Ecología austral; 11(2); 69-78","Ecología austral","Espanhol","2001","http://www.scielo.org.ar/scielo.php?script=sci_arttext&pid=S1667-782X2001000200003&lang=pt" 
"S1667-782X2001000200004-arg","Dinámica poblacional de dos especies de anfípodos y su relación con la vegetación acuática en un microambiente de la cuenca del río Luján (Argentina)","Casset, María A, Momo, Fernando R, Giorgi, Adonis DN","Ecología austral; 11(2); 79-85","Ecología austral","Espanhol","2001","http://www.scielo.org.ar/scielo.php?script=sci_arttext&pid=S1667-782X2001000200004&lang=pt" 
"S1667-782X2001000200005-arg","Utilización de recursos y supervivencia larval del barrenador del brote, Crocidosema aporema (Lepidoptera: Tortricidae), en soja (Glycine max)","Liljesthröm, Gerardo G, Rojas, Gloria C, Pereyra, Patricia C","Ecología austral; 11(2); 87-94","Ecología austral","Espanhol","2001","http://www.scielo.org.ar/scielo.php?script=sci_arttext&pid=S1667-782X2001000200005&lang=pt" 
"S1667-782X2001000200006-arg","Modificación del crecimiento y de la calidad de fustes en un raleo fuerte de un rodal en fase de crecimiento óptimo inicial de Nothofagus pumilio","Martínez Pastur, Guillermo, Cellini, Juan M, Lencinas, María V, Vukasovic, Ricardo, Vicente, Ramiro, Bertolami, Facundo, Giunchi, Jorge","Ecología austral; 11(2); 95-104","Ecología austral","Espanhol","2001","http://www.scielo.org.ar/scielo.php?script=sci_arttext&pid=S1667-782X2001000200006&lang=pt" 
"S1667-782X2001000200007-arg","Tendencias ontogenéticas en el tamaño y la forma de las hojas de Nothofagus pumilio (Poepp. et Endl.) Krasser (Fagaceae)","Puntieri, Javier G, Damascos, María A, Souza, María S","Ecología austral; 11(2); 105-114","Ecología austral","Espanhol","2001","http://www.scielo.org.ar/scielo.php?script=sci_arttext&pid=S1667-782X2001000200007&lang=pt" 
"S1667-782X2001000200008-arg","Filling the groove: energy flow to seabirds in the Beagle Channel, Tierra del Fuego, Argentina","Raya Rey, Andrea, Schiavinin, Adrián","Ecología austral; 11(2); 115-122","Ecología austral","Inglês","2001","http://www.scielo.org.ar/scielo.php?script=sci_arttext&pid=S1667-782X2001000200008&lang=pt" 
"S1667-782X2001000200009-arg","Population density sampling and dispersion pattern of Delphacodes kuscheli Fennah (Homoptera: Delphacidae) in oat crops","Trumper, Eduardo V, Garat, Oscar","Ecología austral; 11(2); 123-130","Ecología austral","Inglês","2001","http://www.scielo.org.ar/scielo.php?script=sci_arttext&pid=S1667-782X2001000200009&lang=pt" 
"S1667-782X2001000200010-arg","Implicancias del efecto de las interacciones en la interpretación de experimentos factoriales en biología","Willems, Priscila, Raffaele, Estela","Ecología austral; 11(2); 131-138","Ecología austral","Espanhol","2001","http://www.scielo.org.ar/scielo.php?script=sci_arttext&pid=S1667-782X2001000200010&lang=pt" 
"S0034-70942001000600012-scl","Erratum","Cangiani, Luiz M.","Revista Brasileira de Anestesiologia; 51(6); 564-564","Revista Brasileira de Anestesiologia","Inglês, Português","2001","http://www.scielo.br/scielo.php?script=sci_arttext&pid=S0034-70942001000600012&lang=pt" 
"S0034-70942001000600003-scl","Efeito da clonidina associada à bupivacaína a 0,5% hiperbárica na anestesia subaracnóidea","Fonseca, Neuber Martins, Oliveira, Clarissa Aires de","Revista Brasileira de Anestesiologia; 51(6); 483-492","Revista Brasileira de Anestesiologia","Inglês, Português","2001","http://www.scielo.br/scielo.php?script=sci_arttext&pid=S0034-70942001000600003&lang=pt" 
"S0034-70942001000600011-scl","Propostas em ventilação mecânica na síndrome da angústia respiratória","Auler Junior, José Otávio Costa, Bliacheriene, Fernando, Miyoshi, Erika, Fernandes, Cláudia Regina","Revista Brasileira de Anestesiologia; 51(6); 558-564","Revista Brasileira de Anestesiologia","Inglês, Português","2001","http://www.scielo.br/scielo.php?script=sci_arttext&pid=S0034-70942001000600011&lang=pt" 
"S0034-70942001000600010-scl","Avaliação e preparo pré-operatório do portador de doença das artérias coronárias","Ramos, Gilson, Ramos Filho, José, Pereira, Edísio","Revista Brasileira de Anestesiologia; 51(6); 548-557","Revista Brasileira de Anestesiologia","Inglês, Português","2001","http://www.scielo.br/scielo.php?script=sci_arttext&pid=S0034-70942001000600010&lang=pt" 
"S0034-70942001000600001-scl","Alterações transitórias do exame neurológico durante o despertar da anestesia com enflurano, isoflurano ou sevoflurano","Soares, Luiz Fernando, Helayel, Pablo Escovedo, Oliveira Filho, Getúlio Rodrigues de, Amaral, Rogério do","Revista Brasileira de Anestesiologia; 51(6); 465-473","Revista Brasileira de Anestesiologia","Inglês, Português","2001","http://www.scielo.br/scielo.php?script=sci_arttext&pid=S0034-70942001000600001&lang=pt" 
"S0034-70942001000600002-scl","Bupivacaína levógira a 0,5% pura versus mistura enantiomérica de bupivacaína (S75-R25) a 0,5% em anestesia peridural para cirurgia de varizes","Delfino, José, Vale, Nilton Bezerra do","Revista Brasileira de Anestesiologia; 51(6); 474-482","Revista Brasileira de Anestesiologia","Inglês, Português","2001","http://www.scielo.br/scielo.php?script=sci_arttext&pid=S0034-70942001000600002&lang=pt" 
"S0034-70942001000600004-scl","Estudo comparativo entre bupivacaína a 0,25% e ropivacaína a 0,2% em anestesia peridural para cirurgia torácica","Novaes, Marcus Vinícius Martins, Francisco, Carlos Roberto Lopes, Pimenta, Karina Bernardi, Lavinas, Paulo Sérgio Gomes","Revista Brasileira de Anestesiologia; 51(6); 493-502","Revista Brasileira de Anestesiologia","Inglês, Português","2001","http://www.scielo.br/scielo.php?script=sci_arttext&pid=S0034-70942001000600004&lang=pt" 
"S0034-70942001000600005-scl","Efeito preemptivo da morfina por via venosa na analgesia pós-operatória e na resposta ao trauma cirúrgico","Kiliçkan, Levent","Revista Brasileira de Anestesiologia; 51(6); 503-510","Revista Brasileira de Anestesiologia","Inglês, Português","2001","http://www.scielo.br/scielo.php?script=sci_arttext&pid=S0034-70942001000600005&lang=pt" 
"S0034-70942001000600006-scl","A articulação acrômio-clavicular como ponto de referência alternativo para o nível flebostático","Oliveira Filho, Getúlio Rodrigues de, Bernal, Rolando Eliezer Jimenez, Pivatto, Sandro Luiz, Tomasi, Alexandre Teobaldo, Soares, Luiz Fernando, Helayel, Pablo Escovedo","Revista Brasileira de Anestesiologia; 51(6); 511-517","Revista Brasileira de Anestesiologia","Inglês, Português","2001","http://www.scielo.br/scielo.php?script=sci_arttext&pid=S0034-70942001000600006&lang=pt" 
"S0034-70942001000600007-scl","Efeitos de baixas pressões no balonete da máscara laríngea na mucosa faringolaríngea do cão","Martins, Regina Helena Garcia, Braz, José Reinaldo Cerqueira, Moura, José Marcos Pechula, Costa, Graziela de Araújo, Carvalho, Lídia Raquel de","Revista Brasileira de Anestesiologia; 51(6); 518-527","Revista Brasileira de Anestesiologia","Inglês, Português","2001","http://www.scielo.br/scielo.php?script=sci_arttext&pid=S0034-70942001000600007&lang=pt" 
"S0034-70942001000600008-scl","Fenoldopam: novo antihipertensivo parenteral; alternativa ao nitroprussiato","César, Daniel Sousa, Miyoshi, Erika, Halpern, Hélio, Auler Junior, José Otávio Costa","Revista Brasileira de Anestesiologia; 51(6); 528-536","Revista Brasileira de Anestesiologia","Inglês, Português","2001","http://www.scielo.br/scielo.php?script=sci_arttext&pid=S0034-70942001000600008&lang=pt" 
"S0034-70942001000600009-scl","Anestesia subaracnóidea em crianças","Módolo, Norma Sueli Pinheiro, Castiglia, Yara Marcondes Machado","Revista Brasileira de Anestesiologia; 51(6); 537-547","Revista Brasileira de Anestesiologia","Inglês, Português","2001","http://www.scielo.br/scielo.php?script=sci_arttext&pid=S0034-70942001000600009&lang=pt" 
"S1413-85572001000200012-scl","Quebrando tabus: uma experiência com crianças portadoras de necessidades especiais","Oliveira, Katya Luciane de","Psicologia Escolar e Educacional; 5(2); 79-81","Psicologia Escolar e Educacional","Português","2001","http://www.scielo.br/scielo.php?script=sci_arttext&pid=S1413-85572001000200012&lang=pt" 
"S1413-85572001000200008-scl","Processo motivacional na psicologia contemporânea","Santos, Acácia Aparecida Angeli dos","Psicologia Escolar e Educacional; 5(2); 67-68","Psicologia Escolar e Educacional","Português","2001","http://www.scielo.br/scielo.php?script=sci_arttext&pid=S1413-85572001000200008&lang=pt" 
"S1413-85572001000200001-scl","Em busca do crescimento qualitativo","Santos, Acácia Aparecida Angeli dos","Psicologia Escolar e Educacional; 5(2); 9-9","Psicologia Escolar e Educacional","Português","2001","http://www.scielo.br/scielo.php?script=sci_arttext&pid=S1413-85572001000200001&lang=pt" 
"S1413-85572001000200004-scl","A utilidade do wisc na detecção de problemas de atenção em escolares","Tonelotto, Josiane Maria de Freitas","Psicologia Escolar e Educacional; 5(2); 31-37","Psicologia Escolar e Educacional","Português","2001","http://www.scielo.br/scielo.php?script=sci_arttext&pid=S1413-85572001000200004&lang=pt" 
"S1413-85572001000200011-scl","Homenagem a Maria Felismina de Rezende e Fuzari","Witter, Geraldina Porto","Psicologia Escolar e Educacional; 5(2); 77-78","Psicologia Escolar e Educacional","Português","2001","http://www.scielo.br/scielo.php?script=sci_arttext&pid=S1413-85572001000200011&lang=pt" 
"S1413-85572001000200010-scl","Entrevista com Prof. Aloysio Bzuneck","Carelli, Ana Esmeralda","Psicologia Escolar e Educacional; 5(2); 73-75","Psicologia Escolar e Educacional","Português","2001","http://www.scielo.br/scielo.php?script=sci_arttext&pid=S1413-85572001000200010&lang=pt" 
"S1413-85572001000200006-scl","Motivação nas aulas de educação física em uma escola particular","Bidutte, Luciana de Castro","Psicologia Escolar e Educacional; 5(2); 49-58","Psicologia Escolar e Educacional","Português","2001","http://www.scielo.br/scielo.php?script=sci_arttext&pid=S1413-85572001000200006&lang=pt" 
"S1413-85572001000200009-scl","Tecnologia educacional","Costa, Luiz","Psicologia Escolar e Educacional; 5(2); 69-71","Psicologia Escolar e Educacional","Português","2001","http://www.scielo.br/scielo.php?script=sci_arttext&pid=S1413-85572001000200009&lang=pt" 
