"S0006-87051999000200009-scl","Resistência de linhagens avançadas de tomateiro a tospovírus","LOURENÇÃO, ANDRÉ LUIZ, NAGAI, HIROSHI, SIQUEIRA, WALTER JOSÉ, MELO, ARLETE MARCHI TAVARES DE, USBERTI FILHO, JOSÉ ALFREDO, FONTE, LEONARDO COSTA DA, MELO, PAULO CÉSAR TAVARES DE","Bragantia; 58(2); 293-303","Bragantia","Português","1999","http://www.scielo.br/scielo.php?script=sci_arttext&pid=S0006-87051999000200009&lang=pt" 
"S0006-87051999000200003-scl","Linhagens diaplóides de trigo: produção de grãos, características agronômicas e tolerância à toxicidade de alumínio","CAMARGO, CARLOS EDUARDO DE OLIVEIRA, RAMOS, LUIS CARLOS DA SILVA, FERREIRA FILHO, ANTONIO WILSON PENTEADO, FELICIO, JOÃO CARLOS, PETTINELLI JÚNIOR, ARMANDO, CASTRO, JAIRO LOPES DE, YOKOO, ÉRIKA YUMI","Bragantia; 58(2); 235-246","Bragantia","Português","1999","http://www.scielo.br/scielo.php?script=sci_arttext&pid=S0006-87051999000200003&lang=pt" 
"S0006-87051999000200001-scl","Teor de água no substrato de crescimento e fotossíntese em laranjeira Valência","MACHADO, EDUARDO CARUSO, MEDINA, CAMILO LÁZARO, GOMES, MARA DE MENEZES DE ASSIS","Bragantia; 58(2); 217-226","Bragantia","Português","1999","http://www.scielo.br/scielo.php?script=sci_arttext&pid=S0006-87051999000200001&lang=pt" 
"S0102-79721999000300003-scl","Considerações sobre a letra: a psicose em questão","Freire, Ana Beatriz","Psicologia: Reflexão e Crítica; 12(3); -","Psicologia: Reflexão e Crítica","Português","1999","http://www.scielo.br/scielo.php?script=sci_arttext&pid=S0102-79721999000300003&lang=pt" 
"S0102-79721999000300008-scl","O excesso de transferência na pesquisa em psicanálise","Beividas, Waldir","Psicologia: Reflexão e Crítica; 12(3); -","Psicologia: Reflexão e Crítica","Português","1999","http://www.scielo.br/scielo.php?script=sci_arttext&pid=S0102-79721999000300008&lang=pt" 
"S0102-79721999000300011-scl","Versões do supereu e perversão","Rudge, Ana Maria","Psicologia: Reflexão e Crítica; 12(3); -","Psicologia: Reflexão e Crítica","Português","1999","http://www.scielo.br/scielo.php?script=sci_arttext&pid=S0102-79721999000300011&lang=pt" 
"S0102-79721999000300014-scl","Metapsicologia do sujeito moderno","Fleig, Mario","Psicologia: Reflexão e Crítica; 12(3); -","Psicologia: Reflexão e Crítica","Português","1999","http://www.scielo.br/scielo.php?script=sci_arttext&pid=S0102-79721999000300014&lang=pt" 
"S0034-77011999000100001-scl","","Magnani, José Guilherme Cantor","Revista de Antropologia; 42(1-2); 05-06","Revista de Antropologia","Português","1999","http://www.scielo.br/scielo.php?script=sci_arttext&pid=S0034-77011999000100001&lang=pt" 
"S0034-77011999000100008-scl","O pássaro de fogo","Lima, Tânia Stolze","Revista de Antropologia; 42(1-2); 113-132","Revista de Antropologia","Português","1999","http://www.scielo.br/scielo.php?script=sci_arttext&pid=S0034-77011999000100008&lang=pt" 
"S0034-77011999000100007-scl","As cidades de Tristes trópicos","Magnani, José Guilherme Cantor","Revista de Antropologia; 42(1-2); 97-111","Revista de Antropologia","Português","1999","http://www.scielo.br/scielo.php?script=sci_arttext&pid=S0034-77011999000100007&lang=pt" 
"S0034-77011999000100005-scl","Lévi-Strauss: razão e sensibilidade","Novaes, Sylvia Caiuby","Revista de Antropologia; 42(1-2); 67-76","Revista de Antropologia","Português","1999","http://www.scielo.br/scielo.php?script=sci_arttext&pid=S0034-77011999000100005&lang=pt" 
"S0034-77011999000100003-scl","O modelo e a marca, ou o estilo dos &quot;misturados&quot;.   Cosmologia, História e Estética entre os povos indígenas do Uaçá&lt;a NAME=&quot;BM1not&quot;&gt;&lt;/a&gt;","Vidal, Lux Boelitz","Revista de Antropologia; 42(1-2); 29-45","Revista de Antropologia","Português","1999","http://www.scielo.br/scielo.php?script=sci_arttext&pid=S0034-77011999000100003&lang=pt" 
"S0034-77011999000100002-scl","Claude Lévi-Strauss, aos 90","Moisés, Beatriz Perrone","Revista de Antropologia; 42(1-2); 09-25","Revista de Antropologia","Português","1999","http://www.scielo.br/scielo.php?script=sci_arttext&pid=S0034-77011999000100002&lang=pt" 
"S0034-77011999000100004-scl","Razão ou sensibilidade?","","Revista de Antropologia; 42(1-2); 46-64","Revista de Antropologia","Português","1999","http://www.scielo.br/scielo.php?script=sci_arttext&pid=S0034-77011999000100004&lang=pt" 
"S0034-77011999000100012-scl","Lévi-Strauss e os sentidos da História","Goldman, Marcio","Revista de Antropologia; 42(1-2); 223-238","Revista de Antropologia","Português","1999","http://www.scielo.br/scielo.php?script=sci_arttext&pid=S0034-77011999000100012&lang=pt" 
"S0034-77011999000100006-scl","O sentir das estruturas e as estruturas do sentir: a poesia que lévistrouxe","Silva, Vagner Gonçalves da","Revista de Antropologia; 42(1-2); 77-96","Revista de Antropologia","Português","1999","http://www.scielo.br/scielo.php?script=sci_arttext&pid=S0034-77011999000100006&lang=pt" 
"S0034-77011999000100009-scl","Linguagem e parentesco","Silva, Marcio","Revista de Antropologia; 42(1-2); 133-161","Revista de Antropologia","Português","1999","http://www.scielo.br/scielo.php?script=sci_arttext&pid=S0034-77011999000100009&lang=pt" 
"S0034-77011999000100010-scl","Simetria e entropia: sobre a noção de estrutura de Lévi-Strauss","Almeida, Mauro W. B. de","Revista de Antropologia; 42(1-2); 163-197","Revista de Antropologia","Português","1999","http://www.scielo.br/scielo.php?script=sci_arttext&pid=S0034-77011999000100010&lang=pt" 
"S0034-77011999000100011-scl","História e Etnologia. Lévi-Strauss e os embates em região de fronteira","Schwarcz, Lilia K. Moritz","Revista de Antropologia; 42(1-2); 199-222","Revista de Antropologia","Português","1999","http://www.scielo.br/scielo.php?script=sci_arttext&pid=S0034-77011999000100011&lang=pt" 
"S0034-77011999000100013-scl","Sobre a comunicação entre diferentes antropologias","Lanna, Marcos","Revista de Antropologia; 42(1-2); 239-265","Revista de Antropologia","Português","1999","http://www.scielo.br/scielo.php?script=sci_arttext&pid=S0034-77011999000100013&lang=pt" 
"S0006-87051999000200004-scl","Identificação de marcador RAPD ligado ao gene de resistência à raça 63.39 da mancha-angular do feijoeiro","FERREIRA, CLAUDIA FORTES, BORÉM, ALUÍZIO, CARVALHO, GERALDO ASSIS DE, NIETSCHE, SILVIA, PAULA JÚNIOR, TRAZILBO JOSÉ DE, BARROS, EVERALDO GONÇALVES DE, MOREIRA, MAURÍLIO ALVES","Bragantia; 58(2); 247-252","Bragantia","Português","1999","http://www.scielo.br/scielo.php?script=sci_arttext&pid=S0006-87051999000200004&lang=pt" 
"S0006-87051999000200018-scl","Mineral nutrition and caffeine content in coffee leaves","MAZZAFERA, PAULO","Bragantia; 58(2); 387-391","Bragantia","Inglês","1999","http://www.scielo.br/scielo.php?script=sci_arttext&pid=S0006-87051999000200018&lang=pt" 
"S0006-87051999000200012-scl","Efeitos na cultura do trigo da rotação com milho e adubos verdes, na presença e na ausência de adubação nitrogenada","ARF, ORIVALDO, SILVA, LUZIA SALUSTIANO DA, BUZETTI, SALATIÉR, ALVES, MARLENE CRISTINA, SÁ, MARCO EUSTÁQUIO DE, RODRIGUES, RICARDO ANTONIO FERREIRA, HERNANDEZ, FERNANDO BRAZ TANGERINO","Bragantia; 58(2); 323-334","Bragantia","Português","1999","http://www.scielo.br/scielo.php?script=sci_arttext&pid=S0006-87051999000200012&lang=pt" 
"S0001-37141999000100005-scl","Pathogenesis of meningoencephalitis in rabbits by bovine herpesvirus type-5 (BHV-5)","Silva, Adriana M. da, Flores, Eduardo F., Weiblen, Rudi, Canto, Marister C., Irigoyen, Luiz F., Roehe, Paulo M., Sousa, Renato S. de","Revista de Microbiologia; 30(1); 22-31","Revista de Microbiologia","Inglês","1999","http://www.scielo.br/scielo.php?script=sci_arttext&pid=S0001-37141999000100005&lang=pt" 
"S0001-37141999000100011-scl","Role of the concentration process in the recovery of Candida albicans from blood","Freitas, Ana Lúcia Peixoto de, Barth, Afonso Luis","Revista de Microbiologia; 30(1); 54-58","Revista de Microbiologia","Inglês","1999","http://www.scielo.br/scielo.php?script=sci_arttext&pid=S0001-37141999000100011&lang=pt" 
"S0001-37141999000100013-scl","Catabolism of caffeine and purification of a xanthine oxidade responsible for methyluric acids production in Pseudomonas putida L","Yamaoka-Yano, Dirce Mithico, Mazzafera, Paulo","Revista de Microbiologia; 30(1); 62-70","Revista de Microbiologia","Inglês","1999","http://www.scielo.br/scielo.php?script=sci_arttext&pid=S0001-37141999000100013&lang=pt" 
"S0104-79301999000200002-scl","THE IMPROVEMENT AND STANDARDIZATION OF ANTIVENOM PRODUCTION IN DEVELOPING COUNTRIES: COMPARING ANTIVENOM QUALITY, THERAPEUTICAL EFFICIENCY, AND COST","KRIFI, M. N., EL AYEB, M., DELLAGI, K.","Journal of Venomous Animals and Toxins; 5(2); 128-141","Journal of Venomous Animals and Toxins","Inglês","1999","http://www.scielo.br/scielo.php?script=sci_arttext&pid=S0104-79301999000200002&lang=pt" 
"S0103-65641999000100015-scl","Jogo de opostos: uma aproximação à realidade mental através do mito de Dioniso","Migliavacca, Eva Maria","Psicologia USP; 10(1); 297-309","Psicologia USP","Português","1999","http://www.scielo.br/scielo.php?script=sci_arttext&pid=S0103-65641999000100015&lang=pt" 
"S0103-65641999000100014-scl","O inconsciente da moda: psicanálise e cultura caipira","Barison, Osvaldo Luís","Psicologia USP; 10(1); 281-295","Psicologia USP","Português","1999","http://www.scielo.br/scielo.php?script=sci_arttext&pid=S0103-65641999000100014&lang=pt" 
"S0103-65641999000100012-scl","Silêncios","Godoy, Luciano Marcondes","Psicologia USP; 10(1); 239-257","Psicologia USP","Português","1999","http://www.scielo.br/scielo.php?script=sci_arttext&pid=S0103-65641999000100012&lang=pt" 
"S0103-65641999000100008-scl","O telescópio e o caleidoscópio: o inconsciente em Freud e Groddeck","Ávila, Lazslo Antonio","Psicologia USP; 10(1); 157-168","Psicologia USP","Português","1999","http://www.scielo.br/scielo.php?script=sci_arttext&pid=S0103-65641999000100008&lang=pt" 
"S0103-65641999000100002-scl","O lugar do inconsciente ou sobre o inconsciente como lugar","Azambuja, Deodato Curvo de","Psicologia USP; 10(1); 11-24","Psicologia USP","Português","1999","http://www.scielo.br/scielo.php?script=sci_arttext&pid=S0103-65641999000100002&lang=pt" 
"S0103-65641999000100001-scl","","Frayze-Pereira, João A.","Psicologia USP; 10(1); 9-10","Psicologia USP","Português","1999","http://www.scielo.br/scielo.php?script=sci_arttext&pid=S0103-65641999000100001&lang=pt" 
"S0103-65641999000100007-scl","Caminhos da intersubjetividade: Ferenczi, Bion, Matte-Blanco","Gerber, Ignácio","Psicologia USP; 10(1); 141-155","Psicologia USP","Português","1999","http://www.scielo.br/scielo.php?script=sci_arttext&pid=S0103-65641999000100007&lang=pt" 
"S0103-65641999000100006-scl","Bion: o zero da experiência","Lino Silva, Maria Emilia","Psicologia USP; 10(1); 119-139","Psicologia USP","Português","1999","http://www.scielo.br/scielo.php?script=sci_arttext&pid=S0103-65641999000100006&lang=pt" 
"S0103-65641999000100011-scl","O inconsciente e as condições de uma autoria","Sousa, Edson Luiz André de","Psicologia USP; 10(1); 225-238","Psicologia USP","Português","1999","http://www.scielo.br/scielo.php?script=sci_arttext&pid=S0103-65641999000100011&lang=pt" 
"S0103-65641999000100017-scl","Inconsciente: um resgate de sua dimensão social-histórica","Minerbo, Marion","Psicologia USP; 10(1); 335-345","Psicologia USP","Português","1999","http://www.scielo.br/scielo.php?script=sci_arttext&pid=S0103-65641999000100017&lang=pt" 
"S0103-65641999000100018-scl","Entre a psicanálise e a arte","Rosenfeld, Helena K.","Psicologia USP; 10(1); 347-353","Psicologia USP","Português","1999","http://www.scielo.br/scielo.php?script=sci_arttext&pid=S0103-65641999000100018&lang=pt" 
"S0103-65641999000100003-scl","Inconsciente e percepção na psicanálise freudiana","Coelho Junior, Nelson Ernesto","Psicologia USP; 10(1); 25-54","Psicologia USP","Português","1999","http://www.scielo.br/scielo.php?script=sci_arttext&pid=S0103-65641999000100003&lang=pt" 
"S0103-65641999000100005-scl","O inconsciente e a constituição de significados na vida mental","Barros, Elias Mallet da Rocha","Psicologia USP; 10(1); 97-117","Psicologia USP","Português","1999","http://www.scielo.br/scielo.php?script=sci_arttext&pid=S0103-65641999000100005&lang=pt" 
"S0103-65641999000100009-scl","Em busca do referente, às voltas com a polissemia dos sonhos: a questão em Freud, Stuart Mill e Lacan","Loffredo, Ana Maria","Psicologia USP; 10(1); 169-197","Psicologia USP","Português","1999","http://www.scielo.br/scielo.php?script=sci_arttext&pid=S0103-65641999000100009&lang=pt" 
"S0103-65641999000100010-scl","Entre os sonhos e a interpretação: aparelho psíquico/aparelho simbólico","Frayze-Pereira, João A.","Psicologia USP; 10(1); 199-223","Psicologia USP","Português","1999","http://www.scielo.br/scielo.php?script=sci_arttext&pid=S0103-65641999000100010&lang=pt" 
"S0103-65641999000100013-scl","O memorial de Sofia: leitura psicanalítica de um conto de Clarice Lispector","Rosenbaum, Yudith","Psicologia USP; 10(1); 259-280","Psicologia USP","Português","1999","http://www.scielo.br/scielo.php?script=sci_arttext&pid=S0103-65641999000100013&lang=pt" 
"S0103-65641999000100016-scl","Psicanálise e educação: banquete, fast food e merenda escolar","Bacha, Marcia Simões Corrêa Neder","Psicologia USP; 10(1); 311-334","Psicologia USP","Português","1999","http://www.scielo.br/scielo.php?script=sci_arttext&pid=S0103-65641999000100016&lang=pt" 
"S0103-65641999000100004-scl","O inconsciente segundo Karl Abraham","Mezan, Renato","Psicologia USP; 10(1); 55-95","Psicologia USP","Português","1999","http://www.scielo.br/scielo.php?script=sci_arttext&pid=S0103-65641999000100004&lang=pt" 
"S0011-52581999000100008-scl","A universidade e a pós-modernidade: o panorama brasileiro","Lessa, Carlos","Dados; 42(1); 159-188","Dados","Português","1999","http://www.scielo.br/scielo.php?script=sci_arttext&pid=S0011-52581999000100008&lang=pt" 
"S0011-52581999000100001-scl","A lucidez excessiva de Olavo","Almeida, Candido Mendes de","Dados; 42(1); 7-9","Dados","Português","1999","http://www.scielo.br/scielo.php?script=sci_arttext&pid=S0011-52581999000100001&lang=pt" 
"S0011-52581999000100003-scl","Sobre o amigo","Boschi, Renato R.","Dados; 42(1); 15-16","Dados","Português","1999","http://www.scielo.br/scielo.php?script=sci_arttext&pid=S0011-52581999000100003&lang=pt" 
"S0011-52581999000100002-scl","Um homem","Soares, Gláucio A. Dillon","Dados; 42(1); 11-13","Dados","Português","1999","http://www.scielo.br/scielo.php?script=sci_arttext&pid=S0011-52581999000100002&lang=pt" 
"S0011-52581999000100007-scl","Democracia, hierarquia e cultura no Québec","Oliveira, Luís R. Cardoso de","Dados; 42(1); 139-158","Dados","Português","1999","http://www.scielo.br/scielo.php?script=sci_arttext&pid=S0011-52581999000100007&lang=pt" 
"S0011-52581999000100004-scl","Reformas de sistemas eleitorais: mudanças, contextos e conseqüências","Lima Junior, Olavo Brasil de","Dados; 42(1); 17-61","Dados","Português","1999","http://www.scielo.br/scielo.php?script=sci_arttext&pid=S0011-52581999000100004&lang=pt" 
"S0011-52581999000100005-scl","O problema do cociente partidário na teoria e na prática brasileiras do mandato representativo","Tavares, José Antônio Giusti","Dados; 42(1); 63-110","Dados","Português","1999","http://www.scielo.br/scielo.php?script=sci_arttext&pid=S0011-52581999000100005&lang=pt" 
"S0011-52581999000100006-scl","Instituições eleitorais e desempenho do presidencialismo no Brasil","Santos, Fabiano","Dados; 42(1); 111-138","Dados","Português","1999","http://www.scielo.br/scielo.php?script=sci_arttext&pid=S0011-52581999000100006&lang=pt" 
"S0102-79721999000300016-scl","Pesquisa e transferência em psicanálise: lugar sem excessos","Beividas, Waldir","Psicologia: Reflexão e Crítica; 12(3); -","Psicologia: Reflexão e Crítica","Português","1999","http://www.scielo.br/scielo.php?script=sci_arttext&pid=S0102-79721999000300016&lang=pt" 
"S0102-79721999000300002-scl","Editorial número especial pesquisa em psicanálise","Lo Bianco, Anna Carolina","Psicologia: Reflexão e Crítica; 12(3); -","Psicologia: Reflexão e Crítica","Português","1999","http://www.scielo.br/scielo.php?script=sci_arttext&pid=S0102-79721999000300002&lang=pt" 
"S0102-79721999000300004-scl","Feyerabend e a máxima do &quot;Tudo Vale&quot;: A necessidade de se adotar múltiplas possibilidades de metodologia na construção de teorias científicas","Couto, Luis Flávio","Psicologia: Reflexão e Crítica; 12(3); -","Psicologia: Reflexão e Crítica","Português","1999","http://www.scielo.br/scielo.php?script=sci_arttext&pid=S0102-79721999000300004&lang=pt" 
"S0102-79721999000300005-scl","A constituição do mundo psíquico na concepção winnicottiana: uma contribuição à clínica das psicoses","Santos, Manoel Antônio dos","Psicologia: Reflexão e Crítica; 12(3); -","Psicologia: Reflexão e Crítica","Português","1999","http://www.scielo.br/scielo.php?script=sci_arttext&pid=S0102-79721999000300005&lang=pt" 
"S0102-79721999000300006-scl","Sobre a lembrança: uma abordagem psicanalítica dos limites estruturais da memória","Bastos, Angélica","Psicologia: Reflexão e Crítica; 12(3); -","Psicologia: Reflexão e Crítica","Português","1999","http://www.scielo.br/scielo.php?script=sci_arttext&pid=S0102-79721999000300006&lang=pt" 
"S0102-79721999000300007-scl","Temporalidade do trauma: gênese mais estrutura no pensamento freudiano","Celes, Luiz Augusto","Psicologia: Reflexão e Crítica; 12(3); -","Psicologia: Reflexão e Crítica","Português","1999","http://www.scielo.br/scielo.php?script=sci_arttext&pid=S0102-79721999000300007&lang=pt" 
"S0102-79721999000300009-scl","A instituição acadêmica e a legitimação da vocação científica da psicanálise","Pinto, Jeferson Machado","Psicologia: Reflexão e Crítica; 12(3); -","Psicologia: Reflexão e Crítica","Português","1999","http://www.scielo.br/scielo.php?script=sci_arttext&pid=S0102-79721999000300009&lang=pt" 
"S0102-79721999000300010-scl","Tyché e Aion no pensamento freudiano","Herzog, Regina","Psicologia: Reflexão e Crítica; 12(3); -","Psicologia: Reflexão e Crítica","Português","1999","http://www.scielo.br/scielo.php?script=sci_arttext&pid=S0102-79721999000300010&lang=pt" 
"S0006-87051999000100006-scl","Efeitos diretos e indiretos e correlações canônicas para caracteres relacionados com a produção de pimentão","TAVARES, MARCELO, MELO, ARLETE MARCHI TAVARES DE, SCIVITTARO, WALKYRIA BUENO","Bragantia; 58(1); 41-47","Bragantia","Português","1999","http://www.scielo.br/scielo.php?script=sci_arttext&pid=S0006-87051999000100006&lang=pt" 
"S0006-87051999000100005-scl","Variabilidade isoenzimática em oito raças de milho","VALENTE, SÉRGIO EMÍLIO DOS SANTOS, GIMENES, MARCOS APARECIDO, LOPES, CATALINA ROMERO","Bragantia; 58(1); 29-31","Bragantia","Português","1999","http://www.scielo.br/scielo.php?script=sci_arttext&pid=S0006-87051999000100005&lang=pt" 
"S0006-87051999000100002-scl","Análise da capacidade combinatória em berinjela","SILVA, DERLY JOSÉ HENRIQUES DA, COSTA, CYRO PAULINO DA, CASALI, VICENTE WAGNER DIAS, DIAS, LUÍZ ANTÔNIO DOS SANTOS, CRUZ, COSME DAMIÃO","Bragantia; 58(1); 07-14","Bragantia","Português","1999","http://www.scielo.br/scielo.php?script=sci_arttext&pid=S0006-87051999000100002&lang=pt" 
"S0006-87051999000100001-scl","Inheritance of malate dehydrogenase in wild pepper","SCHUELTER, ADILSON RICKEN, CASALI, VICENTE WAGNER DIAS, FINGER, FERNANDO LUIZ","Bragantia; 58(1); 01-06","Bragantia","Inglês","1999","http://www.scielo.br/scielo.php?script=sci_arttext&pid=S0006-87051999000100001&lang=pt" 
"S0006-87051999000100004-scl","Técnica de cruzamentos controlados em Euphorbia heterophylla L.","VARGAS, LEANDRO, BORÉM, ALUÍZIO, SILVA, ANTONIO ALBERTO DA","Bragantia; 58(1); 23-27","Bragantia","Português","1999","http://www.scielo.br/scielo.php?script=sci_arttext&pid=S0006-87051999000100004&lang=pt" 
"S0006-87051999000100003-scl","Genetic distances in soybean based on RAPD markers","CORRÊA, RONAN XAVIER, ABDELNOOR, RICARDO VILELA, FALEIRO, FÁBIO GELAPE, CRUZ, COSME DAMIÃO, MOREIRA, MAURILIO ALVES, BARROS, EVERALDO GONÇALVES DE","Bragantia; 58(1); 15-22","Bragantia","Inglês","1999","http://www.scielo.br/scielo.php?script=sci_arttext&pid=S0006-87051999000100003&lang=pt" 
"S0006-87051999000100007-scl","Fontes de pólen utilizadas por Apis mellifera L. e algumas espécies de Trigonini (apidae) em Piracicaba (SP)","CARVALHO, CARLOS ALFREDO LOPES DE, MARCHINI, LUÍS CARLOS, ROS, PATRÍCIA BENITES","Bragantia; 58(1); 49-56","Bragantia","Português","1999","http://www.scielo.br/scielo.php?script=sci_arttext&pid=S0006-87051999000100007&lang=pt" 
"S0006-87051999000100011-scl","Influência da época de semeadura no crescimento, produtividade e outros fatores de produção em cultivares de amendoim na região da alta paulista","KASAI, FRANCISCO SEIITI, PAULO, EDISON MARTINS, GODOY, IGNÁCIO JOSÉ DE, NAGAI, VIOLETA","Bragantia; 58(1); 95-107","Bragantia","Português","1999","http://www.scielo.br/scielo.php?script=sci_arttext&pid=S0006-87051999000100011&lang=pt" 
"S0006-87051999000100017-scl","Determinação da circunferência de rolamento de pneus agrícolas utilizando dois métodos: manual e eletrônico","CORRÊA, ILA MARIA, YANAI, KIYOSHI, GONZALEZ MAZIERO, JOSÉ VALDEMAR, LANÇAS, KLÉBER PEREIRA","Bragantia; 58(1); 179-184","Bragantia","Português","1999","http://www.scielo.br/scielo.php?script=sci_arttext&pid=S0006-87051999000100017&lang=pt" 
"S0006-87051999000100020-scl","Teores de clorofila determinados por medidor portátil e sua relação com formas de nitrogênio em folhas de tomateiro &lt;A NAME=&quot;top&quot;&gt;&lt;/A&gt;cultivados em dois tipos de solo","GUIMARÃES, TADEU GRACIOLLI, FONTES, PAULO CESAR REZENDE, PEREIRA, PAULO ROBERTO GOMES, ALVAREZ V., VICTOR H., MONNERAT, PEDRO HENRIQUE","Bragantia; 58(1); 209-216","Bragantia","Português","1999","http://www.scielo.br/scielo.php?script=sci_arttext&pid=S0006-87051999000100020&lang=pt" 
"S0006-87051999000100013-scl","Tolerância de genótipos de pimentão ao baixo teor de fósforo no solo","OLIVEIRA, VALTER RODRIGUES, CASALI, VICENTE WAGNER DIAS, PEREIRA, PAULO ROBERTO GOMES, CRUZ, COSME DAMIÃO, PIRES, NÁDJA DE MOURA","Bragantia; 58(1); 125-139","Bragantia","Português","1999","http://www.scielo.br/scielo.php?script=sci_arttext&pid=S0006-87051999000100013&lang=pt" 
"S0006-87051999000100015-scl","Desenvolvimento e teste de modelos agrometeorológicos para a estimativa de produtividade do cafeeiro","PICINI, ANGÉLICA GIAROLLA, CAMARGO, MARCELO BENTO PAES DE, ORTOLANI, ALTINO ALDO, FAZUOLI, LUIZ CARLOS, GALLO, PAULO BOLLER","Bragantia; 58(1); 157-170","Bragantia","Português","1999","http://www.scielo.br/scielo.php?script=sci_arttext&pid=S0006-87051999000100015&lang=pt" 
"S0006-87051999000100016-scl","Modelo agrometeorológico de estimativa de produtividade para o cultivar de laranja Valência","CAMARGO, MARCELO BENTO PAES DE, ORTOLANI, ALTINO ALDO, PEDRO JÚNIOR, MÁRIO JOSÉ, ROSA, SIDNEY MARCOS","Bragantia; 58(1); 171-178","Bragantia","Português","1999","http://www.scielo.br/scielo.php?script=sci_arttext&pid=S0006-87051999000100016&lang=pt" 
"S0006-87051999000100018-scl","Estimation of genetic parameters in the square lattice analysis","VIANA, JOSÉ MARCELO SORIANO, REGAZZI, ADAIR JOSÉ","Bragantia; 58(1); 185-193","Bragantia","Inglês","1999","http://www.scielo.br/scielo.php?script=sci_arttext&pid=S0006-87051999000100018&lang=pt" 
"S0006-87051999000100019-scl","Estimation of genetic parameters in the analysis of square lattice experiment group","VIANA, JOSÉ MARCELO SORIANO, REGAZZI, ADAIR JOSÉ","Bragantia; 58(1); 195-208","Bragantia","Inglês","1999","http://www.scielo.br/scielo.php?script=sci_arttext&pid=S0006-87051999000100019&lang=pt" 
"S0006-87051999000100010-scl","Novos genótipos de triticum durum L.: rendimento, adaptabilidade e qualidade tecnológica","FELICIO, JOÃO CARLOS, CAMARGO, CARLOS EDUARDO DE OLIVEIRA, MAGNO, CRISTINA DE PAULA DOS SANTOS, FREITAS, JOSÉ GUILHERME DE, BORTOLETTO, NELSON, PETTINELLI JUNIOR, ARMANDO, GALLO, PAULO BOLLER, PEREIRA, JOSÉ CARLOS VILA NOVA ALVES","Bragantia; 58(1); 83-94","Bragantia","Português","1999","http://www.scielo.br/scielo.php?script=sci_arttext&pid=S0006-87051999000100010&lang=pt" 
"S0006-87051999000100014-scl","Remoção de material erodido dos solos de pequenas bacias hidrográficas no Parque Estadual da Serra do Mar em Cubatão (SP)","ROSSI, MARCIO, PFEIFER, RUI MARCONI","Bragantia; 58(1); 141-156","Bragantia","Português","1999","http://www.scielo.br/scielo.php?script=sci_arttext&pid=S0006-87051999000100014&lang=pt" 
"S0011-52581999000300004-scl","Justiça distributiva: a crítica de Sen a Rawls","Vita, Álvaro de","Dados; 42(3); 471-496","Dados","Português","1999","http://www.scielo.br/scielo.php?script=sci_arttext&pid=S0011-52581999000300004&lang=pt" 
"S0011-52581999000300001-scl","Cidadania Global e Estado Nacional","Vieira, Liszt","Dados; 42(3); 395-419","Dados","Português","1999","http://www.scielo.br/scielo.php?script=sci_arttext&pid=S0011-52581999000300001&lang=pt" 
"S0011-52581999000300003-scl","Evolução e desígnio em Hayek","Kerstenetzky, Celia Lessa","Dados; 42(3); 453-470","Dados","Português","1999","http://www.scielo.br/scielo.php?script=sci_arttext&pid=S0011-52581999000300003&lang=pt" 
"S0011-52581999000300002-scl","Negociando a Reforma: a privatização de empresas públicas no Brasil","Almeida, Maria Hermínia Tavares de","Dados; 42(3); 421-451","Dados","Português","1999","http://www.scielo.br/scielo.php?script=sci_arttext&pid=S0011-52581999000300002&lang=pt" 
