"S0011-52581999000300005-scl","&quot;Aniquilando as naturais produções&quot;: crítica iluminista, crise colonial e as origens do ambientalismo político no Brasil (1786-1810)","Pádua, José Augusto","Dados; 42(3); 497-538","Dados","Português","1999","http://www.scielo.br/scielo.php?script=sci_arttext&pid=S0011-52581999000300005&lang=pt" 
"S0011-52581999000300006-scl","José Veríssimo: pensamento social e etnografia da Amazônia (1877/1915)","Bezerra Neto, José Maia","Dados; 42(3); 539-564","Dados","Português","1999","http://www.scielo.br/scielo.php?script=sci_arttext&pid=S0011-52581999000300006&lang=pt" 
"S0102-01881999000200001-scl","","","Revista Brasileira de História; 19(38); 09-12","Revista Brasileira de História","Português","1999","http://www.scielo.br/scielo.php?script=sci_arttext&pid=S0102-01881999000200001&lang=pt" 
"S0102-01881999000200012-scl","Entre retratos e cadáveres: a fotografia na Guerra do Paraguai","Toral, André Amaral de","Revista Brasileira de História; 19(38); 283-310","Revista Brasileira de História","Português","1999","http://www.scielo.br/scielo.php?script=sci_arttext&pid=S0102-01881999000200012&lang=pt" 
"S0102-01881999000200013-scl","","Souza, Néri de Almeida","Revista Brasileira de História; 19(38); 313-318","Revista Brasileira de História","Português","1999","http://www.scielo.br/scielo.php?script=sci_arttext&pid=S0102-01881999000200013&lang=pt" 
"S0102-01881999000200002-scl","Cultura marítima: marinheiros e escravos no tráfico negreiro para o Brasil (sécs. XVIII e XIX)","Rodrigues, Jaime","Revista Brasileira de História; 19(38); 15-53","Revista Brasileira de História","Português","1999","http://www.scielo.br/scielo.php?script=sci_arttext&pid=S0102-01881999000200002&lang=pt" 
"S0102-01881999000200003-scl","O princípio da fronteira e a fronteira de princípios: filhos ilegítimos em Cuiabá no século XIX","Peraro, Maria Adenir","Revista Brasileira de História; 19(38); 55-80","Revista Brasileira de História","Português","1999","http://www.scielo.br/scielo.php?script=sci_arttext&pid=S0102-01881999000200003&lang=pt" 
"S0102-01881999000200004-scl","A saracura: ritmos sociais e temporalidades da metrópole do café (1890-1920)","Koguruma, Paulo","Revista Brasileira de História; 19(38); 81-99","Revista Brasileira de História","Português","1999","http://www.scielo.br/scielo.php?script=sci_arttext&pid=S0102-01881999000200004&lang=pt" 
"S0102-01881999000200007-scl","Cultura de massas e representações femininas na paulicéia dos anos 20","Pinto, Maria Inez Machado Borges","Revista Brasileira de História; 19(38); 139-163","Revista Brasileira de História","Português","1999","http://www.scielo.br/scielo.php?script=sci_arttext&pid=S0102-01881999000200007&lang=pt" 
"S0102-01881999000200008-scl","A criança no Estado Novo: uma leitura na longa duração","Pereira, André Ricardo","Revista Brasileira de História; 19(38); 165-198","Revista Brasileira de História","Português","1999","http://www.scielo.br/scielo.php?script=sci_arttext&pid=S0102-01881999000200008&lang=pt" 
"S0102-01881999000200009-scl","A apostasia comunista: a subjetividade como política","Kolleritz, Fernando","Revista Brasileira de História; 19(38); 199-226","Revista Brasileira de História","Português","1999","http://www.scielo.br/scielo.php?script=sci_arttext&pid=S0102-01881999000200009&lang=pt" 
"S0102-01881999000200010-scl","Das representações míticas à cultura clerical: as Fadas da Literatura Medieval","Morás, Antonio P.V.","Revista Brasileira de História; 19(38); 229-252","Revista Brasileira de História","Português","1999","http://www.scielo.br/scielo.php?script=sci_arttext&pid=S0102-01881999000200010&lang=pt" 
"S0102-01881999000200011-scl","A escola primária como tema do debate político às vésperas da República","Boto, Carlota","Revista Brasileira de História; 19(38); 253-281","Revista Brasileira de História","Português","1999","http://www.scielo.br/scielo.php?script=sci_arttext&pid=S0102-01881999000200011&lang=pt" 
"S0102-01881999000200005-scl","Para um aprofundamento historiográfico: discutindo o separatismo paulista de 1887","Adduci, Cássia Chrispiniano","Revista Brasileira de História; 19(38); 101-124","Revista Brasileira de História","Português","1999","http://www.scielo.br/scielo.php?script=sci_arttext&pid=S0102-01881999000200005&lang=pt" 
"S0102-01881999000200006-scl","A guerra das narrativas: debates e ilusões em torno do ensino de História","Laville, Christian","Revista Brasileira de História; 19(38); 125-138","Revista Brasileira de História","Português","1999","http://www.scielo.br/scielo.php?script=sci_arttext&pid=S0102-01881999000200006&lang=pt" 
"S0102-79721999000200001-scl","Editorial","Koller, Sílvia Helena","Psicologia: Reflexão e Crítica; 12(2); iii-iv","Psicologia: Reflexão e Crítica","Português","1999","http://www.scielo.br/scielo.php?script=sci_arttext&pid=S0102-79721999000200001&lang=pt" 
"S0102-79721999000200002-scl","Agradecimentos","","Psicologia: Reflexão e Crítica; 12(2); v-vi","Psicologia: Reflexão e Crítica","Português","1999","http://www.scielo.br/scielo.php?script=sci_arttext&pid=S0102-79721999000200002&lang=pt" 
"S0102-79721999000200006-scl","A relação entre estilos pedagógicos e desempenho escolar em Portugal","Sousa, Lígia Correia de, Santos, Luísa","Psicologia: Reflexão e Crítica; 12(2); 331-342","Psicologia: Reflexão e Crítica","Português","1999","http://www.scielo.br/scielo.php?script=sci_arttext&pid=S0102-79721999000200006&lang=pt" 
"S0102-79721999000200003-scl","Aprendendo a ler e a escrever: a narrativa das crianças sobre a alfabetização","Correa, Jane, MacLean, Morag","Psicologia: Reflexão e Crítica; 12(2); 273-286","Psicologia: Reflexão e Crítica","Português","1999","http://www.scielo.br/scielo.php?script=sci_arttext&pid=S0102-79721999000200003&lang=pt" 
"S0102-79721999000200007-scl","Preferências taxonômicas versus preferências temáticas: existe mudança ao longo do desenvolvimento?","Cardoso-Martins, Cláudia, Souza, Rita de Cássia de, Santos, Ruth do Socorro Vieira dos","Psicologia: Reflexão e Crítica; 12(2); 343-359","Psicologia: Reflexão e Crítica","Português","1999","http://www.scielo.br/scielo.php?script=sci_arttext&pid=S0102-79721999000200007&lang=pt" 
"S0102-79721999000200008-scl","Estratégias de aprendizagem e desempenho escolar: considerações para a prática educacional","Boruchovitch, Evely","Psicologia: Reflexão e Crítica; 12(2); 361-376","Psicologia: Reflexão e Crítica","Português","1999","http://www.scielo.br/scielo.php?script=sci_arttext&pid=S0102-79721999000200008&lang=pt" 
"S0102-79721999000200011-scl","Avaliação da depressão infantil em alunos da pré-escola","Andriola, Wagner Bandeira, Cavalcante, Luanna Rodrigues","Psicologia: Reflexão e Crítica; 12(2); 419-428","Psicologia: Reflexão e Crítica","Português","1999","http://www.scielo.br/scielo.php?script=sci_arttext&pid=S0102-79721999000200011&lang=pt" 
"S0102-79721999000200018-scl","A referência e o pensamento psicótico","Martins, Francisco, Costa, Arilson Corrêa da, Aquino, Ana Paula de","Psicologia: Reflexão e Crítica; 12(2); 537-548","Psicologia: Reflexão e Crítica","Português","1999","http://www.scielo.br/scielo.php?script=sci_arttext&pid=S0102-79721999000200018&lang=pt" 
"S0102-79721999000200005-scl","Teoria da Mente: efeito da idade, do sexo e do uso de atores animados e inanimados na inferência de estados mentais","Roazzi, Antonio, Santana, Suely de Melo","Psicologia: Reflexão e Crítica; 12(2); 307-330","Psicologia: Reflexão e Crítica","Português","1999","http://www.scielo.br/scielo.php?script=sci_arttext&pid=S0102-79721999000200005&lang=pt" 
"S0102-79721999000200009-scl","Crianças com dificuldade de aprendizagem: um estudo de seguimento","Santos, Luciana Carla dos, Marturano, Edna Maria","Psicologia: Reflexão e Crítica; 12(2); 377-394","Psicologia: Reflexão e Crítica","Português","1999","http://www.scielo.br/scielo.php?script=sci_arttext&pid=S0102-79721999000200009&lang=pt" 
"S0102-79721999000200010-scl","Avaliação cognitiva assistida de crianças com indicações de dificuldades de aprendizagem escolar e deficiência mental leve","Santa Maria, Margaret Rose, Linhares, Maria Beatriz Martins","Psicologia: Reflexão e Crítica; 12(2); 395-417","Psicologia: Reflexão e Crítica","Português","1999","http://www.scielo.br/scielo.php?script=sci_arttext&pid=S0102-79721999000200010&lang=pt" 
"S0102-79721999000200012-scl","Crianças surdas e suas famílias: um panorama geral","Brito, Angela Maria Waked de, Dessen, Maria Auxiliadora","Psicologia: Reflexão e Crítica; 12(2); 429-445","Psicologia: Reflexão e Crítica","Português","1999","http://www.scielo.br/scielo.php?script=sci_arttext&pid=S0102-79721999000200012&lang=pt" 
"S0102-79721999000200013-scl","Do mundo amoral à possibilidade de ação moral","Freitas, Lia Beatriz de Lucca","Psicologia: Reflexão e Crítica; 12(2); 447-458","Psicologia: Reflexão e Crítica","Português","1999","http://www.scielo.br/scielo.php?script=sci_arttext&pid=S0102-79721999000200013&lang=pt" 
"S0102-79721999000200014-scl","Educação moral para a autonomia","Dias, Adelaide Alves","Psicologia: Reflexão e Crítica; 12(2); 459-478","Psicologia: Reflexão e Crítica","Português","1999","http://www.scielo.br/scielo.php?script=sci_arttext&pid=S0102-79721999000200014&lang=pt" 
"S0102-79721999000200015-scl","Representações sociais do envelhecimento","Veloz, Maria Cristina Triguero, Nascimento-Schulze, Clélia Maria, Camargo, Brigido Vizeu","Psicologia: Reflexão e Crítica; 12(2); 479-501","Psicologia: Reflexão e Crítica","Português","1999","http://www.scielo.br/scielo.php?script=sci_arttext&pid=S0102-79721999000200015&lang=pt" 
"S0102-79721999000200016-scl","Análise das repercussões psicossociais decorrentes da concessão de benefícios rurais","Albuquerque, Francisco José B., Lôbo, Alexandre Lucena, Raymundo, Jorge da Silva","Psicologia: Reflexão e Crítica; 12(2); 503-519","Psicologia: Reflexão e Crítica","Português","1999","http://www.scielo.br/scielo.php?script=sci_arttext&pid=S0102-79721999000200016&lang=pt" 
"S0102-79721999000200017-scl","Imaginário, simbólico e sincrético: aspectos psicológicos da filiação a novas religiões japonesas","Paiva, Geraldo José de","Psicologia: Reflexão e Crítica; 12(2); 521-535","Psicologia: Reflexão e Crítica","Português","1999","http://www.scielo.br/scielo.php?script=sci_arttext&pid=S0102-79721999000200017&lang=pt" 
"S0102-79721999000200019-scl","A produção científica na psicologia: uma análise dos periódicos brasileiros no período 1990-1997","Yamamoto, Oswaldo H., Souza, Carina Cavalcanti de, Yamamoto, Maria Emília","Psicologia: Reflexão e Crítica; 12(2); 549-565","Psicologia: Reflexão e Crítica","Português","1999","http://www.scielo.br/scielo.php?script=sci_arttext&pid=S0102-79721999000200019&lang=pt" 
"S0102-79721999000200004-scl","Teoria da Mente: diferentes abordagens","Jou, Graciela Inchausti de, Sperb, Tania Mara","Psicologia: Reflexão e Crítica; 12(2); 287-306","Psicologia: Reflexão e Crítica","Português","1999","http://www.scielo.br/scielo.php?script=sci_arttext&pid=S0102-79721999000200004&lang=pt" 
"S0006-87051999000100008-scl","Influência do armazenamento, substrato, envelhecimento precoce e profundidade de semeadura na germinação de canafístula","PEREZ, SONIA CRISTINA JULIANO GUALTIERI DE ANDRADE, FANTI, SILMARA CRISTINA, CASALI, CARLOS APARECIDO","Bragantia; 58(1); 57-68","Bragantia","Português","1999","http://www.scielo.br/scielo.php?script=sci_arttext&pid=S0006-87051999000100008&lang=pt" 
"S0006-87051999000100009-scl","Interacão genótipos e locais para rendimento de grãos de linhagens de soja com diferentes ciclos de maturação","ROCHA, MAURISRAEL DE MOURA, VELLO, NATAL ANTONIO","Bragantia; 58(1); 69-81","Bragantia","Português","1999","http://www.scielo.br/scielo.php?script=sci_arttext&pid=S0006-87051999000100009&lang=pt" 
"S0006-87051999000100012-scl","Variabilidade entre genótipos de milho para eficiência no uso de fósforo","MACHADO, CYNTHIA TORRES DE TOLEDO, GUERRA, JOSÉ GUILHERME MARINHO, ALMEIDA, DEJAIR LOPES DE, MACHADO, ALTAIR TOLEDO","Bragantia; 58(1); 109-124","Bragantia","Português","1999","http://www.scielo.br/scielo.php?script=sci_arttext&pid=S0006-87051999000100012&lang=pt" 
"S0011-52581999000200003-scl","Estratégias de campanha no horário gratuito de propaganda eleitoral em eleições proporcionais","Schmitt, Rogério, Carneiro, Leandro Piquet, Kuschnir, Karina","Dados; 42(2); 277-301","Dados","Português","1999","http://www.scielo.br/scielo.php?script=sci_arttext&pid=S0011-52581999000200003&lang=pt" 
"S0102-79721999000300001-scl","Editorial","Koller, Sílvia Helena","Psicologia: Reflexão e Crítica; 12(3); -","Psicologia: Reflexão e Crítica","Português","1999","http://www.scielo.br/scielo.php?script=sci_arttext&pid=S0102-79721999000300001&lang=pt" 
"S0102-79721999000300013-scl","Elementos para uma metapsicologia da interpretação em análise","Lo Bianco, Anna Carolina","Psicologia: Reflexão e Crítica; 12(3); -","Psicologia: Reflexão e Crítica","Português","1999","http://www.scielo.br/scielo.php?script=sci_arttext&pid=S0102-79721999000300013&lang=pt" 
"S0102-79721999000300012-scl","Castas estrelas!","Andrade, Regina","Psicologia: Reflexão e Crítica; 12(3); -","Psicologia: Reflexão e Crítica","Português","1999","http://www.scielo.br/scielo.php?script=sci_arttext&pid=S0102-79721999000300012&lang=pt" 
"S0102-79721999000300015-scl","A transferência na pesquisa em psicanálise: lugar ou excesso?","Elia, Luciano","Psicologia: Reflexão e Crítica; 12(3); -","Psicologia: Reflexão e Crítica","Português","1999","http://www.scielo.br/scielo.php?script=sci_arttext&pid=S0102-79721999000300015&lang=pt" 
"S0100-72031999000800011-scl","Avaliação da qualidade da assistência às gestações pós-termo nas maternidades públicas do Rio de Janeiro: utilização de procedimentos de indução","Iamada, Neiw Oliveira","Revista Brasileira de Ginecologia e Obstetrícia; 21(8); 487-487","Revista Brasileira de Ginecologia e Obstetrícia","Português","1999","http://www.scielo.br/scielo.php?script=sci_arttext&pid=S0100-72031999000800011&lang=pt" 
"S0100-72031999000800007-scl","Conduta expectante para gravidez tubária íntegra","Kyung Koo, Han, Elito Junior, Julio, Camano, Luiz","Revista Brasileira de Ginecologia e Obstetrícia; 21(8); 465-470","Revista Brasileira de Ginecologia e Obstetrícia","Português","1999","http://www.scielo.br/scielo.php?script=sci_arttext&pid=S0100-72031999000800007&lang=pt" 
"S0100-72031999000800006-scl","Efeitos da estimulação vibro-acústica na velocidade do sangue da artéria cerebral média e na freqüência cardíaca fetal: 1. entre a 35ª e 41ª semanas de gestação","Behle, Ivo, Teixeira, Lucas Paccini, Pontremoli, Mila, Rynkowski, Carla Bittencourt, Zielinsky, Paulo","Revista Brasileira de Ginecologia e Obstetrícia; 21(8); 459-463","Revista Brasileira de Ginecologia e Obstetrícia","Português","1999","http://www.scielo.br/scielo.php?script=sci_arttext&pid=S0100-72031999000800006&lang=pt" 
"S0100-72031999000800005-scl","Avaliação do resultado estético em pacientes submetidas a ressecção de mama supranumerária axilar","Oliveira, Marcus Cavalcante de, Taia, Lúcia, Leite Filho, Antônio Rosário, Freitas Júnior, Ruffo de","Revista Brasileira de Ginecologia e Obstetrícia; 21(8); 453-456","Revista Brasileira de Ginecologia e Obstetrícia","Português","1999","http://www.scielo.br/scielo.php?script=sci_arttext&pid=S0100-72031999000800005&lang=pt" 
"S0100-72031999000800004-scl","Freqüência da infecção pelo papilomavírus humano em mulheres com ectopia cervical","Murta, Eddie Fernando Candido, Lombardi, Welington, Borges, Luciana Souza, Souza, Maria Azniv Hazarabedian de, Adad, Sheila Jorge","Revista Brasileira de Ginecologia e Obstetrícia; 21(8); 447-449","Revista Brasileira de Ginecologia e Obstetrícia","Português","1999","http://www.scielo.br/scielo.php?script=sci_arttext&pid=S0100-72031999000800004&lang=pt" 
"S0100-72031999000800003-scl","Prevalência de cândida na flora vaginal de mulheres atendidas num serviço de planejamento familiar","Aleixo Neto, Antônio, Hamdan, Júnia Soares, Souza, Ressalla Castro","Revista Brasileira de Ginecologia e Obstetrícia; 21(8); 441-445","Revista Brasileira de Ginecologia e Obstetrícia","Português","1999","http://www.scielo.br/scielo.php?script=sci_arttext&pid=S0100-72031999000800003&lang=pt" 
"S0100-72031999000800001-scl","O sonho realizado","","Revista Brasileira de Ginecologia e Obstetrícia; 21(8); 430-430","Revista Brasileira de Ginecologia e Obstetrícia","Português","1999","http://www.scielo.br/scielo.php?script=sci_arttext&pid=S0100-72031999000800001&lang=pt" 
"S0100-72031999000800002-scl","Lesões induzidas por papilomavírus humano em parceiros de mulheres com neoplasia intra-epitelial do trato genital inferior","Teixeira, Júlio César, Santos, César Cabello dos, Derchain, Sophie Françoise Mauricette, Zeferino, Luiz Carlos","Revista Brasileira de Ginecologia e Obstetrícia; 21(8); 431-437","Revista Brasileira de Ginecologia e Obstetrícia","Português","1999","http://www.scielo.br/scielo.php?script=sci_arttext&pid=S0100-72031999000800002&lang=pt" 
"S0100-72031999000800013-scl","Perfil epidemiológico da natimortalidade em Caxias do Sul","Lorenzi, Dino Roberto Soares de","Revista Brasileira de Ginecologia e Obstetrícia; 21(8); 488-488","Revista Brasileira de Ginecologia e Obstetrícia","Português","1999","http://www.scielo.br/scielo.php?script=sci_arttext&pid=S0100-72031999000800013&lang=pt" 
"S0100-72031999000800009-scl","Miíase Mamária: relato de 2 casos","Portella Pasqualette, Henrique Alberto, Soares - Pereira, Paulo Maurício, Calás, Maria Julia Gregorio, Santos, Rosana de Castro Ribeiro dos, Manoel, Vânia Ravizzini","Revista Brasileira de Ginecologia e Obstetrícia; 21(8); 483-486","Revista Brasileira de Ginecologia e Obstetrícia","Português","1999","http://www.scielo.br/scielo.php?script=sci_arttext&pid=S0100-72031999000800009&lang=pt" 
"S0100-72031999000800010-scl","Repercussões maternas e perinatais relacionadas à classificação da hipertensão arterial na gravidez","Marchioli, Milton","Revista Brasileira de Ginecologia e Obstetrícia; 21(8); 487-487","Revista Brasileira de Ginecologia e Obstetrícia","Português","1999","http://www.scielo.br/scielo.php?script=sci_arttext&pid=S0100-72031999000800010&lang=pt" 
"S0100-72031999000800008-scl","Importância do diagnóstico pré-natal de gastrosquise","Sbragia Neto, Lourenço, Melo Filho, Antônio Aldo, Barini, Ricardo, Huguet, Priscila Ribeiro, Marba, Sérgio, Bustorff-Silva, Joaquim Murray","Revista Brasileira de Ginecologia e Obstetrícia; 21(8); 475-479","Revista Brasileira de Ginecologia e Obstetrícia","Português","1999","http://www.scielo.br/scielo.php?script=sci_arttext&pid=S0100-72031999000800008&lang=pt" 
"S0100-72031999000800014-scl","Errata","","Revista Brasileira de Ginecologia e Obstetrícia; 21(8); 489-489","Revista Brasileira de Ginecologia e Obstetrícia","Português","1999","http://www.scielo.br/scielo.php?script=sci_arttext&pid=S0100-72031999000800014&lang=pt" 
"S0100-72031999000800012-scl","Estudo da adaptação fetal ao sofrimento crônico: avaliação dopplerfluxométrica, hematimétrica e metabólica","Leite, Henrique Vitor","Revista Brasileira de Ginecologia e Obstetrícia; 21(8); 488-488","Revista Brasileira de Ginecologia e Obstetrícia","Português","1999","http://www.scielo.br/scielo.php?script=sci_arttext&pid=S0100-72031999000800012&lang=pt" 
"S1413-81231999000200001-scl","EDITORIAL","Minayo, Maria Cecília de Souza","Ciência &amp; Saúde Coletiva; 4(2); 218-218","Ciência &amp; Saúde Coletiva","Inglês, Português","1999","http://www.scielo.br/scielo.php?script=sci_arttext&pid=S1413-81231999000200001&lang=pt" 
"S1413-81231999000200017-scl","","","Ciência &amp; Saúde Coletiva; 4(2); 432-433","Ciência &amp; Saúde Coletiva","Português","1999","http://www.scielo.br/scielo.php?script=sci_arttext&pid=S1413-81231999000200017&lang=pt" 
"S1413-81231999000200003-scl","","","Ciência &amp; Saúde Coletiva; 4(2); 243-261","Ciência &amp; Saúde Coletiva","Português","1999","http://www.scielo.br/scielo.php?script=sci_arttext&pid=S1413-81231999000200003&lang=pt" 
"S1413-81231999000200006-scl","O ato de governar as tensões constitutivas do agir em saúde como desafio permanente de algumas estratégias gerenciais","Merhy, Emerson Elias","Ciência &amp; Saúde Coletiva; 4(2); 305-314","Ciência &amp; Saúde Coletiva","Português","1999","http://www.scielo.br/scielo.php?script=sci_arttext&pid=S1413-81231999000200006&lang=pt" 
"S1413-81231999000200010-scl","Planejamento e gestão em saúde: flexibilidade metológica e agir comunicativo","Rivera, Francisco Javier Uribe, Artmann, Elizabeth","Ciência &amp; Saúde Coletiva; 4(2); 355-365","Ciência &amp; Saúde Coletiva","Português","1999","http://www.scielo.br/scielo.php?script=sci_arttext&pid=S1413-81231999000200010&lang=pt" 
"S1413-81231999000200011-scl","Mortalidade hospitalar como indicador de qualidade: uma revisão","Travassos, Claudia, Noronha, José Carvalho de, Martins, Mônica","Ciência &amp; Saúde Coletiva; 4(2); 367-381","Ciência &amp; Saúde Coletiva","Português","1999","http://www.scielo.br/scielo.php?script=sci_arttext&pid=S1413-81231999000200011&lang=pt" 
"S1413-81231999000200002-scl","Planejamento, gestão e avaliação em saúde: identificando problemas","Schraiber, Lilia Blima, Peduzzi, Marina, Sala, Arnaldo, Nemes, Maria Ines B., Castanhera, Elen Rose L., Kon, Rubens","Ciência &amp; Saúde Coletiva; 4(2); 221-242","Ciência &amp; Saúde Coletiva","Português","1999","http://www.scielo.br/scielo.php?script=sci_arttext&pid=S1413-81231999000200002&lang=pt" 
"S1413-81231999000200004-scl","Reforma do Estado e reforma de sistemas de saúde: experiências internacionais e tendências de mudança","Almeida, Célia Maria de","Ciência &amp; Saúde Coletiva; 4(2); 263-286","Ciência &amp; Saúde Coletiva","Português","1999","http://www.scielo.br/scielo.php?script=sci_arttext&pid=S1413-81231999000200004&lang=pt" 
"S1413-81231999000200007-scl","Autonomia versus controle dos trabalhadores: a gestão do poder no hospital","Cecílio, Luiz Carlos de Oliveira","Ciência &amp; Saúde Coletiva; 4(2); 315-329","Ciência &amp; Saúde Coletiva","Português","1999","http://www.scielo.br/scielo.php?script=sci_arttext&pid=S1413-81231999000200007&lang=pt" 
"S1413-81231999000200008-scl","Avaliação do processo de descentralização das ações de saúde","Silva, Ligia Maria Vieira da","Ciência &amp; Saúde Coletiva; 4(2); 331-339","Ciência &amp; Saúde Coletiva","Português","1999","http://www.scielo.br/scielo.php?script=sci_arttext&pid=S1413-81231999000200008&lang=pt" 
"S1413-81231999000200009-scl","Avaliação dos programas de saúde: perspectivas teórico metodológicas e políticas institucionais","Hartz, Zulmira Maria de Araújo","Ciência &amp; Saúde Coletiva; 4(2); 341-353","Ciência &amp; Saúde Coletiva","Português","1999","http://www.scielo.br/scielo.php?script=sci_arttext&pid=S1413-81231999000200009&lang=pt" 
"S1413-81231999000200012-scl","Gestão, planejamento e avaliação de políticas de ciência e tecnologia: hora de rever?","Marques, Marília Bernardes","Ciência &amp; Saúde Coletiva; 4(2); 383-392","Ciência &amp; Saúde Coletiva","Português","1999","http://www.scielo.br/scielo.php?script=sci_arttext&pid=S1413-81231999000200012&lang=pt" 
"S1413-81231999000200013-scl","Equipes de referência e apoio especializado matricial: um ensaio sobre a reorganização do trabalho em saúde","Campos, Gastão Wagner de Sousa","Ciência &amp; Saúde Coletiva; 4(2); 393-403","Ciência &amp; Saúde Coletiva","Português","1999","http://www.scielo.br/scielo.php?script=sci_arttext&pid=S1413-81231999000200013&lang=pt" 
"S1413-81231999000200014-scl","Farmacoepidemiologia no Brasil: evolução e perspectivas","Castro, Lia Lusitana Cardozo de","Ciência &amp; Saúde Coletiva; 4(2); 405-410","Ciência &amp; Saúde Coletiva","Português","1999","http://www.scielo.br/scielo.php?script=sci_arttext&pid=S1413-81231999000200014&lang=pt" 
"S1413-81231999000200015-scl","Precarização do trabalho e desproteção social: desafios para a saúde coletiva","Gomez, Carlos Minayo, Thedim-Costa, Sonia Maria da Fonseca","Ciência &amp; Saúde Coletiva; 4(2); 411-421","Ciência &amp; Saúde Coletiva","Português","1999","http://www.scielo.br/scielo.php?script=sci_arttext&pid=S1413-81231999000200015&lang=pt" 
"S1413-81231999000200016-scl","Doenças tropicais: da ciência dos valores à valorização da ciência na determinação climática de patologias","Albuquerque, Marli B. M. de, Lima e Silva, Francelina Helena Alvarenga, Cardoso, Telma Abdalla de Oliveira","Ciência &amp; Saúde Coletiva; 4(2); 423-431","Ciência &amp; Saúde Coletiva","Português","1999","http://www.scielo.br/scielo.php?script=sci_arttext&pid=S1413-81231999000200016&lang=pt" 
"S1413-81231999000200005-scl","Epidemiologia e planejamento de saúde","Teixeira, Carmem Fontes","Ciência &amp; Saúde Coletiva; 4(2); 287-303","Ciência &amp; Saúde Coletiva","Português","1999","http://www.scielo.br/scielo.php?script=sci_arttext&pid=S1413-81231999000200005&lang=pt" 
"S1413-81231999000100006-scl","Vigilância para acidentes e violência: instrumento para estratégias de prevenção e controle","Waldman, Eliseu Alves, Mello Jorge, Maria Helena de","Ciência &amp; Saúde Coletiva; 4(1); 71-79","Ciência &amp; Saúde Coletiva","Português","1999","http://www.scielo.br/scielo.php?script=sci_arttext&pid=S1413-81231999000100006&lang=pt" 
