"S0074-02761987000800054-scl","Health education for children in the control of Schistosomasis","Schall, Virgínia Torres","Memórias do Instituto Oswaldo Cruz; 82(); 285-292","Memórias do Instituto Oswaldo Cruz","Inglês","1987","http://www.scielo.br/scielo.php?script=sci_arttext&pid=S0074-02761987000800054&lang=pt" 
"S0074-02761987000800055-scl","Educação em saúde no controle das endemias","Carmo, Elisabeth Maria do","Memórias do Instituto Oswaldo Cruz; 82(); 293-294","Memórias do Instituto Oswaldo Cruz","Português","1987","http://www.scielo.br/scielo.php?script=sci_arttext&pid=S0074-02761987000800055&lang=pt" 
"S0074-02761987000800056-scl","Expansão da esquistossomose mansoni em Minas Gerais","Carvalho, Omar dos Santos, Rocha, Roberto Sena, Massara, Cristiano Lara, Katz, Naftale","Memórias do Instituto Oswaldo Cruz; 82(); 295-298","Memórias do Instituto Oswaldo Cruz","Português","1987","http://www.scielo.br/scielo.php?script=sci_arttext&pid=S0074-02761987000800056&lang=pt" 
"S0074-02761987000800057-scl","Population dynamics of aquatic snails in Pampulha reservoir","Freitas, J. R., Bedê, L. C., Marco Júnior, P. de, Rocha, L. A., Santos, M. B. L.","Memórias do Instituto Oswaldo Cruz; 82(); 299-305","Memórias do Instituto Oswaldo Cruz","Inglês","1987","http://www.scielo.br/scielo.php?script=sci_arttext&pid=S0074-02761987000800057&lang=pt" 
"S0074-02761987000800059-scl","Observações ecológicas sobre Biomphalaria straminea (Dunker, 1848) em áreas do Nordeste, Brasil","Rosas, Edivaldo","Memórias do Instituto Oswaldo Cruz; 82(); 311-314","Memórias do Instituto Oswaldo Cruz","Português","1987","http://www.scielo.br/scielo.php?script=sci_arttext&pid=S0074-02761987000800059&lang=pt" 
"S0074-02761987000800060-scl","Effects of Laurus nobilis (Lauraceae) on Biomphalaria glabrata (Say, 1818)","Ré, Liliane, Kawano, Toshie","Memórias do Instituto Oswaldo Cruz; 82(); 315-320","Memórias do Instituto Oswaldo Cruz","Inglês","1987","http://www.scielo.br/scielo.php?script=sci_arttext&pid=S0074-02761987000800060&lang=pt" 
"S0074-02761987000800061-scl","Estudo da ação do moluscocida (Bayluscide-SRB) da Dynatech R/D Company em lagos do nordeste brasileiro - Sergipe, Brasil","Rosas, Edivaldo, Ribeiro, Edna Cristina","Memórias do Instituto Oswaldo Cruz; 82(); 321-329","Memórias do Instituto Oswaldo Cruz","Português","1987","http://www.scielo.br/scielo.php?script=sci_arttext&pid=S0074-02761987000800061&lang=pt" 
"S0074-02761987000800064-scl","Specific treatment of advanced Schistosomiasis liver disease in man: favourable results","Coutinho, Amaury, Domingues, Ana Lúcia Coutinho","Memórias do Instituto Oswaldo Cruz; 82(); 335-340","Memórias do Instituto Oswaldo Cruz","Inglês","1987","http://www.scielo.br/scielo.php?script=sci_arttext&pid=S0074-02761987000800064&lang=pt" 
"S0074-02761987000800066-scl","Atividade quimioprofilática de sabonetes contendo óleo essencial de frutos de Pterodon pubescens na esquistossomose mansoni","Santos Filho, D., Sarti, S. J., Katz, N., Araújo, N., Rocha Filho, P. A., Abreu, J. E., Bortolin, M. E.","Memórias do Instituto Oswaldo Cruz; 82(); 343-345","Memórias do Instituto Oswaldo Cruz","Português","1987","http://www.scielo.br/scielo.php?script=sci_arttext&pid=S0074-02761987000800066&lang=pt" 
"S0074-02761987000800067-scl","Schistosoma mansoni: structural damage after treatment with oxamniquine","Magalhães Filho, Ageu, Melo, Maria Eliane Bezerra de, Padovan, Paulo Antônio, Padovan, Isairas Pereira","Memórias do Instituto Oswaldo Cruz; 82(); 347-352","Memórias do Instituto Oswaldo Cruz","Inglês","1987","http://www.scielo.br/scielo.php?script=sci_arttext&pid=S0074-02761987000800067&lang=pt" 
"S0074-02761987000800068-scl","Abdominal angiostrongyliasis: an under-diagnosed disease","Graeff-Teixeira, C., Camillo-Coura, L., Lenzi, H. L.","Memórias do Instituto Oswaldo Cruz; 82(); 353-354","Memórias do Instituto Oswaldo Cruz","Inglês","1987","http://www.scielo.br/scielo.php?script=sci_arttext&pid=S0074-02761987000800068&lang=pt" 
"S0074-02761987000800069-scl","Sobre o isolamento de uma cepa humana de Schistosoma mansoni, Sambon, 1907","Rodrigues, Izabel R. C., Barros, Vera Lúcia R. Souza de","Memórias do Instituto Oswaldo Cruz; 82(); 355-358","Memórias do Instituto Oswaldo Cruz","Português","1987","http://www.scielo.br/scielo.php?script=sci_arttext&pid=S0074-02761987000800069&lang=pt" 
"S0074-02761987000800071-scl","Ação da oxamniquine sobre o Schistosoma mansoni em camundongos experimentalmente infectados com uma cepa do Kenia","Kohn, A., Bruce, J., Kinoti, G., Mutahi, W. T., Coles, G., Katz, N.","Memórias do Instituto Oswaldo Cruz; 82(); 361-361","Memórias do Instituto Oswaldo Cruz","Português","1987","http://www.scielo.br/scielo.php?script=sci_arttext&pid=S0074-02761987000800071&lang=pt" 
"S0074-02761987000700001-scl","Foreword","Morel, Carlos M.","Memórias do Instituto Oswaldo Cruz; 82(); I-I","Memórias do Instituto Oswaldo Cruz","Inglês","1987","http://www.scielo.br/scielo.php?script=sci_arttext&pid=S0074-02761987000700001&lang=pt" 
"S0074-02761987000700002-scl","Foreword","Garcia, Eloi S.","Memórias do Instituto Oswaldo Cruz; 82(); II-II","Memórias do Instituto Oswaldo Cruz","Inglês","1987","http://www.scielo.br/scielo.php?script=sci_arttext&pid=S0074-02761987000700002&lang=pt" 
"S0074-02761987000700003-scl","Vector salivation and parasite transmission","Ribeiro, José M. C.","Memórias do Instituto Oswaldo Cruz; 82(); 1-3","Memórias do Instituto Oswaldo Cruz","Inglês","1987","http://www.scielo.br/scielo.php?script=sci_arttext&pid=S0074-02761987000700003&lang=pt" 
"S0074-02761987000700004-scl","The evolution of purinergic receptors involved in recognition of a blood meal by hematophagous insects","Galun, Rachel","Memórias do Instituto Oswaldo Cruz; 82(); 5-9","Memórias do Instituto Oswaldo Cruz","Inglês","1987","http://www.scielo.br/scielo.php?script=sci_arttext&pid=S0074-02761987000700004&lang=pt" 
"S0074-02761987000700005-scl","The study of insect blood-feeding behaviour: 1. Feeding equipment, physical and endogenous factors, dose effect analysis, and diet destination","Friend, W. G., Smith, J. J. B.","Memórias do Instituto Oswaldo Cruz; 82(); 11-17","Memórias do Instituto Oswaldo Cruz","Inglês","1987","http://www.scielo.br/scielo.php?script=sci_arttext&pid=S0074-02761987000700005&lang=pt" 
"S0074-02761987000700006-scl","The study of insect blood-feeding behaviour: 2. Recording techniques and the use of flow charts","Smith, J. J. B., Friend, W. G.","Memórias do Instituto Oswaldo Cruz; 82(); 19-23","Memórias do Instituto Oswaldo Cruz","Inglês","1987","http://www.scielo.br/scielo.php?script=sci_arttext&pid=S0074-02761987000700006&lang=pt" 
"S0074-02761987000700007-scl","Evolution of holometabola insect digestive systems: physiological and biochemical aspects","Terra, Walter R.","Memórias do Instituto Oswaldo Cruz; 82(); 25-28","Memórias do Instituto Oswaldo Cruz","Inglês","1987","http://www.scielo.br/scielo.php?script=sci_arttext&pid=S0074-02761987000700007&lang=pt" 
"S0074-02761987000700008-scl","The potassium impermeable apical membrane of insect epithelia: a target for development of safe pesticides","Harvey, William R., Crawford, Dwight N., Eisen, Naomi S., Fernandes, Veronica F., Spaeth, Daniel D., Wolfersberger, Michael G.","Memórias do Instituto Oswaldo Cruz; 82(); 29-34","Memórias do Instituto Oswaldo Cruz","Inglês","1987","http://www.scielo.br/scielo.php?script=sci_arttext&pid=S0074-02761987000700008&lang=pt" 
"S0074-02761987000700010-scl","Midgut of Lepidopteran pupae is a major depot of sequestered, mobilizable, ecdysteroids","Williams, Carroll M.","Memórias do Instituto Oswaldo Cruz; 82(); 47-49","Memórias do Instituto Oswaldo Cruz","Inglês","1987","http://www.scielo.br/scielo.php?script=sci_arttext&pid=S0074-02761987000700010&lang=pt" 
"S0074-02761987000700011-scl","Discovery and identification of an antijuvenile hormone from Chrysanthemum coronarium","Bowers, William S., Aregullin, Manuel","Memórias do Instituto Oswaldo Cruz; 82(); 51-54","Memórias do Instituto Oswaldo Cruz","Inglês","1987","http://www.scielo.br/scielo.php?script=sci_arttext&pid=S0074-02761987000700011&lang=pt" 
"S0074-02761987000700012-scl","Differentation of the fat body cells in the precocius adults of Schistocerca gregaria: regulation of polyploidy by juvenile hormone","Kooman, C. J., Nair, K. K.","Memórias do Instituto Oswaldo Cruz; 82(); 55-60","Memórias do Instituto Oswaldo Cruz","Inglês","1987","http://www.scielo.br/scielo.php?script=sci_arttext&pid=S0074-02761987000700012&lang=pt" 
"S0074-02761987000700013-scl","The Azadirachtins: potent insect growth inhibitors","Rembold, Heinz","Memórias do Instituto Oswaldo Cruz; 82(); 61-66","Memórias do Instituto Oswaldo Cruz","Inglês","1987","http://www.scielo.br/scielo.php?script=sci_arttext&pid=S0074-02761987000700013&lang=pt" 
"S0074-02761987000700014-scl","Effects of precocene and azadirachtin in Rhodnius prolixus: some data on development and reproduction","Garcia, Eloi S., Feder, Denise, Gomes, José Eugénio P. L., Azambuja, Patricia de","Memórias do Instituto Oswaldo Cruz; 82(); 67-73","Memórias do Instituto Oswaldo Cruz","Inglês","1987","http://www.scielo.br/scielo.php?script=sci_arttext&pid=S0074-02761987000700014&lang=pt" 
"S0074-02761987000700015-scl","Secretory activity and endocrine regulation of male accessory glands in the blood-sucking bug Panstrongylus megistus (Hemiptera: Reduviidae)","Regis, Lêda, Furtado, André F., Gomes, Yara de M., Coutinho, Vera B., Schuetz, Maria José C., Cavalcante, Vânia S., Brito, M. Edileuza F., Coutinho, Helio B.","Memórias do Instituto Oswaldo Cruz; 82(); 75-78","Memórias do Instituto Oswaldo Cruz","Inglês","1987","http://www.scielo.br/scielo.php?script=sci_arttext&pid=S0074-02761987000700015&lang=pt" 
"S0074-02761987000700016-scl","Biochemical aspects of Musca domestica vitellogenesis","Bianchi, A. G. de","Memórias do Instituto Oswaldo Cruz; 82(); 79-81","Memórias do Instituto Oswaldo Cruz","Inglês","1987","http://www.scielo.br/scielo.php?script=sci_arttext&pid=S0074-02761987000700016&lang=pt" 
"S0074-02761987000700017-scl","Vitellogenesis in Manduca sexta","Kawooya, John K., Osir, Ellie O., Law, John H.","Memórias do Instituto Oswaldo Cruz; 82(); 83-88","Memórias do Instituto Oswaldo Cruz","Inglês","1987","http://www.scielo.br/scielo.php?script=sci_arttext&pid=S0074-02761987000700017&lang=pt" 
"S0074-02761987000700018-scl","The roles of haemolymphatic lipoproteins in the oogenesis of Rhodnius prolixus","Gondim, Katia Calp, Oliveira, Pedro Lagerblad de, Masuda, Hatisaburo","Memórias do Instituto Oswaldo Cruz; 82(); 89-92","Memórias do Instituto Oswaldo Cruz","Inglês","1987","http://www.scielo.br/scielo.php?script=sci_arttext&pid=S0074-02761987000700018&lang=pt" 
"S0074-02761987000700019-scl","The cell biology of mosquito vitellogenesis","Raikhel, Alexander S.","Memórias do Instituto Oswaldo Cruz; 82(); 93-101","Memórias do Instituto Oswaldo Cruz","Inglês","1987","http://www.scielo.br/scielo.php?script=sci_arttext&pid=S0074-02761987000700019&lang=pt" 
"S0074-02761987000700020-scl","Inputs to the hormonal control of egg development in Rhodnius prolixus","Davey, K. G.","Memórias do Instituto Oswaldo Cruz; 82(); 103-108","Memórias do Instituto Oswaldo Cruz","Inglês","1987","http://www.scielo.br/scielo.php?script=sci_arttext&pid=S0074-02761987000700020&lang=pt" 
"S0074-02761987000700021-scl","The vitellogenin gene family of Aedes aegypti","Hamblin, Martha T., Marx, Jeffrey L., Wolfner, Mariana F., Hagedorn, Henry H.","Memórias do Instituto Oswaldo Cruz; 82(); 109-114","Memórias do Instituto Oswaldo Cruz","Inglês","1987","http://www.scielo.br/scielo.php?script=sci_arttext&pid=S0074-02761987000700021&lang=pt" 
"S0074-02761987000700022-scl","Insect immunity: a gene system for antibacterial proteins","Boman, H. G., Faye, I., Gan, R., Gudmundsson, G. H., Lidholm, D. A., Lee, J. Y., Xanthopoulos, K. G.","Memórias do Instituto Oswaldo Cruz; 82(); 115-124","Memórias do Instituto Oswaldo Cruz","Inglês","1987","http://www.scielo.br/scielo.php?script=sci_arttext&pid=S0074-02761987000700022&lang=pt" 
"S0074-02761987000700023-scl","Gene amplification in Rhynchosciara (1955-1987)","Lara, Francisco J. S.","Memórias do Instituto Oswaldo Cruz; 82(); 125-128","Memórias do Instituto Oswaldo Cruz","Inglês","1987","http://www.scielo.br/scielo.php?script=sci_arttext&pid=S0074-02761987000700023&lang=pt" 
"S0074-02761987000700025-scl","Tryptophan metabolism in tsetse flies and the consequences of its derangement","Gooding, R. H., Rolseth, B. M.","Memórias do Instituto Oswaldo Cruz; 82(); 133-141","Memórias do Instituto Oswaldo Cruz","Inglês","1987","http://www.scielo.br/scielo.php?script=sci_arttext&pid=S0074-02761987000700025&lang=pt" 
"S0074-02761987000700026-scl","Economic threshold levels for the velvetbean caterpillar on soybeans in Brazil: the social and the private perspectives","Margulis, Sergio","Memórias do Instituto Oswaldo Cruz; 82(); 143-152","Memórias do Instituto Oswaldo Cruz","Inglês","1987","http://www.scielo.br/scielo.php?script=sci_arttext&pid=S0074-02761987000700026&lang=pt" 
"S0074-02761987000700027-scl","Biological control of pests through egg parasitoids of the genera Trichogramma and/or Trichogrammatoidea","Parra, J. R. P., Zucchi, R. A., Silveira Neto, S.","Memórias do Instituto Oswaldo Cruz; 82(); 153-160","Memórias do Instituto Oswaldo Cruz","Inglês","1987","http://www.scielo.br/scielo.php?script=sci_arttext&pid=S0074-02761987000700027&lang=pt" 
"S0074-02761987000700028-scl","Nutritional ecology of seed-suking insects of soybean and their management","Panizzi, Antônio R.","Memórias do Instituto Oswaldo Cruz; 82(); 161-175","Memórias do Instituto Oswaldo Cruz","Inglês","1987","http://www.scielo.br/scielo.php?script=sci_arttext&pid=S0074-02761987000700028&lang=pt" 
"S0074-02761987000600001-scl","Address from the vice-president for research, Oswaldo Cruz Foundation","Morel, Carlos M.","Memórias do Instituto Oswaldo Cruz; 82(); I-I","Memórias do Instituto Oswaldo Cruz","Inglês","1987","http://www.scielo.br/scielo.php?script=sci_arttext&pid=S0074-02761987000600001&lang=pt" 
"S0074-02761987000600002-scl","Address from the local organizer","Savino, Wilson","Memórias do Instituto Oswaldo Cruz; 82(); II-II","Memórias do Instituto Oswaldo Cruz","Inglês","1987","http://www.scielo.br/scielo.php?script=sci_arttext&pid=S0074-02761987000600002&lang=pt" 
"S0074-02761987000600003-scl","Thymulin: biochemistry, biology and therapeutical applications","Dardenne, Mireille, Bach, J. F.","Memórias do Instituto Oswaldo Cruz; 82(); 1-8","Memórias do Instituto Oswaldo Cruz","Inglês","1987","http://www.scielo.br/scielo.php?script=sci_arttext&pid=S0074-02761987000600003&lang=pt" 
"S0074-02761987000600005-scl","Cell biology of thymic hormone secretion","Savino, Wilson, Dardenne, Mireille","Memórias do Instituto Oswaldo Cruz; 82(); 15-21","Memórias do Instituto Oswaldo Cruz","Inglês","1987","http://www.scielo.br/scielo.php?script=sci_arttext&pid=S0074-02761987000600005&lang=pt" 
"S0074-02761987000600006-scl","The role of thymic accessory cells in cytokine production and in the intra-thymic T cell differentiation pathway","Papiernik, Martine","Memórias do Instituto Oswaldo Cruz; 82(); 23-28","Memórias do Instituto Oswaldo Cruz","Inglês","1987","http://www.scielo.br/scielo.php?script=sci_arttext&pid=S0074-02761987000600006&lang=pt" 
"S0074-02761987000600007-scl","Potential therapeutic applications for interleukin 1: anti-tumor and hematopoietic effects","Oppenheeim, Joost J., Matsushima, Kouji, Onozaki, Kikuo, Neta, Ruth","Memórias do Instituto Oswaldo Cruz; 82(); 29-38","Memórias do Instituto Oswaldo Cruz","Inglês","1987","http://www.scielo.br/scielo.php?script=sci_arttext&pid=S0074-02761987000600007&lang=pt" 
"S0074-02761987000600008-scl","Structure-function relationships for the interleukin 2 receptor system","Robb, Richard J.","Memórias do Instituto Oswaldo Cruz; 82(); 39-43","Memórias do Instituto Oswaldo Cruz","Inglês","1987","http://www.scielo.br/scielo.php?script=sci_arttext&pid=S0074-02761987000600008&lang=pt" 
"S0074-02761987000600009-scl","Immunological effects of an inflammatory reaction induced in the central nervous system","Quírico-Santos, Thereza","Memórias do Instituto Oswaldo Cruz; 82(); 45-52","Memórias do Instituto Oswaldo Cruz","Inglês","1987","http://www.scielo.br/scielo.php?script=sci_arttext&pid=S0074-02761987000600009&lang=pt" 
"S0074-02761987000600010-scl","The immunomodulatory effects of behavior","Ader, Robert","Memórias do Instituto Oswaldo Cruz; 82(); 53-65","Memórias do Instituto Oswaldo Cruz","Inglês","1987","http://www.scielo.br/scielo.php?script=sci_arttext&pid=S0074-02761987000600010&lang=pt" 
"S0074-02761987000600011-scl","Methionine enkephalin: immunomodulator in normal volunteers, cancer and AIDS patients","Plotnikoff, Nicholas P., Miller, Gerald C., Nimeh, Nadim F., Wybran, Joseph","Memórias do Instituto Oswaldo Cruz; 82(); 67-73","Memórias do Instituto Oswaldo Cruz","Inglês","1987","http://www.scielo.br/scielo.php?script=sci_arttext&pid=S0074-02761987000600011&lang=pt" 
"S0074-02761987000600012-scl","The pineal neurohormone melatonin and its physiologic opiatergic immunoregulatory role","Maestroni, Georges J. M., Conti, Ario, Pierpaoli, Walter","Memórias do Instituto Oswaldo Cruz; 82(); 75-79","Memórias do Instituto Oswaldo Cruz","Inglês","1987","http://www.scielo.br/scielo.php?script=sci_arttext&pid=S0074-02761987000600012&lang=pt" 
"S0074-02761987000600013-scl","Endogenous and exogenously-induced immunomodulation of tumour-host responsiveness","Ablin, Richard J., Polgar, Janos, Gonder, Maurice J.","Memórias do Instituto Oswaldo Cruz; 82(); 81-93","Memórias do Instituto Oswaldo Cruz","Inglês","1987","http://www.scielo.br/scielo.php?script=sci_arttext&pid=S0074-02761987000600013&lang=pt" 
"S0074-02761987000600014-scl","Cyclosporine in renal transplantation: a review of clinical and experimental studies","Abbud Filho, Mário, Loertscher, Rolph, Kupiec-Weglinski, Jerzy, Tilney, Nicolas, Strom, Terry","Memórias do Instituto Oswaldo Cruz; 82(); 95-100","Memórias do Instituto Oswaldo Cruz","Inglês","1987","http://www.scielo.br/scielo.php?script=sci_arttext&pid=S0074-02761987000600014&lang=pt" 
"S0074-02761987000600015-scl","Prevention of bone marrow graft failure by an anti LFA-1 monoclonal antibody","Fischer, A., Blanche, S., Le Deist, F., Veber, F., Griscelli, C., Olive, D., Delaage, M., Mawas, C.","Memórias do Instituto Oswaldo Cruz; 82(); 101-104","Memórias do Instituto Oswaldo Cruz","Inglês","1987","http://www.scielo.br/scielo.php?script=sci_arttext&pid=S0074-02761987000600015&lang=pt" 
"S0074-02761987000600016-scl","The nature of autoantigens","Roitt, Ivan M., Cooke, Anne","Memórias do Instituto Oswaldo Cruz; 82(); 105-109","Memórias do Instituto Oswaldo Cruz","Inglês","1987","http://www.scielo.br/scielo.php?script=sci_arttext&pid=S0074-02761987000600016&lang=pt" 
"S0074-02761987000600017-scl","Restriction in the repertoire of detectable autoantibodies in polyclonal B cell activations and the mimicry of autoantigens by idiotopes","Pontes de Carvalho, L. C., Lannes Vieira, J., Savino, W.","Memórias do Instituto Oswaldo Cruz; 82(); 111-115","Memórias do Instituto Oswaldo Cruz","Inglês","1987","http://www.scielo.br/scielo.php?script=sci_arttext&pid=S0074-02761987000600017&lang=pt" 
"S0074-02761987000600019-scl","Induction of remission of insulin-dependent diabetes by cyclosporin","Bach, Jean-Francois","Memórias do Instituto Oswaldo Cruz; 82(); 121-123","Memórias do Instituto Oswaldo Cruz","Inglês","1987","http://www.scielo.br/scielo.php?script=sci_arttext&pid=S0074-02761987000600019&lang=pt" 
"S0074-02761987000600020-scl","Genomic organization and expression of antigen receptor genes in murine lupus","Theofilopoulos, Argyrios N., Kofler, Reinhard, Singer, Paul A., Noonan, Daniel J., Dixon, Frank J.","Memórias do Instituto Oswaldo Cruz; 82(); 125-136","Memórias do Instituto Oswaldo Cruz","Inglês","1987","http://www.scielo.br/scielo.php?script=sci_arttext&pid=S0074-02761987000600020&lang=pt" 
"S0074-02761987000600021-scl","Immunology of human visceral leishmaniasis and perspective of the use of immunomodulators","Carvalho, E. M., Barral, A., Badaro, R., Barral-Netto, M.","Memórias do Instituto Oswaldo Cruz; 82(); 137-146","Memórias do Instituto Oswaldo Cruz","Inglês","1987","http://www.scielo.br/scielo.php?script=sci_arttext&pid=S0074-02761987000600021&lang=pt" 
"S0074-02761987000600022-scl","The use of monoclonal antibodies for the characterization and production of Mycobacterium leprae antigens","Ivanyi, J.","Memórias do Instituto Oswaldo Cruz; 82(); 147-151","Memórias do Instituto Oswaldo Cruz","Inglês","1987","http://www.scielo.br/scielo.php?script=sci_arttext&pid=S0074-02761987000600022&lang=pt" 
"S0074-02761987000600023-scl","T-cell response to my mycobacterial antigens in lepromatous and tuberculoid leprosy","Bach, Marie Anne","Memórias do Instituto Oswaldo Cruz; 82(); 153-157","Memórias do Instituto Oswaldo Cruz","Inglês","1987","http://www.scielo.br/scielo.php?script=sci_arttext&pid=S0074-02761987000600023&lang=pt" 
"S0074-02761987000600024-scl","The immunological aspects of leprosy","Sarno, Euzenir Nunes","Memórias do Instituto Oswaldo Cruz; 82(); 159-162","Memórias do Instituto Oswaldo Cruz","Inglês","1987","http://www.scielo.br/scielo.php?script=sci_arttext&pid=S0074-02761987000600024&lang=pt" 
"S0074-02761987000600025-scl","Immunomodulation by microbial ribosomes","Normier, G., Pinel, A. M., Domzig, W., Dussourd D&#039;Hinterland, L.","Memórias do Instituto Oswaldo Cruz; 82(); 163-172","Memórias do Instituto Oswaldo Cruz","Inglês","1987","http://www.scielo.br/scielo.php?script=sci_arttext&pid=S0074-02761987000600025&lang=pt" 
"S0074-02761987000600026-scl","In vitro cell activating properties of the composite ribosomal vaccine D53","Revillard, J. P., Millet, I., Lafont, S., Normier, G., Dussourd D&#039;Hinterland, L.","Memórias do Instituto Oswaldo Cruz; 82(); 173-178","Memórias do Instituto Oswaldo Cruz","Inglês","1987","http://www.scielo.br/scielo.php?script=sci_arttext&pid=S0074-02761987000600026&lang=pt" 
"S0373-55241987000100003-scl","Distribution and co-occurrence of Calanoides carinatus and larvae of Sardinella brasiliensis and Engraulis anchoita over the southern Brazilian continental shelf","Campaner, Antonio Frederico, Honda, Sumiko","Boletim do Instituto Oceanográfico; 35(1); 07-16","Boletim do Instituto Oceanográfico","Inglês","1987","http://www.scielo.br/scielo.php?script=sci_arttext&pid=S0373-55241987000100003&lang=pt" 
"S0373-55241987000100004-scl","Quistes planctonicos de dinoficeas en areas de plataforma del atlantico sudoccidental: I. Reporte taxonomico de la família Peridiniaceae ehrenberg","Akselman, Rut","Boletim do Instituto Oceanográfico; 35(1); 17-32","Boletim do Instituto Oceanográfico","Espanhol","1987","http://www.scielo.br/scielo.php?script=sci_arttext&pid=S0373-55241987000100004&lang=pt" 
"S0373-55241987000100007-scl","Estudos sobre estrutura, ciclo de vida e comportamento de Sardinella brasiliensis (Steindachner, 1879) na área entre 22ºS e 28ºS, Brasil: 4. Crescimento: aspectos quantitativos","Vazzoler, Anna Emília A. de M, Rossi-Wongtschowski, Carmen L. D. B, Braga, Francisco M. de S","Boletim do Instituto Oceanográfico; 35(1); 53-63","Boletim do Instituto Oceanográfico","Português","1987","http://www.scielo.br/scielo.php?script=sci_arttext&pid=S0373-55241987000100007&lang=pt" 
"S0373-55241987000200004-scl","Condições hidrográficas na plataforma continental ao largo de Ubatuba: variações sazonais e em média escala","Castro Filho, Belmiro Mendes de, Miranda, Luiz Bruner de, Miyao, Sadako Yadoya","Boletim do Instituto Oceanográfico; 35(2); 135-151","Boletim do Instituto Oceanográfico","Português","1987","http://www.scielo.br/scielo.php?script=sci_arttext&pid=S0373-55241987000200004&lang=pt" 
"S0373-55241987000200002-scl","The contribution of isopods in the feeding of Sympterygia spp (Pisces: Rajidae) with a description of Ancinus gaucho sp. n. (Isopoda: Sphaeromatidae)","Pires, Ana Maria Setubal","Boletim do Instituto Oceanográfico; 35(2); 115-122","Boletim do Instituto Oceanográfico","Inglês","1987","http://www.scielo.br/scielo.php?script=sci_arttext&pid=S0373-55241987000200002&lang=pt" 
"S0373-55241987000200006-scl","Lista das dissertações de mestrado e teses de doutorado","","Boletim do Instituto Oceanográfico; 35(2); 167-168","Boletim do Instituto Oceanográfico","Português","1987","http://www.scielo.br/scielo.php?script=sci_arttext&pid=S0373-55241987000200006&lang=pt" 
"S0373-55241987000200003-scl","Biologia reprodutiva de Micropogonias furnieri (Desmarest, 1823) (Teleostei, Sciaenidae): 2. Relação gonadossomática, comprimento e peso dos ovários como indicadores do período de desova","Isaac-Nahum, Victoria J, Vazzoler, Anna Emília A. de M","Boletim do Instituto Oceanográfico; 35(2); 123-134","Boletim do Instituto Oceanográfico","Português","1987","http://www.scielo.br/scielo.php?script=sci_arttext&pid=S0373-55241987000200003&lang=pt" 
"S0373-55241987000200001-scl","Benthic fauna living on Spartina alterniflora of Cananéia estuarine region (25º02&#039;S - 47º56&#039;W)","Tararam, Airton Santo, Wakabara, Yoko","Boletim do Instituto Oceanográfico; 35(2); 103-113","Boletim do Instituto Oceanográfico","Inglês","1987","http://www.scielo.br/scielo.php?script=sci_arttext&pid=S0373-55241987000200001&lang=pt" 
