"S0373-55241987000200005-scl","Estudo comparativo e variação sazonal da ictiofauna na zona entremarés do Mar Casado-Guarujá e Mar Pequeno-São Vicente, SP","Paiva Filho, Alfredo Martins, Toscano, Ana Paula","Boletim do Instituto Oceanográfico; 35(2); 153-165","Boletim do Instituto Oceanográfico","Português","1987","http://www.scielo.br/scielo.php?script=sci_arttext&pid=S0373-55241987000200005&lang=pt" 
"S0373-55241987000100001-scl","In memoriam: Gelso Vazzoler","Tommasi, Luiz Roberto","Boletim do Instituto Oceanográfico; 35(1); I-I","Boletim do Instituto Oceanográfico","Português","1987","http://www.scielo.br/scielo.php?script=sci_arttext&pid=S0373-55241987000100001&lang=pt" 
"S0373-55241987000100002-scl","Comportamento associativo de Fregata magnificens (Fregatidae, Aves) e Sula lecogaster (Sulidae, Aves) no litoral centro-norte do Estado de São Paulo","Rezende, Mareio Amaral","Boletim do Instituto Oceanográfico; 35(1); 01-05","Boletim do Instituto Oceanográfico","Português","1987","http://www.scielo.br/scielo.php?script=sci_arttext&pid=S0373-55241987000100002&lang=pt" 
"S0373-55241987000100009-scl","Nota sobre o transporte de krill (Euphausia superba Dana) vivo da Antártica para o Brasil","Phan, Van Ngan, Passos, Maria José de Arruda Campos Rocha, Gomes, Vicente, Katsuragawa, Mario, Suzuki, Hana","Boletim do Instituto Oceanográfico; 35(1); 97-101","Boletim do Instituto Oceanográfico","Português","1987","http://www.scielo.br/scielo.php?script=sci_arttext&pid=S0373-55241987000100009&lang=pt" 
"S0373-55241987000100005-scl","Observações sobre Stomatopoda Squilla brasiliensis Calman, 1917 na plataforma continental do Rio Grande do Sul","Tommasi, Luiz Roberto, Bordin, Gilda","Boletim do Instituto Oceanográfico; 35(1); 33-42","Boletim do Instituto Oceanográfico","Português","1987","http://www.scielo.br/scielo.php?script=sci_arttext&pid=S0373-55241987000100005&lang=pt" 
"S0373-55241987000100006-scl","Desenvolvimento marsupial e ciclo de vida de Cymothoa liannae Sartor &amp; Pires (Isopoda, Cymothoidae), parasita de peixes","Sartor, Silvia Maria","Boletim do Instituto Oceanográfico; 35(1); 43-51","Boletim do Instituto Oceanográfico","Português","1987","http://www.scielo.br/scielo.php?script=sci_arttext&pid=S0373-55241987000100006&lang=pt" 
"S0373-55241987000100008-scl","Morfologia, distribuição e abundância de Trachurus lathami Nichols, 1920 (Teleostei: Carangidae) na região sudeste-sul do Brasil","Saccardo, Suzana Anita","Boletim do Instituto Oceanográfico; 35(1); 65-95","Boletim do Instituto Oceanográfico","Português","1987","http://www.scielo.br/scielo.php?script=sci_arttext&pid=S0373-55241987000100008&lang=pt" 
"S1414-98931987000200012-scl","O desenvolvimento individual, o contexto social e a prática de pesquisa","Roazzi, Antonio","Psicologia: Ciência e Profissão; 7(2); 27-33","Psicologia: Ciência e Profissão","Português","1987","http://www.scielo.br/scielo.php?script=sci_arttext&pid=S1414-98931987000200012&lang=pt" 
"S1414-98931987000100004-scl","Pós-graduação: um caso para pensar...","Leite, Sérgio Antonio da Silva, Guirado, Marlene","Psicologia: Ciência e Profissão; 7(1); 14-18","Psicologia: Ciência e Profissão","Português","1987","http://www.scielo.br/scielo.php?script=sci_arttext&pid=S1414-98931987000100004&lang=pt" 
"S1414-98931987000100003-scl","A Constituição como metacontingência","Todorov, João Cláudio","Psicologia: Ciência e Profissão; 7(1); 9-13","Psicologia: Ciência e Profissão","Português","1987","http://www.scielo.br/scielo.php?script=sci_arttext&pid=S1414-98931987000100003&lang=pt" 
"S1414-98931987000200003-scl","Contribuição a uma análise da Psicologia","Malheiro, Dirceu Pinto, Nader, Rosa Maria","Psicologia: Ciência e Profissão; 7(2); 9-13","Psicologia: Ciência e Profissão","Português","1987","http://www.scielo.br/scielo.php?script=sci_arttext&pid=S1414-98931987000200003&lang=pt" 
"S1414-98931987000100011-scl","Quando a Pedagogia é radical?","Drawin, Carlos Roberto","Psicologia: Ciência e Profissão; 7(1); 34-35","Psicologia: Ciência e Profissão","Português","1987","http://www.scielo.br/scielo.php?script=sci_arttext&pid=S1414-98931987000100011&lang=pt" 
"S1414-98931987000100010-scl","Vicissitudes na hospitalização de crianças","","Psicologia: Ciência e Profissão; 7(1); 30-33","Psicologia: Ciência e Profissão","Português","1987","http://www.scielo.br/scielo.php?script=sci_arttext&pid=S1414-98931987000100010&lang=pt" 
"S1414-98931987000100009-scl","A relação terapeuta-cliente sob o enfoque comportamental","Mettel, Thereza Pontual de Lemos","Psicologia: Ciência e Profissão; 7(1); 28-29","Psicologia: Ciência e Profissão","Português","1987","http://www.scielo.br/scielo.php?script=sci_arttext&pid=S1414-98931987000100009&lang=pt" 
"S1414-98931987000100008-scl","A inteligência da criança brasileira: a diferença não é déficit","","Psicologia: Ciência e Profissão; 7(1); 25-27","Psicologia: Ciência e Profissão","Português","1987","http://www.scielo.br/scielo.php?script=sci_arttext&pid=S1414-98931987000100008&lang=pt" 
"S1414-98931987000100007-scl","A inteligência da criança brasileira: o déficit pode ser real","","Psicologia: Ciência e Profissão; 7(1); 21-24","Psicologia: Ciência e Profissão","Português","1987","http://www.scielo.br/scielo.php?script=sci_arttext&pid=S1414-98931987000100007&lang=pt" 
"S1414-98931987000100006-scl","A inteligência da criança brasileira: as controvérsias em pauta","","Psicologia: Ciência e Profissão; 7(1); 20-20","Psicologia: Ciência e Profissão","Português","1987","http://www.scielo.br/scielo.php?script=sci_arttext&pid=S1414-98931987000100006&lang=pt" 
"S1414-98931987000100002-scl","A droga e a saúde pública","","Psicologia: Ciência e Profissão; 7(1); 5-8","Psicologia: Ciência e Profissão","Português","1987","http://www.scielo.br/scielo.php?script=sci_arttext&pid=S1414-98931987000100002&lang=pt" 
"S1414-98931987000100001-scl","Nossa revista pode parar!!!","","Psicologia: Ciência e Profissão; 7(1); 4-4","Psicologia: Ciência e Profissão","Português","1987","http://www.scielo.br/scielo.php?script=sci_arttext&pid=S1414-98931987000100001&lang=pt" 
"S1414-98931987000200014-scl","A sabedoria na velhice","Neri, Anita Liberalesso","Psicologia: Ciência e Profissão; 7(2); 36-36","Psicologia: Ciência e Profissão","Português","1987","http://www.scielo.br/scielo.php?script=sci_arttext&pid=S1414-98931987000200014&lang=pt" 
"S1414-98931987000200015-scl","","","Psicologia: Ciência e Profissão; 7(2); 38-38","Psicologia: Ciência e Profissão","Português","1987","http://www.scielo.br/scielo.php?script=sci_arttext&pid=S1414-98931987000200015&lang=pt" 
"S1414-98931987000200013-scl","As exigências do ato analítico","Guirado, Marlene","Psicologia: Ciência e Profissão; 7(2); 34-35","Psicologia: Ciência e Profissão","Português","1987","http://www.scielo.br/scielo.php?script=sci_arttext&pid=S1414-98931987000200013&lang=pt" 
"S1414-98931987000200010-scl","As diretrizes da Comissão de Ética","","Psicologia: Ciência e Profissão; 7(2); 24-25","Psicologia: Ciência e Profissão","Português","1987","http://www.scielo.br/scielo.php?script=sci_arttext&pid=S1414-98931987000200010&lang=pt" 
"S1414-98931987000200011-scl","A favor do princípio, mas contra o encaminhamento","","Psicologia: Ciência e Profissão; 7(2); 25-26","Psicologia: Ciência e Profissão","Português","1987","http://www.scielo.br/scielo.php?script=sci_arttext&pid=S1414-98931987000200011&lang=pt" 
"S1414-98931987000200007-scl","Entre a vida e a morte","","Psicologia: Ciência e Profissão; 7(2); 20-21","Psicologia: Ciência e Profissão","Português","1987","http://www.scielo.br/scielo.php?script=sci_arttext&pid=S1414-98931987000200007&lang=pt" 
"S1414-98931987000200009-scl","A orientação dada pelo CRP-06","","Psicologia: Ciência e Profissão; 7(2); 23-23","Psicologia: Ciência e Profissão","Português","1987","http://www.scielo.br/scielo.php?script=sci_arttext&pid=S1414-98931987000200009&lang=pt" 
"S1414-98931987000200006-scl","A incidência no país: ontem e agora","","Psicologia: Ciência e Profissão; 7(2); 18-19","Psicologia: Ciência e Profissão","Português","1987","http://www.scielo.br/scielo.php?script=sci_arttext&pid=S1414-98931987000200006&lang=pt" 
"S1414-98931987000200002-scl","Presídio: uma nova possibilidade de atuação","","Psicologia: Ciência e Profissão; 7(2); 5-8","Psicologia: Ciência e Profissão","Português","1987","http://www.scielo.br/scielo.php?script=sci_arttext&pid=S1414-98931987000200002&lang=pt" 
"S1414-98931987000200001-scl","Os 25 anos e a imagem da profissão","","Psicologia: Ciência e Profissão; 7(2); 4-4","Psicologia: Ciência e Profissão","Português","1987","http://www.scielo.br/scielo.php?script=sci_arttext&pid=S1414-98931987000200001&lang=pt" 
"S1414-98931987000200004-scl","O ensino e a prática da terapia comportamental","Conte, Fátima C. S., Brandão, Maria Zilah S., Silva, Vera Lúcia Menezes da","Psicologia: Ciência e Profissão; 7(2); 14-16","Psicologia: Ciência e Profissão","Português","1987","http://www.scielo.br/scielo.php?script=sci_arttext&pid=S1414-98931987000200004&lang=pt" 
"S1414-98931987000200005-scl","Tortura, a luta contra a amnésia","","Psicologia: Ciência e Profissão; 7(2); 17-17","Psicologia: Ciência e Profissão","Português","1987","http://www.scielo.br/scielo.php?script=sci_arttext&pid=S1414-98931987000200005&lang=pt" 
"S1414-98931987000200008-scl","Qual é a ética nos casos de AIDS?","","Psicologia: Ciência e Profissão; 7(2); 22-22","Psicologia: Ciência e Profissão","Português","1987","http://www.scielo.br/scielo.php?script=sci_arttext&pid=S1414-98931987000200008&lang=pt" 
"S1414-98931987000100005-scl","A inteligência da criança brasileira","","Psicologia: Ciência e Profissão; 7(1); 19-19","Psicologia: Ciência e Profissão","Português","1987","http://www.scielo.br/scielo.php?script=sci_arttext&pid=S1414-98931987000100005&lang=pt" 
"S0044-59671987000100401-scl","Taxa de regeneração natural na floresta tropical úmida.","Jardim, Fernando C. da Silva","Acta Amazonica; 17(); 401-410","Acta Amazonica","Português","1987","http://www.scielo.br/scielo.php?script=sci_arttext&pid=S0044-59671987000100401&lang=pt" 
"S0044-59671987000200151-scl","Biologia de anofelinos Amazônicos. XI. Estudos em populações de Anopheles e controle da malária em Ariquemes (Rondônia)","Tadei, Wanderli Pedro","Acta Amazonica; 17(); 151-167","Acta Amazonica","Português","1987","http://www.scielo.br/scielo.php?script=sci_arttext&pid=S0044-59671987000200151&lang=pt" 
"S0044-59671987000100535-scl","Estratégia para conservação genética de espécies florestais prioritárias na amazônia.","Silva, José Alves da, Leite, Edson Junqueira, Gripp, Abimael","Acta Amazonica; 17(); 535-562","Acta Amazonica","Português","1987","http://www.scielo.br/scielo.php?script=sci_arttext&pid=S0044-59671987000100535&lang=pt" 
"S0044-59671987000100003-scl","Relações entre o déficit hídrico e alguns processos fisiológicos e bioquímicos em quatro clones de seringueira.","Corrêa, Ana Francisca Fernandes, Ranzani, Guido, Ferreira, Luiz Gonzaga Rebouças","Acta Amazonica; 17(); 3-108","Acta Amazonica","Português","1987","http://www.scielo.br/scielo.php?script=sci_arttext&pid=S0044-59671987000100003&lang=pt" 
"S0044-59671987000200123-scl","Derrubada da floresta e roçagem de crescimento secundário em projetos de colonização na Amazônia Brasileira e a sua relação à capacidade de suporte humano","Fearnside, Philip M.","Acta Amazonica; 17(); 123-142","Acta Amazonica","Português","1987","http://www.scielo.br/scielo.php?script=sci_arttext&pid=S0044-59671987000200123&lang=pt" 
"S0044-59671987000200043-scl","Composição do pescado e situação da pesca no Estado de Rondônia","Santos, Geraldo Mendes dos","Acta Amazonica; 17(); 43-84","Acta Amazonica","Português","1987","http://www.scielo.br/scielo.php?script=sci_arttext&pid=S0044-59671987000200043&lang=pt" 
"S0044-59671987000100161-scl","Estudios ecológicos de Camu-Camu (Myrciaria dubia). I. Producción de frutos en poblaciones naturales.","Peters, Charles M., Vasquez, A.","Acta Amazonica; 17(); 161-188","Acta Amazonica","Espanhol","1987","http://www.scielo.br/scielo.php?script=sci_arttext&pid=S0044-59671987000100161&lang=pt" 
"S0044-59671987000100563-scl","Características da madeira e da polpa kraft não branqueada de Eucalyptus deglupta Blume introduzido na região de Manaus - AM.","Frazão, Francisco Juvenal Lima","Acta Amazonica; 17(); 563-580","Acta Amazonica","Português","1987","http://www.scielo.br/scielo.php?script=sci_arttext&pid=S0044-59671987000100563&lang=pt" 
"S0044-59671987000200143-scl","Estudo preliminar sobre a hidroquímica da bacia de Jací-Paraná (RO)","Santos, Umberto de Menezes, Ribeiro, Maria de Nazaré Góes, Tancredi, Antonio Carlos F. N. S.","Acta Amazonica; 17(); 143-150","Acta Amazonica","Português","1987","http://www.scielo.br/scielo.php?script=sci_arttext&pid=S0044-59671987000200143&lang=pt" 
"S0044-59671987000100589-scl","Mirídeos neotropicais, CCLOVI: dois gêneros e seis espécies novos da tribo Cylapini (HEMIPTERA).","Carvalho, José C. M.","Acta Amazonica; 17(); 589-616","Acta Amazonica","Português","1987","http://www.scielo.br/scielo.php?script=sci_arttext&pid=S0044-59671987000100589&lang=pt" 
"S0044-59671987000200027-scl","Estudos preliminares de cinco cultivares de amendoim em Vilhena e Ouro Preto D&#039;Oeste, Estado de Rondônia","Yuyama, Kaoru, Menezes, José Maria Thomaz","Acta Amazonica; 17(); 27-32","Acta Amazonica","Português","1987","http://www.scielo.br/scielo.php?script=sci_arttext&pid=S0044-59671987000200027&lang=pt" 
"S0044-59671987000100209-scl","Aspectos sobre a polinizaçâo do &quot;Dendezeiro&quot; Elaeis guineensis Jacq. e do &quot;Caiaué&quot; Elaeis oleifera (H.B.K.) Cortés. (ARECACEAE).","Silva, Marlene F. da, Miranda, Ires Paula de A., Barbosa, Edelcílio M.","Acta Amazonica; 17(); 209-400","Acta Amazonica","Português","1987","http://www.scielo.br/scielo.php?script=sci_arttext&pid=S0044-59671987000100209&lang=pt" 
"S0044-59671987000200019-scl","(*) Sa3 Li Ki3 Su2e Kwa3 Lha2 Ka3 Ta3 Su2: Duas fruteiras dos índios Nambiquara com potencial para domesticação. (**)","Venturieri, Giorgini Augusto, Rodrigues, William A., Menezes, José Maria Tomas","Acta Amazonica; 17(); 19-26","Acta Amazonica","Português","1987","http://www.scielo.br/scielo.php?script=sci_arttext&pid=S0044-59671987000200019&lang=pt" 
"S0044-59671987000100189-scl","Identificação e concentração das antocianinas durante a ontogenia foliar de Hevea brasiliensis Muell. Arg. (IAN 873) e H. pauciflora Muell. Arg. submetidas a dois regimes hídricos .","Pita, Francisco Antonio de Oliveira, Oliva, Marco Antonio","Acta Amazonica; 17(); 189-208","Acta Amazonica","Português","1987","http://www.scielo.br/scielo.php?script=sci_arttext&pid=S0044-59671987000100189&lang=pt" 
"S0044-59671987000200085-scl","Inventário florístico de floresta natural na área da estrada Cuiabá-Porto Velho (BR - 364)","Absy, Maria Lúcia, Prance, Ghillean T., Barbosa, Edelcílio Marques","Acta Amazonica; 17(); 85-122","Acta Amazonica","Português","1987","http://www.scielo.br/scielo.php?script=sci_arttext&pid=S0044-59671987000200085&lang=pt" 
"S0044-59671987000100411-scl","Estrutura da floresta equatorial úmida da estação experimental de silvicultura tropical do INPA","Jardim, Fernando Cristovam da Silva, Hosokawa, Roberto Tuyoshi","Acta Amazonica; 17(); 411-534","Acta Amazonica","Português","1987","http://www.scielo.br/scielo.php?script=sci_arttext&pid=S0044-59671987000100411&lang=pt" 
"S0044-59671987000100581-scl","Um aquecedor solar de água de baixo custo.","Moraes, Rejane Mércia Siqueira, Harwood, John Harry","Acta Amazonica; 17(); 581-588","Acta Amazonica","Português","1987","http://www.scielo.br/scielo.php?script=sci_arttext&pid=S0044-59671987000100581&lang=pt" 
"S0044-59671987000100627-scl","Basileunculus, um gênero novo de PIPUNCULIDAE (DIPTERA) da região neotropical, com chave para as espécies.","Rafael, J. A.","Acta Amazonica; 17(); 627-634","Acta Amazonica","Português","1987","http://www.scielo.br/scielo.php?script=sci_arttext&pid=S0044-59671987000100627&lang=pt" 
"S0044-59671987000200007-scl","Associações Rhizobium - Leguminosas no Estado de Rondõnia","Magalhães, Fátima M. M., Silva, Marlene F. da","Acta Amazonica; 17(); 7-18","Acta Amazonica","Português","1987","http://www.scielo.br/scielo.php?script=sci_arttext&pid=S0044-59671987000200007&lang=pt" 
"S0044-59671987000100109-scl","Aspectos ecológicos da ictiofauna no baixo Tocantins.","Merona, Bernard de","Acta Amazonica; 17(); 109-160","Acta Amazonica","Português","1987","http://www.scielo.br/scielo.php?script=sci_arttext&pid=S0044-59671987000100109&lang=pt" 
"S0044-59671987000200033-scl","Policultivo de Matrinchã (Brycon sp.) e Jaraqui (Semaprochilodus sp.) em pequenas represas","Craef, Ernst W., Resende, Emiko K. de, Petry, Paulo, Storti Filho, Atílio","Acta Amazonica; 17(); 33-42","Acta Amazonica","Português","1987","http://www.scielo.br/scielo.php?script=sci_arttext&pid=S0044-59671987000200033&lang=pt" 
"S0188-46111987000100006-mex","La actividad cañero-azucarera como factor fundamental en la organización espacial del estado de Morelos","Sánchez-Salazar, María Teresa","Investigaciones geográficas; (17); 103-123","Investigaciones geográficas","Espanhol","1987","http://www.scielo.org.mx/scielo.php?script=sci_arttext&pid=S0188-46111987000100006&lang=pt" 
"S0188-46111987000100003-mex","Cambios en la comunidad de Pinus culminicola Andresen &amp; Beaman en el Cerro Potosí, N.L. México","Sánchez Silva, Rubén, López García, José, Espinoza R., José Manuel","Investigaciones geográficas; (17); 65-73","Investigaciones geográficas","Espanhol","1987","http://www.scielo.org.mx/scielo.php?script=sci_arttext&pid=S0188-46111987000100003&lang=pt" 
"S0188-46111987000100007-mex","Actividad turística y asimilación territorial en la costa nayarita","Carrascal, Eurosia","Investigaciones geográficas; (17); 125-136","Investigaciones geográficas","Espanhol","1987","http://www.scielo.org.mx/scielo.php?script=sci_arttext&pid=S0188-46111987000100007&lang=pt" 
"S0188-46111987000100002-mex","Estado actual de la viticultura en Querétaro","Reyna Trujillo, Teresa","Investigaciones geográficas; (17); 45-63","Investigaciones geográficas","Espanhol","1987","http://www.scielo.org.mx/scielo.php?script=sci_arttext&pid=S0188-46111987000100002&lang=pt" 
"S0188-46111987000100008-mex","La construcción de la red férrea mexicana en el porfiriato: Relaciones de poder y organización capitalista del espacio","García de Fuentes, Ana","Investigaciones geográficas; (17); 137-154","Investigaciones geográficas","Espanhol","1987","http://www.scielo.org.mx/scielo.php?script=sci_arttext&pid=S0188-46111987000100008&lang=pt" 
"S0188-46111987000100001-mex","Los cambios de nivel base como mecanismo morfogenético de la asimetría de valles","Ortiz Pérez, Mario Arturo","Investigaciones geográficas; (17); 9-44","Investigaciones geográficas","Espanhol","1987","http://www.scielo.org.mx/scielo.php?script=sci_arttext&pid=S0188-46111987000100001&lang=pt" 
"S0188-46111987000100004-mex","Efectos físico-químicos inmediatos en los suelos afectados por la erupción del volcán Chichón (Chiapas, 1982)","Alfaro Sánchez, Gloria, Cervantes Borja, Jorge F.","Investigaciones geográficas; (17); 75-86","Investigaciones geográficas","Espanhol","1987","http://www.scielo.org.mx/scielo.php?script=sci_arttext&pid=S0188-46111987000100004&lang=pt" 
"S0188-46111987000100005-mex","Análisis geográfico-histórico de Nueva Galicia a mediados del siglo XVIII","Fernández Aguila, Alejandrina","Investigaciones geográficas; (17); 87-101","Investigaciones geográficas","Espanhol","1987","http://www.scielo.org.mx/scielo.php?script=sci_arttext&pid=S0188-46111987000100005&lang=pt" 
"S0006-87051987000200024-scl","Emergência de plântulas do pêssego porta-enxerto &#039;Okinawa&#039;: influência de períodos de estratificação e de ácido giberélico","Barbosa, Wilson, Campo Dall&#039;Orto, Fernando Antonio, Ojima, Mário, Martins, Fernando Picarelli, Rigitano, Orlando","Bragantia; 46(2); 435-441","Bragantia","Português","1987","http://www.scielo.br/scielo.php?script=sci_arttext&pid=S0006-87051987000200024&lang=pt" 
"S0006-87051987000200007-scl","Competição de adubos fosfatados no algodoeiro, em ensaio de longa duração","Silva, Nelson Machado da, Carvalho, Luiz Henrique, Chiavegato, Ederaldo José, Sabino, Nelson Paulieri, Kondo, Julio Isao","Bragantia; 46(2); 233-246","Bragantia","Português","1987","http://www.scielo.br/scielo.php?script=sci_arttext&pid=S0006-87051987000200007&lang=pt" 
"S0006-87051987000200006-scl","Melhoramento do trigo: XVI. Comportamento de novas linhagens em diferentes regiões do Estado de São Paulo","Camargo, Carlos Eduardo de Oliveira, Felício, João Carlos, Barros, Benedito de Camargo, Ferreira Filho, Antonio Wilson Penteado, Freitas, José Guilherme de, Castro, Jairo Lopes de, Sabino, José Carlos","Bragantia; 46(2); 217-232","Bragantia","Português","1987","http://www.scielo.br/scielo.php?script=sci_arttext&pid=S0006-87051987000200006&lang=pt" 
"S0006-87051987000200005-scl","Trigo, triticale e centeio: avaliação da eficiência ao fósforo e tolerância à toxicidade ao alumínio","Camargo, Carlos Eduardo de Oliveira, Felício, João Carlos","Bragantia; 46(2); 203-215","Bragantia","Português","1987","http://www.scielo.br/scielo.php?script=sci_arttext&pid=S0006-87051987000200005&lang=pt" 
"S0006-87051987000200002-scl","Trigo: avaliação tecnológica de novas linhagens","Camargo, Celina Raquel de Oliveira, Camargo, Carlos Eduardo de Oliveira","Bragantia; 46(2); 169-181","Bragantia","Português","1987","http://www.scielo.br/scielo.php?script=sci_arttext&pid=S0006-87051987000200002&lang=pt" 
"S0006-87051987000200001-scl","Cultivar de trigo IAC-24: rendimento de grãos e caracteres agronômicos em três faixas de umidade do solo","Freitas, José Guilherme de, Camargo, Carlos Eduardo de Oliveira","Bragantia; 46(2); 159-168","Bragantia","Português","1987","http://www.scielo.br/scielo.php?script=sci_arttext&pid=S0006-87051987000200001&lang=pt" 
"S0006-87051987000100008-scl","Resistência de soja a insetos: VIII. IAC 78-2318, linhagem com resistência múltipla","Lourenção, André Luiz, Miranda, Manoel Albino Coelho de","Bragantia; 46(1); 65-72","Bragantia","Português","1987","http://www.scielo.br/scielo.php?script=sci_arttext&pid=S0006-87051987000100008&lang=pt" 
"S0006-87051987000100006-scl","Resistência de soja a insetos: VII. Avaliação de danos de percevejos em cultivares e linhagens","Lourenção, André Luiz, Miranda, Manoel Albino Coelho de, Nagai, Violeta","Bragantia; 46(1); 45-67","Bragantia","Português","1987","http://www.scielo.br/scielo.php?script=sci_arttext&pid=S0006-87051987000100006&lang=pt" 
"S0006-87051987000100005-scl","Estádio de maturação e qualidade de sementes de girassol","Maeda, Jocely Andreuccetti, Ungaro, Maria Regina Gonçalves, Lago, Antonio Augusto do, Razera, Luiz Fernandes","Bragantia; 46(1); 35-44","Bragantia","Português","1987","http://www.scielo.br/scielo.php?script=sci_arttext&pid=S0006-87051987000100005&lang=pt" 
"S0006-87051987000100004-scl","Herança da resistência de milho a Pratylenchus spp.","Sawazaki, Eduardo, Lordello, Ana Ines Lucena, Lordello, Rubens Rodolfo Albuquerque","Bragantia; 46(1); 27-33","Bragantia","Português","1987","http://www.scielo.br/scielo.php?script=sci_arttext&pid=S0006-87051987000100004&lang=pt" 
"S0006-87051987000100002-scl","Extração e isolamento de diosgenina de barbasco","Zullo, Marco Antonio Teixeira, Ramos, Maria Tereza Baraldi, Monteiro, Domingos Antonio, Godoy Jr., Gentil","Bragantia; 46(1); 9-15","Bragantia","Português","1987","http://www.scielo.br/scielo.php?script=sci_arttext&pid=S0006-87051987000100002&lang=pt" 
"S0006-87051987000100001-scl","Comportamento do marmeleiro &#039;Mendoza INTA-37&#039;","Dall&#039;Orto, Fernando Antonio Campo, Ojima, Mário, Barbosa, Wilson, Martins, Fernando Picarelli, Rigitano, Orlando","Bragantia; 46(1); 1-8","Bragantia","Português","1987","http://www.scielo.br/scielo.php?script=sci_arttext&pid=S0006-87051987000100001&lang=pt" 
"S0006-87051987000100003-scl","Produção conjunta de fibras celulósicas e etanol a partir do bambu","Azzini, Anisio, Arruda, Maria Carla Queiroz de, Ciaramello, Irceu, Salgado, Antônio Luiz de Barros, Tomazello Filho, Mário","Bragantia; 46(1); 17-25","Bragantia","Português","1987","http://www.scielo.br/scielo.php?script=sci_arttext&pid=S0006-87051987000100003&lang=pt" 
"S0006-87051987000100017-scl","Teor e composição do óleo de sementes de Jatropha spp.","Teixeira, João Paulo Feijão","Bragantia; 46(1); 151-157","Bragantia","Português","1987","http://www.scielo.br/scielo.php?script=sci_arttext&pid=S0006-87051987000100017&lang=pt" 
"S0006-87051987000100007-scl","Avaliação da resistência dê cafeeiros às raças dê Meloidogyne incognita","Lordello, Rubens Rodolfo Albuquerque, Lordello, Ana Ines Lucena","Bragantia; 46(1); 59-64","Bragantia","Português","1987","http://www.scielo.br/scielo.php?script=sci_arttext&pid=S0006-87051987000100007&lang=pt" 
"S0006-87051987000100015-scl","Variações dos teores de fibras celulósicas e amido no colmo de bambu","Azzini, Anisio, Arruda, Maria Carla Queiroz de, Tomazello Filho, Mário, Salgado, Antônio Luiz de Barros, Ciaramello, Dirceu","Bragantia; 46(1); 141-145","Bragantia","Português","1987","http://www.scielo.br/scielo.php?script=sci_arttext&pid=S0006-87051987000100015&lang=pt" 
