"S0101-81751987000100002-scl","Mirideos neotropicais, CCLXXII: descrições de sete espécies novas da tribo Resthenini Reuter (Hemiptera)","Carvalho, José C.M., Carpintero, Diego L.","Revista Brasileira de Zoologia; 4(1); 19-31","Revista Brasileira de Zoologia","Português","1987","http://www.scielo.br/scielo.php?script=sci_arttext&pid=S0101-81751987000100002&lang=pt" 
"S0101-81751987000100003-scl","Histologia y morfologia del sistema reproductor en hembras de Rhagoletis conversa (Brethes) y de Rhagoletis nova (Schimer) (Diptera, Tephritidae)","Flores Rojas, Verónica, Lasserre, Daniel Frías, Martínes Arteaga, Humberto","Revista Brasileira de Zoologia; 4(1); 33-46","Revista Brasileira de Zoologia","Espanhol","1987","http://www.scielo.br/scielo.php?script=sci_arttext&pid=S0101-81751987000100003&lang=pt" 
"S0101-81751987000100004-scl","Biologia e ontogenia de Trachyderes striatus (Fabricius) (Coleoptera, Cerambycidae)","Penteado-Dias, Angélica Maria","Revista Brasileira de Zoologia; 4(1); 47-53","Revista Brasileira de Zoologia","Português","1987","http://www.scielo.br/scielo.php?script=sci_arttext&pid=S0101-81751987000100004&lang=pt" 
"S0101-81751987000100005-scl","Notes on some Pseudothelphusidae crabs from Venezuela, Ecuador and Mexico found in the collection of the Museu de Zoologia da Universedade de São Paulo, São Paulo, Brazil","Magalhães, Célio","Revista Brasileira de Zoologia; 4(1); 55-58","Revista Brasileira de Zoologia","Inglês","1987","http://www.scielo.br/scielo.php?script=sci_arttext&pid=S0101-81751987000100005&lang=pt" 
"S0101-81751987000100006-scl","The occurrence of Callinectes arcuatus ordway, 1863 (Crustacea, Decapoda, Portunidae) in Bahia, Brazil","Gouvêa, Edilson Pires de","Revista Brasileira de Zoologia; 4(1); 59-62","Revista Brasileira de Zoologia","Inglês","1987","http://www.scielo.br/scielo.php?script=sci_arttext&pid=S0101-81751987000100006&lang=pt" 
"S0101-81751987000100007-scl","Uma espécie nova de Meticonaxius do Brasil (Crustacea, Decapoda, Callianeidae)","Coelho, Petrônio Alves","Revista Brasileira de Zoologia; 4(1); 63-69","Revista Brasileira de Zoologia","Português","1987","http://www.scielo.br/scielo.php?script=sci_arttext&pid=S0101-81751987000100007&lang=pt" 
"S0101-81751987000200004-scl","Introdução à mastozoologia do Brasil meridional","Avila-Pires, Fernando Dias de","Revista Brasileira de Zoologia; 4(2); 115-128","Revista Brasileira de Zoologia","Português","1987","http://www.scielo.br/scielo.php?script=sci_arttext&pid=S0101-81751987000200004&lang=pt" 
"S0101-81751987000300002-scl","Desenvolvimento pós-embrionário de Pagurus brevidactylus (Stimpson, 1858) (Decapoda, Paguridae), em laboratório","Negreiros-Fransozo, Maria Lúcia, Hebling, Nilton José","Revista Brasileira de Zoologia; 4(3); 181-194","Revista Brasileira de Zoologia","Português","1987","http://www.scielo.br/scielo.php?script=sci_arttext&pid=S0101-81751987000300002&lang=pt" 
"S0074-02761987000800058-scl","Biomphalaria tenagophila feeding behavior","Santos, Mairy Barbosa Loureiro dos, Freitas, José Rabelo de","Memórias do Instituto Oswaldo Cruz; 82(); 307-309","Memórias do Instituto Oswaldo Cruz","Inglês","1987","http://www.scielo.br/scielo.php?script=sci_arttext&pid=S0074-02761987000800058&lang=pt" 
"S0074-02761987000600018-scl","In vivo effects of antilymphocyte antibodies on immunity and autoimmunity","Seaman, William E., Gutstein, Nancy, Wofsy, David","Memórias do Instituto Oswaldo Cruz; 82(); 117-119","Memórias do Instituto Oswaldo Cruz","Inglês","1987","http://www.scielo.br/scielo.php?script=sci_arttext&pid=S0074-02761987000600018&lang=pt" 
"S0074-02761987000600004-scl","T cell reconstitution by thymic hormones in aging","Doria, Gino, Adorini, Luciano, Mancini, Camillo, Frasca, Daniela","Memórias do Instituto Oswaldo Cruz; 82(); 9-13","Memórias do Instituto Oswaldo Cruz","Inglês","1987","http://www.scielo.br/scielo.php?script=sci_arttext&pid=S0074-02761987000600004&lang=pt" 
"S0074-02761987000700024-scl","Brazilian species of luminescent elaterids: biochemistry and biology","Bechara, Etelvino J. H., Colepicolo Neto, Pio","Memórias do Instituto Oswaldo Cruz; 82(); 129-131","Memórias do Instituto Oswaldo Cruz","Inglês","1987","http://www.scielo.br/scielo.php?script=sci_arttext&pid=S0074-02761987000700024&lang=pt" 
"S0074-02761987000700009-scl","Pheromones and reproduction in brazilian stingless bees","Engels, Wolf","Memórias do Instituto Oswaldo Cruz; 82(); 35-45","Memórias do Instituto Oswaldo Cruz","Inglês","1987","http://www.scielo.br/scielo.php?script=sci_arttext&pid=S0074-02761987000700009&lang=pt" 
"S0074-02761987000800070-scl","Filariasis programme - Recife - Brazil","Dreyer, Gerusa","Memórias do Instituto Oswaldo Cruz; 82(); 359-360","Memórias do Instituto Oswaldo Cruz","Inglês","1987","http://www.scielo.br/scielo.php?script=sci_arttext&pid=S0074-02761987000800070&lang=pt" 
"S0074-02761987000800065-scl","Relevant problems to the epidemiology of mansonic schistosomiasis","Magalhães, Luiz Augusto","Memórias do Instituto Oswaldo Cruz; 82(); 341-341","Memórias do Instituto Oswaldo Cruz","Inglês","1987","http://www.scielo.br/scielo.php?script=sci_arttext&pid=S0074-02761987000800065&lang=pt" 
"S0074-02761987000800063-scl","A influência da terapêutica específica nos níveis de infecção da esquistossomose mansônica","Alvim, Aymoré de Castro","Memórias do Instituto Oswaldo Cruz; 82(); 333-333","Memórias do Instituto Oswaldo Cruz","Português","1987","http://www.scielo.br/scielo.php?script=sci_arttext&pid=S0074-02761987000800063&lang=pt" 
"S0074-02761987000800062-scl","Influência da terapêutica específica na prevenção e reversão das formas graves da esquistossomose","Bina, José Carlos","Memórias do Instituto Oswaldo Cruz; 82(); 331-332","Memórias do Instituto Oswaldo Cruz","Português","1987","http://www.scielo.br/scielo.php?script=sci_arttext&pid=S0074-02761987000800062&lang=pt" 
"S0074-02761987000800048-scl","Splenic fibrosis in patients with chronic Schistosomiasis","Borojevic, Radovan","Memórias do Instituto Oswaldo Cruz; 82(); 253-255","Memórias do Instituto Oswaldo Cruz","Inglês","1987","http://www.scielo.br/scielo.php?script=sci_arttext&pid=S0074-02761987000800048&lang=pt" 
"S0074-02761987000800029-scl","Heterologous resistance in Schistosomiasis","Hillyer, George V.","Memórias do Instituto Oswaldo Cruz; 82(); 171-174","Memórias do Instituto Oswaldo Cruz","Inglês","1987","http://www.scielo.br/scielo.php?script=sci_arttext&pid=S0074-02761987000800029&lang=pt" 
"S0074-02761987000800021-scl","Schistosoma mansoni: protective antigens","Tendler, Miriam","Memórias do Instituto Oswaldo Cruz; 82(); 125-128","Memórias do Instituto Oswaldo Cruz","Inglês","1987","http://www.scielo.br/scielo.php?script=sci_arttext&pid=S0074-02761987000800021&lang=pt" 
"S0074-02761987000800012-scl","Epidemiology and control of Schistosomiasis in the people&#039;s Republic of China","Mao, Shou-Pai","Memórias do Instituto Oswaldo Cruz; 82(); 77-82","Memórias do Instituto Oswaldo Cruz","Inglês","1987","http://www.scielo.br/scielo.php?script=sci_arttext&pid=S0074-02761987000800012&lang=pt" 
"S0074-02761987000800003-scl","Control of Schistosomiasis mansoni: an outlook from current expectation","Paraense, W. Lobato","Memórias do Instituto Oswaldo Cruz; 82(); 1-12","Memórias do Instituto Oswaldo Cruz","Inglês","1987","http://www.scielo.br/scielo.php?script=sci_arttext&pid=S0074-02761987000800003&lang=pt" 
"S0074-02761987000800001-scl","Foreword","Morel, Carlos M.","Memórias do Instituto Oswaldo Cruz; 82(); I-I","Memórias do Instituto Oswaldo Cruz","Inglês","1987","http://www.scielo.br/scielo.php?script=sci_arttext&pid=S0074-02761987000800001&lang=pt" 
"S0074-02761987000800002-scl","Foreword of the organizers of the International Symposium on Schistosomiais and I Reunião Nacional de Esquistosomose","Tendler, Miriam, Lenzi, Henrique L., Jurberg, Pedro, Gomes, Delir Corrêa","Memórias do Instituto Oswaldo Cruz; 82(); II-II","Memórias do Instituto Oswaldo Cruz","Inglês","1987","http://www.scielo.br/scielo.php?script=sci_arttext&pid=S0074-02761987000800002&lang=pt" 
"S0074-02761987000800004-scl","Immunological aspects of host-schistosome relationships","Damian, Raymond T.","Memórias do Instituto Oswaldo Cruz; 82(); 13-16","Memórias do Instituto Oswaldo Cruz","Inglês","1987","http://www.scielo.br/scielo.php?script=sci_arttext&pid=S0074-02761987000800004&lang=pt" 
"S0074-02761987000800005-scl","Pathology of human Schistosomiasis","Andrade, Zilton A.","Memórias do Instituto Oswaldo Cruz; 82(); 17-23","Memórias do Instituto Oswaldo Cruz","Inglês","1987","http://www.scielo.br/scielo.php?script=sci_arttext&pid=S0074-02761987000800005&lang=pt" 
"S0074-02761987000800006-scl","Schistosomiasis: past, present and future","Warren, Kenneth S.","Memórias do Instituto Oswaldo Cruz; 82(); 25-29","Memórias do Instituto Oswaldo Cruz","Inglês","1987","http://www.scielo.br/scielo.php?script=sci_arttext&pid=S0074-02761987000800006&lang=pt" 
"S0074-02761987000800007-scl","Sites and mechanisms of schistosome elimination","Dean, David A., Mangold, Beverly L., Kassim, Olakunle O., Lichtenberg, Franz von","Memórias do Instituto Oswaldo Cruz; 82(); 31-37","Memórias do Instituto Oswaldo Cruz","Inglês","1987","http://www.scielo.br/scielo.php?script=sci_arttext&pid=S0074-02761987000800007&lang=pt" 
"S0074-02761987000800008-scl","Comparison of pathologic changes in mammalian hosts infected with Schistosoma mansoni, S. japonicum and S. haematobium","Cheever, Allen W.","Memórias do Instituto Oswaldo Cruz; 82(); 39-45","Memórias do Instituto Oswaldo Cruz","Inglês","1987","http://www.scielo.br/scielo.php?script=sci_arttext&pid=S0074-02761987000800008&lang=pt" 
"S0074-02761987000800009-scl","Granulomatous hypersensitivity to Schistosoma mansoni egg antigens in human Schistosomiasis: I. Granuloma formation and modulation around polyacrylamide antigen-conjugated beads","Doughty, Barbara L., Goes, Alfredo M., Parra, Juçara C., Rocha, Roberto S., Katz, Naftale, Colley, Daniel G., Gazzinelli, Giovanni","Memórias do Instituto Oswaldo Cruz; 82(); 47-54","Memórias do Instituto Oswaldo Cruz","Inglês","1987","http://www.scielo.br/scielo.php?script=sci_arttext&pid=S0074-02761987000800009&lang=pt" 
"S0074-02761987000800010-scl","Cell-matrix interactions in Schistosomal portal fibrosis: a dynamic event","Grimaud, Jean-Alexis","Memórias do Instituto Oswaldo Cruz; 82(); 55-65","Memórias do Instituto Oswaldo Cruz","Inglês","1987","http://www.scielo.br/scielo.php?script=sci_arttext&pid=S0074-02761987000800010&lang=pt" 
"S0074-02761987000800011-scl","In vivo kinetics of eosinophils and mast cells in experimental murine Schistosomiasis","Lenzi, H. L., Sobral, A. C. L., Lenzi, J. A.","Memórias do Instituto Oswaldo Cruz; 82(); 67-76","Memórias do Instituto Oswaldo Cruz","Inglês","1987","http://www.scielo.br/scielo.php?script=sci_arttext&pid=S0074-02761987000800011&lang=pt" 
"S0074-02761987000800013-scl","A review of achievements of the national schistosomiasis control program in middle and upper Egypt areas","Nassif, Samir","Memórias do Instituto Oswaldo Cruz; 82(); 83-88","Memórias do Instituto Oswaldo Cruz","Inglês","1987","http://www.scielo.br/scielo.php?script=sci_arttext&pid=S0074-02761987000800013&lang=pt" 
"S0074-02761987000800014-scl","The Venezuelan experience in the control of Schistosomiasis mansoni","Nino Incani, R.","Memórias do Instituto Oswaldo Cruz; 82(); 89-93","Memórias do Instituto Oswaldo Cruz","Inglês","1987","http://www.scielo.br/scielo.php?script=sci_arttext&pid=S0074-02761987000800014&lang=pt" 
"S0074-02761987000800015-scl","Immune response in different clinical groups of Schistosomiasis patients","Gazzinelli, Giovanni, Montesano, Maria Angela, Corrêa-Oliveira, Rodrigo, Lima, Marcondes Souza, Katz, Naftale, Rocha, Roberto Sena, Colley, Daniel G.","Memórias do Instituto Oswaldo Cruz; 82(); 95-100","Memórias do Instituto Oswaldo Cruz","Inglês","1987","http://www.scielo.br/scielo.php?script=sci_arttext&pid=S0074-02761987000800015&lang=pt" 
"S0074-02761987000800016-scl","Human antibody responses to Schistosoma mansoni: does antigen directed, isotype restriction result in the production of blocking antibodies?","Dunne, David W., Fulford, Anthony J. C., Butterworth, Anthony E., Koech, David, Ouma, John H.","Memórias do Instituto Oswaldo Cruz; 82(); 101-104","Memórias do Instituto Oswaldo Cruz","Inglês","1987","http://www.scielo.br/scielo.php?script=sci_arttext&pid=S0074-02761987000800016&lang=pt" 
"S0074-02761987000800017-scl","Immunoregulation in human Schistosomiasis by idiotypic interactions and lymphokine-mediated mechanisms","Colley, D. G., Parra, J. C., Montesano, M. A., Lima, M., Nascimento, E., Doughty, B. L., Goes, A., Gazzinelli, G.","Memórias do Instituto Oswaldo Cruz; 82(); 105-109","Memórias do Instituto Oswaldo Cruz","Inglês","1987","http://www.scielo.br/scielo.php?script=sci_arttext&pid=S0074-02761987000800017&lang=pt" 
"S0074-02761987000800018-scl","GP38, P28-I and P28-II: candidates for a vaccine against Schistosomiasis","Pierce, R. J., Balloul, J. M., Grzych, J. M., Dissous, C., Auriault, C., Boulanger, D., Capron, M., Sondermeyer, P., Lecocq, J. P., Capron, A.","Memórias do Instituto Oswaldo Cruz; 82(); 111-114","Memórias do Instituto Oswaldo Cruz","Inglês","1987","http://www.scielo.br/scielo.php?script=sci_arttext&pid=S0074-02761987000800018&lang=pt" 
"S0074-02761987000800019-scl","Characterization of protective and non-protective surface membrane carbohydrate epitopes of Schistosoma mansoni","Ko, Albert I., Harn, Donald A.","Memórias do Instituto Oswaldo Cruz; 82(); 115-119","Memórias do Instituto Oswaldo Cruz","Inglês","1987","http://www.scielo.br/scielo.php?script=sci_arttext&pid=S0074-02761987000800019&lang=pt" 
"S0074-02761987000800020-scl","Prospects for a nonliving vaccine against Schistosomiasis based on cell-mediated immune resistance mechanisms","James, Stephanie L., Pearce, Edward J., Sher, Alan","Memórias do Instituto Oswaldo Cruz; 82(); 121-123","Memórias do Instituto Oswaldo Cruz","Inglês","1987","http://www.scielo.br/scielo.php?script=sci_arttext&pid=S0074-02761987000800020&lang=pt" 
"S0074-02761987000800022-scl","Control of schistosomiasis by use of biological control of snail hosts with special reference to competition","Frandsen, Flemming","Memórias do Instituto Oswaldo Cruz; 82(); 129-133","Memórias do Instituto Oswaldo Cruz","Inglês","1987","http://www.scielo.br/scielo.php?script=sci_arttext&pid=S0074-02761987000800022&lang=pt" 
"S0074-02761987000800023-scl","Esquistossomose mansônica: dinâmica da transmissão","Pires, Fernando Dias de Ávila","Memórias do Instituto Oswaldo Cruz; 82(); 135-137","Memórias do Instituto Oswaldo Cruz","Português","1987","http://www.scielo.br/scielo.php?script=sci_arttext&pid=S0074-02761987000800023&lang=pt" 
"S0074-02761987000800024-scl","Competitive displacement of Biomphalaria glabrata by B. straminea","Barbosa, Frederico S.","Memórias do Instituto Oswaldo Cruz; 82(); 139-141","Memórias do Instituto Oswaldo Cruz","Inglês","1987","http://www.scielo.br/scielo.php?script=sci_arttext&pid=S0074-02761987000800024&lang=pt" 
"S0074-02761987000800025-scl","Drug resistance in Schistosomiasis: a review","Bruce, John I., Dias, Luiz Candido de Souza, Yung-San, Liang, Coles, Gerald C.","Memórias do Instituto Oswaldo Cruz; 82(); 143-150","Memórias do Instituto Oswaldo Cruz","Inglês","1987","http://www.scielo.br/scielo.php?script=sci_arttext&pid=S0074-02761987000800025&lang=pt" 
"S0074-02761987000800026-scl","The significance of variation in the susceptibility of Schistosoma mansoni to the antischistosomal drug oxamniquine","Kinoti, G. K.","Memórias do Instituto Oswaldo Cruz; 82(); 151-156","Memórias do Instituto Oswaldo Cruz","Inglês","1987","http://www.scielo.br/scielo.php?script=sci_arttext&pid=S0074-02761987000800026&lang=pt" 
"S0074-02761987000800027-scl","Anti-schistosomal drugs: observations on the mechanism of drug resistance to hycanthone, and on the involvement of host antibodies in the mode of action of praziquantel","Brindley, Paul J., Sher, Alan","Memórias do Instituto Oswaldo Cruz; 82(); 157-161","Memórias do Instituto Oswaldo Cruz","Inglês","1987","http://www.scielo.br/scielo.php?script=sci_arttext&pid=S0074-02761987000800027&lang=pt" 
"S0074-02761987000800028-scl","Acetylcholinesterase of Schistosoma mansoni: an antigen of functional implications","Arnon, Ruth, Espinoza-Ortega, Berta, Tarrab-Hazdai, Rebeca","Memórias do Instituto Oswaldo Cruz; 82(); 163-170","Memórias do Instituto Oswaldo Cruz","Inglês","1987","http://www.scielo.br/scielo.php?script=sci_arttext&pid=S0074-02761987000800028&lang=pt" 
"S0074-02761987000800030-scl","Antigenic enzymes of Schistosoma mansoni: possible use for immunodiagnosis","M. Cesari, Italo, H. Pujol, Flor, Rodríguez, Margarita, Alarcón de Noya, Belkisyolé","Memórias do Instituto Oswaldo Cruz; 82(); 175-177","Memórias do Instituto Oswaldo Cruz","Inglês","1987","http://www.scielo.br/scielo.php?script=sci_arttext&pid=S0074-02761987000800030&lang=pt" 
"S0074-02761987000800031-scl","Analysis of antibody responses of Schistosoma mansoni infected patients against schistosomal antigens","Corrêa-Oliveira, Rodrigo, Oliveira, Guilherme C., Golgher, Denise B., Viana, Iramaya R. C., Colley, Daniel G., Carvalho, Omar S., Rocha, Roberto S., Katz, Naftale, Gazzinelli, Giovanni","Memórias do Instituto Oswaldo Cruz; 82(); 179-181","Memórias do Instituto Oswaldo Cruz","Inglês","1987","http://www.scielo.br/scielo.php?script=sci_arttext&pid=S0074-02761987000800031&lang=pt" 
"S0074-02761987000800032-scl","A holistic view of Schistosomiasis and snail control","Thomas, J. D.","Memórias do Instituto Oswaldo Cruz; 82(); 183-192","Memórias do Instituto Oswaldo Cruz","Inglês","1987","http://www.scielo.br/scielo.php?script=sci_arttext&pid=S0074-02761987000800032&lang=pt" 
"S0074-02761987000800033-scl","The intermediate snail-host: an agenda for future study","Michelson, Edward H.","Memórias do Instituto Oswaldo Cruz; 82(); 193-195","Memórias do Instituto Oswaldo Cruz","Inglês","1987","http://www.scielo.br/scielo.php?script=sci_arttext&pid=S0074-02761987000800033&lang=pt" 
"S0074-02761987000800034-scl","Snail host control in the eastern coastal areas of North-East (NE) Brazil","Pieri, O. S., Thomas, J. D.","Memórias do Instituto Oswaldo Cruz; 82(); 197-201","Memórias do Instituto Oswaldo Cruz","Inglês","1987","http://www.scielo.br/scielo.php?script=sci_arttext&pid=S0074-02761987000800034&lang=pt" 
"S0074-02761987000800035-scl","Why it is difficult to control Biomphalaria glabrata, the vector snail of schistosomiasis","Jurberg, Pedro","Memórias do Instituto Oswaldo Cruz; 82(); 203-207","Memórias do Instituto Oswaldo Cruz","Inglês","1987","http://www.scielo.br/scielo.php?script=sci_arttext&pid=S0074-02761987000800035&lang=pt" 
"S0074-02761987000800036-scl","Genomic regulation in imature females of Schistosoma mansoni","Rumjanek, Franklin David, Braga, Vania Maria Martins, Silveira, Alda Maria Soares, Rabelo, Elida Mara L., Campos, Elida Geralda, Rodriguez, Vanderlei","Memórias do Instituto Oswaldo Cruz; 82(); 209-212","Memórias do Instituto Oswaldo Cruz","Inglês","1987","http://www.scielo.br/scielo.php?script=sci_arttext&pid=S0074-02761987000800036&lang=pt" 
"S0074-02761987000800037-scl","Decay accelerating factor (DAF) as the host antigen with protective activity to complement killing of schistosomula","Ramalho-Pinto, F. Juarez","Memórias do Instituto Oswaldo Cruz; 82(); 213-216","Memórias do Instituto Oswaldo Cruz","Inglês","1987","http://www.scielo.br/scielo.php?script=sci_arttext&pid=S0074-02761987000800037&lang=pt" 
"S0074-02761987000800038-scl","Schistosomiasis mansoni: immunodiagnosis aspects and search for an immunological marker related to therapeutic efficacy","Kanamura, Hermínia Y., Hoshino-Shimizu, Sumie, Lima, Dirce M. C., Abrantes, Clarice P., Silva, Luiz Caetano da","Memórias do Instituto Oswaldo Cruz; 82(); 217-218","Memórias do Instituto Oswaldo Cruz","Inglês","1987","http://www.scielo.br/scielo.php?script=sci_arttext&pid=S0074-02761987000800038&lang=pt" 
"S0074-02761987000800039-scl","Anaphylactic sensitivity and immunity to Schistosoma mansoni in mice","Gerken, S. E., Vaz, N. M., Mota-Santos, T. A.","Memórias do Instituto Oswaldo Cruz; 82(); 219-220","Memórias do Instituto Oswaldo Cruz","Inglês","1987","http://www.scielo.br/scielo.php?script=sci_arttext&pid=S0074-02761987000800039&lang=pt" 
"S0074-02761987000800040-scl","Pulmonary involvement in Schistosomiasis mansoni","Greco, Dirceu B., Pedroso, Enio R. P., Lambertucci, J. R., Rocha, Manoel O. C., Coelho, Paulo Marcos Z., Raso, Pedro, Ferreira, Cid S.","Memórias do Instituto Oswaldo Cruz; 82(); 221-227","Memórias do Instituto Oswaldo Cruz","Inglês","1987","http://www.scielo.br/scielo.php?script=sci_arttext&pid=S0074-02761987000800040&lang=pt" 
"S0074-02761987000800041-scl","Analysis of the interacting components between larval Schistosoma mansoni and schistosome-susceptible and resistant Biomphalaria glabrata","Granath Junior, Willard O., Spray, Frances J.","Memórias do Instituto Oswaldo Cruz; 82(); 229-230","Memórias do Instituto Oswaldo Cruz","Inglês","1987","http://www.scielo.br/scielo.php?script=sci_arttext&pid=S0074-02761987000800041&lang=pt" 
"S0074-02761987000800042-scl","Schistosoma mansoni: migration patterns in normal and immunized swiss webster mice, by means of autoradiographic analysis","Pinto, R. Magalhães, Noronha, Dely, Almeida, Marília S. S., Tendler, Miriam, Katz, Naftale, Palma, Shirley S.","Memórias do Instituto Oswaldo Cruz; 82(); 231-232","Memórias do Instituto Oswaldo Cruz","Inglês","1987","http://www.scielo.br/scielo.php?script=sci_arttext&pid=S0074-02761987000800042&lang=pt" 
"S0074-02761987000800043-scl","Schistosoma mansoni - NZ rabbit-model: resistance due to infection and active immunization with adult worm antigen","Almeida, Marília S. S., Pinto, R. Magalhães, Noronha, Dely, Tendler, Miriam, Katz, Naftale","Memórias do Instituto Oswaldo Cruz; 82(); 233-233","Memórias do Instituto Oswaldo Cruz","Inglês","1987","http://www.scielo.br/scielo.php?script=sci_arttext&pid=S0074-02761987000800043&lang=pt" 
"S0074-02761987000800044-scl","Localization of Schistosoma mansoni protective antigens by indirect immunofluorescence","Mendonça, M. C. R., Lenzi, H. l., Tendler, M.","Memórias do Instituto Oswaldo Cruz; 82(); 235-236","Memórias do Instituto Oswaldo Cruz","Inglês","1987","http://www.scielo.br/scielo.php?script=sci_arttext&pid=S0074-02761987000800044&lang=pt" 
"S0074-02761987000800045-scl","Role of a mouse monoclonal IgE antibody in passive transfer of immunity to Schistosoma japonicum infection","Kojima, Somei, Janecharut, Tuenta, Hata, Hidekazu, Niimura, Munetoshi","Memórias do Instituto Oswaldo Cruz; 82(); 237-241","Memórias do Instituto Oswaldo Cruz","Inglês","1987","http://www.scielo.br/scielo.php?script=sci_arttext&pid=S0074-02761987000800045&lang=pt" 
"S0074-02761987000800046-scl","Study of the in vitro cell proliferation of lymphocytes from Manson&#039;s Schistosomiasis patients treated with praziquantel","Almeida, Terezinha M. B., Silva, Luiz C. da, Almeida, Vagner F., Beçak, Willy","Memórias do Instituto Oswaldo Cruz; 82(); 243-243","Memórias do Instituto Oswaldo Cruz","Inglês","1987","http://www.scielo.br/scielo.php?script=sci_arttext&pid=S0074-02761987000800046&lang=pt" 
"S0074-02761987000800047-scl","Extra-tissular Schistosoma mansoni egg granulomata in the peritoneal cavity of mice","Melro, Maria Clara B. F., Mariano, Mario","Memórias do Instituto Oswaldo Cruz; 82(); 245-252","Memórias do Instituto Oswaldo Cruz","Inglês","1987","http://www.scielo.br/scielo.php?script=sci_arttext&pid=S0074-02761987000800047&lang=pt" 
"S0074-02761987000800049-scl","Congenital and nursing effects on the evolution of Schistosoma mansoni infection in mice","Lenzi, J. A., Sobral, A. C. L., Araripe, J. R., Grimaldi Filho, G., Lenzi, H. L.","Memórias do Instituto Oswaldo Cruz; 82(); 257-267","Memórias do Instituto Oswaldo Cruz","Inglês","1987","http://www.scielo.br/scielo.php?script=sci_arttext&pid=S0074-02761987000800049&lang=pt" 
"S0074-02761987000800050-scl","Induced tolerance to Schistosoma mansoni antigens modulates periovular granuloma","Sadigursky, Moysés, Falangola, Maria de Fátima, Santos, Rosella de Oliveira, Cardoso, Silvia Andrade, David, John","Memórias do Instituto Oswaldo Cruz; 82(); 269-271","Memórias do Instituto Oswaldo Cruz","Inglês","1987","http://www.scielo.br/scielo.php?script=sci_arttext&pid=S0074-02761987000800050&lang=pt" 
"S0074-02761987000800051-scl","Altered lymphocyte proliferation and cytokine release in hepatosplenic Schistosomiais mansoni in Brazil","Zwingenberger, Kai, Jansen-Rosseck, Rolf, Cardoso, Alberto Eduardo Cox, Siqueira, José Geraldo Vergetti de, Feldmeier, Hermann","Memórias do Instituto Oswaldo Cruz; 82(); 273-276","Memórias do Instituto Oswaldo Cruz","Inglês","1987","http://www.scielo.br/scielo.php?script=sci_arttext&pid=S0074-02761987000800051&lang=pt" 
"S0074-02761987000800052-scl","Reduced capacity of peritoneal exudate cells for oxidative killing of Schistosoma mansoni schistosomula","Smith, James M., Mkoji, Gerald M., Prichard, Roger K.","Memórias do Instituto Oswaldo Cruz; 82(); 277-282","Memórias do Instituto Oswaldo Cruz","Inglês","1987","http://www.scielo.br/scielo.php?script=sci_arttext&pid=S0074-02761987000800052&lang=pt" 
"S0074-02761987000800053-scl","Levels of lethal antibody during the course of infection with Schistosoma mansoni in rats and mice","Horta, M. de Fátima M., Ramalho-Pinto, F. J.","Memórias do Instituto Oswaldo Cruz; 82(); 283-284","Memórias do Instituto Oswaldo Cruz","Inglês","1987","http://www.scielo.br/scielo.php?script=sci_arttext&pid=S0074-02761987000800053&lang=pt" 
