"S2317-64312014000100011-scl","Caracterização das inovações do telejornalismo e a expressividade dos apresentadores","Silva, Eliane Caires da, Penteado, Regina Zanella","Audiology - Communication Research; 19(1); 61-68","Audiology - Communication Research","Inglês, Português","2014","http://www.scielo.br/scielo.php?script=sci_arttext&pid=S2317-64312014000100011&lang=pt" 
"S2317-64312014000100006-scl","Maturação auditiva periférica: análise das amplitudes das emissões otoacústicas produto de distorção em neonatos pré-termo e a termo","Ferreira, Daniele Barreto da Cunha, Araújo, Nádja Ísis Campos e, Marques, Suzana Raquel Lopes, Miranda, Isabela Assunção, Resende, Fernanda Alves Botelho de, Resende, Luciana Macedo de, Carvalho, Sirley Alves da Silva","Audiology - Communication Research; 19(1); 25-32","Audiology - Communication Research","Inglês, Português","2014","http://www.scielo.br/scielo.php?script=sci_arttext&pid=S2317-64312014000100006&lang=pt" 
"S2317-64312014000100004-scl","Potenciais evocados auditivos de longa latência em escolares com transtornos específicos de aprendizagem","Regaçone, Simone Fiuza, Gução, Ana Cláudia Bianco, Giacheti, Célia Maria, Romero, Ana Carla Leite, Frizzo, Ana Cláudia Figueiredo","Audiology - Communication Research; 19(1); 13-18","Audiology - Communication Research","Inglês, Português","2014","http://www.scielo.br/scielo.php?script=sci_arttext&pid=S2317-64312014000100004&lang=pt" 
"S0101-31572014000100003-scl","Estado, bloco no poder e acumulação capitalista: uma abordagem teórica","Pinto, Eduardo Costa, Balanco, Paulo","Revista de Economia Política; 34(1); 39-60","Revista de Economia Política","Português","2014","http://www.scielo.br/scielo.php?script=sci_arttext&pid=S0101-31572014000100003&lang=pt" 
"S1517-97022014000100010-scl","Interações comunicativas entre uma professora e um aluno com autismo na escola comum: uma proposta de intervenção","Gomes, Rosana Carvalho, Nunes, Débora R. P.","Educação e Pesquisa; 40(1); 143-161","Educação e Pesquisa","Português","2014","http://www.scielo.br/scielo.php?script=sci_arttext&pid=S1517-97022014000100010&lang=pt" 
"S1517-97022014000100002-scl","Os gestores educacionais e a recepção dos sistemas externos de avaliação no cotidiano escolar","Rosistolato, Rodrigo, Viana, Guilherme","Educação e Pesquisa; 40(1); 13-28","Educação e Pesquisa","Português","2014","http://www.scielo.br/scielo.php?script=sci_arttext&pid=S1517-97022014000100002&lang=pt" 
"S2179-80872014000100004-scl","Estabelecimento de mudas de Eucalyptus spp. e Corymbia citriodora em diferentes substratos","Oliveira, Karina Fernandes, Souza, Anderson Marcos de, Sousa, Glauce Taís de Oliveira, Costa, Ana Luiza Moreira da, Freitas, Miguel Luiz Menezes","Floresta e Ambiente; 21(1); 30-36","Floresta e Ambiente","Português","2014","http://www.scielo.br/scielo.php?script=sci_arttext&pid=S2179-80872014000100004&lang=pt" 
"S2179-80872014000100010-scl","Témitas associados à degradação de cinco espécies florestais em campo de apodrecimento","Corassa, Janaína de Nadai, Pires, Evaldo Martins, Andrade Neto, Valmir Rodrigues de, Tariga, Tamara Cristina","Floresta e Ambiente; 21(1); 78-84","Floresta e Ambiente","Português","2014","http://www.scielo.br/scielo.php?script=sci_arttext&pid=S2179-80872014000100010&lang=pt" 
"S1517-97022014000100013-scl","Expresiones de lo sensible: lecturas en clave pedagógica","Gallo, Luz Elena","Educação e Pesquisa; 40(1); 197-214","Educação e Pesquisa","Inglês, Espanhol","2014","http://www.scielo.br/scielo.php?script=sci_arttext&pid=S1517-97022014000100013&lang=pt" 
"S1517-97022014000100012-scl","Nos interstícios da cidadania: a inevitabilidade e urgência da dimensão da virtude cívica na educação","Fonseca, Eduardo Nuno","Educação e Pesquisa; 40(1); 181-196","Educação e Pesquisa","Inglês, Português","2014","http://www.scielo.br/scielo.php?script=sci_arttext&pid=S1517-97022014000100012&lang=pt" 
"S1517-97022014000100011-scl","Conceitos matemáticos iniciais e linguagem: um estudo comparativo entre crianças surdas e ouvintes","Barbosa, Heloiza H.","Educação e Pesquisa; 40(1); 163-179","Educação e Pesquisa","Inglês, Português","2014","http://www.scielo.br/scielo.php?script=sci_arttext&pid=S1517-97022014000100011&lang=pt" 
"S1517-97022014000100016-scl","Formação de professores e saberes docentes: trajetória e preocupações de uma pesquisadora da docência - uma entrevista com Ruth Mercado","Souza, Denise Trento Rebello de, Zibetti, Marli Lúcia Tonatto","Educação e Pesquisa; 40(1); 247-267","Educação e Pesquisa","Português","2014","http://www.scielo.br/scielo.php?script=sci_arttext&pid=S1517-97022014000100016&lang=pt" 
"S1517-97022014000100014-scl","Educação sobre drogas: uma proposta orientada pela redução de danos","Adade, Mariana, Monteiro, Simone","Educação e Pesquisa; 40(1); 215-230","Educação e Pesquisa","Português","2014","http://www.scielo.br/scielo.php?script=sci_arttext&pid=S1517-97022014000100014&lang=pt" 
"S0716-09172014000100008-chl","On the asymptotic behaviour of solutions of certain differential equations of the third order","Ademola, A. T, Arawomo, P. O","Proyecciones (Antofagasta); 33(1); 101-122","Proyecciones (Antofagasta)","Inglês","2014","http://www.scielo.cl/scielo.php?script=sci_arttext&pid=S0716-09172014000100008&lang=pt" 
"S0716-09172014000100009-chl","Birrepresentations in a locally nilpotent variety","Arenas, Manuel, Labra, Alicia","Proyecciones (Antofagasta); 33(1); 123-132","Proyecciones (Antofagasta)","Inglês","2014","http://www.scielo.cl/scielo.php?script=sci_arttext&pid=S0716-09172014000100009&lang=pt" 
"S0716-09172014000100006-chl","Some Umbral Calculus Presentations of the Chan-Chyan-Srivastava Polynomials and the Erkuș-Srivastava Polynomials","Srivastava, H. M, Nisar, K. S, Khan, Mumtaz Ahmad","Proyecciones (Antofagasta); 33(1); 77-90","Proyecciones (Antofagasta)","Inglês","2014","http://www.scielo.cl/scielo.php?script=sci_arttext&pid=S0716-09172014000100006&lang=pt" 
"S0716-09172014000100007-chl","Titchmarsh&#039;s Theorem for the Dunkl transform in the space L²(Rd,ωk(x)dx)","Daher, Radouan, El Hamma, Mohamed","Proyecciones (Antofagasta); 33(1); 91-100","Proyecciones (Antofagasta)","Inglês","2014","http://www.scielo.cl/scielo.php?script=sci_arttext&pid=S0716-09172014000100007&lang=pt" 
"S0716-09172014000100004-chl","Hardy-Type Spaces and its Dual","Castillo, René Erlín, Ramos Fernández, Julio C, Trousselot, Eduard","Proyecciones (Antofagasta); 33(1); 43-59","Proyecciones (Antofagasta)","Inglês","2014","http://www.scielo.cl/scielo.php?script=sci_arttext&pid=S0716-09172014000100004&lang=pt" 
"S0716-09172014000100005-chl","Computing the Field of Moduli of the KFT family","Hidalgo, Rubén A","Proyecciones (Antofagasta); 33(1); 61-75","Proyecciones (Antofagasta)","Inglês","2014","http://www.scielo.cl/scielo.php?script=sci_arttext&pid=S0716-09172014000100005&lang=pt" 
"S0716-09172014000100002-chl","Some characterization theorems on dominating chromatic partition-covering number of graphs","Michael Raj, L. Benedict, Ayyaswamy, S. K.","Proyecciones (Antofagasta); 33(1); 13-23","Proyecciones (Antofagasta)","Inglês","2014","http://www.scielo.cl/scielo.php?script=sci_arttext&pid=S0716-09172014000100002&lang=pt" 
"S0716-09172014000100003-chl","","Rama Raju, S. V. Siva, Nagaraja Rao, I. H","Proyecciones (Antofagasta); 33(1); 25-41","Proyecciones (Antofagasta)","Espanhol","2014","http://www.scielo.cl/scielo.php?script=sci_arttext&pid=S0716-09172014000100003&lang=pt" 
"S0716-09172014000100001-chl","A primality test for submodules using Grobner basis","Barragán Moreno, Sandra","Proyecciones (Antofagasta); 33(1); 1-12","Proyecciones (Antofagasta)","Inglês","2014","http://www.scielo.cl/scielo.php?script=sci_arttext&pid=S0716-09172014000100001&lang=pt" 
"S1984-70332014000100005-scl","Variability, heritability, and correlations of agronomic traits in an onion landrace and derived S1 lines","Porta, Bettina, Rivas, Mercedes, Gutiérrez, Lucía, Galván, Guillermo A","Crop Breeding and Applied Biotechnology; 14(1); 29-35","Crop Breeding and Applied Biotechnology","Inglês","2014","http://www.scielo.br/scielo.php?script=sci_arttext&pid=S1984-70332014000100005&lang=pt" 
"S1984-70332014000100003-scl","Evaluation of special grains bean lines for grain yield, cooking time and mineral concentrations","Ribeiro, Nerinéia Dalfollo, Rodrigues, Josana de Abreu, Prigol, Marina, Nogueira, Cristina Wayne, Storck, Lindolfo, Gruhn, Eduardo Muller","Crop Breeding and Applied Biotechnology; 14(1); 15-22","Crop Breeding and Applied Biotechnology","Inglês","2014","http://www.scielo.br/scielo.php?script=sci_arttext&pid=S1984-70332014000100003&lang=pt" 
"S1984-70332014000100002-scl","Agronomic performance of super-sweet corn genotypes in the north of Rio de Janeiro","Santos, Pedro Henrique Araújo Diniz, Pereira, Messias Gonzaga, Trindade, Roberto dos Santos, Cunha, Keila Silva da, Entringer, Geovana Cremonini, Vettorazzi, Julio Cesar Fiorio","Crop Breeding and Applied Biotechnology; 14(1); 8-14","Crop Breeding and Applied Biotechnology","Inglês","2014","http://www.scielo.br/scielo.php?script=sci_arttext&pid=S1984-70332014000100002&lang=pt" 
"S1984-70332014000100001-scl","Rapid screening for selection of heavy metal-tolerant plants","Piotto, Fernando Angelo, Tulmann-Neto, Augusto, Franco, Mônica Regina, Boaretto, Luis Felipe, Azevedo, Ricardo Antunes","Crop Breeding and Applied Biotechnology; 14(1); 1-7","Crop Breeding and Applied Biotechnology","Inglês","2014","http://www.scielo.br/scielo.php?script=sci_arttext&pid=S1984-70332014000100001&lang=pt" 
"S0120-33472014000100008-col","Los problemas de la analgesia obstétrica","Herrera Gómez, Pedro José, Medina, Paula Andrea","Revista Colombiana de Anestesiología; 42(1); 37-39","Revista Colombiana de Anestesiología","Inglês, Espanhol","2014","http://www.scielo.org.co/scielo.php?script=sci_arttext&pid=S0120-33472014000100008&lang=pt" 
"S0120-33472014000100009-col","Fisiopatología y tratamiento del dolor de miembro fantasma","Malavera Angarita, Mayra Alejandra, Carrillo Villa, Sandra, Gomezese Ribero, Omar Fernando, García, Ronald G., Silva Sieger, Federico Arturo","Revista Colombiana de Anestesiología; 42(1); 40-46","Revista Colombiana de Anestesiología","Inglês, Espanhol","2014","http://www.scielo.org.co/scielo.php?script=sci_arttext&pid=S0120-33472014000100009&lang=pt" 
"S0120-33472014000100004-col","Experiencia local con el uso de punción única peribulbar caruncular para anestesia oftálmica","Calvache, José Andrés, López, Hernando, Castro-Delgado, Oscar Eduardo","Revista Colombiana de Anestesiología; 42(1); 16-19","Revista Colombiana de Anestesiología","Inglês, Espanhol","2014","http://www.scielo.org.co/scielo.php?script=sci_arttext&pid=S0120-33472014000100004&lang=pt" 
"S0120-33472014000100005-col","Percepción de la relación anestesiólogo-paciente valorada en el posoperatorio de pacientes ASA I y II en instituciones de nivel III y IV (estudio RAP-2) en Cali, Colombia","Giraldo Tascón, Valeria Lilian, Castillo, Germán Gabriel, Quintero Saker, Ubaldo, Palacio, Liliana, Díaz Ante, Yesid, Palacio Arboleda, Mauricio, Gómez, Juan Manuel, Freddy, Ariza, Alzate, Octavio, Pachón, Mauricio, Carvajal, Reinaldo","Revista Colombiana de Anestesiología; 42(1); 20-27","Revista Colombiana de Anestesiología","Inglês, Espanhol","2014","http://www.scielo.org.co/scielo.php?script=sci_arttext&pid=S0120-33472014000100005&lang=pt" 
"S0120-33472014000100006-col","Incidencia de complicaciones neurológicas y cefalea pospunción dural luego de anestesia regional en la práctica obstétrica: un estudio retrospectivo de 2399 pacientes","Domingos Dias, Cicarelli, Frerichs, Elke, Martins Benseñor, Fábio Ely","Revista Colombiana de Anestesiología; 42(1); 28-32","Revista Colombiana de Anestesiología","Inglês, Espanhol","2014","http://www.scielo.org.co/scielo.php?script=sci_arttext&pid=S0120-33472014000100006&lang=pt" 
"S0120-33472014000100007-col","Ecografía para anestesiólogos","Quintana Puerta, Julián Esteban","Revista Colombiana de Anestesiología; 42(1); 33-36","Revista Colombiana de Anestesiología","Inglês, Espanhol","2014","http://www.scielo.org.co/scielo.php?script=sci_arttext&pid=S0120-33472014000100007&lang=pt" 
"S0120-33472014000100001-col","Del instrumento EQ-5D y la escala visual análoga a la felicidad","Chicaíza-Becerra, Liliana Alejandra, García-Molina, Mario","Revista Colombiana de Anestesiología; 42(1); 1-3","Revista Colombiana de Anestesiología","Inglês, Espanhol","2014","http://www.scielo.org.co/scielo.php?script=sci_arttext&pid=S0120-33472014000100001&lang=pt" 
"S0120-33472014000100002-col","La Revísta Colombiana de Anestesiología (RCA) acoge vD la Declaración de transparencia y lineamientos para publicación de artículos, entre ellos CARE, para reporte de caso","Eslava-Schmalbach, Javier, Gómez-Duarte, Oscar Gilberto","Revista Colombiana de Anestesiología; 42(1); 4-8","Revista Colombiana de Anestesiología","Inglês, Espanhol","2014","http://www.scielo.org.co/scielo.php?script=sci_arttext&pid=S0120-33472014000100002&lang=pt" 
"S0120-33472014000100003-col","Síntomas laringofaríngeos posoperatorios en cirugía electiva. Incidencia y factores asociados","Ríos, Ángela María, Calvache, José Andrés, Gómez, Juan Camilo, Gómez, Luz María, Aguirre, Oscar David, Delgado-Noguera, Mario Francisco, Uribe Trujillo, Fernando, Lesaffre, Emmanuel, Klimek, Markus, Stolker, Robert Jan","Revista Colombiana de Anestesiología; 42(1); 9-15","Revista Colombiana de Anestesiología","Inglês, Espanhol","2014","http://www.scielo.org.co/scielo.php?script=sci_arttext&pid=S0120-33472014000100003&lang=pt" 
"S0120-33472014000100013-col","Lactato y déficit de bases en trauma: valor pronóstico","Laverde Sabogal, Carlos Eduardo, Correa Rivera, Andrés Felipe, Joya Higuera, Angélica Yasmin","Revista Colombiana de Anestesiología; 42(1); 60-64","Revista Colombiana de Anestesiología","Inglês, Espanhol","2014","http://www.scielo.org.co/scielo.php?script=sci_arttext&pid=S0120-33472014000100013&lang=pt" 
"S0120-33472014000100012-col","Manejo anestésico de un paciente con síndrome de Rett y fractura distal de húmero: reporte de un caso y revisión de la literatura","Pérez-Moreno, John Carlos, Nájera-Losada, Diana Carolina, Domínguez-Pérez, Fernando","Revista Colombiana de Anestesiología; 42(1); 57-59","Revista Colombiana de Anestesiología","Inglês, Espanhol","2014","http://www.scielo.org.co/scielo.php?script=sci_arttext&pid=S0120-33472014000100012&lang=pt" 
"S0120-33472014000100011-col","Sedación en un paciente súper-superobeso para la implantación de un balón intragástrico: presentación de un caso clínico","Herrera Rodríguez, Daniel López, Rodríguez Sánchez-Migallón, Eduardo, Mellado Miras, Patricia, Sánchez Carrillo, Francisco","Revista Colombiana de Anestesiología; 42(1); 53-56","Revista Colombiana de Anestesiología","Inglês, Espanhol","2014","http://www.scielo.org.co/scielo.php?script=sci_arttext&pid=S0120-33472014000100011&lang=pt" 
"S0120-33472014000100010-col","Dosis de prueba para anestesia regional","Galindo Gualdrón, Luz Adriana","Revista Colombiana de Anestesiología; 42(1); 47-52","Revista Colombiana de Anestesiología","Inglês, Espanhol","2014","http://www.scielo.org.co/scielo.php?script=sci_arttext&pid=S0120-33472014000100010&lang=pt" 
"S0120-33472014000100015-col","Preguntas y respuestas","Raffan Sanabria, Fernando","Revista Colombiana de Anestesiología; 42(1); 70-71","Revista Colombiana de Anestesiología","Inglês, Espanhol","2014","http://www.scielo.org.co/scielo.php?script=sci_arttext&pid=S0120-33472014000100015&lang=pt" 
"S0120-33472014000100014-col","Síndrome compartimental en miembros superiores por picadura de abejas: reporte de caso","Rivera Díaz, Roberto Carlo, Naquira Escobar, Luis Felipe, Martínez Ramírez, Sandra Milena, Cifuentes Hoyos, Valentina","Revista Colombiana de Anestesiología; 42(1); 65-69","Revista Colombiana de Anestesiología","Inglês, Espanhol","2014","http://www.scielo.org.co/scielo.php?script=sci_arttext&pid=S0120-33472014000100014&lang=pt" 
"S1808-16572014000100001-scl","The role of the &#039;peer reviewer&#039;","","Arquivos do Instituto Biológico; 81(1); 01-01","Arquivos do Instituto Biológico","Inglês, Português","2014","http://www.scielo.br/scielo.php?script=sci_arttext&pid=S1808-16572014000100001&lang=pt" 
"S1808-16572014000100003-scl","Compatibilidade de Heterorhabditis amazonensis (Rhabditida: Heterorhabditidae) isolado RSC-5 com diferentes carrapaticidas utilizados no controle de Rhipicephalus microplus (Acari: Ixodidae)","Monteiro, Caio Márcio de Oliveira, Matos, Renata da Silva, Prata, Márcia Cristina de Azevedo, Batista, Elder Simões, Perinotto, Wendell Marcelo de Souza, Bittencourt, Vânia Rita Elias Pinheiro, Furlong, John, Carvalho, Vanessa Andaló Mendes de","Arquivos do Instituto Biológico; 81(1); 03-08","Arquivos do Instituto Biológico","Português","2014","http://www.scielo.br/scielo.php?script=sci_arttext&pid=S1808-16572014000100003&lang=pt" 
"S1808-16572014000100009-scl","Ferramentas diagnósticas de Lentivirose de Pequenos Ruminantes: padronização da técnica de ELISA indireto","Nascimento, Caliandra Bona, Pinheiro, Raymundo Rizaldo, Alves, Francisco Selmo Fernandes, Brito, Roberta Lomonte Lemos de, Rodrigues, Apoliana de Sousa, Bezerra e Silva, Ricardo Abílio, Paula, Ney Rômulo de Oliveira, Batista, Maria do Carmo de Souza","Arquivos do Instituto Biológico; 81(1); 9-15","Arquivos do Instituto Biológico","Português","2014","http://www.scielo.br/scielo.php?script=sci_arttext&pid=S1808-16572014000100009&lang=pt" 
"S1413-81232014000300785-spa","La trajectoire des symptômes dépressifs de l&#039;enfance à l&#039;adolescence et les cibles d&#039;intervention préventive","Marcotte, Diane, Lemieux, Annie","Ciência &amp; Saúde Coletiva; 19(3); 785-796","Ciência &amp; Saúde Coletiva","Francês","2014","http://www.scielosp.org/scielo.php?script=sci_arttext&pid=S1413-81232014000300785&lang=pt" 
"S1808-16572014000100049-scl","Qualidade microbiológica do peixe serra (Scomberomerus brasiliensis) e do gelo utilizado na sua conservação","Ferreira, Elka Machado, Lopes, Ilderlane da Silva, Pereira, Débora de Matos, Rodrigues, Lucélia da Cunha, Costa, Francisca Neide","Arquivos do Instituto Biológico; 81(1); 49-54","Arquivos do Instituto Biológico","Português","2014","http://www.scielo.br/scielo.php?script=sci_arttext&pid=S1808-16572014000100049&lang=pt" 
"S1808-16572014000100043-scl","Sorologia e suscetibilidade antimicrobiana em isolados de Escherichia coli de pesque-pagues","Barbosa, Mayhara Martins Cordeiro, Pinto, Fernanda de Rezende, Ribeiro, Laryssa Freitas, Guriz, Cintia Sobue Lorenzon, Ferraudo, Antônio Sérgio, Maluta, Renato Pariz, Rigobelo, Everlon Cid, Ávila, Fernando Antonio, Amaral, Luiz Augusto","Arquivos do Instituto Biológico; 81(1); 43-48","Arquivos do Instituto Biológico","Português","2014","http://www.scielo.br/scielo.php?script=sci_arttext&pid=S1808-16572014000100043&lang=pt" 
"S1808-16572014000100083-scl","Primeiro registro das espécies de cigarrinhas-da-raiz da cana-de-açúcar Mahanarva spectabilis (Distant) e Mahanarva liturata (Le Peletier &amp; Serville) atacando canaviais na região de Goianésia (GO), Brasil","Alves, Roberto Teixeira, Carvalho, Gervásio Silva","Arquivos do Instituto Biológico; 81(1); 83-85","Arquivos do Instituto Biológico","Português","2014","http://www.scielo.br/scielo.php?script=sci_arttext&pid=S1808-16572014000100083&lang=pt" 
"S1413-81232014000300719-spa","Gravidez na adolescência: análise de fatores de risco para baixo peso, prematuridade e cesariana","Santos, Nilma Lázara de Almeida Cruz, Costa, Maria Conceição Oliveira, Amaral, Magali Teresópolis Reis, Vieira, Graciete Oliveira, Bacelar, Eloisa Barreto, Almeida, André Henrique do Vale de","Ciência &amp; Saúde Coletiva; 19(3); 719-726","Ciência &amp; Saúde Coletiva","Português","2014","http://www.scielosp.org/scielo.php?script=sci_arttext&pid=S1413-81232014000300719&lang=pt" 
"S1413-81232014000300773-spa","Sistema de Vigilância de Violências e Acidentes/VIVA e a notificação da violência infanto-juvenil, no Sistema Único de Saúde/SUS de Feira de Santana-Bahia, Brasil","Souza, Camila dos Santos, Costa, Maria Conceição Oliveira, Assis, Simone Gonçalves de, Musse, Jamilly de Oliveira, Sobrinho, Carlito Nascimento, Amaral, Magali Teresópolis Reis","Ciência &amp; Saúde Coletiva; 19(3); 773-784","Ciência &amp; Saúde Coletiva","Português","2014","http://www.scielosp.org/scielo.php?script=sci_arttext&pid=S1413-81232014000300773&lang=pt" 
"S1413-81232014000300987-spa","Costa MCO. Violência e vitimização na infância e adolescência - a inclusão da escola no reconhecimento e prevenção. Feira de Santana: Editora UEFS; 2013.","Marques, Jeidson Antônio Moraes","Ciência &amp; Saúde Coletiva; 19(3); 987-988","Ciência &amp; Saúde Coletiva","Português","2014","http://www.scielosp.org/scielo.php?script=sci_arttext&pid=S1413-81232014000300987&lang=pt" 
"S1808-16572014000100016-scl","Pesquisa de enterobactérias em patos domésticos (Cairina moschata) de propriedades localizadas em quatro municípios do Ceará, Brasil","Silva, Emanuella Evangelista da, Lopes, Elisângela de Souza, Teixeira, Régis Siqueira de Castro, Albuquerque, Átilla Holanda de, Silva, Roberta Cristina da Rocha e, Gomes Filho, Valdez Juval Rocha, Vasconcelos, Ruben Horn, Maciel, William Cardoso","Arquivos do Instituto Biológico; 81(1); 16-21","Arquivos do Instituto Biológico","Português","2014","http://www.scielo.br/scielo.php?script=sci_arttext&pid=S1808-16572014000100016&lang=pt" 
"S1808-16572014000100062-scl","Micobiota parasitária de escleródios de Sclerotinia sclerotiorum isolada de solos da fronteira oeste do Rio Grande do Sul","Ethur, Luciana Zago, Copatti, Andrio Spiller, Fipke, Glauber Monçon, Calvano, Caroline Carvalho Aguirre, Pazini, Juliano de Bastos","Arquivos do Instituto Biológico; 81(1); 62-67","Arquivos do Instituto Biológico","Português","2014","http://www.scielo.br/scielo.php?script=sci_arttext&pid=S1808-16572014000100062&lang=pt" 
"S1808-16572014000100030-scl","Aspectos físico-químicos e microbiológicos do queijo tipo coalho comercializado em estados do nordeste do Brasil","Sousa, Andréa Zilá Barroso de, Abrantes, Maria Rociene, Sakamoto, Sidnei Miyoshi, Silva, Jean Berg Alves da, Lima, Patrícia de Oliveira, Lima, Renata Nayhara de, Rocha, Manuella de Oliveira Cabral, Passos, Yanna Deysi Bandeira","Arquivos do Instituto Biológico; 81(1); 30-35","Arquivos do Instituto Biológico","Português","2014","http://www.scielo.br/scielo.php?script=sci_arttext&pid=S1808-16572014000100030&lang=pt" 
"S1808-16572014000100086-scl","Leptospirose em pequenos ruminantes: situação epidemiológica atual no Brasil","Higino, Severino Silvano dos Santos, Azevedo, Sérgio Santos de","Arquivos do Instituto Biológico; 81(1); 86-94","Arquivos do Instituto Biológico","Português","2014","http://www.scielo.br/scielo.php?script=sci_arttext&pid=S1808-16572014000100086&lang=pt" 
"S1413-81232014000300673-spa","Resiliência, gênero e família na adolescência","Rozemberg, Laila, Avanci, Joviana, Schenker, Miriam, Pires, Thiago","Ciência &amp; Saúde Coletiva; 19(3); 673-684","Ciência &amp; Saúde Coletiva","Português","2014","http://www.scielosp.org/scielo.php?script=sci_arttext&pid=S1413-81232014000300673&lang=pt" 
"S1413-81232014000300685-spa","Post Traumatic Stress Disorder/PTSD in adolescent victims of sexual abuse: resilience and social support as protection factors","Hébert, Martine, Lavoie, Francine, Blais, Martin","Ciência &amp; Saúde Coletiva; 19(3); 685-694","Ciência &amp; Saúde Coletiva","Inglês","2014","http://www.scielosp.org/scielo.php?script=sci_arttext&pid=S1413-81232014000300685&lang=pt" 
"S1413-81232014000300707-spa","Namoro na adolescência no Brasil: circularidade da violência psicológica nos diferentes contextos relacionais","Oliveira, Queiti Batista Moreira, Assis, Simone Gonçalves de, Njaine, Kathie, Pires, Thiago Oliveira","Ciência &amp; Saúde Coletiva; 19(3); 707-718","Ciência &amp; Saúde Coletiva","Português","2014","http://www.scielosp.org/scielo.php?script=sci_arttext&pid=S1413-81232014000300707&lang=pt" 
"S1413-81232014000300747-spa","Fatores associados à infecção pelo HIV/AIDS entre adolescentes e adultos jovens matriculados em Centro de Testagem e Aconselhamento no Estado da Bahia, Brasil","Pereira, Bianca de Souza, Costa, Maria Conceição Oliveira, Amaral, Magali Teresópolis Reis, Costa, Hervânia Santana da, Silva, Carlos Alberto Lima da, Sampaio, Vanessa Silva","Ciência &amp; Saúde Coletiva; 19(3); 747-758","Ciência &amp; Saúde Coletiva","Português","2014","http://www.scielosp.org/scielo.php?script=sci_arttext&pid=S1413-81232014000300747&lang=pt" 
"S1413-81232014000300797-spa","Pressão arterial e suas associações com atividade física e obesidade em adolescentes: uma revisão sistemática","Corrêa Neto, Victor Gonçalves, Palma, Alexandre","Ciência &amp; Saúde Coletiva; 19(3); 797-818","Ciência &amp; Saúde Coletiva","Português","2014","http://www.scielosp.org/scielo.php?script=sci_arttext&pid=S1413-81232014000300797&lang=pt" 
"S1413-81232014000300829-spa","Promover saúde na escola: reflexões a partir de uma revisãosobre saúde escolar na América Latina","Casemiro, Juliana Pereira, Fonseca, Alexandre Brasil Carvalho da, Secco, Fabio Vellozo Martins","Ciência &amp; Saúde Coletiva; 19(3); 829-840","Ciência &amp; Saúde Coletiva","Português","2014","http://www.scielosp.org/scielo.php?script=sci_arttext&pid=S1413-81232014000300829&lang=pt" 
