"S1413-81232014000300847-spa","Educação em saúde e educação na saúde: conceitos e implicações para a saúde coletiva","Falkenberg, Mirian Benites, Mendes, Thais de Paula Lima, Moraes, Eliane Pedrozo de, Souza, Elza Maria de","Ciência &amp; Saúde Coletiva; 19(3); 847-852","Ciência &amp; Saúde Coletiva","Português","2014","http://www.scielosp.org/scielo.php?script=sci_arttext&pid=S1413-81232014000300847&lang=pt" 
"S1413-81232014000300853-spa","Planejamento familiar: uso dos serviços de saúde por jovens com experiência de gravidez","Moura, Laís Norberta Bezerra de, Gomes, Keila Rejane Oliveira","Ciência &amp; Saúde Coletiva; 19(3); 853-863","Ciência &amp; Saúde Coletiva","Português","2014","http://www.scielosp.org/scielo.php?script=sci_arttext&pid=S1413-81232014000300853&lang=pt" 
"S1413-81232014000300865-spa","Análise de desempenho de sistema de indicadores para o enfrentamento da violência intrafamiliar e exploração sexual de crianças e adolescentes","Deslandes, Suely Ferreira, Mendes, Corina Helena Figueira, Luz, Eliane Santos da","Ciência &amp; Saúde Coletiva; 19(3); 865-874","Ciência &amp; Saúde Coletiva","Português","2014","http://www.scielosp.org/scielo.php?script=sci_arttext&pid=S1413-81232014000300865&lang=pt" 
"S1413-81232014000300875-spa","Desnutrição e sua associação com atividades durante o lazer entre adolescentes","Fernandes, Rômulo Araújo, Christofaro, Diego Giulliano Destro, Dias, Raphael Mendes Ritti, Codogno, Jamile Sanches, Oliveira, Arli Ramos de","Ciência &amp; Saúde Coletiva; 19(3); 875-880","Ciência &amp; Saúde Coletiva","Português","2014","http://www.scielosp.org/scielo.php?script=sci_arttext&pid=S1413-81232014000300875&lang=pt" 
"S1413-81232014000300881-spa","The prevalence of inhalant use and associated factors among adolescents in Belo Horizonte, Brazil","Silva-Oliveira, Fernando, Jorge, Kelly Oliva, Ferreira, Efigênia Ferreira e, Vale, Míriam Pimenta, Kawachi, Ichiro, Zarzar, Patrícia Maria","Ciência &amp; Saúde Coletiva; 19(3); 881-890","Ciência &amp; Saúde Coletiva","Inglês","2014","http://www.scielosp.org/scielo.php?script=sci_arttext&pid=S1413-81232014000300881&lang=pt" 
"S1413-81232014000300899-spa","Indicadores de risco associados ao consumo de drogas ilícitas em escolares de uma comunidade do sul do Brasil","Backes, Dirce Stein, Zanatta, Fabrício Batistin, Costenaro, Regina Santini, Rangel, Rosiane Filipin, Vidal, Janice, Kruel, Cristina Saling, Mattos, Karen Mallo de","Ciência &amp; Saúde Coletiva; 19(3); 899-906","Ciência &amp; Saúde Coletiva","Português","2014","http://www.scielosp.org/scielo.php?script=sci_arttext&pid=S1413-81232014000300899&lang=pt" 
"S1413-81232014000300907-spa","Mortes infantis evitáveis por intervenções do Sistema Único de Saúde: comparação de duas coortes de nascimentos","Santos, Hellen Geremias dos, Andrade, Selma Maffei de, Silva, Ana Maria Rigo, Mathias, Thais Aidar de Freitas, Ferrari, Lígia Lopes, Mesas, Arthur Eumann","Ciência &amp; Saúde Coletiva; 19(3); 907-916","Ciência &amp; Saúde Coletiva","Português","2014","http://www.scielosp.org/scielo.php?script=sci_arttext&pid=S1413-81232014000300907&lang=pt" 
"S1413-81232014000300917-spa","Adaptação transcultural e reprodutibilidade de questionário para avaliação de conhecimento e atitude de profissionais de saúde frente a casos de abuso físico infantil","Silva-Oliveira, Fernando, Ferreira, Efigênia Ferreira e, Mattos, Flávio de Freitas, Ribeiro, Marco Túlio de Freitas, Cota, Luís Otavio de Miranda, Vale, Míriam Pimenta, Zarzar, Patrícia Maria","Ciência &amp; Saúde Coletiva; 19(3); 917-929","Ciência &amp; Saúde Coletiva","Português","2014","http://www.scielosp.org/scielo.php?script=sci_arttext&pid=S1413-81232014000300917&lang=pt" 
"S1413-81232014000300931-spa","Características sociodemográficas e nutricionais de crianças brasileiras menores de 2 anos beneficiárias de programas de transferência condicionada de renda em 2006","Vega, Juliana Bergamo, Taddei, José Augusto de Aguiar Carrazedo, Poblacion, Ana Paula","Ciência &amp; Saúde Coletiva; 19(3); 931-942","Ciência &amp; Saúde Coletiva","Português","2014","http://www.scielosp.org/scielo.php?script=sci_arttext&pid=S1413-81232014000300931&lang=pt" 
"S1413-81232014000300943-spa","Fatores associados ao excesso de peso em crianças brasileiras menores de cinco anos","Meller, Fernanda de Oliveira, Araújo, Cora Luiza Pavin, Madruga2, Samanta Winck","Ciência &amp; Saúde Coletiva; 19(3); 943-955","Ciência &amp; Saúde Coletiva","Português","2014","http://www.scielosp.org/scielo.php?script=sci_arttext&pid=S1413-81232014000300943&lang=pt" 
"S1413-81232014000300957-spa","A gravidade da cárie está associada à desnutrição proteico-calórica em pré-escolares?","Ribeiro, Cecilia Claudia Costa, Silva, Mariana Carvalho Batista da, Machado, Camila Maiana Pereira, Ribeiro, Marizélia Rodrigues Costa, Thomaz, Érika Bárbara Abreu Fonseca","Ciência &amp; Saúde Coletiva; 19(3); 957-965","Ciência &amp; Saúde Coletiva","Português","2014","http://www.scielosp.org/scielo.php?script=sci_arttext&pid=S1413-81232014000300957&lang=pt" 
"S1516-73132014000100012-scl","Educação ambiental em tempos de transição paradigmática: entrelaçando saberes &quot;disciplinados&quot;","Rodrigues, Ana Raquel de Souza","Ciência &amp; Educação (Bauru); 20(1); 195-206","Ciência &amp; Educação (Bauru)","Português","2014","http://www.scielo.br/scielo.php?script=sci_arttext&pid=S1516-73132014000100012&lang=pt" 
"S1516-73132014000100011-scl","Marx como referencial para análise de relações entre ciência, tecnologia e sociedade","Lima Junior, Paulo, Deconto, Diomar Caríssimo Selli, Andrella Neto, Ricieri, Cavalcanti, Cláudio José de Holanda, Ostermann, Fernanda","Ciência &amp; Educação (Bauru); 20(1); 175-194","Ciência &amp; Educação (Bauru)","Português","2014","http://www.scielo.br/scielo.php?script=sci_arttext&pid=S1516-73132014000100011&lang=pt" 
"S1516-73132014000100010-scl","A vida de alunos pescadores da comunidade de Baiacu (Bahia) e sua relação com a escola: dois mundos distintos?","Bejarano, Nelson Rui Ribas, Brunet, Joana Maria Soler, Bandeira, Fábio Pedro Souza de Ferreira, Bortoliero, Simone Terezinha","Ciência &amp; Educação (Bauru); 20(1); 159-173","Ciência &amp; Educação (Bauru)","Português","2014","http://www.scielo.br/scielo.php?script=sci_arttext&pid=S1516-73132014000100010&lang=pt" 
"S0104-40602014000100018-scl","&quot;El principio del fin. Las políticas y memorias de la educación en la última dictadura militar (1976-1983)&quot;: Argentina en perspectiva","Galak, Eduardo","Educar em Revista; (51); 303-308","Educar em Revista","Português","2014","http://www.scielo.br/scielo.php?script=sci_arttext&pid=S0104-40602014000100018&lang=pt" 
"S0104-40602014000100019-scl","Revista Realidade: edição especial &quot;A Juventude Brasileira, hoje&quot;. Setembro, 1967","Braghini, Katya Mitsuko Zuquim","Educar em Revista; (51); 311-320","Educar em Revista","Português","2014","http://www.scielo.br/scielo.php?script=sci_arttext&pid=S0104-40602014000100019&lang=pt" 
"S1516-73132014000100001-scl","Editorial","","Ciência &amp; Educação (Bauru); 20(1); 1-4","Ciência &amp; Educação (Bauru)","Português","2014","http://www.scielo.br/scielo.php?script=sci_arttext&pid=S1516-73132014000100001&lang=pt" 
"S1516-73132014000100005-scl","Estudo da viabilidade de uma proposta didática metacognitiva para as atividades experimentais em física","Rosa, Cleci Werner da, Alves Filho, José de Pinho","Ciência &amp; Educação (Bauru); 20(1); 61-81","Ciência &amp; Educação (Bauru)","Português","2014","http://www.scielo.br/scielo.php?script=sci_arttext&pid=S1516-73132014000100005&lang=pt" 
"S1516-73132014000100009-scl","Histórias em quadrinhos como recurso didático para o ensino do corpo humano em anos iniciais do Ensino Fundamental","Kawamoto, Elisa Mári, Campos, Luciana Maria Lunardi","Ciência &amp; Educação (Bauru); 20(1); 147-158","Ciência &amp; Educação (Bauru)","Português","2014","http://www.scielo.br/scielo.php?script=sci_arttext&pid=S1516-73132014000100009&lang=pt" 
"S1516-73132014000100008-scl","Análise de vizinhança de mapas conceituais a partir do uso de múltiplos conceitos obrigatórios","Correia, Paulo Rogério Miranda, Cicuto, Camila Aparecida Tolentino, Dazzani, Bianca","Ciência &amp; Educação (Bauru); 20(1); 133-146","Ciência &amp; Educação (Bauru)","Português","2014","http://www.scielo.br/scielo.php?script=sci_arttext&pid=S1516-73132014000100008&lang=pt" 
"S0104-40602014000100002-scl","Apresentação","Bornatto, Suzete de Paula, Oliveira, Marcus Aurelio Taborda de","Educar em Revista; (51); 15-18","Educar em Revista","Português","2014","http://www.scielo.br/scielo.php?script=sci_arttext&pid=S0104-40602014000100002&lang=pt" 
"S0104-40602014000100001-scl","Editorial","Bencostta, Marcus Levy","Educar em Revista; (51); -","Educar em Revista","Português","2014","http://www.scielo.br/scielo.php?script=sci_arttext&pid=S0104-40602014000100001&lang=pt" 
"S1516-73132014000100013-scl","Fração ideal da carga horária com aulas de campo, laboratório e sala no ensino de solos: visão do aluno","Rieder, Arno","Ciência &amp; Educação (Bauru); 20(1); 207-226","Ciência &amp; Educação (Bauru)","Português","2014","http://www.scielo.br/scielo.php?script=sci_arttext&pid=S1516-73132014000100013&lang=pt" 
"S1516-73132014000100016-scl","Fatores que tornam o professor de Ensino Superior bem-sucedido: analisando um caso","Quadros, Ana Luiza de, Mortimer, Eduardo Fleury","Ciência &amp; Educação (Bauru); 20(1); 259-278","Ciência &amp; Educação (Bauru)","Português","2014","http://www.scielo.br/scielo.php?script=sci_arttext&pid=S1516-73132014000100016&lang=pt" 
"S1516-73132014000100014-scl","Visitas guiadas ao Museu Nacional: interações e impressões de estudantes da Educação Básica","Oliveira, Guilherme Cordeiro da Graça de, Turci, Cássia Curan, Teixeira, Brunno Martins, Silva, Ediléa Mendes de Andrade, Garrido, Ivie Soares, Moraes, Rafael Silva","Ciência &amp; Educação (Bauru); 20(1); 227-242","Ciência &amp; Educação (Bauru)","Português","2014","http://www.scielo.br/scielo.php?script=sci_arttext&pid=S1516-73132014000100014&lang=pt" 
"S1516-73132014000100015-scl","Química no ensino de ciências para as séries iniciais: uma análise de livros didáticos","Mori, Rafael Cava, Curvelo, Antonio Aprigio da Silva","Ciência &amp; Educação (Bauru); 20(1); 243-258","Ciência &amp; Educação (Bauru)","Português","2014","http://www.scielo.br/scielo.php?script=sci_arttext&pid=S1516-73132014000100015&lang=pt" 
"S0104-40602014000100010-scl","Diferentes perspetivas de um ensino conservador: o ensino liceal em Portugal durante o Estado Novo (1936-1960)","Ferreira, António Gomes, Mota, Luís","Educar em Revista; (51); 145-174","Educar em Revista","Português","2014","http://www.scielo.br/scielo.php?script=sci_arttext&pid=S0104-40602014000100010&lang=pt" 
"S0104-40602014000100011-scl","&quot;Eu desisto?&quot; Paredes vivas na cidade: conflitos sociais em cartazes produzidos ao longo da década de 1980, no Brasil","Oliveira, Marcus Aurelio Taborda de","Educar em Revista; (51); 175-190","Educar em Revista","Português","2014","http://www.scielo.br/scielo.php?script=sci_arttext&pid=S0104-40602014000100011&lang=pt" 
"S0104-40602014000100012-scl","Limites sociológicos da leitura foucaultiana sobre a escolarização","Dallabrida, Norberto","Educar em Revista; (51); 193-207","Educar em Revista","Português","2014","http://www.scielo.br/scielo.php?script=sci_arttext&pid=S0104-40602014000100012&lang=pt" 
"S0104-40602014000100013-scl","Pela cidade, educabilidades (Príncipe, Rio Grande do Norte - século XIX)","Medeiros Neta, Olivia Morais","Educar em Revista; (51); 209-226","Educar em Revista","Português","2014","http://www.scielo.br/scielo.php?script=sci_arttext&pid=S0104-40602014000100013&lang=pt" 
"S0104-40602014000100014-scl","Encontros cotidianos e a pesquisa em Educação: relações raciais, experiência dialógica e processos de identificação","Passos, Mailsa Carla Pinto","Educar em Revista; (51); 227-242","Educar em Revista","Português","2014","http://www.scielo.br/scielo.php?script=sci_arttext&pid=S0104-40602014000100014&lang=pt" 
"S0104-40602014000100015-scl","Universalização da Educação Superior no Brasil: contrapontos e possibilidades","Lima, Paulo Gomes","Educar em Revista; (51); 243-264","Educar em Revista","Português","2014","http://www.scielo.br/scielo.php?script=sci_arttext&pid=S0104-40602014000100015&lang=pt" 
"S0104-40602014000100016-scl","Alunos ProUni e não ProUni nos cursos de licenciatura: evasão em foco","Felicetti, Vera Lucia, Fossatti, Paulo","Educar em Revista; (51); 265-282","Educar em Revista","Português","2014","http://www.scielo.br/scielo.php?script=sci_arttext&pid=S0104-40602014000100016&lang=pt" 
"S0104-40602014000100017-scl","A utilização das TIC nos processos de formação continuada e o envolvimento dos professores em comunidades de prática","Menezes, Glauco Gomes de","Educar em Revista; (51); 283-299","Educar em Revista","Português","2014","http://www.scielo.br/scielo.php?script=sci_arttext&pid=S0104-40602014000100017&lang=pt" 
"S1516-73132014000100003-scl","O modelo ondulatório como estratégia de promoção da evolução conceitual em tópicos sobre a luz em nível Médio","Silva, Jales de Aquino, Sousa, Célia Maria Soares Gomes de","Ciência &amp; Educação (Bauru); 20(1); 23-41","Ciência &amp; Educação (Bauru)","Português","2014","http://www.scielo.br/scielo.php?script=sci_arttext&pid=S1516-73132014000100003&lang=pt" 
"S1516-73132014000100002-scl","&quot;Como trabalham os cientistas?&quot;: potencialidades de uma atividade de escrita para a discussão acerca da natureza da ciência nas aulas de ciências","Faria, Cláudia, Freire, Sofia, Galvão, Cecília, Reis, Pedro, Figueiredo, Orlando","Ciência &amp; Educação (Bauru); 20(1); 1-22","Ciência &amp; Educação (Bauru)","Português","2014","http://www.scielo.br/scielo.php?script=sci_arttext&pid=S1516-73132014000100002&lang=pt" 
"S1516-73132014000100004-scl","Modelos didáticos na formação inicial de professores de física: uma apreciação na perspectiva da análise do discurso","Hygino, Cassiana Barreto, Moura, Sérgio Arruda de, Linhares, Marília Paixão","Ciência &amp; Educação (Bauru); 20(1); 43-59","Ciência &amp; Educação (Bauru)","Português","2014","http://www.scielo.br/scielo.php?script=sci_arttext&pid=S1516-73132014000100004&lang=pt" 
"S1516-73132014000100007-scl","La formulación de preguntas en el aula de clase: una evidencia de aprendizaje significativo crítico","López, Sonia, Veit, Eliane Angela, Araujo, Ives Solano","Ciência &amp; Educação (Bauru); 20(1); 117-132","Ciência &amp; Educação (Bauru)","Espanhol","2014","http://www.scielo.br/scielo.php?script=sci_arttext&pid=S1516-73132014000100007&lang=pt" 
"S1516-73132014000100006-scl","Álbum fotográfico: um mapa de cenários discursivos na produção acadêmica brasileira sobre aulas experimentais de Ciências","Cardoso, Livia de Rezende, Paraíso, Marlucy Alves","Ciência &amp; Educação (Bauru); 20(1); 83-115","Ciência &amp; Educação (Bauru)","Português","2014","http://www.scielo.br/scielo.php?script=sci_arttext&pid=S1516-73132014000100006&lang=pt" 
"S0104-40602014000100009-scl","A história dos estudantes &quot;excedentes&quot; nos anos 1960: a superlotação das universidades e um &quot;torvelinho de situações improvisadas&quot;","Braghini, Katya Mitsuko Zuquim","Educar em Revista; (51); 123-144","Educar em Revista","Português","2014","http://www.scielo.br/scielo.php?script=sci_arttext&pid=S0104-40602014000100009&lang=pt" 
"S0104-40602014000100008-scl","Reprimir y discriminar: la educación en la última dictadura cívico-militar en Argentina (1976-1983)","Pineau, Pablo","Educar em Revista; (51); 103-122","Educar em Revista","Espanhol","2014","http://www.scielo.br/scielo.php?script=sci_arttext&pid=S0104-40602014000100008&lang=pt" 
"S0104-40602014000100007-scl","A seleção brasileira de escritores nos livros didáticos dos anos 70","Bornatto, Suzete de Paula","Educar em Revista; (51); 85-101","Educar em Revista","Português","2014","http://www.scielo.br/scielo.php?script=sci_arttext&pid=S0104-40602014000100007&lang=pt" 
"S0104-40602014000100006-scl","Tempos, espaços e organização do trabalho escolar em três expressões de governos autoritários brasileiros: 1931, 1961 e 1971 - estudo histórico-jurídico comparado do ensino secundário","Pessanha, Eurize Caldas, Silva, Fabiany de Cássia Tavares","Educar em Revista; (51); 67-83","Educar em Revista","Português","2014","http://www.scielo.br/scielo.php?script=sci_arttext&pid=S0104-40602014000100006&lang=pt" 
"S0104-40602014000100005-scl","Dictadura chilena y sistema escolar: &quot;a otros dieron de verdad esa cosa llamada educación&quot;","Moreno-Doña, Alberto, Jiménez, Rodrigo Gamboa","Educar em Revista; (51); 51-66","Educar em Revista","Espanhol","2014","http://www.scielo.br/scielo.php?script=sci_arttext&pid=S0104-40602014000100005&lang=pt" 
"S0104-40602014000100004-scl","Reflexos reformistas: o ensino das humanidades na ditadura militar brasileira e as formas duvidosas de esquecer","Martins, Maria do Carmo","Educar em Revista; (51); 37-50","Educar em Revista","Português","2014","http://www.scielo.br/scielo.php?script=sci_arttext&pid=S0104-40602014000100004&lang=pt" 
"S0104-40602014000100003-scl","La educación en el franquismo (1936-1975)","Frago, Antonio Viñao","Educar em Revista; (51); 19-35","Educar em Revista","Espanhol","2014","http://www.scielo.br/scielo.php?script=sci_arttext&pid=S0104-40602014000100003&lang=pt" 
"S1984-63982014000100003-scl","Reflexos das políticas itinerantes nas diretrizes curriculares nacionais dos cursos de letras","Costa, Marco Antônio Margarido","Revista Brasileira de Linguística Aplicada; 14(1); 41-60","Revista Brasileira de Linguística Aplicada","Português","2014","http://www.scielo.br/scielo.php?script=sci_arttext&pid=S1984-63982014000100003&lang=pt" 
"S1414-81452014000100156-scl","Caracterização do termo humanização na assistência por profissionais de enfermagem","Chernicharo, Isis de Moraes, Silva, Fernanda Duarte da, Ferreira, Márcia de Assunção","Escola Anna Nery; 18(1); 156-162","Escola Anna Nery","Inglês, Português","2014","http://www.scielo.br/scielo.php?script=sci_arttext&pid=S1414-81452014000100156&lang=pt" 
"S1414-81452014000100054-scl","O diagnóstico precoce do câncer infantojuvenil: o caminho percorrido pelas famílias","Fermo, Vivian Costa, Lourençatto, Gabriella Norberto, Medeiros, Tiago dos Santos, Anders, Jane Cristina, Souza, Ana Izabel Jatobá de","Escola Anna Nery; 18(1); 54-59","Escola Anna Nery","Inglês, Português","2014","http://www.scielo.br/scielo.php?script=sci_arttext&pid=S1414-81452014000100054&lang=pt" 
"S1414-81452014000100096-scl","Caracterização do consumo de álcool de uma população adscrita à estratégia Saúde da Família","Jomar, Rafael Tavares, Abreu, Ângela Maria Mendes, Griep, Rosane Harter","Escola Anna Nery; 18(1); 96-100","Escola Anna Nery","Inglês, Português","2014","http://www.scielo.br/scielo.php?script=sci_arttext&pid=S1414-81452014000100096&lang=pt" 
"S1414-81452014000100112-scl","Uniforme como signo de uma nova identidade de enfermeira no Brasil (1923-1931)","Peres, Maria Angélica de Almeida, Padilha, Maria Itayra Coelho de Souza","Escola Anna Nery; 18(1); 112-121","Escola Anna Nery","Inglês, Português","2014","http://www.scielo.br/scielo.php?script=sci_arttext&pid=S1414-81452014000100112&lang=pt" 
"S1414-81452014000100025-scl","Estratégias de biossegurança dos trabalhadores da saúde no cuidado às pessoas com HIV/AIDS (1986-2006)","Villarinho, Mariana Vieira, Padilha, Maria Itayra","Escola Anna Nery; 18(1); 25-31","Escola Anna Nery","Inglês, Português","2014","http://www.scielo.br/scielo.php?script=sci_arttext&pid=S1414-81452014000100025&lang=pt" 
"S1414-81452014000100060-scl","Importância atribuida à rede de suporte social por mães com filhos em unidade intensiva","Molina, Rosemeire Cristina Moretto, Higarashi, Ieda Harumi, Marcon, Sonia Silva","Escola Anna Nery; 18(1); 60-67","Escola Anna Nery","Inglês, Português","2014","http://www.scielo.br/scielo.php?script=sci_arttext&pid=S1414-81452014000100060&lang=pt" 
"S1414-81452014000100068-scl","O familiar cuidador durante a hospitalização da criança: convivendo com normas e rotinas","Xavier, Daiani Modernel, Gomes, Giovana Calcagno, Salvador, Marli dos Santos","Escola Anna Nery; 18(1); 68-74","Escola Anna Nery","Inglês, Português","2014","http://www.scielo.br/scielo.php?script=sci_arttext&pid=S1414-81452014000100068&lang=pt" 
"S1984-63982014000100011-scl","O contexto das manifestações populares na Copa das Confederações: entre o dizer e o silenciar","Tomazi, Micheline Mattedi","Revista Brasileira de Linguística Aplicada; 14(1); 225-244","Revista Brasileira de Linguística Aplicada","Português","2014","http://www.scielo.br/scielo.php?script=sci_arttext&pid=S1984-63982014000100011&lang=pt" 
"S1984-63982014000100010-scl","O sintagma &quot;progressão continuada&quot; sob a lupa da análise do discurso: um caso de fórmula discursiva?","Silva e Teixeira, Rosana de Barros","Revista Brasileira de Linguística Aplicada; 14(1); 199-223","Revista Brasileira de Linguística Aplicada","Português","2014","http://www.scielo.br/scielo.php?script=sci_arttext&pid=S1984-63982014000100010&lang=pt" 
"S1414-81452014000100148-scl","Avaliação da capacitação dos enfermeiros em unidades básicas de saúde por meio da telenfermagem","Godoy, Solange Cervinho Bicalho, Guimarães, Eliane Marina Palhares, Assis, Driely Suzy Soares","Escola Anna Nery; 18(1); 148-155","Escola Anna Nery","Inglês, Português","2014","http://www.scielo.br/scielo.php?script=sci_arttext&pid=S1414-81452014000100148&lang=pt" 
"S1414-81452014000100143-scl","Avaliação da intensidade da dor e analgesia em pacientes no período pós-operatório de cirurgias ortopédicas","Barbosa, Maria Helena, Araújo, Nathália Ferreira de, Silva, Jaciara Aparecida Jesus da, Corrêa, Thaís Barbosa, Moreira, Tassiana Márcia, Andrade, Érica Vieira","Escola Anna Nery; 18(1); 143-147","Escola Anna Nery","Inglês, Português","2014","http://www.scielo.br/scielo.php?script=sci_arttext&pid=S1414-81452014000100143&lang=pt" 
"S1414-81452014000100107-scl","Caracterização da dor em mulheres após tratamento do câncer de mama","Ferreira, Vânia Tie Koga, Prado, Maria Antonieta Spinoso, Panobianco, Marislei Sanches, Gozzo, Thais de Oliveira, Almeida, Ana Maria de","Escola Anna Nery; 18(1); 107-111","Escola Anna Nery","Inglês, Português","2014","http://www.scielo.br/scielo.php?script=sci_arttext&pid=S1414-81452014000100107&lang=pt" 
"S1414-81452014000100101-scl","Centros de atenção psicossocial álcool/drogas: inserção e práticas dos profissionais de enfermagem","Vargas, Divane de, Bittencourt, Marina Nolli, Rocha, Fernanda Mota, Silva, Anna Carolina Oliveira","Escola Anna Nery; 18(1); 101-106","Escola Anna Nery","Inglês, Português","2014","http://www.scielo.br/scielo.php?script=sci_arttext&pid=S1414-81452014000100101&lang=pt" 
"S1414-81452014000100032-scl","Adesão à terapia antirretroviral e suas representações para pessoas vivendo com HIV/AIDS","Paschoal, Eduardo Pereira, Santo, Caren Camargo do Espírito, Gomes, Antônio Marcos Tosoli, Santos, Érick Igor dos, Oliveira, Denize Cristina de, Pontes, Ana Paula Munhen de","Escola Anna Nery; 18(1); 32-40","Escola Anna Nery","Inglês, Português","2014","http://www.scielo.br/scielo.php?script=sci_arttext&pid=S1414-81452014000100032&lang=pt" 
"S1414-81452014000100175-scl","Sofrimento humano e cuidado de enfermagem: múltiplas visões","Beserra, Eveline Pinheiro, Oliveira, Fernanda Celedonio de, Ramos, Islane Costa, Moreira, Rui Verlaine Oliveira, Alves, Maria Dalva Santos, Braga, Violante Augusta Batista","Escola Anna Nery; 18(1); 175-180","Escola Anna Nery","Inglês, Português","2014","http://www.scielo.br/scielo.php?script=sci_arttext&pid=S1414-81452014000100175&lang=pt" 
"S1414-81452014000100130-scl","Integralidade do cuidado em enfermagem para a mulher que vivenciou o aborto inseguro","Carvalho, Simone Mendes, Paes, Graciele Oroski","Escola Anna Nery; 18(1); 130-135","Escola Anna Nery","Inglês, Português","2014","http://www.scielo.br/scielo.php?script=sci_arttext&pid=S1414-81452014000100130&lang=pt" 
"S1414-81452014000100136-scl","Espiritualidade e religiosidade nos cuidados paliativos: conhecer para governar","Cervelin, Aline Fantin, Kruse, Maria Henriqueta Luce","Escola Anna Nery; 18(1); 136-142","Escola Anna Nery","Inglês, Português","2014","http://www.scielo.br/scielo.php?script=sci_arttext&pid=S1414-81452014000100136&lang=pt" 
"S1414-81452014000100082-scl","A testagem anti-HIV nos serviços de ginecologia do município do Rio de Janeiro","Araújo, Carla Luzia França, Aguiar, Priscila da Silva, Santos, Gleice Kelly Araújo dos, Oliveira, Maíra Guimarães Ponce de, Câmara, Lívia de Souza","Escola Anna Nery; 18(1); 82-89","Escola Anna Nery","Inglês, Português","2014","http://www.scielo.br/scielo.php?script=sci_arttext&pid=S1414-81452014000100082&lang=pt" 
"S1414-81452014000100163-scl","Tornando-se proficiente: o saber/fazer do enfermeiro de hemodiálise","Barbosa, Genesis de Souza, Valadares, Glaucia Valente","Escola Anna Nery; 18(1); 163-166","Escola Anna Nery","Inglês, Português","2014","http://www.scielo.br/scielo.php?script=sci_arttext&pid=S1414-81452014000100163&lang=pt" 
