"S0103-40142013000200018-scl","Relendo Carpeaux","Bosi, Alfredo","Estudos Avançados; 27(78); 279-290","Estudos Avançados","Português","2013","http://www.scielo.br/scielo.php?script=sci_arttext&pid=S0103-40142013000200018&lang=pt" 
"S1808-18512013000100019-scl","Errata","","Coluna/Columna; 12(1); 80-80","Coluna/Columna","Português","2013","http://www.scielo.br/scielo.php?script=sci_arttext&pid=S1808-18512013000100019&lang=pt" 
"S1414-462X2013000400008-scl","Aplicação da técnica de grupo focal em pesquisa da Rede-SANS sobre as ações de alimentação e nutrição na atenção básica em saúde","Vieira, Carla Maria, Santiago, Laís Sartori, Tavare, Patrícia Cristina Wesolowski, Brandt, Adriana, Negri, Flavia, Oliveira, Maria Rita Marques de","Cadernos Saúde Coletiva; 21(4); 407-413","Cadernos Saúde Coletiva","Português","2013","http://www.scielo.br/scielo.php?script=sci_arttext&pid=S1414-462X2013000400008&lang=pt" 
"S1414-462X2013000400014-scl","Leprosy reactions after release from multidrug therapy in an endemic cluster in Brazil: patient awareness of symptoms and self-perceived changes in life","Alencar, Maria de Jesus Freitas de, Barbosa, Jaqueline Caracas, Pereira, Thayza Miranda, Santos, Suen Oliveira, Eggens, Klaas Hendrik, Heukelbach, Jorg","Cadernos Saúde Coletiva; 21(4); 450-456","Cadernos Saúde Coletiva","Inglês","2013","http://www.scielo.br/scielo.php?script=sci_arttext&pid=S1414-462X2013000400014&lang=pt" 
"S1414-462X2013000400007-scl","Levantamento epidemiológico de cárie dentária em escolares de 5 e 12 anos de idade do município de Cascavel, PR","Berti, Marina, Furlanetto, Denise de Lima Costa, Walker, Marli Maria Schmitt, Baltazar, Mariângela Monteiro de Melo, Bianchi, Fabio José","Cadernos Saúde Coletiva; 21(4); 403-406","Cadernos Saúde Coletiva","Português","2013","http://www.scielo.br/scielo.php?script=sci_arttext&pid=S1414-462X2013000400007&lang=pt" 
"S1414-462X2013000400010-scl","Análise da taxa de utilização e perda de vacinas no programa nacional de imunização","Pereira, Diego Daniel dos Santos, Neves, Eduardo Borba, Gemelli, Mauro, Ulbricht, Leandra","Cadernos Saúde Coletiva; 21(4); 420-424","Cadernos Saúde Coletiva","Português","2013","http://www.scielo.br/scielo.php?script=sci_arttext&pid=S1414-462X2013000400010&lang=pt" 
"S1414-462X2013000400015-scl","Transtornos mentais comuns e uso de psicofármacos em mulheres","Vidal, Carlos Eduardo Leal, Yañez, Bárbara de Freitas Pereira, Chaves, Camille Villefort Silva, Yañez, Carolina de Freitas Pereira, Michalaros, Isabela Assis, Almeida, Lubiana Aparecida Sousa","Cadernos Saúde Coletiva; 21(4); 457-464","Cadernos Saúde Coletiva","Português","2013","http://www.scielo.br/scielo.php?script=sci_arttext&pid=S1414-462X2013000400015&lang=pt" 
"S0102-64452013000100003-scl","Introdução","Araujo, Cicero","Lua Nova: Revista de Cultura e Política; (88); 25-28","Lua Nova: Revista de Cultura e Política","Português","2013","http://www.scielo.br/scielo.php?script=sci_arttext&pid=S0102-64452013000100003&lang=pt" 
"S0102-64452013000100002-scl","Socialismo e democracia no marxismo de Carlos Nelson Coutinho (1943-2012)","Nogueira, Marco Aurélio","Lua Nova: Revista de Cultura e Política; (88); 11-21","Lua Nova: Revista de Cultura e Política","Português","2013","http://www.scielo.br/scielo.php?script=sci_arttext&pid=S0102-64452013000100002&lang=pt" 
"S0102-64452013000100001-scl","Apresentação","","Lua Nova: Revista de Cultura e Política; (88); 10-10","Lua Nova: Revista de Cultura e Política","Português","2013","http://www.scielo.br/scielo.php?script=sci_arttext&pid=S0102-64452013000100001&lang=pt" 
"S0102-64452013000100013-scl","O STF e a agenda pública nacional: de outro desconhecido a supremo protagonista?","Falcão, Joaquim, Oliveira, Fabiana Luci de","Lua Nova: Revista de Cultura e Política; (88); 429-469","Lua Nova: Revista de Cultura e Política","Português","2013","http://www.scielo.br/scielo.php?script=sci_arttext&pid=S0102-64452013000100013&lang=pt" 
"S0185-62862013000200005-mex","&quot;Son más que piedras&quot;: una biografía cultural de Los Guachimontones de Teuchitlán, basada en testimonios orales","Dansac, Yael","Trace (México, DF); (64); 55-68","Trace (México, DF)","Espanhol","2013","http://www.scielo.org.mx/scielo.php?script=sci_arttext&pid=S0185-62862013000200005&lang=pt" 
"S0185-62862013000200002-mex","El comercio exterior, la protoindustria y América Latina en el siglo XIX","Riojas, Carlos","Trace (México, DF); (64); 7-24","Trace (México, DF)","Espanhol","2013","http://www.scielo.org.mx/scielo.php?script=sci_arttext&pid=S0185-62862013000200002&lang=pt" 
"S1688-12732013000100008-ury","Evaluación perioperatoria de una paciente con un angioedema grave para una cirugía de coordinación","Ferrari Acosta, María Gabriela, Amoroso Cosimini, Leonel Ezequiel","Anestesia Analgesia Reanimación; 26(1); 8-8","Anestesia Analgesia Reanimación","Espanhol","2013","http://www.scielo.edu.uy/scielo.php?script=sci_arttext&pid=S1688-12732013000100008&lang=pt" 
"S1688-12732013000100006-ury","Manejo anestésico en un recién nacido portador de hernia diafragmática derecha bajo soporte ventilatorio de alta frecuencia oscilatoria.: Reporte de un caso clínico","","Anestesia Analgesia Reanimación; 26(1); 6-6","Anestesia Analgesia Reanimación","Espanhol","2013","http://www.scielo.edu.uy/scielo.php?script=sci_arttext&pid=S1688-12732013000100006&lang=pt" 
"S1688-12732013000100007-ury","Anafilaxia y anestesia","Cosimini, Leonel Ezequiel Amoroso, Ferrari Acosta, María Gabriela","Anestesia Analgesia Reanimación; 26(1); 7-7","Anestesia Analgesia Reanimación","Espanhol","2013","http://www.scielo.edu.uy/scielo.php?script=sci_arttext&pid=S1688-12732013000100007&lang=pt" 
"S1688-12732013000100004-ury","Anestesia subaracnoidea con ropivacaína hiperbárica versus bupivacaína hiperbárica asociadas a fentanilo para operación cesárea de urgencia.: Ensayo clínico controlado con asignación aleatoria","González Vásquez, Mariana, Calderon, Nicolás, Metz, Guillermo, Szwarc, Mariano","Anestesia Analgesia Reanimación; 26(1); 4-4","Anestesia Analgesia Reanimación","Espanhol","2013","http://www.scielo.edu.uy/scielo.php?script=sci_arttext&pid=S1688-12732013000100004&lang=pt" 
"S0185-62862013000100007-mex","Almacenamiento prehispánico del Norte de México al Altiplano Central","Pérez Pérez, Julia","Trace (México, DF); (63); 76-77","Trace (México, DF)","Espanhol","2013","http://www.scielo.org.mx/scielo.php?script=sci_arttext&pid=S0185-62862013000100007&lang=pt" 
"S0185-62862013000100005-mex","Organización política gay y espacio público","Balbuena Bello, Raúl, Ovalle Marroquín, Lilian Paola, Villegas Robertson, Carlos Felipe","Trace (México, DF); (63); 50-59","Trace (México, DF)","Espanhol","2013","http://www.scielo.org.mx/scielo.php?script=sci_arttext&pid=S0185-62862013000100005&lang=pt" 
"S0185-62862013000100003-mex","Conflicto social y reterritorialización: miradas cruzadas sobre movimientos rurales y regionalistas en Bolivia","Do Alto, Hervé, Fontana, Lorenza Belinda","Trace (México, DF); (63); 24-34","Trace (México, DF)","Espanhol","2013","http://www.scielo.org.mx/scielo.php?script=sci_arttext&pid=S0185-62862013000100003&lang=pt" 
"S0185-62862013000100004-mex","El descubrimiento de México por los japoneses: una mirada a través de sus textos geográficos","Vergara Laguna, José","Trace (México, DF); (63); 35-49","Trace (México, DF)","Espanhol","2013","http://www.scielo.org.mx/scielo.php?script=sci_arttext&pid=S0185-62862013000100004&lang=pt" 
"S0185-62862013000100006-mex","Les héros ne sont le patrimoine unique de personne: Les enjeux des célébrations du Bicentenaire de l&#039;Indépendance et du Centenaire de la Révolution mexicaine de 2010","Bordat, Élodie M.","Trace (México, DF); (63); 60-75","Trace (México, DF)","Francês","2013","http://www.scielo.org.mx/scielo.php?script=sci_arttext&pid=S0185-62862013000100006&lang=pt" 
"S0185-62862013000100002-mex","Migraciones laborales, derechos humanos y cooperación internacional: Cortadores de caña centroamericanos en la frontera México-Belice","García Ortega, Martha","Trace (México, DF); (63); 07-23","Trace (México, DF)","Espanhol","2013","http://www.scielo.org.mx/scielo.php?script=sci_arttext&pid=S0185-62862013000100002&lang=pt" 
"S0185-62862013000100008-mex","La práctica de la comunidad: Representación, ritual y reciprocidad en la Sierra Totonaca de México","","Trace (México, DF); (63); 78-78","Trace (México, DF)","Espanhol","2013","http://www.scielo.org.mx/scielo.php?script=sci_arttext&pid=S0185-62862013000100008&lang=pt" 
"S0185-62862013000100001-mex","Prólogo","Zúñiga, Víctor","Trace (México, DF); (63); 03-04","Trace (México, DF)","Espanhol","2013","http://www.scielo.org.mx/scielo.php?script=sci_arttext&pid=S0185-62862013000100001&lang=pt" 
"S1678-91992013000100307-scl","Conus vexillum venom induces oxidative stress in Ehrlich&#039;s ascites carcinoma cells: an insight into the mechanism of induction","Abdel-Rahman, Mohamed A, Abdel-Nabi, Ismail M, El-Naggar, Mohamed S, Abbas, Osama A, Strong, Peter N","Journal of Venomous Animals and Toxins including Tropical Diseases; 19(); 1-10","Journal of Venomous Animals and Toxins including Tropical Diseases","Inglês","2013","http://www.scielo.br/scielo.php?script=sci_arttext&pid=S1678-91992013000100307&lang=pt" 
"S1678-91992013000100201-scl","Isolated biomolecules of pharmacological interest in hemostasis from Cerastes cerastes venom","Chérifi, Fatah, Laraba-Djebari, Fatima","Journal of Venomous Animals and Toxins including Tropical Diseases; 19(); 1-6","Journal of Venomous Animals and Toxins including Tropical Diseases","Inglês","2013","http://www.scielo.br/scielo.php?script=sci_arttext&pid=S1678-91992013000100201&lang=pt" 
"S1678-91992013000100501-scl","Probable chronic renal failure caused by Lonomia caterpillar envenomation","Schmitberger, Poliana Abrantes, Fernandes, Tássia Clara, Santos, Robson Corrêa, de Assis, Rafael Campos, Gomes, Andréia Patrícia, Siqueira, Priscila Karina, Vitorino, Rodrigo Roger, de Mendonça, Eduardo Gomes, de Almeida Oliveira, Maria Goreti, Siqueira-Batista, Rodrigo","Journal of Venomous Animals and Toxins including Tropical Diseases; 19(); 1-4","Journal of Venomous Animals and Toxins including Tropical Diseases","Inglês","2013","http://www.scielo.br/scielo.php?script=sci_arttext&pid=S1678-91992013000100501&lang=pt" 
"S1678-91992013000100302-scl","In vivo evaluation of homeostatic effects of Echis carinatus snake venom in Iran","Salmanizadeh, Hossein, Babaie, Mahdi, Zolfagharian, Hossein","Journal of Venomous Animals and Toxins including Tropical Diseases; 19(); 1-8","Journal of Venomous Animals and Toxins including Tropical Diseases","Inglês","2013","http://www.scielo.br/scielo.php?script=sci_arttext&pid=S1678-91992013000100302&lang=pt" 
"S1678-91992013000100306-scl","Characteristics of hemolytic activity induced by skin secretions of the frog Kaloula pulchra hainana","Wei, Shuangshuang, Chi, Tingting, Meng, Aiyun, Chen, Congwei, An, Tianchen, Wang, Manchuriga, Zhang, Yingxia","Journal of Venomous Animals and Toxins including Tropical Diseases; 19(); 1-6","Journal of Venomous Animals and Toxins including Tropical Diseases","Inglês","2013","http://www.scielo.br/scielo.php?script=sci_arttext&pid=S1678-91992013000100306&lang=pt" 
"S1678-91992013000100310-scl","Humoral immune response in dogs and cats vaccinated against rabies in southeastern Brazil","Albas, Avelino, Picolo, Miléia Ricci, Soares, Célio Nereu, Bachega, Hugo Vagner Ulbano, Tarumoto, Mário Hissamitsu","Journal of Venomous Animals and Toxins including Tropical Diseases; 19(); 1-3","Journal of Venomous Animals and Toxins including Tropical Diseases","Inglês","2013","http://www.scielo.br/scielo.php?script=sci_arttext&pid=S1678-91992013000100310&lang=pt" 
"S1678-91992013000100308-scl","Toxins from the Caribbean sea anemone Bunodeopsis globulifera increase cisplatin-induced cytotoxicity of lung adenocarcinoma cells","Monroy-Estrada, Heidi I, Chirino, Yolanda I, Soria-Mercado, Irma E, Sánchez-Rodríguez, Judith","Journal of Venomous Animals and Toxins including Tropical Diseases; 19(); 1-9","Journal of Venomous Animals and Toxins including Tropical Diseases","Inglês","2013","http://www.scielo.br/scielo.php?script=sci_arttext&pid=S1678-91992013000100308&lang=pt" 
"S1678-91992013000100101-scl","What is the most dangerous snake?","McCue, Marshall D","Journal of Venomous Animals and Toxins including Tropical Diseases; 19(); 1-2","Journal of Venomous Animals and Toxins including Tropical Diseases","Inglês","2013","http://www.scielo.br/scielo.php?script=sci_arttext&pid=S1678-91992013000100101&lang=pt" 
"S1678-91992013000100403-scl","Sandflies (Diptera, Psychodidae) from forest areas in Botucatu municipality, central western São Paulo State, Brazil","Cutolo, André Antonio, Galati, Eunice Aparecida Bianchi, Von Zuben, Claudio José","Journal of Venomous Animals and Toxins including Tropical Diseases; 19(); 1-4","Journal of Venomous Animals and Toxins including Tropical Diseases","Inglês","2013","http://www.scielo.br/scielo.php?script=sci_arttext&pid=S1678-91992013000100403&lang=pt" 
"S1678-91992013000100001-scl","CEVAP journal towards a new phase","Barraviera, Benedito","Journal of Venomous Animals and Toxins including Tropical Diseases; 19(); 1-2","Journal of Venomous Animals and Toxins including Tropical Diseases","Inglês","2013","http://www.scielo.br/scielo.php?script=sci_arttext&pid=S1678-91992013000100001&lang=pt" 
"S1678-91992013000100202-scl","Injuries by marine and freshwater stingrays: history, clinical aspects of the envenomations and current status of a neglected problem in Brazil","Junior, Vidal Haddad, Cardoso, João Luiz Costa, Neto, Domingos Garrone","Journal of Venomous Animals and Toxins including Tropical Diseases; 19(); 1-11","Journal of Venomous Animals and Toxins including Tropical Diseases","Inglês","2013","http://www.scielo.br/scielo.php?script=sci_arttext&pid=S1678-91992013000100202&lang=pt" 
"S1678-91992013000100315-scl","Potentiation of a novel palladium (II) complex lethality with bee venom on the human T-cell acute lymphoblastic leukemia cell line (MOLT-4)","Safaeinejad, Zahra, Mohammad Nabiuni, , Nazari, Zahra","Journal of Venomous Animals and Toxins including Tropical Diseases; 19(); 1-7","Journal of Venomous Animals and Toxins including Tropical Diseases","Inglês","2013","http://www.scielo.br/scielo.php?script=sci_arttext&pid=S1678-91992013000100315&lang=pt" 
"S1678-91992013000100203-scl","Mad, bad and dangerous to know: the biochemistry, ecology and evolution of slow loris venom","Nekaris, K Anne-Isola, Moore, Richard S, Rode, E Johanna, Fry, Bryan G","Journal of Venomous Animals and Toxins including Tropical Diseases; 19(); 1-10","Journal of Venomous Animals and Toxins including Tropical Diseases","Inglês","2013","http://www.scielo.br/scielo.php?script=sci_arttext&pid=S1678-91992013000100203&lang=pt" 
"S1678-91992013000100311-scl","Resistance of cervical adenocarcinoma cells (HeLa) to venom from the scorpion Centruroides limpidus limpidus","Contreras-Ortiz, José María Eloy, Vázquez-Chagoyán, Juan Carlos, Martínez-Castañeda, José Simón, Estrada-Franco, José Guillermo, Aparicio-Burgos, José Esteban, Acosta-Dibarrat, Jorge, Barbabosa-Pliego, Alberto","Journal of Venomous Animals and Toxins including Tropical Diseases; 19(); 1-7","Journal of Venomous Animals and Toxins including Tropical Diseases","Inglês","2013","http://www.scielo.br/scielo.php?script=sci_arttext&pid=S1678-91992013000100311&lang=pt" 
"S1678-91992013000100102-scl","Dangerous snakes, deadly snakes and medically important snakes","Silva, Anjana","Journal of Venomous Animals and Toxins including Tropical Diseases; 19(); 1-2","Journal of Venomous Animals and Toxins including Tropical Diseases","Inglês","2013","http://www.scielo.br/scielo.php?script=sci_arttext&pid=S1678-91992013000100102&lang=pt" 
"S1678-91992013000100204-scl","Public health aspects of snakebite care in West Africa: perspectives from Nigeria","Habib, Abdulrazaq G","Journal of Venomous Animals and Toxins including Tropical Diseases; 19(); 1-14","Journal of Venomous Animals and Toxins including Tropical Diseases","Inglês","2013","http://www.scielo.br/scielo.php?script=sci_arttext&pid=S1678-91992013000100204&lang=pt" 
"S1678-91992013000100316-scl","A bradykinin-potentiating peptide (BPP-10c) from Bothrops jararaca induces changes in seminiferous tubules","Gilio, Joyce M, Portaro, Fernanda CV, Borella, Maria I, Lameu, Claudiana, Camargo, Antonio CM, Alberto-Silva, Carlos","Journal of Venomous Animals and Toxins including Tropical Diseases; 19(); 1-9","Journal of Venomous Animals and Toxins including Tropical Diseases","Inglês","2013","http://www.scielo.br/scielo.php?script=sci_arttext&pid=S1678-91992013000100316&lang=pt" 
"S1678-91992013000100503-scl","Hepatitis B virus surface antigen seroconversion in HIV-infected individual after pegylated interferon-alpha treatment: a case report","Delicio, Adriane Maira, Abati, Paulo Afonso Martins, Vigani, Aline Gonzalez","Journal of Venomous Animals and Toxins including Tropical Diseases; 19(); 1-4","Journal of Venomous Animals and Toxins including Tropical Diseases","Inglês","2013","http://www.scielo.br/scielo.php?script=sci_arttext&pid=S1678-91992013000100503&lang=pt" 
"S1678-91992013000100103-scl","Is the population of Crotalus durissus (Serpentes, Viperidae) expanding in Brazil?","Duarte, Marcelo Ribeiro, Menezes, Frederico Alcântara","Journal of Venomous Animals and Toxins including Tropical Diseases; 19(); 1-4","Journal of Venomous Animals and Toxins including Tropical Diseases","Inglês","2013","http://www.scielo.br/scielo.php?script=sci_arttext&pid=S1678-91992013000100103&lang=pt" 
"S1678-91992013000100317-scl","Effect of bee venom on IL-6, COX-2 and VEGF levels in polycystic ovarian syndrome induced in Wistar rats by estradiol valerate","Karimzadeh, Latifeh, Nabiuni, Mohammad, Kouchesfehani, Homa Mohseni, Adham, Hamed, Bagheri, Amir, Sheikholeslami, Azar","Journal of Venomous Animals and Toxins including Tropical Diseases; 19(); 1-8","Journal of Venomous Animals and Toxins including Tropical Diseases","Inglês","2013","http://www.scielo.br/scielo.php?script=sci_arttext&pid=S1678-91992013000100317&lang=pt" 
"S1678-91992013000100301-scl","Correlation between annual activity patterns of venomous snakes and rural people in the Niger Delta, southern Nigeria","Akani, Godfrey C, Ebere, Nwabueze, Franco, Daniel, Eniang, Edem A, Petrozzi, Fabio, Politano, Edoardo, Luiselli, Luca","Journal of Venomous Animals and Toxins including Tropical Diseases; 19(); 1-8","Journal of Venomous Animals and Toxins including Tropical Diseases","Inglês","2013","http://www.scielo.br/scielo.php?script=sci_arttext&pid=S1678-91992013000100301&lang=pt" 
"S1678-91992013000100402-scl","Decrease in hepatitis B prevalence among blood donors in Central-West Brazil","Lindenberg, Andréa de Siqueira Campos, Motta-Castro, Ana Rita Coimbra, Puga, Marco Antonio, Ortiz Tanaka, Tayana Serpa, Torres, Marina Sawada, Fernandes-Fitts, Sonia Maria, Cunha, Rivaldo Venancio","Journal of Venomous Animals and Toxins including Tropical Diseases; 19(); 1-7","Journal of Venomous Animals and Toxins including Tropical Diseases","Inglês","2013","http://www.scielo.br/scielo.php?script=sci_arttext&pid=S1678-91992013000100402&lang=pt" 
"S1678-91992013000100502-scl","Lesions caused by Africanized honeybee stings in three cattle in Brazil","Caldas, Saulo Andrade, Graça, Flávio Augusto Soares, de Barros, Júlia Soares Monteiro, Rolim, Márcia Farias, Peixoto, Tiago da Cunha, Peixoto, Paulo Vargas","Journal of Venomous Animals and Toxins including Tropical Diseases; 19(); 1-5","Journal of Venomous Animals and Toxins including Tropical Diseases","Inglês","2013","http://www.scielo.br/scielo.php?script=sci_arttext&pid=S1678-91992013000100502&lang=pt" 
"S1678-91992013000100305-scl","Effects of atropine and propranolol on lung inflammation in experimental envenomation: comparison of two buthidae venoms","Saidi, Hadjer, Adi-Bessalem, Sonia, Hammoudi-Triki, Djelila, Laraba-Djebari, Fatima","Journal of Venomous Animals and Toxins including Tropical Diseases; 19(); 1-7","Journal of Venomous Animals and Toxins including Tropical Diseases","Inglês","2013","http://www.scielo.br/scielo.php?script=sci_arttext&pid=S1678-91992013000100305&lang=pt" 
"S1678-91992013000100304-scl","Use of antivenoms for the treatment of envenomation by Elapidae snakes in Guinea, Sub-Saharan Africa","Baldé, Mamadou C, Chippaux, Jean-Philippe, Boiro, Mamadou Y, Stock, Roberto P, Massougbodji, Achille","Journal of Venomous Animals and Toxins including Tropical Diseases; 19(); 1-6","Journal of Venomous Animals and Toxins including Tropical Diseases","Inglês","2013","http://www.scielo.br/scielo.php?script=sci_arttext&pid=S1678-91992013000100304&lang=pt" 
"S1678-91992013000100309-scl","The Cuban scorpion Rhopalurus junceus (Scorpiones, Buthidae): component variations in venom samples collected in different geographical areas","Rodríguez-Ravelo, Rodolfo, Coronas, Fredy I V, Zamudio, Fernando Z, González-Morales, Lidia, López, Georgina Espinosa, Urquiola, Ariel Ruiz, Possani, Lourival D","Journal of Venomous Animals and Toxins including Tropical Diseases; 19(); 1-10","Journal of Venomous Animals and Toxins including Tropical Diseases","Inglês","2013","http://www.scielo.br/scielo.php?script=sci_arttext&pid=S1678-91992013000100309&lang=pt" 
"S1678-91992013000100401-scl","Effects of the European hornet ( Vespa crabro Linnaeus 1761) crude venom on its own species","Nadolski, Jerzy","Journal of Venomous Animals and Toxins including Tropical Diseases; 19(); 1-4","Journal of Venomous Animals and Toxins including Tropical Diseases","Inglês","2013","http://www.scielo.br/scielo.php?script=sci_arttext&pid=S1678-91992013000100401&lang=pt" 
"S1678-91992013000100303-scl","Comparison between two methods of scorpion venom milking in Morocco","Oukkache, Naoual, Chgoury, Fatima, Lalaoui, Mekki, Cano, Alejandro Alagón, Ghalim, Noreddine","Journal of Venomous Animals and Toxins including Tropical Diseases; 19(); 1-5","Journal of Venomous Animals and Toxins including Tropical Diseases","Inglês","2013","http://www.scielo.br/scielo.php?script=sci_arttext&pid=S1678-91992013000100303&lang=pt" 
"S1678-91992013000100313-scl","Toxoplasmosis, leptospirosis and brucellosis in stray dogs housed at the shelter in Umuarama municipality, Paraná, Brazil","Dreer, Márcia Küster de Paula, Gonçalves, Daniela Dib, Caetano, Isabel Cristina da Silva, Gerônimo, Edson, Menegas, Paulo Henrique, Bergo, Danilo, Lopes-Mori, Fabiana Maria Ruiz, Benitez, Aline, Freitas, Julio Cesar de, Evers, Fernanda, Navarro, Italmar Teodorico, Martins, Lisiane de Almeida","Journal of Venomous Animals and Toxins including Tropical Diseases; 19(); 1-5","Journal of Venomous Animals and Toxins including Tropical Diseases","Inglês","2013","http://www.scielo.br/scielo.php?script=sci_arttext&pid=S1678-91992013000100313&lang=pt" 
"S1678-91992013000100314-scl","Vasoconstrictor effect of Africanized honeybee (Apis mellifera L.) venom on rat aorta","Sousa, Paulo César P, Brito, Teresinha S, Freire, Daniel S, Ximenes, Rafael M, Magalhães, Pedro Jorge C, Monteiro, Helena SA, Alves, Renata S, Martins, Alice Maria C, Toyama, Daniela O, Toyama, Marcos H","Journal of Venomous Animals and Toxins including Tropical Diseases; 19(); 1-6","Journal of Venomous Animals and Toxins including Tropical Diseases","Inglês","2013","http://www.scielo.br/scielo.php?script=sci_arttext&pid=S1678-91992013000100314&lang=pt" 
"S1678-91992013000100312-scl","Hemolytic activity of venom from crown-of-thorns starfish Acanthaster planci spines","Lee, Chi-Chiu, Tsai, Wann-Sheng, Hsieh, Hernyi Justin, Hwang, Deng-Fwu","Journal of Venomous Animals and Toxins including Tropical Diseases; 19(); 1-8","Journal of Venomous Animals and Toxins including Tropical Diseases","Inglês","2013","http://www.scielo.br/scielo.php?script=sci_arttext&pid=S1678-91992013000100312&lang=pt" 
"S1678-91992013000100205-scl","The international view of envenoming in Brazil: myths and realities","Bochner, Rosany","Journal of Venomous Animals and Toxins including Tropical Diseases; 19(); 1-22","Journal of Venomous Animals and Toxins including Tropical Diseases","Inglês","2013","http://www.scielo.br/scielo.php?script=sci_arttext&pid=S1678-91992013000100205&lang=pt" 
"S1678-91992013000100206-scl","Challenges and perspectives of Chagas disease: a review","Pereira, Paulo Câmara Marques, Navarro, Elaine Cristina","Journal of Venomous Animals and Toxins including Tropical Diseases; 19(); 1-17","Journal of Venomous Animals and Toxins including Tropical Diseases","Inglês","2013","http://www.scielo.br/scielo.php?script=sci_arttext&pid=S1678-91992013000100206&lang=pt" 
"S1678-91992013000100318-scl","Cathepsin B/X is secreted by Echinometra lucunter sea urchin spines, a structure rich in granular cells and toxins","Sciani, Juliana Mozer, Antoniazzi, Marta Maria, Neves, Adriana da Costa, Pimenta, Daniel Carvalho","Journal of Venomous Animals and Toxins including Tropical Diseases; 19(); 1-8","Journal of Venomous Animals and Toxins including Tropical Diseases","Inglês","2013","http://www.scielo.br/scielo.php?script=sci_arttext&pid=S1678-91992013000100318&lang=pt" 
"S1807-59322013000300028-scl","","","Clinics; 68(3); 435-435","Clinics","Inglês","2013","http://www.scielo.br/scielo.php?script=sci_arttext&pid=S1807-59322013000300028&lang=pt" 
