"S0103-40142013000200018-scl","Relendo Carpeaux","Bosi, Alfredo","Estudos Avançados; 27(78); 279-290","Estudos Avançados","Português","2013","http://www.scielo.br/scielo.php?script=sci_arttext&pid=S0103-40142013000200018&lang=pt" 
"S1807-59322013000300005-scl","Is there a relationship between endothelial nitric oxide synthase gene polymorphisms and ankylosing spondylitis?","Sari, Ismail, Igci, Yusuf Ziya, Can, Gercek, Taylan, Ali, Solmaz, Dilek, Gogebakan, Bulent, Akar, Servet, Eslik, Zeynep, Bozkaya, Giray, Akkoc, Nurullah","Clinics; 68(3); 305-309","Clinics","Inglês","2013","http://www.scielo.br/scielo.php?script=sci_arttext&pid=S1807-59322013000300005&lang=pt" 
"S1807-59322013000300006-scl","Objective evaluation of plantar hyperhidrosis after sympathectomy","Wolosker, Nelson, Ishy, Augusto, Yazbek, Guilherme, Campos, Jose Ribas Milanez de, Kauffman, Paulo, Puech-Leão, Pedro, Jatene, Fabio Biscegli","Clinics; 68(3); 311-315","Clinics","Inglês","2013","http://www.scielo.br/scielo.php?script=sci_arttext&pid=S1807-59322013000300006&lang=pt" 
"S1807-59322013000300007-scl","Giant cell arteritis: a multicenter observational study in Brazil","Souza, Alexandre Wagner Silva de, Okamoto, Karine Yoshiye Kajiyama, Abrantes, Fabiano, Schau, Bruno, Bacchiega, Ana Beatriz Santos, Shinjo, Samuel Katsuyuki","Clinics; 68(3); 317-322","Clinics","Inglês","2013","http://www.scielo.br/scielo.php?script=sci_arttext&pid=S1807-59322013000300007&lang=pt" 
"S1807-59322013000300009-scl","Adverse reactions to antituberculosis drugs in Manguinhos, Rio de Janeiro, Brazil","Damasceno, Glauciene Santana, Guaraldo, Lusiele, Engstrom, Elyne Montenegro, Theme Filha, Mariza Miranda, Souza-Santos, Reinaldo, Vasconcelos, Ana Gloria Godoi, Rozenfeld, Suely","Clinics; 68(3); 329-337","Clinics","Inglês","2013","http://www.scielo.br/scielo.php?script=sci_arttext&pid=S1807-59322013000300009&lang=pt" 
"S1807-59322013000300012-scl","Zinc, vitamin A, and glutamine supplementation in Brazilian shantytown children at risk for diarrhea results in sex-specific improvements in verbal learning","Lima, Aldo A. M., Kvalsund, Michelle P., Souza, Paula P. E. de, Figueiredo, Ítalo L, Soares, Alberto M., Mota, Rosa M. S., Lima, Noélia L., Pinkerton, Relana C., Patrick, Peter P., Guerrant, Richard L., Oriá, Reinaldo B.","Clinics; 68(3); 351-358","Clinics","Inglês","2013","http://www.scielo.br/scielo.php?script=sci_arttext&pid=S1807-59322013000300012&lang=pt" 
"S1807-59322013000300013-scl","Association between muscle strength and the cardiopulmonary status of individuals living with HIV/AIDS","Raso, Vagner, Shephard, Roy J., Casseb, Jorge, Duarte, Alberto José da Silva, Silva, Paulo Roberto Santos, Greve, Júlia Maria D&#039;Andréa","Clinics; 68(3); 359-364","Clinics","Inglês","2013","http://www.scielo.br/scielo.php?script=sci_arttext&pid=S1807-59322013000300013&lang=pt" 
"S1807-59322013000300014-scl","The &#039;silence&#039; of silent brain infarctions may be related to chronic ischemic preconditioning and nonstrategic locations rather than to a small infarction size","Feng, Chao, Bai, Xue, Xu, Yu, Hua, Ting, Liu, Xue-Yuan","Clinics; 68(3); 365-369","Clinics","Inglês","2013","http://www.scielo.br/scielo.php?script=sci_arttext&pid=S1807-59322013000300014&lang=pt" 
"S1807-59322013000300016-scl","Fetuin-A levels in hyperthyroidism","Pamuk, Bariş Onder, Yilmaz, Hamiyet, Topcuoglu, Tugba, Bilgir, Oktay, Çalan, Ozlem, Pamuk, Gulseren, Ertugrul, Derun Taner","Clinics; 68(3); 379-383","Clinics","Inglês","2013","http://www.scielo.br/scielo.php?script=sci_arttext&pid=S1807-59322013000300016&lang=pt" 
"S1807-59322013000300018-scl","Blockade of CXCR1/2 chemokine receptors protects against brain damage in ischemic stroke in mice","Sousa, Larissa Fonseca da Cunha, Coelho, Fernanda Matos, Rodrigues, David Henrique, Campos, Alline Cristina, Barcelos, Luciola da Silva, Teixeira, Mauro Martins, Rachid, Milene Alvarenga, Teixeira, Antonio Lucio","Clinics; 68(3); 391-394","Clinics","Inglês","2013","http://www.scielo.br/scielo.php?script=sci_arttext&pid=S1807-59322013000300018&lang=pt" 
"S1807-59322013000300021-scl","What has changed in brachial plexus surgery?","Rezende, Marcelo Rosa de, Silva, Gustavo Bersani, Paula, Emygdio Jose Leomil de, Mattar Junior, Rames, Camargo, Olavo Pires de","Clinics; 68(3); 411-418","Clinics","Inglês","2013","http://www.scielo.br/scielo.php?script=sci_arttext&pid=S1807-59322013000300021&lang=pt" 
"S0103-73312013000100002-scl","Reinserção social de portadores de sofrimento psíquico: o olhar de usuários de um Centro de Atenção Psicossocial","Paranhos-Passos, Fernanda, Aires, Suely","Physis: Revista de Saúde Coletiva; 23(1); 13-31","Physis: Revista de Saúde Coletiva","Português","2013","http://www.scielo.br/scielo.php?script=sci_arttext&pid=S0103-73312013000100002&lang=pt" 
"S0103-73312013000100003-scl","Acesso e intersetorialidade: o acompanhamento de pessoas em situação de rua com transtorno mental grave","Borysow, Igor da Costa, Furtado, Juarez Pereira","Physis: Revista de Saúde Coletiva; 23(1); 33-50","Physis: Revista de Saúde Coletiva","Português","2013","http://www.scielo.br/scielo.php?script=sci_arttext&pid=S0103-73312013000100003&lang=pt" 
"S0103-73312013000100004-scl","A visão de usuários, familiares e profissionais acerca do empoderamento em saúde mental","Alves, Tarcísia Castro, Oliveira, Walter Ferreira de, Vasconcelos, Eduardo Mourão","Physis: Revista de Saúde Coletiva; 23(1); 51-71","Physis: Revista de Saúde Coletiva","Português","2013","http://www.scielo.br/scielo.php?script=sci_arttext&pid=S0103-73312013000100004&lang=pt" 
"S0103-73312013000100005-scl","Sexualidade e reprodução: discutindo gênero e integralidade na Atenção Primária à Saúde","Pinheiro, Thiago Félix, Couto, Márcia Thereza","Physis: Revista de Saúde Coletiva; 23(1); 73-92","Physis: Revista de Saúde Coletiva","Português","2013","http://www.scielo.br/scielo.php?script=sci_arttext&pid=S0103-73312013000100005&lang=pt" 
"S0103-73312013000100006-scl","Expectativas e sentimentos de mulheres que esperam por tratamento de reprodução humana","Fontenele, Claudia Valença, Tanaka, Ana Cristina D&#039;Andretta","Physis: Revista de Saúde Coletiva; 23(1); 93-108","Physis: Revista de Saúde Coletiva","Português","2013","http://www.scielo.br/scielo.php?script=sci_arttext&pid=S0103-73312013000100006&lang=pt" 
"S0103-73312013000100007-scl","Avaliação da atenção humanizada ao abortamento: um estudo de avaliabilidade","Rocha, Bianca Nunes Guedes do Amaral, Uchoa, Severina Alice da Costa","Physis: Revista de Saúde Coletiva; 23(1); 109-127","Physis: Revista de Saúde Coletiva","Português","2013","http://www.scielo.br/scielo.php?script=sci_arttext&pid=S0103-73312013000100007&lang=pt" 
"S0103-73312013000100008-scl","Discriminação racial e vulnerabilidade às DST/Aids: um estudo com adolescentes negras","Taquette, Stella R., Meirelles, Zilah Vieira","Physis: Revista de Saúde Coletiva; 23(1); 129-142","Physis: Revista de Saúde Coletiva","Português","2013","http://www.scielo.br/scielo.php?script=sci_arttext&pid=S0103-73312013000100008&lang=pt" 
"S0103-73312013000100010-scl","A gênese cerebral da imagem corporal: algumas considerações sobre o fenômeno dos membros fantasmas em Ramachandran","Silva, Sergio Gomes da","Physis: Revista de Saúde Coletiva; 23(1); 167-195","Physis: Revista de Saúde Coletiva","Português","2013","http://www.scielo.br/scielo.php?script=sci_arttext&pid=S0103-73312013000100010&lang=pt" 
"S0103-73312013000100012-scl","Promoção da saúde e redes de lideranças","Mendes, Rosilda, Bógus, Cláudia Maria, Westphal, Marcia Faria, Fernandez, Juan Carlos Aneiros","Physis: Revista de Saúde Coletiva; 23(1); 209-226","Physis: Revista de Saúde Coletiva","Português","2013","http://www.scielo.br/scielo.php?script=sci_arttext&pid=S0103-73312013000100012&lang=pt" 
"S0103-73312013000100013-scl","&quot;Tô sentindo nada&quot;: percepções de pacientes idosos sobre o tratamento da hipertensão arterial sistêmica","Leão e Silva, Leonardo Oliveira, Soares, Marina Mendes, Oliveira, Mericley Angela de, Rodrigues, Suely Maria, Machado, Carla Jorge, Dias, Carlos Alberto","Physis: Revista de Saúde Coletiva; 23(1); 227-242","Physis: Revista de Saúde Coletiva","Português","2013","http://www.scielo.br/scielo.php?script=sci_arttext&pid=S0103-73312013000100013&lang=pt" 
"S0103-73312013000100014-scl","Atenção em genética médica no SUS: a experiência de um município de médio porte","Vieira, Daniela Koeller Rodrigues, Attianezi, Margareth, Horovitz, Dafne D., Llerena Jr., Juan C.","Physis: Revista de Saúde Coletiva; 23(1); 243-261","Physis: Revista de Saúde Coletiva","Português","2013","http://www.scielo.br/scielo.php?script=sci_arttext&pid=S0103-73312013000100014&lang=pt" 
"S0103-73312013000100015-scl","Trabalho docente, readaptação e saúde: a experiência dos professores de uma universidade pública","Arbex, Ana Paula Santos, Souza, Katia Reis, Mendonça, André Luis Oliveira","Physis: Revista de Saúde Coletiva; 23(1); 263-284","Physis: Revista de Saúde Coletiva","Português","2013","http://www.scielo.br/scielo.php?script=sci_arttext&pid=S0103-73312013000100015&lang=pt" 
"S1414-98932013000100002-scl","Evidências de validade convergente-discriminante para a avaliação dos tipos profissionais de Holland (ATPH)","Noronha, Ana Paula Porto, Mansão, Camélia Santina Murgo, Silva, Marlene Alves da, Freitas, Patrícia Carla dos Santos, Pereira, Geruza Oliveira Aquino","Psicologia: Ciência e Profissão; 33(1); 04-15","Psicologia: Ciência e Profissão","Português","2013","http://www.scielo.br/scielo.php?script=sci_arttext&pid=S1414-98932013000100002&lang=pt" 
"S1414-98932013000100003-scl","Teorias sobre o amor no campo da Psicologia Social","Martins-Silva, Priscilla de Oliveira, Trindade, Zeidi Araujo, Silva Junior, Annor da","Psicologia: Ciência e Profissão; 33(1); 16-31","Psicologia: Ciência e Profissão","Português","2013","http://www.scielo.br/scielo.php?script=sci_arttext&pid=S1414-98932013000100003&lang=pt" 
"S1414-98932013000100004-scl","Escala tetrangular do amor: testando sua estrutura e invariância fatorial","Gouveia, Valdiney Veloso, Carvalho, Euclismária Alves Barreiro de, Santos, Francecirly Alexandre dos, Almeida, Mônica Rafaela de","Psicologia: Ciência e Profissão; 33(1); 32-45","Psicologia: Ciência e Profissão","Português","2013","http://www.scielo.br/scielo.php?script=sci_arttext&pid=S1414-98932013000100004&lang=pt" 
"S1414-98932013000100007-scl","Diálogos Bourdieu - Piaget: implicações para a Psicologia","Gutierrez, Denise Machado Duran, Mascarenhas, Suely Aparecida do Nascimento, Silva, Gisele Cristina Resende Fernandes da","Psicologia: Ciência e Profissão; 33(1); 74-83","Psicologia: Ciência e Profissão","Português","2013","http://www.scielo.br/scielo.php?script=sci_arttext&pid=S1414-98932013000100007&lang=pt" 
"S1414-98932013000100011-scl","A graduação em Psicologia prepara para o trabalho no hospital?","Torezan, Zeila Facci, Calheiros, Taís da Costa, Mandelli, Jéssica Pedrosa, Stumpf, Vanuccy Martins","Psicologia: Ciência e Profissão; 33(1); 132-145","Psicologia: Ciência e Profissão","Português","2013","http://www.scielo.br/scielo.php?script=sci_arttext&pid=S1414-98932013000100011&lang=pt" 
"S1414-98932013000100013-scl","O Psicólogo apoiador matricial: percepções e práticas na atenção básica","Freire, Francisca Marina de Souza, Pichelli, Ana Alayde Werba Saldanha","Psicologia: Ciência e Profissão; 33(1); 162-173","Psicologia: Ciência e Profissão","Português","2013","http://www.scielo.br/scielo.php?script=sci_arttext&pid=S1414-98932013000100013&lang=pt" 
"S1414-98932013000100014-scl","Loucura e trabalho no encontro entre saúde mental e economia solidária","Andrade, Márcia Campos, Burali, Maria Aparecida de Moraes, Vida, Aline, Fransozio, Michely Balladeli B., Santos, Raquel Zavatin dos","Psicologia: Ciência e Profissão; 33(1); 174-191","Psicologia: Ciência e Profissão","Português","2013","http://www.scielo.br/scielo.php?script=sci_arttext&pid=S1414-98932013000100014&lang=pt" 
"S1414-98932013000100015-scl","O servidor público no mundo do trabalho do século XXI","Ribeiro, Carla Vaz dos Santos, Mancebo, Deise","Psicologia: Ciência e Profissão; 33(1); 192-207","Psicologia: Ciência e Profissão","Português","2013","http://www.scielo.br/scielo.php?script=sci_arttext&pid=S1414-98932013000100015&lang=pt" 
"S1414-98932013000100016-scl","Medicalização dos desvios de comportamento na infância: aspectos positivos e negativos","Brzozowski, Fabíola Stolf, Caponi, Sandra Noemi Cucurullo de","Psicologia: Ciência e Profissão; 33(1); 208-221","Psicologia: Ciência e Profissão","Português","2013","http://www.scielo.br/scielo.php?script=sci_arttext&pid=S1414-98932013000100016&lang=pt" 
"S1414-98932013000100017-scl","O desafio da convivência: assessoria de diversidade e apoio aos cotistas (2004-2008)","Jesus, Jaqueline Gomes de","Psicologia: Ciência e Profissão; 33(1); 222-233","Psicologia: Ciência e Profissão","Português","2013","http://www.scielo.br/scielo.php?script=sci_arttext&pid=S1414-98932013000100017&lang=pt" 
"S1414-98932013000100018-scl","Vulnerabilidade e autonomia na pesquisa com adolescentes privados de liberdade","Zappe, Jana Gonçalves, Santos, Cristiane Rosa dos, Ferrão, Iara da Silva, Dias, Ana Cristina Garcia","Psicologia: Ciência e Profissão; 33(1); 234-247","Psicologia: Ciência e Profissão","Português","2013","http://www.scielo.br/scielo.php?script=sci_arttext&pid=S1414-98932013000100018&lang=pt" 
"S1414-98932013000200002-scl","Meio ambiente e água sob a perspectiva da teoria das representações sociais","Polli, Gislei Mocelin, Camargo, Brigido Vizeu","Psicologia: Ciência e Profissão; 33(2); 255-271","Psicologia: Ciência e Profissão","Português","2013","http://www.scielo.br/scielo.php?script=sci_arttext&pid=S1414-98932013000200002&lang=pt" 
"S1414-98932013000200003-scl","Organização sociopolítica de Psicólogas(os) na Bahia: formação das suas entidades de classe","Santos, Julianin Araujo, Pereira, Maiara Santos Targino, Oliveira, Andréia da Cruz, Jesus, Débora PiresViana de","Psicologia: Ciência e Profissão; 33(2); 272-282","Psicologia: Ciência e Profissão","Português","2013","http://www.scielo.br/scielo.php?script=sci_arttext&pid=S1414-98932013000200003&lang=pt" 
"S1414-98932013000200004-scl","Os recursos da memória de trabalho e suas influências na compreensão da leitura","Faria, Elaine Leporate Barroso, Mourão Júnior, Carlos Alberto","Psicologia: Ciência e Profissão; 33(2); 288-303","Psicologia: Ciência e Profissão","Português","2013","http://www.scielo.br/scielo.php?script=sci_arttext&pid=S1414-98932013000200004&lang=pt" 
"S1414-98932013000200008-scl","Psicologia da saúde crítica no contexto hospitalar","Carvalho, Denis Barros de","Psicologia: Ciência e Profissão; 33(2); 350-365","Psicologia: Ciência e Profissão","Português","2013","http://www.scielo.br/scielo.php?script=sci_arttext&pid=S1414-98932013000200008&lang=pt" 
"S1414-98932013000200010-scl","Notas sobre suicídio no trabalho à luz da teoria crítica da sociedade","Gomide, Ana Paula de Ávila","Psicologia: Ciência e Profissão; 33(2); 380-395","Psicologia: Ciência e Profissão","Português","2013","http://www.scielo.br/scielo.php?script=sci_arttext&pid=S1414-98932013000200010&lang=pt" 
"S1414-98932013000200011-scl","Sob a espada de Dâmocles: a prática de Psicólogas em Oncologia Pediátrica em Recife-Pe","Morais, Sílvia Raquel Santos de, Andrade, Ângela Nobre de","Psicologia: Ciência e Profissão; 33(2); 396-413","Psicologia: Ciência e Profissão","Português","2013","http://www.scielo.br/scielo.php?script=sci_arttext&pid=S1414-98932013000200011&lang=pt" 
"S1414-98932013000200012-scl","Criança não é manga, não amadurece: conceito de maturação na teoria histórico-cultural","Asbahr, Flávia da Silva Ferreira, Nascimento, Carolina Picchetti","Psicologia: Ciência e Profissão; 33(2); 414-427","Psicologia: Ciência e Profissão","Português","2013","http://www.scielo.br/scielo.php?script=sci_arttext&pid=S1414-98932013000200012&lang=pt" 
"S1414-98932013000200014-scl","A droga da obediência: medicalização, infância e biopoder: notas sobre clínica e política","Decotelli, Kely Magalhães, Bohre, Luiz Carlos Teixeira, Bicalho, Pedro Paulo Gastalho de","Psicologia: Ciência e Profissão; 33(2); 446-459","Psicologia: Ciência e Profissão","Português","2013","http://www.scielo.br/scielo.php?script=sci_arttext&pid=S1414-98932013000200014&lang=pt" 
"S1414-98932013000200015-scl","Os direitos da criança e do adolescente na percepção de adolescentes dos contextos urbano e rural","Alves, Cássia Ferrazza, Siqueira, Aline Cardoso","Psicologia: Ciência e Profissão; 33(2); 460-473","Psicologia: Ciência e Profissão","Português","2013","http://www.scielo.br/scielo.php?script=sci_arttext&pid=S1414-98932013000200015&lang=pt" 
"S1414-98932013000200017-scl","Aplicação de um programa de cessação do tabagismo com rodoviários urbanos","Lopes, Fernanda Machado, Peuker, Ana Carolina, Bizarro, Lisiane","Psicologia: Ciência e Profissão; 33(2); 490-499","Psicologia: Ciência e Profissão","Português","2013","http://www.scielo.br/scielo.php?script=sci_arttext&pid=S1414-98932013000200017&lang=pt" 
"S1414-98932013000200018-scl","Psicologia em ação no SUS: a interdisciplinaridade posta à prova","Couto, Leandra Lúcia Moraes, Schimith, Polyana Barbosa, Dalbello-Araujo, Maristela","Psicologia: Ciência e Profissão; 33(2); 500-511","Psicologia: Ciência e Profissão","Português","2013","http://www.scielo.br/scielo.php?script=sci_arttext&pid=S1414-98932013000200018&lang=pt" 
"S1415-47572013000400010-scl","Genomic growth curves of an outbred pig population","Silva, Fabyano Fonseca e, Resende, Marcos Deon V. de, Rocha, Gilson Silvério, Duarte, Darlene Ana S., Lopes, Paulo Sávio, Brustolini, Otávio J.B., Thus, Sander, Viana, José Marcelo S., Guimarães, Simone E.F.","Genetics and Molecular Biology; 36(4); 520-527","Genetics and Molecular Biology","Inglês","2013","http://www.scielo.br/scielo.php?script=sci_arttext&pid=S1415-47572013000400010&lang=pt" 
"S1415-47572013000400001-scl","microRNAs and the mammary gland: a new understanding of gene expression","Gigli, Isabel, Maizon, Daniel Omar","Genetics and Molecular Biology; 36(4); 465-474","Genetics and Molecular Biology","Inglês","2013","http://www.scielo.br/scielo.php?script=sci_arttext&pid=S1415-47572013000400001&lang=pt" 
"S1415-47572013000400012-scl","AFLP marker analysis revealing genetic structure of the tree Parapiptadenia rigida (Benth.) Brenan (Leguminosae-Mimosoideae) in the southern Brazilian Tropical Rainforest","Souza, Laís Bérgamo de, Ruas, Eduardo A., Rodrigues, Luana A., Ruas, Claudete F., Ruas, Paulo M.","Genetics and Molecular Biology; 36(4); 533-539","Genetics and Molecular Biology","Inglês","2013","http://www.scielo.br/scielo.php?script=sci_arttext&pid=S1415-47572013000400012&lang=pt" 
"S1415-47572013000400013-scl","Downregulation of caffeoyl-CoA O-methyltransferase (CCoAOMT) by RNA interference leads to reduced lignin production in maize straw","Li, Xiaoyu, Chen, Wenjuan, Zhao, Yang, Xiang, Yan, Jiang, Haiyang, Zhu, Suwen, Cheng, Beijiu","Genetics and Molecular Biology; 36(4); 540-546","Genetics and Molecular Biology","Inglês","2013","http://www.scielo.br/scielo.php?script=sci_arttext&pid=S1415-47572013000400013&lang=pt" 
"S1415-47572013000400014-scl","The genetic base of Brazilian soybean cultivars: evolution over time and breeding implications","Wysmierski, Philip Traldi, Vello, Natal Antonio","Genetics and Molecular Biology; 36(4); 547-555","Genetics and Molecular Biology","Inglês","2013","http://www.scielo.br/scielo.php?script=sci_arttext&pid=S1415-47572013000400014&lang=pt" 
"S1415-47572013000400003-scl","Association between the g.296596G &gt; A genetic variant of RELN gene and susceptibility to autism in a Chinese Han population","Fu, Xiaoyan, Mei, Zhu, Sun, Lixin","Genetics and Molecular Biology; 36(4); 486-489","Genetics and Molecular Biology","Inglês","2013","http://www.scielo.br/scielo.php?script=sci_arttext&pid=S1415-47572013000400003&lang=pt" 
"S1415-47572013000400002-scl","Mantel test in population genetics","Diniz-Filho, José Alexandre F., Soares, Thannya N., Lima, Jacqueline S., Dobrovolski, Ricardo, Landeiro, Victor Lemes, Telles, Mariana Pires de Campos, Rangel, Thiago F., Bini, Luis Mauricio","Genetics and Molecular Biology; 36(4); 475-485","Genetics and Molecular Biology","Inglês","2013","http://www.scielo.br/scielo.php?script=sci_arttext&pid=S1415-47572013000400002&lang=pt" 
"S1415-47572013000400016-scl","Genetic and epigenetic effects of salinity on in vitro growth of barley","Demirkiran, Aykut, Marakli, Sevgi, Temel, Aslihan, Gozukirmizi, Nermin","Genetics and Molecular Biology; 36(4); 566-570","Genetics and Molecular Biology","Inglês","2013","http://www.scielo.br/scielo.php?script=sci_arttext&pid=S1415-47572013000400016&lang=pt" 
"S1415-47572013000400018-scl","Molecular evidence for a recent demographic expansion in the puma (Puma concolor) (Mammalia, Felidae)","Matte, Eunice M., Castilho, Camila S., Miotto, Renata A., Sana, Denis A., Johnson, Warren E., O&#039;Brien, Stephen J., Freitas, Thales R. O. de, Eizirik, Eduardo","Genetics and Molecular Biology; 36(4); 586-597","Genetics and Molecular Biology","Inglês","2013","http://www.scielo.br/scielo.php?script=sci_arttext&pid=S1415-47572013000400018&lang=pt" 
"S1415-47572013000400019-scl","Spatial and temporal population genetic variation and structure of Nothotsuga longibracteata (Pinaceae), a relic conifer species endemic to subtropical China","Qiu, Yingjun, Liu, Yifei, Kang, Ming, Yi, Guanmei, Huang, Hongwen","Genetics and Molecular Biology; 36(4); 598-607","Genetics and Molecular Biology","Inglês","2013","http://www.scielo.br/scielo.php?script=sci_arttext&pid=S1415-47572013000400019&lang=pt" 
"S1405-10792013000400006-mex","La confianza y la colaboración en proyectos interorganizacionales de tecnologías de información en el sector público","Luna-Reyes, Luis Felipe","Gestión y política pública; 22(spe); 171-210","Gestión y política pública","Espanhol","2013","http://www.scielo.org.mx/scielo.php?script=sci_arttext&pid=S1405-10792013000400006&lang=pt" 
"S1405-10792013000400004-mex","El gobierno electrónico y la rendición de cuentas en la administración regional y estatal: An International Comparison","Lara Martínez, Marco Antonio, Pina Martínez, Vicente, Torres Pradas, Lourdes","Gestión y política pública; 22(spe); 105-135","Gestión y política pública","Espanhol","2013","http://www.scielo.org.mx/scielo.php?script=sci_arttext&pid=S1405-10792013000400004&lang=pt" 
"S1405-10792013000400005-mex","Las tecnologías de la información y comunicación (TIC) como recurso común: Coordinación, competencia y brecha digital en ocho municipios de Oaxaca","Chávez-Ángeles, Manuel Gerardo, Sánchez-Medina, Patricia S.","Gestión y política pública; 22(spe); 137-170","Gestión y política pública","Espanhol","2013","http://www.scielo.org.mx/scielo.php?script=sci_arttext&pid=S1405-10792013000400005&lang=pt" 
"S1405-10792013000400002-mex","Avances en gobierno electrónico: La conexión entre práctica, conocimiento e investigación","Dawes, Sharon S.","Gestión y política pública; 22(spe); 49-67","Gestión y política pública","Espanhol","2013","http://www.scielo.org.mx/scielo.php?script=sci_arttext&pid=S1405-10792013000400002&lang=pt" 
"S1405-10792013000400010-mex","","Sandoval Almazán, Rodrigo","Gestión y política pública; 22(spe); 333-337","Gestión y política pública","Espanhol","2013","http://www.scielo.org.mx/scielo.php?script=sci_arttext&pid=S1405-10792013000400010&lang=pt" 
"S1405-10792013000400011-mex","","Rojas-Martín, Francisco","Gestión y política pública; 22(spe); 338-343","Gestión y política pública","Espanhol","2013","http://www.scielo.org.mx/scielo.php?script=sci_arttext&pid=S1405-10792013000400011&lang=pt" 
"S1405-10792013000400012-mex","","Quintanilla Mendoza, Gabriela","Gestión y política pública; 22(spe); 343-348","Gestión y política pública","Espanhol","2013","http://www.scielo.org.mx/scielo.php?script=sci_arttext&pid=S1405-10792013000400012&lang=pt" 
"S1405-10792013000400009-mex","Herramientas Web 2.0 para la participación pública a través de los sitios de Internet del gobierno","Karkin, Naci","Gestión y política pública; 22(spe); 307-331","Gestión y política pública","Espanhol","2013","http://www.scielo.org.mx/scielo.php?script=sci_arttext&pid=S1405-10792013000400009&lang=pt" 
"S1405-10792013000400008-mex","El estudio de la funcionalidad de los portales gubernamentales: Una propuesta metodológica desde la e-salud","Bouzas-Lorenzo, Ramón, Mahou Lago, Xosé María","Gestión y política pública; 22(spe); 259-305","Gestión y política pública","Espanhol","2013","http://www.scielo.org.mx/scielo.php?script=sci_arttext&pid=S1405-10792013000400008&lang=pt" 
"S1405-10792013000400001-mex","Gobierno electrónico, gestión y políticas públicas: Estado actual y tendencias futuras en América Latina","Criado, J. Ignacio, Gil-García, J. Ramón","Gestión y política pública; 22(spe); 03-48","Gestión y política pública","Espanhol","2013","http://www.scielo.org.mx/scielo.php?script=sci_arttext&pid=S1405-10792013000400001&lang=pt" 
"S1405-10792013000400003-mex","Los modelos de gobierno electrónico y sus fases de desarrollo: Un análisis desde la teoría política","Villoria, Manuel, Ramírez Alujas, Álvaro","Gestión y política pública; 22(spe); 69-103","Gestión y política pública","Espanhol","2013","http://www.scielo.org.mx/scielo.php?script=sci_arttext&pid=S1405-10792013000400003&lang=pt" 
