"S0103-40142013000200018-scl","Relendo Carpeaux","Bosi, Alfredo","Estudos Avançados; 27(78); 279-290","Estudos Avançados","Português","2013","http://www.scielo.br/scielo.php?script=sci_arttext&pid=S0103-40142013000200018&lang=pt" 
"S0103-40142013000200013-scl","Sustentabilidade da produção de etanol de cana-de-açúcar no Estado de São Paulo","Rodrigues Filho, Saulo, Juliani, Antonio José","Estudos Avançados; 27(78); 195-212","Estudos Avançados","Português","2013","http://www.scielo.br/scielo.php?script=sci_arttext&pid=S0103-40142013000200013&lang=pt" 
"S0103-40142013000200015-scl","Política energética","Sauer, Ildo","Estudos Avançados; 27(78); 239-264","Estudos Avançados","Português","2013","http://www.scielo.br/scielo.php?script=sci_arttext&pid=S0103-40142013000200015&lang=pt" 
"S0103-40142013000100002-scl","Tempo de cérebro","Ribeiro, Sidarta","Estudos Avançados; 27(77); 07-22","Estudos Avançados","Português","2013","http://www.scielo.br/scielo.php?script=sci_arttext&pid=S0103-40142013000100002&lang=pt" 
"S0103-40142013000100004-scl","Componentes funcionais da memória visuoespacial","Galera, Cesar, Garcia, Ricardo Basso, Vasques, Rafael","Estudos Avançados; 27(77); 29-44","Estudos Avançados","Português","2013","http://www.scielo.br/scielo.php?script=sci_arttext&pid=S0103-40142013000100004&lang=pt" 
"S0103-40142013000100005-scl","A visão através dos contrastes","Souza, Givago da Silva, Lacerda, Eliza Maria da Costa Brito, Silveira, Vladímir de Aquino, Araújo, Carolina dos Santos, Silveira, Luiz Carlos de Lima","Estudos Avançados; 27(77); 45-60","Estudos Avançados","Português","2013","http://www.scielo.br/scielo.php?script=sci_arttext&pid=S0103-40142013000100005&lang=pt" 
"S0103-40142013000100006-scl","Glia: dos velhos conceitos às novas funções de hoje e as que ainda virão","Gomes, Flávia Carvalho Alcantara, Tortelli, Vanessa Pereira, Diniz, Luan","Estudos Avançados; 27(77); 61-84","Estudos Avançados","Português","2013","http://www.scielo.br/scielo.php?script=sci_arttext&pid=S0103-40142013000100006&lang=pt" 
"S0103-40142013000100017-scl","Césio-137, um drama recontado","Vieira, Suzane de Alencar","Estudos Avançados; 27(77); 217-236","Estudos Avançados","Português","2013","http://www.scielo.br/scielo.php?script=sci_arttext&pid=S0103-40142013000100017&lang=pt" 
"S0103-40142013000100018-scl","Acumulação sistêmica, poupança externa e rentismo: observações sobre o caso brasileiro","Paulani, Leda","Estudos Avançados; 27(77); 237-264","Estudos Avançados","Português","2013","http://www.scielo.br/scielo.php?script=sci_arttext&pid=S0103-40142013000100018&lang=pt" 
"S0103-40142013000100020-scl","Portella, intelectual do nosso tempo (e de outros tempos)","Mota, Carlos Guilherme","Estudos Avançados; 27(77); 281-298","Estudos Avançados","Português","2013","http://www.scielo.br/scielo.php?script=sci_arttext&pid=S0103-40142013000100020&lang=pt" 
"S0103-40142013000100021-scl","Jorge de Lima no contexto da poesia negra americana","Camilo, Vagner","Estudos Avançados; 27(77); 299-318","Estudos Avançados","Português","2013","http://www.scielo.br/scielo.php?script=sci_arttext&pid=S0103-40142013000100021&lang=pt" 
"S0103-40142013000100022-scl","Carpeaux: mediador entre a literatura das &quot;duas Espanhas&quot; e o Brasil","Marco, Valeria De","Estudos Avançados; 27(77); 319-332","Estudos Avançados","Português","2013","http://www.scielo.br/scielo.php?script=sci_arttext&pid=S0103-40142013000100022&lang=pt" 
"S0103-40142013000100023-scl","Sarmiento e o romantismo no Rio da Prata","Molina, Diego A.","Estudos Avançados; 27(77); 333-348","Estudos Avançados","Português","2013","http://www.scielo.br/scielo.php?script=sci_arttext&pid=S0103-40142013000100023&lang=pt" 
"S0104-14282013000100012-scl","Logística reversa dos pneus usados no Brasil","Lagarinhos, Carlos A. F., Tenório, Jorge A. S.","Polímeros; 23(1); 49-58","Polímeros","Português","2013","http://www.scielo.br/scielo.php?script=sci_arttext&pid=S0104-14282013000100012&lang=pt" 
"S0104-14282013000100020-scl","Blendas PHB/copoliésteres biodegradáveis : biodegradação em solo","Casarin, Suzan A., Agnelli, José A. M., Malmonge, Sônia M., Rosário, Francisco","Polímeros; 23(1); 115-122","Polímeros","Português","2013","http://www.scielo.br/scielo.php?script=sci_arttext&pid=S0104-14282013000100020&lang=pt" 
"S0104-14282013000100015-scl","Caracterização morfológica de nanomembranas de poliamida-66 dopadas com grafeno obtidas por electrospinning","Ávila Júnior, José de, Ávila, Antônio Ferreira, Triplett, Matt H.","Polímeros; 23(1); 74-81","Polímeros","Português","2013","http://www.scielo.br/scielo.php?script=sci_arttext&pid=S0104-14282013000100015&lang=pt" 
"S0104-14282013000100022-scl","Reciclagem de embalagens plásticas flexíveis: contribuição da identificação correta","Coltro, Leda, Duarte, Leda C.","Polímeros; 23(1); 128-134","Polímeros","Português","2013","http://www.scielo.br/scielo.php?script=sci_arttext&pid=S0104-14282013000100022&lang=pt" 
"S0104-14282013000100021-scl","Efeito da hibridização de montmorilonita e celulose II sobre as propriedades mecânicas de nanocompósitos de borracha natural","Mariano, Roberta M., Nunes, Regina C. R., Visconte, Leila L. Y., Altstaedt, Volker","Polímeros; 23(1); 123-127","Polímeros","Português","2013","http://www.scielo.br/scielo.php?script=sci_arttext&pid=S0104-14282013000100021&lang=pt" 
"S0104-14282013000100003-scl","Influence of hydroxypropyl cellulose on molecular relaxations of epoxy-amine networks","Miranda, Maria Inez G., Samios, Dimitrios, Freitas, Liane de L., Bica, Clara I. D.","Polímeros; 23(1); 1-6","Polímeros","Inglês","2013","http://www.scielo.br/scielo.php?script=sci_arttext&pid=S0104-14282013000100003&lang=pt" 
"S0104-14282013000100011-scl","Propriedades mecânicas e molhabilidade de filmes de zeínas extraídas de glúten de milho","Forato, Lucimara A., Britto, Douglas de, Scramin, Juliana A., Colnago, Luiz A., Assis, Odilio B. G.","Polímeros; 23(1); 42-48","Polímeros","Português","2013","http://www.scielo.br/scielo.php?script=sci_arttext&pid=S0104-14282013000100011&lang=pt" 
"S0104-14282013000100018-scl","Estudo experimental do processo de rotomoldagem de PELBD: efeitos sobre a morfologia e estabilidade dimensional","Comisso, Tiago Boni, Lima, Carlos Alberto Silva de, Carvalho, Benjamim de Melo","Polímeros; 23(1); 97-107","Polímeros","Português","2013","http://www.scielo.br/scielo.php?script=sci_arttext&pid=S0104-14282013000100018&lang=pt" 
"S0104-14282013000100019-scl","Influência da concentração e purificação da argila na estrutura e permeação ao vapor de água de nanocompósitos PEBDL/bentonita","Silva, Eduardo M., Coutinho, M Goretti F., Costa, Raquel B., Carvalho, Laura H. de, Canedo, Eduardo L.","Polímeros; 23(1); 108-114","Polímeros","Português","2013","http://www.scielo.br/scielo.php?script=sci_arttext&pid=S0104-14282013000100019&lang=pt" 
"S0104-14282013000100006-scl","AFM and XRD characterization of silver nanoparticles films deposited on the surface of DGEBA epoxy resin by ion sputtering","Andrade, José Elisandro de, Machado, Rogério, Macêdo, Marcelo Andrade, Cunha, Frederico Guilherme Carvalho","Polímeros; 23(1); 19-23","Polímeros","Inglês","2013","http://www.scielo.br/scielo.php?script=sci_arttext&pid=S0104-14282013000100006&lang=pt" 
"S0104-14282013000100016-scl","Síntese e caracterização de copolímeros reticulados à base de estireno, divinilbenzeno e metacrilato de metila com propriedades magnéticas","Souza, Flavio S., Costa, Marcos A. S., Maria, Luiz Claudio de Santa, Mello, Ivana L., Silva, Manoel R., Wang, Shu H.","Polímeros; 23(1); 82-90","Polímeros","Português","2013","http://www.scielo.br/scielo.php?script=sci_arttext&pid=S0104-14282013000100016&lang=pt" 
"S0104-14282013000100009-scl","Starch/polyester films: simultaneous optimisation of the properties for the production of biodegradable plastic bags","Olivato, J. B., Grossmann, M. V. E., Bilck, A. P., Yamashita, F., Oliveira, L. M.","Polímeros; 23(1); 32-36","Polímeros","Inglês","2013","http://www.scielo.br/scielo.php?script=sci_arttext&pid=S0104-14282013000100009&lang=pt" 
"S0104-14282013000300001-scl","Cellulose-reinforced composites: from micro-to nanoscale","Dufresne, Alain, Belgacem, Mohamed N.","Polímeros; 23(3); 277-286","Polímeros","Inglês","2013","http://www.scielo.br/scielo.php?script=sci_arttext&pid=S0104-14282013000300001&lang=pt" 
"S0104-14282013000300002-scl","Polysaccharide-based biomaterials with antimicrobial and antioxidant properties","Coma, Véronique","Polímeros; 23(3); 287-297","Polímeros","Inglês","2013","http://www.scielo.br/scielo.php?script=sci_arttext&pid=S0104-14282013000300002&lang=pt" 
"S0104-14282013000300016-scl","Estudo do efeito da adição de PP reciclado nas propriedades mecânicas e de escoamento de misturas de PP/EPDM","Santos, Luciene da S., Silva, Antonio H. Monteiro da F. T. da, Pacheco, Elen B. A. V., Silva, Ana L. N. da","Polímeros; 23(3); 389-394","Polímeros","Português","2013","http://www.scielo.br/scielo.php?script=sci_arttext&pid=S0104-14282013000300016&lang=pt" 
"S0104-14282013000300021-scl","Despolimerização química de PET grau Garrafa pós-consumo na presença de um catalisador catiônico, o brometo de hexadeciltrimetrilamônio (CTAB)","Vanini, Gabriela, Castro, Eustáquio V. R. de, Silva Filho, Eloi Alves da, Romão, Wanderson","Polímeros; 23(3); 425-431","Polímeros","Português","2013","http://www.scielo.br/scielo.php?script=sci_arttext&pid=S0104-14282013000300021&lang=pt" 
"S0104-14282013000300017-scl","Efeito do óleo de linhaça e do óleo de amendoim sobre a vulcanização da borracha natural (NR). parte I: modelo generalizado","Bezerra, Alexandre, Santos, Alex. C. S., Costa, Helson M. da, Ramos, Valéria D., Costa, Helson M. da","Polímeros; 23(3); 395-401","Polímeros","Português","2013","http://www.scielo.br/scielo.php?script=sci_arttext&pid=S0104-14282013000300017&lang=pt" 
"S0104-14282013000300018-scl","Imunomodulação de fagócitos do sangue humano pelo extrato de Strychnos pseudoquina ST. HILL adsorvido em microesferas de Polietilenoglicol","Côrtes, Mayra Aparecida, França, Eduardo Luzía, Reinaque, Ana Paula Barcelos, Scherer, Edson Fredulin, Honorio-França, Adenilda Cristina","Polímeros; 23(3); 402-409","Polímeros","Português","2013","http://www.scielo.br/scielo.php?script=sci_arttext&pid=S0104-14282013000300018&lang=pt" 
"S0104-14282013000300008-scl","Influence of the polyhedral oligomeric silsesquioxane n-phenylaminopropyl: POSS in the thermal stability and the glass transition temperature of epoxy resin","Pistor, Vinícius, Soares, Bluma Guenther, Mauler, Raquel Santos","Polímeros; 23(3); 331-338","Polímeros","Inglês","2013","http://www.scielo.br/scielo.php?script=sci_arttext&pid=S0104-14282013000300008&lang=pt" 
"S0104-14282013000300019-scl","Efeito da montmorilonita organifílica na compatibilização e nas propriedades morfológicas, mecânicas e térmicas de blendas de PA6/ PEBD","Coelho, Paulo Henrique da Silva Leite, Morales, Ana Rita","Polímeros; 23(3); 410-416","Polímeros","Português","2013","http://www.scielo.br/scielo.php?script=sci_arttext&pid=S0104-14282013000300019&lang=pt" 
"S0104-14282013000300020-scl","Avaliação comparativa das propriedades de xantanas produzidas pelo patovar pruni e clairana com xantana comercial para predição de uso","Oliveira, Patrícia D., Vendruscolo, Claire T., Borges, Caroline D., Michel, Ricardo C., Lomba, Rosana T.","Polímeros; 23(3); 417-424","Polímeros","Português","2013","http://www.scielo.br/scielo.php?script=sci_arttext&pid=S0104-14282013000300020&lang=pt" 
"S0104-14282013000300004-scl","UV and gamma irradiation effects on surface properties of polyurethane derivate from castor oil","Azevedo, Elaine C., Nascimento, Eduardo M., Chierice, Gilberto O., Claro Neto, Salvador, Lepienski, Carlos M.","Polímeros; 23(3); 305-311","Polímeros","Inglês","2013","http://www.scielo.br/scielo.php?script=sci_arttext&pid=S0104-14282013000300004&lang=pt" 
"S0104-14282013000300009-scl","Effect of the addition of soy lecithin and Yucca schidigera extract on the properties of gelatin and glycerol based biodegradable films","Dias, Tatiana P., Grosso, Carlos R. F., Andreuccetti, Caroline, Carvalho, Rosemary A. de, Galicia-García, Tomás, Martinez-Bustos, Fernando","Polímeros; 23(3); 339-345","Polímeros","Inglês","2013","http://www.scielo.br/scielo.php?script=sci_arttext&pid=S0104-14282013000300009&lang=pt" 
"S0104-14282013000300005-scl","Effect of compatibilization and reprocessing on the isothermal crystallization kinetics of polypropylene/wood flour composites","Rodrigues, Arieny, Carvalho, Benjamim de M., Pinheiro, Luís A., Bretãs, Rosário E. S., Canevarolo, Sebastião V., Marini, Juliano","Polímeros; 23(3); 312-319","Polímeros","Inglês","2013","http://www.scielo.br/scielo.php?script=sci_arttext&pid=S0104-14282013000300005&lang=pt" 
"S0104-14282013000400012-scl","Reticulação de plastissóis de PVC utilizando resina epóxi polifuncional: síntese e caracterização","Carvalho, Ívi Martins de, Mei, Lucia Helena Innocentini, Rodolfo Junior, Antonio","Polímeros; 23(4); 501-508","Polímeros","Português","2013","http://www.scielo.br/scielo.php?script=sci_arttext&pid=S0104-14282013000400012&lang=pt" 
"S0104-14282013000400019-scl","Preparação de resinas de poliuretana à base de óleo de mamona e dietanolamina e sua aplicação em circuitos eletroeletrônicos","Cardoso, Oldemar Ribeiro, Balaban, Rosangela de Carvalho","Polímeros; 23(4); 552-558","Polímeros","Português","2013","http://www.scielo.br/scielo.php?script=sci_arttext&pid=S0104-14282013000400019&lang=pt" 
"S0104-14282013000400014-scl","Tendências tecnológicas do uso do sisal em compósitos a partir da prospecção em documentos de patentes","Scopel, Felipe, Gregolin, José Angelo Rodrigues, Faria, Leandro Innocentini Lopes de","Polímeros; 23(4); 514-520","Polímeros","Português","2013","http://www.scielo.br/scielo.php?script=sci_arttext&pid=S0104-14282013000400014&lang=pt" 
"S0104-14282013000400018-scl","Avaliação e caracterização de tubos fabricados com PVC reciclado","Pennafort Jr, Luiz Carlos G., Silva, Frederico Rozendo da, Deus, Enio Pontes de","Polímeros; 23(4); 547-551","Polímeros","Português","2013","http://www.scielo.br/scielo.php?script=sci_arttext&pid=S0104-14282013000400018&lang=pt" 
"S0104-14282013000400016-scl","Efeito compatibilizante de uma argila organofílica na blenda PLA/terpolímero (etileno/acrilato de metila/metacrilato de glicidila)","Brito, Gustavo F., Agrawal, Pankaj, Araújo, Edcleide M., Mélo, Tomás J. A. de","Polímeros; 23(4); 531-537","Polímeros","Português","2013","http://www.scielo.br/scielo.php?script=sci_arttext&pid=S0104-14282013000400016&lang=pt" 
"S0104-14282013000400005-scl","Morphological, viscoelastic and mechanical characterization of polypropylene/exfoliated graphite nanocomposites","Ferreira, Creusa Iara, Bianchi, Otavio, Oviedo, Mauro Alfredo Soto, Oliveira, Ricardo Vinicius Bof de, Mauler, Raquel Santos","Polímeros; 23(4); 456-461","Polímeros","Inglês","2013","http://www.scielo.br/scielo.php?script=sci_arttext&pid=S0104-14282013000400005&lang=pt" 
"S0104-14282013000400008-scl","Influence of elastic recovery time on the Dimensional Stability of Polydimethylsiloxane (PDS)","Cesero, Leonardo de, Nogarett, Lígia Maria, Mota, Eduardo Gonçalves, Fracasso, Lisiane Martins, Araujo, Carlos dos Reis Pereira de","Polímeros; 23(4); 473-476","Polímeros","Inglês","2013","http://www.scielo.br/scielo.php?script=sci_arttext&pid=S0104-14282013000400008&lang=pt" 
"S0104-14282013000400010-scl","Synthesis and characterization of novel polyamide-ethers based on bis-imidazole containing bulky aryl pendant groups","Saadati, Seyed Mahdi, Mosslemin, Mohammad Hossein, Behmadi, Hossein","Polímeros; 23(4); 484-492","Polímeros","Inglês","2013","http://www.scielo.br/scielo.php?script=sci_arttext&pid=S0104-14282013000400010&lang=pt" 
"S0104-14282013000400003-scl","Degradation of non-vulcanized natural rubber - renewable resource for fine chemicals used in polymer synthesis","Fainleib, Alexander, Pires, Renata V., Lucas, Elizabete F., Soares, Bluma G.","Polímeros; 23(4); 441-450","Polímeros","Inglês","2013","http://www.scielo.br/scielo.php?script=sci_arttext&pid=S0104-14282013000400003&lang=pt" 
"S0104-14282013000400022-scl","Estudo do efeito da incorporação de plastificante de fonte renovável em compostos de PVC","Rosa, Derval dos Santos, Silveira, Alexandre de Freitas, Madaleno, Emerson, Tavares, Maria Inês Bruno","Polímeros; 23(4); 570-581","Polímeros","Português","2013","http://www.scielo.br/scielo.php?script=sci_arttext&pid=S0104-14282013000400022&lang=pt" 
"S0104-14282013000500010-scl","Avaliação do uso de amidos aniônicos hidrolisados como estabilizantes em nanocápsulas poliméricas para formulações tópicas","Santos, Ester P. dos, Barboza, Jayne C. S.","Polímeros; 23(5); 624-629","Polímeros","Português","2013","http://www.scielo.br/scielo.php?script=sci_arttext&pid=S0104-14282013000500010&lang=pt" 
"S0104-14282013000500015-scl","Análise técnica do uso de resíduos de poliéster na indústria têxtil","Pinho, Eleandro B., Costa, Helson M. da, Ramos, Valéria D.","Polímeros; 23(5); 654-660","Polímeros","Português","2013","http://www.scielo.br/scielo.php?script=sci_arttext&pid=S0104-14282013000500015&lang=pt" 
"S0104-14282013000500020-scl","Propriedades mecânicas e reológicas de nanocompósitos de poliamida 6 com argila organofílica nacional","Paz, Renê Anisio da, Leite, Amanda Melissa Damião, Araújo, Edcleide Maria, Melo, Tomás Jeferson Alves de, Pessan, Luiz Antonio, Passador, Fábio Roberto","Polímeros; 23(5); 682-689","Polímeros","Português","2013","http://www.scielo.br/scielo.php?script=sci_arttext&pid=S0104-14282013000500020&lang=pt" 
"S0104-14282013000500021-scl","Degradação de membrana impermeabilizante de polietileno de alta densidade usada em tanques de armazenamento de vinhaça","Lavoie, Fernando Luiz, Bueno, Benedito de Souza, Lodi, Paulo César","Polímeros; 23(5); 690-695","Polímeros","Português","2013","http://www.scielo.br/scielo.php?script=sci_arttext&pid=S0104-14282013000500021&lang=pt" 
"S0104-14282013000500019-scl","Sal de iodônio aumenta a resistência coesiva de uma resina adesiva experimental na presença de solvente","Leal, Fernanda B., Souza, Aline T. de, Piva, Evandro, Ogliari, Fabrício","Polímeros; 23(5); 678-681","Polímeros","Português","2013","http://www.scielo.br/scielo.php?script=sci_arttext&pid=S0104-14282013000500019&lang=pt" 
"S0104-14282013000500012-scl","PVC Orientado: avaliação de processo de orientação e das propriedades mecânicas em função da razão de estiramento","Medeiros, Felipe Albuquerque, Wiebeck, Hélio","Polímeros; 23(5); 636-643","Polímeros","Português","2013","http://www.scielo.br/scielo.php?script=sci_arttext&pid=S0104-14282013000500012&lang=pt" 
"S0104-14282013000500011-scl","Propriedades e características da quitosana obtida a partir do exoesqueleto de caranguejo-uçá utilizando radiação de microondas","Abreu, F. O. M. S., Cavalcante, L. G., Doudement, P. V., Castro, A. M., Nascimento, A. P., Matos, J. E. X","Polímeros; 23(5); 630-635","Polímeros","Português","2013","http://www.scielo.br/scielo.php?script=sci_arttext&pid=S0104-14282013000500011&lang=pt" 
"S0104-14282013000500006-scl","Use of green coconut shells as an alternative substrate for the production of xanthan gum on different scales of fermentation","Nery, Tatiana Barreto Rocha, Cruz, Antonio José Gonçalves da, Druzian, Janice Izabel","Polímeros; 23(5); 602-607","Polímeros","Inglês","2013","http://www.scielo.br/scielo.php?script=sci_arttext&pid=S0104-14282013000500006&lang=pt" 
"S0104-14282013000500002-scl","Analysis of Poly(Lactic-co-Glycolic Acid)/Poly(Isoprene) Polymeric Blend for application as biomaterial","Marques, Douglas Ramos, Santos, Luis Alberto dos, Schopf, Luciano Ferraz, Fraga, José Carlos Soares de","Polímeros; 23(5); 579-584","Polímeros","Inglês","2013","http://www.scielo.br/scielo.php?script=sci_arttext&pid=S0104-14282013000500002&lang=pt" 
"S0104-14282013000500004-scl","Removal of Phenol from aqueous solutions by Polymeric composites containing Ni and Co particles","Simplício, Simone, Santa Maria, Luiz Cláudio de, Costa, Marcos Antônio da Silva, Lucas, Elizabete Fernandes, Queirós, Yure Gomes de Carvalho, Marques, Luiz Rodrigo da Silva, Costa, Luciana da Cunha, Hui, Wang Shu, Silva, Manoel Ribeiro","Polímeros; 23(5); 590-596","Polímeros","Inglês","2013","http://www.scielo.br/scielo.php?script=sci_arttext&pid=S0104-14282013000500004&lang=pt" 
"S0104-14282013000500009-scl","Physicochemical properties of poly(lactic acid-co-glycolic acid) film modified via blending with poly(butyl acrylate-co-methyl methacrylate)","Zhu, Guoquan, Wang, Fagang, Gao, Qiaochun, Liu, Yuying","Polímeros; 23(5); 619-623","Polímeros","Inglês","2013","http://www.scielo.br/scielo.php?script=sci_arttext&pid=S0104-14282013000500009&lang=pt" 
"S0103-40142013000200006-scl","Perfil socioeconômico, nutricional e de ingestão alimentar de beneficiários do Programa Bolsa Família","Cabral, Marcela Jardim, Vieira, Karlla Almeida, Sawaya, Ana Lydia, Florêncio, Telma Maria Menezes Toledo","Estudos Avançados; 27(78); 71-87","Estudos Avançados","Português","2013","http://www.scielo.br/scielo.php?script=sci_arttext&pid=S0103-40142013000200006&lang=pt" 
"S0103-40142013000200010-scl","Obstáculos para a implementação governamental de dietas saudáveis com base científica e como superá-los","Waitzberg, Dan L., Simopoulos, Artemis P., Bourne, Peter G., Faergeman, Olle","Estudos Avançados; 27(78); 133-152","Estudos Avançados","Português","2013","http://www.scielo.br/scielo.php?script=sci_arttext&pid=S0103-40142013000200010&lang=pt" 
"S0103-40142013000200008-scl","A importância do tratamento em hospital-dia para a criança com subnutrição primária","Albuquerque, Maria Paula de, Martins, Paula Andrea, Pires, Renata Cristina, Sawaya, Ana Lydia","Estudos Avançados; 27(78); 103-120","Estudos Avançados","Português","2013","http://www.scielo.br/scielo.php?script=sci_arttext&pid=S0103-40142013000200008&lang=pt" 
"S0103-40142013000200005-scl","&quot;Abra a felicidade&quot;? Implicações para o vício alimentar","Sawaya, Ana Lydia, Filgueiras, Andrea","Estudos Avançados; 27(78); 53-70","Estudos Avançados","Português","2013","http://www.scielo.br/scielo.php?script=sci_arttext&pid=S0103-40142013000200005&lang=pt" 
"S0103-40142013000200004-scl","Desigualdades socioeconômicas na baixa estatura infantil: a experiência brasileira, 1974-2007","Monteiro, Carlos Augusto, Benicio, Maria Helena D&#039;Aquino, Conde, Wolney Lisboa, Konno, Silvia Cristina, Lima, Ana Lucia Lovadino de, Barros, Aluísio Jardim Dornellas de, Victora, Cesar Gomes","Estudos Avançados; 27(78); 38-49","Estudos Avançados","Português","2013","http://www.scielo.br/scielo.php?script=sci_arttext&pid=S0103-40142013000200004&lang=pt" 
"S0103-40142013000200002-scl","A saúde pública no Brasil","Carvalho, Gilson","Estudos Avançados; 27(78); 7-26","Estudos Avançados","Português","2013","http://www.scielo.br/scielo.php?script=sci_arttext&pid=S0103-40142013000200002&lang=pt" 
"S0103-40142013000100012-scl","Direitos dos trabalhadores rurais num contexto de desenvolvimento sustentável","KoKol, Awdrey Frederico, Misailidis, Mirta lerena","Estudos Avançados; 27(77); 161-180","Estudos Avançados","Português","2013","http://www.scielo.br/scielo.php?script=sci_arttext&pid=S0103-40142013000100012&lang=pt" 
"S0104-14282013000400020-scl","Produção e degradação in vitro de estruturas tubulares de celulose bacteriana","Oliveira, Vanessa A., Rambo, Carlos Renato, Porto, Luismar M.","Polímeros; 23(4); 559-564","Polímeros","Português","2013","http://www.scielo.br/scielo.php?script=sci_arttext&pid=S0104-14282013000400020&lang=pt" 
"S0104-14282013000400011-scl","Efeito do óleo de linhaça e do óleo de amendoim sobre a vulcanização da borracha natural (NR). parte II: modelo detalhado","Bezerra, Alexandre, Santos, Alex. C. S., Costa, Helson M. da, Ramos, Valéria D., Costa, Helson M. da","Polímeros; 23(4); 493-500","Polímeros","Português","2013","http://www.scielo.br/scielo.php?script=sci_arttext&pid=S0104-14282013000400011&lang=pt" 
"S0104-14282013000500005-scl","Thermal &amp; morphological evaluation of linear and radial SEBS-polypropylene blends","Mendienta-García, Martha Belem, Páramo-García, Ulises, Díaz-Zavala, Nancy Patricia, Robledo-Muñiz, Juan Gabriel, Rivera-Armenta, José Luis","Polímeros; 23(5); 597-601","Polímeros","Inglês","2013","http://www.scielo.br/scielo.php?script=sci_arttext&pid=S0104-14282013000500005&lang=pt" 
"S0104-14282013000300003-scl","Solid state polymerization: its action on thermal and rheological properties of PET/PC reactive blends","Mendes, Luis C., Pereira, Patrícia S.C.","Polímeros; 23(3); 298-304","Polímeros","Inglês","2013","http://www.scielo.br/scielo.php?script=sci_arttext&pid=S0104-14282013000300003&lang=pt" 
"S0104-14282013000300014-scl","Degradación in-vitro de mezclas de poliuretano termoplástico y almidón modificado","Valero, Manuel F.","Polímeros; 23(3); 373-382","Polímeros","Espanhol","2013","http://www.scielo.br/scielo.php?script=sci_arttext&pid=S0104-14282013000300014&lang=pt" 
"S0104-14282013000300015-scl","Efeito do envelhecimento de catalisadores Ziegler-Natta à base de neodímio sobre a polimerização de 2-metil, 1,3-butadieno","Simões, André Luiz Carneiro, Pires, Neusa Maria Tocchetto, Dias, Marco Antônio Pereira, Coutinho, Fernanda Margarida Barbosa, Costa, Marcos Antonio da Silva","Polímeros; 23(3); 383-388","Polímeros","Português","2013","http://www.scielo.br/scielo.php?script=sci_arttext&pid=S0104-14282013000300015&lang=pt" 
