"S0718-50492016000300016-chl","","Gaido, Daniel","Izquierdas; (28); 339-342","Izquierdas","Espanhol","2016","http://www.scielo.cl/scielo.php?script=sci_arttext&pid=S0718-50492016000300016&lang=pt" 
"S0718-50492016000300015-chl","Hacia un discurso emancipador de los derechos de las niñas y los niños","Pavez Soto, Iskra","Izquierdas; (28); 334-338","Izquierdas","Espanhol","2016","http://www.scielo.cl/scielo.php?script=sci_arttext&pid=S0718-50492016000300015&lang=pt" 
"S2223-03862016000100008-sza","Innovative ways to teach the youth lessons from South Africa&#039;s historical legacies","Malan, Jan","Yesterday and Today; (15); 116-124","Yesterday and Today","Inglês","2016","http://www.scielo.org.za/scielo.php?script=sci_arttext&pid=S2223-03862016000100008&lang=pt" 
"S0718-69242016000200006-chl","Claves para el análisis de la participación social en los procesos de envejecimiento de la generación baby boom","Majón-Valpuesta, Dolores, Ramos, Pilar, Pérez-Salanova, Mercé","Psicoperspectivas; 15(2); 53-63","Psicoperspectivas","Espanhol","2016","http://www.scielo.cl/scielo.php?script=sci_arttext&pid=S0718-69242016000200006&lang=pt" 
"S0718-69242016000200008-chl","Valoración del alumnado de primaria sobre convivencia escolar: El valor de la red de iguales","Còrdoba Alcaide, Francisco, Del Rey Alamillo, Rosario, Casas Bolaños, José Antonio, Ortega Ruiz, Rosario","Psicoperspectivas; 15(2); 78-89","Psicoperspectivas","Espanhol","2016","http://www.scielo.cl/scielo.php?script=sci_arttext&pid=S0718-69242016000200008&lang=pt" 
"S0304-28472016000200008-col","The effect of storage temperature and time on total phenolics and enzymatic activity of sapodilla (Achras sapota L.)","Camargo, Jairo Mercado, Dunoyer, Arnulfo Taron, García-Zapateiro, Luis A.","Revista Facultad Nacional de Agronomía, Medellín; 69(2); 7955-7963","Revista Facultad Nacional de Agronomía, Medellín","Inglês","2016","http://www.scielo.org.co/scielo.php?script=sci_arttext&pid=S0304-28472016000200008&lang=pt" 
"S0124-00642016000400008-col","Diagnóstico de problemáticas asistenciales en clínicas y hospitales de Barranquilla","Ortiz-Barrios, Miguel Á, Felizzola-Jiménez, Heriberto A","Revista de Salud Pública; 18(4); 592-604","Revista de Salud Pública","Espanhol","2016","http://www.scielo.org.co/scielo.php?script=sci_arttext&pid=S0124-00642016000400008&lang=pt" 
"S1727-558X2016000300010-per","Colgajo lingual excelente alternativa para el cierre de Fístulas Oronasales: reporte de un caso","Wiegering Cecchi, Guillermo","Horizonte Médico; 16(3); 66-70","Horizonte Médico","Espanhol","2016","http://www.scielo.org.pe/scielo.php?script=sci_arttext&pid=S1727-558X2016000300010&lang=pt" 
"S1727-558X2016000300003-per","Estudio de la biodisponibilidad relativa de una formulación multifuente de sulfametoxazol respecto al medicamento referente","Alvarado Yarasca, Ángel, Salazar Granara, Alberto, Pineda Pérez, Neuman, Villanueva Vilchez, Hugo, Cáceres Andonaire, Elena","Horizonte Médico; 16(3); 12-19","Horizonte Médico","Espanhol","2016","http://www.scielo.org.pe/scielo.php?script=sci_arttext&pid=S1727-558X2016000300003&lang=pt" 
"S1727-558X2016000300005-per","Factores que condicionan la alimentación de personas adultas en un centro de rehabilitación de drogas","Troncoso Pantoja, Claudia, Mora Ormeño, Darlyng, Sánchez Espinoza, Paulina","Horizonte Médico; 16(3); 29-34","Horizonte Médico","Espanhol","2016","http://www.scielo.org.pe/scielo.php?script=sci_arttext&pid=S1727-558X2016000300005&lang=pt" 
"S0123-30332016000200010-col","Self-Similarity of Space Filling Curves","Cardona, Luis F., Múnera, Luis E.","Ingeniería y competitividad; 18(2); 113-124","Ingeniería y competitividad","Inglês","2016","http://www.scielo.org.co/scielo.php?script=sci_arttext&pid=S0123-30332016000200010&lang=pt" 
"S1657-80312016000200001-col","EL PAPEL DE LA COMUNIDAD UNIVERSITARIA EN EL POS-ACUERDO O POS-CONFLICTO EN COLOMBIA","Insuasty Rodríguez, Alfonso, Borja Bedoya, Eulalia","El Ágora U.S.B.; 16(2); 373-376","El Ágora U.S.B.","Espanhol","2016","http://www.scielo.org.co/scielo.php?script=sci_arttext&pid=S1657-80312016000200001&lang=pt" 
"S1728-59172016000300008-per","Sepsis-3 y las nuevas definiciones, ¿es tiempo de abandonar SIRS?","Neira-Sanchez, Elsa R, Málaga, Germán","Acta Médica Peruana; 33(3); 217-222","Acta Médica Peruana","Espanhol","2016","http://www.scielo.org.pe/scielo.php?script=sci_arttext&pid=S1728-59172016000300008&lang=pt" 
"S1728-59172016000300021-per","La perspectiva de la sociedad en las evaluaciones económicas en salud en el Perú","Escobedo-Palza, Seimer, Timaná-Ruiz, Raúl","Acta Médica Peruana; 33(3); 261-262","Acta Médica Peruana","Espanhol","2016","http://www.scielo.org.pe/scielo.php?script=sci_arttext&pid=S1728-59172016000300021&lang=pt" 
"S1728-59172016000300020-per","Pokémon Go: ¿herramienta para combatir las conductas sedentarias?","Miñan-Tapia, Armando, Torres-Riveros, Gloria S, Antezana-Román, Augusto","Acta Médica Peruana; 33(3); 259-260","Acta Médica Peruana","Espanhol","2016","http://www.scielo.org.pe/scielo.php?script=sci_arttext&pid=S1728-59172016000300020&lang=pt" 
"S1728-59172016000300015-per","Violencia contra médicos en emergencias de un hospital de tercer nivel de Arequipa, Perú 2016","Sumari, Christian, Suyo-Prieto, Fiorella, Moreno-Loaiza, Oscar","Acta Médica Peruana; 33(3); 246-247","Acta Médica Peruana","Espanhol","2016","http://www.scielo.org.pe/scielo.php?script=sci_arttext&pid=S1728-59172016000300015&lang=pt" 
"S1728-59172016000300018-per","Traducción y adaptación cultural del Yale-Brown Obsessive Compulsive Scale (Y-BOCS) para trastornos obsesivos compulsivos","Yacila, Giuliana A, Cook-del Aguila, Lorella, Sanchez-Castro, Ana Elena, Reyes-Bossio, Mario, A. Tejada, Romina","Acta Médica Peruana; 33(3); 253-255","Acta Médica Peruana","Espanhol","2016","http://www.scielo.org.pe/scielo.php?script=sci_arttext&pid=S1728-59172016000300018&lang=pt" 
"S1728-59172016000300013-per","Hidatidosis vesical y retrovesical: reporte de caso","Lozano, Noris, Arrunátegui-Salas, Giuliana, Amado, Yamir, Arakaki, Angie, Gutierrez, Ericson L","Acta Médica Peruana; 33(3); 241-243","Acta Médica Peruana","Espanhol","2016","http://www.scielo.org.pe/scielo.php?script=sci_arttext&pid=S1728-59172016000300013&lang=pt" 
"S2304-51322016000300011-per","Monochorionic diamniotic twin pregnancy with selective IUGR type 2: fetoscopic and sonographic findings of ominous prognosis","Gil Guevara, Enrique, Bower, Sarah, Nicolaides, Kypros","Revista Peruana de Ginecología y Obstetricia; 62(3); 285-293","Revista Peruana de Ginecología y Obstetricia","Inglês","2016","http://www.scielo.org.pe/scielo.php?script=sci_arttext&pid=S2304-51322016000300011&lang=pt" 
"S2304-51322016000300012-per","Sindrome de las tuberías oxidadas: reporte de caso","Carrasco, Amparo, Navarro, Lidia, Tarrazó, María, Balanzá, Reyes","Revista Peruana de Ginecología y Obstetricia; 62(3); 295-297","Revista Peruana de Ginecología y Obstetricia","Espanhol","2016","http://www.scielo.org.pe/scielo.php?script=sci_arttext&pid=S2304-51322016000300012&lang=pt" 
"S2304-51322016000300006-per","","Pacheco-Romero, José","Revista Peruana de Ginecología y Obstetricia; 62(3); 247-260","Revista Peruana de Ginecología y Obstetricia","Espanhol","2016","http://www.scielo.org.pe/scielo.php?script=sci_arttext&pid=S2304-51322016000300006&lang=pt" 
"S2304-51322016000300001-per","","Pacheco-Romero, José","Revista Peruana de Ginecología y Obstetricia; 62(3); 201-209","Revista Peruana de Ginecología y Obstetricia","Espanhol","2016","http://www.scielo.org.pe/scielo.php?script=sci_arttext&pid=S2304-51322016000300001&lang=pt" 
"S1659-33592016000100029-cri","Factores determinantes del desempeño del clúster: Caso aplicado al sector de muebles en Barranquilla, Colombia.","López Jiménez, Jael, Martínez Gutiérrez, Bernal, Hernández Malpica, Pedro Emilio, Rodríguez Barquero, Rony","Tec Empresarial; 10(1); 29-38","Tec Empresarial","Espanhol","2016","http://www.scielo.sa.cr/scielo.php?script=sci_arttext&pid=S1659-33592016000100029&lang=pt" 
"S0187-893X2016000300182-mex","Análisis curricular de la enseñanza química en México en los niveles preuniversitarios. Parte II: La educación media superior","Pérez Campillo, Yosajandi, Chamizo Guerrero, José Antonio","Educación química; 27(3); 182-194","Educación química","Espanhol","2016","http://www.scielo.org.mx/scielo.php?script=sci_arttext&pid=S0187-893X2016000300182&lang=pt" 
"S0187-893X2016000300217-mex","Las emociones en el aprendizaje de física y química en educación secundaria. Causas relacionadas con el estudiante","Dávila Acedo, María Antonia, Cañada Cañada, Florentina, Sánchez Martín, Jesús, Mellado Jiménez, Vicente","Educación química; 27(3); 217-225","Educación química","Espanhol","2016","http://www.scielo.org.mx/scielo.php?script=sci_arttext&pid=S0187-893X2016000300217&lang=pt" 
"S0187-893X2016000300233-mex","One hundred and one years after a milestone: Modern chemical weapons and World War I","Vilches, Diego, Alburquerque, Germán, Ramirez-Tagle, Rodrigo","Educación química; 27(3); 233-236","Educación química","Inglês","2016","http://www.scielo.org.mx/scielo.php?script=sci_arttext&pid=S0187-893X2016000300233&lang=pt" 
"S0187-893X2016000300226-mex","Desarrollo de tecnologías de la información y la comunicación para reforzar los procesos de enseñanza y aprendizaje en ciencias en el grado de maestro/a en educación infantil de la Universidad de Málaga","Rojano Ramos, Santiago, López Guerrero, María del Mar, López Guerrero, Gema","Educación química; 27(3); 226-232","Educación química","Espanhol","2016","http://www.scielo.org.mx/scielo.php?script=sci_arttext&pid=S0187-893X2016000300226&lang=pt" 
"S0187-893X2016000300195-mex","Enseñanza de la estequiometría: uso de analogías y comprensión conceptual","Raviolo, Andrés, Lerzo, Gabriela","Educación química; 27(3); 195-204","Educación química","Espanhol","2016","http://www.scielo.org.mx/scielo.php?script=sci_arttext&pid=S0187-893X2016000300195&lang=pt" 
"S0187-893X2016000300209-mex","Graphical representation of chemical periodicity of main elements through boxplot","Ferreira, João Elias Vidueira, Pinheiro, Maria Tayane Silva, dos Santos, Wagner Roberto Santos, Maia, Rodrigo da Silva","Educación química; 27(3); 209-216","Educación química","Inglês","2016","http://www.scielo.org.mx/scielo.php?script=sci_arttext&pid=S0187-893X2016000300209&lang=pt" 
"S0187-893X2016000300205-mex","The phenomenon of brine rejection: a practical proposal for prospective primary teacher training","Villarroel, José Domingo, Zuazagoitia, Daniel","Educación química; 27(3); 205-208","Educación química","Inglês","2016","http://www.scielo.org.mx/scielo.php?script=sci_arttext&pid=S0187-893X2016000300205&lang=pt" 
"S0187-893X2016000300173-mex","Editorial","Antonio Chamizo, José","Educación química; 27(3); 173-174","Educación química","Espanhol","2016","http://www.scielo.org.mx/scielo.php?script=sci_arttext&pid=S0187-893X2016000300173&lang=pt" 
"S0187-893X2016000300237-mex","In memoriam","Caamaño, Aureli","Educación química; 27(3); 237-237","Educación química","Espanhol","2016","http://www.scielo.org.mx/scielo.php?script=sci_arttext&pid=S0187-893X2016000300237&lang=pt" 
"S0187-893X2016000300175-mex","History and the teaching of chemistry. A tribute to Thomas Lowry&#039;s textbook &quot;Historical Introduction to Chemistry&quot;","Jensen, William B.","Educación química; 27(3); 175-181","Educación química","Inglês","2016","http://www.scielo.org.mx/scielo.php?script=sci_arttext&pid=S0187-893X2016000300175&lang=pt" 
"S2304-51322016000300010-per","Primer embarazo con transferencia de embriones seleccionados por morfocinética en el Perú","Portella, Jimmy, Nuñez, Denisse, Obregón, Eva, Chávez, Nathaly, Noriega-Hoces, Luis, Guzmán, Luis","Revista Peruana de Ginecología y Obstetricia; 62(3); 279-283","Revista Peruana de Ginecología y Obstetricia","Espanhol","2016","http://www.scielo.org.pe/scielo.php?script=sci_arttext&pid=S2304-51322016000300010&lang=pt" 
"S2304-51322016000300004-per","Embolización de arterias uterinas para manejo de miomatosis: experiencia con 200 pacientes","Cantella S, Raúl, Brazzini A, Augusto, Brazzini M, Mariana, Ramón, Julio César, Hurtado R, Jorge, Quispe A, Edwin, Arrieta M, Sebastián","Revista Peruana de Ginecología y Obstetricia; 62(3); 229-234","Revista Peruana de Ginecología y Obstetricia","Espanhol","2016","http://www.scielo.org.pe/scielo.php?script=sci_arttext&pid=S2304-51322016000300004&lang=pt" 
"S2304-51322016000300009-per","Diagnóstico prenatal de anomalías cromosómicas: Biopsia de vellosidades coriales y amniocentesis para cariotipo fetal","Huamán G, Moisés, Quiroga de Michelena, María Isabel, St. Martin, Brad, Huamán, Moisés","Revista Peruana de Ginecología y Obstetricia; 62(3); 269-277","Revista Peruana de Ginecología y Obstetricia","Espanhol","2016","http://www.scielo.org.pe/scielo.php?script=sci_arttext&pid=S2304-51322016000300009&lang=pt" 
"S2304-51322016000300015-per","¿Cómo evitar errores en la traducción de artículos al inglés?: análisis a propósito de un caso","Moreno-Loaiza, Milagros, Moreno-Loaiza, Oscar","Revista Peruana de Ginecología y Obstetricia; 62(3); 307-308","Revista Peruana de Ginecología y Obstetricia","Espanhol","2016","http://www.scielo.org.pe/scielo.php?script=sci_arttext&pid=S2304-51322016000300015&lang=pt" 
"S2304-51322016000300013-per","Diagnóstico de cavum vergae durante el tercer trimestre de gestación","Navarro-Briceño, Yolimar, Santos-Bolívar, Joel, Reyna-Villasmil, Eduardo","Revista Peruana de Ginecología y Obstetricia; 62(3); 299-302","Revista Peruana de Ginecología y Obstetricia","Espanhol","2016","http://www.scielo.org.pe/scielo.php?script=sci_arttext&pid=S2304-51322016000300013&lang=pt" 
"S2304-51322016000300007-per","Cáncer de cérvix: reflexiones sobre el tamizaje y manejo","Jerónimo, José","Revista Peruana de Ginecología y Obstetricia; 62(3); 261-264","Revista Peruana de Ginecología y Obstetricia","Espanhol","2016","http://www.scielo.org.pe/scielo.php?script=sci_arttext&pid=S2304-51322016000300007&lang=pt" 
"S2304-51322016000300014-per","Coriocarcinoma: reporte de 3 casos","Ramírez Aguirre, Katherine, Muñoz Guzmán, Maryleen, Flores Noriega, Mónica, Cok García, Jaime","Revista Peruana de Ginecología y Obstetricia; 62(3); 303-306","Revista Peruana de Ginecología y Obstetricia","Espanhol","2016","http://www.scielo.org.pe/scielo.php?script=sci_arttext&pid=S2304-51322016000300014&lang=pt" 
"S2304-51322016000300008-per","Diagnóstico prenatal de anomalías cromosómicas: Examen prenatal no invasivo","Quiroga de Michelena, María Isabel, Díaz Kuan, Alicia","Revista Peruana de Ginecología y Obstetricia; 62(3); 265-268","Revista Peruana de Ginecología y Obstetricia","Espanhol","2016","http://www.scielo.org.pe/scielo.php?script=sci_arttext&pid=S2304-51322016000300008&lang=pt" 
"S2304-51322016000300002-per","Embarazo en adolescentes de Jalisco, México: una mirada desde la marginación social","Laureano, Jorge, Gil, Elisa, Leticia Mejía, Martha, de la Torre, Aldo César","Revista Peruana de Ginecología y Obstetricia; 62(3); 211-220","Revista Peruana de Ginecología y Obstetricia","Espanhol","2016","http://www.scielo.org.pe/scielo.php?script=sci_arttext&pid=S2304-51322016000300002&lang=pt" 
"S2304-51322016000300005-per","Evaluación del suelo pélvico mediante ecografía introital","Apaza Valencia, John","Revista Peruana de Ginecología y Obstetricia; 62(3); 235-246","Revista Peruana de Ginecología y Obstetricia","Espanhol","2016","http://www.scielo.org.pe/scielo.php?script=sci_arttext&pid=S2304-51322016000300005&lang=pt" 
"S2304-51322016000300003-per","Factor de necrosis tumoral alfa plasmático en mujeres obesas y no obesas con síndrome de ovarios poliquísticos","Mejía Montilla, Jorly, Álvarez-Mon, Melchor, Reyna Villasmil, Eduardo, Torres Cepeda, Duly, Santos Bolívar, Joel, Reyna Villasmil, Nadia, Fernández-Ramírez, Andreina, Bravo Henríquez, Alfonso","Revista Peruana de Ginecología y Obstetricia; 62(3); 221-227","Revista Peruana de Ginecología y Obstetricia","Espanhol","2016","http://www.scielo.org.pe/scielo.php?script=sci_arttext&pid=S2304-51322016000300003&lang=pt" 
"S1728-59172016000300012-per","Esponja estéril de gelatina comprimida (GELFOAMMR) simulando tejido tiroideo en ecografía de paciente con tiroidectomía. Reporte de un caso","Alzate-Carvajal, Verónica, Salcedo-Cerquera, Carol P, Nuñez-Renza, Jesus, Mondragón-Cardona, Alvaro","Acta Médica Peruana; 33(3); 236-240","Acta Médica Peruana","Espanhol","2016","http://www.scielo.org.pe/scielo.php?script=sci_arttext&pid=S1728-59172016000300012&lang=pt" 
"S1728-59172016000300002-per","Responsabilidad de las instituciones ante la proliferación de escuelas de medicina en el Perú","Mayta-Tristán, Percy, Cuentas, Mariano, Núñez-Vergara, Manuel","Acta Médica Peruana; 33(3); 178-182","Acta Médica Peruana","Espanhol","2016","http://www.scielo.org.pe/scielo.php?script=sci_arttext&pid=S1728-59172016000300002&lang=pt" 
"S1728-59172016000300005-per","Injuria renal aguda en la gestación: experiencia en un hospital general en Arequipa-Perú, 2003-2013","Vizcarra-Vizcarra, Cristhian, Hurtado-Aréstegui, Abdías, Gonzales Polar-Garcés, José","Acta Médica Peruana; 33(3); 195-201","Acta Médica Peruana","Espanhol","2016","http://www.scielo.org.pe/scielo.php?script=sci_arttext&pid=S1728-59172016000300005&lang=pt" 
"S1728-59172016000300007-per","Herniorrafía con la técnica de Lichtenstein versus Nyhus en el manejo de las hernias inguinales y sus complicaciones postoperatorias en un hospital del Perú","Granda, Ana C, Correa-Tineo, Santos, Quispe, Antonio M","Acta Médica Peruana; 33(3); 208-216","Acta Médica Peruana","Espanhol","2016","http://www.scielo.org.pe/scielo.php?script=sci_arttext&pid=S1728-59172016000300007&lang=pt" 
"S1728-59172016000300003-per","Carbapenemasas en bacterias Gram negativas no fermentadoras aisladas en servicios críticos del Hospital Regional Lambayeque, diciembre 2014 - julio 2015","Gastelo-Acosta, Rosy M, Díaz-Sipión, Roberto S, Maguiña Vargas, Ciro","Acta Médica Peruana; 33(3); 183-188","Acta Médica Peruana","Espanhol","2016","http://www.scielo.org.pe/scielo.php?script=sci_arttext&pid=S1728-59172016000300003&lang=pt" 
"S1728-59172016000300004-per","Infecciones intrahospitalarias del tracto urinario en servicios críticos de un hospital público de Chiclayo, Perú (2009-2014)","Montenegro-Díaz, Brian, Tafur-Ramirez, Rosita, Díaz-Vélez, Cristian, Fernández-Mogollon, Jorge","Acta Médica Peruana; 33(3); 189-194","Acta Médica Peruana","Espanhol","2016","http://www.scielo.org.pe/scielo.php?script=sci_arttext&pid=S1728-59172016000300004&lang=pt" 
"S1728-59172016000300011-per","Meningoencefalitis por Cryptococcus neoformans en adolescente con desnutrición","Trejo-Espino, A. Wilfredo, Ramírez-Izcoa, Alejandro, Alvarado-Rivera, Swany, Godoy-Mejía, Carlos, Valenzuela-Castillo, Renato","Acta Médica Peruana; 33(3); 232-235","Acta Médica Peruana","Espanhol","2016","http://www.scielo.org.pe/scielo.php?script=sci_arttext&pid=S1728-59172016000300011&lang=pt" 
"S1728-59172016000300006-per","Prevalencia de tuberculosis pulmonar en población privada de la libertad de 10 centros penitenciarios en Colombia, 2013","Alarcón-Robayo, José Fair, Martinez-Casallas, Liliana, Samir-Sánchez, Maite, Valderrama-Mendoza, Juan Sebastián, Bados-Enriquez, Diego Mauricio, Jiménez-Canizales, Carlos Eduardo","Acta Médica Peruana; 33(3); 202-207","Acta Médica Peruana","Espanhol","2016","http://www.scielo.org.pe/scielo.php?script=sci_arttext&pid=S1728-59172016000300006&lang=pt" 
"S1728-59172016000300019-per","¿Cuál debería ser el perfil de quien se denomine investigador en Colombia y Perú?","Rodriguez-Morales, Alfonso J, Díaz-Vélez, Cristian, Gálvez-Olórtegui, Tomás, Gálvez-Olórtegui, José, Benites-Zapata, Vicente A","Acta Médica Peruana; 33(3); 256-258","Acta Médica Peruana","Espanhol","2016","http://www.scielo.org.pe/scielo.php?script=sci_arttext&pid=S1728-59172016000300019&lang=pt" 
"S1728-59172016000300010-per","Fracaso de dosis única de triclabendazole para el tratamiento de fasciolosis humana","Terashima, Angélica, Marcos, Luis A","Acta Médica Peruana; 33(3); 228-231","Acta Médica Peruana","Espanhol","2016","http://www.scielo.org.pe/scielo.php?script=sci_arttext&pid=S1728-59172016000300010&lang=pt" 
"S1728-59172016000300017-per","Mortalidad atribuible a infecciones nosocomiales en un hospital de la Seguridad Social en Chiclayo, Perú","Díaz-Vélez, Cristian, Neciosup-Puicán, Elizabeth, Fernández-Mogollón, Jorge Luis, Tresierra-Ayala, Miguel Ángel, Apolaya-Segura, Moisés","Acta Médica Peruana; 33(3); 250-252","Acta Médica Peruana","Espanhol","2016","http://www.scielo.org.pe/scielo.php?script=sci_arttext&pid=S1728-59172016000300017&lang=pt" 
"S1728-59172016000300016-per","Mala praxis periodística en el análisis del acto médico: propuestas de cambio","Valenzuela-Rodríguez, Germán, Herrera-Añazco, Percy","Acta Médica Peruana; 33(3); 248-249","Acta Médica Peruana","Espanhol","2016","http://www.scielo.org.pe/scielo.php?script=sci_arttext&pid=S1728-59172016000300016&lang=pt" 
"S1728-59172016000300009-per","Modelo TOPIC: tareas orientadas a los procesos ambulatorios en el primer nivel de atención","Masgo-Coronado, Karina Mariela, Cuba-Fuentes, María Sofía, Miranda-Mesías, Rocío","Acta Médica Peruana; 33(3); 223-227","Acta Médica Peruana","Espanhol","2016","http://www.scielo.org.pe/scielo.php?script=sci_arttext&pid=S1728-59172016000300009&lang=pt" 
"S1728-59172016000300014-per","¿Tesis en formato tradicional o de artículo científico?: percepciones de estudiantes de medicina de una universidad de Arequipa, 2016","Muñoz-del-Carpio-Toia, Agueda, Mayta-Tristán, Percy","Acta Médica Peruana; 33(3); 244-245","Acta Médica Peruana","Espanhol","2016","http://www.scielo.org.pe/scielo.php?script=sci_arttext&pid=S1728-59172016000300014&lang=pt" 
"S1728-59172016000300001-per","Infecciones nosocomiales","Maguiña Vargas, Ciro","Acta Médica Peruana; 33(3); 175-177","Acta Médica Peruana","Espanhol","2016","http://www.scielo.org.pe/scielo.php?script=sci_arttext&pid=S1728-59172016000300001&lang=pt" 
"S2314-15492016000100009-arg","Escenarios de poder: La escultura en el Parque General San Martín","Dussel, Pilar","Revista de historia americana y argentina; 51(1); 209-210","Revista de historia americana y argentina","Espanhol","2016","http://www.scielo.org.ar/scielo.php?script=sci_arttext&pid=S2314-15492016000100009&lang=pt" 
"S2314-15492016000100002-arg","HACER POLÍTICA PARA HACER NEGOCIOS: La política paraguaya, la política borbónica y los comerciantes de yerba en Santa Fe (Siglo XVIII)","Forconi, María Celeste","Revista de historia americana y argentina; 51(1); 39-66","Revista de historia americana y argentina","Espanhol","2016","http://www.scielo.org.ar/scielo.php?script=sci_arttext&pid=S2314-15492016000100002&lang=pt" 
"S2314-15492016000100003-arg","PLANIFICAR EL TERRITORIO METROPOLITANO: Historia de la planificación regional de Rosario (1935-1976)","Galimberti, Cecilia Inés","Revista de historia americana y argentina; 51(1); 69-101","Revista de historia americana y argentina","Espanhol","2016","http://www.scielo.org.ar/scielo.php?script=sci_arttext&pid=S2314-15492016000100003&lang=pt" 
"S2314-15492016000100004-arg","ALIADOS PERO FRAUDULENTOS: Las prácticas electorales en Santa Fe, Mendoza y Corrientes durante el bienio de Roberto M. Ortiz (1938-1940)","López, Ignacio A.","Revista de historia americana y argentina; 51(1); 103-130","Revista de historia americana y argentina","Espanhol","2016","http://www.scielo.org.ar/scielo.php?script=sci_arttext&pid=S2314-15492016000100004&lang=pt" 
"S2314-15492016000100001-arg","…Y QUE OLVIDEN LOS ERRORES DE SUS ANTIGUOS RITOS Y CEREMONIAS SUPERSTICIOSAS, VIVAN EN CONCIERTO Y POLICÍA…: Transformaciones y continuidades en la organización parroquial indígena potosina durante el siglo XVIII¹","De Luca, Candela","Revista de historia americana y argentina; 51(1); 11-37","Revista de historia americana y argentina","Espanhol","2016","http://www.scielo.org.ar/scielo.php?script=sci_arttext&pid=S2314-15492016000100001&lang=pt" 
"S2314-15492016000100005-arg","LA MILITANCIA FEMENINA EN LA RESISTENCIA PERONISTA TRAVÉS DE LA PRENSA OPOSITORA (1955-1958): Nora Lagos y los periódicos La Argentina y Soberanía¹","Gorza, Anabella","Revista de historia americana y argentina; 51(1); 131-167","Revista de historia americana y argentina","Espanhol","2016","http://www.scielo.org.ar/scielo.php?script=sci_arttext&pid=S2314-15492016000100005&lang=pt" 
"S2314-15492016000100006-arg","CONFLICTOS PROVINCIALES ENTRE LA TENDENCIA Y LA ORTODOXIA: La Rioja, un caso de estudio","Antúnez, Damián","Revista de historia americana y argentina; 51(1); 169-195","Revista de historia americana y argentina","Espanhol","2016","http://www.scielo.org.ar/scielo.php?script=sci_arttext&pid=S2314-15492016000100006&lang=pt" 
"S2314-15492016000100008-arg","San Martín: cuestiones disputadas","Miranda, Sebastián","Revista de historia americana y argentina; 51(1); 203-208","Revista de historia americana y argentina","Espanhol","2016","http://www.scielo.org.ar/scielo.php?script=sci_arttext&pid=S2314-15492016000100008&lang=pt" 
"S2314-15492016000100007-arg","EDBERTO OSCAR ACEVEDO (1926-2015)","","Revista de historia americana y argentina; 51(1); 199-200","Revista de historia americana y argentina","Espanhol","2016","http://www.scielo.org.ar/scielo.php?script=sci_arttext&pid=S2314-15492016000100007&lang=pt" 
