"S1517-97022012000200002-scl","A sala de aula foi o meu mundo: a carreira do magistério em São Paulo (1920-1950)","Alcântara, Wiara Rosa Rios","Educação e Pesquisa; 38(2); 289-305","Educação e Pesquisa","Português","2012","http://www.scielo.br/scielo.php?script=sci_arttext&pid=S1517-97022012000200002&lang=pt" 
"S1517-97022012000200003-scl","Proceso de transición hacia una consciência crítica-fenomenológica de la profesión docente","Vergara, Marcela Gaete, Hidalgo, Abelardo Castro","Educação e Pesquisa; 38(2); 308-322","Educação e Pesquisa","Espanhol","2012","http://www.scielo.br/scielo.php?script=sci_arttext&pid=S1517-97022012000200003&lang=pt" 
"S1517-97022012000200005-scl","Remuneração de professores no Brasil: um olhar a partir da Relação Anual de Informações Sociais (RAIS)","Fernandes, Maria Dilnéia Espíndola, Gouveia, Andrea Barbosa, Benini, Élcio Gustavo","Educação e Pesquisa; 38(2); 339-356","Educação e Pesquisa","Inglês, Português","2012","http://www.scielo.br/scielo.php?script=sci_arttext&pid=S1517-97022012000200005&lang=pt" 
"S1517-97022012000200008-scl","Professor de ensino superior: o entendimento a partir de narrativas de pós-graduandos em química","Quadros, Ana Luiza de, Silva, Dayse Carvalho da, Silva, Fernando César, Silva, Gilson de Freitas, Oliveira, Sheila Rodrigues, Andrade, Frank Pereira de, Tristão, Juliana Cristina, Santos, Leandro José, Aleme, Helga Gabriela","Educação e Pesquisa; 38(2); 389-402","Educação e Pesquisa","Português","2012","http://www.scielo.br/scielo.php?script=sci_arttext&pid=S1517-97022012000200008&lang=pt" 
"S1517-97022012000200012-scl","Educação moral: o aprender e o ensinar sobre justiça na escola","Müller, Adriana, Alencar, Heloisa Moulin de","Educação e Pesquisa; 38(2); 453-468","Educação e Pesquisa","Português","2012","http://www.scielo.br/scielo.php?script=sci_arttext&pid=S1517-97022012000200012&lang=pt" 
"S1517-97022012000200014-scl","Noemy Rudolfer e a organização da escola e do mundo do trabalho nos anos 1920 e 1930","Moraes, José Damiro de","Educação e Pesquisa; 38(2); 485-497","Educação e Pesquisa","Inglês, Português","2012","http://www.scielo.br/scielo.php?script=sci_arttext&pid=S1517-97022012000200014&lang=pt" 
"S1517-97022012000200015-scl","Promoção automática nos anos 1950: a experiência pioneira do Grupo Experimental da Lapa (São Paulo)","Viégas, Lygia S., Souza, Marilene P. R.","Educação e Pesquisa; 38(2); 499-514","Educação e Pesquisa","Inglês, Português","2012","http://www.scielo.br/scielo.php?script=sci_arttext&pid=S1517-97022012000200015&lang=pt" 
"S1517-97022012000200013-scl","Agroecologia, consumo sustentável e aprendizado coletivo no Brasil","Santos, Fernando Passos dos, Chalub-Martins, Leila","Educação e Pesquisa; 38(2); 469-484","Educação e Pesquisa","Português","2012","http://www.scielo.br/scielo.php?script=sci_arttext&pid=S1517-97022012000200013&lang=pt" 
"S1517-97022012000200010-scl","Dialogue, agency and experiential learning in international camps","Baraldi, Claudio","Educação e Pesquisa; 38(2); 419-436","Educação e Pesquisa","Inglês, Português","2012","http://www.scielo.br/scielo.php?script=sci_arttext&pid=S1517-97022012000200010&lang=pt" 
"S1517-97022012000200011-scl","Educação ao ar livre pela aventura: o aprendizado de valores morais em expedições à natureza","Kunreuther, Flavio Theodor, Ferraz, Osvaldo Luiz","Educação e Pesquisa; 38(2); 437-454","Educação e Pesquisa","Português","2012","http://www.scielo.br/scielo.php?script=sci_arttext&pid=S1517-97022012000200011&lang=pt" 
"S1517-97022012000200007-scl","Três gerações de avaliação da educação básica no Brasil: interfaces com o currículo da/na escola","Bonamino, Alicia, Sousa, Sandra Zákia","Educação e Pesquisa; 38(2); 373-388","Educação e Pesquisa","Inglês, Português","2012","http://www.scielo.br/scielo.php?script=sci_arttext&pid=S1517-97022012000200007&lang=pt" 
"S1516-14392012000300003-scl","Impact properties of aluminium - glass fiber reinforced plastics sandwich panels","Periasamy, Mathivanan, Manickam, Balakrishnan, Hariharasubramanian, Krishnan","Materials Research; 15(3); 347-354","Materials Research","Inglês","2012","http://www.scielo.br/scielo.php?script=sci_arttext&pid=S1516-14392012000300003&lang=pt" 
"S0104-42302012000300002-scl","A relação médico-paciente em algumas obras literárias","Cruz, Jorge","Revista da Associação Médica Brasileira; 58(3); 272-275","Revista da Associação Médica Brasileira","Inglês, Português","2012","http://www.scielo.br/scielo.php?script=sci_arttext&pid=S0104-42302012000300002&lang=pt" 
"S0104-42302012000300005-scl","Carcinoma endometrial: tratamento","","Revista da Associação Médica Brasileira; 58(3); 281-286","Revista da Associação Médica Brasileira","Inglês, Português","2012","http://www.scielo.br/scielo.php?script=sci_arttext&pid=S0104-42302012000300005&lang=pt" 
"S0104-42302012000300007-scl","Associação entre doença hepática gordurosa não alcoólica e marcadores de lesão/função hepática com componentes da síndrome metabólica em indivíduos obesos classe III","Chaves, Gabriela Villaça, Souza, Daiane Spitz de, Pereira, Silvia Elaine, Saboya, Carlos José, Peres, Wilza Arantes Ferreira","Revista da Associação Médica Brasileira; 58(3); 288-293","Revista da Associação Médica Brasileira","Inglês, Português","2012","http://www.scielo.br/scielo.php?script=sci_arttext&pid=S0104-42302012000300007&lang=pt" 
"S0104-42302012000300008-scl","Custo-efetividade e impacto orçamentário da saxagliptina como terapia adicional à metformina para o tratamento do diabetes mellitus tipo 2 no sistema de saúde suplementar do Brasil","Nita, Marcelo Eidi, Eliaschewitz, Freddy G., Ribeiro, Eliane, Asano, Elio, Barbosa, Elias, Takemoto, Maíra, Donato, Bonnie, Rached, Roberto, Rahal, Elaine","Revista da Associação Médica Brasileira; 58(3); 294-301","Revista da Associação Médica Brasileira","Inglês, Português","2012","http://www.scielo.br/scielo.php?script=sci_arttext&pid=S0104-42302012000300008&lang=pt" 
"S0104-42302012000300010-scl","Eficácia de antifúngicos tópicos em diferentes dermatomicoses: uma revisão sistemática com metanálise","Rotta, Inajara, Otuki, Michel Fleith, Sanches, Andréia Cristina Conegero, Correr, Cassyano Januário","Revista da Associação Médica Brasileira; 58(3); 308-318","Revista da Associação Médica Brasileira","Inglês, Português","2012","http://www.scielo.br/scielo.php?script=sci_arttext&pid=S0104-42302012000300010&lang=pt" 
"S0104-42302012000300014-scl","Priorização de pacientes em emergências médicas: uma análise ética","Fortes, Paulo Antônio de Carvalho, Pereira, Patricia Cristina Andrade","Revista da Associação Médica Brasileira; 58(3); 335-340","Revista da Associação Médica Brasileira","Inglês, Português","2012","http://www.scielo.br/scielo.php?script=sci_arttext&pid=S0104-42302012000300014&lang=pt" 
"S0104-42302012000300015-scl","Atividade física como preditor da ausência de fragilidade em idosos","Tribess, Sheilla, Virtuoso Júnior, Jair Sindra, Oliveira, Ricardo Jacó de","Revista da Associação Médica Brasileira; 58(3); 341-347","Revista da Associação Médica Brasileira","Inglês, Português","2012","http://www.scielo.br/scielo.php?script=sci_arttext&pid=S0104-42302012000300015&lang=pt" 
"S0104-42302012000300016-scl","Risco cardiovascular em pacientes submetidos ao transplante hepático","Ribeiro, Hélem de Sena, Anastácio, Lucilene Rezende, Ferreira, Lívia Garcia, Lima, Agnaldo Soares, Correia, Maria Isabel Toulson Davisson","Revista da Associação Médica Brasileira; 58(3); 348-354","Revista da Associação Médica Brasileira","Inglês, Português","2012","http://www.scielo.br/scielo.php?script=sci_arttext&pid=S0104-42302012000300016&lang=pt" 
"S0104-42302012000300018-scl","Fibromialgia: aspectos clínicos e ocupacionais","Helfenstein Junior, Milton, Goldenfum, Marco Aurélio, Siena, César Augusto Fávaro","Revista da Associação Médica Brasileira; 58(3); 358-365","Revista da Associação Médica Brasileira","Inglês, Português","2012","http://www.scielo.br/scielo.php?script=sci_arttext&pid=S0104-42302012000300018&lang=pt" 
"S0104-42302012000300019-scl","Proteômica: metodologias e aplicações no estudo de doenças humanas","Barbosa, Eduardo Buzolin, Vidotto, Alessandra, Polachini, Giovana Mussi, Henrique, Tiago, Marqui, Alessandra Bernadete Trovó de, Tajara, Eloiza Helena","Revista da Associação Médica Brasileira; 58(3); 366-375","Revista da Associação Médica Brasileira","Inglês, Português","2012","http://www.scielo.br/scielo.php?script=sci_arttext&pid=S0104-42302012000300019&lang=pt" 
"S0104-42302012000300022-scl","Manejo do paciente no período perioperatório em neurocirurgia pediátrica","Mekitarian Filho, Eduardo, Carvalho, Werther Brunow de, Cavalheiro, Sérgio","Revista da Associação Médica Brasileira; 58(3); 388-396","Revista da Associação Médica Brasileira","Inglês, Português","2012","http://www.scielo.br/scielo.php?script=sci_arttext&pid=S0104-42302012000300022&lang=pt" 
"S0103-17592012000300003-scl","Rao-Blackwellized particle filter with vector observations for satellite three-axis attitude estimation and control in a simulated testbed","Chagas, Ronan Arraes Jardim, Waldmann, Jacques","Sba: Controle &amp; Automação Sociedade Brasileira de Automatica; 23(3); 277-293","Sba: Controle &amp; Automação Sociedade Brasileira de Automatica","Inglês","2012","http://www.scielo.br/scielo.php?script=sci_arttext&pid=S0103-17592012000300003&lang=pt" 
"S0103-17592012000300004-scl","Análise do erro de previsão de vazões mensais com diferentes horizontes de previsão","Andrade, Marinho G., Reis, Ricardo Luis dos, Soares, Secundino, Silva Filho, Donato da","Sba: Controle &amp; Automação Sociedade Brasileira de Automatica; 23(3); 294-305","Sba: Controle &amp; Automação Sociedade Brasileira de Automatica","Português","2012","http://www.scielo.br/scielo.php?script=sci_arttext&pid=S0103-17592012000300004&lang=pt" 
"S0103-17592012000300005-scl","Alocação eficiente de indicadores de faltas em um sistema de distribuição real usando computação evolutiva","Usida, Wesley F., Coury, Denis V., Flauzino, Rogério A., Silva, Ivan N.","Sba: Controle &amp; Automação Sociedade Brasileira de Automatica; 23(3); 306-320","Sba: Controle &amp; Automação Sociedade Brasileira de Automatica","Português","2012","http://www.scielo.br/scielo.php?script=sci_arttext&pid=S0103-17592012000300005&lang=pt" 
"S0103-17592012000300006-scl","Aplicação do método GMRES em estudos de estabilidade de sistemas de energia elétrica","Pessanha, José E. O., Paz, Alex A., Prada, Ricardo","Sba: Controle &amp; Automação Sociedade Brasileira de Automatica; 23(3); 321-330","Sba: Controle &amp; Automação Sociedade Brasileira de Automatica","Português","2012","http://www.scielo.br/scielo.php?script=sci_arttext&pid=S0103-17592012000300006&lang=pt" 
"S0103-17592012000300007-scl","Calculation of parameter ranges for robust gain tuning of power system controllers","Oliveira, Ricardo Vasques de, Ramos, Rodrigo Andrade, Bretas, Newton Geraldo","Sba: Controle &amp; Automação Sociedade Brasileira de Automatica; 23(3); 331-345","Sba: Controle &amp; Automação Sociedade Brasileira de Automatica","Inglês","2012","http://www.scielo.br/scielo.php?script=sci_arttext&pid=S0103-17592012000300007&lang=pt" 
"S0103-17592012000300008-scl","Programação diária da operação de sistemas termoelétricos de geração utilizando otimização bio-inspirada em colônia de formigas","Silva Junior, Ivo Chaves, Nascimento, Flávia Rodrigues do, Oliveira, Edimar José de, Marcato, André Luis Marques, Dias, Bruno Henrique","Sba: Controle &amp; Automação Sociedade Brasileira de Automatica; 23(3); 346-355","Sba: Controle &amp; Automação Sociedade Brasileira de Automatica","Português","2012","http://www.scielo.br/scielo.php?script=sci_arttext&pid=S0103-17592012000300008&lang=pt" 
"S0103-17592012000300009-scl","Restrições de controle sobre cores decompostas: uma proposta no controle supervisório de sistemas a eventos discretos utilizando redes de Petri coloridas","Menezes, F. A. de Alencar, Barroso, Giovanni C., Prata, Bruno de A.","Sba: Controle &amp; Automação Sociedade Brasileira de Automatica; 23(3); 356-373","Sba: Controle &amp; Automação Sociedade Brasileira de Automatica","Português","2012","http://www.scielo.br/scielo.php?script=sci_arttext&pid=S0103-17592012000300009&lang=pt" 
"S0103-17592012000300010-scl","Aplicação de backstepping para controle de óxidos de nitrogênio em veículos diesel","Baldissera, Fabio L., Castelan, Eugênio B., Moreno, Ubirajara F., De Pieri, Edson R.","Sba: Controle &amp; Automação Sociedade Brasileira de Automatica; 23(3); 374-385","Sba: Controle &amp; Automação Sociedade Brasileira de Automatica","Português","2012","http://www.scielo.br/scielo.php?script=sci_arttext&pid=S0103-17592012000300010&lang=pt" 
"S0103-17592012000300002-scl","Análise comparativa de controladores repetitivos modificados para aplicação em inversores PWM","Michels, Leandro, Stefanello, Márcio, Gründling, Hilton Abílio","Sba: Controle &amp; Automação Sociedade Brasileira de Automatica; 23(3); 263-276","Sba: Controle &amp; Automação Sociedade Brasileira de Automatica","Português","2012","http://www.scielo.br/scielo.php?script=sci_arttext&pid=S0103-17592012000300002&lang=pt" 
"S1517-97022012000200004-scl","O triângulo da formação docente: seus jogadores e configurações","Sarti, Flavia Medeiros","Educação e Pesquisa; 38(2); 323-338","Educação e Pesquisa","Português","2012","http://www.scielo.br/scielo.php?script=sci_arttext&pid=S1517-97022012000200004&lang=pt" 
"S0034-75152012000200001-cub","Antimicrobianos antipseudomónicos antiguos, actuales y futuros","Morejón García, Moisés","Revista Cubana de Farmacia; 46(2); 138-140","Revista Cubana de Farmacia","Espanhol","2012","http://scielo.sld.cu/scielo.php?script=sci_arttext&pid=S0034-75152012000200001&lang=pt" 
"S0034-75152012000200002-cub","Publicaciones de la Autoridad Reguladora de Medicamentos y su impacto","Sánchez González, Celeste Aurora","Revista Cubana de Farmacia; 46(2); 141-149","Revista Cubana de Farmacia","Espanhol","2012","http://scielo.sld.cu/scielo.php?script=sci_arttext&pid=S0034-75152012000200002&lang=pt" 
"S0034-75152012000200003-cub","Incremento de disolución de un derivado del furano mediante la técnica de secado por atomización","Iraizoz Barrios, Antonio, Bataille, Bernard, Castanedo Cancio, Nilo, Iraizoz Colarte, Antonio, Lidwine, Grosmaire, Barrios Álvarez, María Aurora, Baylac, Giles","Revista Cubana de Farmacia; 46(2); 150-161","Revista Cubana de Farmacia","Espanhol","2012","http://scielo.sld.cu/scielo.php?script=sci_arttext&pid=S0034-75152012000200003&lang=pt" 
"S0034-75152012000200004-cub","Fosfato de cromo (III) marcado con diferentes radionúclidos para uso en radiosinoviortesis","Cruz Arencibia, Jorge, Morín Zorrilla, José, Cruz Morales, Amed, Tamayo Fuente, Radamés, Taylor Delgado, Tamara, Samiñón Medina, Milagros","Revista Cubana de Farmacia; 46(2); 162-172","Revista Cubana de Farmacia","Espanhol","2012","http://scielo.sld.cu/scielo.php?script=sci_arttext&pid=S0034-75152012000200004&lang=pt" 
"S0034-75152012000200005-cub","Desarrollo tecnológico de cisplatino solución inyectable","Gato del Monte, Armando, Padrón Yaquis, Alejandro Saúl","Revista Cubana de Farmacia; 46(2); 173-182","Revista Cubana de Farmacia","Espanhol","2012","http://scielo.sld.cu/scielo.php?script=sci_arttext&pid=S0034-75152012000200005&lang=pt" 
"S0034-75152012000200006-cub","Validación del método de valoración biológica de gonadotrofina coriónica humana","Lagarto Parra, Alicia, García Peña, Caridad, Gabilondo Ramírez, Tatiana, Triana Manso, Osmaida","Revista Cubana de Farmacia; 46(2); 183-190","Revista Cubana de Farmacia","Espanhol","2012","http://scielo.sld.cu/scielo.php?script=sci_arttext&pid=S0034-75152012000200006&lang=pt" 
"S0034-75152012000200007-cub","Validación del método de determinación de efecto anestésico local","Lagarto Parra, Alicia, Torres Amaro, Leonid, Carrillo Domínguez, Carmen, Gabilondo Ramírez, Tatiana","Revista Cubana de Farmacia; 46(2); 191-201","Revista Cubana de Farmacia","Espanhol","2012","http://scielo.sld.cu/scielo.php?script=sci_arttext&pid=S0034-75152012000200007&lang=pt" 
"S0034-75152012000200008-cub","Síndrome de lipodistrofia en pacientes con VIH/sida que reciben terapia antirretroviral de gran actividad en Tepic, México","Fernández Argüelles, Rogelio Alberto, Gutiérrez Rentería, César Cuautemoc, Castro Melchor, Pedro, Flores García, Aurelio, Cancino Marentes, Martha Edith","Revista Cubana de Farmacia; 46(2); 202-212","Revista Cubana de Farmacia","Espanhol","2012","http://scielo.sld.cu/scielo.php?script=sci_arttext&pid=S0034-75152012000200008&lang=pt" 
"S0034-75152012000200009-cub","Contradicciones sociales expresadas en la práctica de la Atención Farmacéutica Hospitalaria en Cuba","Reyes Hernández, Ivette, Bermúdez Camps, Isis Beatríz","Revista Cubana de Farmacia; 46(2); 213-223","Revista Cubana de Farmacia","Espanhol","2012","http://scielo.sld.cu/scielo.php?script=sci_arttext&pid=S0034-75152012000200009&lang=pt" 
"S0034-75152012000200010-cub","Propuesta de adaptación de la hoja de historia farmacoterapéutica del método Dáder para aprendices","Carvalho Amarante, Laila, Sanae Shoji, Luci, Freitas, Kátia Michele, Radighieri Rascado, Ricardo, Silva, Lara Cristina, Moreira Marques, Luciene Alves","Revista Cubana de Farmacia; 46(2); 224-239","Revista Cubana de Farmacia","Espanhol","2012","http://scielo.sld.cu/scielo.php?script=sci_arttext&pid=S0034-75152012000200010&lang=pt" 
"S0034-75152012000200011-cub","Estabilidad en estante de tabletas de las hojas de Tamarindus indica L","Rodríguez Amado, Jesús Rafael, Lafourcade Prada, Ariadna, Escalona Arranz, Julio César, Iraizoz Colarte, Antonio, Sierra González, Gustavo","Revista Cubana de Farmacia; 46(2); 240-248","Revista Cubana de Farmacia","Espanhol","2012","http://scielo.sld.cu/scielo.php?script=sci_arttext&pid=S0034-75152012000200011&lang=pt" 
"S0034-75152012000200012-cub","Effects of D-002 on aspirin-induced ulcers and neutrophil infiltration on the gastric mucosa","Valle Clara, Maikel, Noa Puig, Miriam, Mendoza Castaño, Sarahí, Oyarzábal Yera, Ambar, Molina Cuevas, Vivian, Mendoza Hernández, Nilda, Mas Ferreiro, Rosa","Revista Cubana de Farmacia; 46(2); 249-258","Revista Cubana de Farmacia","Inglês","2012","http://scielo.sld.cu/scielo.php?script=sci_arttext&pid=S0034-75152012000200012&lang=pt" 
"S0034-75152012000200013-cub","Efecto in vitro del D-002 sobre la actividad enzimática de la 5-lipoxigenasa (5-LOX)","Pérez Guerra, Yohani, Oyarzábal Yera, Ambar, Ravelo Calzado, Yasmín, Mas Ferreiro, Rosa, Jiménez Despaigne, Sonia, Molina Cuevas, Vivian","Revista Cubana de Farmacia; 46(2); 259-266","Revista Cubana de Farmacia","Espanhol","2012","http://scielo.sld.cu/scielo.php?script=sci_arttext&pid=S0034-75152012000200013&lang=pt" 
"S0034-75152012000200014-cub","Procesos moleculares patogénicos de la aterosclerosis y alternativas terapéuticas para su control","Delgado Roche, Livan, Vázquez López, Ana María, Martínez-Sánchez, Gregorio","Revista Cubana de Farmacia; 46(2); 267-280","Revista Cubana de Farmacia","Espanhol","2012","http://scielo.sld.cu/scielo.php?script=sci_arttext&pid=S0034-75152012000200014&lang=pt" 
"S0034-75152012000200015-cub","Atorvastatina","","Revista Cubana de Farmacia; 46(2); 281-283","Revista Cubana de Farmacia","Espanhol","2012","http://scielo.sld.cu/scielo.php?script=sci_arttext&pid=S0034-75152012000200015&lang=pt" 
"S0034-75152012000200016-cub","BCG inmunoterápico","","Revista Cubana de Farmacia; 46(2); 284-286","Revista Cubana de Farmacia","Espanhol","2012","http://scielo.sld.cu/scielo.php?script=sci_arttext&pid=S0034-75152012000200016&lang=pt" 
"S0034-75152012000200017-cub","Eritropoyetina humana recombinante","","Revista Cubana de Farmacia; 46(2); 287-288","Revista Cubana de Farmacia","Espanhol","2012","http://scielo.sld.cu/scielo.php?script=sci_arttext&pid=S0034-75152012000200017&lang=pt" 
"S1028-47962012000200001-cub","Influencia del tratamiento con extractos de plantas de Cuba sobre el tumor ascítico de Erlich","Colom Loo, Yamila, Azcue Ferrera, Mairely, Pérez Gil, Rita M, Respall, Mabel, Cepero Cañas, Janet, Quesada, Waldo","Revista Cubana de Plantas Medicinales; 17(2); 115-124","Revista Cubana de Plantas Medicinales","Espanhol","2012","http://scielo.sld.cu/scielo.php?script=sci_arttext&pid=S1028-47962012000200001&lang=pt" 
"S1028-47962012000200002-cub","Estabilidad físico-química y microbiológica de la corteza fresca de Mangifera indica L.","Nuevas-Paz, Lauro, Álvarez de León, Juan Carlos, Suárez-Torras, Ayme, Sordo-Martínez, Lisette, González-Hernández, Leonora, Acosta-Esquijarosa, Jhoany","Revista Cubana de Plantas Medicinales; 17(2); 125-133","Revista Cubana de Plantas Medicinales","Espanhol","2012","http://scielo.sld.cu/scielo.php?script=sci_arttext&pid=S1028-47962012000200002&lang=pt" 
"S1028-47962012000200003-cub","Análise toxicológica da fase I do exsudato extraído do fruto de Mangifera indica L.","Henrique da Silva Ramos, Eduardo, Simões Duarte, Helena, Chavez Jimenez, George","Revista Cubana de Plantas Medicinales; 17(2); 134-148","Revista Cubana de Plantas Medicinales","Português","2012","http://scielo.sld.cu/scielo.php?script=sci_arttext&pid=S1028-47962012000200003&lang=pt" 
"S1028-47962012000200004-cub","Efeitos citotóxico, genotóxico e mutagênico da tintura de Matricaria chamomilla L. in vivo","Macedo Delarmelina, Juliana, Pimentel Batitucci, Maria do Carmo, de Oliveira Gonçalves, Jefferson Luiz","Revista Cubana de Plantas Medicinales; 17(2); 149-159","Revista Cubana de Plantas Medicinales","Português","2012","http://scielo.sld.cu/scielo.php?script=sci_arttext&pid=S1028-47962012000200004&lang=pt" 
"S1028-47962012000200005-cub","Actividad biológica de los aceites esenciales de Acmella ciliata (Kunth) Cass","Rincón Mejía, Carlos Andrés, Castaño Osorio, Jhon Carlos, Ríos Vázquez, Eunice","Revista Cubana de Plantas Medicinales; 17(2); 160-171","Revista Cubana de Plantas Medicinales","Espanhol","2012","http://scielo.sld.cu/scielo.php?script=sci_arttext&pid=S1028-47962012000200005&lang=pt" 
"S1028-47962012000200006-cub","In vitro antimalarial activity of fractions and constituents isolated from Tabebuia billbergii","Gómez-Estrada, Harold, Gaitán-Ibarra, Ricardo, Díaz-Castillo, Fredyc, Pérez, Hilda A, Medina, José D","Revista Cubana de Plantas Medicinales; 17(2); 172-180","Revista Cubana de Plantas Medicinales","Inglês","2012","http://scielo.sld.cu/scielo.php?script=sci_arttext&pid=S1028-47962012000200006&lang=pt" 
"S1028-47962012000200007-cub","Farmacognosia, farmacobotánica, farmacogeografía y farmacoetimología del platanillo de Cuba (Piper aduncum subespecie ossanum)","Abreu Guirado, Orlando A, Rodríguez Tamargo, Ana A, Morgado Montes, Maybel, Cao Vocero, Laura B","Revista Cubana de Plantas Medicinales; 17(2); 181-193","Revista Cubana de Plantas Medicinales","Espanhol","2012","http://scielo.sld.cu/scielo.php?script=sci_arttext&pid=S1028-47962012000200007&lang=pt" 
"S1028-47962012000200008-cub","Importancia química de Jatropha curcas y sus aplicaciones biológicas, farmacológicas e industriales","Pabón, Ludy C, Hernández-Rodríguez, Patricia","Revista Cubana de Plantas Medicinales; 17(2); 194-209","Revista Cubana de Plantas Medicinales","Espanhol","2012","http://scielo.sld.cu/scielo.php?script=sci_arttext&pid=S1028-47962012000200008&lang=pt" 
"S0104-66322012000200002-scl","Nitrogen removal from landfill leachate via the nitrite route","Kulikowska, D.","Brazilian Journal of Chemical Engineering; 29(2); 211-219","Brazilian Journal of Chemical Engineering","Inglês","2012","http://www.scielo.br/scielo.php?script=sci_arttext&pid=S0104-66322012000200002&lang=pt" 
"S0104-66322012000200008-scl","Two-phase experimental heat transfer studies on a water-diesel system in a shell and tube heat exchanger","Alagesan, V., Sundaram, S.","Brazilian Journal of Chemical Engineering; 29(2); 275-283","Brazilian Journal of Chemical Engineering","Inglês","2012","http://www.scielo.br/scielo.php?script=sci_arttext&pid=S0104-66322012000200008&lang=pt" 
"S0104-66322012000200013-scl","Characterization of lyophilized liposomes produced with non-purified soy lecithin: a case study of casein hydrolysate microencapsulation","Yokota, D., Moraes, M., Pinho, S. C.","Brazilian Journal of Chemical Engineering; 29(2); 325-335","Brazilian Journal of Chemical Engineering","Inglês","2012","http://www.scielo.br/scielo.php?script=sci_arttext&pid=S0104-66322012000200013&lang=pt" 
"S0104-66322012000200019-scl","Pore blocking mechanism for the recovery of milk solids from dairy wastewater by ultrafiltration","Brião, V. B., Tavares, C. R. G.","Brazilian Journal of Chemical Engineering; 29(2); 393-407","Brazilian Journal of Chemical Engineering","Inglês","2012","http://www.scielo.br/scielo.php?script=sci_arttext&pid=S0104-66322012000200019&lang=pt" 
"S1517-97022012000200001-scl","Editorial","","Educação e Pesquisa; 38(2); 279-285","Educação e Pesquisa","Inglês, Português","2012","http://www.scielo.br/scielo.php?script=sci_arttext&pid=S1517-97022012000200001&lang=pt" 
"S1517-97022012000200016-scl","Uma escola para homem rural: a cultura popular, os camponeses e o movimento de educação de base (1960-1964)","Souza, Claudia Moraes de","Educação e Pesquisa; 38(2); 515-529","Educação e Pesquisa","Português","2012","http://www.scielo.br/scielo.php?script=sci_arttext&pid=S1517-97022012000200016&lang=pt" 
