"S1130-01082012000400011-esp","Splenic rupture following diagnostic colonoscopy","González-Soler, Roberto, Castro-Ortiz, Elena, Lancho-Seco, Ángeles, García-Suárez, Covadonga, Santos-Blanco, Eva, Carral-Martínez, David, Ávila-Nasi, Susana, González-Ramírez, Abel, López-Rosés, Leopoldo","Revista Española de Enfermedades Digestivas; 104(4); 219-220","Revista Española de Enfermedades Digestivas","Inglês","2012","http://scielo.isciii.es/scielo.php?script=sci_arttext&pid=S1130-01082012000400011&lang=pt" 
"S1130-01082012000400004-esp","Is there still a role for intraoperative enteroscopy in patients with obscure gastrointestinal bleeding?","Monsanto, Pedro, Almeida, Nuno, Lérias, Clotilde, Figueiredo, Pedro, Gouveia, Hermano, Sofia, Carlos","Revista Española de Enfermedades Digestivas; 104(4); 190-196","Revista Española de Enfermedades Digestivas","Inglês","2012","http://scielo.isciii.es/scielo.php?script=sci_arttext&pid=S1130-01082012000400004&lang=pt" 
"S1130-01082012000400007-esp","Bronchobiliary fistula","Martínez-Velado, Emilia, Palomar-Rodríguez, Luis Miguel, Olivo-Esteban, Juan Ramón","Revista Española de Enfermedades Digestivas; 104(4); 210-211","Revista Española de Enfermedades Digestivas","Inglês","2012","http://scielo.isciii.es/scielo.php?script=sci_arttext&pid=S1130-01082012000400007&lang=pt" 
"S1130-01082012000400002-esp","Drug dosage recommendations in patients with chronic liver disease","Periáñez-Párraga, Leonor, Martínez-López, Iciar, Ventayol-Bosch, Pere, Puigventós-Latorre, Francesc, Delgado-Sánchez, Olga","Revista Española de Enfermedades Digestivas; 104(4); 165-184","Revista Española de Enfermedades Digestivas","Inglês","2012","http://scielo.isciii.es/scielo.php?script=sci_arttext&pid=S1130-01082012000400002&lang=pt" 
"S1130-01082012000400015-esp","Collagenous sprue with associated features of refractory celiac disease","Cuoco, Lucio, Villanacci, Vincenzo, Salvagnini, Mario, Bassotti, Gabrio","Revista Española de Enfermedades Digestivas; 104(4); 223-225","Revista Española de Enfermedades Digestivas","Inglês","2012","http://scielo.isciii.es/scielo.php?script=sci_arttext&pid=S1130-01082012000400015&lang=pt" 
"S1130-01082012000400012-esp","Relationship between H. pylori and hepatitis A virus infection","Castro-Fernández, Manuel, Vargas-Romero, Julio, Hoyas, Elena, Lamas, Eloisa, Millán, Raquel, Romero-Gómez, Manuel","Revista Española de Enfermedades Digestivas; 104(4); 220-221","Revista Española de Enfermedades Digestivas","Inglês","2012","http://scielo.isciii.es/scielo.php?script=sci_arttext&pid=S1130-01082012000400012&lang=pt" 
"S1576-59622012000100004-esp","The Human Resource Management in Call Centres: The Development of a Questionnair","Catanheira, Filipa, Chambel, María José","Revista de Psicología del Trabajo y de las Organizaciones; 28(1); 37-50","Revista de Psicología del Trabajo y de las Organizaciones","Inglês","2012","http://scielo.isciii.es/scielo.php?script=sci_arttext&pid=S1576-59622012000100004&lang=pt" 
"S1130-01082012000400003-esp","Self-expanding metal stents versus antrectomy for the palliative treatment of obstructive adenocarcinoma of the gastric antrum","Alonso-Larraga, Juan Octavio, Álvaro-Villegas, Julio César, Sobrino-Cossio, Sergio, Hernández-Guerrero, Angélica, Mora-Levy, Guillermo de la, Figueroa-Barojas, Paola","Revista Española de Enfermedades Digestivas; 104(4); 185-189","Revista Española de Enfermedades Digestivas","Inglês","2012","http://scielo.isciii.es/scielo.php?script=sci_arttext&pid=S1130-01082012000400003&lang=pt" 
"S1130-01082012000400010-esp","Endoscopia en pacientes antiagregados","Alberca de las Parras, Fernando","Revista Española de Enfermedades Digestivas; 104(4); 218-218","Revista Española de Enfermedades Digestivas","Espanhol","2012","http://scielo.isciii.es/scielo.php?script=sci_arttext&pid=S1130-01082012000400010&lang=pt" 
"S1851-82652012000100001-spa","Agrotóxicos: nuevos y viejos desafíos para la salud colectiva","Augusto, Lia Giraldo da Silva","Salud Colectiva; 8(1); 5-8","Salud Colectiva","Espanhol","2012","http://www.scielosp.org/scielo.php?script=sci_arttext&pid=S1851-82652012000100001&lang=pt" 
"S1576-59622012000100001-esp","Personality Antecedents of Self-Other Rating Discrepancy","Sinha, Nila, Mesmer-Magnus, Jessica, Viswesvaran, Chockalingam","Revista de Psicología del Trabajo y de las Organizaciones; 28(1); 3-14","Revista de Psicología del Trabajo y de las Organizaciones","Inglês","2012","http://scielo.isciii.es/scielo.php?script=sci_arttext&pid=S1576-59622012000100001&lang=pt" 
"S1130-01082012000400016-esp","Contribution of contrast enhanced sonography in the etiological diagnosis of focal splenic lesions","Casanova-Martínez, Laura, Marín-Serrano, Eva, Jaquotot-Herranz, Marta, Mora-Sanz, Pedro, Segura-Cabral, José María","Revista Española de Enfermedades Digestivas; 104(4); 225-226","Revista Española de Enfermedades Digestivas","Inglês","2012","http://scielo.isciii.es/scielo.php?script=sci_arttext&pid=S1130-01082012000400016&lang=pt" 
"S1851-82652012000100008-spa","¿Quién es el Dr. Alvarado?","Jauretche, Arturo","Salud Colectiva; 8(1); 81-83","Salud Colectiva","Espanhol","2012","http://www.scielosp.org/scielo.php?script=sci_arttext&pid=S1851-82652012000100008&lang=pt" 
"S1851-82652012000100003-spa","Contribuciones metodológicas para estudiar la producción del cuidado en salud: aprendizajes a partir de una investigación sobre barreras y acceso en salud mental","Merhy, Emerson Elias, Feuerwerker, Laura Camargo Macruz, Silva, Erminia","Salud Colectiva; 8(1); 25-34","Salud Colectiva","Espanhol","2012","http://www.scielosp.org/scielo.php?script=sci_arttext&pid=S1851-82652012000100003&lang=pt" 
"S0103-33522012000100002-scl","Apresentação","Miguel, Luis Felipe, Biroli, Flávia","Revista Brasileira de Ciência Política; (7); 19-23","Revista Brasileira de Ciência Política","Português","2012","http://www.scielo.br/scielo.php?script=sci_arttext&pid=S0103-33522012000100002&lang=pt" 
"S0103-33522012000100001-scl","Guillermo O&#039;Donnell (1936-2011)","Nascimento, Paulo César","Revista Brasileira de Ciência Política; (7); 9-14","Revista Brasileira de Ciência Política","Português","2012","http://www.scielo.br/scielo.php?script=sci_arttext&pid=S0103-33522012000100001&lang=pt" 
"S0103-33522012000100007-scl","Aborto, direitos reprodutivos e feminismo na França de Nicolas Sarkozy","Santos, Beatriz Carneiro dos","Revista Brasileira de Ciência Política; (7); 133-143","Revista Brasileira de Ciência Política","Português","2012","http://www.scielo.br/scielo.php?script=sci_arttext&pid=S0103-33522012000100007&lang=pt" 
"S0103-33522012000100013-scl","Justiça constitucional, legitimidade e interesse público","Filgueiras, Fernando","Revista Brasileira de Ciência Política; (7); 319-347","Revista Brasileira de Ciência Política","Português","2012","http://www.scielo.br/scielo.php?script=sci_arttext&pid=S0103-33522012000100013&lang=pt" 
"S0103-33522012000100016-scl","José Álvaro Moisés (org) - Democracia e confiança: por que os cidadãos desconfiam das instituições públicas?","Bonifácio, Robert","Revista Brasileira de Ciência Política; (7); 399-406","Revista Brasileira de Ciência Política","Português","2012","http://www.scielo.br/scielo.php?script=sci_arttext&pid=S0103-33522012000100016&lang=pt" 
"S0103-33522012000100015-scl","Ian Hershaw: Hitler","Silva, Rogério Souza","Revista Brasileira de Ciência Política; (7); 389-398","Revista Brasileira de Ciência Política","Português","2012","http://www.scielo.br/scielo.php?script=sci_arttext&pid=S0103-33522012000100015&lang=pt" 
"S1130-01082012000400001-esp","Drugs prescription in patients with chronic liver disease: rules for adjusting doses and beyond","Andrade, Raúl J., Lucena, María Isabel","Revista Española de Enfermedades Digestivas; 104(4); 161-164","Revista Española de Enfermedades Digestivas","Inglês","2012","http://scielo.isciii.es/scielo.php?script=sci_arttext&pid=S1130-01082012000400001&lang=pt" 
"S1657-59972012000100002-col","Validación de dos escalas utilizadas en la medición del cuidado humano transpersonal basadas en la Teoría de Jean Watson","Poblete-Troncoso, Margarita del Carmen, Valenzuela-Suazo, Sandra Verónica, Merino, José Manuel","Aquichán; 12(1); 8-21","Aquichán","Espanhol","2012","http://www.scielo.org.co/scielo.php?script=sci_arttext&pid=S1657-59972012000100002&lang=pt" 
"S1657-59972012000100003-col","Validez y confiabilidad de una escala de valoración de comportamientos de autocuidado en personas con falla cardiaca","Rodríguez-Gázquez, María de los Ángeles, Arredondo-Holguín, Edith","Aquichán; 12(1); 22-31","Aquichán","Espanhol","2012","http://www.scielo.org.co/scielo.php?script=sci_arttext&pid=S1657-59972012000100003&lang=pt" 
"S1657-59972012000100001-col","Medición de fenómenos de enfermería: el reto de la validez y confiabilidad en la investigación cuantitativa","Carvajal-Carrascal, Gloria","Aquichán; 12(1); 5-7","Aquichán","Espanhol","2012","http://www.scielo.org.co/scielo.php?script=sci_arttext&pid=S1657-59972012000100001&lang=pt" 
"S1657-59972012000100006-col","La adherencia al autocuidado en personas con enfermedad cardiovascular: abordaje desde el Modelo de Orem","Olivella-Fernández, Madeleine Cecilia, Bastidas-Sánchez, Clara Victoria, Castiblanco-Amaya, Myriam Angélica","Aquichán; 12(1); 53-61","Aquichán","Espanhol","2012","http://www.scielo.org.co/scielo.php?script=sci_arttext&pid=S1657-59972012000100006&lang=pt" 
"S1657-59972012000100007-col","Aporte de enfermería a la calidad de vida del cuidador familiar del paciente con Alzheimer","Vargas-Escobar, Lina María","Aquichán; 12(1); 62-76","Aquichán","Espanhol","2012","http://www.scielo.org.co/scielo.php?script=sci_arttext&pid=S1657-59972012000100007&lang=pt" 
"S1657-59972012000100004-col","Consentimiento informado: un pilar de la investigación clínica","Carrasco-Aldunate, Paola, Rubio-Acuña, Miriam, Fuentes-Olavarría, Daniela","Aquichán; 12(1); 32-41","Aquichán","Espanhol","2012","http://www.scielo.org.co/scielo.php?script=sci_arttext&pid=S1657-59972012000100004&lang=pt" 
"S1657-59972012000100005-col","La enfermería en Colombia: una mirada desde la sociología de las profesiones","Gómez-Bustamante, Edna Margarita","Aquichán; 12(1); 42-52","Aquichán","Espanhol","2012","http://www.scielo.org.co/scielo.php?script=sci_arttext&pid=S1657-59972012000100005&lang=pt" 
"S0103-33522012000100003-scl","Aborto e ativismo religioso nas eleições de 2010","Machado, Maria das Dores Campos","Revista Brasileira de Ciência Política; (7); 25-54","Revista Brasileira de Ciência Política","Português","2012","http://www.scielo.br/scielo.php?script=sci_arttext&pid=S0103-33522012000100003&lang=pt" 
"S0103-33522012000100004-scl","Toma que o aborto é teu: a politização do aborto em jornais e na web durante a campanha presidencial de 2010","Ramos, Jair de Souza","Revista Brasileira de Ciência Política; (7); 55-82","Revista Brasileira de Ciência Política","Português","2012","http://www.scielo.br/scielo.php?script=sci_arttext&pid=S0103-33522012000100004&lang=pt" 
"S0103-33522012000100005-scl","Aborto por anencefalia na mídia brasileira: análise retórica do debate entre as posições &quot;pró-escolha&quot; e &quot;pró-vida&quot;","Ribeiro, Flávia Regina Guedes","Revista Brasileira de Ciência Política; (7); 83-114","Revista Brasileira de Ciência Política","Português","2012","http://www.scielo.br/scielo.php?script=sci_arttext&pid=S0103-33522012000100005&lang=pt" 
"S0103-33522012000100006-scl","O aborto na Argentina: implicações do acesso à prática da interrupção voluntária da gravidez","Drovetta, Raquel Irene","Revista Brasileira de Ciência Política; (7); 115-132","Revista Brasileira de Ciência Política","Português","2012","http://www.scielo.br/scielo.php?script=sci_arttext&pid=S0103-33522012000100006&lang=pt" 
"S0103-33522012000100008-scl","Uma defesa do aborto","Thomson, Judith Jarvis","Revista Brasileira de Ciência Política; (7); 145-163","Revista Brasileira de Ciência Política","Português","2012","http://www.scielo.br/scielo.php?script=sci_arttext&pid=S0103-33522012000100008&lang=pt" 
"S0103-33522012000100009-scl","Repensando a privacidade: autonomia, identidade e a controvérsia sobre o aborto","Cohen, Jean L.","Revista Brasileira de Ciência Política; (7); 165-203","Revista Brasileira de Ciência Política","Português","2012","http://www.scielo.br/scielo.php?script=sci_arttext&pid=S0103-33522012000100009&lang=pt" 
"S0103-33522012000100010-scl","As dimensões antropológicas do aborto","Boltanski, Luc","Revista Brasileira de Ciência Política; (7); 205-245","Revista Brasileira de Ciência Política","Português","2012","http://www.scielo.br/scielo.php?script=sci_arttext&pid=S0103-33522012000100010&lang=pt" 
"S0103-33522012000100011-scl","Conferências de políticas públicas: um sistema integrado de participação e deliberação?","Faria, Claudia Feres, Silva, Viviane Petinelli, Lins, Isabella Lourenço","Revista Brasileira de Ciência Política; (7); 249-284","Revista Brasileira de Ciência Política","Português","2012","http://www.scielo.br/scielo.php?script=sci_arttext&pid=S0103-33522012000100011&lang=pt" 
"S0103-33522012000100012-scl","Eleições municipais comparadas: a escolha do chefe do executivo no Brasil e no Uruguai e o impacto sobre os sistemas partidários locais (2000-2005)","Barreto, Alvaro Augusto de Borba","Revista Brasileira de Ciência Política; (7); 285-317","Revista Brasileira de Ciência Política","Português","2012","http://www.scielo.br/scielo.php?script=sci_arttext&pid=S0103-33522012000100012&lang=pt" 
"S0103-33522012000100014-scl","A transformação dos sistemas partidários da Europa Ocidental","Kirchheimer, Otto","Revista Brasileira de Ciência Política; (7); 349-385","Revista Brasileira de Ciência Política","Português","2012","http://www.scielo.br/scielo.php?script=sci_arttext&pid=S0103-33522012000100014&lang=pt" 
"S0365-66912012000400008-esp","Fototoxicidad (3): Daño ocular por arco de soldadura","Zozaya Aldana, B.","Archivos de la Sociedad Española de Oftalmología; 87(4); 128-128","Archivos de la Sociedad Española de Oftalmología","Espanhol","2012","http://scielo.isciii.es/scielo.php?script=sci_arttext&pid=S0365-66912012000400008&lang=pt" 
"S0365-66912012000400006-esp","Un ojo enigmático en un busto enigmático","Ascaso, F.J., Lizana, J.","Archivos de la Sociedad Española de Oftalmología; 87(4); 125-126","Archivos de la Sociedad Española de Oftalmología","Espanhol","2012","http://scielo.isciii.es/scielo.php?script=sci_arttext&pid=S0365-66912012000400006&lang=pt" 
"S0365-66912012000400001-esp","Dispositivo de Ahmed versus Baerveldt: ¿cuál es mejor?","Moreno-Montañés, J., Nova, E. de, Bonet Farriol, E.","Archivos de la Sociedad Española de Oftalmología; 87(4); 105-106","Archivos de la Sociedad Española de Oftalmología","Espanhol","2012","http://scielo.isciii.es/scielo.php?script=sci_arttext&pid=S0365-66912012000400001&lang=pt" 
"S0365-66912012000400004-esp","Utilidad de marcadores inmunohistoquímicos para el diagnóstico de lesiones pigmentadas conjuntivales","Bellido Muñoz, R.M., Domínguez Hidalgo, I., García Serrano, J.L., López Peña, C.","Archivos de la Sociedad Española de Oftalmología; 87(4); 119-121","Archivos de la Sociedad Española de Oftalmología","Espanhol","2012","http://scielo.isciii.es/scielo.php?script=sci_arttext&pid=S0365-66912012000400004&lang=pt" 
"S0365-66912012000400009-esp","Cândido Mariano Da Silva Rondon: Santo Antonio do Laverger/Mimoso, Brasil (1865)-Río de Janeiro, Brasil (1958)","Noguera Paláu, J.J.","Archivos de la Sociedad Española de Oftalmología; 87(4); 129-130","Archivos de la Sociedad Española de Oftalmología","Espanhol","2012","http://scielo.isciii.es/scielo.php?script=sci_arttext&pid=S0365-66912012000400009&lang=pt" 
"S1415-98482012000100001-scl","The evolution of development conventions","Erber, Fabio Stefano","Revista de Economia Contemporânea; 16(1); 1-22","Revista de Economia Contemporânea","Inglês","2012","http://www.scielo.br/scielo.php?script=sci_arttext&pid=S1415-98482012000100001&lang=pt" 
"S1415-98482012000100004-scl","Análise da relação entre importações e produtividade: evidência empírica para a indústria de transformação do Brasil","Silva, Igor Ézio Maciel, Bezerra, Jocildo Fernandes, Lima, Ricardo Chaves","Revista de Economia Contemporânea; 16(1); 62-87","Revista de Economia Contemporânea","Português","2012","http://www.scielo.br/scielo.php?script=sci_arttext&pid=S1415-98482012000100004&lang=pt" 
"S0100-69162012000200003-scl","Substrate with Organosuper® for cucumber seedlings formation in protected environments and polystyrene trays","Costa, Edilson, Vieira, Laura C. R., Leal, Paulo A. M., Jara, Murillo C. de S., Silva, Priscilla N. de L.","Engenharia Agrícola; 32(2); 226-235","Engenharia Agrícola","Inglês","2012","http://www.scielo.br/scielo.php?script=sci_arttext&pid=S0100-69162012000200003&lang=pt" 
"S0100-69162012000200013-scl","Rheological behavior of mixed drink of annona and milk","Duarte, Maria E. M., Gouveia, Deyzi S., Mata, Mario E. R. M. C., Queiroz, Alexandre J. de M.","Engenharia Agrícola; 32(2); 333-341","Engenharia Agrícola","Inglês","2012","http://www.scielo.br/scielo.php?script=sci_arttext&pid=S0100-69162012000200013&lang=pt" 
"S0100-69162012000200015-scl","Determination of the influence of the variation of reducing and non-reducing sugars on coffee quality with use of artificial neural network","Messias, José A. T., Melo, Evandro de C., Lacerda Filho, Adílio F. de, Braga, José L., Cecon, Paulo R.","Engenharia Agrícola; 32(2); 354-360","Engenharia Agrícola","Inglês","2012","http://www.scielo.br/scielo.php?script=sci_arttext&pid=S0100-69162012000200015&lang=pt" 
"S0718-18762012000100001-chl","Editorial: In Memoriam of Associate Professor Dr Elaine Lawrence","Michael, Katina","Journal of theoretical and applied electronic commerce research; 7(1); i-ii","Journal of theoretical and applied electronic commerce research","Inglês","2012","http://www.scielo.cl/scielo.php?script=sci_arttext&pid=S0718-18762012000100001&lang=pt" 
"S0718-18762012000100002-chl","Addressing Common Vulnerabilities of Reputation Systems for Electronic Commerce","Yao, Yuan, Ruohomaa, Sini, Xu, Feng","Journal of theoretical and applied electronic commerce research; 7(1); 1-20","Journal of theoretical and applied electronic commerce research","Inglês","2012","http://www.scielo.cl/scielo.php?script=sci_arttext&pid=S0718-18762012000100002&lang=pt" 
"S0718-18762012000100003-chl","Exploring Tourist Adoption of Tourism Mobile Payment: An Empirical Analysis","Peng, Runhua, Xiong, Li, Yang, Zhenqing","Journal of theoretical and applied electronic commerce research; 7(1); 21-33","Journal of theoretical and applied electronic commerce research","Inglês","2012","http://www.scielo.cl/scielo.php?script=sci_arttext&pid=S0718-18762012000100003&lang=pt" 
"S0718-18762012000100004-chl","The Usage of Contextual Discounting and Opposition in Determining the Trustfulness of Users in Online Auctions","Beranek, Ladislav, Knizek, Jiri","Journal of theoretical and applied electronic commerce research; 7(1); 34-50","Journal of theoretical and applied electronic commerce research","Inglês","2012","http://www.scielo.cl/scielo.php?script=sci_arttext&pid=S0718-18762012000100004&lang=pt" 
"S0718-18762012000100005-chl","The Impact of Testimonials on Purchase Intentions in a Mock E-commerce Web Site","Spillinger, Avishag, Parush, Avi","Journal of theoretical and applied electronic commerce research; 7(1); 51-63","Journal of theoretical and applied electronic commerce research","Inglês","2012","http://www.scielo.cl/scielo.php?script=sci_arttext&pid=S0718-18762012000100005&lang=pt" 
"S0718-18762012000100006-chl","Comparison Shopping Agents and Online Price Dispersion: A Search Cost based Explanation","Pathak, Bhavik K","Journal of theoretical and applied electronic commerce research; 7(1); 64-76","Journal of theoretical and applied electronic commerce research","Inglês","2012","http://www.scielo.cl/scielo.php?script=sci_arttext&pid=S0718-18762012000100006&lang=pt" 
"S0718-18762012000100007-chl","Internet Shopping Behavior of Turkish Customers: Comparison of Two Competing Models","Hamit Turan, Aykut","Journal of theoretical and applied electronic commerce research; 7(1); 77-93","Journal of theoretical and applied electronic commerce research","Inglês","2012","http://www.scielo.cl/scielo.php?script=sci_arttext&pid=S0718-18762012000100007&lang=pt" 
"S0718-18762012000100008-chl","Building a Research Model for Mobile Wallet Consumer Adoption: The Case of Mobile Suica in Japan","Amoroso, Donald L, Magnier-Watanabe, Rémy","Journal of theoretical and applied electronic commerce research; 7(1); 94-110","Journal of theoretical and applied electronic commerce research","Inglês","2012","http://www.scielo.cl/scielo.php?script=sci_arttext&pid=S0718-18762012000100008&lang=pt" 
"S0718-18762012000100009-chl","Forming Buyer Coalition Scheme with Connection of a Coalition Leader","Boongasame, Laor, Temdee, Punnarumol, Daneshgar, Farhad","Journal of theoretical and applied electronic commerce research; 7(1); 111-122","Journal of theoretical and applied electronic commerce research","Inglês","2012","http://www.scielo.cl/scielo.php?script=sci_arttext&pid=S0718-18762012000100009&lang=pt" 
"S0103-863X2012000100003-scl","Escala multidimensional de atitudes face a lésbicas e a gays: construção e validação preliminar","Gato, Jorge, Fontaine, Anne Marie, Carneiro, Nuno Santos","Paidéia (Ribeirão Preto); 22(51); 11-20","Paidéia (Ribeirão Preto)","Inglês, Português","2012","http://www.scielo.br/scielo.php?script=sci_arttext&pid=S0103-863X2012000100003&lang=pt" 
"S0103-863X2012000100004-scl","Estudo nacional dos atributos psicométricos da Escala Triangular do Amor de Sternberg","Cassepp-Borges, Vicente, Pasquali, Luiz","Paidéia (Ribeirão Preto); 22(51); 21-31","Paidéia (Ribeirão Preto)","Inglês, Português","2012","http://www.scielo.br/scielo.php?script=sci_arttext&pid=S0103-863X2012000100004&lang=pt" 
"S0103-863X2012000100005-scl","Metas de socialização em diferentes contextos","Lordelo, Eulina da Rocha, Roethle, Monika, Mochizuki, Akemy Brandão","Paidéia (Ribeirão Preto); 22(51); 33-42","Paidéia (Ribeirão Preto)","Inglês, Português","2012","http://www.scielo.br/scielo.php?script=sci_arttext&pid=S0103-863X2012000100005&lang=pt" 
"S0103-863X2012000100006-scl","Perspectiva experiencial da conversa interna no contexto de resolução de problemas","DaSilveira, Amanda da Costa, Gomes, William Barbosa","Paidéia (Ribeirão Preto); 22(51); 43-52","Paidéia (Ribeirão Preto)","Inglês, Português","2012","http://www.scielo.br/scielo.php?script=sci_arttext&pid=S0103-863X2012000100006&lang=pt" 
"S0103-863X2012000100007-scl","A qualidade da motivação em estudantes do ensino fundamental","Rufini, Sueli Édi, Bzuneck, José Aloyseo, Oliveira, Katya Luciane de","Paidéia (Ribeirão Preto); 22(51); 53-62","Paidéia (Ribeirão Preto)","Inglês, Português","2012","http://www.scielo.br/scielo.php?script=sci_arttext&pid=S0103-863X2012000100007&lang=pt" 
"S0103-863X2012000100008-scl","Evidências desfavoráveis para avaliação da personalidade com um instrumento de 10 itens","Carvalho, Lucas de Francisco, Nunes, Maiana Farias Oliveira, Primi, Ricardo, Nunes, Carlos Henrique Sancineto da Silva","Paidéia (Ribeirão Preto); 22(51); 63-71","Paidéia (Ribeirão Preto)","Inglês, Português","2012","http://www.scielo.br/scielo.php?script=sci_arttext&pid=S0103-863X2012000100008&lang=pt" 
"S0103-863X2012000100009-scl","Mudança em pacientes de clínica-escola: avaliação de resultados e processos","Honda, Giovanna Corte, Yoshida, Elisa Medici Pizão","Paidéia (Ribeirão Preto); 22(51); 73-82","Paidéia (Ribeirão Preto)","Inglês, Português","2012","http://www.scielo.br/scielo.php?script=sci_arttext&pid=S0103-863X2012000100009&lang=pt" 
"S0103-863X2012000100010-scl","Avaliação do Programa Informatizado de Leitura Estratégica para estudantes do ensino fundamental","Joly, Maria Cristina Rodrigues Azevedo, Piovezan, Nayane Martoni","Paidéia (Ribeirão Preto); 22(51); 83-90","Paidéia (Ribeirão Preto)","Inglês, Português","2012","http://www.scielo.br/scielo.php?script=sci_arttext&pid=S0103-863X2012000100010&lang=pt" 
"S0103-863X2012000100011-scl","Comunicação e envolvimento: possibilidades de interconexões entre família-escola?","Marcondes, Keila Hellen Barbato, Sigolo, Silvia Regina Ricco Lucato","Paidéia (Ribeirão Preto); 22(51); 91-99","Paidéia (Ribeirão Preto)","Inglês, Português","2012","http://www.scielo.br/scielo.php?script=sci_arttext&pid=S0103-863X2012000100011&lang=pt" 
"S0103-863X2012000100012-scl","Personalidade paterna como fator prognóstico no tratamento da tendência antissocial","Barbieri, Valéria, Pavelqueires, Jamila de Godoy","Paidéia (Ribeirão Preto); 22(51); 101-110","Paidéia (Ribeirão Preto)","Inglês, Português","2012","http://www.scielo.br/scielo.php?script=sci_arttext&pid=S0103-863X2012000100012&lang=pt" 
"S0103-863X2012000100013-scl","Parentalidade e o desenvolvimento psíquico na criança","Veludo, Cássio Marcelo Batista, Viana, Terezinha de Camargo","Paidéia (Ribeirão Preto); 22(51); 111-118","Paidéia (Ribeirão Preto)","Inglês, Português","2012","http://www.scielo.br/scielo.php?script=sci_arttext&pid=S0103-863X2012000100013&lang=pt" 
"S0103-863X2012000100014-scl","Impacto psicossocial do câncer pediátrico para pais: revisão da literatura","Kohlsdorf, Marina, Costa Junior, Áderson Luiz","Paidéia (Ribeirão Preto); 22(51); 119-129","Paidéia (Ribeirão Preto)","Inglês, Português","2012","http://www.scielo.br/scielo.php?script=sci_arttext&pid=S0103-863X2012000100014&lang=pt" 
