"S0122-51972012000100008-col","","López, Abel","Memoria y Sociedad; 16(32); 90-93","Memoria y Sociedad","Espanhol","2012","http://www.scielo.org.co/scielo.php?script=sci_arttext&pid=S0122-51972012000100008&lang=pt" 
"S1909-04552012000100003-col","Determinación y cuantificación de los niveles de compuestos organoclorados en leche pasteurizada","Castilla Pinedo, Yolanda, Mercado Martínez, Iván Darío, González Silva, Germán","Producción + Limpia; 7(1); 19-31","Producción + Limpia","Espanhol","2012","http://www.scielo.org.co/scielo.php?script=sci_arttext&pid=S1909-04552012000100003&lang=pt" 
"S1909-04552012000100011-col","El desarrollo sostenible y el reciclaje del aceite usado de cocina a la luz de la jurisprudencia y el ordenamiento jurídico colombiano","Echavarría Restrepo, Juliana","Producción + Limpia; 7(1); 109-122","Producción + Limpia","Espanhol","2012","http://www.scielo.org.co/scielo.php?script=sci_arttext&pid=S1909-04552012000100011&lang=pt" 
"S1909-04552012000100010-col","Comparación entre bioestimulación y bioaumentación para la recuperación de suelos contaminados con diesel","Pino Rodríguez, Nancy J, Carvajal, Stephanie, Gallo, Andrés, Peñuela, Gustavo","Producción + Limpia; 7(1); 101-108","Producción + Limpia","Espanhol","2012","http://www.scielo.org.co/scielo.php?script=sci_arttext&pid=S1909-04552012000100010&lang=pt" 
"S0121-45002012000100001-col","La teoría, soporte de la ciencia y práctica de enfermería: tendencias","Durán de Villalobos, María Mercedes","Avances en Enfermería; 30(1); 9-12","Avances en Enfermería","Espanhol","2012","http://www.scielo.org.co/scielo.php?script=sci_arttext&pid=S0121-45002012000100001&lang=pt" 
"S0121-45002012000100002-col","O cuidar da pessoa em fim de vida como experiência formadora","Frias, Cidália","Avances en Enfermería; 30(1); 13-22","Avances en Enfermería","Português","2012","http://www.scielo.org.co/scielo.php?script=sci_arttext&pid=S0121-45002012000100002&lang=pt" 
"S0121-45002012000100003-col","Optimizando la funcionalidad del adulto mayor a través de una estrategia de autocuidado","Sanhueza Parra, Marcela Isabel del Pilar, Castro Salas, Manuel, Merino Escobar, José Manuel","Avances en Enfermería; 30(1); 23-31","Avances en Enfermería","Espanhol","2012","http://www.scielo.org.co/scielo.php?script=sci_arttext&pid=S0121-45002012000100003&lang=pt" 
"S0121-45002012000100004-col","El apoyo social: estrategia para afrontar el cáncer de cérvix","Gómez Gómez, Margarita María, Lagoueyte Gómez, María Isabel","Avances en Enfermería; 30(1); 32-41","Avances en Enfermería","Espanhol","2012","http://www.scielo.org.co/scielo.php?script=sci_arttext&pid=S0121-45002012000100004&lang=pt" 
"S0121-45002012000100005-col","Asociación entre la capacidad funcional y los resultados de autocuidado en personas con enfermedad cardiovascular","Bastidas Sánchez, Clara Victoria, Olivella Fernández, Madeleine, Bonilla Ibáñez, Claudia Patricia","Avances en Enfermería; 30(1); 42-54","Avances en Enfermería","Espanhol","2012","http://www.scielo.org.co/scielo.php?script=sci_arttext&pid=S0121-45002012000100005&lang=pt" 
"S0121-45002012000100006-col","Promoción de una alimentación saludable: experiencia en Tunja, colombia","Herrera Giraldo, Sandra Lorena, Panader Torres, Adriana, Cárdenas Cárdenas, Luz Mery, Agudelo Cely, Nancy Aurora","Avances en Enfermería; 30(1); 55-63","Avances en Enfermería","Espanhol","2012","http://www.scielo.org.co/scielo.php?script=sci_arttext&pid=S0121-45002012000100006&lang=pt" 
"S0121-45002012000100007-col","Bienestar espiritual de enfermeras y enfermeros en unidades de cuidado intensivo","Sierra Leguía, Luis, Montalvo Prieto, Amparo","Avances en Enfermería; 30(1); 64-74","Avances en Enfermería","Espanhol","2012","http://www.scielo.org.co/scielo.php?script=sci_arttext&pid=S0121-45002012000100007&lang=pt" 
"S0121-45002012000100008-col","Salud familiar en familias con adolescente gestante","Veloza Morales, Martha cecilia","Avances en Enfermería; 30(1); 75-81","Avances en Enfermería","Espanhol","2012","http://www.scielo.org.co/scielo.php?script=sci_arttext&pid=S0121-45002012000100008&lang=pt" 
"S0121-45002012000100009-col","Cuerpo y corporalidad en la paraplejia: significado de los cambios","Moreno-Fergusson, María Elisa, Amaya Rey, María Consuelo del Pilar","Avances en Enfermería; 30(1); 82-94","Avances en Enfermería","Espanhol","2012","http://www.scielo.org.co/scielo.php?script=sci_arttext&pid=S0121-45002012000100009&lang=pt" 
"S0121-45002012000100013-col","In memoriam Raquel Natividad Pinto Afanador Hoy como ayer","","Avances en Enfermería; 30(1); 116-117","Avances en Enfermería","Espanhol","2012","http://www.scielo.org.co/scielo.php?script=sci_arttext&pid=S0121-45002012000100013&lang=pt" 
"S0121-45002012000100012-col","Acuerdo 010 de 2002 del consejo superior Universitario de la Universidad Nacional de Colombia","","Avances en Enfermería; 30(1); 114-115","Avances en Enfermería","Espanhol","2012","http://www.scielo.org.co/scielo.php?script=sci_arttext&pid=S0121-45002012000100012&lang=pt" 
"S0121-45002012000100011-col","Clima organizacional: un modo eficaz para dirigir los servicios de salud","Segura Massó, Arturo Alexánder","Avances en Enfermería; 30(1); 107-113","Avances en Enfermería","Espanhol","2012","http://www.scielo.org.co/scielo.php?script=sci_arttext&pid=S0121-45002012000100011&lang=pt" 
"S0121-45002012000100010-col","La administración que se enseña en el pregrado de enfermería","Vega Vega, Yolanda","Avances en Enfermería; 30(1); 95-106","Avances en Enfermería","Espanhol","2012","http://www.scielo.org.co/scielo.php?script=sci_arttext&pid=S0121-45002012000100010&lang=pt" 
"S0120-24562012000100007-col","Visiones jesuíticas del Amazonas en la Colonia: de la misión como dominio espiritual a la exploración de las riquezas del río vistas como tesoro","TORRES-LONDOÑO, FERNANDO","Anuario Colombiano de Historia Social y de la Cultura; 39(1); 183-213","Anuario Colombiano de Historia Social y de la Cultura","Espanhol","2012","http://www.scielo.org.co/scielo.php?script=sci_arttext&pid=S0120-24562012000100007&lang=pt" 
"S0120-24562012000100006-col","Evolución del uribismo en Ciudad Bolívar: un análisis histórico, 2002-2007","FORERO HIDALGO, JYMY ALEXANDER","Anuario Colombiano de Historia Social y de la Cultura; 39(1); 145-180","Anuario Colombiano de Historia Social y de la Cultura","Espanhol","2012","http://www.scielo.org.co/scielo.php?script=sci_arttext&pid=S0120-24562012000100006&lang=pt" 
"S0120-24562012000100005-col","Juego de intereses en la demolición del Convento y de la Iglesia de Santo Domingo. Bogotá, 1939-1947","RUEDA CÁCERES, LILIANA","Anuario Colombiano de Historia Social y de la Cultura; 39(1); 119-144","Anuario Colombiano de Historia Social y de la Cultura","Espanhol","2012","http://www.scielo.org.co/scielo.php?script=sci_arttext&pid=S0120-24562012000100005&lang=pt" 
"S0120-24562012000100004-col","Composición, mercedes de tierras realengas y expansión ganadera en una zona de frontera de la gobernación de Santa Marta: Valledupar (1700-1810)","SÁNCHEZ MEJÍA, HUGUES RAFAEL","Anuario Colombiano de Historia Social y de la Cultura; 39(1); 81-117","Anuario Colombiano de Historia Social y de la Cultura","Espanhol","2012","http://www.scielo.org.co/scielo.php?script=sci_arttext&pid=S0120-24562012000100004&lang=pt" 
"S0120-24562012000100003-col","Las familias indígenas de Santafé, Nuevo Reino de Granada, según los testamentos de los siglos XVI y XVII","TURBAY CEBALLOS, SANDRA","Anuario Colombiano de Historia Social y de la Cultura; 39(1); 49-80","Anuario Colombiano de Historia Social y de la Cultura","Espanhol","2012","http://www.scielo.org.co/scielo.php?script=sci_arttext&pid=S0120-24562012000100003&lang=pt" 
"S0120-24562012000100002-col","Buena sangre y hábitos españoles: repensando a Alonso de Silva y Diego de Torres","RAPPAPORT, JOANNE","Anuario Colombiano de Historia Social y de la Cultura; 39(1); 19-48","Anuario Colombiano de Historia Social y de la Cultura","Espanhol","2012","http://www.scielo.org.co/scielo.php?script=sci_arttext&pid=S0120-24562012000100002&lang=pt" 
"S0120-24562012000100001-col","PRESENTACIÓN","ARCHILA NEIRA, MAURICIO","Anuario Colombiano de Historia Social y de la Cultura; 39(1); 13-15","Anuario Colombiano de Historia Social y de la Cultura","Espanhol","2012","http://www.scielo.org.co/scielo.php?script=sci_arttext&pid=S0120-24562012000100001&lang=pt" 
"S0120-24562012000100009-col","Sobre historia y sociología: interdisciplinariedad y narración en las ciencias sociales en Colombia","VEGA TORRES, DANIEL ROBERTO","Anuario Colombiano de Historia Social y de la Cultura; 39(1); 243-262","Anuario Colombiano de Historia Social y de la Cultura","Espanhol","2012","http://www.scielo.org.co/scielo.php?script=sci_arttext&pid=S0120-24562012000100009&lang=pt" 
"S0120-24562012000100008-col","Cuando el mundo le dio la espalda a una democracia. La diplomacia mexicana ante la desaparición de Checoslovaquia, 1938-1940","GUILLERMO LÓPEZ, CONTRERAS","Anuario Colombiano de Historia Social y de la Cultura; 39(1); 215-240","Anuario Colombiano de Historia Social y de la Cultura","Espanhol","2012","http://www.scielo.org.co/scielo.php?script=sci_arttext&pid=S0120-24562012000100008&lang=pt" 
"S1900-23862012000100008-col","Propiedades psicométricas de la escala de Zung para síntomas depresivos en población adolescente escolarizada colombiana","Lezama Meneses, Sandra Rocío","Psychologia. Avances de la Disciplina; 6(1); 91-101","Psychologia. Avances de la Disciplina","Espanhol","2012","http://www.scielo.org.co/scielo.php?script=sci_arttext&pid=S1900-23862012000100008&lang=pt" 
"S1900-23862012000100009-col","El doble procesamiento paralelo en situación de crisis: fundamentación motivacional","Flórez Alarcón, Luis, Gantiva Díaz, Carlos Andrés","Psychologia. Avances de la Disciplina; 6(1); 105-121","Psychologia. Avances de la Disciplina","Espanhol","2012","http://www.scielo.org.co/scielo.php?script=sci_arttext&pid=S1900-23862012000100009&lang=pt" 
"S1900-23862012000100002-col","Integración de la memoria, recuerdo histórico y teatro en la educación en colombia: implicaciones pedagógicas y psicosociales","Arcila Gallego, Jorge Tadeo","Psychologia. Avances de la Disciplina; 6(1); 13-20","Psychologia. Avances de la Disciplina","Espanhol","2012","http://www.scielo.org.co/scielo.php?script=sci_arttext&pid=S1900-23862012000100002&lang=pt" 
"S1900-23862012000100003-col","Características psicosociales de la población asistente a la unidad de servicios psicológicos de la Universidad Católica de Colombia durante los años 2007 y 2008","Moreno Méndez, Jaime Humberto, Rozo Sánchez, María Margarita, Cantor Nieto, Martha Isabel, Toro Tobar, Ronald Alberto","Psychologia. Avances de la Disciplina; 6(1); 21-33","Psychologia. Avances de la Disciplina","Espanhol","2012","http://www.scielo.org.co/scielo.php?script=sci_arttext&pid=S1900-23862012000100003&lang=pt" 
"S1900-23862012000100001-col","Editorial","Hewitt Ramírez, Nohelia","Psychologia. Avances de la Disciplina; 6(1); 9-10","Psychologia. Avances de la Disciplina","Espanhol","2012","http://www.scielo.org.co/scielo.php?script=sci_arttext&pid=S1900-23862012000100001&lang=pt" 
"S1900-23862012000100006-col","Desarrollos preliminares de la escala de motivación (EM1) para adultos, basada en el modelo motivacional de Mc Clelland","Álvarez Ramírez, Leonardo Yovany","Psychologia. Avances de la Disciplina; 6(1); 63-75","Psychologia. Avances de la Disciplina","Espanhol","2012","http://www.scielo.org.co/scielo.php?script=sci_arttext&pid=S1900-23862012000100006&lang=pt" 
"S1900-23862012000100007-col","Cambios en la calidad de vida en pacientes con trauma craneoencefálico severo después de un programa de rehabilitación","González Alexander, Diana, Giraldo Cardozo, Carolina, Ramírez Cardona, Diana, Quijano Martínez, María Cristina","Psychologia. Avances de la Disciplina; 6(1); 77-89","Psychologia. Avances de la Disciplina","Espanhol","2012","http://www.scielo.org.co/scielo.php?script=sci_arttext&pid=S1900-23862012000100007&lang=pt" 
"S1900-23862012000100004-col","Sobrecarga en cuidadores de pacientes con demencia tipo alzheimer","Cerquera Córdoba, Ara Mercedes, Granados Latorre, Francisco Javier, Buitrago Mariño, Ana María","Psychologia. Avances de la Disciplina; 6(1); 35-45","Psychologia. Avances de la Disciplina","Espanhol","2012","http://www.scielo.org.co/scielo.php?script=sci_arttext&pid=S1900-23862012000100004&lang=pt" 
"S1900-23862012000100005-col","Salud mental y transformaciones del mundo de la vida en un escenario de violencia política y social","Cardona Duque, Héctor Henry, Sepúlveda Ruiz, Sandra Milena, Angarita Varela, Adriana Lucía, Parada Baños, Arturo José","Psychologia. Avances de la Disciplina; 6(1); 47-62","Psychologia. Avances de la Disciplina","Espanhol","2012","http://www.scielo.org.co/scielo.php?script=sci_arttext&pid=S1900-23862012000100005&lang=pt" 
"S1900-23862012000100011-col","La Integración de los Saberes: Una Propuesta Curricular para la Formación en Investigación en la Educación Superior","Hewitt Ramírez, Nohelia, Barrero Rivera, Floralba","Psychologia. Avances de la Disciplina; 6(1); 137-145","Psychologia. Avances de la Disciplina","Espanhol","2012","http://www.scielo.org.co/scielo.php?script=sci_arttext&pid=S1900-23862012000100011&lang=pt" 
"S1900-23862012000100010-col","Calidad de Vida Relacionada Con La Salud y Enfermedad Crónica: Estudios Colombianos","Alpi, Stefano Vinaccia, Quiceno, Japcy Margarita","Psychologia. Avances de la Disciplina; 6(1); 123-136","Psychologia. Avances de la Disciplina","Espanhol","2012","http://www.scielo.org.co/scielo.php?script=sci_arttext&pid=S1900-23862012000100010&lang=pt" 
"S1900-23862012000100013-col","Funcionalidad familiar, conductas externalizadas y rendimiento académico en un grupo de adolescentes de la ciudad de Bogotá","Moreno Méndez, Jaime Humberto, Chauta Rozo, Laura Camila","Psychologia. Avances de la Disciplina; 6(1); 149-152","Psychologia. Avances de la Disciplina","Espanhol","2012","http://www.scielo.org.co/scielo.php?script=sci_arttext&pid=S1900-23862012000100013&lang=pt" 
"S1900-23862012000100012-col","La Psicología Política: El Eslabón Perdido en Tiempos de Crisis","Pérez Gaviria, Martha Elena","Psychologia. Avances de la Disciplina; 6(1); 149-152","Psychologia. Avances de la Disciplina","Espanhol","2012","http://www.scielo.org.co/scielo.php?script=sci_arttext&pid=S1900-23862012000100012&lang=pt" 
"S1794-44492012000100016-col","Bioética en la experimentación científica con animales: cuestión de reglamentación o de actitud humana","Garcés Giraldo, Luis Fernando, Giraldo Zuluaga, Conrado","Revista Lasallista de Investigación; 9(1); 159-166","Revista Lasallista de Investigación","Espanhol","2012","http://www.scielo.org.co/scielo.php?script=sci_arttext&pid=S1794-44492012000100016&lang=pt" 
"S1794-44492012000100014-col","La novedad del conocimiento humano: fuente perenne de toda innovación","Irizar, Liliana Beatriz","Revista Lasallista de Investigación; 9(1); 137-148","Revista Lasallista de Investigación","Espanhol","2012","http://www.scielo.org.co/scielo.php?script=sci_arttext&pid=S1794-44492012000100014&lang=pt" 
"S1794-44492012000100015-col","Entorno organizacional y desarrollo humano","Castaño González, Esther Julia","Revista Lasallista de Investigación; 9(1); 149-158","Revista Lasallista de Investigación","Espanhol","2012","http://www.scielo.org.co/scielo.php?script=sci_arttext&pid=S1794-44492012000100015&lang=pt" 
"S1794-44492012000100012-col","Características de los virus asociados a la virosis del tomate de árbol (Solanum betaceum) en Colombia","Jaramillo Zapata, Margarita María, Álvarez, John Alejandro, Marín Montoya, Mauricio","Revista Lasallista de Investigación; 9(1); 115-127","Revista Lasallista de Investigación","Espanhol","2012","http://www.scielo.org.co/scielo.php?script=sci_arttext&pid=S1794-44492012000100012&lang=pt" 
"S1794-44492012000100013-col","Estrés oxidativo en el semen equino criopreservado","Restrepo Betancur, Giovanni, Pizarro López, Edison, Alberto Rojano, Benjamín","Revista Lasallista de Investigación; 9(1); 128-136","Revista Lasallista de Investigación","Espanhol","2012","http://www.scielo.org.co/scielo.php?script=sci_arttext&pid=S1794-44492012000100013&lang=pt" 
"S1794-44492012000100010-col","Investigación longitudinal de los hábitos de estudio en una cohorte de alumnos universitarios","Montes Iturrizaga, Iván","Revista Lasallista de Investigación; 9(1); 96-110","Revista Lasallista de Investigación","Espanhol","2012","http://www.scielo.org.co/scielo.php?script=sci_arttext&pid=S1794-44492012000100010&lang=pt" 
"S1794-44492012000100011-col","Qualidade de Vida e Sono em Mulheres de Meia-idade e Idosas do Vale do Médio Araguaia, Amazônia legal","Neto Paniago, Emidio, KusanoBucalen Ferrari, Carlos","Revista Lasallista de Investigación; 9(1); 111-114","Revista Lasallista de Investigación","Português","2012","http://www.scielo.org.co/scielo.php?script=sci_arttext&pid=S1794-44492012000100011&lang=pt" 
"S1794-44492012000100001-col","Objeciones al uso de modelos animales","Vallejo Rendón, Aníbal","Revista Lasallista de Investigación; 9(1); 9-11","Revista Lasallista de Investigación","Espanhol","2012","http://www.scielo.org.co/scielo.php?script=sci_arttext&pid=S1794-44492012000100001&lang=pt" 
"S1794-44492012000100003-col","Efecto del polimorfismo del gen de la somatotropina BGH) sobre características lineales en vacas Holstein","Echavarría Valencia, Diana Carolina, Echeverri Zuluaga, José Julián","Revista Lasallista de Investigación; 9(1); 21-31","Revista Lasallista de Investigación","Espanhol","2012","http://www.scielo.org.co/scielo.php?script=sci_arttext&pid=S1794-44492012000100003&lang=pt" 
"S1794-44492012000100002-col","Efecto de la Dimetilformamida sobre la viabilidad posvitrificación de embriones bovinos producidos in vitro","Giraldo Giraldo, John Jairo, Gómez Oquendo, Jorge, Vásquez Araque, Neil","Revista Lasallista de Investigación; 9(1); 13-20","Revista Lasallista de Investigación","Espanhol","2012","http://www.scielo.org.co/scielo.php?script=sci_arttext&pid=S1794-44492012000100002&lang=pt" 
"S1794-44492012000100005-col","Efectos del perifiton sobre los parámetros fisicoquímicos del agua en estanques con policultivo de tilapia Oreochromis niloticus y Bocachico Prochilodus magdalenae","Muñoz Duque, Sebastián Eduardo, García González, José Jaime, Correa Londoño, Guillermo, Atencio García, Víctor Julio, Pardo Carrasco, Sandra Clemencia","Revista Lasallista de Investigación; 9(1); 41-52","Revista Lasallista de Investigación","Espanhol","2012","http://www.scielo.org.co/scielo.php?script=sci_arttext&pid=S1794-44492012000100005&lang=pt" 
"S1794-44492012000100004-col","Determinación de cadmio en leches crudas usando un biosensor amperométrico","Carvajal Acevedo, Stephanie, Rodríguez Loaiza, Diana Catalina, Peñuela Mesa, Gustavo","Revista Lasallista de Investigación; 9(1); 32-40","Revista Lasallista de Investigación","Espanhol","2012","http://www.scielo.org.co/scielo.php?script=sci_arttext&pid=S1794-44492012000100004&lang=pt" 
"S1794-44492012000100007-col","Síntesis y caracterización de pigmentos tipo espinela CuCr2O4 a través del método autocombustión en solución","Chavarriaga Miranda, Edgar Andrés, Betancur Granados, Natalia, Montoya, Juan Fernando, Restrepo Baena, Oscar Jaime","Revista Lasallista de Investigación; 9(1); 62-69","Revista Lasallista de Investigación","Espanhol","2012","http://www.scielo.org.co/scielo.php?script=sci_arttext&pid=S1794-44492012000100007&lang=pt" 
"S1794-44492012000100006-col","Percepción sobre daños a la salud y utilidad de medidas de protección de personas expuestas ocupacionalmente al mercurio en la minería del oro","Muñoz-Vallejo, Luisa Fernanda, García-Ardila, Luisa Fernanda, Rodríguez-Gázquez, María de los Ángeles","Revista Lasallista de Investigación; 9(1); 53-61","Revista Lasallista de Investigación","Espanhol","2012","http://www.scielo.org.co/scielo.php?script=sci_arttext&pid=S1794-44492012000100006&lang=pt" 
"S1794-44492012000100009-col","Asociaciones entre madurez de gestión del conocimiento y desempeño innovador: organización y personas, e interpretación","Arias Pérez, Jose Enrique","Revista Lasallista de Investigación; 9(1); 86-95","Revista Lasallista de Investigación","Espanhol","2012","http://www.scielo.org.co/scielo.php?script=sci_arttext&pid=S1794-44492012000100009&lang=pt" 
"S1794-44492012000100008-col","Mejoramiento del cargue en el despacho de un centro de distribución utilizando superficies de respuesta","Gómez Montoya, Rodrigo Andrés, Correa Espinal, Alexander Alberto","Revista Lasallista de Investigación; 9(1); 70-85","Revista Lasallista de Investigación","Espanhol","2012","http://www.scielo.org.co/scielo.php?script=sci_arttext&pid=S1794-44492012000100008&lang=pt" 
"S0120-24562012000100021-col","Laure Murat. L&#039;homme qui se prenait pour Napoléon. Pour une histoire politique de la folie","RENÁN, SILVA","Anuario Colombiano de Historia Social y de la Cultura; 39(1); 352-358","Anuario Colombiano de Historia Social y de la Cultura","Espanhol","2012","http://www.scielo.org.co/scielo.php?script=sci_arttext&pid=S0120-24562012000100021&lang=pt" 
"S0120-24562012000100020-col","Roger Leonardo Mamani Siñani. &quot;La División de los Valles&quot;: estructura militar, social y étnica de la guerrilla de La Paz y Cochabamba (1814-1817)","ZAVALA CÓRDOVA, GONZALO","Anuario Colombiano de Historia Social y de la Cultura; 39(1); 348-351","Anuario Colombiano de Historia Social y de la Cultura","Espanhol","2012","http://www.scielo.org.co/scielo.php?script=sci_arttext&pid=S0120-24562012000100020&lang=pt" 
"S0120-24562012000100023-col","Beatriz Patiño Millán. Riqueza, pobreza y diferenciación social en la provincia de Antioquia durante el siglo XVIII","LÓPEZ RIVERA, EDWIN","Anuario Colombiano de Historia Social y de la Cultura; 39(1); 362-367","Anuario Colombiano de Historia Social y de la Cultura","Espanhol","2012","http://www.scielo.org.co/scielo.php?script=sci_arttext&pid=S0120-24562012000100023&lang=pt" 
"S0120-24562012000100022-col","José Muzlera, Mariana Poggi y Ximena Carreras Doalla, compiladores. Aportes, sujetos y miradas del conflicto agrario argentino (1910-2010)","ALMIRÓN, ADRIÁN ALEJANDRO","Anuario Colombiano de Historia Social y de la Cultura; 39(1); 359-362","Anuario Colombiano de Historia Social y de la Cultura","Espanhol","2012","http://www.scielo.org.co/scielo.php?script=sci_arttext&pid=S0120-24562012000100022&lang=pt" 
"S0120-24562012000100024-col","Beatriz Patiño Millán (1952-2012)","MURILLO POSADA, AMPARO","Anuario Colombiano de Historia Social y de la Cultura; 39(1); 371-372","Anuario Colombiano de Historia Social y de la Cultura","Espanhol","2012","http://www.scielo.org.co/scielo.php?script=sci_arttext&pid=S0120-24562012000100024&lang=pt" 
"S0120-24562012000100011-col","La familia en la historiografía puertorriqueña","SALCEDO, DALÍN MIRANDA","Anuario Colombiano de Historia Social y de la Cultura; 39(1); 289-314","Anuario Colombiano de Historia Social y de la Cultura","Espanhol","2012","http://www.scielo.org.co/scielo.php?script=sci_arttext&pid=S0120-24562012000100011&lang=pt" 
"S0120-24562012000100014-col","Katherine Bonil Gómez. Gobierno y calidad en el orden colonial. Las categorías del mestizaje en la provincia de Mariquita en la segunda mitad del siglo XVIII","BONILLA MAYTA, HERACLIO","Anuario Colombiano de Historia Social y de la Cultura; 39(1); 325-327","Anuario Colombiano de Historia Social y de la Cultura","Espanhol","2012","http://www.scielo.org.co/scielo.php?script=sci_arttext&pid=S0120-24562012000100014&lang=pt" 
"S0120-24562012000100015-col","Nikolaus Böttcher, Bernd Hausberger y Max S. Hering Torres, editores. El peso de la sangre: limpios, mestizos y nobles en el mundo hispánico","CALDERÓN, JOSÉ DIONISIO","Anuario Colombiano de Historia Social y de la Cultura; 39(1); 327-332","Anuario Colombiano de Historia Social y de la Cultura","Espanhol","2012","http://www.scielo.org.co/scielo.php?script=sci_arttext&pid=S0120-24562012000100015&lang=pt" 
"S0120-24562012000100016-col","Centro de Investigación Libertaria y Educación Popular, editor. Pasado y presente del anarquismo y el anarcosindicalismo en Colombia","MÚNERA RUIZ, LEOPOLDO","Anuario Colombiano de Historia Social y de la Cultura; 39(1); 332-337","Anuario Colombiano de Historia Social y de la Cultura","Espanhol","2012","http://www.scielo.org.co/scielo.php?script=sci_arttext&pid=S0120-24562012000100016&lang=pt" 
"S0120-24562012000100017-col","Edgar Collazos. El Demonio en la Proa, segunda edición","SÁNCHEZ ÁNGEL, RICARDO","Anuario Colombiano de Historia Social y de la Cultura; 39(1); 338-340","Anuario Colombiano de Historia Social y de la Cultura","Espanhol","2012","http://www.scielo.org.co/scielo.php?script=sci_arttext&pid=S0120-24562012000100017&lang=pt" 
"S0120-24562012000100010-col","La interdisciplinariedad saboteada: observaciones a la ley que reglamenta el ejercicio profesional de la archivística","SUÁREZ PINZÓN, IVONNE","Anuario Colombiano de Historia Social y de la Cultura; 39(1); 263-288","Anuario Colombiano de Historia Social y de la Cultura","Espanhol","2012","http://www.scielo.org.co/scielo.php?script=sci_arttext&pid=S0120-24562012000100010&lang=pt" 
