"S0122-51972012000100008-col","","López, Abel","Memoria y Sociedad; 16(32); 90-93","Memoria y Sociedad","Espanhol","2012","http://www.scielo.org.co/scielo.php?script=sci_arttext&pid=S0122-51972012000100008&lang=pt" 
"S0120-24562012000100012-col","Rafael Enrique Acevedo Puello. Memorias, lecciones y representaciones históricas. La celebración del primer centenario de la Independencia en las escuelas de la provincia de Cartagena (1900-1920)","PULIDO LONDOÑO, HERNANDO ANDRÉS","Anuario Colombiano de Historia Social y de la Cultura; 39(1); 317-320","Anuario Colombiano de Historia Social y de la Cultura","Espanhol","2012","http://www.scielo.org.co/scielo.php?script=sci_arttext&pid=S0120-24562012000100012&lang=pt" 
"S0120-24562012000100013-col","Thomas Bender. Historia de los Estados Unidos: una nación entre naciones","FLORIÁN GUZMÁN, JHON","Anuario Colombiano de Historia Social y de la Cultura; 39(1); 320-325","Anuario Colombiano de Historia Social y de la Cultura","Espanhol","2012","http://www.scielo.org.co/scielo.php?script=sci_arttext&pid=S0120-24562012000100013&lang=pt" 
"S0120-24562012000100018-col","Humberto Cucchetti. Combatientes de Perón, herederos de Cristo. Peronismo, religión secular y organización de cuadros","POZZONI, MARIANA","Anuario Colombiano de Historia Social y de la Cultura; 39(1); 340-343","Anuario Colombiano de Historia Social y de la Cultura","Espanhol","2012","http://www.scielo.org.co/scielo.php?script=sci_arttext&pid=S0120-24562012000100018&lang=pt" 
"S0120-24562012000100019-col","Ana María Lorandi. Poder central, poder local. Funcionarios borbónicos en el Tucumán colonial: un estudio de antropología política","VELASCO PEDRAZA, JULIAN ANDREI","Anuario Colombiano de Historia Social y de la Cultura; 39(1); 344-348","Anuario Colombiano de Historia Social y de la Cultura","Espanhol","2012","http://www.scielo.org.co/scielo.php?script=sci_arttext&pid=S0120-24562012000100019&lang=pt" 
"S1692-715X2012000100035-col","Práctica y significado del consentimiento informado en hospitales de Colombia y Chile","Ovalle, Constanza","Revista Latinoamericana de Ciencias Sociales, Niñez y Juventud; 10(1); 541-561","Revista Latinoamericana de Ciencias Sociales, Niñez y Juventud","Espanhol","2012","http://www.scielo.org.co/scielo.php?script=sci_arttext&pid=S1692-715X2012000100035&lang=pt" 
"S1692-715X2012000100031-col","Percepciones sobre el uso del condón y la sexualidad entre jóvenes","Uribe, J. Isaac, Amador, Genoveva, Zacarías, Ximena, Villarreal, Leticia","Revista Latinoamericana de Ciencias Sociales, Niñez y Juventud; 10(1); 481-494","Revista Latinoamericana de Ciencias Sociales, Niñez y Juventud","Espanhol","2012","http://www.scielo.org.co/scielo.php?script=sci_arttext&pid=S1692-715X2012000100031&lang=pt" 
"S1692-715X2012000100030-col","Dinámicas del reconocimiento en las narraciones de jóvenes con discapacidades","Fernández, Aleida, Vasco, Eloísa","Revista Latinoamericana de Ciencias Sociales, Niñez y Juventud; 10(1); 467-479","Revista Latinoamericana de Ciencias Sociales, Niñez y Juventud","Espanhol","2012","http://www.scielo.org.co/scielo.php?script=sci_arttext&pid=S1692-715X2012000100030&lang=pt" 
"S1692-715X2012000100033-col","Crianças e suas opiniões: lazer e esportes em uma cidade brasileira","Müller, Verônica Regina, Arruda, Fabiana Moura","Revista Latinoamericana de Ciencias Sociales, Niñez y Juventud; 10(1); 513-525","Revista Latinoamericana de Ciencias Sociales, Niñez y Juventud","Português","2012","http://www.scielo.org.co/scielo.php?script=sci_arttext&pid=S1692-715X2012000100033&lang=pt" 
"S1692-715X2012000100032-col","Violencia: análisis de su conceptualización en jóvenes estudiantes de bachillerato","García-Villanueva, Jorge, De la Rosa-Acosta, Adara, Castillo-Valdés, Jessica S.","Revista Latinoamericana de Ciencias Sociales, Niñez y Juventud; 10(1); 495-512","Revista Latinoamericana de Ciencias Sociales, Niñez y Juventud","Espanhol","2012","http://www.scielo.org.co/scielo.php?script=sci_arttext&pid=S1692-715X2012000100032&lang=pt" 
"S1692-715X2012000100034-col","Expectativas sobre la obligación filial: comparación de dos generaciones en México","Robles, Leticia, Pérez, Ana del Carmen","Revista Latinoamericana de Ciencias Sociales, Niñez y Juventud; 10(1); 527-540","Revista Latinoamericana de Ciencias Sociales, Niñez y Juventud","Espanhol","2012","http://www.scielo.org.co/scielo.php?script=sci_arttext&pid=S1692-715X2012000100034&lang=pt" 
"S1692-715X2012000100037-col","Intervención psicosocial y educativa para prevención de riesgos asociados a procesos migratorios","Pinillos, Mónica","Revista Latinoamericana de Ciencias Sociales, Niñez y Juventud; 10(1); 579-591","Revista Latinoamericana de Ciencias Sociales, Niñez y Juventud","Espanhol","2012","http://www.scielo.org.co/scielo.php?script=sci_arttext&pid=S1692-715X2012000100037&lang=pt" 
"S1692-715X2012000100036-col","Discriminación salarial: un análisis entre mujeres afrocolombianas y no afrocolombianas en el área metropolitana de Cali","González-Rivas, Nazly","Revista Latinoamericana de Ciencias Sociales, Niñez y Juventud; 10(1); 563-578","Revista Latinoamericana de Ciencias Sociales, Niñez y Juventud","Espanhol","2012","http://www.scielo.org.co/scielo.php?script=sci_arttext&pid=S1692-715X2012000100036&lang=pt" 
"S1692-715X2012000100039-col","La migración internacional paterna o materna: una lectura desde los sujetos jóvenes","Soto, Cristian David","Revista Latinoamericana de Ciencias Sociales, Niñez y Juventud; 10(1); 593-610","Revista Latinoamericana de Ciencias Sociales, Niñez y Juventud","Espanhol","2012","http://www.scielo.org.co/scielo.php?script=sci_arttext&pid=S1692-715X2012000100039&lang=pt" 
"S1692-715X2012000100038-col","Feminización de la migración y papel de las mujeres en el hecho migratorio","Unda, René, Alvarado, Sara Victoria","Revista Latinoamericana de Ciencias Sociales, Niñez y Juventud; 10(1); 593-610","Revista Latinoamericana de Ciencias Sociales, Niñez y Juventud","Espanhol","2012","http://www.scielo.org.co/scielo.php?script=sci_arttext&pid=S1692-715X2012000100038&lang=pt" 
"S1692-715X2012000100004-col","¿&quot;Proyecto de vida&quot;? tensiones en un programa de prevención del delito juvenil","Medan, Marina","Revista Latinoamericana de Ciencias Sociales, Niñez y Juventud; 10(1); 79-91","Revista Latinoamericana de Ciencias Sociales, Niñez y Juventud","Espanhol","2012","http://www.scielo.org.co/scielo.php?script=sci_arttext&pid=S1692-715X2012000100004&lang=pt" 
"S1692-715X2012000100005-col","Cuerpos sometidos, sujetos educados. Apuntes para una interpretación de las luchas discursivas por la construcción de la educación sexual en Colombia","Hincapié, Alexánder, Quintero, Sebastián","Revista Latinoamericana de Ciencias Sociales, Niñez y Juventud; 10(1); 93-100","Revista Latinoamericana de Ciencias Sociales, Niñez y Juventud","Espanhol","2012","http://www.scielo.org.co/scielo.php?script=sci_arttext&pid=S1692-715X2012000100005&lang=pt" 
"S1692-715X2012000100006-col","Juventud Digital: Revisión de algunas aseveraciones negativas sobre la relación jóvenes-nuevas tecnologías","Acosta-Silva, David Arturo, Muñoz, Germán","Revista Latinoamericana de Ciencias Sociales, Niñez y Juventud; 10(1); 107-130","Revista Latinoamericana de Ciencias Sociales, Niñez y Juventud","Espanhol","2012","http://www.scielo.org.co/scielo.php?script=sci_arttext&pid=S1692-715X2012000100006&lang=pt" 
"S1692-715X2012000100007-col","La Cooperación Internacional para la formación e inserción sociolaboral de jóvenes mexicanos","Girardo, Cristina, Siles, Oscar Mauricio","Revista Latinoamericana de Ciencias Sociales, Niñez y Juventud; 10(1); 131-146","Revista Latinoamericana de Ciencias Sociales, Niñez y Juventud","Espanhol","2012","http://www.scielo.org.co/scielo.php?script=sci_arttext&pid=S1692-715X2012000100007&lang=pt" 
"S1692-715X2012000100002-col","La cultura juvenil otaku: expresión de la posmodernidad","Menkes, Dominique","Revista Latinoamericana de Ciencias Sociales, Niñez y Juventud; 10(1); 51-62","Revista Latinoamericana de Ciencias Sociales, Niñez y Juventud","Espanhol","2012","http://www.scielo.org.co/scielo.php?script=sci_arttext&pid=S1692-715X2012000100002&lang=pt" 
"S1692-715X2012000100003-col","Dilema de la juventud en territorios rurales de Colombia: ¿campo o ciudad?","Jurado, Claudia, Tobasura, Isaías","Revista Latinoamericana de Ciencias Sociales, Niñez y Juventud; 10(1); 63-77","Revista Latinoamericana de Ciencias Sociales, Niñez y Juventud","Espanhol","2012","http://www.scielo.org.co/scielo.php?script=sci_arttext&pid=S1692-715X2012000100003&lang=pt" 
"S1692-715X2012000100008-col","(De)construyendo la esfera pública: Juventud y (la otra) cultura política","González Aguirre, J. Igor Israel","Revista Latinoamericana de Ciencias Sociales, Niñez y Juventud; 10(1); 147-157","Revista Latinoamericana de Ciencias Sociales, Niñez y Juventud","Espanhol","2012","http://www.scielo.org.co/scielo.php?script=sci_arttext&pid=S1692-715X2012000100008&lang=pt" 
"S1692-715X2012000100009-col","El aprendizaje semipresencial o virtual: nueva metodología de aprendizaje en Educación Superior","Hinojo, María Angustias, Fernández, Andrés","Revista Latinoamericana de Ciencias Sociales, Niñez y Juventud; 10(1); 159-167","Revista Latinoamericana de Ciencias Sociales, Niñez y Juventud","Espanhol","2012","http://www.scielo.org.co/scielo.php?script=sci_arttext&pid=S1692-715X2012000100009&lang=pt" 
"S1692-715X2012000100001-col","EDITORIAL","Unda, René, Ospina, Héctor Fabio, da Silva Araújo, Sônia Maria, del Valle, Liliana","Revista Latinoamericana de Ciencias Sociales, Niñez y Juventud; 10(1); 1-2","Revista Latinoamericana de Ciencias Sociales, Niñez y Juventud","Espanhol","2012","http://www.scielo.org.co/scielo.php?script=sci_arttext&pid=S1692-715X2012000100001&lang=pt" 
"S1692-715X2012000100017-col","Coincidencias entre la Argumentación Pragmadialéctica y la Novíssima Retórica","Londoño, David Alberto, Herrera, José Darío","Revista Latinoamericana de Ciencias Sociales, Niñez y Juventud; 10(1); 271-285","Revista Latinoamericana de Ciencias Sociales, Niñez y Juventud","Espanhol","2012","http://www.scielo.org.co/scielo.php?script=sci_arttext&pid=S1692-715X2012000100017&lang=pt" 
"S1692-715X2012000100016-col","Actores gubernamentales de la política cultural cubana entre 1949 y 1961","Guzmán, Jorgelina","Revista Latinoamericana de Ciencias Sociales, Niñez y Juventud; 10(1); 257-270","Revista Latinoamericana de Ciencias Sociales, Niñez y Juventud","Espanhol","2012","http://www.scielo.org.co/scielo.php?script=sci_arttext&pid=S1692-715X2012000100016&lang=pt" 
"S1692-715X2012000100015-col","La subjetividad política y la socialización política, desde las márgenes de la psicología política","Alvarado, Sara Victoria, Ospina-Alvarado, María Camila, García, Claudia María","Revista Latinoamericana de Ciencias Sociales, Niñez y Juventud; 10(1); 235-256","Revista Latinoamericana de Ciencias Sociales, Niñez y Juventud","Espanhol","2012","http://www.scielo.org.co/scielo.php?script=sci_arttext&pid=S1692-715X2012000100015&lang=pt" 
"S1692-715X2012000100014-col","Adaptación y validación del Faces-20-ESP: Re-conociendo el funcionamiento familiar en Chillán, Chile","Zicavo, Nelson, Palma, Claudia, Garrido, Gustavo","Revista Latinoamericana de Ciencias Sociales, Niñez y Juventud; 10(1); 219-234","Revista Latinoamericana de Ciencias Sociales, Niñez y Juventud","Espanhol","2012","http://www.scielo.org.co/scielo.php?script=sci_arttext&pid=S1692-715X2012000100014&lang=pt" 
"S1692-715X2012000100013-col","Calidad de vida y derechos de la infancia: un desafío presente","Mieles, María Dilia, Acosta, Alejandro","Revista Latinoamericana de Ciencias Sociales, Niñez y Juventud; 10(1); 205-217","Revista Latinoamericana de Ciencias Sociales, Niñez y Juventud","Espanhol","2012","http://www.scielo.org.co/scielo.php?script=sci_arttext&pid=S1692-715X2012000100013&lang=pt" 
"S1692-715X2012000100012-col","Vulnerabilidades de crianças que nascem e crescem em periferias metropolitanas: notícias do Brasil","Cezar de Freitas, Marcos, Henrique de Mecena, Elizane","Revista Latinoamericana de Ciencias Sociales, Niñez y Juventud; 10(1); 195-203","Revista Latinoamericana de Ciencias Sociales, Niñez y Juventud","Português","2012","http://www.scielo.org.co/scielo.php?script=sci_arttext&pid=S1692-715X2012000100012&lang=pt" 
"S1692-715X2012000100011-col","Límites estructurales para el desarrollo de la infancia en contexto de crisis","Tuñón, Ianina, Salvia, Agustín","Revista Latinoamericana de Ciencias Sociales, Niñez y Juventud; 10(1); 179-194","Revista Latinoamericana de Ciencias Sociales, Niñez y Juventud","Espanhol","2012","http://www.scielo.org.co/scielo.php?script=sci_arttext&pid=S1692-715X2012000100011&lang=pt" 
"S1692-715X2012000100010-col","La crianza como objeto de estudio actual desde el modelo transaccional","Martínez, Marta, García, María Cristina","Revista Latinoamericana de Ciencias Sociales, Niñez y Juventud; 10(1); 169-178","Revista Latinoamericana de Ciencias Sociales, Niñez y Juventud","Espanhol","2012","http://www.scielo.org.co/scielo.php?script=sci_arttext&pid=S1692-715X2012000100010&lang=pt" 
"S1692-715X2012000100019-col","De profesores, familias y estudiantes: fortalecimiento de la resiliencia en la escuela","Acevedo, Victoria Eugenia, Restrepo, Lucía","Revista Latinoamericana de Ciencias Sociales, Niñez y Juventud; 10(1); 301-319","Revista Latinoamericana de Ciencias Sociales, Niñez y Juventud","Espanhol","2012","http://www.scielo.org.co/scielo.php?script=sci_arttext&pid=S1692-715X2012000100019&lang=pt" 
"S1692-715X2012000100018-col","Os sentidos da escola pública para jovens pobres da cidade do Recife","Maria dos Santos, Rubenize, Nascimento, Maria Aparecida, de Araújo Menezes, Jaileila","Revista Latinoamericana de Ciencias Sociales, Niñez y Juventud; 10(1); 289-300","Revista Latinoamericana de Ciencias Sociales, Niñez y Juventud","Português","2012","http://www.scielo.org.co/scielo.php?script=sci_arttext&pid=S1692-715X2012000100018&lang=pt" 
"S1692-715X2012000100040-col","Interacciones sociales y explotación económica","Montaña, Andrés","Revista Latinoamericana de Ciencias Sociales, Niñez y Juventud; 10(1); 625-638","Revista Latinoamericana de Ciencias Sociales, Niñez y Juventud","Espanhol","2012","http://www.scielo.org.co/scielo.php?script=sci_arttext&pid=S1692-715X2012000100040&lang=pt" 
"S1692-715X2012000100028-col","Inteligencia y Conductas Delictuales en Adolescentes Chilenos","Cova, Félix, Pérez-Salas, Claudia P., Parada, Benjamín Vicente, Saldivia, Sandra, Rioseco, Pedro, Soto, Osvaldo","Revista Latinoamericana de Ciencias Sociales, Niñez y Juventud; 10(1); 441-452","Revista Latinoamericana de Ciencias Sociales, Niñez y Juventud","Espanhol","2012","http://www.scielo.org.co/scielo.php?script=sci_arttext&pid=S1692-715X2012000100028&lang=pt" 
"S1692-715X2012000100029-col","La experiencia vinculante afectiva del sujeto adolescente infractor","Sánchez, Paula Vanessa","Revista Latinoamericana de Ciencias Sociales, Niñez y Juventud; 10(1); 453-465","Revista Latinoamericana de Ciencias Sociales, Niñez y Juventud","Espanhol","2012","http://www.scielo.org.co/scielo.php?script=sci_arttext&pid=S1692-715X2012000100029&lang=pt" 
"S1692-715X2012000100026-col","Línea de base del programa &quot;Prevención de la violencia, inclusión social y empleabilidad en jóvenes&quot;","Gallom, Nancy Eliana, Molina, Astrid Natalia","Revista Latinoamericana de Ciencias Sociales, Niñez y Juventud; 10(1); 415-426","Revista Latinoamericana de Ciencias Sociales, Niñez y Juventud","Espanhol","2012","http://www.scielo.org.co/scielo.php?script=sci_arttext&pid=S1692-715X2012000100026&lang=pt" 
"S1692-715X2012000100027-col","El desempleo juvenil: problema de efectos perpetuos","De La Hoz, Fabio José, Quejada, Raúl, Yánez, Martha","Revista Latinoamericana de Ciencias Sociales, Niñez y Juventud; 10(1); 427-439","Revista Latinoamericana de Ciencias Sociales, Niñez y Juventud","Espanhol","2012","http://www.scielo.org.co/scielo.php?script=sci_arttext&pid=S1692-715X2012000100027&lang=pt" 
"S1692-715X2012000100024-col","Obstáculos cognitivo-emotivos para la realización de actividad física en estudiantes universitarios","González, Aída María, Tamayo, Oscar Eugenio","Revista Latinoamericana de Ciencias Sociales, Niñez y Juventud; 10(1); 379-396","Revista Latinoamericana de Ciencias Sociales, Niñez y Juventud","Espanhol","2012","http://www.scielo.org.co/scielo.php?script=sci_arttext&pid=S1692-715X2012000100024&lang=pt" 
"S1692-715X2012000100025-col","Equidad en la educación superior: una propuesta de financiación para Colombia","Gutiérrez, Consuelo","Revista Latinoamericana de Ciencias Sociales, Niñez y Juventud; 10(1); 397-413","Revista Latinoamericana de Ciencias Sociales, Niñez y Juventud","Espanhol","2012","http://www.scielo.org.co/scielo.php?script=sci_arttext&pid=S1692-715X2012000100025&lang=pt" 
"S1692-715X2012000100022-col","Saberes da ayahuasca e processos educativos na religião do Santo Daime","Albuquerque, Maria Betânia B.","Revista Latinoamericana de Ciencias Sociales, Niñez y Juventud; 10(1); 351-365","Revista Latinoamericana de Ciencias Sociales, Niñez y Juventud","Português","2012","http://www.scielo.org.co/scielo.php?script=sci_arttext&pid=S1692-715X2012000100022&lang=pt" 
"S1692-715X2012000100023-col","Autorregulación y rendimiento académico en la transición secundaria-universidad","Elvira-Valdés, María Antonieta, Pujol, Lydia","Revista Latinoamericana de Ciencias Sociales, Niñez y Juventud; 10(1); 367-378","Revista Latinoamericana de Ciencias Sociales, Niñez y Juventud","Espanhol","2012","http://www.scielo.org.co/scielo.php?script=sci_arttext&pid=S1692-715X2012000100023&lang=pt" 
"S1692-715X2012000100020-col","","Asún, Rodrigo, Ruiz, Soledad, Aceituno, Roberto, Venegas, Juan Ignacio, Reinoso, Alejandro","Revista Latinoamericana de Ciencias Sociales, Niñez y Juventud; 10(1); 321-338","Revista Latinoamericana de Ciencias Sociales, Niñez y Juventud","Espanhol","2012","http://www.scielo.org.co/scielo.php?script=sci_arttext&pid=S1692-715X2012000100020&lang=pt" 
"S1692-715X2012000100021-col","Autoestima profesional: competencia mediadora en el marco de la evaluación docente","Wilhelm, Karin, Martin, Gabriela, Miranda, Christian","Revista Latinoamericana de Ciencias Sociales, Niñez y Juventud; 10(1); 339-350","Revista Latinoamericana de Ciencias Sociales, Niñez y Juventud","Espanhol","2012","http://www.scielo.org.co/scielo.php?script=sci_arttext&pid=S1692-715X2012000100021&lang=pt" 
"S0872-19042012000100004-prt","Conductometric Studies on Terbium Soaps","Kishore, Kamal, Upadhyaya, S.K.","Portugaliae Electrochimica Acta; 30(1); 45-51","Portugaliae Electrochimica Acta","Inglês","2012","http://www.scielo.mec.pt/scielo.php?script=sci_arttext&pid=S0872-19042012000100004&lang=pt" 
"S0872-19042012000100001-prt","Effect of Surfactants on the Electrodeposition of Ni-SiC Composites","Narasimman, P., Pushpavanama, Malathy, Periasamyb, V.M.","Portugaliae Electrochimica Acta; 30(1); 1-14","Portugaliae Electrochimica Acta","Inglês","2012","http://www.scielo.mec.pt/scielo.php?script=sci_arttext&pid=S0872-19042012000100001&lang=pt" 
"S0872-19042012000100002-prt","Potentiometric Determination of Amlodipine Besilate and Valsartan Using Microsized and Polymeric Matrix Membrane Sensors","Ramadan, Nesrin K., Mohamed, Heba M., Mostafa, Azza A.","Portugaliae Electrochimica Acta; 30(1); 15-29","Portugaliae Electrochimica Acta","Inglês","2012","http://www.scielo.mec.pt/scielo.php?script=sci_arttext&pid=S0872-19042012000100002&lang=pt" 
"S0872-19042012000100003-prt","Potentiometric Membrane Sensors for Determination of Memantine Hydrochloride and Pramipexole Dihydrochloride Monohydrate","Merey, Hanan A., Helmy, Marwa I., Tawakkol, Shereen M., Toubar, Safaa S., Risk, Mohamed S.","Portugaliae Electrochimica Acta; 30(1); 31-43","Portugaliae Electrochimica Acta","Inglês","2012","http://www.scielo.mec.pt/scielo.php?script=sci_arttext&pid=S0872-19042012000100003&lang=pt" 
"S0872-19042012000100005-prt","Inhibition of Mild Steel Corrosion by some Phenyltetrazole Substituted Compounds in Hydrochloric Acid","Elkacimi, Y., Achnin, M., Aouine, Y., Touhami, M. Ebn, Alami, A., Touir, R., Sfaira, M., Chebabe, D., Elachqar, A., Hammouti, B.","Portugaliae Electrochimica Acta; 30(1); 53-65","Portugaliae Electrochimica Acta","Inglês","2012","http://www.scielo.mec.pt/scielo.php?script=sci_arttext&pid=S0872-19042012000100005&lang=pt" 
"S0872-19042012000100006-prt","Poly(p-Phenylenediamine) as an Inhibitor for Mild Steel in Hydrochloric Acid Medium","Rehim, S.S. Abd El, Sayyahand, S.M., Azooz, R.E.","Portugaliae Electrochimica Acta; 30(1); 67-80","Portugaliae Electrochimica Acta","Inglês","2012","http://www.scielo.mec.pt/scielo.php?script=sci_arttext&pid=S0872-19042012000100006&lang=pt" 
"S1900-38032012000100009-col","Propuesta de comunicación y educación ambiental a través del Facebook y el uso de narrativas digitales","Badillo Mendoza, Miguel Ezequiel","Entramado; 8(1); 128-139","Entramado","Espanhol","2012","http://www.scielo.org.co/scielo.php?script=sci_arttext&pid=S1900-38032012000100009&lang=pt" 
"S1900-38032012000100008-col","Aportes jurisprudenciales y doctrinales sobre la prescripción adquisitiva del dominio y el justo título en el derecho colombiano","Serrano Gómez, Rocío, Acevedo Prada, Milena","Entramado; 8(1); 100-125","Entramado","Espanhol","2012","http://www.scielo.org.co/scielo.php?script=sci_arttext&pid=S1900-38032012000100008&lang=pt" 
"S1900-38032012000100001-col","Fortalecer los grupos de investigación","Ríos Alvarado, Arnaldo","Entramado; 8(1); 8-10","Entramado","Espanhol","2012","http://www.scielo.org.co/scielo.php?script=sci_arttext&pid=S1900-38032012000100001&lang=pt" 
"S1900-38032012000100003-col","Estudio sobre el desempeño de las empresas familiares colombianas que cotizan en la bolsa de valores, frente a las empresas no familiares","Gómez-Betancourt, Gonzalo, López Vergara, María Piedad, Betancourt Ramírez, José Bernardo, Millán Payán, Javier Olmedo","Entramado; 8(1); 28-42","Entramado","Espanhol","2012","http://www.scielo.org.co/scielo.php?script=sci_arttext&pid=S1900-38032012000100003&lang=pt" 
"S1900-38032012000100002-col","Análisis de los indicadores financieros en las sociedades portuarias de Colombia","Morelos Gómez, José, Fontalvo Herrera, Tomás José, de la Hoz Granadillo, Efraín","Entramado; 8(1); 14-26","Entramado","Espanhol","2012","http://www.scielo.org.co/scielo.php?script=sci_arttext&pid=S1900-38032012000100002&lang=pt" 
"S1900-38032012000100005-col","Fue eficiente la asignación de recursos en el suministro de agua potable en el departamento de Bolívar - Colombia en el periodo 2007-2008","Maza Ávila, Francisco Javier, Navarro España, Jorge Luis, Puello Payares, Joaquín Guillermo","Entramado; 8(1); 58-70","Entramado","Espanhol","2012","http://www.scielo.org.co/scielo.php?script=sci_arttext&pid=S1900-38032012000100005&lang=pt" 
"S1900-38032012000100004-col","Perfil emprendedor de los pequeños empresarios agropecuarios en El Valle de Puebla, México","Jaramillo Villanueva, José Luis, Escobedo Garrido, José Sergio, Morales Jiménez, Juan, Ramos Castro, José Guadalupe","Entramado; 8(1); 44-57","Entramado","Espanhol","2012","http://www.scielo.org.co/scielo.php?script=sci_arttext&pid=S1900-38032012000100004&lang=pt" 
"S1900-38032012000100007-col","Medición del riesgo de liquidez. Una aplicación en el sector cooperativo","Sánchez Mayorga, Ximena, Millán Solarte, Julio César","Entramado; 8(1); 90-98","Entramado","Espanhol","2012","http://www.scielo.org.co/scielo.php?script=sci_arttext&pid=S1900-38032012000100007&lang=pt" 
"S1900-38032012000100006-col","Políticas públicas para la mujer en Colombia: La doble condición de madre y trabajadora en la legislación del siglo XX","Pérez, Alejandro, Domínguez, Soto, Cortés Gallego, Mónica María","Entramado; 8(1); 72-88","Entramado","Espanhol","2012","http://www.scielo.org.co/scielo.php?script=sci_arttext&pid=S1900-38032012000100006&lang=pt" 
"S1900-38032012000100012-col","El cuidado de cara a la ética, la política y la pedagogía vivencial para la vida","Gil Claros, María Fernanda","Entramado; 8(1); 178-187","Entramado","Espanhol","2012","http://www.scielo.org.co/scielo.php?script=sci_arttext&pid=S1900-38032012000100012&lang=pt" 
"S1900-38032012000100013-col","Modelado e implementación de un sistema multiagente para el diagnóstico de enfermedades de transmisión sexual","Callejas Cuervo, Mauro, Milena Parada Prieto, Liliana, Alarcón Aldana, Andrea Catherine","Entramado; 8(1); 190-208","Entramado","Espanhol","2012","http://www.scielo.org.co/scielo.php?script=sci_arttext&pid=S1900-38032012000100013&lang=pt" 
"S1900-38032012000100010-col","Ciencias del Deporte: Evolución de aspectos teórico científicos","Vargas Olarte, Carlos Eduardo","Entramado; 8(1); 140-165","Entramado","Espanhol","2012","http://www.scielo.org.co/scielo.php?script=sci_arttext&pid=S1900-38032012000100010&lang=pt" 
"S1900-38032012000100011-col","Bioemprendimiento: reconfiguración productiva de los agroecosistemas en el corregimiento La Elvira, Santiago de Cali","Banguero Camacho, Clara Viviana, Giraldo Díaz, Reinaldo","Entramado; 8(1); 168-175","Entramado","Espanhol","2012","http://www.scielo.org.co/scielo.php?script=sci_arttext&pid=S1900-38032012000100011&lang=pt" 
"S0120-99652012000100012-col","Modelling change in color and firmness of baby banana (Musa acuminata AA) in modified atmosphere packaging","Castellanos, Diego A, Algecira, Nestor A","Agronomía Colombiana; 30(1); 84-94","Agronomía Colombiana","Inglês","2012","http://www.scielo.org.co/scielo.php?script=sci_arttext&pid=S0120-99652012000100012&lang=pt" 
